管理番号,大きい項目,中間項目,表示名,バンドルパス,ファイル名
0,29,58,おちんぽ、最後まで味わっていたいですね,sound/data/pcm/c29/h/01.unity3d,h_so3p_29_03_000
1,29,58,早く始めてください……（焦れている）,sound/data/pcm/c29/h/01.unity3d,h_so3p_29_03_001
2,29,58,奥まで、ずぷってきました……,sound/data/pcm/c29/h/01.unity3d,h_so3p_29_03_004
3,29,58,おちんぽ、いいです……っ,sound/data/pcm/c29/h/01.unity3d,h_so3p_29_03_005
4,29,58,おちんぽの快感は、やはり特別です,sound/data/pcm/c29/h/01.unity3d,h_so3p_29_03_008
5,29,58,あなたもおちんぽ、味わいたいですか？,sound/data/pcm/c29/h/01.unity3d,h_so3p_29_03_009
6,29,58,見てください、おまんこからこんなにお汁が溢れてますよ……！,sound/data/pcm/c29/h/01.unity3d,h_so3p_29_03_010
7,29,58,おちんぽ、すごくいいです……っ！,sound/data/pcm/c29/h/01.unity3d,h_so3p_29_03_011
8,29,58,おまんこ、どうですか？　もうぐしょぐしょですか？,sound/data/pcm/c29/h/01.unity3d,h_so3p_29_03_016
9,29,58,このまま一緒に昂ぶっていきましょう,sound/data/pcm/c29/h/01.unity3d,h_so3p_29_03_017
10,29,58,二人がイクところ、しっかり目に焼き付けてくださいね……！,sound/data/pcm/c29/h/01.unity3d,h_so3p_29_03_022
11,29,58,私たち、一緒にイッてしまいますぅぅ……！！,sound/data/pcm/c29/h/01.unity3d,h_so3p_29_03_023
12,29,58,欲望のままに、イッてしまいましょうっ！,sound/data/pcm/c29/h/01.unity3d,h_so3p_29_03_024
13,29,58,二人のおまんこを感じながら、あなたもイッてくださいっ！！,sound/data/pcm/c29/h/01.unity3d,h_so3p_29_03_025
14,29,58,癖になってしまいそうな気持ちよさです……,sound/data/pcm/c29/h/01.unity3d,h_so3p_29_03_030
15,29,58,快感が増幅されすぎて、おかしくなってしまいそうです……,sound/data/pcm/c29/h/01.unity3d,h_so3p_29_03_031
16,29,58,まだおちんぽを味わっていたいのですが……,sound/data/pcm/c29/h/01.unity3d,h_so3p_29_03_036
17,29,58,このままもう一度してみませんか？,sound/data/pcm/c29/h/01.unity3d,h_so3p_29_03_037
