管理番号,大きい項目,中間項目,表示名,バンドルパス,ファイル名
0,32,57,いっぱいしゃぶってあげますね……できれば一人でお相手したいところですが,sound/data/pcm/c32/h/01.unity3d,h_hh3p_32_03_000
1,32,57,私一人でも、最高の奉仕を見せてあげられるんですがね,sound/data/pcm/c32/h/01.unity3d,h_hh3p_32_03_001
2,32,57,根本までむしゃぶり付きたい気分です……まあ我慢しますけど,sound/data/pcm/c32/h/01.unity3d,h_hh3p_32_03_004
3,32,57,二人で奉仕……ああ、このもどかしさが楽しいですね,sound/data/pcm/c32/h/01.unity3d,h_hh3p_32_03_005
4,32,57,一人の方が舐めやすいでしね……あ、いえ、独り言です,sound/data/pcm/c32/h/01.unity3d,h_hh3p_32_03_006
5,32,57,一人よりも二人の方がいいですか？　いえ、答えなくていいです……おちんぽが反応してます,sound/data/pcm/c32/h/01.unity3d,h_hh3p_32_03_007
6,32,57,根本までむしゃぶり付きたい気分です……まあ我慢しますけど,sound/data/pcm/c32/h/01.unity3d,h_hh3p_32_03_012
7,32,57,二人で奉仕……ああ、このもどかしさが楽しいですね,sound/data/pcm/c32/h/01.unity3d,h_hh3p_32_03_013
8,32,57,一人よりも二人の方がいいですか？　いえ、答えなくていいです……おちんぽが反応してます,sound/data/pcm/c32/h/01.unity3d,h_hh3p_32_03_015
9,32,57,ドピュドピュが楽しみです……さあ、出して下さい,sound/data/pcm/c32/h/01.unity3d,h_hh3p_32_03_016
10,32,57,さあ、どう射精するつもりですか？　楽しみにしていますよ,sound/data/pcm/c32/h/01.unity3d,h_hh3p_32_03_017
11,32,57,はぁ……横で見られてるのに、顔を汚されるなんて……最高に最悪です,sound/data/pcm/c32/h/01.unity3d,h_hh3p_32_03_020
12,32,57,いいですよ……窒息するほど顔を精液で覆って下さいね,sound/data/pcm/c32/h/01.unity3d,h_hh3p_32_03_021
13,32,57,精液の味と匂い、興奮します……いいですよ、いっぱい下さい,sound/data/pcm/c32/h/01.unity3d,h_hh3p_32_03_022
14,32,57,口から種付けですか？　もう、仕方ありませんね……どうぞ,sound/data/pcm/c32/h/01.unity3d,h_hh3p_32_03_023
15,32,57,顔いっぱいの精液……ああ、幸せ……オマンコが濡れちゃいました,sound/data/pcm/c32/h/01.unity3d,h_hh3p_32_03_032
