管理番号,大きい項目,中間項目,表示名,バンドルパス,ファイル名
0,14,44,今日はどんなこと、してくれるんだ？,sound/data/pcm/c14/h/01.unity3d,h_so_14_02_000
1,14,44,おちんぽ……たくましいなっ……楽しみだっ,sound/data/pcm/c14/h/01.unity3d,h_so_14_02_001
2,14,44,エッチ、楽しみにしてくれてたんだっ……私もだよっ,sound/data/pcm/c14/h/01.unity3d,h_so_14_02_002
3,14,44,いいよっ、気持ちよくなろっ,sound/data/pcm/c14/h/01.unity3d,h_so_14_02_003
4,14,44,いっぱい、私好きにしていいからなっ,sound/data/pcm/c14/h/01.unity3d,h_so_14_02_004
5,14,44,うんっ！　ちょっと、身構えちゃうかもっ,sound/data/pcm/c14/h/01.unity3d,h_so_14_02_005
6,14,44,ゴムはつけなきゃ、ダメだよっ,sound/data/pcm/c14/h/01.unity3d,h_so_14_02_006
7,14,44,ゴム付けなきゃ、やらせてあげないぞっ？,sound/data/pcm/c14/h/01.unity3d,h_so_14_02_007
8,14,44,今日はダメな日なんだ。次のときは、考えないでもないから、さっ？,sound/data/pcm/c14/h/01.unity3d,h_so_14_02_008
9,14,44,お前、わざとつけてないだろ？　だめだぞっ,sound/data/pcm/c14/h/01.unity3d,h_so_14_02_009
10,14,44,ほんと、お前物好きだよなっ……いいけどさっ,sound/data/pcm/c14/h/01.unity3d,h_so_14_02_010
11,14,44,お尻がいいなんて、変態だなっ……いいよっ,sound/data/pcm/c14/h/01.unity3d,h_so_14_02_011
12,14,44,あのさっ……今日はちょっと、ごめんな？,sound/data/pcm/c14/h/01.unity3d,h_so_14_02_012
13,14,44,今日は、おまんこのほうがいいかなって……ダメ、かな？,sound/data/pcm/c14/h/01.unity3d,h_so_14_02_013
14,14,44,あぁ……おちんぽ、はいってくるぅ……,sound/data/pcm/c14/h/01.unity3d,h_so_14_02_014
15,14,44,あっ！　おちんぽがっ、急にくるのっ……,sound/data/pcm/c14/h/01.unity3d,h_so_14_02_015
16,14,44,お尻ぃ、入ってくぅ……,sound/data/pcm/c14/h/01.unity3d,h_so_14_02_016
17,14,44,はあっ！　いきなり、お尻にぃ！,sound/data/pcm/c14/h/01.unity3d,h_so_14_02_017
18,14,44,あぁっ……このひとつになるときぃ、すごく幸せぇ,sound/data/pcm/c14/h/01.unity3d,h_so_14_02_018
19,14,44,おちんぽでいっぱいになってくぅ……,sound/data/pcm/c14/h/01.unity3d,h_so_14_02_019
20,14,44,ああっ……きてぇ……,sound/data/pcm/c14/h/01.unity3d,h_so_14_02_020
21,14,44,もうっ、入っちゃってるぅ……,sound/data/pcm/c14/h/01.unity3d,h_so_14_02_021
22,14,44,入ってきたぁ……ここから、どうするのっ,sound/data/pcm/c14/h/01.unity3d,h_so_14_02_022
23,14,44,はぁん……お尻、すんなり入るようになってるよぉ……,sound/data/pcm/c14/h/01.unity3d,h_so_14_02_023
24,14,44,お尻、おちんぽ受け入れるようにされちゃってるぅ……,sound/data/pcm/c14/h/01.unity3d,h_so_14_02_024
25,14,44,ふぁぁ……お尻には、急に来るのさすがにびっくりしちゃうよぉ,sound/data/pcm/c14/h/01.unity3d,h_so_14_02_025
26,14,44,まだ、お尻急に来られるのは、抵抗でちゃうなっ,sound/data/pcm/c14/h/01.unity3d,h_so_14_02_026
27,14,44,おあずけ食らってるみたいで、すごく切なくなっちゃう……,sound/data/pcm/c14/h/01.unity3d,h_so_14_02_027
28,14,44,おちんぽのかたち、教え込まれてるみたいっ……,sound/data/pcm/c14/h/01.unity3d,h_so_14_02_028
29,14,44,あっ……この時、私はお前の女だって、教えられてるみたいっ,sound/data/pcm/c14/h/01.unity3d,h_so_14_02_029
30,14,44,はぁぁ……お尻のお口が、いつも開いちゃいそうっ……,sound/data/pcm/c14/h/01.unity3d,h_so_14_02_030
31,14,44,お尻におちんぽ入ってるのっ、違和感なくなってきちゃってるなっ,sound/data/pcm/c14/h/01.unity3d,h_so_14_02_031
32,14,44,お尻におちんぽ入れられて、じっとしてるの、おかしいなっ,sound/data/pcm/c14/h/01.unity3d,h_so_14_02_032
33,14,44,んあぁぁ……抜かれる感覚、入れられてるのとはまた違う気持ちよさあるな……,sound/data/pcm/c14/h/01.unity3d,h_so_14_02_033
34,14,44,んはぁ……あれ、どうした？,sound/data/pcm/c14/h/01.unity3d,h_so_14_02_034
35,14,44,んんっ……どうした？　もっと動いて？,sound/data/pcm/c14/h/01.unity3d,h_so_14_02_035
36,14,44,あぁ……私のお尻、お前のものになってる感じっ……,sound/data/pcm/c14/h/01.unity3d,h_so_14_02_036
37,14,44,んくはぁ……お尻出入りするのっ、変になっちゃう……,sound/data/pcm/c14/h/01.unity3d,h_so_14_02_037
38,14,44,お尻でぇ……遊んでないか？,sound/data/pcm/c14/h/01.unity3d,h_so_14_02_038
39,14,44,ゆっくりされるの、たまらないのぉ……,sound/data/pcm/c14/h/01.unity3d,h_so_14_02_039
40,14,44,おちんぽに、教育されちゃってるぅ……,sound/data/pcm/c14/h/01.unity3d,h_so_14_02_040
41,14,44,やぁん……焦らされてるみたいぃ……,sound/data/pcm/c14/h/01.unity3d,h_so_14_02_041
42,14,44,ぁあっあ……はやいやつぅ、いいっ……,sound/data/pcm/c14/h/01.unity3d,h_so_14_02_042
43,14,44,ああん、もっと早くしてぇ……きもちよくしてぇ……,sound/data/pcm/c14/h/01.unity3d,h_so_14_02_043
44,14,44,いいっ……感じの来てるっ……うまいよぉ,sound/data/pcm/c14/h/01.unity3d,h_so_14_02_044
45,14,44,んっ、はあっ……お尻ゆっくり、癖になるぅ,sound/data/pcm/c14/h/01.unity3d,h_so_14_02_045
46,14,44,んくぅ……お尻、気持ちよくなっちゃってるぅ……,sound/data/pcm/c14/h/01.unity3d,h_so_14_02_046
47,14,44,はぁっ……前まで、きつかったけどぉ、慣らされちゃってるぅ……,sound/data/pcm/c14/h/01.unity3d,h_so_14_02_047
48,14,44,はっううん！　お尻、いっぱい動いてるのぉ……,sound/data/pcm/c14/h/01.unity3d,h_so_14_02_048
49,14,44,お尻ぃ、擦れてるのがいいのぉっ……,sound/data/pcm/c14/h/01.unity3d,h_so_14_02_049
50,14,44,くふぅん！　やあ……もっとぉ……,sound/data/pcm/c14/h/01.unity3d,h_so_14_02_050
51,14,44,やあんっ、一緒に触られるの、気持ちいいよぉっ,sound/data/pcm/c14/h/01.unity3d,h_so_14_02_051
52,14,44,そこ、、好きなとこなのぉ……,sound/data/pcm/c14/h/01.unity3d,h_so_14_02_052
53,14,44,やっ、ああん！　そんなにいじめられたら、声おっきくなっちゃうっ！,sound/data/pcm/c14/h/01.unity3d,h_so_14_02_053
54,14,44,ひゃあん！　そこっ、すっごい好きっ！　もっと、もっとぉ,sound/data/pcm/c14/h/01.unity3d,h_so_14_02_054
55,14,44,あぁっ、そこは、やぁだっ……,sound/data/pcm/c14/h/01.unity3d,h_so_14_02_055
56,14,44,ひゃ、そこはやめてっ,sound/data/pcm/c14/h/01.unity3d,h_so_14_02_056
57,14,44,そこ、違うっ！　違うからぁ！,sound/data/pcm/c14/h/01.unity3d,h_so_14_02_057
58,14,44,やっ！　違うとこがいいっ！　違うのにしてっ,sound/data/pcm/c14/h/01.unity3d,h_so_14_02_058
59,14,44,ああぁん……ゆっくりピストン、きたぁ……,sound/data/pcm/c14/h/01.unity3d,h_so_14_02_059
60,14,44,っやあぁ……おまんこ、いっぱいになるのっ,sound/data/pcm/c14/h/01.unity3d,h_so_14_02_060
61,14,44,んあぁ……もっと激しくても、いいぞっ……,sound/data/pcm/c14/h/01.unity3d,h_so_14_02_061
62,14,44,んんっ！　ううぅあっ、もっと突いてぇ！,sound/data/pcm/c14/h/01.unity3d,h_so_14_02_062
63,14,44,ううぅんんっ！　おちんぽ、中で動き回っちゃってるのっ！,sound/data/pcm/c14/h/01.unity3d,h_so_14_02_063
64,14,44,あんんっ！　お前のがっ、力強くって……はぁっ！,sound/data/pcm/c14/h/01.unity3d,h_so_14_02_064
65,14,44,うっ……くふぅ……お尻、教え込まれてるっ……,sound/data/pcm/c14/h/01.unity3d,h_so_14_02_065
66,14,44,お尻ぃ、すごい変っ。おまんことはまた違うのぉ,sound/data/pcm/c14/h/01.unity3d,h_so_14_02_066
67,14,44,うっはあっ、おちんぽに、調教されちゃってるのっ……,sound/data/pcm/c14/h/01.unity3d,h_so_14_02_067
68,14,44,お尻に、おちんぽいっぱいっ……,sound/data/pcm/c14/h/01.unity3d,h_so_14_02_068
69,14,44,ううっはあっ、お尻でぇ、気持ちよくなっちゃってるぅ！？,sound/data/pcm/c14/h/01.unity3d,h_so_14_02_069
70,14,44,お尻ぃ……いいように、動いてっ,sound/data/pcm/c14/h/01.unity3d,h_so_14_02_070
71,14,44,んはぁ！　そこ、いっぱい触ってっ！　そこぉ！,sound/data/pcm/c14/h/01.unity3d,h_so_14_02_071
72,14,44,はぁん！　一緒に触られるの、感じるのっ,sound/data/pcm/c14/h/01.unity3d,h_so_14_02_072
73,14,44,んんっ！　そんなに激しく触ってっ……はああぁん！,sound/data/pcm/c14/h/01.unity3d,h_so_14_02_073
74,14,44,ふわっっあんんっ！　いっぱいしてぇ！,sound/data/pcm/c14/h/01.unity3d,h_so_14_02_074
75,14,44,っぐうっ……ごめん、そこ、苦手なんだっ,sound/data/pcm/c14/h/01.unity3d,h_so_14_02_075
76,14,44,んっ、そこは、や……だなっ,sound/data/pcm/c14/h/01.unity3d,h_so_14_02_076
77,14,44,やぁっ！　……ごめんな？　そこはやめてっ？,sound/data/pcm/c14/h/01.unity3d,h_so_14_02_077
78,14,44,あぐぅっ！　他のとこ、触ってほしいなっ,sound/data/pcm/c14/h/01.unity3d,h_so_14_02_078
79,14,44,んちゅ……っぱ、いいのっ。キス、安心するっ,sound/data/pcm/c14/h/01.unity3d,h_so_14_02_079
80,14,44,……はむっ、エッチしながらキスするの、いいっ……,sound/data/pcm/c14/h/01.unity3d,h_so_14_02_080
81,14,44,んちゅうっ、んっ、っはあ……もっとキス、したぁい……,sound/data/pcm/c14/h/01.unity3d,h_so_14_02_081
82,14,44,ちゅうっ、れろっ、んっ、んっ……もっと、きてぇ……,sound/data/pcm/c14/h/01.unity3d,h_so_14_02_082
83,14,44,んっぷ、はぁ！　んんん！　ゆっくりだけどっ……！頭で響くのっ……,sound/data/pcm/c14/h/01.unity3d,h_so_14_02_083
84,14,44,ちゅぅうっ、んんっ、はふ！　いっぱい愛してっ、好きぃ,sound/data/pcm/c14/h/01.unity3d,h_so_14_02_084
85,14,44,んちゅうっ、れるっ、んっ　ふわふわしてるのっ！　わけわかんないっ！,sound/data/pcm/c14/h/01.unity3d,h_so_14_02_085
86,14,44,んちゅううう、っはあっ！　強く突いてぇ！　私、いっぱい来てほしいのっ！,sound/data/pcm/c14/h/01.unity3d,h_so_14_02_086
87,14,44,ふわふわしてるっ……私のからだじゃない、みたいなのっ,sound/data/pcm/c14/h/01.unity3d,h_so_14_02_087
88,14,44,お前の優しさでっ……頭、幸せだらけになってるぅ……,sound/data/pcm/c14/h/01.unity3d,h_so_14_02_088
89,14,44,あっあぁっ、そろそろ来そうっ……,sound/data/pcm/c14/h/01.unity3d,h_so_14_02_089
90,14,44,いっぱいっ、いっぱいになってきてるよぉ,sound/data/pcm/c14/h/01.unity3d,h_so_14_02_090
91,14,44,はぁん、あぁ……イキたそうな顔になってるっ,sound/data/pcm/c14/h/01.unity3d,h_so_14_02_091
92,14,44,はぁん……イキたいなら、いつでもきていいぞっ,sound/data/pcm/c14/h/01.unity3d,h_so_14_02_092
93,14,44,あぁん、イキたいの……？　いつでもいいぞ？,sound/data/pcm/c14/h/01.unity3d,h_so_14_02_093
94,14,44,おちんぽ、我慢できないって感じ、してるっ……,sound/data/pcm/c14/h/01.unity3d,h_so_14_02_094
95,14,44,お尻でっ……感じてきちゃったぁっ……,sound/data/pcm/c14/h/01.unity3d,h_so_14_02_095
96,14,44,ああっ……お尻で気持ちよくなっちゃうぅ……,sound/data/pcm/c14/h/01.unity3d,h_so_14_02_096
97,14,44,おちんぽでぇ……お尻くちょぐちょされてるううぅ,sound/data/pcm/c14/h/01.unity3d,h_so_14_02_097
98,14,44,はあぁん……お尻もっと強くしてぇ……気持ちいいのっ……いいのっ,sound/data/pcm/c14/h/01.unity3d,h_so_14_02_098
99,14,44,おちんぽ、おっきくなってるの、お尻からつたわってくるのっ,sound/data/pcm/c14/h/01.unity3d,h_so_14_02_099
100,14,44,お尻、響いちゃってる……おちんぽ、暴れたがってるっ……,sound/data/pcm/c14/h/01.unity3d,h_so_14_02_100
101,14,44,んんっ、はあぁっ、来てるっ、出したくってうずうずしてるぅ,sound/data/pcm/c14/h/01.unity3d,h_so_14_02_101
102,14,44,はぁっうぅん！　いいよ、お前のいいように動いてっ,sound/data/pcm/c14/h/01.unity3d,h_so_14_02_102
103,14,44,あっ、先イキそっ、私っ、先イッちゃうねっ、イクからぁ！,sound/data/pcm/c14/h/01.unity3d,h_so_14_02_103
104,14,44,ああっ、いっちゃうっ！　もっと激しくっ、してぇえええ！,sound/data/pcm/c14/h/01.unity3d,h_so_14_02_104
105,14,44,あっ、はあっ！　……私もっ、イキそう……一緒にぃ,sound/data/pcm/c14/h/01.unity3d,h_so_14_02_105
106,14,44,はあっ、来てるのっ！　一緒に……っイこっ！,sound/data/pcm/c14/h/01.unity3d,h_so_14_02_106
107,14,44,あっあぁっ、いいよっ、熱いのっ、いっぱいきてええ,sound/data/pcm/c14/h/01.unity3d,h_so_14_02_107
108,14,44,あぅぅあん！　私の中、満たしてぇ！,sound/data/pcm/c14/h/01.unity3d,h_so_14_02_108
109,14,44,う、うんっ、あんんっ！　んんっ！,sound/data/pcm/c14/h/01.unity3d,h_so_14_02_109
110,14,44,いいよっ！　出してほしいのっ！,sound/data/pcm/c14/h/01.unity3d,h_so_14_02_110
111,14,44,ふぁあっっ！　おちんぽっ、暴れだしたのっ！　いいよ来てっ！,sound/data/pcm/c14/h/01.unity3d,h_so_14_02_111
112,14,44,ふぁぁ！　ああぁっ！　出るんだなっ？　いっぱい、頼むっ！,sound/data/pcm/c14/h/01.unity3d,h_so_14_02_112
113,14,44,ゴムあるからっ、いっぱいドピュドピュしてぇええんああっぁっ,sound/data/pcm/c14/h/01.unity3d,h_so_14_02_113
114,14,44,ゴム越しにあっついのちょうだいっ！　ちょうだいいいぃぃ！,sound/data/pcm/c14/h/01.unity3d,h_so_14_02_114
115,14,44,あっ、あっあっあっ、これイッちゃうっ、お尻でいかされちゃうっ……！,sound/data/pcm/c14/h/01.unity3d,h_so_14_02_115
116,14,44,お尻がぁあっ、気持ちよくされちゃってっ……イッちゃうっ……,sound/data/pcm/c14/h/01.unity3d,h_so_14_02_116
117,14,44,お尻でイッちゃう……あっあっ、一緒に、だしてっ,sound/data/pcm/c14/h/01.unity3d,h_so_14_02_117
118,14,44,ああっ、イキそうになってるんだなっ、私もっ、イキそっ……,sound/data/pcm/c14/h/01.unity3d,h_so_14_02_118
119,14,44,いいよっ……あっ、お尻ぃっなら……んあぁっ,sound/data/pcm/c14/h/01.unity3d,h_so_14_02_119
120,14,44,あっ……じゃあ、私も手伝ってやるよっ……,sound/data/pcm/c14/h/01.unity3d,h_so_14_02_120
121,14,44,あっんんっ！　ちんぽ汁、中に出てるううぅぅ,sound/data/pcm/c14/h/01.unity3d,h_so_14_02_121
122,14,44,ふわっんんっ！　　たっくさん、きたあぁぁああ！,sound/data/pcm/c14/h/01.unity3d,h_so_14_02_122
123,14,44,ああんっ！　ゴムの中で、必死に出してるううぅぅ,sound/data/pcm/c14/h/01.unity3d,h_so_14_02_123
124,14,44,あっんんっ！　ぼとぼと精液、でてるううぅ！　あ……んんっ！,sound/data/pcm/c14/h/01.unity3d,h_so_14_02_124
125,14,44,はぁああん！　出てきてるぅ、お尻に、ちんぽ汁きてるぅぅ,sound/data/pcm/c14/h/01.unity3d,h_so_14_02_125
126,14,44,ああぁぁん！　お尻に、どぴゅどぴゅって、でてるうっ,sound/data/pcm/c14/h/01.unity3d,h_so_14_02_126
127,14,44,ぁ……んんっ！　ああっんぁ,sound/data/pcm/c14/h/01.unity3d,h_so_14_02_127
128,14,44,ああっぁんんっ！,sound/data/pcm/c14/h/01.unity3d,h_so_14_02_128
129,14,44,イィっ、クぅぅぅうううん！,sound/data/pcm/c14/h/01.unity3d,h_so_14_02_129
130,14,44,ふわっあっんんっ！　っんんっ！,sound/data/pcm/c14/h/01.unity3d,h_so_14_02_130
131,14,44,はぁん……イくタイミングが一緒なんて、私たち、相性いいんだろうなっ,sound/data/pcm/c14/h/01.unity3d,h_so_14_02_131
132,14,44,ああん……私、こんなセックスできるなんて、幸せものだな……,sound/data/pcm/c14/h/01.unity3d,h_so_14_02_132
133,14,44,ちんぽ汁が、私のと混ざってそう……ふぁぁ……,sound/data/pcm/c14/h/01.unity3d,h_so_14_02_133
134,14,44,いっぱい、出してくれたんだなっ……嬉しいよ,sound/data/pcm/c14/h/01.unity3d,h_so_14_02_134
135,14,44,中でいっぱい出たな……赤ちゃん、できちゃう……できたら、よろしくな？,sound/data/pcm/c14/h/01.unity3d,h_so_14_02_135
136,14,44,こんなに濃いのばっかり……私もイッたし、間違いないだろうなっ,sound/data/pcm/c14/h/01.unity3d,h_so_14_02_136
137,14,44,また、イカされちゃったっ……うますぎるんだよっ,sound/data/pcm/c14/h/01.unity3d,h_so_14_02_137
138,14,44,先にイッちゃうのは、お、お前がエッチうまいからだからっ,sound/data/pcm/c14/h/01.unity3d,h_so_14_02_138
139,14,44,お尻じゃなかったら、赤ちゃんできてたかもっ……,sound/data/pcm/c14/h/01.unity3d,h_so_14_02_139
140,14,44,私たち、お尻でイクような変態になっちゃったなっ,sound/data/pcm/c14/h/01.unity3d,h_so_14_02_140
141,14,44,また、お尻でイッちゃったっ……変態にされたぁ……,sound/data/pcm/c14/h/01.unity3d,h_so_14_02_141
142,14,44,お尻ぃ、気持ちいい……変態でも、いいっ,sound/data/pcm/c14/h/01.unity3d,h_so_14_02_142
143,14,44,ゴムないのっ、想像したら……ふふっ,sound/data/pcm/c14/h/01.unity3d,h_so_14_02_143
144,14,44,なあ……今度は、もっと薄いゴム、試してくれないか？,sound/data/pcm/c14/h/01.unity3d,h_so_14_02_144
145,14,44,おまんこが、きゅんきゅんしちゃってるっ……,sound/data/pcm/c14/h/01.unity3d,h_so_14_02_145
146,14,44,二人で一緒にイケたの、またしたいなっ,sound/data/pcm/c14/h/01.unity3d,h_so_14_02_146
147,14,44,ふあぁ……こんなの、絶対妊娠してるっ……ふふっ,sound/data/pcm/c14/h/01.unity3d,h_so_14_02_147
148,14,44,こんな激しいの、こどもができたら、すごいエッチな子になりそうだなっ,sound/data/pcm/c14/h/01.unity3d,h_so_14_02_148
149,14,44,ひとりでイッちゃった……ちょっと、待って。まだ、動けないっ,sound/data/pcm/c14/h/01.unity3d,h_so_14_02_149
150,14,44,はぁぁぁ……腰、砕けちゃったあぁ,sound/data/pcm/c14/h/01.unity3d,h_so_14_02_150
151,14,44,あぁ……また、明日お尻バカになってるやつだぁ……,sound/data/pcm/c14/h/01.unity3d,h_so_14_02_151
152,14,44,お尻でぇ……また出てるぅ……,sound/data/pcm/c14/h/01.unity3d,h_so_14_02_152
153,14,44,お尻が……もうおまんこになってるっ……,sound/data/pcm/c14/h/01.unity3d,h_so_14_02_153
154,14,44,お尻で、こんなになっちゃう女の子なんて、おかしいんだよぉ,sound/data/pcm/c14/h/01.unity3d,h_so_14_02_154
155,14,44,わあっ……ゴム、こんなに膨れてるっ……面白いなっ,sound/data/pcm/c14/h/01.unity3d,h_so_14_02_155
156,14,44,こんなにだしてくれて、私の中、気持ちよかったか……？,sound/data/pcm/c14/h/01.unity3d,h_so_14_02_156
157,14,44,あっ、今日は大丈夫な日だから、もうちょっとこのままでっ……,sound/data/pcm/c14/h/01.unity3d,h_so_14_02_157
158,14,44,お前の体すべてが、私に溶けてきそうっ……,sound/data/pcm/c14/h/01.unity3d,h_so_14_02_158
159,14,44,いっぱいでてっ……,sound/data/pcm/c14/h/01.unity3d,h_so_14_02_159
160,14,44,おちんぽ汁が、私の子宮目指してきてそうな、感じっ……,sound/data/pcm/c14/h/01.unity3d,h_so_14_02_160
161,14,44,お前とイケることに、おまんこも喜んじゃってるっ……,sound/data/pcm/c14/h/01.unity3d,h_so_14_02_161
162,14,44,出しすぎだろ。ゴムがはちきれるかと思ったぞ,sound/data/pcm/c14/h/01.unity3d,h_so_14_02_162
163,14,44,こんなあついのっ……その日だったら、もしかしたかもねっ,sound/data/pcm/c14/h/01.unity3d,h_so_14_02_163
164,14,44,はぁぁ……中にお前の精液があるの、ずっとイッてしまえそうだっ……,sound/data/pcm/c14/h/01.unity3d,h_so_14_02_164
165,14,44,これは、赤ちゃんできてないほうが、おかしいかもなっ,sound/data/pcm/c14/h/01.unity3d,h_so_14_02_165
166,14,44,あぁっ……今日は、記念日になるかもなっ,sound/data/pcm/c14/h/01.unity3d,h_so_14_02_166
167,14,44,イカされちゃったぁ……うますぎるって、絶対,sound/data/pcm/c14/h/01.unity3d,h_so_14_02_167
168,14,44,こんなにイッちゃうの、お前がうまいからだぞっ,sound/data/pcm/c14/h/01.unity3d,h_so_14_02_168
169,14,44,お尻が……ひりひりしちゃう……,sound/data/pcm/c14/h/01.unity3d,h_so_14_02_169
170,14,44,お尻で、感じる体になっちゃったっ……,sound/data/pcm/c14/h/01.unity3d,h_so_14_02_170
171,14,44,こんな変態にしたんだから、責任、とれよなっ,sound/data/pcm/c14/h/01.unity3d,h_so_14_02_171
172,14,44,おちんぽ、ぴくぴくしてるっ……イキいいなっ,sound/data/pcm/c14/h/01.unity3d,h_so_14_02_172
173,14,44,いっぱい、出したなっ……エッチなやつだなっ,sound/data/pcm/c14/h/01.unity3d,h_so_14_02_173
174,14,44,ちんぽ汁、こんなに出しちゃったんだ……,sound/data/pcm/c14/h/01.unity3d,h_so_14_02_174
175,14,44,すっかり、濡れちゃったなっ……おもらししたみたいっ,sound/data/pcm/c14/h/01.unity3d,h_so_14_02_175
176,14,44,なあ……まだ、できないかなっ……？,sound/data/pcm/c14/h/01.unity3d,h_so_14_02_176
177,14,44,あっ……ふふっ、今日はいっぱい出したなっ,sound/data/pcm/c14/h/01.unity3d,h_so_14_02_177
178,14,44,たれちゃったっ……ふふっ,sound/data/pcm/c14/h/01.unity3d,h_so_14_02_178
179,14,44,あ、おもらししちゃった……あらためて、いっぱいだされたのわかるなっ,sound/data/pcm/c14/h/01.unity3d,h_so_14_02_179
180,14,44,あっ……もれちゃっただけで、ちょっと気持ちよくなっちゃった……,sound/data/pcm/c14/h/01.unity3d,h_so_14_02_180
181,14,44,まだ、しようぜっ……？,sound/data/pcm/c14/h/01.unity3d,h_so_14_02_181
182,14,44,もっと、しないか……？,sound/data/pcm/c14/h/01.unity3d,h_so_14_02_182
183,14,44,私で、もっと気持ちよくなってくれっ,sound/data/pcm/c14/h/01.unity3d,h_so_14_02_183
184,14,44,ああ……きてくれっ……,sound/data/pcm/c14/h/01.unity3d,h_so_14_02_184
185,14,44,今度、ゴムなしでいいから、今日はしてくれ,sound/data/pcm/c14/h/01.unity3d,h_so_14_02_185
186,14,44,ごめん、今日はつけてほしいな,sound/data/pcm/c14/h/01.unity3d,h_so_14_02_186
187,14,44,今日は無理な日なんだ、ごめんな？,sound/data/pcm/c14/h/01.unity3d,h_so_14_02_187
188,14,44,危険日だから、気兼ねなく、気持ちよくなりたいんだっ。頼むっ,sound/data/pcm/c14/h/01.unity3d,h_so_14_02_188
189,14,44,いいよ、気持ちよくしてやるっ,sound/data/pcm/c14/h/01.unity3d,h_so_14_02_189
190,14,44,わかったよ。根負けだっ,sound/data/pcm/c14/h/01.unity3d,h_so_14_02_190
191,14,44,これ以上お尻に入れられると、馬鹿になっちゃうからっ,sound/data/pcm/c14/h/01.unity3d,h_so_14_02_191
192,14,44,私、まだ変態にはなりたくない、かな,sound/data/pcm/c14/h/01.unity3d,h_so_14_02_192
193,14,44,あぁん、またくるぅ,sound/data/pcm/c14/h/01.unity3d,h_so_14_02_193
194,14,44,また、きもちいいの、してくれ,sound/data/pcm/c14/h/01.unity3d,h_so_14_02_194
195,14,44,あぁん、きたぁ,sound/data/pcm/c14/h/01.unity3d,h_so_14_02_195
196,14,44,急に来るのぉっ,sound/data/pcm/c14/h/01.unity3d,h_so_14_02_196
197,14,44,何度でもきもちよくなってくれっ,sound/data/pcm/c14/h/01.unity3d,h_so_14_02_197
198,14,44,あぁん、お尻のこの感じ、やっぱり変だぁ,sound/data/pcm/c14/h/01.unity3d,h_so_14_02_198
199,14,44,んあっ、ムズムズしてきたぁ……,sound/data/pcm/c14/h/01.unity3d,h_so_14_02_199
200,14,44,ふあぁっ、お尻ぃ,sound/data/pcm/c14/h/01.unity3d,h_so_14_02_200
201,14,44,お尻ぃっ、キタッ……,sound/data/pcm/c14/h/01.unity3d,h_so_14_02_201
202,14,44,あぁぁ、動かれるのを、ずっと待ってるのぉ,sound/data/pcm/c14/h/01.unity3d,h_so_14_02_202
203,14,44,入れられてるだけで、感じちゃう,sound/data/pcm/c14/h/01.unity3d,h_so_14_02_203
204,14,44,はぁああ、待ちわびてる感じするぅ,sound/data/pcm/c14/h/01.unity3d,h_so_14_02_204
205,14,44,いつでも、動いていいぞっ,sound/data/pcm/c14/h/01.unity3d,h_so_14_02_205
206,14,44,どうした？　……やめるの、か……？,sound/data/pcm/c14/h/01.unity3d,h_so_14_02_206
207,14,44,ん、別の体位にするか？,sound/data/pcm/c14/h/01.unity3d,h_so_14_02_207
208,14,44,あぁん、焦らされてるっ,sound/data/pcm/c14/h/01.unity3d,h_so_14_02_208
209,14,44,あっはあん……もっとしてぇ……,sound/data/pcm/c14/h/01.unity3d,h_so_14_02_209
210,14,44,ゆっくりくるの、いいっ,sound/data/pcm/c14/h/01.unity3d,h_so_14_02_210
211,14,44,ゆっくりでも、気持ちよくなってくのぉ,sound/data/pcm/c14/h/01.unity3d,h_so_14_02_211
212,14,44,もっと激しいの、いいぞっ,sound/data/pcm/c14/h/01.unity3d,h_so_14_02_212
213,14,44,早いの、気持ちいいっ,sound/data/pcm/c14/h/01.unity3d,h_so_14_02_213
214,14,44,お尻で優しくされるの、ゾクッときちゃう,sound/data/pcm/c14/h/01.unity3d,h_so_14_02_214
