管理番号,大きい項目,中間項目,表示名,バンドルパス,ファイル名
0,03,51,えへへ、私、もう期待で準備万端なのですよ,sound/data/pcm/c03/h/01.unity3d,h_ai_03_03_000
1,03,51,焦らすのなんてナシですよー,sound/data/pcm/c03/h/01.unity3d,h_ai_03_03_001
2,03,51,はぅ……もう待てないのです……,sound/data/pcm/c03/h/01.unity3d,h_ai_03_03_002
3,03,51,ん、れりゅっ……舌、気持ちいいです……,sound/data/pcm/c03/h/01.unity3d,h_ai_03_03_009
4,03,51,舌と舌が絡まって……はふ……ぼーっとしちゃうですよ,sound/data/pcm/c03/h/01.unity3d,h_ai_03_03_010
5,03,51,はぁぁ……とろとろになっちゃったです……,sound/data/pcm/c03/h/01.unity3d,h_ai_03_03_011
6,03,51,こんな濃厚なキス……それだけで濡れちゃうですよ,sound/data/pcm/c03/h/01.unity3d,h_ai_03_03_012
7,03,51,私……身体中から力が抜けちゃいそうです……はふぅ……,sound/data/pcm/c03/h/01.unity3d,h_ai_03_03_013
8,03,51,キスの最中から……溢れてるの感じちゃってたですよ……はぅ……,sound/data/pcm/c03/h/01.unity3d,h_ai_03_03_014
9,03,51,ふあぁっ、あっ、声っ、いっぱい出ちゃうですっ……,sound/data/pcm/c03/h/01.unity3d,h_ai_03_03_018
10,03,51,どんなことされても気持ちいいですよぉっ……,sound/data/pcm/c03/h/01.unity3d,h_ai_03_03_019
11,03,51,あっ、びくびくっ、止まらないですっ……ふあぁっ,sound/data/pcm/c03/h/01.unity3d,h_ai_03_03_020
12,03,51,あっ、ダメっ、感じすぎてっ、力抜けちゃいそうっ、ですっ……ふあぁっ……,sound/data/pcm/c03/h/01.unity3d,h_ai_03_03_022
13,03,51,ふわっ、気持ちいいところっ……ピンポイントなのですっ……あっ、身体喜んじゃうですっ！,sound/data/pcm/c03/h/01.unity3d,h_ai_03_03_023
14,03,51,あんっ、い、いっぱい溢れちゃうですっ……そこ弱点なのですよっ……,sound/data/pcm/c03/h/01.unity3d,h_ai_03_03_025
15,03,51,私っ、乳首弱いのですっ……力抜けちゃうですよぉっ……,sound/data/pcm/c03/h/01.unity3d,h_ai_03_03_027
16,03,51,あぁんっ、乳首っ、刺激されるとっ……あっ、声っ、どんどん出ちゃうですっ！,sound/data/pcm/c03/h/01.unity3d,h_ai_03_03_028
17,03,51,やっ、お、おまんこっ……やっぱり一番気持ちいいですっ……,sound/data/pcm/c03/h/01.unity3d,h_ai_03_03_029
18,03,51,あぁんっ、もうっ、おまんこどんどん気持ち良くされちゃってるですよぉっ……,sound/data/pcm/c03/h/01.unity3d,h_ai_03_03_030
19,03,51,触られる度っ、おまんこが喜んじゃうですっ……あっ、ほらっ……またっ、溢れちゃうっ、ですっ……,sound/data/pcm/c03/h/01.unity3d,h_ai_03_03_031
20,03,51,恥ずかしいけどっ、お尻っ……すっごく気持ちいいのですっ……もっともっと触って欲しいですよぅっ……,sound/data/pcm/c03/h/01.unity3d,h_ai_03_03_032
21,03,51,お尻なのにこんなに感じるなんてっ……私、あなたにいっぱい開発されちゃったですよっ……,sound/data/pcm/c03/h/01.unity3d,h_ai_03_03_033
22,03,51,えへへ、お尻、気持ちいいのです。もっともっと開発してほしーですよ♪,sound/data/pcm/c03/h/01.unity3d,h_ai_03_03_034
23,03,51,おっぱい、たくさん揉んで欲しいです……,sound/data/pcm/c03/h/01.unity3d,h_ai_03_03_047
24,03,51,いっぱい揉んで……大きくしてくださいです……,sound/data/pcm/c03/h/01.unity3d,h_ai_03_03_048
25,03,51,お尻っ、そんなにがっしり揉むですかっ……あんっ、感じちゃうですっ……,sound/data/pcm/c03/h/01.unity3d,h_ai_03_03_049
26,03,51,ひあぁ、お尻揉まれるとっ……おまんこがひくひくしちゃうですっ……,sound/data/pcm/c03/h/01.unity3d,h_ai_03_03_050
27,03,51,乳首っ、押し込まれてるですっ……はぅっ……,sound/data/pcm/c03/h/01.unity3d,h_ai_03_03_051
28,03,51,あんっ、つんつんされるだけでビクッてしちゃうですっ……,sound/data/pcm/c03/h/01.unity3d,h_ai_03_03_052
29,03,51,はぅっ、乳首ってそんな風に触るものだったですかっ……,sound/data/pcm/c03/h/01.unity3d,h_ai_03_03_053
30,03,51,やっ、あぁっ、乳首っ、どんどん大きくなっちゃうですーっ！,sound/data/pcm/c03/h/01.unity3d,h_ai_03_03_054
31,03,51,い、痛いくらいっ、引っ張ってくださいですっ、気持ちいいっ！,sound/data/pcm/c03/h/01.unity3d,h_ai_03_03_055
32,03,51,乳首っ、たくさん苛めて欲しいですっ……あ、あっ、感じちゃうですよーっ,sound/data/pcm/c03/h/01.unity3d,h_ai_03_03_056
33,03,51,あ……どうして私……お尻の穴でこんな感じるようになっちゃったですか……,sound/data/pcm/c03/h/01.unity3d,h_ai_03_03_057
34,03,51,もう……お尻の穴の快感、覚えちゃったですよ……気持ちいい……,sound/data/pcm/c03/h/01.unity3d,h_ai_03_03_058
35,03,51,うぅぅ……まさかお尻がこんなに気持ち良くなるなんて……あなたに仕込まれちゃったです……はぅ……,sound/data/pcm/c03/h/01.unity3d,h_ai_03_03_059
36,03,51,あんっ、おまんこっ、ひくひくしてるですっ……,sound/data/pcm/c03/h/01.unity3d,h_ai_03_03_060
37,03,51,やっ、ますます濡れちゃうですよぅ……,sound/data/pcm/c03/h/01.unity3d,h_ai_03_03_061
38,03,51,おまんこ……もっともっと濡らしちゃうですか……？　ふふーっ、いいですよ♪,sound/data/pcm/c03/h/01.unity3d,h_ai_03_03_062
39,03,51,そ、そんなところ、ダメですのにっ……あっ、感じちゃうですよぉっ……,sound/data/pcm/c03/h/01.unity3d,h_ai_03_03_063
40,03,51,だ、ダメですっ……指で撫でられるとっ、お尻の穴っ、ひくひくしちゃうですっ……,sound/data/pcm/c03/h/01.unity3d,h_ai_03_03_064
41,03,51,あっ、やっ、指っ、入っちゃいそうですっ……お尻の穴っ……ふあぁっ……,sound/data/pcm/c03/h/01.unity3d,h_ai_03_03_065
42,03,51,ふぁっ、おまんこ、あなたの指飲み込んじゃったです……えへへ、美味しい……,sound/data/pcm/c03/h/01.unity3d,h_ai_03_03_066
43,03,51,いっぱい触って、もっとぬるぬるにして欲しいです……かきだしてくださいー,sound/data/pcm/c03/h/01.unity3d,h_ai_03_03_067
44,03,51,おまんこの中、まだいっぱい溢れてるですよ。私、濡れすぎなのですっ……,sound/data/pcm/c03/h/01.unity3d,h_ai_03_03_068
45,03,51,お尻の穴っ……きゅんきゅんしちゃうですっ……,sound/data/pcm/c03/h/01.unity3d,h_ai_03_03_069
46,03,51,ふぁっ、あぁっ、お尻の穴もっ……好きなのですぅっ……,sound/data/pcm/c03/h/01.unity3d,h_ai_03_03_070
47,03,51,お尻の穴っ、奥まで入れてみてくださいですっ……きっとっ、熱々なのですよっ……ふあぁっ！,sound/data/pcm/c03/h/01.unity3d,h_ai_03_03_071
48,03,51,あっ、おまんこの中からっ、どんどん溢れてくるですっ……やらしいお汁っ、なのですっ……,sound/data/pcm/c03/h/01.unity3d,h_ai_03_03_072
49,03,51,ふぁぁっ、おまんこっ、蕩けちゃうですよぉっ……,sound/data/pcm/c03/h/01.unity3d,h_ai_03_03_073
50,03,51,はふっ、もっと、もっと掻き回してほしーですっ……,sound/data/pcm/c03/h/01.unity3d,h_ai_03_03_074
51,03,51,お尻の穴っ……そんなに大きくしちゃうですかっ……？,sound/data/pcm/c03/h/01.unity3d,h_ai_03_03_075
52,03,51,気持ち良すぎて訳分かんないですっ……私のお尻の穴っ……す、好きにしてくださいなのですーっ！,sound/data/pcm/c03/h/01.unity3d,h_ai_03_03_076
53,03,51,ふあぁっ、お尻の穴っ、気持ちいいですよぉっ！　たくさん掻き回してください-っ！,sound/data/pcm/c03/h/01.unity3d,h_ai_03_03_077
54,03,51,あ……んっ、私のこと、いっぱい味わってくださいなのですっ……,sound/data/pcm/c03/h/01.unity3d,h_ai_03_03_078
55,03,51,汗……嫌じゃないですか？　あのっ……匂いっ、とかもっ……あぁんっ、もうっ、恥ずかしいのに興奮するですーっ！,sound/data/pcm/c03/h/01.unity3d,h_ai_03_03_079
56,03,51,はふ……あなたの舌……温かくて柔らかいです……幸せ……,sound/data/pcm/c03/h/01.unity3d,h_ai_03_03_080
57,03,51,あんっ、乳首っ、そんなに舐められるなんてっ……な、なんだか大人になったみたいですっ……,sound/data/pcm/c03/h/01.unity3d,h_ai_03_03_081
58,03,51,ふあぁっ、私っ……あなたのことぎゅーってしたくなっちゃうですよっ……,sound/data/pcm/c03/h/01.unity3d,h_ai_03_03_082
59,03,51,おまんこの中からっ……愛液っ、どんどん出ちゃうですっ……あんっ、そんなの美味しくないですよーっ！,sound/data/pcm/c03/h/01.unity3d,h_ai_03_03_083
60,03,51,あぁんっ、おまんこの味なんてっ……い、言わなくていーですっ！　んっ、興奮しちゃうですよーっ！,sound/data/pcm/c03/h/01.unity3d,h_ai_03_03_084
61,03,51,あぁっ、お尻の穴舐められてるなんてっ……消えちゃいたいくらい恥ずかしいのにっ……すっごく気持ちいいっ！,sound/data/pcm/c03/h/01.unity3d,h_ai_03_03_085
62,03,51,お尻の穴っ、ぺろぺろされてるですっ……あっ、やっ、ふやけちゃうですよっ……,sound/data/pcm/c03/h/01.unity3d,h_ai_03_03_086
63,03,51,はぁんっ、お尻の中っ、気持ちいいですっ……癖になっちゃうですよぉっ……,sound/data/pcm/c03/h/01.unity3d,h_ai_03_03_087
64,03,51,こ、これっ……ふやけちゃうですっ……お尻だけじゃなくてっ、全身ふやけちゃうですーっ……,sound/data/pcm/c03/h/01.unity3d,h_ai_03_03_088
65,03,51,や、あぁんっ、中ぁっ、すごく気持ちいいですっ！　お尻っ、ぞくぞくしちゃうですぅっ！,sound/data/pcm/c03/h/01.unity3d,h_ai_03_03_089
66,03,51,あっ、お、押しつけられるとっ、感じちゃうっ……,sound/data/pcm/c03/h/01.unity3d,h_ai_03_03_090
67,03,51,こ、これはちょっとっ……特殊な気持ち良さなのですっ！,sound/data/pcm/c03/h/01.unity3d,h_ai_03_03_091
68,03,51,こんな快感まで教えられたらっ、わ、私っ……戻れなくなっちゃうですよぉっ……,sound/data/pcm/c03/h/01.unity3d,h_ai_03_03_092
69,03,51,あぁっ、わ、私っ……乳首だけでっ、こんなに感じちゃう身体にっ……あっ、気持ちいいですーっ……,sound/data/pcm/c03/h/01.unity3d,h_ai_03_03_093
70,03,51,んんっ、ち、乳首だけじゃなくてっ、おっぱい全体が気持ちいいですっ……すごくっ、感じちゃうっ、ですぅっ……,sound/data/pcm/c03/h/01.unity3d,h_ai_03_03_094
71,03,51,おまんこっ、中まで震えてるですよっ……あっ、ダメっ、もっと漏れてきちゃうっ……,sound/data/pcm/c03/h/01.unity3d,h_ai_03_03_095
72,03,51,おまんこっ、周りも中も気持ちいいですっ……もっと当ててくほしーですよぅっ！,sound/data/pcm/c03/h/01.unity3d,h_ai_03_03_096
73,03,51,気持ち良くて限界ですーっ！　い、イッちゃうっ……大きいのイッちゃうぅっ！,sound/data/pcm/c03/h/01.unity3d,h_ai_03_03_097
74,03,51,ふあっ、イッちゃいそうですよぉっ……お、お願いですっ、イかせてっ、ほしーですっ……,sound/data/pcm/c03/h/01.unity3d,h_ai_03_03_098
75,03,51,あぁっ、あなたにっ、イかせてもらえるのっ、幸せっ……ふぁ、あっ、いっ、イッちゃうですーっ……,sound/data/pcm/c03/h/01.unity3d,h_ai_03_03_099
76,03,51,ああぁ、イッちゃうですぅぅっ！,sound/data/pcm/c03/h/01.unity3d,h_ai_03_03_100
77,03,51,えへへ、イかせてもらっちゃったです♪,sound/data/pcm/c03/h/01.unity3d,h_ai_03_03_101
78,03,51,すっごく気持ち良かったですよ♪　あなたとの思い出、また一つ増えたです♪,sound/data/pcm/c03/h/01.unity3d,h_ai_03_03_102
79,03,51,あなたにしてもらえると、何だって最高の経験なのです……えへへ,sound/data/pcm/c03/h/01.unity3d,h_ai_03_03_103
80,03,51,はぅ……見られてるだけで……濡れちゃいそうです……,sound/data/pcm/c03/h/01.unity3d,h_ai_03_03_104
81,03,51,私のおまんこ……もうとろとろなのです……,sound/data/pcm/c03/h/01.unity3d,h_ai_03_03_105
82,03,51,れりゅっ……んんっ……舌が絡むキス……気持ちいいです……,sound/data/pcm/c03/h/01.unity3d,h_ai_03_03_112
83,03,51,ぬるぬるべとべと……えへへ、やらしいですね,sound/data/pcm/c03/h/01.unity3d,h_ai_03_03_113
84,03,51,はふ……涎……いっぱい交換しちゃったです……,sound/data/pcm/c03/h/01.unity3d,h_ai_03_03_114
85,03,51,こんなキス覚えちゃったら……どこでもして欲しくなっちゃうですよ……,sound/data/pcm/c03/h/01.unity3d,h_ai_03_03_115
86,03,51,えへへ、あなたとなら……キスだけでイッちゃいそうなのです……,sound/data/pcm/c03/h/01.unity3d,h_ai_03_03_116
87,03,51,キスしてもらってる最中、おまんこがきゅんきゅんしちゃったですよ……,sound/data/pcm/c03/h/01.unity3d,h_ai_03_03_117
88,03,51,んんっ、そこ、気持ちいいですよぉっ……,sound/data/pcm/c03/h/01.unity3d,h_ai_03_03_120
89,03,51,あなたには何回でもしてほしーです……私、エッチな娘なのですよ,sound/data/pcm/c03/h/01.unity3d,h_ai_03_03_121
90,03,51,またそこっ……私っ、敏感なところですよぉっ……ふあぁっ……,sound/data/pcm/c03/h/01.unity3d,h_ai_03_03_123
91,03,51,あっ、ふああぁっ、声っ、いっぱい出ちゃうですぅっ！,sound/data/pcm/c03/h/01.unity3d,h_ai_03_03_124
92,03,51,あっ、ダメっ、ですっ……乳首触られるとっ……おっぱい溶けちゃいそうですっ……,sound/data/pcm/c03/h/01.unity3d,h_ai_03_03_125
93,03,51,あ、ち、乳首はっ、弱いっ、ですからっ……あぁんっ、びくびくするですーっ！,sound/data/pcm/c03/h/01.unity3d,h_ai_03_03_126
94,03,51,あぅっ、またっ、おまんこっ……もう中も外もとろとろなのですぅっ！,sound/data/pcm/c03/h/01.unity3d,h_ai_03_03_127
95,03,51,はぁっ、あぁっ、おまんこっ……気持ち良すぎて我慢出来なくなるですよぉっ！,sound/data/pcm/c03/h/01.unity3d,h_ai_03_03_128
96,03,51,私っ……お尻、弱いのですっ……もうっ、完全に開発されちゃったのですよっ……ふあぁっ！,sound/data/pcm/c03/h/01.unity3d,h_ai_03_03_129
97,03,51,お尻で感じちゃうなんてっ……はぅっ、わ、私っ……いつからこんなエッチな娘になっちゃったですかっ……ふあぁっ！,sound/data/pcm/c03/h/01.unity3d,h_ai_03_03_130
98,03,51,あっ……んんっ、さっきよりもエッチな触り方……感じちゃうです……,sound/data/pcm/c03/h/01.unity3d,h_ai_03_03_137
99,03,51,はぅっ……あなたに触ってもらうと……身体熱くなっちゃうですよっ……,sound/data/pcm/c03/h/01.unity3d,h_ai_03_03_138
100,03,51,おっぱい、いっぱい触ってくださいですっ……どんな触り方でも気持ちいいですよっ……,sound/data/pcm/c03/h/01.unity3d,h_ai_03_03_139
101,03,51,あなたに触られるとっ、おっぱい溶けちゃいそうなくらいっ、気持ちいいですっ……,sound/data/pcm/c03/h/01.unity3d,h_ai_03_03_140
102,03,51,あ……お尻っ、触られてるだけでもひくひくしちゃうですっ……,sound/data/pcm/c03/h/01.unity3d,h_ai_03_03_141
103,03,51,そうやって撫でられるとっ……ふやんっ、気持ちいいですよぉっ……,sound/data/pcm/c03/h/01.unity3d,h_ai_03_03_142
104,03,51,やんっ、自分の乳首見てっ……ちょっと興奮しちゃうですっ……こんなにピンと尖って……恥ずかしいですぅ……,sound/data/pcm/c03/h/01.unity3d,h_ai_03_03_143
105,03,51,はふっ……乳首、少しずつ大きくなってるですよっ……でも……あなたに大きくしてもらってるから……嬉しいのです♪,sound/data/pcm/c03/h/01.unity3d,h_ai_03_03_144
106,03,51,やぁっ、乳首っ……伸びるっ、ですっ……ふあっ、もっといっぱい引っ張ってくださいですーっ,sound/data/pcm/c03/h/01.unity3d,h_ai_03_03_145
107,03,51,あなたの指っ……すごく気持ちいいっ、ですっ……乳首っ、押しつぶすくらい強くしてくださいですーっ！,sound/data/pcm/c03/h/01.unity3d,h_ai_03_03_146
108,03,51,お尻の穴っ……もう気持ち良さしか感じないのですっ……あはっ、もっと触ってくださいですーっ……,sound/data/pcm/c03/h/01.unity3d,h_ai_03_03_147
109,03,51,感じ過ぎちゃってっ……お尻の穴なのかっ、おまんこなのかっ、区別が付かなくなっちゃうですよぉっ……,sound/data/pcm/c03/h/01.unity3d,h_ai_03_03_148
110,03,51,あぁんっ、いっぱい擦ってほしいですっ！　おまんこっ、すっごく喜んでるですよっ！　気持ちいいっ！,sound/data/pcm/c03/h/01.unity3d,h_ai_03_03_149
111,03,51,またっ、おまんこっ……あっ、でもっ、やっぱりそこっ、気持ちいいのですっ……すごくっ、女の子な場所っ、なのですよっ！,sound/data/pcm/c03/h/01.unity3d,h_ai_03_03_150
112,03,51,あんっ、またお尻ですかっ……さ、さっきよりも激しいっ……ですっ……,sound/data/pcm/c03/h/01.unity3d,h_ai_03_03_151
113,03,51,ふあっ、お尻の穴っ、こすられるのっ……気持ちいいですっ……きゅうぅって締まっちゃうですよっ……,sound/data/pcm/c03/h/01.unity3d,h_ai_03_03_152
114,03,51,おまんこっ、ぬるぬるですよぉっ……もっ、何も抵抗できないくらいっ……ぬるぬるなのですっ……,sound/data/pcm/c03/h/01.unity3d,h_ai_03_03_153
115,03,51,あんっ、こ、こんなにっ、蕩けるくらい濡れるものっ、なのですかっ……？　私もしかしてっ、濡れすぎっｔ、なのではっ……,sound/data/pcm/c03/h/01.unity3d,h_ai_03_03_154
116,03,51,も、もうっ、お尻の穴で感じちゃうなんてっ……わ、私っ……完全にヘンタイさんなのですよっ……ふぁぁっ！,sound/data/pcm/c03/h/01.unity3d,h_ai_03_03_155
117,03,51,お尻の穴っ、弄りすぎなのですっ……おかげで私っ……お、お尻の穴で濡れちゃう娘になっちゃったですよぅっ……,sound/data/pcm/c03/h/01.unity3d,h_ai_03_03_156
118,03,51,ふあぁんっ、おまんこ、そんなに弄ったらっ……わ、私もうっ……戻れなくなっちゃうですっ……いつでもおまんこのこと考えちゃうですよぉっ１,sound/data/pcm/c03/h/01.unity3d,h_ai_03_03_157
119,03,51,あ、あぁっ、おまんこの中、すごいですっ……気持ちいいっ！,sound/data/pcm/c03/h/01.unity3d,h_ai_03_03_158
120,03,51,お尻の穴っ、どんどんほぐれるですよぉっ……その度にっ、気持ち良くなっちゃうですっ……ふはぁっ！,sound/data/pcm/c03/h/01.unity3d,h_ai_03_03_159
121,03,51,あぁんっ、お尻の中っ、気持ちいいですぅっ！　頭の中までっ……掻き回されてるみたいっ、なのですっ！,sound/data/pcm/c03/h/01.unity3d,h_ai_03_03_160
122,03,51,んっ……気持ちいい……あなたに舐めてもらえるなんて……幸せなのです……,sound/data/pcm/c03/h/01.unity3d,h_ai_03_03_161
123,03,51,私、舐められるの大好きなのです……もちろん、あなた限定なのですよ♪,sound/data/pcm/c03/h/01.unity3d,h_ai_03_03_162
124,03,51,はふぅっ、な、何度舐めてもっ……おっぱいは出ないのですっ……まだっ、無理なのですよぉっ……,sound/data/pcm/c03/h/01.unity3d,h_ai_03_03_163
125,03,51,乳首いっぱい刺激されるとっ……身体中が溶けちゃいそうですよぉっ……,sound/data/pcm/c03/h/01.unity3d,h_ai_03_03_164
126,03,51,や、あっ……私のっ、愛液っ……気持ちいいお汁の味っ……あなたに覚えられちゃうですよぉっ……,sound/data/pcm/c03/h/01.unity3d,h_ai_03_03_165
127,03,51,あんっ、ま、真っ白なっ、ドロドロしたっ……愛液っ……あっ、ダメっ……舌に付いちゃってるですってばぁっ！,sound/data/pcm/c03/h/01.unity3d,h_ai_03_03_166
128,03,51,そ、そんなっ、お尻の穴なんてっ、何回も舐める場所じゃっ、ないっ、のにっ……あぁんっ、気持ちいいですよぉっ！,sound/data/pcm/c03/h/01.unity3d,h_ai_03_03_167
129,03,51,私っ……もうヘンタイさんなのですっ……お尻の穴、舐めてもらって興奮しちゃうっ……ヘンタイさんなのですよぉっ……,sound/data/pcm/c03/h/01.unity3d,h_ai_03_03_168
130,03,51,お尻の穴っ……あなたの舌で喜んじゃってるのですっ……あっ、ひくひくしてっ……舌っ、締め付けちゃうですよぉっ！,sound/data/pcm/c03/h/01.unity3d,h_ai_03_03_169
131,03,51,あんっ、で、出口が広がってっ……あっ、やっ……中まで蕩けちゃうですっ……お尻の穴っ、こんなにっ、気持ちいいなんてっ……ふあぁっ！,sound/data/pcm/c03/h/01.unity3d,h_ai_03_03_170
132,03,51,あぁっ、もう限界なのですっ！　気持ちいいのがっ、押し寄せてっ……ふあぁっ、いっ、イッちゃうですよぉっ！,sound/data/pcm/c03/h/01.unity3d,h_ai_03_03_171
133,03,51,も、もうっ、私っ……はふっ……いっ、イかせてくださいっ……あなたにっ、イかせてほしーですっ……ふあぁっ！,sound/data/pcm/c03/h/01.unity3d,h_ai_03_03_172
134,03,51,はぁ……んん……あなたにしてもらうの……本当に幸せなのです……,sound/data/pcm/c03/h/01.unity3d,h_ai_03_03_173
135,03,51,えへへ……あなたにしてもらうと……私、いっぱいイッちゃうですよ……,sound/data/pcm/c03/h/01.unity3d,h_ai_03_03_174
