管理番号,大きい項目,中間項目,表示名,バンドルパス,ファイル名
171,10,54,これからはいつでもお尻に入れたいときは言ってくれ……最近は好きになってきたんだ,sound/data/pcm/c10/h/01.unity3d,h_so_10_03_171
172,10,54,勢いありすぎだ、どれだけ我慢していたんだ、汝は……,sound/data/pcm/c10/h/01.unity3d,h_so_10_03_172
173,10,54,汝のオチンポからもまだ精液たれてるよ……,sound/data/pcm/c10/h/01.unity3d,h_so_10_03_173
174,10,54,たまには外だしもいいものだな……これが普段私の中に射精されてると思うと、ゾクゾクする……,sound/data/pcm/c10/h/01.unity3d,h_so_10_03_174
175,10,54,汝の精液の匂いは我の嗅覚を刺激し、おかしくさせる,sound/data/pcm/c10/h/01.unity3d,h_so_10_03_175
176,10,54,こんなに射精して……無理してでも中に出して貰えればよかったかな？,sound/data/pcm/c10/h/01.unity3d,h_so_10_03_176
177,10,54,汝よ、見てくれ……これが我の中に入った汝の精液だ……,sound/data/pcm/c10/h/01.unity3d,h_so_10_03_177
178,10,54,たれて出てきている……少し、もったいないな……,sound/data/pcm/c10/h/01.unity3d,h_so_10_03_178
179,10,54,まったく、我のお尻の中でどれだけ出したのだ……たれ出てきているではないか……,sound/data/pcm/c10/h/01.unity3d,h_so_10_03_179
180,10,54,わ、わざとではないぞ？　油断して、たらって出てきただけなんだ,sound/data/pcm/c10/h/01.unity3d,h_so_10_03_180
181,10,54,まだまだ、我は満足できておらんのだぁ……,sound/data/pcm/c10/h/01.unity3d,h_so_10_03_181
182,10,54,また体がうずき始めた……,sound/data/pcm/c10/h/01.unity3d,h_so_10_03_182
183,10,54,はぁ、はぁ……ほしい、汝のオチンポほしいよ,sound/data/pcm/c10/h/01.unity3d,h_so_10_03_183
184,10,54,そのためにもう一度しようとしてるんだ,sound/data/pcm/c10/h/01.unity3d,h_so_10_03_184
185,10,54,我もしたいが、今日は無しだ,sound/data/pcm/c10/h/01.unity3d,h_so_10_03_185
186,10,54,それは、今度またしようではないか！,sound/data/pcm/c10/h/01.unity3d,h_so_10_03_186
187,10,54,さすがにこれはつけて貰わねばな,sound/data/pcm/c10/h/01.unity3d,h_so_10_03_187
188,10,54,キミとは安心してエッチしたいのぉ,sound/data/pcm/c10/h/01.unity3d,h_so_10_03_188
189,10,54,くるのだ、このお尻好きめっ！,sound/data/pcm/c10/h/01.unity3d,h_so_10_03_189
190,10,54,早く、またお尻をいじめてくれぇ,sound/data/pcm/c10/h/01.unity3d,h_so_10_03_190
191,10,54,ここでハマってしまったったら最後戻れなくなる、だからダメだ,sound/data/pcm/c10/h/01.unity3d,h_so_10_03_191
192,10,54,お尻は機会があればやろう、今日はとりあえず別のところで……,sound/data/pcm/c10/h/01.unity3d,h_so_10_03_192
193,10,54,頼むぞ、今度も我を気持ちよくしてくれぇ,sound/data/pcm/c10/h/01.unity3d,h_so_10_03_193
194,10,54,そのオチンポで狂うぐらい突いてくれ,sound/data/pcm/c10/h/01.unity3d,h_so_10_03_194
195,10,54,そ、そう、そのまま動いてくれ,sound/data/pcm/c10/h/01.unity3d,h_so_10_03_195
196,10,54,この入ってきて瞬間がたまらんのだ,sound/data/pcm/c10/h/01.unity3d,h_so_10_03_196
197,10,54,イッたはずなのに……汝の体力に底はないのか？,sound/data/pcm/c10/h/01.unity3d,h_so_10_03_197
198,10,54,アナルの中は混沌に満ちておる。だから、早く汝のオチンポで粛正してくれぇ,sound/data/pcm/c10/h/01.unity3d,h_so_10_03_198
199,10,54,お尻の穴をいじめ倒してくれぇ,sound/data/pcm/c10/h/01.unity3d,h_so_10_03_199
200,10,54,よくぞきた、歓迎する,sound/data/pcm/c10/h/01.unity3d,h_so_10_03_200
201,10,54,入れられた側から興奮しとるぞ,sound/data/pcm/c10/h/01.unity3d,h_so_10_03_201
202,10,54,あぁ、このままでもイッてしまいそうだ,sound/data/pcm/c10/h/01.unity3d,h_so_10_03_202
203,10,54,精神統一がすんだら、我をめちゃくちゃにしてくれ,sound/data/pcm/c10/h/01.unity3d,h_so_10_03_203
204,10,54,たまらんぞ、この苦しさがたまらんのだ,sound/data/pcm/c10/h/01.unity3d,h_so_10_03_204
205,10,54,お尻にオチンポが入っているだけで、イッてしまいそうだ,sound/data/pcm/c10/h/01.unity3d,h_so_10_03_205
206,10,54,我は汝の言うことならなんでもするぞ,sound/data/pcm/c10/h/01.unity3d,h_so_10_03_206
207,10,54,どうした？　早くしようではないか,sound/data/pcm/c10/h/01.unity3d,h_so_10_03_207
208,10,54,この開放感も癖になる,sound/data/pcm/c10/h/01.unity3d,h_so_10_03_208
209,10,54,抜かれた時にあたるカリが……んん〜、快感だ,sound/data/pcm/c10/h/01.unity3d,h_so_10_03_209
210,10,54,ゆっくり、ねっとり我を攻めてくれ,sound/data/pcm/c10/h/01.unity3d,h_so_10_03_210
211,10,54,時間はあるじっくりやってくれぇ,sound/data/pcm/c10/h/01.unity3d,h_so_10_03_211
212,10,54,イッあとだ、この速さでも感じ過ぎてしまうぞ,sound/data/pcm/c10/h/01.unity3d,h_so_10_03_212
213,10,54,これより、強くて、激しいのを頼む！,sound/data/pcm/c10/h/01.unity3d,h_so_10_03_213
214,10,54,我のお尻は汝のオチンポを愛しているようだ,sound/data/pcm/c10/h/01.unity3d,h_so_10_03_214
215,10,54,締め付けて、汝も気持ちよくするからな,sound/data/pcm/c10/h/01.unity3d,h_so_10_03_215
216,10,54,んんっ、これだ、これが始まるのを待っていた,sound/data/pcm/c10/h/01.unity3d,h_so_10_03_216
217,10,54,中をぐちゃぐちゃにしてくれ,sound/data/pcm/c10/h/01.unity3d,h_so_10_03_217
218,10,54,あぁ、汝のオチンポが我の中を行ったり来たりしとる,sound/data/pcm/c10/h/01.unity3d,h_so_10_03_218
219,10,54,我の深淵を汝のオチンポでかき乱してくれぇ,sound/data/pcm/c10/h/01.unity3d,h_so_10_03_219
220,10,54,もっと、腰が外れるぐらい強くしてくれ,sound/data/pcm/c10/h/01.unity3d,h_so_10_03_220
221,10,54,汝のオチンポ好きぃ、だからもっとコスコスしてぇ,sound/data/pcm/c10/h/01.unity3d,h_so_10_03_221
222,10,54,我のアナルはすっかりエッチな穴にされてしまった,sound/data/pcm/c10/h/01.unity3d,h_so_10_03_222
223,10,54,あぁ、お尻の快感が止まらないよ,sound/data/pcm/c10/h/01.unity3d,h_so_10_03_223
224,10,54,もっと、お尻をいじめてやってくれぇ,sound/data/pcm/c10/h/01.unity3d,h_so_10_03_224
225,10,54,我のお尻にもっと腰を打ち付けてくれぇ,sound/data/pcm/c10/h/01.unity3d,h_so_10_03_225
226,10,54,視界がぼやけてきたぁ,sound/data/pcm/c10/h/01.unity3d,h_so_10_03_226
227,10,54,あぁ、もうセックスのことしか考えられん,sound/data/pcm/c10/h/01.unity3d,h_so_10_03_227
228,10,54,夢の世界にいるようだ,sound/data/pcm/c10/h/01.unity3d,h_so_10_03_228
229,10,54,オチンポのことしか考えられん,sound/data/pcm/c10/h/01.unity3d,h_so_10_03_229
230,10,54,あぁ、嬉しいぞ、そんなに我のために頑張ってくれてるのだな……,sound/data/pcm/c10/h/01.unity3d,h_so_10_03_230
231,10,54,汝もそろそろ限界なのだな、我も同じだぞ,sound/data/pcm/c10/h/01.unity3d,h_so_10_03_231
232,10,54,汝の喘ぎ声で我ももゾクゾクしてしまう,sound/data/pcm/c10/h/01.unity3d,h_so_10_03_232
233,10,54,よいぞ、我と汝の間柄だ、イキたくなったらイッてしまえ！,sound/data/pcm/c10/h/01.unity3d,h_so_10_03_233
234,10,54,お、お尻がもう……感じるための場所になってるぅ,sound/data/pcm/c10/h/01.unity3d,h_so_10_03_234
235,10,54,速さが関係なくなって、なんでも気持ちいいぞ,sound/data/pcm/c10/h/01.unity3d,h_so_10_03_235
236,10,54,アナルで感じる変態にお仕置きをしてくれ,sound/data/pcm/c10/h/01.unity3d,h_so_10_03_236
237,10,54,我はアナルで感じる変態なんだ、だからもっとせめてくれぇ,sound/data/pcm/c10/h/01.unity3d,h_so_10_03_237
238,10,54,汝がはじめたのだ！　しっかり、お尻でイカせてくれぇ,sound/data/pcm/c10/h/01.unity3d,h_so_10_03_238
239,10,54,な、汝の絶倫オチンポで我を突きまくってくれぇ,sound/data/pcm/c10/h/01.unity3d,h_so_10_03_239
240,10,54,我のお尻は汝のものだ、好きに使ってくれぇ,sound/data/pcm/c10/h/01.unity3d,h_so_10_03_240
241,10,54,一度は絶頂に達したのに、まだこんなに続けれるなんて汝は絶倫すぎる,sound/data/pcm/c10/h/01.unity3d,h_so_10_03_241
242,10,54,そこだ、そこまでもう来とる！　ラストスパートをかけてくれぇ,sound/data/pcm/c10/h/01.unity3d,h_so_10_03_242
243,10,54,イクッ、イッてしまう、我の意思とは関係無しにぃ,sound/data/pcm/c10/h/01.unity3d,h_so_10_03_243
244,10,54,汝のオチンポから伝わってくるぞ、一緒にイキたいって,sound/data/pcm/c10/h/01.unity3d,h_so_10_03_244
245,10,54,汝がイクなら我もイク、我がイクなら汝もイケッ！,sound/data/pcm/c10/h/01.unity3d,h_so_10_03_245
246,10,54,出してくれぇ、我もそれを望んどる,sound/data/pcm/c10/h/01.unity3d,h_so_10_03_246
247,10,54,ダメだ、もっと我慢して我を永遠に楽しませてくれ,sound/data/pcm/c10/h/01.unity3d,h_so_10_03_247
248,10,54,よいぞ。しかし、さっきよりもたくさん出すのだぞ,sound/data/pcm/c10/h/01.unity3d,h_so_10_03_248
249,10,54,汝のエロエロな精液をいっぱい出してくれぇ,sound/data/pcm/c10/h/01.unity3d,h_so_10_03_249
250,10,54,何も言わずともわかるぞ、汝きておるな？,sound/data/pcm/c10/h/01.unity3d,h_so_10_03_250
251,10,54,耐えてくれ、あともう少しだけこうしていたいのだぁ,sound/data/pcm/c10/h/01.unity3d,h_so_10_03_251
252,10,54,ゴムが我の愛液でぬるぬるだ,sound/data/pcm/c10/h/01.unity3d,h_so_10_03_252
253,10,54,ゴムの上からでも、汝が限界なのがわかるぞ,sound/data/pcm/c10/h/01.unity3d,h_so_10_03_253
254,10,54,大好きな汝にお尻でイカされる！,sound/data/pcm/c10/h/01.unity3d,h_so_10_03_254
255,10,54,また、お尻で簡単にイカされちゃうよぉ,sound/data/pcm/c10/h/01.unity3d,h_so_10_03_255
256,10,54,我のアナル、汝と一緒にイキたいってヒクついておるぅ,sound/data/pcm/c10/h/01.unity3d,h_so_10_03_256
257,10,54,汝も我と一緒のタイミングでイッてくれぇ,sound/data/pcm/c10/h/01.unity3d,h_so_10_03_257
258,10,54,我の淫乱なアナルで何回でも出してくれぇ,sound/data/pcm/c10/h/01.unity3d,h_so_10_03_258
259,10,54,あぁ、イイ、お尻が一番の性感帯になってるぅ,sound/data/pcm/c10/h/01.unity3d,h_so_10_03_259
260,10,54,我のオマンコは汝専用の精液入れにしてくれぇ,sound/data/pcm/c10/h/01.unity3d,h_so_10_03_260
261,10,54,精液が我の中を巡っておる,sound/data/pcm/c10/h/01.unity3d,h_so_10_03_261
262,10,54,この量だと、ゴムが破裂するのではないか？,sound/data/pcm/c10/h/01.unity3d,h_so_10_03_262
263,10,54,ゴム越しでもすごい量だというのがわかるぞ,sound/data/pcm/c10/h/01.unity3d,h_so_10_03_263
264,10,54,汝のオチンポからドピュドピュ出てるのがわかるぞ,sound/data/pcm/c10/h/01.unity3d,h_so_10_03_264
265,10,54,そうだ、我のお尻の中で汝の精液を解放してくれ,sound/data/pcm/c10/h/01.unity3d,h_so_10_03_265
266,10,54,意識が飛んじゃうぅぅぅぅっっ！！,sound/data/pcm/c10/h/01.unity3d,h_so_10_03_266
267,10,54,お、おかしくなるぅぅぅぅっっ！！,sound/data/pcm/c10/h/01.unity3d,h_so_10_03_267
268,10,54,天界に飛ばされるぅぅぅぅっっ！！,sound/data/pcm/c10/h/01.unity3d,h_so_10_03_268
269,10,54,天界にいっちゃうぅぅぅぅっっ！！,sound/data/pcm/c10/h/01.unity3d,h_so_10_03_269
270,10,54,汝とセックスできるのなら、ゴムがあってもよいな,sound/data/pcm/c10/h/01.unity3d,h_so_10_03_270
271,10,54,今日はゴムがなければと後悔する我がおる,sound/data/pcm/c10/h/01.unity3d,h_so_10_03_271
272,10,54,オマンコも精神も満たされておる,sound/data/pcm/c10/h/01.unity3d,h_so_10_03_272
273,10,54,ゴム無しはやはり気持ちよくて最高だな,sound/data/pcm/c10/h/01.unity3d,h_so_10_03_273
274,10,54,危険日に出されるが快感になっているぞ,sound/data/pcm/c10/h/01.unity3d,h_so_10_03_274
275,10,54,お互いにスッキリ出来てよかったな,sound/data/pcm/c10/h/01.unity3d,h_so_10_03_275
276,10,54,やっぱり汝との相性は抜群だな,sound/data/pcm/c10/h/01.unity3d,h_so_10_03_276
277,10,54,やっはり汝と我は運命の鎖につながれとるようだ,sound/data/pcm/c10/h/01.unity3d,h_so_10_03_277
278,10,54,あ、アナルが痙攣して動けん,sound/data/pcm/c10/h/01.unity3d,h_so_10_03_278
279,10,54,アナルから伝染して全身が痙攣しとる,sound/data/pcm/c10/h/01.unity3d,h_so_10_03_279
280,10,54,もっと、もっと我はお尻でイカせてほしいぞ,sound/data/pcm/c10/h/01.unity3d,h_so_10_03_280
281,10,54,お尻がこんなにも気持ちよいものに変わるとは思わなんだぞ,sound/data/pcm/c10/h/01.unity3d,h_so_10_03_281
282,10,54,汝と我でどちらがどれだけ多くイケるか勝負するか？,sound/data/pcm/c10/h/01.unity3d,h_so_10_03_282
283,10,54,ゴムのキュッキュって感覚だけでまたイッてしまいそうだ,sound/data/pcm/c10/h/01.unity3d,h_so_10_03_283
284,10,54,やはり、生でする方がセックスらしいな,sound/data/pcm/c10/h/01.unity3d,h_so_10_03_284
285,10,54,快感が全身を駆け巡っておる。,sound/data/pcm/c10/h/01.unity3d,h_so_10_03_285
286,10,54,もうゴムがありでは満足できなくなる……,sound/data/pcm/c10/h/01.unity3d,h_so_10_03_286
287,10,54,もうゴム、いらないな,sound/data/pcm/c10/h/01.unity3d,h_so_10_03_287
288,10,54,また我だけ天界に行ってしまったわけか,sound/data/pcm/c10/h/01.unity3d,h_so_10_03_288
289,10,54,あぁ、もうビクビクが止まらぬぞ,sound/data/pcm/c10/h/01.unity3d,h_so_10_03_289
290,10,54,もしかしたらオマンコよりアナルの方が好きかもしれん,sound/data/pcm/c10/h/01.unity3d,h_so_10_03_290
291,10,54,アナル好きの変態女に我はなってしまったようだ,sound/data/pcm/c10/h/01.unity3d,h_so_10_03_291
292,10,54,もう、アナルセックスなしじゃ生きられないかも……,sound/data/pcm/c10/h/01.unity3d,h_so_10_03_292
293,10,54,これは椅子に座っただけで感じてしまうかもな……,sound/data/pcm/c10/h/01.unity3d,h_so_10_03_293
294,10,54,我ががもっとエロくなったら、もっと中だししてくれるのか？,sound/data/pcm/c10/h/01.unity3d,h_so_10_03_294
295,10,54,今度するときは中出しで頼むぞ,sound/data/pcm/c10/h/01.unity3d,h_so_10_03_295
296,10,54,生はやはりお互い敏感になってしまうな,sound/data/pcm/c10/h/01.unity3d,h_so_10_03_296
297,10,54,生は最高に気持ちが高ぶるな,sound/data/pcm/c10/h/01.unity3d,h_so_10_03_297
298,10,54,さっき出したばっかりなのに、凄い量だな……,sound/data/pcm/c10/h/01.unity3d,h_so_10_03_298
299,10,54,汝の精液、しっかり子宮まで届いておるぞ,sound/data/pcm/c10/h/01.unity3d,h_so_10_03_299
300,10,54,ゴムの付け根から漏れでておらんか！？,sound/data/pcm/c10/h/01.unity3d,h_so_10_03_300
301,10,54,いつかゴムの限界を越えるのではないか？,sound/data/pcm/c10/h/01.unity3d,h_so_10_03_301
302,10,54,混ざりあった液……異常に興奮してしまうな……,sound/data/pcm/c10/h/01.unity3d,h_so_10_03_302
303,10,54,ふたりでイクとどちらが寂しい思いをせずにすむからよいな,sound/data/pcm/c10/h/01.unity3d,h_so_10_03_303
304,10,54,まだ結婚もしとらんのにこんなことをするなんて、我らは変態だな,sound/data/pcm/c10/h/01.unity3d,h_so_10_03_305
305,10,54,我は汝を満足させるときがくるのだろうか,sound/data/pcm/c10/h/01.unity3d,h_so_10_03_306
306,10,54,我は簡単にイッてしまう女ではないぞ、汝が上手すぎるのだ,sound/data/pcm/c10/h/01.unity3d,h_so_10_03_307
307,10,54,き、今日はもう勘弁してくれ,sound/data/pcm/c10/h/01.unity3d,h_so_10_03_308
308,10,54,お尻に汝の精子があるだけ興奮する,sound/data/pcm/c10/h/01.unity3d,h_so_10_03_309
309,10,54,なんど見ても汝の射精は楽しめるな,sound/data/pcm/c10/h/01.unity3d,h_so_10_03_310
310,10,54,はぁぁ、汝の精液の匂いでまた興奮してしまう,sound/data/pcm/c10/h/01.unity3d,h_so_10_03_311
311,10,54,これで本当に出し切ったのか？　汝は底が知れぬからな,sound/data/pcm/c10/h/01.unity3d,h_so_10_03_312
312,10,54,まだ中に残ってそうだな、吸い出してやろうか？,sound/data/pcm/c10/h/01.unity3d,h_so_10_03_313
313,10,54,早く下着を履いて、魔力放出を防がねば,sound/data/pcm/c10/h/01.unity3d,h_so_10_03_314
314,10,54,この恥ずかしい我を見てくれ……そして、興奮させてくれ,sound/data/pcm/c10/h/01.unity3d,h_so_10_03_315
