管理番号,大きい項目,中間項目,表示名,バンドルパス,ファイル名
0,32,44,いつもお元気ですね。,sound/data/pcm/c32/h/01.unity3d,h_so_32_02_000
1,32,44,たっぷり溜め込んでらっしゃるようで……,sound/data/pcm/c32/h/01.unity3d,h_so_32_02_001
2,32,44,沢山気持ちよくなりましょう。,sound/data/pcm/c32/h/01.unity3d,h_so_32_02_002
3,32,44,どのくらいでイケるでしょうね。,sound/data/pcm/c32/h/01.unity3d,h_so_32_02_003
4,32,44,この緊張感がまたいいんですよね。,sound/data/pcm/c32/h/01.unity3d,h_so_32_02_004
5,32,44,私はいつでも大丈夫ですので……,sound/data/pcm/c32/h/01.unity3d,h_so_32_02_005
6,32,44,生はいけません。きちんとゴムは付けましょう。,sound/data/pcm/c32/h/01.unity3d,h_so_32_02_006
7,32,44,子供が出来ると困りますので……ゴムの装着を。,sound/data/pcm/c32/h/01.unity3d,h_so_32_02_007
8,32,44,危険日なので、ゴムを付けて下さいね。,sound/data/pcm/c32/h/01.unity3d,h_so_32_02_008
9,32,44,ゴムがないと危ないので、今日は装着を。,sound/data/pcm/c32/h/01.unity3d,h_so_32_02_009
10,32,44,本当にお好きなんですね。いいですよ。,sound/data/pcm/c32/h/01.unity3d,h_so_32_02_010
11,32,44,お好きにおハメ下さい。,sound/data/pcm/c32/h/01.unity3d,h_so_32_02_011
12,32,44,ワガママを言ってもいいですか？　今はそっちではない方が嬉しいです。,sound/data/pcm/c32/h/01.unity3d,h_so_32_02_012
13,32,44,お断りしてもよろしいでしょうか？ あまりこちらにばかりハマられても困りますので,sound/data/pcm/c32/h/01.unity3d,h_so_32_02_013
14,32,44,ああっ、熱いです！　入ってくるぅ……,sound/data/pcm/c32/h/01.unity3d,h_so_32_02_014
15,32,44,あうっ、固くて太いのが……！,sound/data/pcm/c32/h/01.unity3d,h_so_32_02_015
16,32,44,押し入ってきました……！,sound/data/pcm/c32/h/01.unity3d,h_so_32_02_016
17,32,44,そんなにねじり込まずとも……,sound/data/pcm/c32/h/01.unity3d,h_so_32_02_017
18,32,44,ああ、幸せな瞬間です……,sound/data/pcm/c32/h/01.unity3d,h_so_32_02_018
19,32,44,私のアソコが、あなたの形に……,sound/data/pcm/c32/h/01.unity3d,h_so_32_02_019
20,32,44,ぎっちり咥えこんでいますでしょう？,sound/data/pcm/c32/h/01.unity3d,h_so_32_02_020
21,32,44,マイペースな方ですね。もう慣れましたが。,sound/data/pcm/c32/h/01.unity3d,h_so_32_02_021
22,32,44,びっくりしてアソコがキュッとしたじゃないですか。,sound/data/pcm/c32/h/01.unity3d,h_so_32_02_022
23,32,44,もうすっかり難なく入るようになってしまいましたね。,sound/data/pcm/c32/h/01.unity3d,h_so_32_02_023
24,32,44,ああ、お尻に心地の良い違和感です……,sound/data/pcm/c32/h/01.unity3d,h_so_32_02_024
25,32,44,意地悪はほどほどに、ですよ？,sound/data/pcm/c32/h/01.unity3d,h_so_32_02_025
26,32,44,あなたにはいつも驚かされます、もう……,sound/data/pcm/c32/h/01.unity3d,h_so_32_02_026
27,32,44,アソコ全体であなたを感じていますよ。,sound/data/pcm/c32/h/01.unity3d,h_so_32_02_027
28,32,44,ああ、本当に大きなあなた……,sound/data/pcm/c32/h/01.unity3d,h_so_32_02_028
29,32,44,このまま一生繋がっていたいですね。,sound/data/pcm/c32/h/01.unity3d,h_so_32_02_029
30,32,44,私のアナル、もうすっかりあなたの形になってしまいました。,sound/data/pcm/c32/h/01.unity3d,h_so_32_02_030
31,32,44,お尻の中であなたが大きくなっていますね。,sound/data/pcm/c32/h/01.unity3d,h_so_32_02_031
32,32,44,締め付け具合が丁度いいですか？,sound/data/pcm/c32/h/01.unity3d,h_so_32_02_032
33,32,44,抜ける瞬間もたまりませんね。,sound/data/pcm/c32/h/01.unity3d,h_so_32_02_033
34,32,44,また挿れなおすのですよね、わかります。,sound/data/pcm/c32/h/01.unity3d,h_so_32_02_034
35,32,44,寂しくなってしまうじゃないですか……,sound/data/pcm/c32/h/01.unity3d,h_so_32_02_035
36,32,44,出ました、ペニスが出ました。,sound/data/pcm/c32/h/01.unity3d,h_so_32_02_036
37,32,44,あまりそうされると、おトイレで感じてしまうじゃないですか……。,sound/data/pcm/c32/h/01.unity3d,h_so_32_02_037
38,32,44,抜く瞬間の気持ち良さを私に与えて下さったのですね。,sound/data/pcm/c32/h/01.unity3d,h_so_32_02_038
39,32,44,あなたの優しい愛を感じます。,sound/data/pcm/c32/h/01.unity3d,h_so_32_02_039
40,32,44,ずっと浸っていたい心地よさです。,sound/data/pcm/c32/h/01.unity3d,h_so_32_02_040
41,32,44,じっくり私のアソコを味わって下さいね。,sound/data/pcm/c32/h/01.unity3d,h_so_32_02_041
42,32,44,あ、そこ、いいですね、お上手です。,sound/data/pcm/c32/h/01.unity3d,h_so_32_02_042
43,32,44,どんどんエッチな気分になってきます。,sound/data/pcm/c32/h/01.unity3d,h_so_32_02_043
44,32,44,あなたの腰使い、最高です。,sound/data/pcm/c32/h/01.unity3d,h_so_32_02_044
45,32,44,お尻もゆっくり愛して下さるのですね。,sound/data/pcm/c32/h/01.unity3d,h_so_32_02_045
46,32,44,ああ、中をねっとりかき回されています。,sound/data/pcm/c32/h/01.unity3d,h_so_32_02_046
47,32,44,もっと奥までほじって下さい。,sound/data/pcm/c32/h/01.unity3d,h_so_32_02_047
48,32,44,お尻にも気持ちいい部分があるんですね。,sound/data/pcm/c32/h/01.unity3d,h_so_32_02_048
49,32,44,もっと色んなところをこすって下さい。,sound/data/pcm/c32/h/01.unity3d,h_so_32_02_049
50,32,44,好きなだけズボズボして下さい。,sound/data/pcm/c32/h/01.unity3d,h_so_32_02_050
51,32,44,だんだんと身体が熱く……,sound/data/pcm/c32/h/01.unity3d,h_so_32_02_051
52,32,44,感度増し増しです。,sound/data/pcm/c32/h/01.unity3d,h_so_32_02_052
53,32,44,一緒になんて……最高です。,sound/data/pcm/c32/h/01.unity3d,h_so_32_02_053
54,32,44,すごいテクニックですね。,sound/data/pcm/c32/h/01.unity3d,h_so_32_02_054
55,32,44,ああもう、強引な方ですね。,sound/data/pcm/c32/h/01.unity3d,h_so_32_02_055
56,32,44,どうしてもというのでしたら、どうぞ……,sound/data/pcm/c32/h/01.unity3d,h_so_32_02_056
57,32,44,そこまで良い反応ができず、すみません……,sound/data/pcm/c32/h/01.unity3d,h_so_32_02_057
58,32,44,そのうち感覚も変わってきますかね……,sound/data/pcm/c32/h/01.unity3d,h_so_32_02_058
59,32,44,ゆっくりなのに重くて、ゾクゾクします。,sound/data/pcm/c32/h/01.unity3d,h_so_32_02_059
60,32,44,奥まで届くたびに快感がせり上がってきます。,sound/data/pcm/c32/h/01.unity3d,h_so_32_02_060
61,32,44,もっと欲しいと愛液が溢れて止まりません。,sound/data/pcm/c32/h/01.unity3d,h_so_32_02_061
62,32,44,快感に、支配されてしまいます……,sound/data/pcm/c32/h/01.unity3d,h_so_32_02_062
63,32,44,私の中で、ペニスが暴れているのですね。,sound/data/pcm/c32/h/01.unity3d,h_so_32_02_063
64,32,44,本能の赴くままに突きまくって下さい。,sound/data/pcm/c32/h/01.unity3d,h_so_32_02_064
65,32,44,お尻から快感が……ゾクゾクします。,sound/data/pcm/c32/h/01.unity3d,h_so_32_02_065
66,32,44,もっとお尻にペニスを突き入れて下さい。,sound/data/pcm/c32/h/01.unity3d,h_so_32_02_066
67,32,44,あなたのペニスにジャストフィットしていますでしょう。,sound/data/pcm/c32/h/01.unity3d,h_so_32_02_067
68,32,44,まさかお尻でこんなに感じるようになるなんて。,sound/data/pcm/c32/h/01.unity3d,h_so_32_02_068
69,32,44,もっとお尻をほじくって下さい。,sound/data/pcm/c32/h/01.unity3d,h_so_32_02_069
70,32,44,お尻も大好きになってしまいました。,sound/data/pcm/c32/h/01.unity3d,h_so_32_02_070
71,32,44,私って結構エッチみたいです。,sound/data/pcm/c32/h/01.unity3d,h_so_32_02_071
72,32,44,どうぞもっと責めてください,sound/data/pcm/c32/h/01.unity3d,h_so_32_02_072
73,32,44,ああ、なんてテクニック……,sound/data/pcm/c32/h/01.unity3d,h_so_32_02_073
74,32,44,そんなにされては、淫らに落ちてしまいます……,sound/data/pcm/c32/h/01.unity3d,h_so_32_02_074
75,32,44,今はセックスだけに集中したいんです。,sound/data/pcm/c32/h/01.unity3d,h_so_32_02_075
76,32,44,そこまであなたがしたいのでしたら……いいですよ。,sound/data/pcm/c32/h/01.unity3d,h_so_32_02_076
77,32,44,ペニスでもっと突いて下さるなら、そこも、いいです……,sound/data/pcm/c32/h/01.unity3d,h_so_32_02_077
78,32,44,ピストン中ならまだ何とか……,sound/data/pcm/c32/h/01.unity3d,h_so_32_02_078
79,32,44,最高に幸せです。,sound/data/pcm/c32/h/01.unity3d,h_so_32_02_079
80,32,44,もっと舌を絡ませ合って……,sound/data/pcm/c32/h/01.unity3d,h_so_32_02_080
81,32,44,唾液をもっと下さい。,sound/data/pcm/c32/h/01.unity3d,h_so_32_02_081
82,32,44,上の口も濡れ濡れです。,sound/data/pcm/c32/h/01.unity3d,h_so_32_02_082
83,32,44,あなたの舌がとてもエロい……,sound/data/pcm/c32/h/01.unity3d,h_so_32_02_083
84,32,44,キスしながらなんて、贅沢ですね。,sound/data/pcm/c32/h/01.unity3d,h_so_32_02_084
85,32,44,キスももっと激しく……,sound/data/pcm/c32/h/01.unity3d,h_so_32_02_085
86,32,44,舌をペニスのようにねじ込んで……,sound/data/pcm/c32/h/01.unity3d,h_so_32_02_086
87,32,44,身体が火照って仕方ありません。,sound/data/pcm/c32/h/01.unity3d,h_so_32_02_087
88,32,44,子宮があなたを求めています。,sound/data/pcm/c32/h/01.unity3d,h_so_32_02_088
89,32,44,これはそろそろ絶頂の予感……,sound/data/pcm/c32/h/01.unity3d,h_so_32_02_089
90,32,44,あなたを離したくないと、締め付けが……,sound/data/pcm/c32/h/01.unity3d,h_so_32_02_090
91,32,44,あなたからもエッチな声が……,sound/data/pcm/c32/h/01.unity3d,h_so_32_02_091
92,32,44,息が荒いですね。いつでもイッてくれて構いませんよ。,sound/data/pcm/c32/h/01.unity3d,h_so_32_02_092
93,32,44,そろそろラストスパートですね。,sound/data/pcm/c32/h/01.unity3d,h_so_32_02_093
94,32,44,突かれるたびにエッチな響きが……,sound/data/pcm/c32/h/01.unity3d,h_so_32_02_094
95,32,44,お尻でもセックスが楽しめるなんて、贅沢ですよね。,sound/data/pcm/c32/h/01.unity3d,h_so_32_02_095
96,32,44,ああ、全身がビクビクします。,sound/data/pcm/c32/h/01.unity3d,h_so_32_02_096
97,32,44,意識が飛んでしまいそうです。,sound/data/pcm/c32/h/01.unity3d,h_so_32_02_097
98,32,44,アナルがもっと喜びたがっています。,sound/data/pcm/c32/h/01.unity3d,h_so_32_02_098
99,32,44,お尻で先にイッて頂いても構いませんよ。,sound/data/pcm/c32/h/01.unity3d,h_so_32_02_099
100,32,44,アナルもあなたお気に入りのスポットですから。,sound/data/pcm/c32/h/01.unity3d,h_so_32_02_100
101,32,44,強く擦れるのがまたいいですね。,sound/data/pcm/c32/h/01.unity3d,h_so_32_02_101
102,32,44,あなたが開発したお尻ですから、気兼ねすることはありません。,sound/data/pcm/c32/h/01.unity3d,h_so_32_02_102
103,32,44,ああ、もっと突いて下さい、イキそうなんです。,sound/data/pcm/c32/h/01.unity3d,h_so_32_02_103
104,32,44,もう我慢の限界で……セックス気持ちよすぎます！,sound/data/pcm/c32/h/01.unity3d,h_so_32_02_104
105,32,44,あなたと私、仲良く一緒にイキましょう！,sound/data/pcm/c32/h/01.unity3d,h_so_32_02_105
106,32,44,もっとお互いを求めあいながら……イキましょう！,sound/data/pcm/c32/h/01.unity3d,h_so_32_02_106
107,32,44,ええ、あなたの熱いお気持ちと共に受け入れますので。,sound/data/pcm/c32/h/01.unity3d,h_so_32_02_107
108,32,44,溜まってらっしゃるものは全て私に吐き出して下さい。,sound/data/pcm/c32/h/01.unity3d,h_so_32_02_108
109,32,44,あなたがそれでよろしいのでしたら……,sound/data/pcm/c32/h/01.unity3d,h_so_32_02_109
110,32,44,私に出ているところをお見せ頂けるのですね。,sound/data/pcm/c32/h/01.unity3d,h_so_32_02_110
111,32,44,中ですか、外ですか。私はどちらでも……,sound/data/pcm/c32/h/01.unity3d,h_so_32_02_111
112,32,44,その時の気分でお好きな方に出して下さい。,sound/data/pcm/c32/h/01.unity3d,h_so_32_02_112
113,32,44,あなたが達するのが先か、ゴムが弾けるのが先か……,sound/data/pcm/c32/h/01.unity3d,h_so_32_02_113
114,32,44,ゴムを押し付けるように……そうです、こすれて気持ちいいです。,sound/data/pcm/c32/h/01.unity3d,h_so_32_02_114
115,32,44,変態尻なので、もうイキそうです……！,sound/data/pcm/c32/h/01.unity3d,h_so_32_02_115
116,32,44,あなたのお尻責めが気持ちよすぎて……！,sound/data/pcm/c32/h/01.unity3d,h_so_32_02_116
117,32,44,一緒にもっと変態になりましょう……！,sound/data/pcm/c32/h/01.unity3d,h_so_32_02_117
118,32,44,仲良くアナルでイキましょう！,sound/data/pcm/c32/h/01.unity3d,h_so_32_02_118
119,32,44,どうぞ、私のお尻に出しきって下さい。,sound/data/pcm/c32/h/01.unity3d,h_so_32_02_119
120,32,44,沢山アナルをほじって気持ちよく出して下さいね。,sound/data/pcm/c32/h/01.unity3d,h_so_32_02_120
121,32,44,どんどん出て……私の中がいっぱいに……,sound/data/pcm/c32/h/01.unity3d,h_so_32_02_121
122,32,44,ペニスが波打っているのがわかります……！,sound/data/pcm/c32/h/01.unity3d,h_so_32_02_122
123,32,44,ゴム越しに感じられるのもイイものですね。,sound/data/pcm/c32/h/01.unity3d,h_so_32_02_123
124,32,44,ゴムの中であなたの元気な精子が暴れているのでしょうね。,sound/data/pcm/c32/h/01.unity3d,h_so_32_02_124
125,32,44,最後までお尻で受け止めてみせますよ……！,sound/data/pcm/c32/h/01.unity3d,h_so_32_02_125
126,32,44,射精の勢いまで伝わってきます……,sound/data/pcm/c32/h/01.unity3d,h_so_32_02_126
127,32,44,イクゥ！,sound/data/pcm/c32/h/01.unity3d,h_so_32_02_127
128,32,44,気持ちよすぎなのぉ！,sound/data/pcm/c32/h/01.unity3d,h_so_32_02_128
129,32,44,イクッ、イクゥゥゥ！！,sound/data/pcm/c32/h/01.unity3d,h_so_32_02_129
130,32,44,何も考えられないーっ！！,sound/data/pcm/c32/h/01.unity3d,h_so_32_02_130
131,32,44,私たち、身体の相性はもうバッチリですね……,sound/data/pcm/c32/h/01.unity3d,h_so_32_02_131
132,32,44,ゴムにも感謝ですね。あなたの精子を受け止めてくれたんですから。,sound/data/pcm/c32/h/01.unity3d,h_so_32_02_132
133,32,44,余韻を楽しみましょう……,sound/data/pcm/c32/h/01.unity3d,h_so_32_02_133
134,32,44,この熱さが……心地良いです,sound/data/pcm/c32/h/01.unity3d,h_so_32_02_134
135,32,44,あなたの赤ちゃんなら、できても……いえ、何でもありません。,sound/data/pcm/c32/h/01.unity3d,h_so_32_02_135
136,32,44,生で中出しする気持ちよさはたまりませんね……,sound/data/pcm/c32/h/01.unity3d,h_so_32_02_136
137,32,44,あなたが上手すぎるからですよ、もう……,sound/data/pcm/c32/h/01.unity3d,h_so_32_02_137
138,32,44,私のヨガる姿が見たかったのですね……満足頂けましたか？,sound/data/pcm/c32/h/01.unity3d,h_so_32_02_138
139,32,44,私をひとりにしないでいて下さって、ありがとうございます。,sound/data/pcm/c32/h/01.unity3d,h_so_32_02_139
140,32,44,あなたとお尻でイクと、背徳感がますます高まりますね……,sound/data/pcm/c32/h/01.unity3d,h_so_32_02_140
141,32,44,あなたのペニスの前では、恋するお尻になってしまいます……,sound/data/pcm/c32/h/01.unity3d,h_so_32_02_141
142,32,44,トイレに行った時に、また今のことを思い出してしまいます……,sound/data/pcm/c32/h/01.unity3d,h_so_32_02_142
143,32,44,ゴム越しでもあなたをすごく感じました……,sound/data/pcm/c32/h/01.unity3d,h_so_32_02_143
144,32,44,いつゴムが破れるかと、ヒヤヒヤしましたよ……,sound/data/pcm/c32/h/01.unity3d,h_so_32_02_144
145,32,44,これぞセックスですね……,sound/data/pcm/c32/h/01.unity3d,h_so_32_02_145
146,32,44,一緒に絶頂を迎える……なんて幸せなことでしょう……,sound/data/pcm/c32/h/01.unity3d,h_so_32_02_146
147,32,44,結果妊娠しても、私は構いません……,sound/data/pcm/c32/h/01.unity3d,h_so_32_02_147
148,32,44,今頃、子宮でお見合いでも始まっているかもしれませんね……,sound/data/pcm/c32/h/01.unity3d,h_so_32_02_148
149,32,44,あなたとのセックスの味がもうクセに……,sound/data/pcm/c32/h/01.unity3d,h_so_32_02_149
150,32,44,上達の秘訣を後で教えて下さいね……,sound/data/pcm/c32/h/01.unity3d,h_so_32_02_150
151,32,44,あなたのおかげで、敏感なお尻になってしまいました……,sound/data/pcm/c32/h/01.unity3d,h_so_32_02_151
152,32,44,私のアナル、もっともっと好きになって下さいね……,sound/data/pcm/c32/h/01.unity3d,h_so_32_02_152
153,32,44,お望みならば、これからも痴態を晒しますよ。,sound/data/pcm/c32/h/01.unity3d,h_so_32_02_153
154,32,44,私の変態アナルはお気に召して頂けていますか？,sound/data/pcm/c32/h/01.unity3d,h_so_32_02_154
155,32,44,ゴムの中に全部出せたようですね、安心しました。,sound/data/pcm/c32/h/01.unity3d,h_so_32_02_155
156,32,44,大丈夫です、ゴムを信じて……漏れた感じはありませんから。,sound/data/pcm/c32/h/01.unity3d,h_so_32_02_156
157,32,44,あなたを最後までイカせることができて嬉しいです……,sound/data/pcm/c32/h/01.unity3d,h_so_32_02_157
158,32,44,私はいいんです。あなたが気持ちよくなることが重要ですから。,sound/data/pcm/c32/h/01.unity3d,h_so_32_02_158
159,32,44,後のことなど、今はいいじゃありませんか。,sound/data/pcm/c32/h/01.unity3d,h_so_32_02_159
160,32,44,今は余韻に浸って下さい、余韻に。,sound/data/pcm/c32/h/01.unity3d,h_so_32_02_160
161,32,44,ゴムの安心感ってすごいと思いませんか？,sound/data/pcm/c32/h/01.unity3d,h_so_32_02_161
162,32,44,私たちの良識が、このゴムなのですね。,sound/data/pcm/c32/h/01.unity3d,h_so_32_02_162
163,32,44,あなたを直に感じられる喜びは、何物にも代えがたいものがあります。,sound/data/pcm/c32/h/01.unity3d,h_so_32_02_163
164,32,44,私の好物は生ペニスです。……冗談じゃありませんよ？,sound/data/pcm/c32/h/01.unity3d,h_so_32_02_164
165,32,44,危険日というスパイスがセックスを刺激的なものにするのですね。,sound/data/pcm/c32/h/01.unity3d,h_so_32_02_165
166,32,44,いけない遊びを覚えてしまいましたね、私たち……,sound/data/pcm/c32/h/01.unity3d,h_so_32_02_166
167,32,44,次はこの倍、あなたに尽くさせて頂きますね。,sound/data/pcm/c32/h/01.unity3d,h_so_32_02_167
168,32,44,あなたとあなたのペニスに最大限の感謝を。,sound/data/pcm/c32/h/01.unity3d,h_so_32_02_168
169,32,44,私のお尻、アナルセックスするたびに感度が増していく気がします。,sound/data/pcm/c32/h/01.unity3d,h_so_32_02_169
170,32,44,お尻に出すのと、アソコに出すの、どちらが気持ちいいのでしょうか？　後でじっくり聞かせて下さいね。,sound/data/pcm/c32/h/01.unity3d,h_so_32_02_170
171,32,44,これからもどうぞご自由にお使い下さいね。,sound/data/pcm/c32/h/01.unity3d,h_so_32_02_171
172,32,44,ペニスがビクビクして、すごくエッチです。,sound/data/pcm/c32/h/01.unity3d,h_so_32_02_172
173,32,44,ああ、とても興奮する光景です。,sound/data/pcm/c32/h/01.unity3d,h_so_32_02_173
174,32,44,精液が噴射する瞬間、スローモーションで何度でも見たいです。,sound/data/pcm/c32/h/01.unity3d,h_so_32_02_174
175,32,44,射精する瞬間だけでも軽くイケそうです。,sound/data/pcm/c32/h/01.unity3d,h_so_32_02_175
176,32,44,ギンギンのペニス、とてもエロティックでしたよ。,sound/data/pcm/c32/h/01.unity3d,h_so_32_02_176
177,32,44,ああ、もったいない……,sound/data/pcm/c32/h/01.unity3d,h_so_32_02_177
178,32,44,また沢山出しましたね……,sound/data/pcm/c32/h/01.unity3d,h_so_32_02_178
179,32,44,精液が中の壁を伝うのが、またくすぐったくて……,sound/data/pcm/c32/h/01.unity3d,h_so_32_02_179
180,32,44,あの、今の私、とてもエッチに見えますか……？,sound/data/pcm/c32/h/01.unity3d,h_so_32_02_180
181,32,44,もう少しだけ……一緒に楽しみませんか？,sound/data/pcm/c32/h/01.unity3d,h_so_32_02_181
182,32,44,まだ、物足りないのでは？,sound/data/pcm/c32/h/01.unity3d,h_so_32_02_182
183,32,44,また気持ちよくなって下さい。,sound/data/pcm/c32/h/01.unity3d,h_so_32_02_183
184,32,44,もうスルッと入りますよ。,sound/data/pcm/c32/h/01.unity3d,h_so_32_02_184
185,32,44,あ、ゴムをお忘れです。,sound/data/pcm/c32/h/01.unity3d,h_so_32_02_185
186,32,44,節度を持ちましょう。,sound/data/pcm/c32/h/01.unity3d,h_so_32_02_186
187,32,44,危険日だということをお忘れですか？,sound/data/pcm/c32/h/01.unity3d,h_so_32_02_187
188,32,44,安心して楽しみたいので……,sound/data/pcm/c32/h/01.unity3d,h_so_32_02_188
189,32,44,またお尻で気持ちよくなって下さい。,sound/data/pcm/c32/h/01.unity3d,h_so_32_02_189
190,32,44,沢山お尻を楽しんで下さいね。,sound/data/pcm/c32/h/01.unity3d,h_so_32_02_190
191,32,44,そこは営業休止中なんです。,sound/data/pcm/c32/h/01.unity3d,h_so_32_02_191
192,32,44,お尻がガバガバになってしまいますので……,sound/data/pcm/c32/h/01.unity3d,h_so_32_02_192
193,32,44,ああ、これですよこれ……,sound/data/pcm/c32/h/01.unity3d,h_so_32_02_193
194,32,44,またいちだんとお固いですね。,sound/data/pcm/c32/h/01.unity3d,h_so_32_02_194
195,32,44,もう、びっくりしました。,sound/data/pcm/c32/h/01.unity3d,h_so_32_02_195
196,32,44,心配せずとも、私は逃げたりしませんよ？,sound/data/pcm/c32/h/01.unity3d,h_so_32_02_196
197,32,44,あなた、もしかして絶倫なのでは……？,sound/data/pcm/c32/h/01.unity3d,h_so_32_02_197
198,32,44,またお尻を貫かれてしまいました……,sound/data/pcm/c32/h/01.unity3d,h_so_32_02_198
199,32,44,敏感なのですぐ感じてしまいます……,sound/data/pcm/c32/h/01.unity3d,h_so_32_02_199
200,32,44,なんとお尻ですか……,sound/data/pcm/c32/h/01.unity3d,h_so_32_02_200
201,32,44,サプライズですね……,sound/data/pcm/c32/h/01.unity3d,h_so_32_02_201
202,32,44,挿れているだけでイキそうです……,sound/data/pcm/c32/h/01.unity3d,h_so_32_02_202
203,32,44,ペニスのピクピクが気持ちいいです……,sound/data/pcm/c32/h/01.unity3d,h_so_32_02_203
204,32,44,お尻の感度が上がってきました……,sound/data/pcm/c32/h/01.unity3d,h_so_32_02_204
205,32,44,ずっぽり咥えていますよ。,sound/data/pcm/c32/h/01.unity3d,h_so_32_02_205
206,32,44,まさか飽きてしまいました？,sound/data/pcm/c32/h/01.unity3d,h_so_32_02_206
207,32,44,続けないのですか？,sound/data/pcm/c32/h/01.unity3d,h_so_32_02_207
208,32,44,挿れなおしますか？,sound/data/pcm/c32/h/01.unity3d,h_so_32_02_208
209,32,44,それも気持ちいいですが……,sound/data/pcm/c32/h/01.unity3d,h_so_32_02_209
210,32,44,ゆっくり焦らしているのですね。,sound/data/pcm/c32/h/01.unity3d,h_so_32_02_210
211,32,44,優しいあなた、とても素敵です。,sound/data/pcm/c32/h/01.unity3d,h_so_32_02_211
212,32,44,激しくしても大丈夫ですよ。,sound/data/pcm/c32/h/01.unity3d,h_so_32_02_212
213,32,44,好きなように動かして下さい。,sound/data/pcm/c32/h/01.unity3d,h_so_32_02_213
214,32,44,お尻まで優しくして下さるのですね。,sound/data/pcm/c32/h/01.unity3d,h_so_32_02_214
215,32,44,先ほどのプレイでもう出来上がっていますので……,sound/data/pcm/c32/h/01.unity3d,h_so_32_02_215
216,32,44,さっきよりもどうぞ激しく……！,sound/data/pcm/c32/h/01.unity3d,h_so_32_02_216
217,32,44,叩きつける感じでもいいですよ。,sound/data/pcm/c32/h/01.unity3d,h_so_32_02_217
218,32,44,とても力強いですね。,sound/data/pcm/c32/h/01.unity3d,h_so_32_02_218
219,32,44,遠慮せず、ガンガンどうぞ。,sound/data/pcm/c32/h/01.unity3d,h_so_32_02_219
220,32,44,あなたのペニスが暴れています。,sound/data/pcm/c32/h/01.unity3d,h_so_32_02_220
221,32,44,気持ち良さで意識が飛びそうに……,sound/data/pcm/c32/h/01.unity3d,h_so_32_02_221
222,32,44,もっとお尻をいじめて下さい。,sound/data/pcm/c32/h/01.unity3d,h_so_32_02_222
223,32,44,限界まで強くしてもいいですよ。,sound/data/pcm/c32/h/01.unity3d,h_so_32_02_223
224,32,44,これならすぐイキそうです。,sound/data/pcm/c32/h/01.unity3d,h_so_32_02_224
225,32,44,変態スイッチが入ってしまいます……,sound/data/pcm/c32/h/01.unity3d,h_so_32_02_225
226,32,44,そろそろイッてしまいそうです……！,sound/data/pcm/c32/h/01.unity3d,h_so_32_02_226
227,32,44,ああ、もう我慢が……,sound/data/pcm/c32/h/01.unity3d,h_so_32_02_227
228,32,44,またすごいのがきています……！,sound/data/pcm/c32/h/01.unity3d,h_so_32_02_228
229,32,44,もうイッてもいいですか……！,sound/data/pcm/c32/h/01.unity3d,h_so_32_02_229
230,32,44,もうそろそろイキそうなんですね。,sound/data/pcm/c32/h/01.unity3d,h_so_32_02_230
