管理番号,大きい項目,中間項目,表示名,バンドルパス,ファイル名
0,41,50,ボクのエッチなおつゆで溺れないでね、ふふふ……,sound/data/pcm/c41/h/71.unity3d,h_ka_41_03_000
1,41,50,もういろんなところがぐちょぐちょで、耐えられないよぉ,sound/data/pcm/c41/h/71.unity3d,h_ka_41_03_001
2,41,50,キミとエッチしたすぎて、ボクたまらなかったんだよ……,sound/data/pcm/c41/h/71.unity3d,h_ka_41_03_002
3,41,50,うん、何十回でも何百回でもご奉仕させて……,sound/data/pcm/c41/h/71.unity3d,h_ka_41_03_003
4,41,50,うん、満足するまでボクの身体で射精していいからね？,sound/data/pcm/c41/h/71.unity3d,h_ka_41_03_004
5,41,50,あ、先に言われちゃった。もう一回、ボクの中で気持ちよくなろう？,sound/data/pcm/c41/h/71.unity3d,h_ka_41_03_005
6,41,50,キミにそう言ってもらうと、それだけでイッちゃいそうになるよ……,sound/data/pcm/c41/h/71.unity3d,h_ka_41_03_006
7,41,50,キミを興奮させちゃうエッチな声が出ちゃうけど、それでいいなら攻めてほしいな,sound/data/pcm/c41/h/71.unity3d,h_ka_41_03_007
8,41,50,うん、して……？　キミとのセックスに期待しきってるから、凄く火照っちゃってるよ,sound/data/pcm/c41/h/71.unity3d,h_ka_41_03_008
9,41,50,ボクの身体はキミだけのものだから、好きにしていいよ……,sound/data/pcm/c41/h/71.unity3d,h_ka_41_03_009
10,41,50,あん、お腹がキュンってなっちゃった。上手にできたら後でご褒美ほしいな,sound/data/pcm/c41/h/71.unity3d,h_ka_41_03_010
11,41,50,ふふ、トロトロにしちゃうけど、それでもいい？,sound/data/pcm/c41/h/71.unity3d,h_ka_41_03_011
12,41,50,キミの腰が抜けちゃうぐらい頑張っちゃうね、ふふふっ,sound/data/pcm/c41/h/71.unity3d,h_ka_41_03_012
13,41,50,ふふ、一番ゾクゾクしちゃう快感の交換こ、しちゃおっか,sound/data/pcm/c41/h/71.unity3d,h_ka_41_03_013
14,41,50,うん、もう身体中が熱くって、キミのオチンポの禁断症状が出ちゃってるんだ……,sound/data/pcm/c41/h/71.unity3d,h_ka_41_03_014
15,41,50,ボクもキミのオチンポ欲しいよ、前からでも後ろからでもズブズブって挿れて……,sound/data/pcm/c41/h/71.unity3d,h_ka_41_03_015
16,41,50,ボクたちの末永いセックスライフの為に、ゴムは忘れずにね,sound/data/pcm/c41/h/71.unity3d,h_ka_41_03_016
17,41,50,今日中出しされたら赤ちゃんできちゃうから、ゴムは絶対にしてね、ふふふ,sound/data/pcm/c41/h/71.unity3d,h_ka_41_03_017
18,41,50,ボクのおまんこ、安全日だからナマ中出しOKだよ,sound/data/pcm/c41/h/71.unity3d,h_ka_41_03_018
19,41,50,せっかく恋人同士なんだし、オチンポとおまんこをナマで擦りつけ合っちゃう？,sound/data/pcm/c41/h/71.unity3d,h_ka_41_03_019
20,41,50,うん、もっとボクに欲情してくれるなら喜んで,sound/data/pcm/c41/h/71.unity3d,h_ka_41_03_020
21,41,50,いいよ、いっぱいエッチを楽しもう？,sound/data/pcm/c41/h/71.unity3d,h_ka_41_03_021
22,41,50,たくさん気持ちよくするから、エッチな声は我慢しないでいいからね,sound/data/pcm/c41/h/71.unity3d,h_ka_41_03_022
23,41,50,忘れられない快感をキミにプレゼントするね,sound/data/pcm/c41/h/71.unity3d,h_ka_41_03_023
24,41,50,キミのオチンポを好きにしちゃっていいの？　ふふふ、わかった,sound/data/pcm/c41/h/71.unity3d,h_ka_41_03_024
25,41,50,うん、キミを誘惑しちゃうね,sound/data/pcm/c41/h/71.unity3d,h_ka_41_03_025
26,41,50,今体勢を変えたら、おまんこのおつゆが垂れちゃうけど構わないよね？,sound/data/pcm/c41/h/71.unity3d,h_ka_41_03_026
27,41,50,いいよ、恥ずかしい方が感じちゃうもんね,sound/data/pcm/c41/h/71.unity3d,h_ka_41_03_027
28,41,50,キミって本当にスケベだよね、ボクも負けてないけれどっ,sound/data/pcm/c41/h/71.unity3d,h_ka_41_03_028
29,41,50,うん、キミの性感帯をいじくり倒しちゃうね,sound/data/pcm/c41/h/71.unity3d,h_ka_41_03_029
30,41,50,キミの弱いところをいっぱい弄っちゃうよ,sound/data/pcm/c41/h/71.unity3d,h_ka_41_03_030
31,41,50,エッチな涎をたくさん付けてあげるね,sound/data/pcm/c41/h/71.unity3d,h_ka_41_03_031
32,41,50,ちょっと待ってね。お口に唾液をいっぱい溜めちゃうから,sound/data/pcm/c41/h/71.unity3d,h_ka_41_03_032
33,41,50,今のボクのおっぱい、すごーくスケベだから気を付けてね、ふふふ,sound/data/pcm/c41/h/71.unity3d,h_ka_41_03_033
34,41,50,ボクもおっぱいで幸せにしてあげたいなって考えてたところだったんだ,sound/data/pcm/c41/h/71.unity3d,h_ka_41_03_034
35,41,50,もうエッチな声がもれちゃいそう店,sound/data/pcm/c41/h/71.unity3d,h_ka_41_03_035
36,41,50,キミもボクも……興奮してるのを全然隠せてないね,sound/data/pcm/c41/h/71.unity3d,h_ka_41_03_036
37,41,50,びっくりするぐらい気持ちよくするから、期待してね,sound/data/pcm/c41/h/71.unity3d,h_ka_41_03_037
38,41,50,キミのオチンポ、笑っちゃうぐらいガッチガチ。射精まで気持ちよく導いてあげるね,sound/data/pcm/c41/h/71.unity3d,h_ka_41_03_038
39,41,50,ボクのエッチなところ、どうなってる？　キミの愛撫で教えてほしいな,sound/data/pcm/c41/h/71.unity3d,h_ka_41_03_039
40,41,50,ボクの身体、すごくスケベでしょ。キミがこうさせてくれたんだよ,sound/data/pcm/c41/h/71.unity3d,h_ka_41_03_040
41,41,50,ボクのとろとろオマンコも、ひくひくアナルも、よく見えるよね？,sound/data/pcm/c41/h/71.unity3d,h_ka_41_03_041
42,41,50,この体勢になると自動的にお腹がキュンキュンするんだ、欲しがっちゃうんだよね,sound/data/pcm/c41/h/71.unity3d,h_ka_41_03_042
43,41,50,キミのオチンポピストンでボクの瞳孔がふわぁって開くところ、見ててね,sound/data/pcm/c41/h/71.unity3d,h_ka_41_03_043
44,41,50,ボクの中、熱くてヌルヌルでキツキツだから、覚悟してね,sound/data/pcm/c41/h/71.unity3d,h_ka_41_03_044
45,41,50,タマタマがカラッポになるまで、後ろからパンパン突いて……,sound/data/pcm/c41/h/71.unity3d,h_ka_41_03_045
46,41,50,キミのでっかい亀頭でボクの性感帯をえぐって……ムラムラしちゃってるの,sound/data/pcm/c41/h/71.unity3d,h_ka_41_03_046
47,41,50,こんな体位でしたら、スケベなおつゆが止まらなくなっちゃう、ふふふ,sound/data/pcm/c41/h/71.unity3d,h_ka_41_03_047
48,41,50,ふふふ、ボク知ってるんだから。恥ずかしいから気持ちいいんだよね,sound/data/pcm/c41/h/71.unity3d,h_ka_41_03_048
