管理番号,大きい項目,中間項目,表示名,バンドルパス,ファイル名
0,21,21,えへへ…えと……そんなに見たら、照れちゃうよ…,sound/data/pcm/c21/h/01.unity3d,h_ai_21_00_000
1,21,21,緊張してるの丸わかりだけど、許してね…,sound/data/pcm/c21/h/01.unity3d,h_ai_21_00_001
2,21,21,私の身体、変じゃないかな…,sound/data/pcm/c21/h/01.unity3d,h_ai_21_00_002
3,21,21,これがファーストキスの味…えへへ、一生忘れられない味だね♪,sound/data/pcm/c21/h/01.unity3d,h_ai_21_00_005
4,21,21,あう…キミとチューできるなんて、夢みたいだよ…,sound/data/pcm/c21/h/01.unity3d,h_ai_21_00_006
5,21,21,身体が…告白のときみたいに、熱いよ…,sound/data/pcm/c21/h/01.unity3d,h_ai_21_00_007
6,21,21,えへへ…もう一回、する？,sound/data/pcm/c21/h/01.unity3d,h_ai_21_00_008
7,21,21,あ…ごめんね、キスは恋人になってからがいいな…,sound/data/pcm/c21/h/01.unity3d,h_ai_21_00_015
8,21,21,ごめんね、OKしたのは私だけど、キスはまだ…,sound/data/pcm/c21/h/01.unity3d,h_ai_21_00_016
9,21,21,あ、うっ、えと…き、キスは恋人になってからー！,sound/data/pcm/c21/h/01.unity3d,h_ai_21_00_017
10,21,21,ひゃうっ、ちょ、ちょっとくすぐったいかも…,sound/data/pcm/c21/h/01.unity3d,h_ai_21_00_018
11,21,21,あ、待って…んんっ、変な感じぃ,sound/data/pcm/c21/h/01.unity3d,h_ai_21_00_019
12,21,21,やぁ、むずむず、しちゃう,sound/data/pcm/c21/h/01.unity3d,h_ai_21_00_020
13,21,21,うう、すごくエッチだよぉ…,sound/data/pcm/c21/h/01.unity3d,h_ai_21_00_021
14,21,21,ちょ、ちょっとだけ、怖い…,sound/data/pcm/c21/h/01.unity3d,h_ai_21_00_022
15,21,21,ひんっ、な、なにそこぉっ,sound/data/pcm/c21/h/01.unity3d,h_ai_21_00_023
16,21,21,ちょ、ちょっと待っ…ひううっ,sound/data/pcm/c21/h/01.unity3d,h_ai_21_00_024
17,21,21,きゃうっ！　そこ、ダメぇっ,sound/data/pcm/c21/h/01.unity3d,h_ai_21_00_025
18,21,21,先っぽ…そんなに触ったら、やだよぉ…,sound/data/pcm/c21/h/01.unity3d,h_ai_21_00_026
19,21,21,へ、変な声出ちゃうからダメぇ…,sound/data/pcm/c21/h/01.unity3d,h_ai_21_00_027
20,21,21,うあ、先っぽ、敏感すぎちゃう…,sound/data/pcm/c21/h/01.unity3d,h_ai_21_00_028
21,21,21,も、もうそこ、触っちゃうの？,sound/data/pcm/c21/h/01.unity3d,h_ai_21_00_029
22,21,21,うああ、アソコが、痺れちゃう…,sound/data/pcm/c21/h/01.unity3d,h_ai_21_00_030
23,21,21,ソコ、敏感だから優しく、あんっ♡,sound/data/pcm/c21/h/01.unity3d,h_ai_21_00_031
24,21,21,お、お尻なのに…私…おかしいのぉ,sound/data/pcm/c21/h/01.unity3d,h_ai_21_00_032
25,21,21,お尻なんかで、感じたくないのにぃ,sound/data/pcm/c21/h/01.unity3d,h_ai_21_00_033
26,21,21,そんなにお尻ばっかりしないで…恥ずかしいよぉ,sound/data/pcm/c21/h/01.unity3d,h_ai_21_00_034
27,21,21,（拒否して外される）ごめんね、はじめてだから、い、痛くて……,sound/data/pcm/c21/h/01.unity3d,h_ai_21_00_035
28,21,21,（拒否して外される）ダメ、無理ぃっ！,sound/data/pcm/c21/h/01.unity3d,h_ai_21_00_036
29,21,21,（拒否して外される）ご、ごめんね、男の子と違って、女の子ってあんまり頑丈じゃないんだ…,sound/data/pcm/c21/h/01.unity3d,h_ai_21_00_037
30,21,21,（拒否して外される）わわっ！？　そんな汚いところ触っちゃダメっ,sound/data/pcm/c21/h/01.unity3d,h_ai_21_00_038
31,21,21,（拒否して外される）えぇっ！？　そ、そこは違うよ？　お尻だよぉっ,sound/data/pcm/c21/h/01.unity3d,h_ai_21_00_039
32,21,21,（拒否して外される）ま、待って、いくらキミがエッチでもそこだけはだめぇっ！,sound/data/pcm/c21/h/01.unity3d,h_ai_21_00_040
33,21,21,（強すぎて拒否）ごめん、ちょっと怖くて……ごめんね,sound/data/pcm/c21/h/01.unity3d,h_ai_21_00_041
34,21,21,（強すぎて拒否）きっと刺激が強すぎるから…ほ、ほかの場所だったらいいよ？,sound/data/pcm/c21/h/01.unity3d,h_ai_21_00_042
35,21,21,（強すぎて拒否）そんなブルブル当てられたら身体が変になっちゃうよぉ,sound/data/pcm/c21/h/01.unity3d,h_ai_21_00_043
36,21,21,ふわぁ、私、男の子に揉まれちゃってるぅ,sound/data/pcm/c21/h/01.unity3d,h_ai_21_00_044
37,21,21,ど、どうかな？　ちゃんと柔らかい？,sound/data/pcm/c21/h/01.unity3d,h_ai_21_00_045
38,21,21,身体にはあまり自信ないけど、キミがよければいっぱい触っていいからね,sound/data/pcm/c21/h/01.unity3d,h_ai_21_00_046
39,21,21,ひゃんっ！　いきなりつついたらびっくりするよぉ,sound/data/pcm/c21/h/01.unity3d,h_ai_21_00_051
40,21,21,も～、いたずらっ子なんだからぁ,sound/data/pcm/c21/h/01.unity3d,h_ai_21_00_052
41,21,21,先っぽは敏感だからそっと触ってぇ,sound/data/pcm/c21/h/01.unity3d,h_ai_21_00_053
42,21,21,んん…触り方、エッチだなぁ,sound/data/pcm/c21/h/01.unity3d,h_ai_21_00_054
43,21,21,引っ張るのが、好きなのー？,sound/data/pcm/c21/h/01.unity3d,h_ai_21_00_055
44,21,21,えへへ、くすぐったいよぉ,sound/data/pcm/c21/h/01.unity3d,h_ai_21_00_056
45,21,21,ふえっ！？　そ、そこはダメだよぉ,sound/data/pcm/c21/h/01.unity3d,h_ai_21_00_057
46,21,21,こ、こらーっ！　どこ触ってるの！？,sound/data/pcm/c21/h/01.unity3d,h_ai_21_00_058
47,21,21,や、やだぁっ！　汚いよぉっ,sound/data/pcm/c21/h/01.unity3d,h_ai_21_00_059
48,21,21,あ、あ、そんなにこすったら、指に匂いがついちゃうよぉ,sound/data/pcm/c21/h/01.unity3d,h_ai_21_00_060
49,21,21,キミに触られるとジンジンするよぉ,sound/data/pcm/c21/h/01.unity3d,h_ai_21_00_061
50,21,21,アソコから身体が熱くなってくるのが、わかるよぉ,sound/data/pcm/c21/h/01.unity3d,h_ai_21_00_062
51,21,21,そんなところこすったらダメだよぉ,sound/data/pcm/c21/h/01.unity3d,h_ai_21_00_063
52,21,21,もぉ、本当に恥ずかしいんだからね？,sound/data/pcm/c21/h/01.unity3d,h_ai_21_00_064
53,21,21,もう…やめてって言っても聞かないんでしょ？　あまり触りすぎないでね,sound/data/pcm/c21/h/01.unity3d,h_ai_21_00_065
54,21,21,キミの指、本当に入っちゃったぁ,sound/data/pcm/c21/h/01.unity3d,h_ai_21_00_066
55,21,21,私のアソコ、変じゃないぃ？,sound/data/pcm/c21/h/01.unity3d,h_ai_21_00_067
56,21,21,うあっ、指の違和感、すごいよぉ,sound/data/pcm/c21/h/01.unity3d,h_ai_21_00_068
57,21,21,や、やあ～～～……,sound/data/pcm/c21/h/01.unity3d,h_ai_21_00_069
58,21,21,お尻、痛いのと熱いので変な感じぃ,sound/data/pcm/c21/h/01.unity3d,h_ai_21_00_070
59,21,21,待って…すごくキツイぃ,sound/data/pcm/c21/h/01.unity3d,h_ai_21_00_071
60,21,21,ま、漫画で見たやつだぁ……こんな、感じなんだね…,sound/data/pcm/c21/h/01.unity3d,h_ai_21_00_072
61,21,21,ごめんね、もっと強くしたいよね…でも、もうちょっと慣れるまで待ってね…,sound/data/pcm/c21/h/01.unity3d,h_ai_21_00_073
62,21,21,優しくしてくれて、ありがと……すぐ、気持ちよくなると思うからぁ,sound/data/pcm/c21/h/01.unity3d,h_ai_21_00_074
63,21,21,思ったより痛くないけど、違和感がすごいよぉ,sound/data/pcm/c21/h/01.unity3d,h_ai_21_00_075
64,21,21,ゆっくりなら、まだ、なんとか……,sound/data/pcm/c21/h/01.unity3d,h_ai_21_00_076
65,21,21,彼氏持ちの友達もこんなことしてるのかなぁ…,sound/data/pcm/c21/h/01.unity3d,h_ai_21_00_077
66,21,21,わ、私の身体って舐めても平気なのかなぁ,sound/data/pcm/c21/h/01.unity3d,h_ai_21_00_078
67,21,21,く、くすぐったいよぉっ,sound/data/pcm/c21/h/01.unity3d,h_ai_21_00_079
68,21,21,汗かいてるから汚いよぉ～,sound/data/pcm/c21/h/01.unity3d,h_ai_21_00_080
69,21,21,先っちょ敏感だから…うん、そういう風に優しくしてくれたら、大丈夫,sound/data/pcm/c21/h/01.unity3d,h_ai_21_00_081
70,21,21,キミの唾液で先っぽがスースーするよぉ,sound/data/pcm/c21/h/01.unity3d,h_ai_21_00_082
71,21,21,き、綺麗に洗ってきたから、いっぱい舐めて大丈夫だよぉ,sound/data/pcm/c21/h/01.unity3d,h_ai_21_00_083
72,21,21,いつも見てるキミの顔が、私の一番大事なところに収まって、ペロペロしてるなんてぇっ,sound/data/pcm/c21/h/01.unity3d,h_ai_21_00_084
73,21,21,お、お尻はダメだよぉっ！　だって、洗って、ないからぁ,sound/data/pcm/c21/h/01.unity3d,h_ai_21_00_085
74,21,21,そんなところ舐めたらキミが病気になっちゃうぅ,sound/data/pcm/c21/h/01.unity3d,h_ai_21_00_086
75,21,21,ちょ、ちょっとぉっ！？　や、やだぁっ！,sound/data/pcm/c21/h/01.unity3d,h_ai_21_00_087
76,21,21,お願い、やめてぇ…そんなことしたら、バチがあたっちゃうよぉっ,sound/data/pcm/c21/h/01.unity3d,h_ai_21_00_088
77,21,21,臭いし汚いからだめぇっ！　やだぁ、変な感じぃっ,sound/data/pcm/c21/h/01.unity3d,h_ai_21_00_089
78,21,21,これ、ブルブルしすぎだよぉっ、ま、待ってぇっ,sound/data/pcm/c21/h/01.unity3d,h_ai_21_00_090
79,21,21,そ、それぐらい優しく押し付けてくれたら、ちょうどいいかもぉっ,sound/data/pcm/c21/h/01.unity3d,h_ai_21_00_091
80,21,21,あまり、グリグリしちゃだめぇっ、刺激、強すぎちゃうっ,sound/data/pcm/c21/h/01.unity3d,h_ai_21_00_092
81,21,21,ち、乳首だめぇっ！　取れちゃうぅっ,sound/data/pcm/c21/h/01.unity3d,h_ai_21_00_093
82,21,21,こんなオモチャ使ってたら、赤ちゃんが吸えなくなっちゃうぐらい先っぽ膨らんじゃうぅっ,sound/data/pcm/c21/h/01.unity3d,h_ai_21_00_094
83,21,21,あ、アソコだめ、なにこれ、電気走ってるぅっ,sound/data/pcm/c21/h/01.unity3d,h_ai_21_00_095
84,21,21,気持ちいいと痛いがゴチャゴチャになっちゃってるぅっ,sound/data/pcm/c21/h/01.unity3d,h_ai_21_00_096
85,21,21,や、やっ、何か来ちゃうよぉっ,sound/data/pcm/c21/h/01.unity3d,h_ai_21_00_097
86,21,21,私、イッちゃうぅっ、あうっ、そんなに見ちゃダメぇっ,sound/data/pcm/c21/h/01.unity3d,h_ai_21_00_098
87,21,21,ごめんね、私、キミの目の前で恥ずかしい感じになっちゃうっ,sound/data/pcm/c21/h/01.unity3d,h_ai_21_00_099
88,21,21,だめっ、きちゃうぅぅっ,sound/data/pcm/c21/h/01.unity3d,h_ai_21_00_100
89,21,21,は、はじめてなのに、すごいの来て、行っちゃったぁ…,sound/data/pcm/c21/h/01.unity3d,h_ai_21_00_101
90,21,21,ま、待って……頭、真っ白で……,sound/data/pcm/c21/h/01.unity3d,h_ai_21_00_102
91,21,21,涙出ちゃったぁ……,sound/data/pcm/c21/h/01.unity3d,h_ai_21_00_103
92,21,21,もう一回？　うん、いいよ…息、整ってきたから…,sound/data/pcm/c21/h/01.unity3d,h_ai_21_00_104
93,21,21,ちょっとぐったりしちゃってるけど、キミがしたいならいくらでもしていいよ,sound/data/pcm/c21/h/01.unity3d,h_ai_21_00_105
94,21,21,さっきと違って、エッチな味がした気がする…恥ずかしいぃ,sound/data/pcm/c21/h/01.unity3d,h_ai_21_00_108
95,21,21,キミとだったら、いくらでもチューしたいよ,sound/data/pcm/c21/h/01.unity3d,h_ai_21_00_109
96,21,21,もっと…もっとキミとチューしたい…,sound/data/pcm/c21/h/01.unity3d,h_ai_21_00_110
97,21,21,キスしてるだけで満足しちゃいそう,sound/data/pcm/c21/h/01.unity3d,h_ai_21_00_111
98,21,21,あう…本当にごめんね、キスだけは待って…,sound/data/pcm/c21/h/01.unity3d,h_ai_21_00_118
99,21,21,キミの強引さは知ってるけど、キスだけは許してほしいな,sound/data/pcm/c21/h/01.unity3d,h_ai_21_00_119
100,21,21,ソコ、好きなのぉ？,sound/data/pcm/c21/h/01.unity3d,h_ai_21_00_120
101,21,21,今日はいっぱいしてくれるね,sound/data/pcm/c21/h/01.unity3d,h_ai_21_00_121
102,21,21,くすぐったいってばぁ,sound/data/pcm/c21/h/01.unity3d,h_ai_21_00_122
103,21,21,そこ、弱いんだってばぁ,sound/data/pcm/c21/h/01.unity3d,h_ai_21_00_123
104,21,21,こ、声でちゃうぅ,sound/data/pcm/c21/h/01.unity3d,h_ai_21_00_124
105,21,21,そんなにいじったら乳首取れちゃうよぉっ,sound/data/pcm/c21/h/01.unity3d,h_ai_21_00_125
106,21,21,も、もうだめぇ、今日のおっぱい、なんか変だから終わりぃっ,sound/data/pcm/c21/h/01.unity3d,h_ai_21_00_126
107,21,21,もう許してぇっ、歩いて帰れなくなっちゃうぅ,sound/data/pcm/c21/h/01.unity3d,h_ai_21_00_127
108,21,21,おしっこ出ちゃいそう、許してぇ、ダメぇっ,sound/data/pcm/c21/h/01.unity3d,h_ai_21_00_128
109,21,21,これ以上されたら、お尻の穴がおかしくなっちゃうよぉ,sound/data/pcm/c21/h/01.unity3d,h_ai_21_00_129
110,21,21,変態さんにさせようとしてるのぉ？　恥ずかしいよぉ,sound/data/pcm/c21/h/01.unity3d,h_ai_21_00_130
111,21,21,（拒否）やっぱり、激しすぎるかな、弱くてごめんね,sound/data/pcm/c21/h/01.unity3d,h_ai_21_00_131
112,21,21,（拒否）あんまり強くすると痛いから優しくしてぇ,sound/data/pcm/c21/h/01.unity3d,h_ai_21_00_132
113,21,21,（拒否）だからお尻はダメなのぉ,sound/data/pcm/c21/h/01.unity3d,h_ai_21_00_133
114,21,21,（拒否）今日は…その、処理？　してないからダメなのぉ,sound/data/pcm/c21/h/01.unity3d,h_ai_21_00_134
115,21,21,（拒否）ごめんね、振動が強すぎるから、もっと慎重にやってぇ,sound/data/pcm/c21/h/01.unity3d,h_ai_21_00_135
116,21,21,（拒否）今日はダメなの、許して、お願い！,sound/data/pcm/c21/h/01.unity3d,h_ai_21_00_136
117,21,21,そんなにもみもみするなら、ちゃんと毎日お肌のケアしようかなぁ？,sound/data/pcm/c21/h/01.unity3d,h_ai_21_00_137
118,21,21,んもう、くすぐったいってばぁ、揉みすぎっ,sound/data/pcm/c21/h/01.unity3d,h_ai_21_00_138
119,21,21,あんまり突いたら乳首潰れちゃうよぉっ,sound/data/pcm/c21/h/01.unity3d,h_ai_21_00_143
120,21,21,こんなにつっついて乳首の色が濃くなったりしないかなぁ…,sound/data/pcm/c21/h/01.unity3d,h_ai_21_00_144
121,21,21,ゾクゾクして気持ちいいけど、おっぱい垂れちゃうよぉ,sound/data/pcm/c21/h/01.unity3d,h_ai_21_00_145
122,21,21,あんまり引っ張ったら乳首がエッチな形になっちゃうってばぁ,sound/data/pcm/c21/h/01.unity3d,h_ai_21_00_146
123,21,21,キミがお尻好きなのはわかったから、あまりいじらないでぇ,sound/data/pcm/c21/h/01.unity3d,h_ai_21_00_147
124,21,21,大切なところなんだから、触りすぎは禁止だよぉ…,sound/data/pcm/c21/h/01.unity3d,h_ai_21_00_148
125,21,21,それぐらい優しくしてくれるなら、平気ぃ…今、すごく敏感になってるよぉ,sound/data/pcm/c21/h/01.unity3d,h_ai_21_00_149
126,21,21,私のアソコ疲れちゃってるみたいだけど、キミが触りたいならいいよぉ,sound/data/pcm/c21/h/01.unity3d,h_ai_21_00_150
127,21,21,お尻ってそんなに触っちゃダメなところなのにぃ,sound/data/pcm/c21/h/01.unity3d,h_ai_21_00_151
128,21,21,もぉわかったよぉ。キミがしたいなら私もイヤって言えないもん,sound/data/pcm/c21/h/01.unity3d,h_ai_21_00_152
129,21,21,アソコもうグチュグチュだよぉ,sound/data/pcm/c21/h/01.unity3d,h_ai_21_00_153
130,21,21,うう、指すぐ入っちゃうの恥ずかしい～,sound/data/pcm/c21/h/01.unity3d,h_ai_21_00_154
131,21,21,また入れちゃうのぉ？　少し慣れてきたけど、恥ずかしさは倍増してるよぉ,sound/data/pcm/c21/h/01.unity3d,h_ai_21_00_155
132,21,21,そっちの穴はもういいのにぃ,sound/data/pcm/c21/h/01.unity3d,h_ai_21_00_156
133,21,21,そんなに掻きまわしたら拡がっちゃうぅっ,sound/data/pcm/c21/h/01.unity3d,h_ai_21_00_157
134,21,21,だめぇ、クチュクチュ音しちゃうの恥ずかしいよぉ,sound/data/pcm/c21/h/01.unity3d,h_ai_21_00_158
135,21,21,さっきのでほぐれてるけど、もうちょっと優しくしてぇっ,sound/data/pcm/c21/h/01.unity3d,h_ai_21_00_159
136,21,21,ちょっと痛いけど、キミが興奮するなら…我慢するよぉ,sound/data/pcm/c21/h/01.unity3d,h_ai_21_00_160
137,21,21,うう、そこ敏感になってるよぉ,sound/data/pcm/c21/h/01.unity3d,h_ai_21_00_161
138,21,21,ぴりぴりって痺れちゃうぅ,sound/data/pcm/c21/h/01.unity3d,h_ai_21_00_162
139,21,21,やだぁ、さっきより立ってるから、変な感じだよぉ,sound/data/pcm/c21/h/01.unity3d,h_ai_21_00_163
140,21,21,そんなに乳首舐めてもおっぱいは出ないからねぇ？,sound/data/pcm/c21/h/01.unity3d,h_ai_21_00_164
141,21,21,だめぇ、すごく濡れちゃってるから恥ずかしいよぉ,sound/data/pcm/c21/h/01.unity3d,h_ai_21_00_165
142,21,21,今蒸れちゃってるからだめぇ。ぺろぺろ禁止ぃ,sound/data/pcm/c21/h/01.unity3d,h_ai_21_00_166
143,21,21,また舐めるぅ…そこは一番舐めちゃいけないところなのにぃ,sound/data/pcm/c21/h/01.unity3d,h_ai_21_00_167
144,21,21,心配だから、ちゃんと後でうがいしてね…,sound/data/pcm/c21/h/01.unity3d,h_ai_21_00_168
145,21,21,さっきの舌の感覚がまだ残ってるから、入れちゃだめぇっ,sound/data/pcm/c21/h/01.unity3d,h_ai_21_00_169
146,21,21,キミは興奮するかもしれないけど、汚いってばぁ,sound/data/pcm/c21/h/01.unity3d,h_ai_21_00_170
147,21,21,またイッちゃいそうっ、私、エッチな子になっちゃうぅっ,sound/data/pcm/c21/h/01.unity3d,h_ai_21_00_171
148,21,21,連続でイカされちゃうっ、まだエッチ一年生なのにぃっ,sound/data/pcm/c21/h/01.unity3d,h_ai_21_00_172
149,21,21,はじめてなのに…何回もイッちゃったぁ,sound/data/pcm/c21/h/01.unity3d,h_ai_21_00_173
150,21,21,キミって、本当にエッチが上手なんだね…私は全然だから、これから色々教えてね,sound/data/pcm/c21/h/01.unity3d,h_ai_21_00_174
