管理番号,大きい項目,中間項目,表示名,バンドルパス,ファイル名
209,01,44,あなたの、抜けちゃいました……,sound/data/pcm/c01/h/01.unity3d,h_so_01_02_209
210,01,44,ゆっくりも……いいですよね,sound/data/pcm/c01/h/01.unity3d,h_so_01_02_210
211,01,44,優しくされると、胸が幸せでいっぱいになります,sound/data/pcm/c01/h/01.unity3d,h_so_01_02_211
212,01,44,激しくしても……いいですよ,sound/data/pcm/c01/h/01.unity3d,h_so_01_02_212
213,01,44,ガンガン、かき回してください,sound/data/pcm/c01/h/01.unity3d,h_so_01_02_213
214,01,44,んんぅ……お尻、意識しなくても反応してしまいます,sound/data/pcm/c01/h/01.unity3d,h_so_01_02_214
215,01,44,そんなふうに優しくされるの、好きです,sound/data/pcm/c01/h/01.unity3d,h_so_01_02_215
216,01,44,やぁんっ、お尻勝手に動いちゃいます,sound/data/pcm/c01/h/01.unity3d,h_so_01_02_216
217,01,44,もう、我慢できない……かも……,sound/data/pcm/c01/h/01.unity3d,h_so_01_02_217
218,01,44,おちんちん、ぐいぐいって……来てますぅ,sound/data/pcm/c01/h/01.unity3d,h_so_01_02_218
219,01,44,私のおまんこ、どうですか？　さっきよりもっと、感じられてますか？,sound/data/pcm/c01/h/01.unity3d,h_so_01_02_219
220,01,44,ああぁ……おちんちん、すごく気持ち良さそう……,sound/data/pcm/c01/h/01.unity3d,h_so_01_02_220
221,01,44,エッチなおまんこ、悦んでますぅ,sound/data/pcm/c01/h/01.unity3d,h_so_01_02_221
222,01,44,お尻の中で、おちんちん……びくびく跳ねてますね,sound/data/pcm/c01/h/01.unity3d,h_so_01_02_222
223,01,44,こちらの穴で……たくさん感じてくださいね……？,sound/data/pcm/c01/h/01.unity3d,h_so_01_02_223
224,01,44,穴を締めて……んっ、いっぱい気持ち良くしちゃいます,sound/data/pcm/c01/h/01.unity3d,h_so_01_02_224
225,01,44,あああぁ……おちんちん、もっともっと硬くなってる……,sound/data/pcm/c01/h/01.unity3d,h_so_01_02_225
226,01,44,ま、また……飛んでしまいそうに……,sound/data/pcm/c01/h/01.unity3d,h_so_01_02_226
227,01,44,はぁん！　また、来てしまいそう……,sound/data/pcm/c01/h/01.unity3d,h_so_01_02_227
228,01,44,すごい波が、来そうです……！,sound/data/pcm/c01/h/01.unity3d,h_so_01_02_228
229,01,44,またあなたに、おかしくさせられてしまいそうですね,sound/data/pcm/c01/h/01.unity3d,h_so_01_02_229
230,01,44,いつでも、イッていいですからね。また、濃い精液をたくさん出してください,sound/data/pcm/c01/h/01.unity3d,h_so_01_02_230
231,01,44,おちんちんが何度も震えて……そろそろですか？,sound/data/pcm/c01/h/01.unity3d,h_so_01_02_231
232,01,44,もっと……もっとじゅぽじゅぽって、してください！,sound/data/pcm/c01/h/01.unity3d,h_so_01_02_232
233,01,44,このまま、私が射精まで導いて差し上げますね,sound/data/pcm/c01/h/01.unity3d,h_so_01_02_233
234,01,44,ああぁ……お尻、ますます感じるように……,sound/data/pcm/c01/h/01.unity3d,h_so_01_02_234
235,01,44,お尻、もっと深くまで……来てくださいぃ,sound/data/pcm/c01/h/01.unity3d,h_so_01_02_235
236,01,44,ずんずんって、突かれて……やぁんっ,sound/data/pcm/c01/h/01.unity3d,h_so_01_02_236
237,01,44,お尻の穴におちんちん、すごいですぅっ,sound/data/pcm/c01/h/01.unity3d,h_so_01_02_237
238,01,44,おちんちんが、どんどん気持ち良くなっているの……伝わってきますよ,sound/data/pcm/c01/h/01.unity3d,h_so_01_02_238
239,01,44,お尻でたくさん感じてくれて、私……嬉しいですっ,sound/data/pcm/c01/h/01.unity3d,h_so_01_02_239
240,01,44,このまま……出してしまっていいですよ……お尻の奥深くに,sound/data/pcm/c01/h/01.unity3d,h_so_01_02_240
241,01,44,お尻、グチュグチュ言ってます……おまんこみたいに、ぐちゅぐちゅって,sound/data/pcm/c01/h/01.unity3d,h_so_01_02_241
242,01,44,イッちゃいそう……また、飛んじゃいそう……！,sound/data/pcm/c01/h/01.unity3d,h_so_01_02_242
243,01,44,頭の中、気持ち良さでいっぱい……もう、イクぅ,sound/data/pcm/c01/h/01.unity3d,h_so_01_02_243
244,01,44,あなたと、一緒に……！,sound/data/pcm/c01/h/01.unity3d,h_so_01_02_244
245,01,44,一緒にイキましょう……っ,sound/data/pcm/c01/h/01.unity3d,h_so_01_02_245
246,01,44,嬉しいです。どうぞ、中で思い切り気持ち良くなってください,sound/data/pcm/c01/h/01.unity3d,h_so_01_02_246
247,01,44,たくさん、びゅーびゅしてくださいね？,sound/data/pcm/c01/h/01.unity3d,h_so_01_02_247
248,01,44,今度も、遠慮せずにいっぱい射精してほしいです,sound/data/pcm/c01/h/01.unity3d,h_so_01_02_248
249,01,44,私の体を使って、どうぞ何度でもイッてくださいぃ！,sound/data/pcm/c01/h/01.unity3d,h_so_01_02_249
250,01,44,おちんちん、膨らんでます,sound/data/pcm/c01/h/01.unity3d,h_so_01_02_250
251,01,44,おちんちんが、またぐぅって大きく……,sound/data/pcm/c01/h/01.unity3d,h_so_01_02_251
252,01,44,また一段と、激しくぅ,sound/data/pcm/c01/h/01.unity3d,h_so_01_02_252
253,01,44,ゴム付きおちんちんで、ガクガクにされちゃってます,sound/data/pcm/c01/h/01.unity3d,h_so_01_02_253
254,01,44,もう、ダメですぅ……お尻、イッちゃいそう,sound/data/pcm/c01/h/01.unity3d,h_so_01_02_254
255,01,44,お尻、もう我慢できません……！,sound/data/pcm/c01/h/01.unity3d,h_so_01_02_255
256,01,44,あ、あなたも一緒に……,sound/data/pcm/c01/h/01.unity3d,h_so_01_02_256
257,01,44,お尻に出してくださいっ。そうしたら私も……,sound/data/pcm/c01/h/01.unity3d,h_so_01_02_257
258,01,44,お尻の穴から溢れるくらい、どぴゅどぴゅしてください,sound/data/pcm/c01/h/01.unity3d,h_so_01_02_258
259,01,44,精子、お尻に吐き出してくださいぃ,sound/data/pcm/c01/h/01.unity3d,h_so_01_02_259
260,01,44,先程よりも、もっと激しくびくびくと……,sound/data/pcm/c01/h/01.unity3d,h_so_01_02_260
261,01,44,はあぁぁ……おちんちん、とても気持ち良さそう……,sound/data/pcm/c01/h/01.unity3d,h_so_01_02_261
262,01,44,ゴムの中に吐き出されてるの、ちゃんとわかりますよ,sound/data/pcm/c01/h/01.unity3d,h_so_01_02_262
263,01,44,びくびくってして、何度も射精してますぅ,sound/data/pcm/c01/h/01.unity3d,h_so_01_02_263
264,01,44,まだこんなに出るなんて……お尻、壊れちゃいますよぉ,sound/data/pcm/c01/h/01.unity3d,h_so_01_02_264
265,01,44,ああぁ……お尻の中で、精子が暴れまわっているみたいです,sound/data/pcm/c01/h/01.unity3d,h_so_01_02_265
266,01,44,ダメ、イッくぅぅぅぅ！,sound/data/pcm/c01/h/01.unity3d,h_so_01_02_266
267,01,44,きゃはああぁぁぁんっ！！,sound/data/pcm/c01/h/01.unity3d,h_so_01_02_267
268,01,44,目の前、真っ白になっちゃいますぅぅぅぅ！,sound/data/pcm/c01/h/01.unity3d,h_so_01_02_268
269,01,44,もうらめぇぇぇぇぇっ！！,sound/data/pcm/c01/h/01.unity3d,h_so_01_02_269
270,01,44,途中から、ゴムを付けてるの忘れてしまうくらい気持ち良かったです,sound/data/pcm/c01/h/01.unity3d,h_so_01_02_270
271,01,44,ゴムありエッチでも、おちんちんの凶暴さは変わりませんね,sound/data/pcm/c01/h/01.unity3d,h_so_01_02_271
272,01,44,肌を重ねて、共に達して……素晴らしい時間ですね,sound/data/pcm/c01/h/01.unity3d,h_so_01_02_272
273,01,44,エッチを通じて、愛情が益々大きくなりますね,sound/data/pcm/c01/h/01.unity3d,h_so_01_02_273
274,01,44,とっても、しあわせ……れすぅ……（ろれつが回っていません）,sound/data/pcm/c01/h/01.unity3d,h_so_01_02_274
275,01,44,満たされすぎて、怖いくらいですね,sound/data/pcm/c01/h/01.unity3d,h_so_01_02_275
276,01,44,はあぁ……悔しいですけど、とても気持ち良くイカされちゃいました……,sound/data/pcm/c01/h/01.unity3d,h_so_01_02_276
277,01,44,あれほど激しくイッてしまうなんて……あなたのテクニックは恐ろしいです,sound/data/pcm/c01/h/01.unity3d,h_so_01_02_277
278,01,44,お尻の気持ち良さにすっかり目覚めてしまいました,sound/data/pcm/c01/h/01.unity3d,h_so_01_02_278
279,01,44,おまんことは違う快感が、癖になりそうです,sound/data/pcm/c01/h/01.unity3d,h_so_01_02_279
280,01,44,私ももう、れっきとした変態さんですね……,sound/data/pcm/c01/h/01.unity3d,h_so_01_02_280
281,01,44,まだ興奮が収まりません……アナルエッチ、恐るべしです,sound/data/pcm/c01/h/01.unity3d,h_so_01_02_281
282,01,44,射精と一緒にイクのが、一番気持ちいいですね……,sound/data/pcm/c01/h/01.unity3d,h_so_01_02_282
283,01,44,あなたとだから、こんなに幸せなエッチができるのだと思います,sound/data/pcm/c01/h/01.unity3d,h_so_01_02_283
284,01,44,直接感じるおちんちん、気持ち良かったです……,sound/data/pcm/c01/h/01.unity3d,h_so_01_02_284
285,01,44,生でするエッチは格別ですね,sound/data/pcm/c01/h/01.unity3d,h_so_01_02_285
286,01,44,全身で、あなたのことを感じられました,sound/data/pcm/c01/h/01.unity3d,h_so_01_02_286
287,01,44,おまんこ、まだヒクヒクしています,sound/data/pcm/c01/h/01.unity3d,h_so_01_02_287
288,01,44,イかされる＝愛されていると、最近は感じるんです,sound/data/pcm/c01/h/01.unity3d,h_so_01_02_288
289,01,44,また激しくイかされてしまいましたぁ,sound/data/pcm/c01/h/01.unity3d,h_so_01_02_289
290,01,44,まだ、お尻がガクガクしてますよぉ,sound/data/pcm/c01/h/01.unity3d,h_so_01_02_290
291,01,44,お尻、最高でした……,sound/data/pcm/c01/h/01.unity3d,h_so_01_02_291
292,01,44,しばらく立ち上がれないかもしれません……,sound/data/pcm/c01/h/01.unity3d,h_so_01_02_292
293,01,44,お尻で達するの、気持ち良すぎて……はうぅ,sound/data/pcm/c01/h/01.unity3d,h_so_01_02_293
294,01,44,びくんびくんと、先程より気持ちよさそうに震えていましたよ,sound/data/pcm/c01/h/01.unity3d,h_so_01_02_294
295,01,44,ゴム越しなのに、妊娠させるくらいの勢いで射精していましたよ？,sound/data/pcm/c01/h/01.unity3d,h_so_01_02_295
296,01,44,おちんちん、やはり中でイクのが気持ちいいですか？,sound/data/pcm/c01/h/01.unity3d,h_so_01_02_296
297,01,44,中出しされると、より火照ってしまいます……,sound/data/pcm/c01/h/01.unity3d,h_so_01_02_297
298,01,44,精液、きっと子宮に流れ込んでいますよ,sound/data/pcm/c01/h/01.unity3d,h_so_01_02_298
299,01,44,おまんこも、中出しされてとても喜んでいます,sound/data/pcm/c01/h/01.unity3d,h_so_01_02_299
300,01,44,ゴムありでも、精液の熱さと勢いはしっかり感じられますよ,sound/data/pcm/c01/h/01.unity3d,h_so_01_02_300
301,01,44,おちんちん、本当に元気ですね,sound/data/pcm/c01/h/01.unity3d,h_so_01_02_301
302,01,44,繋がっているところ、ぐちょぐちょですぅ,sound/data/pcm/c01/h/01.unity3d,h_so_01_02_302
303,01,44,中出しエッチでトロトロになっちゃいましたぁ,sound/data/pcm/c01/h/01.unity3d,h_so_01_02_303
304,01,44,イケナイ事の方が快楽は強い、ということなのでしょうか,sound/data/pcm/c01/h/01.unity3d,h_so_01_02_304
305,01,44,またしましょうね？　危険日の中出しエッチ,sound/data/pcm/c01/h/01.unity3d,h_so_01_02_305
306,01,44,エッチ、やはり気持ち良すぎです……でも、次はあなたと一緒に……,sound/data/pcm/c01/h/01.unity3d,h_so_01_02_306
307,01,44,一人でイクのは……少し寂しいかもしれません,sound/data/pcm/c01/h/01.unity3d,h_so_01_02_307
308,01,44,お尻も愛してくれて、ありがとうございます,sound/data/pcm/c01/h/01.unity3d,h_so_01_02_308
309,01,44,あなたが出してくれるなら、どこでも嬉しいです,sound/data/pcm/c01/h/01.unity3d,h_so_01_02_309
310,01,44,おちんちん、嬉しそうに射精してます……,sound/data/pcm/c01/h/01.unity3d,h_so_01_02_310
311,01,44,はあぁ……おちんちん、とっても気持ちよさそうです,sound/data/pcm/c01/h/01.unity3d,h_so_01_02_311
312,01,44,いつも中出しだと、飽きてしまいますか？……なんて、冗談ですよ♪,sound/data/pcm/c01/h/01.unity3d,h_so_01_02_312
313,01,44,次は、おまんこにほしいです,sound/data/pcm/c01/h/01.unity3d,h_so_01_02_313
314,01,44,あ……精液が零れて……もったいないです,sound/data/pcm/c01/h/01.unity3d,h_so_01_02_314
315,01,44,お尻から、精液零れてしまってます……,sound/data/pcm/c01/h/01.unity3d,h_so_01_02_315
316,01,44,（開始時台詞）大丈夫です……プールの中でも、あなたを満足させてみせます,sound/data/pcm/c01/h/01.unity3d,h_so_01_02_316
317,01,44,（開始時台詞）下から見られてしまいそうですね……恥ずかしいことなのに興奮しちゃうのは、何故なんでしょう？,sound/data/pcm/c01/h/01.unity3d,h_so_01_02_317
