管理番号,大きい項目,中間項目,表示名,バンドルパス,ファイル名
0,38,42,ふふ、おちんちんが期待に震えていますよ？,sound/data/pcm/c38/h/01.unity3d,h_hh_38_02_000
1,38,42,貴方は感じる事だけ考えください、あとは全て私に、お任せを,sound/data/pcm/c38/h/01.unity3d,h_hh_38_02_001
2,38,42,本日は、どのようなご奉仕をご所望ですか？,sound/data/pcm/c38/h/01.unity3d,h_hh_38_02_002
3,38,42,もどかしいですか？　すぐにそれが良くなりますよ……,sound/data/pcm/c38/h/01.unity3d,h_hh_38_02_003
4,38,42,貴方の可愛い声、もっと聞かせてください……,sound/data/pcm/c38/h/01.unity3d,h_hh_38_02_004
5,38,42,急がば回れですよ……じっくり感じてください,sound/data/pcm/c38/h/01.unity3d,h_hh_38_02_005
6,38,42,激しくすると、すぐに情けない声が出てしまいますねっ,sound/data/pcm/c38/h/01.unity3d,h_hh_38_02_006
7,38,42,おちんちん、もうたまらなくなっていますか？,sound/data/pcm/c38/h/01.unity3d,h_hh_38_02_007
8,38,42,ふふっ、先走りが、漏れてきてしまいましたよ……,sound/data/pcm/c38/h/01.unity3d,h_hh_38_02_008
9,38,42,んっ、貴方の味が一番濃い部分……とても美味しいです……,sound/data/pcm/c38/h/01.unity3d,h_hh_38_02_009
10,38,42,おちんちん、ゆっくり味あわせて頂きますね……,sound/data/pcm/c38/h/01.unity3d,h_hh_38_02_010
11,38,42,あっ、どうしても唾が飛んでしまいますねっ、ご容赦ください……,sound/data/pcm/c38/h/01.unity3d,h_hh_38_02_011
12,38,42,唾液でおちんちんべちゃべちゃにされて、気持ちいいですか？,sound/data/pcm/c38/h/01.unity3d,h_hh_38_02_012
13,38,42,お口、もっと激しい方が、お好みですか？,sound/data/pcm/c38/h/01.unity3d,h_hh_38_02_013
14,38,42,お口の中で、ねっとり溶かしてさしあげますね……,sound/data/pcm/c38/h/01.unity3d,h_hh_38_02_014
15,38,42,貴方のおちんちん、熱くなってきました……,sound/data/pcm/c38/h/01.unity3d,h_hh_38_02_015
16,38,42,ぢゅずっ、我慢汁……全部飲んでしまいますね……,sound/data/pcm/c38/h/01.unity3d,h_hh_38_02_016
17,38,42,ふふ、お汁を出して頂けると、こちらも弄りやすいです,sound/data/pcm/c38/h/01.unity3d,h_hh_38_02_017
18,38,42,ゆっくり亀頭責め……少しお辛そうですね……,sound/data/pcm/c38/h/01.unity3d,h_hh_38_02_018
19,38,42,先っぽ真っ赤に膨らんで、ここをキュっとすると、はい、たまらないですねー♪,sound/data/pcm/c38/h/01.unity3d,h_hh_38_02_019
20,38,42,亀頭苛められて、感じてしまっているのですね……ふふっ♪,sound/data/pcm/c38/h/01.unity3d,h_hh_38_02_020
21,38,42,貴方の一番大事な場所ですから、優しくゆっくりいたしましょうね……,sound/data/pcm/c38/h/01.unity3d,h_hh_38_02_021
22,38,42,ふふ、この程度の刺激でも、気持ちよくなって頂けるのですね,sound/data/pcm/c38/h/01.unity3d,h_hh_38_02_022
23,38,42,こうやって激しくシゴけば、ほら、すぐに射精したくなってしまいますね……,sound/data/pcm/c38/h/01.unity3d,h_hh_38_02_023
24,38,42,いつもは逞しいおちんちんも、こうして見ると可愛いですね……,sound/data/pcm/c38/h/01.unity3d,h_hh_38_02_024
25,38,42,ここにたっぷり詰まった精液、全部吐き出してしまいましょうね……,sound/data/pcm/c38/h/01.unity3d,h_hh_38_02_025
26,38,42,知っていますよ……このコリコリの球を舐めらるのが、いいのですよね？,sound/data/pcm/c38/h/01.unity3d,h_hh_38_02_026
27,38,42,強く舐め上げて、尿道に精液、送り出してさしあげますね……,sound/data/pcm/c38/h/01.unity3d,h_hh_38_02_027
28,38,42,まさか舐められているだけで、イってしまいそうなのですか？,sound/data/pcm/c38/h/01.unity3d,h_hh_38_02_028
29,38,42,素直に感じて頂いてよいのですよ……私は笑ったりしませんから,sound/data/pcm/c38/h/01.unity3d,h_hh_38_02_029
30,38,42,袋の中で精巣を転がすと……凄い反応をして頂けるようですね,sound/data/pcm/c38/h/01.unity3d,h_hh_38_02_030
31,38,42,精巣コリコリ、気持ちいいですね……でもこれ、少し危ないのですよ？,sound/data/pcm/c38/h/01.unity3d,h_hh_38_02_031
32,38,42,さぁ、これを我慢すると少し体に毒ですから、早めに射精、いたしましょう？,sound/data/pcm/c38/h/01.unity3d,h_hh_38_02_032
33,38,42,ちゅずっ、唾液と先走りで、もう先がべちゃべちゃですね……,sound/data/pcm/c38/h/01.unity3d,h_hh_38_02_033
34,38,42,ゆっくり舐めるの好きなのです、貴方の可愛い反応が、じっくり見れるので……,sound/data/pcm/c38/h/01.unity3d,h_hh_38_02_034
35,38,42,亀頭も顔も真っ赤ですよ……先っぽナメナメ、大好きなんですね？,sound/data/pcm/c38/h/01.unity3d,h_hh_38_02_035
36,38,42,お気持ちお察しいたします、私だって、こんなにクリトリスを舐められれたら……,sound/data/pcm/c38/h/01.unity3d,h_hh_38_02_036
37,38,42,んぷっ、おちんちん美味しいです……ずっと、味わっていたい……,sound/data/pcm/c38/h/01.unity3d,h_hh_38_02_037
38,38,42,貴方のを咥えるようになってから、唾液の量が増えた気がします……,sound/data/pcm/c38/h/01.unity3d,h_hh_38_02_038
39,38,42,この下品な音が良いのでしょう？　わかりますよ、私も興奮しますっ,sound/data/pcm/c38/h/01.unity3d,h_hh_38_02_039
40,38,42,私、おちんちんを咥えながら、おまんこ濡らしてしまっていますっ,sound/data/pcm/c38/h/01.unity3d,h_hh_38_02_040
41,38,42,おっぱいとおちんちんを擦り付け合うなんて、誰が考えたのでしょうね,sound/data/pcm/c38/h/01.unity3d,h_hh_38_02_041
42,38,42,私のおっぱいで、もっとおちんちんを固くしてください,sound/data/pcm/c38/h/01.unity3d,h_hh_38_02_042
43,38,42,私のおっぱいで気持ちよくなって……たくさん射精、してくださいっ,sound/data/pcm/c38/h/01.unity3d,h_hh_38_02_043
44,38,42,貴方の匂い、おっぱいに擦り付けて、とれなくしたいのですっ,sound/data/pcm/c38/h/01.unity3d,h_hh_38_02_044
45,38,42,乳首に擦り付ければ、コリコリして、気持ちいいかもしれません,sound/data/pcm/c38/h/01.unity3d,h_hh_38_02_045
46,38,42,小さな胸ですみません……こういった時は、肩身が狭いですね……,sound/data/pcm/c38/h/01.unity3d,h_hh_38_02_046
47,38,42,ふふ、ぽよぽよおっぱいで、すっかり蕩けてしまっていますね,sound/data/pcm/c38/h/01.unity3d,h_hh_38_02_047
48,38,42,ぱちゅぱちゅと、いやらしい音をさせられるのも、大きいからですよっ,sound/data/pcm/c38/h/01.unity3d,h_hh_38_02_048
49,38,42,使えるところは全部使うという感じが、大変いやらしいですね,sound/data/pcm/c38/h/01.unity3d,h_hh_38_02_049
50,38,42,おっぱいむにむに、舌でべろべろ、とっても贅沢な快楽ですねっ,sound/data/pcm/c38/h/01.unity3d,h_hh_38_02_050
51,38,42,唾液と我慢汁で、おっぱいぬるぬるにしてしまいましょうねっ,sound/data/pcm/c38/h/01.unity3d,h_hh_38_02_051
52,38,42,おっぱいと舌で、好きな時に、いくらでも射精してくださいっ,sound/data/pcm/c38/h/01.unity3d,h_hh_38_02_052
53,38,42,おっぱいが小さい分、舐める方に集中させて頂きますっ,sound/data/pcm/c38/h/01.unity3d,h_hh_38_02_053
54,38,42,舌だけでも、イカせてみせますっ、おっぱいは、おまけみたいなものですので……,sound/data/pcm/c38/h/01.unity3d,h_hh_38_02_054
55,38,42,大きなおっぱいも使いようですね。日頃の苦労が、報われる気分です,sound/data/pcm/c38/h/01.unity3d,h_hh_38_02_055
56,38,42,谷間に唾液が溜まってしまって、にちゅにちゅといやらしい音が……,sound/data/pcm/c38/h/01.unity3d,h_hh_38_02_056
57,38,42,これは、ご奉仕するより、貴方に動いて頂いた方が、楽かもしれません,sound/data/pcm/c38/h/01.unity3d,h_hh_38_02_057
58,38,42,おっぱいとお口、どちらが気持ちいいですか？,sound/data/pcm/c38/h/01.unity3d,h_hh_38_02_058
59,38,42,はあっ、我慢汁美味しくて……おっぱい動かすのを、忘れそうになります……,sound/data/pcm/c38/h/01.unity3d,h_hh_38_02_059
60,38,42,ここまでしたのですから、たっぷり射精してくださいねっ,sound/data/pcm/c38/h/01.unity3d,h_hh_38_02_060
61,38,42,胸は小さくても、気持ちよくなって頂きたいという気持ちは、大きいですよっ,sound/data/pcm/c38/h/01.unity3d,h_hh_38_02_061
62,38,42,頑張って口をぢゅぽぢゅぽすれば、射精して頂けますか？,sound/data/pcm/c38/h/01.unity3d,h_hh_38_02_062
63,38,42,おっぱいをギュっと締め付けると、先っぽがぷくっと膨むのですねっ♪,sound/data/pcm/c38/h/01.unity3d,h_hh_38_02_063
64,38,42,さぁ、おっぱいとお口で、天国に連れていって差し上げますよ……,sound/data/pcm/c38/h/01.unity3d,h_hh_38_02_064
65,38,42,あぁ、尿道がぷっくり膨らんで、ここに精液が、上がってきているのですねっ,sound/data/pcm/c38/h/01.unity3d,h_hh_38_02_065
66,38,42,亀頭が真っ赤ですっ、パンパンに膨らんで、今にもはちきれそうっ,sound/data/pcm/c38/h/01.unity3d,h_hh_38_02_066
67,38,42,好きなだけピュッピュッしていいのですよ……さぁっ、どうぞっ,sound/data/pcm/c38/h/01.unity3d,h_hh_38_02_067
68,38,42,唾液でベトベトになったおちんちんから、白いのビューってしましょうねっ,sound/data/pcm/c38/h/01.unity3d,h_hh_38_02_068
69,38,42,さぁっ、ここからが一番気持ちのいいところですよっ、舌に集中しますねっ,sound/data/pcm/c38/h/01.unity3d,h_hh_38_02_069
70,38,42,声がどんどん色っぽくなっていますよ、そろそろですねっ,sound/data/pcm/c38/h/01.unity3d,h_hh_38_02_070
71,38,42,わかりますよっ、お口の中でおちんちん膨らんで、射精の準備、していますっ,sound/data/pcm/c38/h/01.unity3d,h_hh_38_02_071
72,38,42,お口に射精されたら、私もイってしまうかも……それくらい、興奮していますっ,sound/data/pcm/c38/h/01.unity3d,h_hh_38_02_072
73,38,42,一度、イってしまいましょう？　何回だって、お口でご奉仕しますからっ,sound/data/pcm/c38/h/01.unity3d,h_hh_38_02_073
74,38,42,お外に元気よく射精しましょうねっ、貴方のおちんちんなら、できますよっ,sound/data/pcm/c38/h/01.unity3d,h_hh_38_02_074
75,38,42,では、ラストスパートですっ、最後まで、お付き合いいたしますっ,sound/data/pcm/c38/h/01.unity3d,h_hh_38_02_075
76,38,42,承知いたしました。外なのですから、好きなだけ出していいのですよっ,sound/data/pcm/c38/h/01.unity3d,h_hh_38_02_076
77,38,42,外なのですね……舌で貴方の精液、味わいたかったのですが……,sound/data/pcm/c38/h/01.unity3d,h_hh_38_02_077
78,38,42,ではでは、ワレメを重点的に舐めて、出しやすくいたしますねっ,sound/data/pcm/c38/h/01.unity3d,h_hh_38_02_078
79,38,42,かしこまりましたっ、私の顔にかかるくらい、勢いよく射精してくださいっ,sound/data/pcm/c38/h/01.unity3d,h_hh_38_02_079
80,38,42,ぁ、お口には頂けないのですね……少し残念ですが、わかりました,sound/data/pcm/c38/h/01.unity3d,h_hh_38_02_080
81,38,42,外にどれだけ射精して頂けるのか、楽しみですっ,sound/data/pcm/c38/h/01.unity3d,h_hh_38_02_081
82,38,42,ギリギリまで咥えさせて頂きますっ、未練がましくて、すみませんっ,sound/data/pcm/c38/h/01.unity3d,h_hh_38_02_082
83,38,42,やった！　ぁ、すみません。お口に頂けるのが嬉しくて、ついはしゃいでしまいました,sound/data/pcm/c38/h/01.unity3d,h_hh_38_02_083
84,38,42,出た後も口をすぼめて、最後の一滴まで吸出しますねっ,sound/data/pcm/c38/h/01.unity3d,h_hh_38_02_084
85,38,42,ふふ、これで心おきなく、咥え続けていられますっ,sound/data/pcm/c38/h/01.unity3d,h_hh_38_02_085
86,38,42,はぁぁ……いつ見ても、射精って気持ちよさそうですね……,sound/data/pcm/c38/h/01.unity3d,h_hh_38_02_086
87,38,42,あぁっ、この勢いで、中にも出ているのですね……,sound/data/pcm/c38/h/01.unity3d,h_hh_38_02_087
88,38,42,ひゃうっ、精液をかけて頂けるなんて……光栄ですっ♪,sound/data/pcm/c38/h/01.unity3d,h_hh_38_02_088
89,38,42,おちんちんのお掃除は、お任せください。すぐに綺麗にいたしますよ,sound/data/pcm/c38/h/01.unity3d,h_hh_38_02_089
90,38,42,次は、飲ませてくださいね？　射精を見ているだけなんて、辛いです……,sound/data/pcm/c38/h/01.unity3d,h_hh_38_02_090
91,38,42,精液、熱いです……貴方の興奮を感じます……,sound/data/pcm/c38/h/01.unity3d,h_hh_38_02_091
92,38,42,精液の味、大好きになりました。貴方にたくさん、飲ませて頂きましたから……,sound/data/pcm/c38/h/01.unity3d,h_hh_38_02_092
93,38,42,この味、やはりたまりません……身体の奥が、一気に熱くなります……,sound/data/pcm/c38/h/01.unity3d,h_hh_38_02_093
94,38,42,いつも通り、濃厚な味ですね……しばらくは、口の中に残りそうです……,sound/data/pcm/c38/h/01.unity3d,h_hh_38_02_094
95,38,42,ふふ、少し飲んでしまいましたけど……だいたいこのくらいです……,sound/data/pcm/c38/h/01.unity3d,h_hh_38_02_095
96,38,42,はぁぁ、いけません……こんなエッチな匂い、私には毒です……,sound/data/pcm/c38/h/01.unity3d,h_hh_38_02_096
97,38,42,よかった……本日も、こんなにたくさん出して頂けて……,sound/data/pcm/c38/h/01.unity3d,h_hh_38_02_097
98,38,42,まだ満足していないというお顔ですね？　ふふ、私の錯覚でなければ……,sound/data/pcm/c38/h/01.unity3d,h_hh_38_02_098
99,38,42,もっとご奉仕させてください……日頃、お世話になっているお礼です,sound/data/pcm/c38/h/01.unity3d,h_hh_38_02_099
100,38,42,またすぐにイってしまいそうですか？　では、ゆっくりにしておきますね……,sound/data/pcm/c38/h/01.unity3d,h_hh_38_02_100
101,38,42,ビクビクと、反応がいいですね……今が一番、敏感なのですよね？,sound/data/pcm/c38/h/01.unity3d,h_hh_38_02_101
102,38,42,一人でする時も、こんなに何度も、激しくしているのですか？,sound/data/pcm/c38/h/01.unity3d,h_hh_38_02_102
103,38,42,先程出したばかりだというのに、もう尿道がぷっくりしていますよ……,sound/data/pcm/c38/h/01.unity3d,h_hh_38_02_103
104,38,42,はぁっ、精液の味、少し残っています……,sound/data/pcm/c38/h/01.unity3d,h_hh_38_02_104
105,38,42,少々お待ちください……今、綺麗にお掃除いたしますから……,sound/data/pcm/c38/h/01.unity3d,h_hh_38_02_105
106,38,42,また匂いが濃くなって……いいのですよ、何回でも射精してくださいっ,sound/data/pcm/c38/h/01.unity3d,h_hh_38_02_106
107,38,42,貴方のを舐めていると、私も幸せです……とても、充実した時間です……,sound/data/pcm/c38/h/01.unity3d,h_hh_38_02_107
108,38,42,ぢゅずっ、残った精液は、私が全部、吸い出しておきますので……,sound/data/pcm/c38/h/01.unity3d,h_hh_38_02_108
109,38,42,もっと強くしても大丈夫ですか？　お辛そうなので、遠慮していたのですが……,sound/data/pcm/c38/h/01.unity3d,h_hh_38_02_109
110,38,42,口の中、もう貴方のおちんちんの匂いで、いっぱいですっ,sound/data/pcm/c38/h/01.unity3d,h_hh_38_02_110
111,38,42,私、ご奉仕好きなのです。貴方のおちんちん、ずっと咥えていたいですっ,sound/data/pcm/c38/h/01.unity3d,h_hh_38_02_111
112,38,42,おちんちん震えて、お可哀相に……優しく包んで差し上げますね……,sound/data/pcm/c38/h/01.unity3d,h_hh_38_02_112
113,38,42,おっぱい強くしますよ、おちんちん辛くなったら、いつでも出していいですからね,sound/data/pcm/c38/h/01.unity3d,h_hh_38_02_113
114,38,42,残った精液を味わいながら、おっぱいで擦るなんて、贅沢なご奉仕ですね……,sound/data/pcm/c38/h/01.unity3d,h_hh_38_02_114
115,38,42,おちんちん壊れていませんよね？　先走りが、ずっと溢れているので……,sound/data/pcm/c38/h/01.unity3d,h_hh_38_02_115
116,38,42,今が一番お辛いでしょうが、もう少しの辛抱ですよ……,sound/data/pcm/c38/h/01.unity3d,h_hh_38_02_116
117,38,42,さて、弱いばかりでは、またイけませんよね？　少々激しく、させて頂きますっ,sound/data/pcm/c38/h/01.unity3d,h_hh_38_02_117
118,38,42,声、抑えなくていいのですよ、大きな声を出して、気持ちよくイってくださいっ,sound/data/pcm/c38/h/01.unity3d,h_hh_38_02_118
119,38,42,これで何度目か覚えていますか？　ふふ、もうよくわからないという顔ですね,sound/data/pcm/c38/h/01.unity3d,h_hh_38_02_119
120,38,42,さぁ、また射精してくださいっ、また最後まで、おちんちん舐め回しますからっ,sound/data/pcm/c38/h/01.unity3d,h_hh_38_02_120
121,38,42,おちんちん、よく頑張りましたね、舌でよしよし、して差し上げますっ,sound/data/pcm/c38/h/01.unity3d,h_hh_38_02_121
122,38,42,凄い、もう我慢汁なのか精液なのか、わからないくらい溢れていますっ,sound/data/pcm/c38/h/01.unity3d,h_hh_38_02_122
123,38,42,貴方の射精なら、私は何度だって、お口で受け止めますっ,sound/data/pcm/c38/h/01.unity3d,h_hh_38_02_123
124,38,42,いいですよっ、貴方の精液の匂いで、私を満たしてくださいっ,sound/data/pcm/c38/h/01.unity3d,h_hh_38_02_124
125,38,42,絶倫なのですね……それとも、今日のために溜めてきたのですか？,sound/data/pcm/c38/h/01.unity3d,h_hh_38_02_125
126,38,42,また可愛い声で鳴いて頂けるよう、念入りに舐めさせて頂きますっ,sound/data/pcm/c38/h/01.unity3d,h_hh_38_02_126
127,38,42,舌でおちんちんを味わえるのも、後少しということですね……でしたらっ,sound/data/pcm/c38/h/01.unity3d,h_hh_38_02_127
128,38,42,えっ、外に出されてしまうのですか？　今回は私、失敗してしまいましたか？,sound/data/pcm/c38/h/01.unity3d,h_hh_38_02_128
129,38,42,うぅ、名残惜しいですが……貴方が外に出したいと言うのなら、仕方ありませんっ,sound/data/pcm/c38/h/01.unity3d,h_hh_38_02_129
130,38,42,精液の味で、私の口をいっぱいにしてくださいっ、もうずっと、残るくらいにっ,sound/data/pcm/c38/h/01.unity3d,h_hh_38_02_130
131,38,42,ふふ、流石に薄くなっているのでしょうか？　精液を頂けるなら、何でもよいですがっ,sound/data/pcm/c38/h/01.unity3d,h_hh_38_02_131
132,38,42,ふふっ、少し薄くなった分、勢いが増しましたねっ,sound/data/pcm/c38/h/01.unity3d,h_hh_38_02_132
133,38,42,まぁっ、何度出しても元気な射精……見ていだけで、気分が晴れ晴れします,sound/data/pcm/c38/h/01.unity3d,h_hh_38_02_133
134,38,42,あひゅっ、ふふ、もっとたくさん……かけてもいいのですよ？,sound/data/pcm/c38/h/01.unity3d,h_hh_38_02_134
135,38,42,もうどこも、貴方の匂いでいっぱいです……ふふ、幸せな空間ですね……,sound/data/pcm/c38/h/01.unity3d,h_hh_38_02_135
136,38,42,えぇと、これだけ出して、まだ元気というのは……少々驚きました……,sound/data/pcm/c38/h/01.unity3d,h_hh_38_02_136
137,38,42,貴方の精液なら、どれだけかけられても、不快ではありません……,sound/data/pcm/c38/h/01.unity3d,h_hh_38_02_137
138,38,42,貴方からのご褒美、しかと頂きました……大変、美味でございましたよ♪,sound/data/pcm/c38/h/01.unity3d,h_hh_38_02_138
139,38,42,口からでも、孕んでしまいそうです……それくらい、濃いのですよ……,sound/data/pcm/c38/h/01.unity3d,h_hh_38_02_139
140,38,42,こういうの、男の方は喜ばれるのでしょう？　ふふ、様式美と聞きました……,sound/data/pcm/c38/h/01.unity3d,h_hh_38_02_140
141,38,42,全部、飲むこともできるのですよ？　ですが、貴方は見たいのですよね？,sound/data/pcm/c38/h/01.unity3d,h_hh_38_02_141
142,38,42,どうぞっ、私にかけてくださいっ、どこでも、大丈夫ですからっ,sound/data/pcm/c38/h/01.unity3d,h_hh_38_02_142
143,38,42,はいっ、これで気兼ねなく、最後まで舐めていられますねっ,sound/data/pcm/c38/h/01.unity3d,h_hh_38_02_143
144,38,42,あぁっ、かけて頂けるのですね、離したくありませんでしたが、それでしたらっ,sound/data/pcm/c38/h/01.unity3d,h_hh_38_02_144
145,38,42,はぁっ、私、貴方に真っ白にされてしまうのですねっ♪,sound/data/pcm/c38/h/01.unity3d,h_hh_38_02_145
146,38,42,ふふ、では容赦しませんよ……射精の瞬間まで、舐めさせて頂きますっ,sound/data/pcm/c38/h/01.unity3d,h_hh_38_02_146
147,38,42,お好きなだけかけてください、貴方好みの、白さになるまでっ,sound/data/pcm/c38/h/01.unity3d,h_hh_38_02_147
148,38,42,貴方に気持ち良くなってもらえるように、こっそり練習してたんです,sound/data/pcm/c38/h/01.unity3d,h_hh_38_02_300
149,38,42,緩やかに……でも、刺激的に……,sound/data/pcm/c38/h/01.unity3d,h_hh_38_02_301
150,38,42,これがいいんですね？　おちんちんは正直です,sound/data/pcm/c38/h/01.unity3d,h_hh_38_02_302
151,38,42,お汁を出せば出すほど、滑りやすくなって気持ち良いですよ？,sound/data/pcm/c38/h/01.unity3d,h_hh_38_02_303
152,38,42,（たっぷり涎をつけて……乳首、ヌルヌルになりました）,sound/data/pcm/c38/h/01.unity3d,h_hh_38_02_304
153,38,42,（舌先でつつくように舐めると、いい反応をしてくれますね）,sound/data/pcm/c38/h/01.unity3d,h_hh_38_02_305
154,38,42,（私のナメナメも、だいぶ上達したと思います）,sound/data/pcm/c38/h/01.unity3d,h_hh_38_02_306
155,38,42,（下品に舐めた方が、そそられますか？）,sound/data/pcm/c38/h/01.unity3d,h_hh_38_02_307
156,38,42,（舌攻めの本領は、ここからですよ）,sound/data/pcm/c38/h/01.unity3d,h_hh_38_02_308
157,38,42,（執拗に舐め続けるので、素直にイッた方が良いですよ？）,sound/data/pcm/c38/h/01.unity3d,h_hh_38_02_309
158,38,42,（はいっ……精液ドクドク出してください）,sound/data/pcm/c38/h/01.unity3d,h_hh_38_02_310
159,38,42,（こんなに我慢出来てえらいですね。気持ち良く射精してください）,sound/data/pcm/c38/h/01.unity3d,h_hh_38_02_311
