管理番号,大きい項目,中間項目,表示名,バンドルパス,ファイル名
215,14,44,お尻が切なくなっちゃうぅ,sound/data/pcm/c14/h/01.unity3d,h_so_14_02_215
216,14,44,お尻、激しくぅ……,sound/data/pcm/c14/h/01.unity3d,h_so_14_02_216
217,14,44,もっとはげしいの、してえ,sound/data/pcm/c14/h/01.unity3d,h_so_14_02_217
218,14,44,さっきより敏感になってるっよお,sound/data/pcm/c14/h/01.unity3d,h_so_14_02_218
219,14,44,おちんぽ、いっぱい感じちゃう,sound/data/pcm/c14/h/01.unity3d,h_so_14_02_219
220,14,44,ああっ、もっと、もっとおお,sound/data/pcm/c14/h/01.unity3d,h_so_14_02_220
221,14,44,もっと、いっぱいうごいていいよっ,sound/data/pcm/c14/h/01.unity3d,h_so_14_02_221
222,14,44,あはぁ、お尻感じてるっ,sound/data/pcm/c14/h/01.unity3d,h_so_14_02_222
223,14,44,体、2つに割れそうなくらいきてるっ,sound/data/pcm/c14/h/01.unity3d,h_so_14_02_223
224,14,44,お尻で、きもちよくなってぇ,sound/data/pcm/c14/h/01.unity3d,h_so_14_02_224
225,14,44,トイレできなくなっちゃうう,sound/data/pcm/c14/h/01.unity3d,h_so_14_02_225
226,14,44,あぁっ、ゆっくりなのでいっぱいになっちゃってるっ,sound/data/pcm/c14/h/01.unity3d,h_so_14_02_226
227,14,44,お前の優しいので感じちゃってるのっ,sound/data/pcm/c14/h/01.unity3d,h_so_14_02_227
228,14,44,さっきよりも、もっとすごいのくるぅ……,sound/data/pcm/c14/h/01.unity3d,h_so_14_02_228
229,14,44,また来ちゃう……激しく、激しくぅ！,sound/data/pcm/c14/h/01.unity3d,h_so_14_02_229
230,14,44,顔に余裕がなくなってるぞっ？,sound/data/pcm/c14/h/01.unity3d,h_so_14_02_230
231,14,44,出そうなんだな？　好きに動いてくれっ,sound/data/pcm/c14/h/01.unity3d,h_so_14_02_231
232,14,44,もっと、もっときても、大丈夫だからっ,sound/data/pcm/c14/h/01.unity3d,h_so_14_02_232
233,14,44,敏感おちんぽ、もっと私で感じてっ,sound/data/pcm/c14/h/01.unity3d,h_so_14_02_233
234,14,44,お尻っ感じてきたぁ,sound/data/pcm/c14/h/01.unity3d,h_so_14_02_234
235,14,44,お尻でおまんこ、苦しくなってきたぁ……,sound/data/pcm/c14/h/01.unity3d,h_so_14_02_235
236,14,44,そんな早いの、お尻めくれちゃう,sound/data/pcm/c14/h/01.unity3d,h_so_14_02_236
237,14,44,おちんぽでお尻の中開発されてるのぉ,sound/data/pcm/c14/h/01.unity3d,h_so_14_02_237
238,14,44,お前が気持ちよくなってくれるなら、お尻でもなんでも使ってくれっ,sound/data/pcm/c14/h/01.unity3d,h_so_14_02_238
239,14,44,気持ちいいか？　もっと、気持ちよくなっていいからな,sound/data/pcm/c14/h/01.unity3d,h_so_14_02_239
240,14,44,おちんぽすごいついてくるっ……どんどんきてぇ,sound/data/pcm/c14/h/01.unity3d,h_so_14_02_240
241,14,44,お尻、もっと感じてぇ,sound/data/pcm/c14/h/01.unity3d,h_so_14_02_241
242,14,44,もう、またきちゃうっ！　まてないのっ！,sound/data/pcm/c14/h/01.unity3d,h_so_14_02_242
243,14,44,先にイッちゃう！,sound/data/pcm/c14/h/01.unity3d,h_so_14_02_243
244,14,44,私も一緒にっ……,sound/data/pcm/c14/h/01.unity3d,h_so_14_02_244
245,14,44,一緒に、イキたいんだっ,sound/data/pcm/c14/h/01.unity3d,h_so_14_02_245
246,14,44,きて、きて、きてええぇぇ,sound/data/pcm/c14/h/01.unity3d,h_so_14_02_246
247,14,44,私でいっぱい出してええ,sound/data/pcm/c14/h/01.unity3d,h_so_14_02_247
248,14,44,いいよっ、出すとこ、私に見せてくれっ,sound/data/pcm/c14/h/01.unity3d,h_so_14_02_248
249,14,44,外でおちんぽビクビクしてるの、みせてぇ,sound/data/pcm/c14/h/01.unity3d,h_so_14_02_249
250,14,44,おちんぽ、脈打ってるのっ,sound/data/pcm/c14/h/01.unity3d,h_so_14_02_250
251,14,44,おちんぽ激しすぎるっ,sound/data/pcm/c14/h/01.unity3d,h_so_14_02_251
252,14,44,おちんぽ苦しそうに中で跳ねてるっ,sound/data/pcm/c14/h/01.unity3d,h_so_14_02_252
253,14,44,ゴム越しにぱんぱんなの、つたわってくるぅ,sound/data/pcm/c14/h/01.unity3d,h_so_14_02_253
254,14,44,お尻で、もうイきそう、イッちゃうっ,sound/data/pcm/c14/h/01.unity3d,h_so_14_02_254
255,14,44,お尻もう来るのおお,sound/data/pcm/c14/h/01.unity3d,h_so_14_02_255
256,14,44,私もなんだ……一緒に、感じて？,sound/data/pcm/c14/h/01.unity3d,h_so_14_02_256
257,14,44,お尻、締めてあげるから、一緒にっ,sound/data/pcm/c14/h/01.unity3d,h_so_14_02_257
258,14,44,お尻ならいっぱい出していいからっ,sound/data/pcm/c14/h/01.unity3d,h_so_14_02_258
259,14,44,お尻、いつでもいいからあ,sound/data/pcm/c14/h/01.unity3d,h_so_14_02_259
260,14,44,さっきより、勢いすごいのっ,sound/data/pcm/c14/h/01.unity3d,h_so_14_02_260
261,14,44,またあついの、中にいっぱいぃ……,sound/data/pcm/c14/h/01.unity3d,h_so_14_02_261
262,14,44,中で、いっぱいに膨らんでるぅ……,sound/data/pcm/c14/h/01.unity3d,h_so_14_02_262
263,14,44,ゴム越しにビクビクしてるのわかるのっ,sound/data/pcm/c14/h/01.unity3d,h_so_14_02_263
264,14,44,お尻にいっぱいでてるぅ,sound/data/pcm/c14/h/01.unity3d,h_so_14_02_264
265,14,44,さっきだしたとこなのに、お尻にきてるぅ,sound/data/pcm/c14/h/01.unity3d,h_so_14_02_265
266,14,44,さき、いっちゃううううう,sound/data/pcm/c14/h/01.unity3d,h_so_14_02_266
267,14,44,飛んじゃうううぅぅ,sound/data/pcm/c14/h/01.unity3d,h_so_14_02_267
268,14,44,いっぱい、いっちゃうううぅぅ,sound/data/pcm/c14/h/01.unity3d,h_so_14_02_268
269,14,44,さっきよりもおお、すごいの来たあああ,sound/data/pcm/c14/h/01.unity3d,h_so_14_02_269
270,14,44,お前と一緒にイけるの、いつやっても幸せ……,sound/data/pcm/c14/h/01.unity3d,h_so_14_02_270
271,14,44,ゴムあるけど、いっぱい感じれる……,sound/data/pcm/c14/h/01.unity3d,h_so_14_02_271
272,14,44,満たされてる、いっぱいに感じちゃう……,sound/data/pcm/c14/h/01.unity3d,h_so_14_02_272
273,14,44,おちんぽとのつながり、気持ちいいのがいっぱいだっ,sound/data/pcm/c14/h/01.unity3d,h_so_14_02_273
274,14,44,ちんぽ汁で、子宮の中までいっぱいだぁ,sound/data/pcm/c14/h/01.unity3d,h_so_14_02_274
275,14,44,赤ちゃん……もうできちゃうかもっ,sound/data/pcm/c14/h/01.unity3d,h_so_14_02_275
276,14,44,こんな気持ちいいのっ我慢できるわけないよっ,sound/data/pcm/c14/h/01.unity3d,h_so_14_02_276
277,14,44,私だけで、イッちゃったぁ,sound/data/pcm/c14/h/01.unity3d,h_so_14_02_277
278,14,44,お尻でも、一緒にっ……,sound/data/pcm/c14/h/01.unity3d,h_so_14_02_278
279,14,44,私もお尻だけどっ、イっちゃった……,sound/data/pcm/c14/h/01.unity3d,h_so_14_02_279
280,14,44,お尻で、先に感じちゃったぁ,sound/data/pcm/c14/h/01.unity3d,h_so_14_02_280
281,14,44,お尻が、気持ちよくされちゃったのぉ,sound/data/pcm/c14/h/01.unity3d,h_so_14_02_281
282,14,44,こんな激しいのっ……聞いてないよぉ……,sound/data/pcm/c14/h/01.unity3d,h_so_14_02_282
283,14,44,ゴムのドロっとしたのが、すごい多いよっ,sound/data/pcm/c14/h/01.unity3d,h_so_14_02_283
284,14,44,生でこんないっぱいきたら、我慢できないって,sound/data/pcm/c14/h/01.unity3d,h_so_14_02_284
285,14,44,続きでこんなに、いっぱい感じちゃったあ,sound/data/pcm/c14/h/01.unity3d,h_so_14_02_285
286,14,44,奥の方まで、ちんぽ汁きてるよお……,sound/data/pcm/c14/h/01.unity3d,h_so_14_02_286
287,14,44,私の中、ちんぽ汁でいっぱいだよぉ……,sound/data/pcm/c14/h/01.unity3d,h_so_14_02_287
288,14,44,こんなにいっぱい、イカされちゃった……,sound/data/pcm/c14/h/01.unity3d,h_so_14_02_288
289,14,44,イカされちゃったぁ……次はイカしちゃうからなっ,sound/data/pcm/c14/h/01.unity3d,h_so_14_02_289
290,14,44,お尻で、感じる体になっちゃったぁ,sound/data/pcm/c14/h/01.unity3d,h_so_14_02_290
291,14,44,お尻と、おちんぽと一緒にイッちゃったあ,sound/data/pcm/c14/h/01.unity3d,h_so_14_02_291
292,14,44,お尻でまだ感じちゃったのっ,sound/data/pcm/c14/h/01.unity3d,h_so_14_02_292
293,14,44,お尻で、おちんぽに負けちゃったぁ,sound/data/pcm/c14/h/01.unity3d,h_so_14_02_293
294,14,44,おちんぽ、まだ元気なのか？　すごいなっ,sound/data/pcm/c14/h/01.unity3d,h_so_14_02_294
295,14,44,まだおちんぽいけちゃうのか？　みんな、こんなもんなのか？,sound/data/pcm/c14/h/01.unity3d,h_so_14_02_295
296,14,44,明日、絶対ひりひりしちゃうぅ,sound/data/pcm/c14/h/01.unity3d,h_so_14_02_296
297,14,44,お前ので溺れてしまってるよお,sound/data/pcm/c14/h/01.unity3d,h_so_14_02_297
298,14,44,中で出されて、すごく幸せな気持ちなんだっ,sound/data/pcm/c14/h/01.unity3d,h_so_14_02_298
299,14,44,子宮が降りてくるっ……,sound/data/pcm/c14/h/01.unity3d,h_so_14_02_299
300,14,44,ゴムの中、あったかいのいっぱいだぁ,sound/data/pcm/c14/h/01.unity3d,h_so_14_02_300
301,14,44,こんなに激しいの、ゴムなの忘れちゃうくらい激しいっ,sound/data/pcm/c14/h/01.unity3d,h_so_14_02_301
302,14,44,中で、ずっと気持ちいいっておまんこがいってるのっ,sound/data/pcm/c14/h/01.unity3d,h_so_14_02_302
303,14,44,あったかいのが、からだじゅうに染みてくるみたいっ,sound/data/pcm/c14/h/01.unity3d,h_so_14_02_303
304,14,44,いけないのに、私の方からも欲しくなっちゃったっ,sound/data/pcm/c14/h/01.unity3d,h_so_14_02_304
305,14,44,赤ちゃんのこと、考えないといけないかもなっ,sound/data/pcm/c14/h/01.unity3d,h_so_14_02_305
306,14,44,すごい……まだ余韻がきてるのっ……,sound/data/pcm/c14/h/01.unity3d,h_so_14_02_306
307,14,44,セックス、うますぎるから、先にイッちゃうのっ,sound/data/pcm/c14/h/01.unity3d,h_so_14_02_307
308,14,44,お尻……すっかりおまんこみたいになっちゃったかもっ……,sound/data/pcm/c14/h/01.unity3d,h_so_14_02_308
309,14,44,もう、完璧に開発されちゃったぁ……,sound/data/pcm/c14/h/01.unity3d,h_so_14_02_309
310,14,44,まだ、おちんぽ汁がこんなに来てるっ……,sound/data/pcm/c14/h/01.unity3d,h_so_14_02_310
311,14,44,あぁ、またせつなそうに、おちんぽ跳ねてるっ,sound/data/pcm/c14/h/01.unity3d,h_so_14_02_311
312,14,44,いっぱい、でたなっ,sound/data/pcm/c14/h/01.unity3d,h_so_14_02_312
313,14,44,まだ、気持ちよくなりたいのか？,sound/data/pcm/c14/h/01.unity3d,h_so_14_02_313
314,14,44,あっ……あんなに出されたら、垂れちゃうかっ,sound/data/pcm/c14/h/01.unity3d,h_so_14_02_314
315,14,44,あっ、お尻もう止められないっ……,sound/data/pcm/c14/h/01.unity3d,h_so_14_02_315
316,14,44,（開始時台詞）プールん中でしようだなんて、すごいこと考えるな、お前,sound/data/pcm/c14/h/01.unity3d,h_so_14_02_316
317,14,44,（開始時台詞）ここは見晴らしがいいから、誰かに見られるかもな……それでもいいなら、別にいいけどよ,sound/data/pcm/c14/h/01.unity3d,h_so_14_02_317
