管理番号,大きい項目,中間項目,表示名,バンドルパス,ファイル名
0,38,21,あ、あの……私の身体、どこか変でしょうか？,sound/data/pcm/c38/h/01.unity3d,h_ai_38_00_000
1,38,21,うぅ、その……身体が勝手に、震えてしまって……,sound/data/pcm/c38/h/01.unity3d,h_ai_38_00_001
2,38,21,み、見ているだけでなく……触って頂いても、いいのですよ？,sound/data/pcm/c38/h/01.unity3d,h_ai_38_00_002
3,38,21,（初めてのキス）そ、その……い、今のキスが、私のファーストキスでした……,sound/data/pcm/c38/h/01.unity3d,h_ai_38_00_005
4,38,21,んっ……何と言ったらいいか、頭が上手く回りません……,sound/data/pcm/c38/h/01.unity3d,h_ai_38_00_006
5,38,21,私、もしかすると、キスに弱いのかもしれません……,sound/data/pcm/c38/h/01.unity3d,h_ai_38_00_007
6,38,21,ぁの……はしたないお願いだとは思いますが……もっとキス、して頂けませんか？,sound/data/pcm/c38/h/01.unity3d,h_ai_38_00_008
7,38,21,ま、待ってください……キスは、まだ早いかと……,sound/data/pcm/c38/h/01.unity3d,h_ai_38_00_015
8,38,21,だ、ダメですっ……キスはその、パートナー同士でするものですから……,sound/data/pcm/c38/h/01.unity3d,h_ai_38_00_016
9,38,21,お気持ちは嬉しいですが……キスはお控えください……,sound/data/pcm/c38/h/01.unity3d,h_ai_38_00_017
10,38,21,ふぁっ、なんだか、くすぐったいです……,sound/data/pcm/c38/h/01.unity3d,h_ai_38_00_018
11,38,21,あぁっ、貴方に、されてしまっています……,sound/data/pcm/c38/h/01.unity3d,h_ai_38_00_019
12,38,21,体が、勝手にビクビクとっ……,sound/data/pcm/c38/h/01.unity3d,h_ai_38_00_020
13,38,21,どうしましょう……気持ちいいです……,sound/data/pcm/c38/h/01.unity3d,h_ai_38_00_021
14,38,21,私はそのっ、どうしすればっ……,sound/data/pcm/c38/h/01.unity3d,h_ai_38_00_022
15,38,21,んぁっ、そこはっ、とても敏感なところでっ,sound/data/pcm/c38/h/01.unity3d,h_ai_38_00_023
16,38,21,ひゃふっ、そこっ、弱いですっ……,sound/data/pcm/c38/h/01.unity3d,h_ai_38_00_024
17,38,21,はぁっ、声がっ、抑えられませんっ,sound/data/pcm/c38/h/01.unity3d,h_ai_38_00_025
18,38,21,先は、その……敏感なのでっ,sound/data/pcm/c38/h/01.unity3d,h_ai_38_00_026
19,38,21,あぁっ、先っぽばかり、そんなっ,sound/data/pcm/c38/h/01.unity3d,h_ai_38_00_027
20,38,21,弱いのですっ、そこっ、硬くなってしまいますっ,sound/data/pcm/c38/h/01.unity3d,h_ai_38_00_028
21,38,21,そ、そこは、とても大事な場所なのでっ、優しくっ,sound/data/pcm/c38/h/01.unity3d,h_ai_38_00_029
22,38,21,私のアソコ、こんなに感じてしまうなんてっ,sound/data/pcm/c38/h/01.unity3d,h_ai_38_00_030
23,38,21,うぅ、お股弄られると……弱いんです……,sound/data/pcm/c38/h/01.unity3d,h_ai_38_00_031
24,38,21,わ、私……お尻で感じてしまっています……,sound/data/pcm/c38/h/01.unity3d,h_ai_38_00_032
25,38,21,引かないでくださいね？　お尻、とても弱くて……,sound/data/pcm/c38/h/01.unity3d,h_ai_38_00_033
26,38,21,お尻が弱いなんて、誰にも言わないでくださいね？,sound/data/pcm/c38/h/01.unity3d,h_ai_38_00_034
27,38,21,"（拒否,外される）あのっ、あまり強引なのは……やめて頂けると……",sound/data/pcm/c38/h/01.unity3d,h_ai_38_00_035
28,38,21,"（拒否,外される）すみません、もう少しだけ優しく……",sound/data/pcm/c38/h/01.unity3d,h_ai_38_00_036
29,38,21,"（拒否,外される）ま、待ってください……少し、強すぎます……",sound/data/pcm/c38/h/01.unity3d,h_ai_38_00_037
30,38,21,"（拒否,外される）そ、そこはお尻ですよっ！？　間違えてしまいましたか？",sound/data/pcm/c38/h/01.unity3d,h_ai_38_00_038
31,38,21,"（拒否,外される）だ、ダメですっ……そこだけは、許してくださいっ",sound/data/pcm/c38/h/01.unity3d,h_ai_38_00_039
32,38,21,"（拒否,外される）やっ、お尻なんて、汚いですからっ",sound/data/pcm/c38/h/01.unity3d,h_ai_38_00_040
33,38,21,（強すぎて拒否）その、デリケートなところなので……そういったものは……,sound/data/pcm/c38/h/01.unity3d,h_ai_38_00_041
34,38,21,（強すぎて拒否）強くされると、痛いのです……どうか、ご理解ください……,sound/data/pcm/c38/h/01.unity3d,h_ai_38_00_042
35,38,21,（強すぎて拒否）そういうのは、まだ怖いです……,sound/data/pcm/c38/h/01.unity3d,h_ai_38_00_043
36,38,21,あぁっ、貴方に、揉まれていますっ……,sound/data/pcm/c38/h/01.unity3d,h_ai_38_00_044
37,38,21,揉み心地は、どうですか……？,sound/data/pcm/c38/h/01.unity3d,h_ai_38_00_045
38,38,21,揉み方が、何だかエッチです……,sound/data/pcm/c38/h/01.unity3d,h_ai_38_00_046
39,38,21,ひゃうっ、いきなりつつかれると、びっくりしてしまうので……,sound/data/pcm/c38/h/01.unity3d,h_ai_38_00_051
40,38,21,敏感なところなので、そっとですよ？,sound/data/pcm/c38/h/01.unity3d,h_ai_38_00_052
41,38,21,うぅ、貴方の指先を見る度、思い出してしまいそうです……,sound/data/pcm/c38/h/01.unity3d,h_ai_38_00_053
42,38,21,んぃっ、いくら目立つからといって、摘まむなんてっ……,sound/data/pcm/c38/h/01.unity3d,h_ai_38_00_054
43,38,21,あまり強く引かないでくださいね……,sound/data/pcm/c38/h/01.unity3d,h_ai_38_00_055
44,38,21,な、なんでしょう……先が、ムズムズします……,sound/data/pcm/c38/h/01.unity3d,h_ai_38_00_056
45,38,21,そ、そこは汚いですからっ、貴方の手が、汚れてしまいますっ,sound/data/pcm/c38/h/01.unity3d,h_ai_38_00_057
46,38,21,やっ、お尻まで、弄られてしまうのですね……,sound/data/pcm/c38/h/01.unity3d,h_ai_38_00_058
47,38,21,うぅ、なんだか変な気分です……お尻を、弄られるなんてぇ……,sound/data/pcm/c38/h/01.unity3d,h_ai_38_00_059
48,38,21,そこは、女性の大事な場所なので……出来るだけ優しく……,sound/data/pcm/c38/h/01.unity3d,h_ai_38_00_060
49,38,21,はぁっ、ジワジワと、何か溢れてしまいそうですっ,sound/data/pcm/c38/h/01.unity3d,h_ai_38_00_061
50,38,21,はぁぁ、お股、そんなに触ってはっ……,sound/data/pcm/c38/h/01.unity3d,h_ai_38_00_062
51,38,21,はぁぁ、熱いです、擦られると、こんな風になるのですね……,sound/data/pcm/c38/h/01.unity3d,h_ai_38_00_063
52,38,21,お尻を擦るなんて、本当は、してはいけないことですよ？,sound/data/pcm/c38/h/01.unity3d,h_ai_38_00_064
53,38,21,あ、あまり擦られると、ヒリヒリしてしまうのでっ,sound/data/pcm/c38/h/01.unity3d,h_ai_38_00_065
54,38,21,あぁっ、貴方の指が、入ってきますっ,sound/data/pcm/c38/h/01.unity3d,h_ai_38_00_066
55,38,21,んぁっ、クチュって、いやらしい音が……,sound/data/pcm/c38/h/01.unity3d,h_ai_38_00_067
56,38,21,はぁぅっ、私の中に……貴方の指がっ……,sound/data/pcm/c38/h/01.unity3d,h_ai_38_00_068
57,38,21,んっ、そんなっ、お尻に指がっ,sound/data/pcm/c38/h/01.unity3d,h_ai_38_00_069
58,38,21,私のお尻に、貴方の指が入ってます……,sound/data/pcm/c38/h/01.unity3d,h_ai_38_00_070
59,38,21,んんっ、異物感が、凄いですっ……,sound/data/pcm/c38/h/01.unity3d,h_ai_38_00_071
60,38,21,あ、あまり音を立てないでください……恥ずかしいですっ,sound/data/pcm/c38/h/01.unity3d,h_ai_38_00_072
61,38,21,あぁっ、貴方の指が、中で動いていますっ,sound/data/pcm/c38/h/01.unity3d,h_ai_38_00_073
62,38,21,私の中、変ではありませんか？,sound/data/pcm/c38/h/01.unity3d,h_ai_38_00_074
63,38,21,あぁあ、この感じは、何と言えばよいのでしょうっ,sound/data/pcm/c38/h/01.unity3d,h_ai_38_00_075
64,38,21,ゆっくりですよ？　決して強くしては、いけませんよ？,sound/data/pcm/c38/h/01.unity3d,h_ai_38_00_076
65,38,21,こうやって、お尻を開発していくのですね……,sound/data/pcm/c38/h/01.unity3d,h_ai_38_00_077
66,38,21,そんなっ、汚いですから、舐めるなんてやめた方がっ……,sound/data/pcm/c38/h/01.unity3d,h_ai_38_00_078
67,38,21,うぅぅ、私なんか舐めても、美味しくないですよ……,sound/data/pcm/c38/h/01.unity3d,h_ai_38_00_079
68,38,21,変な味、しませんか？　汗をかいてしまっているので……,sound/data/pcm/c38/h/01.unity3d,h_ai_38_00_080
69,38,21,んっ、先を吸っても、母乳は、まだ出ませんから……,sound/data/pcm/c38/h/01.unity3d,h_ai_38_00_081
70,38,21,ふふっ、甘えん坊さんですね……,sound/data/pcm/c38/h/01.unity3d,h_ai_38_00_082
71,38,21,き、汚いですよっ、そこは……お、おしっこをするところで……,sound/data/pcm/c38/h/01.unity3d,h_ai_38_00_083
72,38,21,んんぅ、舐めるのはいいですが、後できちんと、うがいをしてくださいね……,sound/data/pcm/c38/h/01.unity3d,h_ai_38_00_084
73,38,21,なっ、お尻を舐めるなんてっ、具合が悪くなってからでは、遅いのですよっ？,sound/data/pcm/c38/h/01.unity3d,h_ai_38_00_085
74,38,21,あぁ、お尻がムズムズします、もしかして私、感じているのでしょうか？,sound/data/pcm/c38/h/01.unity3d,h_ai_38_00_086
75,38,21,えっ、舌っ、入ってっ、そこはお尻ですよっ、汚いですからっ,sound/data/pcm/c38/h/01.unity3d,h_ai_38_00_087
76,38,21,あぁっ、そんなっ、お尻の中にまで、舌がっ……,sound/data/pcm/c38/h/01.unity3d,h_ai_38_00_088
77,38,21,んぁあっ、お尻の穴は、きちんと自分で、綺麗にいたしますからっ,sound/data/pcm/c38/h/01.unity3d,h_ai_38_00_089
78,38,21,そんなものではなく、貴方に触って頂きたいのですが……,sound/data/pcm/c38/h/01.unity3d,h_ai_38_00_090
79,38,21,うくっ、それは強過ぎて、体が変になってしまいそうですっ,sound/data/pcm/c38/h/01.unity3d,h_ai_38_00_091
80,38,21,そういったものは、容赦がない感じで……少し怖いですっ,sound/data/pcm/c38/h/01.unity3d,h_ai_38_00_092
81,38,21,先っぽが、おかしくなりますっ、それは、ルール違反ですっ,sound/data/pcm/c38/h/01.unity3d,h_ai_38_00_093
82,38,21,先っぽ震えて、これ、どうすればいいのですかっ,sound/data/pcm/c38/h/01.unity3d,h_ai_38_00_094
83,38,21,これは絶対、よくないと思います……アソコをオモチャで震わせるなんてっ,sound/data/pcm/c38/h/01.unity3d,h_ai_38_00_095
84,38,21,なんなのですかこれはっ、身体の奥から、無理矢理感じさせられるようなっ,sound/data/pcm/c38/h/01.unity3d,h_ai_38_00_096
85,38,21,ふぁっ、私、そろそろ、イってしまうかもしれませんっ,sound/data/pcm/c38/h/01.unity3d,h_ai_38_00_097
86,38,21,もう、イカせて頂けますか？　これ以上は、私っ……,sound/data/pcm/c38/h/01.unity3d,h_ai_38_00_098
87,38,21,んぁあっ、すみません、私、限界ですっ,sound/data/pcm/c38/h/01.unity3d,h_ai_38_00_099
88,38,21,んぁっ、イキますぅぅぅぅっ！,sound/data/pcm/c38/h/01.unity3d,h_ai_38_00_100
89,38,21,他の方にイカせて頂くのって、こんなに凄いものなのですね……,sound/data/pcm/c38/h/01.unity3d,h_ai_38_00_101
90,38,21,息が、整いません……ずっと体が、ビクビクしてっ,sound/data/pcm/c38/h/01.unity3d,h_ai_38_00_102
91,38,21,これが……イカされるという、ことなんですね……,sound/data/pcm/c38/h/01.unity3d,h_ai_38_00_103
92,38,21,また、気持ちよくして頂けるのですか？　ぁ、えと、おねだりをしているというわけではなく……,sound/data/pcm/c38/h/01.unity3d,h_ai_38_00_104
93,38,21,体の力が抜けてしまっていますが……お触り頂けるのであれば……どうぞ、ご自由に……,sound/data/pcm/c38/h/01.unity3d,h_ai_38_00_105
94,38,21,ところかまわずキスをしたくなる人の気持ち、わかった気がします……,sound/data/pcm/c38/h/01.unity3d,h_ai_38_00_108
95,38,21,キスって、こんなに気持ちのいいものだったんですね……,sound/data/pcm/c38/h/01.unity3d,h_ai_38_00_109
96,38,21,キス、好きになってしまったみたいで……もう少しだけしませんか？,sound/data/pcm/c38/h/01.unity3d,h_ai_38_00_110
97,38,21,何をしてもいいですから……たまにキスをしてください……,sound/data/pcm/c38/h/01.unity3d,h_ai_38_00_111
98,38,21,そ、その……本当にすみません、キスだけはご勘弁ください……,sound/data/pcm/c38/h/01.unity3d,h_ai_38_00_118
99,38,21,だ、ダメですよ？　どさくさに紛れても、キスだけは見逃せません……,sound/data/pcm/c38/h/01.unity3d,h_ai_38_00_119
100,38,21,そこ、お好きなのですか？,sound/data/pcm/c38/h/01.unity3d,h_ai_38_00_120
101,38,21,たくさんされると、力が抜けてしまいます……,sound/data/pcm/c38/h/01.unity3d,h_ai_38_00_121
102,38,21,もっとしてください、貴方になら私は……,sound/data/pcm/c38/h/01.unity3d,h_ai_38_00_122
103,38,21,そう何度も、弱いところばかりされてはっ,sound/data/pcm/c38/h/01.unity3d,h_ai_38_00_123
104,38,21,あぁっ、いやらしい声が、出てしまいますっ,sound/data/pcm/c38/h/01.unity3d,h_ai_38_00_124
105,38,21,先が弱いと、知られてしまいましたね……んぅぅ……,sound/data/pcm/c38/h/01.unity3d,h_ai_38_00_125
106,38,21,貴方のおかげで、乳首が弱いとわかりました……,sound/data/pcm/c38/h/01.unity3d,h_ai_38_00_126
107,38,21,あ、あまり弄られ過ぎますと……立てなくなってしまいそうで……,sound/data/pcm/c38/h/01.unity3d,h_ai_38_00_127
108,38,21,あぁっ、そんなにしては……おもらし、してしまいますっ,sound/data/pcm/c38/h/01.unity3d,h_ai_38_00_128
109,38,21,お尻でイカせようとするの、反則ですっ……,sound/data/pcm/c38/h/01.unity3d,h_ai_38_00_129
110,38,21,あぁ、確実に私、お尻を開発されてしまっています……,sound/data/pcm/c38/h/01.unity3d,h_ai_38_00_130
111,38,21,（拒否）うぅ、やはり強いのはまだ、痛みが勝ってしまって……,sound/data/pcm/c38/h/01.unity3d,h_ai_38_00_131
112,38,21,（拒否）慣れるまででいいので、なるべく優しくしてください……,sound/data/pcm/c38/h/01.unity3d,h_ai_38_00_132
113,38,21,（拒否）お尻はダメだと……言いましたよね？,sound/data/pcm/c38/h/01.unity3d,h_ai_38_00_133
114,38,21,（拒否）やっ、どうして、汚いところばかり触りたがるのですか？,sound/data/pcm/c38/h/01.unity3d,h_ai_38_00_134
115,38,21,（拒否）そ、そういったものは……やはり怖いです……,sound/data/pcm/c38/h/01.unity3d,h_ai_38_00_135
116,38,21,（拒否）普通にいたしましょう？　私はそれで満足ですので……,sound/data/pcm/c38/h/01.unity3d,h_ai_38_00_136
117,38,21,少し揉み過ぎではありませんか？　いえ、嫌ではないのですが……,sound/data/pcm/c38/h/01.unity3d,h_ai_38_00_137
118,38,21,貴方に揉まれた感触……しばらく残りそうです……,sound/data/pcm/c38/h/01.unity3d,h_ai_38_00_138
119,38,21,んぁん、あまりつつかれますと、どんどん硬くなってしまうので……,sound/data/pcm/c38/h/01.unity3d,h_ai_38_00_143
120,38,21,ひぅっ、つつくのではなく……普通に触って頂いて構いませんよ？,sound/data/pcm/c38/h/01.unity3d,h_ai_38_00_144
121,38,21,んゃっ、そう何度も引っ張れては……伸びてしまいますっ,sound/data/pcm/c38/h/01.unity3d,h_ai_38_00_145
122,38,21,乳首は、もう少し優しく……イった後は、特に敏感なのでっ……,sound/data/pcm/c38/h/01.unity3d,h_ai_38_00_146
123,38,21,お尻の開発、念入り過ぎませんか？,sound/data/pcm/c38/h/01.unity3d,h_ai_38_00_147
124,38,21,お尻でしたいのはわかりましたから、もう弄らず、いっそ一思いに……,sound/data/pcm/c38/h/01.unity3d,h_ai_38_00_148
125,38,21,とても敏感になっているので、お願いですから、優しくっ……,sound/data/pcm/c38/h/01.unity3d,h_ai_38_00_149
126,38,21,うぅ、びしょ濡れになっていますから……手が汚れてしまいますよ？,sound/data/pcm/c38/h/01.unity3d,h_ai_38_00_150
127,38,21,あの、ご自分で試されればわかると思います、お尻は、色々大変なのです……,sound/data/pcm/c38/h/01.unity3d,h_ai_38_00_151
128,38,21,イった後は、お尻も敏感になるんですね……うぅ……,sound/data/pcm/c38/h/01.unity3d,h_ai_38_00_152
129,38,21,あぁっ、濡れていると、やはり入れやすいのですねっ,sound/data/pcm/c38/h/01.unity3d,h_ai_38_00_153
130,38,21,抵抗なく指が入って、うぅ、私のアソコ、エッチになってしまっています……,sound/data/pcm/c38/h/01.unity3d,h_ai_38_00_154
131,38,21,えっ、今……すんなり指が入ってしまいましたよね？　ぅぅぅ……,sound/data/pcm/c38/h/01.unity3d,h_ai_38_00_155
132,38,21,私のお尻、確実に拡げられてしまっています……,sound/data/pcm/c38/h/01.unity3d,h_ai_38_00_156
133,38,21,んくっ、またいやらしいおつゆが、溢れてしまいますっ、,sound/data/pcm/c38/h/01.unity3d,h_ai_38_00_157
134,38,21,わざと音をさせていますね？　うぅ、意地悪ですよ……,sound/data/pcm/c38/h/01.unity3d,h_ai_38_00_158
135,38,21,こうやって何度もして、お尻に慣れていくのですよねっ……,sound/data/pcm/c38/h/01.unity3d,h_ai_38_00_159
136,38,21,指でよく拡げておいてください……もっと太いものを、受け入れられるように……,sound/data/pcm/c38/h/01.unity3d,h_ai_38_00_160
137,38,21,んぁっ、そんなに舐めて、舌が疲れないのですか？,sound/data/pcm/c38/h/01.unity3d,h_ai_38_00_161
138,38,21,貴方の唾液で、もうどこもベトベトです……,sound/data/pcm/c38/h/01.unity3d,h_ai_38_00_162
139,38,21,先っぽに貴方の匂い、染み付いてしまいそうです……,sound/data/pcm/c38/h/01.unity3d,h_ai_38_00_163
140,38,21,んっ、エッチな赤ちゃんですね……困ったものです……,sound/data/pcm/c38/h/01.unity3d,h_ai_38_00_164
141,38,21,あぁっ、唾液と私のおつゆが混ざって、凄くいやらしい匂いに……,sound/data/pcm/c38/h/01.unity3d,h_ai_38_00_165
142,38,21,イった後のお股をぺろぺろされるの、刺激が強過ぎますっ,sound/data/pcm/c38/h/01.unity3d,h_ai_38_00_166
143,38,21,あの、本当に汚いですから……お尻はそんなに舐めてはっ……,sound/data/pcm/c38/h/01.unity3d,h_ai_38_00_167
144,38,21,もう、どうなっても知りませんよ？　ここからは自己責任でお願いします……,sound/data/pcm/c38/h/01.unity3d,h_ai_38_00_168
145,38,21,そこは舌を入れるところではないとっ……あぁっ、言っていますのにぃっ,sound/data/pcm/c38/h/01.unity3d,h_ai_38_00_169
146,38,21,どうしてそう、強引なのですかっ……うぅぅっ,sound/data/pcm/c38/h/01.unity3d,h_ai_38_00_170
147,38,21,あぁあ、私またイきますっ、貴方にイカされてしまいますっ,sound/data/pcm/c38/h/01.unity3d,h_ai_38_00_171
148,38,21,どうしましょう、私、またイキそうになっていますっ,sound/data/pcm/c38/h/01.unity3d,h_ai_38_00_172
149,38,21,私の身体って、こんなにイケるものだったのですね……,sound/data/pcm/c38/h/01.unity3d,h_ai_38_00_173
150,38,21,何度イカされても、体の火照りが収まらなくて、私、おかしくなってしまったのでしょうか？,sound/data/pcm/c38/h/01.unity3d,h_ai_38_00_174
