管理番号,大きい項目,中間項目,表示名,バンドルパス,ファイル名
231,32,44,さっきよりもエッチな声が聞こえます。,sound/data/pcm/c32/h/01.unity3d,h_so_32_02_231
232,32,44,敏感なペニスでまたイッて下さい。,sound/data/pcm/c32/h/01.unity3d,h_so_32_02_232
233,32,44,早く射精したいですよね。,sound/data/pcm/c32/h/01.unity3d,h_so_32_02_233
234,32,44,もっと私のお尻を開発して下さい。,sound/data/pcm/c32/h/01.unity3d,h_so_32_02_234
235,32,44,お尻でイケる幸せを私に……！,sound/data/pcm/c32/h/01.unity3d,h_so_32_02_235
236,32,44,お尻の穴がめくれそうです……！,sound/data/pcm/c32/h/01.unity3d,h_so_32_02_236
237,32,44,アナルがビクビクして……！,sound/data/pcm/c32/h/01.unity3d,h_so_32_02_237
238,32,44,好きなだけズボズボして下さい。,sound/data/pcm/c32/h/01.unity3d,h_so_32_02_238
239,32,44,私のお尻、もっと好きになって下さい。,sound/data/pcm/c32/h/01.unity3d,h_so_32_02_239
240,32,44,お尻の中であなたのモノがますます大きく……,sound/data/pcm/c32/h/01.unity3d,h_so_32_02_240
241,32,44,もっと括約筋を締めますよ。,sound/data/pcm/c32/h/01.unity3d,h_so_32_02_241
242,32,44,もう我慢の限界が……！,sound/data/pcm/c32/h/01.unity3d,h_so_32_02_242
243,32,44,またイッてもいいですか？,sound/data/pcm/c32/h/01.unity3d,h_so_32_02_243
244,32,44,(恋人限定)私たちの愛を証明しましょう……！,sound/data/pcm/c32/h/01.unity3d,h_so_32_02_244
245,32,44,イク時は一緒ですよ……！,sound/data/pcm/c32/h/01.unity3d,h_so_32_02_245
246,32,44,また私で気持ちよくなって下さっているのですね。,sound/data/pcm/c32/h/01.unity3d,h_so_32_02_246
247,32,44,我慢せず、どうぞ。,sound/data/pcm/c32/h/01.unity3d,h_so_32_02_247
248,32,44,今度も勢いよくお願いします。,sound/data/pcm/c32/h/01.unity3d,h_so_32_02_248
249,32,44,またイクところを見せて下さい。,sound/data/pcm/c32/h/01.unity3d,h_so_32_02_249
250,32,44,ペニスが大きくなってきていますよ。,sound/data/pcm/c32/h/01.unity3d,h_so_32_02_250
251,32,44,どうぞいつでもイッて下さい。,sound/data/pcm/c32/h/01.unity3d,h_so_32_02_251
252,32,44,ゴムの先が奥深くを突いています。,sound/data/pcm/c32/h/01.unity3d,h_so_32_02_252
253,32,44,ゴムが押し付けられている感触がします。,sound/data/pcm/c32/h/01.unity3d,h_so_32_02_253
254,32,44,もうお尻が限界なんです……！,sound/data/pcm/c32/h/01.unity3d,h_so_32_02_254
255,32,44,アナルでまたイッていいですか……！？,sound/data/pcm/c32/h/01.unity3d,h_so_32_02_255
256,32,44,ぎゅっと締めますので、一緒にイキましょう……！,sound/data/pcm/c32/h/01.unity3d,h_so_32_02_256
257,32,44,こんなところまで仲良しですよね、私たち。,sound/data/pcm/c32/h/01.unity3d,h_so_32_02_257
258,32,44,最後までお尻をお楽しみ下さい。,sound/data/pcm/c32/h/01.unity3d,h_so_32_02_258
259,32,44,もうめちゃくちゃにしてもいいですよ。,sound/data/pcm/c32/h/01.unity3d,h_so_32_02_259
260,32,44,さっきよりもビクついていますね。,sound/data/pcm/c32/h/01.unity3d,h_so_32_02_260
261,32,44,なんて量を、また……,sound/data/pcm/c32/h/01.unity3d,h_so_32_02_261
262,32,44,ゴムが膨らんで、私の中がいっぱいに……,sound/data/pcm/c32/h/01.unity3d,h_so_32_02_262
263,32,44,またたっぷり出していますか？,sound/data/pcm/c32/h/01.unity3d,h_so_32_02_263
264,32,44,さっきあんなに出したはずですのに……,sound/data/pcm/c32/h/01.unity3d,h_so_32_02_264
265,32,44,腸の奥までドクドクきています……,sound/data/pcm/c32/h/01.unity3d,h_so_32_02_265
266,32,44,ああっ、イイ！,sound/data/pcm/c32/h/01.unity3d,h_so_32_02_266
267,32,44,イク、イクッ！,sound/data/pcm/c32/h/01.unity3d,h_so_32_02_267
268,32,44,イクゥゥゥッ！,sound/data/pcm/c32/h/01.unity3d,h_so_32_02_268
269,32,44,最高……！,sound/data/pcm/c32/h/01.unity3d,h_so_32_02_269
270,32,44,またゴムありでしましょうね。,sound/data/pcm/c32/h/01.unity3d,h_so_32_02_270
271,32,44,ゴムの滑り具合が好きです。,sound/data/pcm/c32/h/01.unity3d,h_so_32_02_271
272,32,44,私たちの相性……よすぎるかもしれませんね……,sound/data/pcm/c32/h/01.unity3d,h_so_32_02_272
273,32,44,最高でした。,sound/data/pcm/c32/h/01.unity3d,h_so_32_02_273
274,32,44,今は快感に浸りましょう。,sound/data/pcm/c32/h/01.unity3d,h_so_32_02_274
275,32,44,私もいつか母親になるのですよね……,sound/data/pcm/c32/h/01.unity3d,h_so_32_02_275
276,32,44,今度こそはと思っていたのですが……,sound/data/pcm/c32/h/01.unity3d,h_so_32_02_276
277,32,44,あなたの前ではさすがの私もかたなしです。,sound/data/pcm/c32/h/01.unity3d,h_so_32_02_277
278,32,44,私たち、本当にお尻好きですよね。,sound/data/pcm/c32/h/01.unity3d,h_so_32_02_278
279,32,44,一度ハマるとやめられませんね。,sound/data/pcm/c32/h/01.unity3d,h_so_32_02_279
280,32,44,こんなに開発されてしまうなんて……,sound/data/pcm/c32/h/01.unity3d,h_so_32_02_280
281,32,44,スケベなお尻ですみません……,sound/data/pcm/c32/h/01.unity3d,h_so_32_02_281
282,32,44,ゴムありペニスにはもう降参です。,sound/data/pcm/c32/h/01.unity3d,h_so_32_02_282
283,32,44,ゴムが擦れて最高でした。,sound/data/pcm/c32/h/01.unity3d,h_so_32_02_283
284,32,44,またいちだんと激しかったですね。,sound/data/pcm/c32/h/01.unity3d,h_so_32_02_284
285,32,44,また私とセックスして下さいね。,sound/data/pcm/c32/h/01.unity3d,h_so_32_02_285
286,32,44,またイケナイセックスをしてしまいましたね。,sound/data/pcm/c32/h/01.unity3d,h_so_32_02_286
287,32,44,危険日ですのにね……,sound/data/pcm/c32/h/01.unity3d,h_so_32_02_287
288,32,44,激しすぎたせいですね……,sound/data/pcm/c32/h/01.unity3d,h_so_32_02_288
289,32,44,あなた、またセックスが上達しました？,sound/data/pcm/c32/h/01.unity3d,h_so_32_02_289
290,32,44,限界を超えてもアナルセックスしそうですよね、私たち。,sound/data/pcm/c32/h/01.unity3d,h_so_32_02_290
291,32,44,どこまでもあなたについていきますよ。,sound/data/pcm/c32/h/01.unity3d,h_so_32_02_291
292,32,44,お尻に力が入りません……,sound/data/pcm/c32/h/01.unity3d,h_so_32_02_292
293,32,44,ああ、まだお尻全体に余韻が……,sound/data/pcm/c32/h/01.unity3d,h_so_32_02_293
294,32,44,ペニスの暴れ具合がすごかったですね。,sound/data/pcm/c32/h/01.unity3d,h_so_32_02_294
295,32,44,何度でもこの量が出せるのは、感心しますよ。,sound/data/pcm/c32/h/01.unity3d,h_so_32_02_295
296,32,44,精液でもうお腹がたぷたぷです。,sound/data/pcm/c32/h/01.unity3d,h_so_32_02_296
297,32,44,元気でいいと思います。,sound/data/pcm/c32/h/01.unity3d,h_so_32_02_297
298,32,44,心なしか子宮が一層喜んでいる気がします。,sound/data/pcm/c32/h/01.unity3d,h_so_32_02_298
299,32,44,もしかして私を孕ませるおつもりですか？　望むところですよ。,sound/data/pcm/c32/h/01.unity3d,h_so_32_02_299
300,32,44,ゴムをしててもあなたはあなたでしたね。,sound/data/pcm/c32/h/01.unity3d,h_so_32_02_300
301,32,44,パンパンなゴムの擦れが最高でした。,sound/data/pcm/c32/h/01.unity3d,h_so_32_02_301
302,32,44,(恋人限定)愛しています……これからもよろしくお願いしますね。,sound/data/pcm/c32/h/01.unity3d,h_so_32_02_302
303,32,44,やっぱりあなたは絶倫なのですね。,sound/data/pcm/c32/h/01.unity3d,h_so_32_02_303
304,32,44,あなたもだいぶ熱が入っていましたね。,sound/data/pcm/c32/h/01.unity3d,h_so_32_02_304
305,32,44,背徳感のある分、いつもと気持ち良さが違いましたね。,sound/data/pcm/c32/h/01.unity3d,h_so_32_02_305
306,32,44,(恋人限定)あなたに愛されていると、すごく実感しました。,sound/data/pcm/c32/h/01.unity3d,h_so_32_02_306
307,32,44,次こそはあなたを……！　って、毎回言っていますね、私……,sound/data/pcm/c32/h/01.unity3d,h_so_32_02_307
308,32,44,お尻の中で射精するのにハマッてしまいましたか？,sound/data/pcm/c32/h/01.unity3d,h_so_32_02_308
309,32,44,お尻でしたら気兼ねなく出せますしね。,sound/data/pcm/c32/h/01.unity3d,h_so_32_02_309
310,32,44,勢いがさっきよりも増してます……！？,sound/data/pcm/c32/h/01.unity3d,h_so_32_02_310
311,32,44,いいですね、どんどん出して下さい。,sound/data/pcm/c32/h/01.unity3d,h_so_32_02_311
312,32,44,精液を見ていると、またしたくなりますね……,sound/data/pcm/c32/h/01.unity3d,h_so_32_02_312
313,32,44,あなたのザーメンの匂い、好きですよ。,sound/data/pcm/c32/h/01.unity3d,h_so_32_02_313
314,32,44,あなたのがアソコから溢れて……,sound/data/pcm/c32/h/01.unity3d,h_so_32_02_314
315,32,44,こぼれ落ちるのを止められません……,sound/data/pcm/c32/h/01.unity3d,h_so_32_02_315
316,32,44,（開始時台詞）本当に、どこでもできてしまうんですね。もちろんちゃんとお付き合いしますよ。,sound/data/pcm/c32/h/01.unity3d,h_so_32_02_316
317,32,44,（開始時台詞）端とはいえ、誰かに見られたらどうするんです？　もう……仕方のない人ですね。,sound/data/pcm/c32/h/01.unity3d,h_so_32_02_317
