管理番号,大きい項目,中間項目,表示名,バンドルパス,ファイル名
0,32,33,ああっ……熱いのが…、入って……,sound/data/pcm/c32/h/01.unity3d,h_fe_32_01_014
1,32,33,えっと、これでいいですか？,sound/data/pcm/c32/h/01.unity3d,h_fe_32_01_034
2,32,33,まだ、慣れませんね……スムーズに身体が動かない……,sound/data/pcm/c32/h/01.unity3d,h_fe_32_01_043
3,32,33,この動かし方、あってます……？,sound/data/pcm/c32/h/01.unity3d,h_fe_32_01_044
4,32,33,ああ……攻めてるのに、責められてる……,sound/data/pcm/c32/h/01.unity3d,h_fe_32_01_051
5,32,33,腰を動かすと、奥にズンズン、感じます,sound/data/pcm/c32/h/01.unity3d,h_fe_32_01_062
6,32,33,気持ちよくなってきました……ああ、腰が大胆に動いちゃう,sound/data/pcm/c32/h/01.unity3d,h_fe_32_01_087
7,32,33,私の腰つき、エッチでしょう？　すごく頑張ってるんですよ,sound/data/pcm/c32/h/01.unity3d,h_fe_32_01_092
8,32,33,このままで気持ちよくなれますか？　私、頑張り、ます,sound/data/pcm/c32/h/01.unity3d,h_fe_32_01_093
9,32,33,ああ、あなたを見てると、必死になっちゃう……,sound/data/pcm/c32/h/01.unity3d,h_fe_32_01_094
10,32,33,なんとか、自分でイクことができました,sound/data/pcm/c32/h/01.unity3d,h_fe_32_01_150
11,32,33,すみません……はしたなく、いっぱい動いちゃいました,sound/data/pcm/c32/h/01.unity3d,h_fe_32_01_167
