管理番号,大きい項目,中間項目,表示名,バンドルパス,ファイル名
0,30,48,私達に見られて照れてるの？　ふふ、可愛いんだから……,sound/data/pcm/c30/h/01.unity3d,h_so3p_30_02_000
1,30,48,さぁ早く来て、二人もいるんだから……ぐずぐずしてられないわよ？,sound/data/pcm/c30/h/01.unity3d,h_so3p_30_02_001
2,30,48,やっぱりお姉さんに挿れたくなった？　私は全然構わないわよ？,sound/data/pcm/c30/h/01.unity3d,h_so3p_30_02_002
3,30,48,いつ挿れられるんだろって……ドキドキしてるんでしょ？　わかるわ,sound/data/pcm/c30/h/01.unity3d,h_so3p_30_02_003
4,30,48,ねぇ見える？　お姉さんの中に全部入っちゃったわ,sound/data/pcm/c30/h/01.unity3d,h_so3p_30_02_004
5,30,48,ふふっ、中で震えてる……すぐにイっちゃ、勿体ないわよ？,sound/data/pcm/c30/h/01.unity3d,h_so3p_30_02_005
6,30,48,動かないの？　もしかして、凄い締まりがいいとか？,sound/data/pcm/c30/h/01.unity3d,h_so3p_30_02_006
7,30,48,ほら、待ってる女の子もいるのよ……男の子が頑張ってくれなくちゃ,sound/data/pcm/c30/h/01.unity3d,h_so3p_30_02_007
8,30,48,わざと音出してるわね？　そんなに見せつけちゃ、可哀相よっ,sound/data/pcm/c30/h/01.unity3d,h_so3p_30_02_008
9,30,48,女の子同士だもん、ちょっと乱れても、わかってくれるわよね？,sound/data/pcm/c30/h/01.unity3d,h_so3p_30_02_009
10,30,48,どう？　おちんちん以外でも、ちゃんと気持ちよくなれてる？,sound/data/pcm/c30/h/01.unity3d,h_so3p_30_02_010
11,30,48,あぁっ、お姉さん余裕なくなっちゃう……変な声、聞かれちゃうっ,sound/data/pcm/c30/h/01.unity3d,h_so3p_30_02_011
12,30,48,おちんちんどう？　恥ずかしがらずに、私に感想教えて？　,sound/data/pcm/c30/h/01.unity3d,h_so3p_30_02_012
13,30,48,ゆっくりされるの好き？　顔が蕩けちゃってるわよ……,sound/data/pcm/c30/h/01.unity3d,h_so3p_30_02_013
14,30,48,女の子の感じてる顔って、すっごくいやらしいのね……,sound/data/pcm/c30/h/01.unity3d,h_so3p_30_02_014
15,30,48,んっ、激しっ……お姉さんも、昂ってきちゃったかもっ,sound/data/pcm/c30/h/01.unity3d,h_so3p_30_02_015
16,30,48,ねぇ、二人でイってあげましょっ……男の子が頑張ってくれてるんだものっ,sound/data/pcm/c30/h/01.unity3d,h_so3p_30_02_016
17,30,48,すごいわ、見直しちゃった……今のキミ、すっごく男らしいっ,sound/data/pcm/c30/h/01.unity3d,h_so3p_30_02_017
18,30,48,私、こんなに感じやすかったかしら、おちんちんじゃないのにっ……,sound/data/pcm/c30/h/01.unity3d,h_so3p_30_02_018
19,30,48,もうちょっとよ、私達、もうちょとでイっちゃうからっ,sound/data/pcm/c30/h/01.unity3d,h_so3p_30_02_019
20,30,48,ほらほら、頑張れ男の子っ……女の子はまだまだ余裕よ？,sound/data/pcm/c30/h/01.unity3d,h_so3p_30_02_020
21,30,48,ふふ、もうイっちゃいそうね？　相手が二人で興奮しちゃったのかな？,sound/data/pcm/c30/h/01.unity3d,h_so3p_30_02_021
22,30,48,キミが頑張ってくれるほど、私達だけイキそうになっちゃうの、許してっ,sound/data/pcm/c30/h/01.unity3d,h_so3p_30_02_022
23,30,48,もっと一緒に楽しみたかったけど、ちょっと無理みたい、私達、イクわっ,sound/data/pcm/c30/h/01.unity3d,h_so3p_30_02_023
24,30,48,みんなでイキましょ、せーので合わせて？　絶対気持ちいいからっ,sound/data/pcm/c30/h/01.unity3d,h_so3p_30_02_024
25,30,48,私達、相性がいいみたいっ、みんなで一緒にイケそうなんて、凄い事よっ,sound/data/pcm/c30/h/01.unity3d,h_so3p_30_02_025
26,30,48,あっ、出しちゃうんだ……お姉さん以外に、中出し、しちゃうんだっ……,sound/data/pcm/c30/h/01.unity3d,h_so3p_30_02_026
27,30,48,そうね、キミだけイッちゃうなら、せめて中に出してあげてっ,sound/data/pcm/c30/h/01.unity3d,h_so3p_30_02_027
28,30,48,ふふ、私達に射精見せたいんだ？　いいよ、いっぱい出してねっ,sound/data/pcm/c30/h/01.unity3d,h_so3p_30_02_028
29,30,48,私に気を使わなくていいのよ？　キミの好きな所に、出していいのっ,sound/data/pcm/c30/h/01.unity3d,h_so3p_30_02_029
30,30,48,おちんちん、まだ震えてる……二人相手は、流石に大変だったかな？,sound/data/pcm/c30/h/01.unity3d,h_so3p_30_02_030
31,30,48,これでもう、私達は仲良しっ……次も絶対、みんなで一緒にイキましょ？,sound/data/pcm/c30/h/01.unity3d,h_so3p_30_02_031
32,30,48,キミ、ちょっと上手（うま）すぎよ……私達だけ、イカせちゃうなんて……,sound/data/pcm/c30/h/01.unity3d,h_so3p_30_02_032
33,30,48,次は、お姉さんに挿れてくれるでしょ？　ずっと、楽しみにしてたのよっ,sound/data/pcm/c30/h/01.unity3d,h_so3p_30_02_033
34,30,48,みんなでイケたのに、もっとって思っちゃう……私、はしたない子かな？,sound/data/pcm/c30/h/01.unity3d,h_so3p_30_02_034
35,30,48,お姉さんに挿れてくれたら、ちゃんとイカせてあげるっ……だから、ね？,sound/data/pcm/c30/h/01.unity3d,h_so3p_30_02_035
36,30,48,じゃあ、交代かな？　お姉さん的には……ちょっと名残惜しいけど,sound/data/pcm/c30/h/01.unity3d,h_so3p_30_02_036
37,30,48,順番は守らないとね……せっかくだし、みんなで気持ちよくならなくちゃ,sound/data/pcm/c30/h/01.unity3d,h_so3p_30_02_037
38,30,48,ねえ……次は私の中に入れてみない？,sound/data/pcm/c30/h/01.unity3d,h_so3p_30_02_038
39,30,48,おちんちんじゃなくても感じさせてくれて……うん、嬉しいわ,sound/data/pcm/c30/h/01.unity3d,h_so3p_30_02_039
40,30,48,ふふっ、こんなに出しちゃって……私達、もっと興奮しちゃうわよ？,sound/data/pcm/c30/h/01.unity3d,h_so3p_30_02_040
41,30,48,おちんちん汚れちゃったわね……次はお掃除？　それともこのまま？,sound/data/pcm/c30/h/01.unity3d,h_so3p_30_02_041
42,30,48,わぁ、凄い量……キミ達ってその……ここまで許し合えちゃう関係なの？,sound/data/pcm/c30/h/01.unity3d,h_so3p_30_02_042
43,30,48,なんだかエッチね……男の子が見たがる気持ち、ちょっとわかったかも,sound/data/pcm/c30/h/01.unity3d,h_so3p_30_02_043
44,30,48,イッちゃうぅぅぅぅっ！,sound/data/pcm/c30/h/01.unity3d,h_so3p_30_02_044
45,30,48,無理、イクぅぅぅっ！,sound/data/pcm/c30/h/01.unity3d,h_so3p_30_02_045
46,30,48,イク、イク、イッちゃぁぁぁうっ！,sound/data/pcm/c30/h/01.unity3d,h_so3p_30_02_046
47,30,48,イクッ、はぁぁぁぁぁぁーっ！,sound/data/pcm/c30/h/01.unity3d,h_so3p_30_02_047
