管理番号,大きい項目,中間項目,表示名,バンドルパス,ファイル名
0,01,44,もうすっかり身体が熱くなってしまっています……,sound/data/pcm/c01/h/01.unity3d,h_so_01_02_000
1,01,44,わ、私も、あなたがほしいと……思っていますよ？,sound/data/pcm/c01/h/01.unity3d,h_so_01_02_001
2,01,44,あなたと肌を重ねること、とても幸せだと感じています,sound/data/pcm/c01/h/01.unity3d,h_so_01_02_002
3,01,44,一緒に、たくさん気持ちよくなりましょうね？,sound/data/pcm/c01/h/01.unity3d,h_so_01_02_003
4,01,44,この瞬間は、いまだにドキドキです……,sound/data/pcm/c01/h/01.unity3d,h_so_01_02_004
5,01,44,はい。あなたを感じさせてください,sound/data/pcm/c01/h/01.unity3d,h_so_01_02_005
6,01,44,いけませんよ。ゴムを付けてからでなくては,sound/data/pcm/c01/h/01.unity3d,h_so_01_02_006
7,01,44,避妊は大切なことですから、しっかりとしましょう。ね？,sound/data/pcm/c01/h/01.unity3d,h_so_01_02_007
8,01,44,今日は危険日なので……すみません、ゴム越しになっちゃいますが……,sound/data/pcm/c01/h/01.unity3d,h_so_01_02_008
9,01,44,そんなに残念そうな顔をしないでください。安全日でしたら……な、生で大丈夫ですから,sound/data/pcm/c01/h/01.unity3d,h_so_01_02_009
10,01,44,お尻、好きになっちゃのですか？,sound/data/pcm/c01/h/01.unity3d,h_so_01_02_010
11,01,44,仕方ないですね。いいですよ、入れても,sound/data/pcm/c01/h/01.unity3d,h_so_01_02_011
12,01,44,お尻よりも気持ち良い場所に、入れてほしいです……,sound/data/pcm/c01/h/01.unity3d,h_so_01_02_012
13,01,44,無理を言っているのはわかるのですが、お尻はダメなんです……,sound/data/pcm/c01/h/01.unity3d,h_so_01_02_013
14,01,44,はぁんっ！　あなたの、入ってきました……,sound/data/pcm/c01/h/01.unity3d,h_so_01_02_014
15,01,44,んああぁっ！　熱いおちんちん、ずぷって,sound/data/pcm/c01/h/01.unity3d,h_so_01_02_015
16,01,44,ひゃんっ……お尻の穴、貫かれちゃいました……,sound/data/pcm/c01/h/01.unity3d,h_so_01_02_016
17,01,44,お尻でも、たくさん感じます……ふふふっ,sound/data/pcm/c01/h/01.unity3d,h_so_01_02_017
18,01,44,はぁ、はぁ……入れてもらえるだけで、嬉しくなってしまいます……,sound/data/pcm/c01/h/01.unity3d,h_so_01_02_018
19,01,44,心だけでなく、身体も……喜んでます……,sound/data/pcm/c01/h/01.unity3d,h_so_01_02_019
20,01,44,なんだか、頭がぼーっとしてきちゃいます……,sound/data/pcm/c01/h/01.unity3d,h_so_01_02_020
21,01,44,はあぁ……入れられちゃいましたね……ふふっ,sound/data/pcm/c01/h/01.unity3d,h_so_01_02_021
22,01,44,もう、せっかちですね……,sound/data/pcm/c01/h/01.unity3d,h_so_01_02_022
23,01,44,段々、受け入れてしまっている私がいます……,sound/data/pcm/c01/h/01.unity3d,h_so_01_02_023
24,01,44,これはこれで、気持ちが良いものですね……,sound/data/pcm/c01/h/01.unity3d,h_so_01_02_024
25,01,44,はぁ、あぁあ……この感覚に慣れ始めている自分が怖いです……,sound/data/pcm/c01/h/01.unity3d,h_so_01_02_025
26,01,44,ああぁ……やはり、変な感じです……,sound/data/pcm/c01/h/01.unity3d,h_so_01_02_026
27,01,44,エッチな顔していますね……ふふっ,sound/data/pcm/c01/h/01.unity3d,h_so_01_02_027
28,01,44,そろそろ、動いてもいいですよ……？,sound/data/pcm/c01/h/01.unity3d,h_so_01_02_028
29,01,44,このままでも、んんっ、ぁ……気持ち良い,sound/data/pcm/c01/h/01.unity3d,h_so_01_02_029
30,01,44,お尻でも……あなたのこと、感じます……,sound/data/pcm/c01/h/01.unity3d,h_so_01_02_030
31,01,44,今は……そうですね、気持ち良いです,sound/data/pcm/c01/h/01.unity3d,h_so_01_02_031
32,01,44,どうですか……？　私のお尻は……？,sound/data/pcm/c01/h/01.unity3d,h_so_01_02_032
33,01,44,ふあ、あぁぁ……あなたのが、出ていっちゃった……,sound/data/pcm/c01/h/01.unity3d,h_so_01_02_033
34,01,44,んぁ……やめて、しまうのですか？,sound/data/pcm/c01/h/01.unity3d,h_so_01_02_034
35,01,44,抜かれるときの刺激でも、感じてしまいます……,sound/data/pcm/c01/h/01.unity3d,h_so_01_02_035
36,01,44,ぁ、んっ……ちょっとびくっとしちゃいました……,sound/data/pcm/c01/h/01.unity3d,h_so_01_02_036
37,01,44,お尻で……しないんですか？,sound/data/pcm/c01/h/01.unity3d,h_so_01_02_037
38,01,44,おちんちん、抜けてしまいましたね……,sound/data/pcm/c01/h/01.unity3d,h_so_01_02_038
39,01,44,じわじわ、気持ち良くなってきます……,sound/data/pcm/c01/h/01.unity3d,h_so_01_02_039
40,01,44,じっくり動かれるの……好き、です……,sound/data/pcm/c01/h/01.unity3d,h_so_01_02_040
41,01,44,この感じで、もっと動いてください……,sound/data/pcm/c01/h/01.unity3d,h_so_01_02_041
42,01,44,このスピードにも、慣れてきた気がします,sound/data/pcm/c01/h/01.unity3d,h_so_01_02_042
43,01,44,あぁっ、奥、ぐいって……,sound/data/pcm/c01/h/01.unity3d,h_so_01_02_043
44,01,44,もっと……もっとしてください,sound/data/pcm/c01/h/01.unity3d,h_so_01_02_044
45,01,44,お尻、いいです……もっとしてください,sound/data/pcm/c01/h/01.unity3d,h_so_01_02_045
46,01,44,ゆっくりでしたら、お尻も気持ちいいものですね,sound/data/pcm/c01/h/01.unity3d,h_so_01_02_046
47,01,44,アソコとはまた違う気持ち良さですね,sound/data/pcm/c01/h/01.unity3d,h_so_01_02_047
48,01,44,お、お尻で感じちゃってます、私……,sound/data/pcm/c01/h/01.unity3d,h_so_01_02_048
49,01,44,はぁんっ……き、気持ち、いい……,sound/data/pcm/c01/h/01.unity3d,h_so_01_02_049
50,01,44,そ、そこ……いい、です……っ,sound/data/pcm/c01/h/01.unity3d,h_so_01_02_050
51,01,44,弄られながらするの……気持ち良いです……,sound/data/pcm/c01/h/01.unity3d,h_so_01_02_051
52,01,44,あうぅ……恥ずかしいけど、気持ち良い……,sound/data/pcm/c01/h/01.unity3d,h_so_01_02_052
53,01,44,ほんとに、ダメです……変に……変になっちゃいますから,sound/data/pcm/c01/h/01.unity3d,h_so_01_02_053
54,01,44,お、おまんこと同時は……刺激強すぎで……,sound/data/pcm/c01/h/01.unity3d,h_so_01_02_054
55,01,44,一緒にされると、中でもいっぱい、感じます……,sound/data/pcm/c01/h/01.unity3d,h_so_01_02_055
56,01,44,同時にするなんて、エッチなんですから……,sound/data/pcm/c01/h/01.unity3d,h_so_01_02_056
57,01,44,そんなに、私の弱いところ……弄りたいんですか？,sound/data/pcm/c01/h/01.unity3d,h_so_01_02_057
58,01,44,イジワル……なんですから、もう……,sound/data/pcm/c01/h/01.unity3d,h_so_01_02_058
59,01,44,いい、です……ゆっくり、奥の方まで来て……,sound/data/pcm/c01/h/01.unity3d,h_so_01_02_059
60,01,44,おまんこの中、何度も擦られてる……,sound/data/pcm/c01/h/01.unity3d,h_so_01_02_060
61,01,44,気持ち良い……っ、おちんちん、いい……,sound/data/pcm/c01/h/01.unity3d,h_so_01_02_061
62,01,44,もっと……がつんがつん、来てもいいですよ？,sound/data/pcm/c01/h/01.unity3d,h_so_01_02_062
63,01,44,奥の方……もっと、突いてほしい……ですっ,sound/data/pcm/c01/h/01.unity3d,h_so_01_02_063
64,01,44,中、激しく擦られて……ふやぁんっ！,sound/data/pcm/c01/h/01.unity3d,h_so_01_02_064
65,01,44,やあぁ……んっ、お尻……感じますぅ,sound/data/pcm/c01/h/01.unity3d,h_so_01_02_065
66,01,44,私、本当に変態です……お尻でこんなに、気持ち良くなって……,sound/data/pcm/c01/h/01.unity3d,h_so_01_02_066
67,01,44,ここ責められるの……好きなんです……っ,sound/data/pcm/c01/h/01.unity3d,h_so_01_02_067
68,01,44,気持ち良くて、お尻の穴……もっときゅって締まっちゃいます……,sound/data/pcm/c01/h/01.unity3d,h_so_01_02_068
69,01,44,お尻で、感じすぎて……しまうかも……,sound/data/pcm/c01/h/01.unity3d,h_so_01_02_069
70,01,44,おちんちんでずぼずぼされて、お尻の穴……ひくひく言っちゃってる……,sound/data/pcm/c01/h/01.unity3d,h_so_01_02_070
71,01,44,あああぁ……もっと感じちゃいますぅ,sound/data/pcm/c01/h/01.unity3d,h_so_01_02_071
72,01,44,そこ、もっと触ってください……！　もっとぉっ！,sound/data/pcm/c01/h/01.unity3d,h_so_01_02_072
73,01,44,そこ、今は……ダメです、はぁんっ……！,sound/data/pcm/c01/h/01.unity3d,h_so_01_02_073
74,01,44,快感が、弾けてしまいそう……,sound/data/pcm/c01/h/01.unity3d,h_so_01_02_074
75,01,44,せっかくおちんちんで、感じられているので……そちらでお願いします……,sound/data/pcm/c01/h/01.unity3d,h_so_01_02_075
76,01,44,そこをイジられると、気が散ってしまいます……,sound/data/pcm/c01/h/01.unity3d,h_so_01_02_076
77,01,44,触れながらでかまいませんので、たくさん突いてください,sound/data/pcm/c01/h/01.unity3d,h_so_01_02_077
78,01,44,そこを弄るのと一緒に、おちんちんいっぱいくださいっ,sound/data/pcm/c01/h/01.unity3d,h_so_01_02_078
79,01,44,ぴちゅ、ぴちゃ、ちゅぅ……お口の方でも、繋がっていたいです……,sound/data/pcm/c01/h/01.unity3d,h_so_01_02_079
80,01,44,れる、れぉぉ、んっ、ちゅ……もっと溶け合いたい、です……,sound/data/pcm/c01/h/01.unity3d,h_so_01_02_080
81,01,44,ぴちゃ、ぴちゅぅ、んっ、んんん……は、激しいぃ……,sound/data/pcm/c01/h/01.unity3d,h_so_01_02_081
82,01,44,づじゅ、じゅ、んっ、ちゅりゅぅぅ……はぁ、ああぁ……おちんちん、もっと速く……んぁああぁっ,sound/data/pcm/c01/h/01.unity3d,h_so_01_02_082
83,01,44,んんんっっ、ちゅるぅ、づ、じゅ……唇も、おちんちんも、美味しい……,sound/data/pcm/c01/h/01.unity3d,h_so_01_02_083
84,01,44,ぴちゅ、ちゅ、んっ、れるっ……や、ぁん……キスで、おちんちんも……喜んでいるみたいです……,sound/data/pcm/c01/h/01.unity3d,h_so_01_02_084
85,01,44,ちゅ、んんぅ……んぁ、ん……ちゅぅ……ぁ、おちんちん、暴れてますぅ……,sound/data/pcm/c01/h/01.unity3d,h_so_01_02_085
86,01,44,はぁんっ！　す、凄い……このまま続けてください……んっ、ちゅ、ちゅぅ、んんんんんっ……！,sound/data/pcm/c01/h/01.unity3d,h_so_01_02_086
87,01,44,あなたとのエッチで、私……おかしくなっちゃいそうです,sound/data/pcm/c01/h/01.unity3d,h_so_01_02_087
88,01,44,だんだん、なにも考えられなくなってきています……,sound/data/pcm/c01/h/01.unity3d,h_so_01_02_088
89,01,44,んっ、ぁ……絶頂が、近いかも……しれません,sound/data/pcm/c01/h/01.unity3d,h_so_01_02_089
90,01,44,このままでは、アソコ……大変なことになってしまいそう……,sound/data/pcm/c01/h/01.unity3d,h_so_01_02_090
91,01,44,あなたの気持ち良さそうな声、もっと聞かせてください,sound/data/pcm/c01/h/01.unity3d,h_so_01_02_091
92,01,44,ああぁ、いいですよ……おまんこで、思う存分気持ち良くなってください……！,sound/data/pcm/c01/h/01.unity3d,h_so_01_02_092
93,01,44,もしかして、そろそろイキそうですか？　最後まで、激しくしてほしいです,sound/data/pcm/c01/h/01.unity3d,h_so_01_02_093
94,01,44,おちんちんとおまんこが、こんなに擦れあって……はぁんっ！,sound/data/pcm/c01/h/01.unity3d,h_so_01_02_094
95,01,44,こ、このまま……お尻でイッちゃいそうです……,sound/data/pcm/c01/h/01.unity3d,h_so_01_02_095
96,01,44,お尻でのエッチがこんなに気持ちいいって、あなたとだから気づけました……,sound/data/pcm/c01/h/01.unity3d,h_so_01_02_096
97,01,44,その……もっと、欲しいです……お尻の奥まで,sound/data/pcm/c01/h/01.unity3d,h_so_01_02_097
98,01,44,気持ち良すぎます、おちんちんでお尻突かれるのぉ……,sound/data/pcm/c01/h/01.unity3d,h_so_01_02_098
99,01,44,息が荒くなって、きましたね……そろそろ達しますか？,sound/data/pcm/c01/h/01.unity3d,h_so_01_02_099
100,01,44,いいですよ、このまま……お尻で、イッてください……っ,sound/data/pcm/c01/h/01.unity3d,h_so_01_02_100
101,01,44,イッて、ください……このまま、もっとお尻の中を擦って……！,sound/data/pcm/c01/h/01.unity3d,h_so_01_02_101
102,01,44,おちんちんのスピード、こんなに速く……いやらしいですね、もう……,sound/data/pcm/c01/h/01.unity3d,h_so_01_02_102
103,01,44,もう、ダメ……イク……イッちゃいますぅ,sound/data/pcm/c01/h/01.unity3d,h_so_01_02_103
104,01,44,おちんちんで、もう私……イッちゃいそうです……,sound/data/pcm/c01/h/01.unity3d,h_so_01_02_104
105,01,44,ああぁぁっ！　来ちゃいます……あなたも、一緒に……！,sound/data/pcm/c01/h/01.unity3d,h_so_01_02_105
106,01,44,イク、イッちゃいます……おちんちんと一緒にぃ……！,sound/data/pcm/c01/h/01.unity3d,h_so_01_02_106
107,01,44,熱い精液、たくさん注ぎ込んで……ほしいですっ,sound/data/pcm/c01/h/01.unity3d,h_so_01_02_107
108,01,44,おちんちんも、イキそうって言ってます……どうぞ？,sound/data/pcm/c01/h/01.unity3d,h_so_01_02_108
109,01,44,はいっ、私にかけてもいいですからね……？,sound/data/pcm/c01/h/01.unity3d,h_so_01_02_109
110,01,44,わかりました、いっぱい……ください……,sound/data/pcm/c01/h/01.unity3d,h_so_01_02_110
111,01,44,射精しそうなの、わかります……,sound/data/pcm/c01/h/01.unity3d,h_so_01_02_111
112,01,44,中と外、どちらがいいですか？,sound/data/pcm/c01/h/01.unity3d,h_so_01_02_112
113,01,44,いい、ですよ……ゴムの中に、びゅーびゅーしてくださいっ,sound/data/pcm/c01/h/01.unity3d,h_so_01_02_113
114,01,44,なにも気にせず、いっぱい出してくださいっ,sound/data/pcm/c01/h/01.unity3d,h_so_01_02_114
115,01,44,はぁんっ！　お尻責められて、イク……イクぅ,sound/data/pcm/c01/h/01.unity3d,h_so_01_02_115
116,01,44,私だけ、先に……すみません、もう……,sound/data/pcm/c01/h/01.unity3d,h_so_01_02_116
117,01,44,い、一緒にイきましょう……あなたもお尻で……,sound/data/pcm/c01/h/01.unity3d,h_so_01_02_117
118,01,44,私たち、本当にエッチです……お尻でイきそうに、なるなんてぇ……,sound/data/pcm/c01/h/01.unity3d,h_so_01_02_118
119,01,44,は、はい……では、もっとキツく締め付けますね,sound/data/pcm/c01/h/01.unity3d,h_so_01_02_119
120,01,44,イッて、ください……私のお尻を使って……！,sound/data/pcm/c01/h/01.unity3d,h_so_01_02_120
121,01,44,おちんちん、震えながら……あぁぁ……ドクドク射精してます……,sound/data/pcm/c01/h/01.unity3d,h_so_01_02_121
122,01,44,んぁ、はぁああぁ……すごい、いっぱい出てるぅ……,sound/data/pcm/c01/h/01.unity3d,h_so_01_02_122
123,01,44,おちんちん、こんなに震えて……気持ち良いんですね……,sound/data/pcm/c01/h/01.unity3d,h_so_01_02_123
124,01,44,ゴムの中に、ドロドロの精液出されちゃってます……,sound/data/pcm/c01/h/01.unity3d,h_so_01_02_124
125,01,44,ああぁっ、来ましたぁ……濃い精液、いっぱいぃ……,sound/data/pcm/c01/h/01.unity3d,h_so_01_02_125
126,01,44,お尻の中、とっても熱いです……,sound/data/pcm/c01/h/01.unity3d,h_so_01_02_126
127,01,44,イク、イクぅ……！！,sound/data/pcm/c01/h/01.unity3d,h_so_01_02_127
128,01,44,イクぅううんっ♪,sound/data/pcm/c01/h/01.unity3d,h_so_01_02_128
129,01,44,イクイクイクんぁああぁぁぁっ！！,sound/data/pcm/c01/h/01.unity3d,h_so_01_02_129
130,01,44,や、ああぁっ、あああぁぁんっ！！,sound/data/pcm/c01/h/01.unity3d,h_so_01_02_130
131,01,44,一緒のタイミングで、気持ち良くなれましたね……ふふふっ,sound/data/pcm/c01/h/01.unity3d,h_so_01_02_131
132,01,44,はぁ、ああぁ……こんなに、快感に飲まれたのは……あなたとだからですね,sound/data/pcm/c01/h/01.unity3d,h_so_01_02_132
133,01,44,一緒にイケるの……とっても幸せです……,sound/data/pcm/c01/h/01.unity3d,h_so_01_02_133
134,01,44,中も外もあなたで満たされて……すごく嬉しいです……うふふふっ,sound/data/pcm/c01/h/01.unity3d,h_so_01_02_134
135,01,44,もし妊娠したら……あなた似の子どもが生まれるのでしょうか……それとも……,sound/data/pcm/c01/h/01.unity3d,h_so_01_02_135
136,01,44,はぁ、はぁ……この量だと、赤ちゃんできたでしょうか,sound/data/pcm/c01/h/01.unity3d,h_so_01_02_136
137,01,44,今度は、あなたと一緒にイキたい……です,sound/data/pcm/c01/h/01.unity3d,h_so_01_02_137
138,01,44,私だけ達するのも気持ちいいですが、やはりあなたと二人で……,sound/data/pcm/c01/h/01.unity3d,h_so_01_02_138
139,01,44,お尻でするの、ハマってしまいそうですか？,sound/data/pcm/c01/h/01.unity3d,h_so_01_02_139
140,01,44,お尻の奥でまだ、おちんちん、びくびくって……はぁ、はあぁ……,sound/data/pcm/c01/h/01.unity3d,h_so_01_02_140
141,01,44,ど、どうしてお尻でこんなに感じるのでしょう……理由、わかりますか？,sound/data/pcm/c01/h/01.unity3d,h_so_01_02_141
142,01,44,まさかまたお尻で……しかも私だけ先にイッてしまうなんて……,sound/data/pcm/c01/h/01.unity3d,h_so_01_02_142
143,01,44,ゴムを付けているのに、妊娠させられそうな勢いでした……,sound/data/pcm/c01/h/01.unity3d,h_so_01_02_143
144,01,44,あんなに激しいエッチ、癖になっちゃいそう……,sound/data/pcm/c01/h/01.unity3d,h_so_01_02_144
145,01,44,やはり、二人一緒にイクと……気持ちいいですね……,sound/data/pcm/c01/h/01.unity3d,h_so_01_02_145
146,01,44,ふふふっ……身体全部が、あなたのものになったみたいです……,sound/data/pcm/c01/h/01.unity3d,h_so_01_02_146
147,01,44,あなたとの生エッチ、やはり最高……です……,sound/data/pcm/c01/h/01.unity3d,h_so_01_02_147
148,01,44,ゴム付きよりも、こちらのセックスの方が、好きかもしれません,sound/data/pcm/c01/h/01.unity3d,h_so_01_02_148
149,01,44,心も身体も、あなたに奪われちゃいましたね,sound/data/pcm/c01/h/01.unity3d,h_so_01_02_149
150,01,44,これくらいの激しさで、今度は一緒にイキたいです,sound/data/pcm/c01/h/01.unity3d,h_so_01_02_150
151,01,44,あなたのがお尻に入っていないと、なんだか落ち着かないんです……,sound/data/pcm/c01/h/01.unity3d,h_so_01_02_151
152,01,44,あっ、おちんちん、びくって……最後にまた射精しましたか？,sound/data/pcm/c01/h/01.unity3d,h_so_01_02_152
153,01,44,な、なんだか、私ばかりイッてしまっているような……,sound/data/pcm/c01/h/01.unity3d,h_so_01_02_153
154,01,44,精液を注がれないの、物足りなく感じてしまいます……,sound/data/pcm/c01/h/01.unity3d,h_so_01_02_154
155,01,44,ゴム越しに感じるおちんちんも、実は結構好きなんです,sound/data/pcm/c01/h/01.unity3d,h_so_01_02_155
156,01,44,あんなに激しくしても破れないなんて、コンドームってすごいんですね,sound/data/pcm/c01/h/01.unity3d,h_so_01_02_156
157,01,44,もう少し……このままでいましょうか,sound/data/pcm/c01/h/01.unity3d,h_so_01_02_157
158,01,44,とても……幸せ、です……,sound/data/pcm/c01/h/01.unity3d,h_so_01_02_158
159,01,44,はああぁあ……なんだかふわふわしますぅ,sound/data/pcm/c01/h/01.unity3d,h_so_01_02_159
160,01,44,危険日にこれほど中出しするなんて……大胆ですね、もう,sound/data/pcm/c01/h/01.unity3d,h_so_01_02_160
161,01,44,イッちゃいましたね、二人で。幸せいっぱいです,sound/data/pcm/c01/h/01.unity3d,h_so_01_02_161
162,01,44,気持ち良さを共有できて、心から嬉しいです,sound/data/pcm/c01/h/01.unity3d,h_so_01_02_162
163,01,44,おちんちんとおまんこ、まだぴったりとくっついていますね。お互いを感じられて嬉しいです,sound/data/pcm/c01/h/01.unity3d,h_so_01_02_163
164,01,44,中に出されるのは、やはり幸せです……,sound/data/pcm/c01/h/01.unity3d,h_so_01_02_164
165,01,44,危険日だと、他の日よりも感じやすい気がするんです,sound/data/pcm/c01/h/01.unity3d,h_so_01_02_165
166,01,44,危険日の中出し……最高かも……はあぁぁ……,sound/data/pcm/c01/h/01.unity3d,h_so_01_02_166
167,01,44,イケばイクほど、さらなく気持ち良さを求めてしまう私がいます……,sound/data/pcm/c01/h/01.unity3d,h_so_01_02_167
168,01,44,好きな人にイカされるのって、嬉しいものですよね,sound/data/pcm/c01/h/01.unity3d,h_so_01_02_168
169,01,44,お尻の穴でも、たくさん感じることができるんですね,sound/data/pcm/c01/h/01.unity3d,h_so_01_02_169
170,01,44,さすがに、お尻でエッチしていることは誰にも言えません……,sound/data/pcm/c01/h/01.unity3d,h_so_01_02_170
171,01,44,私たち、変態カップルですね。ふふっ,sound/data/pcm/c01/h/01.unity3d,h_so_01_02_171
172,01,44,ビクビク震えながら射精してます……はあぁぁ……,sound/data/pcm/c01/h/01.unity3d,h_so_01_02_172
173,01,44,エッチなお汁がこんなに……,sound/data/pcm/c01/h/01.unity3d,h_so_01_02_173
174,01,44,おちんちんの先、パクパクさせながら射精するんですよ。知っていましたか？,sound/data/pcm/c01/h/01.unity3d,h_so_01_02_174
175,01,44,思い切り射精して、気持ち良かったですか？,sound/data/pcm/c01/h/01.unity3d,h_so_01_02_175
176,01,44,あなたが感じてくれるだけでも、私は幸せです,sound/data/pcm/c01/h/01.unity3d,h_so_01_02_176
177,01,44,いっぱい出してくれて、ありがとうございました,sound/data/pcm/c01/h/01.unity3d,h_so_01_02_177
178,01,44,満足……してもらえましたか？,sound/data/pcm/c01/h/01.unity3d,h_so_01_02_178
179,01,44,あっ……おちんちんいなくなると、お尻が寂しいです……,sound/data/pcm/c01/h/01.unity3d,h_so_01_02_179
180,01,44,もう少し、蓋をしていてほしかったです……,sound/data/pcm/c01/h/01.unity3d,h_so_01_02_180
181,01,44,もっと、しましょう……,sound/data/pcm/c01/h/01.unity3d,h_so_01_02_181
182,01,44,きて……ください……,sound/data/pcm/c01/h/01.unity3d,h_so_01_02_182
183,01,44,おまんこで、もっと気持ち良くなってください,sound/data/pcm/c01/h/01.unity3d,h_so_01_02_183
184,01,44,先程のように、ガツガツ来てください,sound/data/pcm/c01/h/01.unity3d,h_so_01_02_184
185,01,44,すみません、ゴムは付けてほしいです,sound/data/pcm/c01/h/01.unity3d,h_so_01_02_185
186,01,44,先程も言いましたが、ゴムなしはダメですよ……？,sound/data/pcm/c01/h/01.unity3d,h_so_01_02_186
187,01,44,しっかり避妊をして、楽しみましょう？,sound/data/pcm/c01/h/01.unity3d,h_so_01_02_187
188,01,44,危険日ですから……ね？,sound/data/pcm/c01/h/01.unity3d,h_so_01_02_188
189,01,44,いいですよ……また、お尻でたくさん感じてください,sound/data/pcm/c01/h/01.unity3d,h_so_01_02_189
190,01,44,私も、お尻でしたいです……,sound/data/pcm/c01/h/01.unity3d,h_so_01_02_190
191,01,44,ご、ごめんなさい、お尻は……,sound/data/pcm/c01/h/01.unity3d,h_so_01_02_191
192,01,44,お尻の穴が広がってしまうのでダメです……,sound/data/pcm/c01/h/01.unity3d,h_so_01_02_192
193,01,44,いい、です……気持ち良い……,sound/data/pcm/c01/h/01.unity3d,h_so_01_02_193
194,01,44,また、ずぷぅってあなたのが……,sound/data/pcm/c01/h/01.unity3d,h_so_01_02_194
195,01,44,おちんちん、好きです……,sound/data/pcm/c01/h/01.unity3d,h_so_01_02_195
196,01,44,入れられるだけで、感じちゃいます,sound/data/pcm/c01/h/01.unity3d,h_so_01_02_196
197,01,44,何度でも、私の中で気持ち良くなってくださいね,sound/data/pcm/c01/h/01.unity3d,h_so_01_02_197
198,01,44,お尻……きゅうぅって締まっちゃいます……,sound/data/pcm/c01/h/01.unity3d,h_so_01_02_198
199,01,44,お腹の方まで、貫かれてしまったみたい……,sound/data/pcm/c01/h/01.unity3d,h_so_01_02_199
200,01,44,はぁんっ、またお尻なのですね,sound/data/pcm/c01/h/01.unity3d,h_so_01_02_200
201,01,44,お尻、いいですぅ……,sound/data/pcm/c01/h/01.unity3d,h_so_01_02_201
202,01,44,このままでも十分、気持ち良いです,sound/data/pcm/c01/h/01.unity3d,h_so_01_02_202
203,01,44,あなたのこと、中でいっぱい感じます,sound/data/pcm/c01/h/01.unity3d,h_so_01_02_203
204,01,44,お尻、動いちゃいます,sound/data/pcm/c01/h/01.unity3d,h_so_01_02_204
205,01,44,やはり、お尻も気持ち良い……です,sound/data/pcm/c01/h/01.unity3d,h_so_01_02_205
206,01,44,体位、変えますか？,sound/data/pcm/c01/h/01.unity3d,h_so_01_02_206
207,01,44,他のやり方のほうが良かったですか？,sound/data/pcm/c01/h/01.unity3d,h_so_01_02_207
208,01,44,ううぅ……は、恥ずかしいです……,sound/data/pcm/c01/h/01.unity3d,h_so_01_02_208
