管理番号,大きい項目,中間項目,表示名,バンドルパス,ファイル名
0,10,54,早くしてくれぇ……我慢ができんのだ、ほしくてたまらんのだぁ,sound/data/pcm/c10/h/01.unity3d,h_so_10_03_000
1,10,54,汝のオチンポも限界なんだろ？　さぁ、はじめよう,sound/data/pcm/c10/h/01.unity3d,h_so_10_03_001
2,10,54,我と汝はまだまだ契約の儀を続けなくてはならんのだ、だから早く入れてくれぇ,sound/data/pcm/c10/h/01.unity3d,h_so_10_03_002
3,10,54,我と汝の関係だ、言わぬでもわからるだろ？,sound/data/pcm/c10/h/01.unity3d,h_so_10_03_003
4,10,54,もう、熱くなってるんだ、早く慰めてくれぇ,sound/data/pcm/c10/h/01.unity3d,h_so_10_03_004
5,10,54,……準備万端といったところか、我は遠の前からできておるぞ,sound/data/pcm/c10/h/01.unity3d,h_so_10_03_005
6,10,54,ゴムがあった方が汝も安心してだせるだろ、さぁ、装備するがいい,sound/data/pcm/c10/h/01.unity3d,h_so_10_03_006
7,10,54,はやる気持ちは我も同じだが、しっかりするところはしっかりしろ,sound/data/pcm/c10/h/01.unity3d,h_so_10_03_007
8,10,54,ダメ、今日は危険な日なのだ……今度は生でしていいから今日はつけてくれ,sound/data/pcm/c10/h/01.unity3d,h_so_10_03_008
9,10,54,ゴムがない方が好きなのはわかるが……リスクは負いたくないだろ,sound/data/pcm/c10/h/01.unity3d,h_so_10_03_009
10,10,54,そうくると思っていたぞ、準備はできてるいつでもくるがいい,sound/data/pcm/c10/h/01.unity3d,h_so_10_03_010
11,10,54,お尻が好きなのか？　えへへ、我も同じだ,sound/data/pcm/c10/h/01.unity3d,h_so_10_03_011
12,10,54,ダメだ、お尻よりオマンコが熱くなっておるんだ、だから早くこっちに！,sound/data/pcm/c10/h/01.unity3d,h_so_10_03_012
13,10,54,今日は痛いのより、気持ちいいを優先したいのだがよいか？,sound/data/pcm/c10/h/01.unity3d,h_so_10_03_013
14,10,54,んあぁぁ……ドンドン入れてきてくれぇ,sound/data/pcm/c10/h/01.unity3d,h_so_10_03_014
15,10,54,んんっ、こ、この瞬間がたまらなく好きだ,sound/data/pcm/c10/h/01.unity3d,h_so_10_03_015
16,10,54,あぁぁ……我のアナルも汝のオチンポを求めていたみたいだぁ,sound/data/pcm/c10/h/01.unity3d,h_so_10_03_016
17,10,54,ふぅぅっ！　はぁ、はぁ……ふ、不意をつかれて入れられるの……嫌いじゃないぞ,sound/data/pcm/c10/h/01.unity3d,h_so_10_03_017
18,10,54,んんんっ！　この感覚が我は大好きなのだ！,sound/data/pcm/c10/h/01.unity3d,h_so_10_03_018
19,10,54,我のオマンコは汝のオチンポが大好きで喜んでおるぞ！,sound/data/pcm/c10/h/01.unity3d,h_so_10_03_019
20,10,54,入れるだけではダメだ、早く、早く次ぎのことをしてくれぇ,sound/data/pcm/c10/h/01.unity3d,h_so_10_03_020
21,10,54,さぁ、汝よ！　出し入れするなり、かき混ぜるなり、好きするのだ！,sound/data/pcm/c10/h/01.unity3d,h_so_10_03_021
22,10,54,早く、汝のオチンポで激しく気持ちよくしてくれぇ,sound/data/pcm/c10/h/01.unity3d,h_so_10_03_022
23,10,54,はぁぁんっ！　初めは嫌だったが、今はこんなにも求めてしまう,sound/data/pcm/c10/h/01.unity3d,h_so_10_03_023
24,10,54,うぅんんっ、汝のせいでアナルが性感帯になってしまった、責任をとるのだぞ,sound/data/pcm/c10/h/01.unity3d,h_so_10_03_024
25,10,54,あぁん、アナルに入れられるだけで気持ちが高ぶってくるぅ,sound/data/pcm/c10/h/01.unity3d,h_so_10_03_025
26,10,54,もう、入れられるだけでは動じなくなった……その代わり感じやすくなってしまったがな,sound/data/pcm/c10/h/01.unity3d,h_so_10_03_026
27,10,54,も、もう、じらさないでくれ！　我は突いてほしくてたまらんのだから,sound/data/pcm/c10/h/01.unity3d,h_so_10_03_027
28,10,54,ん、どうした？　もしかして我をどう犯そうか考えているのか？,sound/data/pcm/c10/h/01.unity3d,h_so_10_03_028
29,10,54,考えることなんてないだろ？　ただ、汝の好きにすればいいのだ,sound/data/pcm/c10/h/01.unity3d,h_so_10_03_029
30,10,54,は、早く突いてぇ……我をおかしくしてくれっ,sound/data/pcm/c10/h/01.unity3d,h_so_10_03_030
31,10,54,汝にも、我が求めているのがわかるだろ？　いじわるはぜずに始めてくれ,sound/data/pcm/c10/h/01.unity3d,h_so_10_03_031
32,10,54,この何もしない時間が我の期待を膨らませることになるぞ,sound/data/pcm/c10/h/01.unity3d,h_so_10_03_032
33,10,54,あんっ、な、何をしておるのだ！　気持ちよくしてくれるのではないのか！？,sound/data/pcm/c10/h/01.unity3d,h_so_10_03_033
34,10,54,やだよぉ……入れてくれ、それで我を快感に溺れさしてくれ,sound/data/pcm/c10/h/01.unity3d,h_so_10_03_034
35,10,54,ん、なぜ抜くのだ？　……わかったぞ、おねだりさせたいのだな……お願いだから汝のオチンポちょうだい,sound/data/pcm/c10/h/01.unity3d,h_so_10_03_035
36,10,54,あぁあ、異物が抜けてスッキリするけど……我は汝のオチンポがもっとほしいのだ,sound/data/pcm/c10/h/01.unity3d,h_so_10_03_036
37,10,54,だ、ダメ、続けてくれないと、嫌いになってしまうぞ,sound/data/pcm/c10/h/01.unity3d,h_so_10_03_037
38,10,54,はぁあっ……他のことで我を楽しませてくれるのか？,sound/data/pcm/c10/h/01.unity3d,h_so_10_03_038
39,10,54,ゆっくりだと、ねっとりと広がっていくのがわかるな,sound/data/pcm/c10/h/01.unity3d,h_so_10_03_039
40,10,54,はぁんっ、はぁ……し、幸せぇ…・…,sound/data/pcm/c10/h/01.unity3d,h_so_10_03_040
41,10,54,我の中に固いのが一本入ってくるのがわかるぞ,sound/data/pcm/c10/h/01.unity3d,h_so_10_03_041
42,10,54,あっあ、んんっ……速いのもいいが、遅いのも好きだぞ,sound/data/pcm/c10/h/01.unity3d,h_so_10_03_042
43,10,54,はっ、はぁぁ……ゆっくりの方が考えられるから、感じてしまうっ！,sound/data/pcm/c10/h/01.unity3d,h_so_10_03_043
44,10,54,これはよいぞ……はんっ……感覚が研ぎすまされて、汝を感じられる,sound/data/pcm/c10/h/01.unity3d,h_so_10_03_044
45,10,54,はああぁっ、ねっとり、ずっぽり、気持ちいいよぉぉぉ〜,sound/data/pcm/c10/h/01.unity3d,h_so_10_03_045
46,10,54,ふううっ、引かれるときのほうが、あっん……感じちゃう,sound/data/pcm/c10/h/01.unity3d,h_so_10_03_046
47,10,54,も、もっとお尻の中なでなでしてぇ、んんぁっ……そう、それぇ！,sound/data/pcm/c10/h/01.unity3d,h_so_10_03_047
48,10,54,んんんぁっ！　汝のオチンポでゴリゴリ、好きぃ！,sound/data/pcm/c10/h/01.unity3d,h_so_10_03_048
49,10,54,ふんんんっ！　我はお尻を犯されるのが好きみたいだぁ,sound/data/pcm/c10/h/01.unity3d,h_so_10_03_049
50,10,54,はぁ、はぁあんんっ、かき出されてるのが、ふんっ、わかるぞ,sound/data/pcm/c10/h/01.unity3d,h_so_10_03_050
51,10,54,あぁうぅんっ！　そ、そこも触ってぇ、気持ちよくさせてくれ,sound/data/pcm/c10/h/01.unity3d,h_so_10_03_051
52,10,54,はぁあんっ！　き、気持ちいいよ、突きながらもっと触ってぇっ,sound/data/pcm/c10/h/01.unity3d,h_so_10_03_052
53,10,54,ふぁっ、あぁ……触って欲しいときに……んあぁぁん……触ってくれて嬉しいぞ,sound/data/pcm/c10/h/01.unity3d,h_so_10_03_053
54,10,54,心が……んんっ…・・読めるのか？　はあっ……そこに触れて……はぁぁ……欲しかったのだ,sound/data/pcm/c10/h/01.unity3d,h_so_10_03_054
55,10,54,はぁ、はぁ……我に……嫌がれせをして、はうぅっ……楽しんでおるな,sound/data/pcm/c10/h/01.unity3d,h_so_10_03_055
56,10,54,くっ、うぅ……だからぁ……はっん……ダメなんだぁ、そこは……,sound/data/pcm/c10/h/01.unity3d,h_so_10_03_056
57,10,54,あっん……あぁ、そこは苦手なところなのにぃ……あっ、あぁん！　……どうでもよくなってる,sound/data/pcm/c10/h/01.unity3d,h_so_10_03_057
58,10,54,んんっ、あっ……もうよい……はぁ、はぁ……汝の好きにしろ,sound/data/pcm/c10/h/01.unity3d,h_so_10_03_058
59,10,54,あっ、あっ、あっん……抵抗……ん、あっ……できない……よんっ！,sound/data/pcm/c10/h/01.unity3d,h_so_10_03_059
60,10,54,ふぅ、あんっ……男らしくて……はぁっ……好きぃ,sound/data/pcm/c10/h/01.unity3d,h_so_10_03_060
61,10,54,あっ、うんっ…・…感じぇ……頭が……ふうんっ……くらくらするぅ……,sound/data/pcm/c10/h/01.unity3d,h_so_10_03_061
62,10,54,はっ、はっ、はぁぁ……これが……んんっ……我は、うんっ……好きなのだぁ,sound/data/pcm/c10/h/01.unity3d,h_so_10_03_062
63,10,54,ふっ、はぁんっ……お、おかしく……あっ、あぁ……なりそうだぉ,sound/data/pcm/c10/h/01.unity3d,h_so_10_03_063
64,10,54,うっ、んんっ、あっ……もっと……はぁぁ、んっ……・もっと激しくぅ……ピストンしてくれぇ,sound/data/pcm/c10/h/01.unity3d,h_so_10_03_064
65,10,54,ひゃぁっ、お尻が汝のオチンポを……んんっ……好きだと言って、おるぞぉ,sound/data/pcm/c10/h/01.unity3d,h_so_10_03_065
66,10,54,あっ、あぁん……お尻ぃ、もう慣れたぁ……はぁぁ、あんっ……だからガンガン突いてくれぇ！,sound/data/pcm/c10/h/01.unity3d,h_so_10_03_066
67,10,54,もっとぉ……強く……汝を強くかんじたいのだぁ,sound/data/pcm/c10/h/01.unity3d,h_so_10_03_067
68,10,54,い、入り口がこすれて痛い……くんんっ……でも、すごく感じてる,sound/data/pcm/c10/h/01.unity3d,h_so_10_03_068
69,10,54,んっ！　……アナルを……はぁ、あぁぁんっ……いじめられるのが好きなのだぁ！,sound/data/pcm/c10/h/01.unity3d,h_so_10_03_069
70,10,54,はっ、あっ、あぁ……オチンポがぁ……ふぅ、うんっ……壊れるまで続けてくれぇ……,sound/data/pcm/c10/h/01.unity3d,h_so_10_03_070
71,10,54,そっちもぉ、ううんっ！　はぁぁ……乱暴に触ってぇ……,sound/data/pcm/c10/h/01.unity3d,h_so_10_03_071
72,10,54,はぁ、あぁっ……我の体はぁ……もう、なんでも……感じるぅ……,sound/data/pcm/c10/h/01.unity3d,h_so_10_03_072
73,10,54,ふぅんっ、もっとぉ……もっと我を……あっ、はぁんっ……攻めてくれぇ……,sound/data/pcm/c10/h/01.unity3d,h_so_10_03_073
74,10,54,んっ、あっ……内と外から……あっ、あぁ……快感がせまってくるぅ……,sound/data/pcm/c10/h/01.unity3d,h_so_10_03_074
75,10,54,あ、あぁんっ……好きなら……そこも触ってくれぇ……,sound/data/pcm/c10/h/01.unity3d,h_so_10_03_075
76,10,54,ふぅ、んんっ……苦手なところぉ……あぁん……触れられてるのにぃ……んんっ！,sound/data/pcm/c10/h/01.unity3d,h_so_10_03_076
77,10,54,はぁ、はっ、あぁ……オチンポと一緒ならぁ……ふ、ふぅんっ……そこに触れられるのも悪くはない,sound/data/pcm/c10/h/01.unity3d,h_so_10_03_077
78,10,54,ダメなのにぃ、うんっ……すごくてぇ……あっ、んんっ……抵抗できないよぉ……,sound/data/pcm/c10/h/01.unity3d,h_so_10_03_078
79,10,54,うぷぅ、ちゅ……くちゅら……あんっ……舌を吸ってぇ,sound/data/pcm/c10/h/01.unity3d,h_so_10_03_079
80,10,54,くちゅ、ぬちゃ……激しく……んんっ、んちゅ……キスを……,sound/data/pcm/c10/h/01.unity3d,h_so_10_03_080
81,10,54,汝のキスに我は虜だ,sound/data/pcm/c10/h/01.unity3d,h_so_10_03_081
82,10,54,んんちゅ……ちゅっ、らちゅ……キスでぇ……ぬちゅ……窒息しそう,sound/data/pcm/c10/h/01.unity3d,h_so_10_03_082
83,10,54,はちゅ、らちゃ……ぷはっ……どっちも気持ちよすぎるぅ……,sound/data/pcm/c10/h/01.unity3d,h_so_10_03_083
84,10,54,口もおまんこもよだれがたれてすごいことになってる,sound/data/pcm/c10/h/01.unity3d,h_so_10_03_084
85,10,54,むちゅぅぅ……下も上も……らちゅ、んんっ……犯してくれぇ……,sound/data/pcm/c10/h/01.unity3d,h_so_10_03_085
86,10,54,ふんん、ちゅっ……汝の……ちゅぷ、ちゅ……すべてが、ほしいよぉ,sound/data/pcm/c10/h/01.unity3d,h_so_10_03_086
87,10,54,ふっ、うっ、うんんっ！　イッてしまう！　あぁぁっ！　出ちゃうよぉっ！,sound/data/pcm/c10/h/01.unity3d,h_so_10_03_087
88,10,54,はぁぁ……体が火照って……あ、あっ、あぁ……熱いよぉ……,sound/data/pcm/c10/h/01.unity3d,h_so_10_03_088
89,10,54,あぁん、あっ……我の中に混沌ではない、んんっ……快感が溢れてきてる……,sound/data/pcm/c10/h/01.unity3d,h_so_10_03_089
90,10,54,はぁんっ……このまま続けてぇ……あっん……すごく気持ちいいからぁ……,sound/data/pcm/c10/h/01.unity3d,h_so_10_03_090
91,10,54,汝から……んんっ…・・感じるぞ、イキたいと言うことがなぁ……,sound/data/pcm/c10/h/01.unity3d,h_so_10_03_091
92,10,54,あっ、あぁん……オチンポが震えておる……んんっ、んくぅ……限界が、きそうなのだなぁ,sound/data/pcm/c10/h/01.unity3d,h_so_10_03_092
93,10,54,ん、ん、んっ……わ、我に……あんっ……出来ることはないかぁ？　,sound/data/pcm/c10/h/01.unity3d,h_so_10_03_093
94,10,54,んんっ、あぁ……イキそう……あっ、あぁ……でも、汝にもイッて欲しいよ,sound/data/pcm/c10/h/01.unity3d,h_so_10_03_094
95,10,54,は、は、はぁぁっ……アナルが……んっ、あぁ……すごいことになってるよぉ,sound/data/pcm/c10/h/01.unity3d,h_so_10_03_095
96,10,54,はぁぁんっ、ああぁ、あっ……出ちゃうっ……んぁっ…いろんなものがっ……出ちゃうよぉっ！！,sound/data/pcm/c10/h/01.unity3d,h_so_10_03_096
97,10,54,お尻がぁ……ん、んんっ……ぬるぬるでぇ……あっん……オチンポが、すごい速さにっ！！,sound/data/pcm/c10/h/01.unity3d,h_so_10_03_097
98,10,54,んあああぁぁぁぁっ・……もうぉっっ！！　　ら、らめぇっっ！！,sound/data/pcm/c10/h/01.unity3d,h_so_10_03_098
99,10,54,あっ、あぁ……イキたいなら……んんっ、はぁぁ……我をもっと……はぁ……突くのだっ！,sound/data/pcm/c10/h/01.unity3d,h_so_10_03_099
100,10,54,んっ、んっ、ん……嬉しいぞっ……はっ、あぁ……気持ちよくなってくれてぇぇ……,sound/data/pcm/c10/h/01.unity3d,h_so_10_03_100
101,10,54,はぁ、はぁ……もう無理ぃ……はっん……お尻も……我も限界だっ！！,sound/data/pcm/c10/h/01.unity3d,h_so_10_03_101
102,10,54,あ、あ、あ、はぁぁんっ！　汝が突くたびにっ！　あっんっ！　我の最後が近づいてくるぅぅぅっ！！,sound/data/pcm/c10/h/01.unity3d,h_so_10_03_102
103,10,54,あ、あっ、あぁぁ……こんなに突かれてたら……イクしかないよぉ！！,sound/data/pcm/c10/h/01.unity3d,h_so_10_03_103
104,10,54,うぅぅぅんっ！　すまぬっ！　我だけイッてしまうっ！！,sound/data/pcm/c10/h/01.unity3d,h_so_10_03_104
105,10,54,はぁ、はぁぁ……オマンコとオチンポが……く、くぅん……愛し合ってるっ,sound/data/pcm/c10/h/01.unity3d,h_so_10_03_105
106,10,54,はぁっ！　あっ……あっ……とろけるぅ……汝のオチンポが……熱くてぇ,sound/data/pcm/c10/h/01.unity3d,h_so_10_03_106
107,10,54,ふぅ、うぅ……下の口は待ちすぎてぇ……はっ、あっ……よだれをたらしとるぅ……,sound/data/pcm/c10/h/01.unity3d,h_so_10_03_107
108,10,54,い、言わなくよいかぁ……あんっ……出してぇ、早くぅ……,sound/data/pcm/c10/h/01.unity3d,h_so_10_03_108
109,10,54,ん、んんっ……えぐるように……あっ……抜いてくれぇ,sound/data/pcm/c10/h/01.unity3d,h_so_10_03_109
110,10,54,あぁぁぁぁっ！　わかったからっ！　気持ちよく出してくれぇっ！！,sound/data/pcm/c10/h/01.unity3d,h_so_10_03_110
111,10,54,は、はぁぁ……好きな方に……あっん……たっぷり射精してくれぇ,sound/data/pcm/c10/h/01.unity3d,h_so_10_03_111
112,10,54,はぁぁぁぁんっ！　どちらでもよいっ！　汝がきもちよくなるならなっ！！,sound/data/pcm/c10/h/01.unity3d,h_so_10_03_112
113,10,54,あ、あ、あぁ……あ、あとは汝がぁ……んっ……気持ちよくなるだけだっ,sound/data/pcm/c10/h/01.unity3d,h_so_10_03_113
114,10,54,さぁ、そのゴムの中に……んっ、はぁ……汝の欲望を満たせっっ！,sound/data/pcm/c10/h/01.unity3d,h_so_10_03_114
115,10,54,はぁ、はぁ……きてる！　きてるっ！　あっ、お尻で、イクぅぅぅっ！！,sound/data/pcm/c10/h/01.unity3d,h_so_10_03_115
116,10,54,ふ、ふぅん……お尻がぁ……あ、あぁ、あっ……気持ちいい,sound/data/pcm/c10/h/01.unity3d,h_so_10_03_116
117,10,54,あぁぁぁっ……アナルでぇ……あ、あああ、ああっ……アナルでイッちゃうぅぅぅっ！！,sound/data/pcm/c10/h/01.unity3d,h_so_10_03_117
118,10,54,はぁあんっ！　あぁぁぁんっ！　限界だぁっ！　　イクぅぅぅぅっ！！,sound/data/pcm/c10/h/01.unity3d,h_so_10_03_118
119,10,54,あんっあ、あ、あ、あぁぁっ……我慢できぬのか？　それなら、吐き出すがよいっ！！,sound/data/pcm/c10/h/01.unity3d,h_so_10_03_119
120,10,54,んっあああっ！　だすのだぁっ！　我に深淵に汝の精液をだしてくれぇ！！,sound/data/pcm/c10/h/01.unity3d,h_so_10_03_120
121,10,54,生で出された方がよいな、犯されている気分でゾクゾクする,sound/data/pcm/c10/h/01.unity3d,h_so_10_03_121
122,10,54,これは我へのご褒美か？　汝よ、ありがとう,sound/data/pcm/c10/h/01.unity3d,h_so_10_03_122
123,10,54,もしかして汝の精子の勢いでゴムが破けるたのではないのか,sound/data/pcm/c10/h/01.unity3d,h_so_10_03_123
124,10,54,出てる、すごい出てるのわかるぞ,sound/data/pcm/c10/h/01.unity3d,h_so_10_03_124
125,10,54,我のお尻に届いとるぞ、汝の精液が,sound/data/pcm/c10/h/01.unity3d,h_so_10_03_125
126,10,54,お尻の中が汝の精液よってやけどしてしまいそうだ,sound/data/pcm/c10/h/01.unity3d,h_so_10_03_126
127,10,54,んぐぐぅぅぅぅっっっ！！,sound/data/pcm/c10/h/01.unity3d,h_so_10_03_127
128,10,54,あぁぁぁぁっ！　漏れでちゃうぅぅぅぅぅっっっ！！,sound/data/pcm/c10/h/01.unity3d,h_so_10_03_128
129,10,54,イクッイクッ、イッちゃうぅぅぅぅぅっっっ！！,sound/data/pcm/c10/h/01.unity3d,h_so_10_03_129
130,10,54,さ、最高ーーーーーっっっ！！！,sound/data/pcm/c10/h/01.unity3d,h_so_10_03_130
131,10,54,ふたりでイクと快感は三十八倍だな,sound/data/pcm/c10/h/01.unity3d,h_so_10_03_131
132,10,54,えへへ、ふたり同時って意外とないらしいよ、だから私達の相性は抜群だね,sound/data/pcm/c10/h/01.unity3d,h_so_10_03_132
133,10,54,汝よ、ピクついておるな、まぁ、我も同じだがな,sound/data/pcm/c10/h/01.unity3d,h_so_10_03_133
134,10,54,ふぅ、汝と一緒にイケて、我は大満足だ,sound/data/pcm/c10/h/01.unity3d,h_so_10_03_134
135,10,54,汝は我のことが本当に好きなのだな、もちろん我も汝のことが好きだぞ,sound/data/pcm/c10/h/01.unity3d,h_so_10_03_135
136,10,54,えへへ、危険日に出すということはそういう事でよいのだな？,sound/data/pcm/c10/h/01.unity3d,h_so_10_03_136
137,10,54,今日は汝をイカせてヒィヒィ言わせるはずだったのだが……我がヒィヒィ言っておったな、不覚！,sound/data/pcm/c10/h/01.unity3d,h_so_10_03_137
138,10,54,エッチなことでは我は汝にはかなわんようだな、ちなみに一応は褒め言葉だぞこれは,sound/data/pcm/c10/h/01.unity3d,h_so_10_03_138
139,10,54,お尻でイコうが、オマンコでイコうが……汝と交わる喜びは変わらんな,sound/data/pcm/c10/h/01.unity3d,h_so_10_03_139
140,10,54,汝をイカせてやったぞ！　我もイカされたがなっ！！,sound/data/pcm/c10/h/01.unity3d,h_so_10_03_140
141,10,54,汝の策略により……最近、本当にお尻が弱くなってしまった……そうだ、今度は我が汝のお尻を開発しょうかな！,sound/data/pcm/c10/h/01.unity3d,h_so_10_03_141
142,10,54,今回は我だけがイカされてしまったが……汝が生きている限り……クックック、何度でも蘇り挑戦してくるだろう,sound/data/pcm/c10/h/01.unity3d,h_so_10_03_142
143,10,54,ふたり同時に絶頂に達して、ゴムがあるからあとのことは気にしなくていい……うむ、最高だな,sound/data/pcm/c10/h/01.unity3d,h_so_10_03_143
144,10,54,ゴムで安心なセックスもよいが、たまには生でやる日もあってもいいのかもな……,sound/data/pcm/c10/h/01.unity3d,h_so_10_03_144
145,10,54,少し疲れた……まぁ、あれだけ激しくやればなぁ……次回はゆっくり、長く汝と触れ合ってみたいな,sound/data/pcm/c10/h/01.unity3d,h_so_10_03_145
146,10,54,いっぱい精液が出たな……この我の中で満たされる感じが癖になるのだ,sound/data/pcm/c10/h/01.unity3d,h_so_10_03_146
147,10,54,汝に犯されてるのと危険日とが合わさって……すっごくゾクゾクしていたんだぞ,sound/data/pcm/c10/h/01.unity3d,h_so_10_03_147
148,10,54,なぜ、危険日なのに中出しさせたかって？　それは……汝だから許したのだ,sound/data/pcm/c10/h/01.unity3d,h_so_10_03_148
149,10,54,我だけ先にイッてしまった……二回目するか？　それとも他のことでもしようか？,sound/data/pcm/c10/h/01.unity3d,h_so_10_03_149
150,10,54,汝よ、これからはあらかじめ自慰行為をして盛り上げてから、我と交わった方がよいと思うぞ,sound/data/pcm/c10/h/01.unity3d,h_so_10_03_150
151,10,54,お尻がこんなにも気持ちよくなるとはおもわなんだ……ありがとう……って、なぜお礼をいってるんだ？,sound/data/pcm/c10/h/01.unity3d,h_so_10_03_151
152,10,54,あぁ……お尻が痛いな……誰か痛いの痛いの飛んでけ〜をしてくれんかな……,sound/data/pcm/c10/h/01.unity3d,h_so_10_03_152
153,10,54,とうとうバレてしまったか……そうだ、我はアナルが弱点になってしまっている！,sound/data/pcm/c10/h/01.unity3d,h_so_10_03_153
154,10,54,汝は我を喜ばせるのが本当に上手いな。我も汝を喜ばせたいのだが……なかなか上手くいかないんだ,sound/data/pcm/c10/h/01.unity3d,h_so_10_03_154
155,10,54,えへへ、我の中は気持ちよかったか？　まぁ、聞かなくてもわかるがな,sound/data/pcm/c10/h/01.unity3d,h_so_10_03_155
156,10,54,聞かせてくれ、我にイカされたときの気持ちを……,sound/data/pcm/c10/h/01.unity3d,h_so_10_03_156
157,10,54,我を置いてイクなんてずるいぞ！　もう一度するのだ！,sound/data/pcm/c10/h/01.unity3d,h_so_10_03_157
158,10,54,羨ましい……我も盛大にイキたかったぞ……,sound/data/pcm/c10/h/01.unity3d,h_so_10_03_158
159,10,54,危険な日だというのに汝は……まったく。しかし、我もそれを許容したのだから人のことは言えんか,sound/data/pcm/c10/h/01.unity3d,h_so_10_03_159
160,10,54,えへへ、危険日に中出ししたってことは、我をめとると思ってよいのだな？,sound/data/pcm/c10/h/01.unity3d,h_so_10_03_160
161,10,54,……汝はどう思っとるか知らんが……我は汝と、この先もずっといろいろなことをしたいと思っとる……,sound/data/pcm/c10/h/01.unity3d,h_so_10_03_161
162,10,54,出し切ったか？　余裕があるのであればもう一度してやっても良いぞ,sound/data/pcm/c10/h/01.unity3d,h_so_10_03_162
163,10,54,同時に絶頂に達したのは、汝が我との共鳴で魂が一時だけ魔界へ行きそのおかげで……って、今はそんなこといいか……,sound/data/pcm/c10/h/01.unity3d,h_so_10_03_163
164,10,54,あぁ、さっきイッたばかりなのに……まだまだ、足りぬ気がするのは我だけか？,sound/data/pcm/c10/h/01.unity3d,h_so_10_03_164
165,10,54,ん？　あぁ、考えごとをしていた、汝と我の子が出来たらいい子に育つかなって,sound/data/pcm/c10/h/01.unity3d,h_so_10_03_165
166,10,54,しかし、今回はすごかったな……この先我らにはこれを越えるすべはあるのだろうか？,sound/data/pcm/c10/h/01.unity3d,h_so_10_03_166
167,10,54,我だけ気持ちよくなって、すまぬ……最近は我慢したくてもできないのだ,sound/data/pcm/c10/h/01.unity3d,h_so_10_03_167
168,10,54,我の天敵はズバリ！　汝だ！　汝の前だと我は小動物のように非力になってしまう,sound/data/pcm/c10/h/01.unity3d,h_so_10_03_168
169,10,54,開発されすぎたかな……前の穴よりもしかしたら、感じてしまうかもしれん…・…,sound/data/pcm/c10/h/01.unity3d,h_so_10_03_169
170,10,54,お尻が解放されてスー、スーする……まぁ、これも含めて気持ちよいのだがな,sound/data/pcm/c10/h/01.unity3d,h_so_10_03_170
