管理番号,大きい項目,中間項目,表示名,バンドルパス,ファイル名
0,31,48,どうした？　いざとなったら体が動かないなんて、やめてくれよ？,sound/data/pcm/c31/h/01.unity3d,h_so3p_31_02_000
1,31,48,そう緊張するな、人数が一人増えただけだ、いつも通りやればいい,sound/data/pcm/c31/h/01.unity3d,h_so3p_31_02_001
2,31,48,ほら、早く始めろ……それとも、女二人に襲われたいのか？,sound/data/pcm/c31/h/01.unity3d,h_so3p_31_02_002
3,31,48,感動してるのか？　ハーレムは男の夢なんだろう？　んぅ？,sound/data/pcm/c31/h/01.unity3d,h_so3p_31_02_003
4,31,48,見えるか？　私の中に、全部入ってるんだぞっ,sound/data/pcm/c31/h/01.unity3d,h_so3p_31_02_004
5,31,48,早速中で震えてるぞ？　すぐにイクなよ？,sound/data/pcm/c31/h/01.unity3d,h_so3p_31_02_005
6,31,48,何をしている……すぐにイって、笑われるのが怖いのか？,sound/data/pcm/c31/h/01.unity3d,h_so3p_31_02_006
7,31,48,その、そんなに締まりがいいのか？　動けないほどに……,sound/data/pcm/c31/h/01.unity3d,h_so3p_31_02_007
8,31,48,いい感じじゃないか……もう少し激しくしても、私は構わないぞ,sound/data/pcm/c31/h/01.unity3d,h_so3p_31_02_008
9,31,48,フフッ、甘い声が出てるぞ……女が感じてる、いい声だっ……,sound/data/pcm/c31/h/01.unity3d,h_so3p_31_02_009
10,31,48,余裕のない顔、見られてしまったな……そうだ、私感じてるんだっ,sound/data/pcm/c31/h/01.unity3d,h_so3p_31_02_010
11,31,48,もっと乱れてもいいんだぞ？　女同士だ、わかってるさっ,sound/data/pcm/c31/h/01.unity3d,h_so3p_31_02_011
12,31,48,悪くない、んぅ、悪くないが……何かものたりないっ……,sound/data/pcm/c31/h/01.unity3d,h_so3p_31_02_012
13,31,48,オチンポ、気持ちいいか？　いやらしい顔に、なってるぞ,sound/data/pcm/c31/h/01.unity3d,h_so3p_31_02_013
14,31,48,激しくされると、お互い、情けない声が、出てしまうなっ,sound/data/pcm/c31/h/01.unity3d,h_so3p_31_02_014
15,31,48,ここまでされるとっ、私も、本気で感じてしまうっ,sound/data/pcm/c31/h/01.unity3d,h_so3p_31_02_015
16,31,48,女だけでイクのもいいんじゃないか、私はアリだと思うぞっ,sound/data/pcm/c31/h/01.unity3d,h_so3p_31_02_016
17,31,48,イキそうなんだろ？　わかるぞ、私だって、同じ女だっ,sound/data/pcm/c31/h/01.unity3d,h_so3p_31_02_017
18,31,48,私がイキそうなんだ、オチンポ咥えてれば、もう限界だろ？,sound/data/pcm/c31/h/01.unity3d,h_so3p_31_02_018
19,31,48,よしっ、男なんて放っておけ、女同士、仲良くイケばいいっ,sound/data/pcm/c31/h/01.unity3d,h_so3p_31_02_019
20,31,48,気持よさそうじゃないか……そっちの穴は、そんなにいいのか？,sound/data/pcm/c31/h/01.unity3d,h_so3p_31_02_020
21,31,48,こら、自分だけイこうとするなっ、そのオチンポ、抜いてやるぞ？,sound/data/pcm/c31/h/01.unity3d,h_so3p_31_02_021
22,31,48,もうイクぞっ……私達、先にイクからなっ、恨むなよっ,sound/data/pcm/c31/h/01.unity3d,h_so3p_31_02_022
23,31,48,女だけイカせられそうなんてっ、さぞかしおまえは、満足だろうなっ,sound/data/pcm/c31/h/01.unity3d,h_so3p_31_02_023
24,31,48,みんなイキそうなんてっ、少し照れるなっ、だが、いいと思うぞっ,sound/data/pcm/c31/h/01.unity3d,h_so3p_31_02_024
25,31,48,醜態を晒しているのはみんな同じだ、遠慮なく、イカせてもらうぞっ,sound/data/pcm/c31/h/01.unity3d,h_so3p_31_02_025
26,31,48,よし、大量に出してやれっ、おまんこは、その方が喜ぶぞっ,sound/data/pcm/c31/h/01.unity3d,h_so3p_31_02_026
27,31,48,ほう、中出しか……後で私にも、してくれるんだろうな？,sound/data/pcm/c31/h/01.unity3d,h_so3p_31_02_027
28,31,48,いいのか？　何だかんだで、女は中に欲しいものだぞ？,sound/data/pcm/c31/h/01.unity3d,h_so3p_31_02_028
29,31,48,射精、私達に見せたいのか？　フフッ、恥ずかしい奴だっ,sound/data/pcm/c31/h/01.unity3d,h_so3p_31_02_029
30,31,48,よかったな……三人同時にイケるなんて……普通じゃできないぞ,sound/data/pcm/c31/h/01.unity3d,h_so3p_31_02_030
31,31,48,おまえ達のイキ顔、ばっちり見てやったぞ……まぁ、私も見られたが,sound/data/pcm/c31/h/01.unity3d,h_so3p_31_02_031
32,31,48,イキ方もそれぞれだな……女同士でも、結構違いがあるものだ,sound/data/pcm/c31/h/01.unity3d,h_so3p_31_02_032
33,31,48,オチンポ、よかったか？　次は私の番だぞ……文句はないな？,sound/data/pcm/c31/h/01.unity3d,h_so3p_31_02_033
34,31,48,一緒にイったが、少し疎外感があるな……繋がっていないからか？,sound/data/pcm/c31/h/01.unity3d,h_so3p_31_02_034
35,31,48,まいったな……私達だけイカされて、女チームは完敗だな……,sound/data/pcm/c31/h/01.unity3d,h_so3p_31_02_035
36,31,48,私に入れたままにしておけと言いたいが……流石に恨まれそうだな,sound/data/pcm/c31/h/01.unity3d,h_so3p_31_02_036
37,31,48,次はどっちに入れるんだ？　まさか、これで終わりなんて無いだろ？,sound/data/pcm/c31/h/01.unity3d,h_so3p_31_02_037
38,31,48,そろそろ、私のオマンコに入れないか？,sound/data/pcm/c31/h/01.unity3d,h_so3p_31_02_038
39,31,48,オチンポじゃなくても、ちゃんとイカせてくれたな、偉いぞっ,sound/data/pcm/c31/h/01.unity3d,h_so3p_31_02_039
40,31,48,はぁ、凄い匂いだな……これを嗅いでると、今すぐ入れたくなるっ,sound/data/pcm/c31/h/01.unity3d,h_so3p_31_02_040
41,31,48,こんなに出して大丈夫か？　おまえの相手は、二人だぞ？,sound/data/pcm/c31/h/01.unity3d,h_so3p_31_02_041
42,31,48,精液が垂れるってエロいな……おまえが見たくなるものわかる……,sound/data/pcm/c31/h/01.unity3d,h_so3p_31_02_042
43,31,48,はは……それだけ出されれば、女としては幸せだろうさ……,sound/data/pcm/c31/h/01.unity3d,h_so3p_31_02_043
44,31,48,イッちゃうぅぅぅぅっ！,sound/data/pcm/c31/h/01.unity3d,h_so3p_31_02_044
45,31,48,無理、イクぅぅぅっ！,sound/data/pcm/c31/h/01.unity3d,h_so3p_31_02_045
46,31,48,イク、イク、イッちゃぁぁぁうっ！,sound/data/pcm/c31/h/01.unity3d,h_so3p_31_02_046
47,31,48,イクッ、はぁぁぁぁぁぁーっ！,sound/data/pcm/c31/h/01.unity3d,h_so3p_31_02_047
