管理番号,大きい項目,中間項目,表示名,バンドルパス,ファイル名
0,18,57,私達にしてもらえるなんて、なんて贅沢な人なんでしょう,sound/data/pcm/c18/h/01.unity3d,h_hh3p_18_03_000
1,18,57,私達の奉仕に耐えられるでしょうか？　ふふっ,sound/data/pcm/c18/h/01.unity3d,h_hh3p_18_03_001
2,18,57,私達のテクニック、もっと見せてあげますね？,sound/data/pcm/c18/h/01.unity3d,h_hh3p_18_03_004
3,18,57,二人でずっと焦らしてあげましょうか？　ふふっ,sound/data/pcm/c18/h/01.unity3d,h_hh3p_18_03_005
4,18,57,私達二人におちんちん舐められて、幸せものですね,sound/data/pcm/c18/h/01.unity3d,h_hh3p_18_03_006
5,18,57,まだまだ、力尽きないようにしてくださいね？,sound/data/pcm/c18/h/01.unity3d,h_hh3p_18_03_007
6,18,57,私達のテクニック、もっと見せてあげますね？,sound/data/pcm/c18/h/01.unity3d,h_hh3p_18_03_012
7,18,57,二人でずっと焦らしてあげましょうか？　ふふっ,sound/data/pcm/c18/h/01.unity3d,h_hh3p_18_03_013
8,18,57,まだまだ、力尽きないようにしてくださいね？,sound/data/pcm/c18/h/01.unity3d,h_hh3p_18_03_015
9,18,57,二人でしてる分、汁が漏れるのも早いですねっ,sound/data/pcm/c18/h/01.unity3d,h_hh3p_18_03_016
10,18,57,私達のコンビネーションですぐイカせてあげますっ,sound/data/pcm/c18/h/01.unity3d,h_hh3p_18_03_017
11,18,57,元気よく、ビュルルって出してくださいっ,sound/data/pcm/c18/h/01.unity3d,h_hh3p_18_03_020
12,18,57,二人でしてるんだから、思いっきりイッてくださいね,sound/data/pcm/c18/h/01.unity3d,h_hh3p_18_03_021
13,18,57,あなたの精液、全部もらっちゃいますっ,sound/data/pcm/c18/h/01.unity3d,h_hh3p_18_03_022
14,18,57,二人で育てた精液、口にいっぱいくださいっ,sound/data/pcm/c18/h/01.unity3d,h_hh3p_18_03_023
15,18,57,いっぱい精液、かけられちゃいましたっ……幸せです……,sound/data/pcm/c18/h/01.unity3d,h_hh3p_18_03_032
