管理番号,大きい項目,中間項目,表示名,バンドルパス,ファイル名
0,42,56,もちろん、２人でキミのおちんちんを気持ち良くしてあげるよー,sound/data/pcm/c42/h/71.unity3d,h_ka3p_42_03_000
1,42,56,良いよぉ。キミがどれだけイケるか、２人で確かめてあげるー,sound/data/pcm/c42/h/71.unity3d,h_ka3p_42_03_001
2,42,56,うん、私ももっとしたかったのぉ,sound/data/pcm/c42/h/71.unity3d,h_ka3p_42_03_002
3,42,56,このまま私でいいのー？　おまんこはもう一人分あるんだよぉ,sound/data/pcm/c42/h/71.unity3d,h_ka3p_42_03_003
4,42,56,うん、ご奉仕が希望なんだねー。２人がかりで楽しませてあげるっ,sound/data/pcm/c42/h/71.unity3d,h_ka3p_42_03_004
5,42,56,えへへ、もちろんいいよぉ。おちんちん、早く欲しかったからぁ,sound/data/pcm/c42/h/71.unity3d,h_ka3p_42_03_005
6,42,56,はーい、わかったよぉ,sound/data/pcm/c42/h/71.unity3d,h_ka3p_42_03_006
7,42,56,おちんちんは大事に分けあわないとダメだもんねー,sound/data/pcm/c42/h/71.unity3d,h_ka3p_42_03_007
8,42,56,みんなで一緒に気持ちよくなれると最高だねっ,sound/data/pcm/c42/h/71.unity3d,h_ka3p_42_03_008
9,42,56,おちんちんの担当は任せてっ,sound/data/pcm/c42/h/71.unity3d,h_ka3p_42_03_009
10,42,56,私の腰使いで、おちんちんをいっぱい気持ち良くしてあげるねぇ,sound/data/pcm/c42/h/71.unity3d,h_ka3p_42_03_010
11,42,56,えへへ、やっぱりおちんちん物足りなかったんだね。いいよー,sound/data/pcm/c42/h/71.unity3d,h_ka3p_42_03_300
12,42,56,うんっ、また二人でいっぱい気持ち良くしちゃうね,sound/data/pcm/c42/h/71.unity3d,h_ka3p_42_03_301
13,42,56,いいよー。私たちに任せて。たぁくさん搾り取っちゃうから,sound/data/pcm/c42/h/71.unity3d,h_ka3p_42_03_302
