管理番号,大きい項目,中間項目,表示名,バンドルパス,ファイル名
203,25,44,はあ、おっきいよぉ～……,sound/data/pcm/c25/h/01.unity3d,h_so_25_02_203
204,25,44,入ってるだけで、おしり締まっちゃうよ～……,sound/data/pcm/c25/h/01.unity3d,h_so_25_02_204
205,25,44,おしりでキミとつながってるんだ～……,sound/data/pcm/c25/h/01.unity3d,h_so_25_02_205
206,25,44,いや～……焦らしちゃいや～,sound/data/pcm/c25/h/01.unity3d,h_so_25_02_206
207,25,44,抜けるだけで、気持ちいかも～……,sound/data/pcm/c25/h/01.unity3d,h_so_25_02_207
208,25,44,あっ、こ、この感じっ、クセになりそう～,sound/data/pcm/c25/h/01.unity3d,h_so_25_02_208
209,25,44,おしりっ、キュッてなるよ～,sound/data/pcm/c25/h/01.unity3d,h_so_25_02_209
210,25,44,あはっ、これっ、いいかも～っ,sound/data/pcm/c25/h/01.unity3d,h_so_25_02_210
211,25,44,ゆっくりエッチ、気持ちいいよぉっ,sound/data/pcm/c25/h/01.unity3d,h_so_25_02_211
212,25,44,もっと、強くても、いいからね～っ,sound/data/pcm/c25/h/01.unity3d,h_so_25_02_212
213,25,44,い、いいよっ、キミの好きにしてぇ～っ,sound/data/pcm/c25/h/01.unity3d,h_so_25_02_213
214,25,44,きつくてっ、おしり割れちゃうよぉ～,sound/data/pcm/c25/h/01.unity3d,h_so_25_02_214
215,25,44,おちんちんに、おしり拡げられてるぅ～っ,sound/data/pcm/c25/h/01.unity3d,h_so_25_02_215
216,25,44,あはっ、おしり、そんなにいいんだ～……？,sound/data/pcm/c25/h/01.unity3d,h_so_25_02_216
217,25,44,あはっ、コリコリされるの気持ちいい～,sound/data/pcm/c25/h/01.unity3d,h_so_25_02_217
218,25,44,おまんこ、ひっくりかえっちゃうぅ～っ,sound/data/pcm/c25/h/01.unity3d,h_so_25_02_218
219,25,44,あんっ、そんな強くっ、されたらぁ～っ,sound/data/pcm/c25/h/01.unity3d,h_so_25_02_219
220,25,44,おちんちんっ、固くてっ、いいよぉ～っ,sound/data/pcm/c25/h/01.unity3d,h_so_25_02_220
221,25,44,そんなに、強く、されたらぁ～っ,sound/data/pcm/c25/h/01.unity3d,h_so_25_02_221
222,25,44,おしりだと、おちんちん、もっと太く感じちゃうよぉ～,sound/data/pcm/c25/h/01.unity3d,h_so_25_02_222
223,25,44,アナルっ、ほじくられて、いいのぉ～っ,sound/data/pcm/c25/h/01.unity3d,h_so_25_02_223
224,25,44,後ろの穴っ、気持ちいいんだなっ,sound/data/pcm/c25/h/01.unity3d,h_so_25_02_224
225,25,44,おしりの中で、おちんぽ暴れてるぅ～っ,sound/data/pcm/c25/h/01.unity3d,h_so_25_02_225
226,25,44,これ以上されたらっ、私ぃ～っ,sound/data/pcm/c25/h/01.unity3d,h_so_25_02_226
227,25,44,エッチな波、来て、きてるぅ～っ,sound/data/pcm/c25/h/01.unity3d,h_so_25_02_227
228,25,44,あっ、私も腰止まんないよぉ～っ！,sound/data/pcm/c25/h/01.unity3d,h_so_25_02_228
229,25,44,さっきよりも、すごいの、来てるぅ～っ！,sound/data/pcm/c25/h/01.unity3d,h_so_25_02_229
230,25,44,あはっ、気持ちいいなら、好きに動いていいからぁ～っ！,sound/data/pcm/c25/h/01.unity3d,h_so_25_02_230
231,25,44,今のキミの顔、とろとろだぁ～……ふふふ,sound/data/pcm/c25/h/01.unity3d,h_so_25_02_231
232,25,44,あんっ、犬みたいにっ、腰振って……かわいいんだ～……,sound/data/pcm/c25/h/01.unity3d,h_so_25_02_232
233,25,44,んっ、そろそろ、イキたいんだねぇ～？,sound/data/pcm/c25/h/01.unity3d,h_so_25_02_233
234,25,44,あっ、そこっ、いいよっ、もっと突いてぇ～っ,sound/data/pcm/c25/h/01.unity3d,h_so_25_02_234
235,25,44,突かれるたびに、頭っ真っ白になるぅ～っ！,sound/data/pcm/c25/h/01.unity3d,h_so_25_02_235
236,25,44,おしりっ、おちんちんでごりごりしてっ、もっとぉ～！,sound/data/pcm/c25/h/01.unity3d,h_so_25_02_236
237,25,44,あんっ、おしりひっくり返っちゃいそうだよ～っ,sound/data/pcm/c25/h/01.unity3d,h_so_25_02_237
238,25,44,あんっ、そっか、イキそうなんだね～……,sound/data/pcm/c25/h/01.unity3d,h_so_25_02_238
239,25,44,おしり、気持ちいいんだね～？　もっと気持ちよくするよ～,sound/data/pcm/c25/h/01.unity3d,h_so_25_02_239
240,25,44,おしりのおくで、おちんちん暴れてるぅ～っ！,sound/data/pcm/c25/h/01.unity3d,h_so_25_02_240
241,25,44,好きにしてっ、キミのおちんちんでかきまわしてぇ～！,sound/data/pcm/c25/h/01.unity3d,h_so_25_02_241
242,25,44,んうっ、来てるっすごいの来てるぅ～っ！,sound/data/pcm/c25/h/01.unity3d,h_so_25_02_242
243,25,44,ダメっ、んっ、ダメだってばぁ～！,sound/data/pcm/c25/h/01.unity3d,h_so_25_02_243
244,25,44,んっ、二人でいっしょだからねぇ～！,sound/data/pcm/c25/h/01.unity3d,h_so_25_02_244
245,25,44,うんっ、私もいっしょにイクからぁ～っ！,sound/data/pcm/c25/h/01.unity3d,h_so_25_02_245
246,25,44,イキそうなんだね～？　イイよぉっ、いっぱいイッていいよぉ～っ！,sound/data/pcm/c25/h/01.unity3d,h_so_25_02_246
247,25,44,うんっ、うんっ、好きにしていいからねぇ～,sound/data/pcm/c25/h/01.unity3d,h_so_25_02_247
248,25,44,いいよぉ～、いっぱい、いっぱいぶっかけてぇ～！,sound/data/pcm/c25/h/01.unity3d,h_so_25_02_248
249,25,44,見せてっ、おちんちんびゅっびゅってぇ～……！,sound/data/pcm/c25/h/01.unity3d,h_so_25_02_249
250,25,44,イキそうなんだなっ、顔っ、すごいエッチになってるよぉ～っ！,sound/data/pcm/c25/h/01.unity3d,h_so_25_02_250
251,25,44,もうっ、お猿さんなんだからぁ～っ,sound/data/pcm/c25/h/01.unity3d,h_so_25_02_251
252,25,44,ゴムおちんちんっ、激しいのぉ～っ,sound/data/pcm/c25/h/01.unity3d,h_so_25_02_252
253,25,44,もっと、擦って、ぬるぬるゴムで突いてぇ～っ,sound/data/pcm/c25/h/01.unity3d,h_so_25_02_253
254,25,44,あんっ、おしりの奥でちんちん、突かれてぇ～っ！,sound/data/pcm/c25/h/01.unity3d,h_so_25_02_254
255,25,44,んぉっ、おしり、だめえぇ～……,sound/data/pcm/c25/h/01.unity3d,h_so_25_02_255
256,25,44,いいよ～っ、おしりでイッちゃうヘンタイカップルになっちゃおう～っ,sound/data/pcm/c25/h/01.unity3d,h_so_25_02_256
257,25,44,あんっ、おしりキュッてきたからっ、いっしょにいこ～っ,sound/data/pcm/c25/h/01.unity3d,h_so_25_02_257
258,25,44,んうっ、いっぱい出していいからっ、おしりに来てぇ～っ！,sound/data/pcm/c25/h/01.unity3d,h_so_25_02_258
259,25,44,いいよっ、おしりキュッてしてあげるからぁ～っ,sound/data/pcm/c25/h/01.unity3d,h_so_25_02_259
260,25,44,んうっ、さっきよりも、いっぱい出てるよぉ～……！,sound/data/pcm/c25/h/01.unity3d,h_so_25_02_260
261,25,44,せーしっ、びゅるびゅる出てるっ、んあぁ～……！,sound/data/pcm/c25/h/01.unity3d,h_so_25_02_261
262,25,44,んんっ、さっきも出たのに、とまんないねぇ～……,sound/data/pcm/c25/h/01.unity3d,h_so_25_02_262
263,25,44,ふふふ、せーしで膨らんだゴム、奥をぎゅってしてる～……,sound/data/pcm/c25/h/01.unity3d,h_so_25_02_263
264,25,44,おしりの中で、ぴちぴちのせーし出てるぅ～っ,sound/data/pcm/c25/h/01.unity3d,h_so_25_02_264
265,25,44,出てるっ、さっきよりも濃いの、出てるぅ～っ,sound/data/pcm/c25/h/01.unity3d,h_so_25_02_265
266,25,44,んあああぁっ！,sound/data/pcm/c25/h/01.unity3d,h_so_25_02_266
267,25,44,やっ、壊れちゃうからあぁ～っ！,sound/data/pcm/c25/h/01.unity3d,h_so_25_02_267
268,25,44,もう、限界……んはあぁ～っ！,sound/data/pcm/c25/h/01.unity3d,h_so_25_02_268
269,25,44,なんかっ、とんじゃうぅ～っ！,sound/data/pcm/c25/h/01.unity3d,h_so_25_02_269
270,25,44,今度エッチするとき、またゴム用意しないとなぁ～,sound/data/pcm/c25/h/01.unity3d,h_so_25_02_270
271,25,44,ふふふ、ゴム、使い切っちゃいそうだねぇ～っ,sound/data/pcm/c25/h/01.unity3d,h_so_25_02_271
272,25,44,ああ、おまんこの中で、どろどろになってるよ～……,sound/data/pcm/c25/h/01.unity3d,h_so_25_02_272
273,25,44,繋がってると、キミの心がわかる気がするんだぁ～……ふふふ～,sound/data/pcm/c25/h/01.unity3d,h_so_25_02_273
274,25,44,こうやってる時間って、なんかいいよな……しあわせ～……,sound/data/pcm/c25/h/01.unity3d,h_so_25_02_274
275,25,44,赤ちゃんの名前、男の子と女の子、どっちも考えとこっか、ねえパパ～？,sound/data/pcm/c25/h/01.unity3d,h_so_25_02_275
276,25,44,私の弱いとこ、全部知られちゃってるなぁ～……恥ずかしい～,sound/data/pcm/c25/h/01.unity3d,h_so_25_02_276
277,25,44,私のからだのこと、キミの方が詳しいかも～？,sound/data/pcm/c25/h/01.unity3d,h_so_25_02_277
278,25,44,もう、気持ちよかったら、なんでもいいか～……,sound/data/pcm/c25/h/01.unity3d,h_so_25_02_278
279,25,44,えへ～、キミのおちんちんもおしりが大好きになったんだねぇ～,sound/data/pcm/c25/h/01.unity3d,h_so_25_02_279
280,25,44,男の子も、おしりって気持ちよくなるのか？　じょ。じょーだんだよ……半分くらい,sound/data/pcm/c25/h/01.unity3d,h_so_25_02_280
281,25,44,ううっ、いっしょにイッてれば、恥ずかしくないのにな～……,sound/data/pcm/c25/h/01.unity3d,h_so_25_02_281
282,25,44,こんなっ、突かれたらっ、誰でもこうなっちゃうよ～……,sound/data/pcm/c25/h/01.unity3d,h_so_25_02_282
283,25,44,ゴムがあっても、こんなに気持ちいいのって、私がエッチだからかな～？,sound/data/pcm/c25/h/01.unity3d,h_so_25_02_283
284,25,44,あんなに激しくされたら、ガマン出来るわけないよぉ～……,sound/data/pcm/c25/h/01.unity3d,h_so_25_02_284
285,25,44,繋がってるとき、私とキミがひとつになってるみたいで、しあわせ～,sound/data/pcm/c25/h/01.unity3d,h_so_25_02_285
286,25,44,気持ちよかったぁ～……でもやっぱり疲れるねぇ～……,sound/data/pcm/c25/h/01.unity3d,h_so_25_02_286
287,25,44,子宮にあったかいの、来てるぅ～……,sound/data/pcm/c25/h/01.unity3d,h_so_25_02_287
288,25,44,繋がってるだけで、こんなに心があたたまるんだねぇ～……,sound/data/pcm/c25/h/01.unity3d,h_so_25_02_288
289,25,44,うう、激しすぎだよっ、もっと気持ちよくさせたかったのにぃ～……,sound/data/pcm/c25/h/01.unity3d,h_so_25_02_289
290,25,44,ふふふ、おしりでいっしょにイッちゃったね～……,sound/data/pcm/c25/h/01.unity3d,h_so_25_02_290
291,25,44,おしりですると、気持ちよすぎてあぶないなぁ～……,sound/data/pcm/c25/h/01.unity3d,h_so_25_02_291
292,25,44,んうっ、今日はおしり、もうダメぇ……力、抜けちゃって～……,sound/data/pcm/c25/h/01.unity3d,h_so_25_02_292
293,25,44,最初よりも、だんだん気持ちよくてっ、キミのせいだからね～？,sound/data/pcm/c25/h/01.unity3d,h_so_25_02_293
294,25,44,えっと、まだゴムはあるけど……もっかいする～？,sound/data/pcm/c25/h/01.unity3d,h_so_25_02_294
295,25,44,あんっ、ゴムがたぷたぷして……すごぉ～……,sound/data/pcm/c25/h/01.unity3d,h_so_25_02_295
296,25,44,大丈夫な日でも、こんなに出たらデキちゃいそう～……私はいいけど～,sound/data/pcm/c25/h/01.unity3d,h_so_25_02_296
297,25,44,せーしと愛液でどろどろ～……見てるだけでちょっと興奮するかも～……,sound/data/pcm/c25/h/01.unity3d,h_so_25_02_297
298,25,44,うぅ、子宮に入んないせーしが溢れちゃうなぁ～,sound/data/pcm/c25/h/01.unity3d,h_so_25_02_298
299,25,44,こんなにいっぱい出されたらっ、赤ちゃんできちゃうかも～,sound/data/pcm/c25/h/01.unity3d,h_so_25_02_299
300,25,44,私たちのエッチに、ゴムの隔たりも関係な～い……なんてね～,sound/data/pcm/c25/h/01.unity3d,h_so_25_02_300
301,25,44,ゴム越しに、熱いのが伝わって来るんだ～……,sound/data/pcm/c25/h/01.unity3d,h_so_25_02_301
302,25,44,ねばねばのどろどろ、奥にくっついてるのがわかるよ～,sound/data/pcm/c25/h/01.unity3d,h_so_25_02_302
303,25,44,すご～……どろどろのせーし、入って来てるのがわかるよ～……,sound/data/pcm/c25/h/01.unity3d,h_so_25_02_303
304,25,44,今日のキミ、すごかったなー……私も人のこと言えないけど～。ふふふ,sound/data/pcm/c25/h/01.unity3d,h_so_25_02_304
305,25,44,ふふふ～……キミ、すごく興奮してたね～、そんなに孕ませたかったの～？,sound/data/pcm/c25/h/01.unity3d,h_so_25_02_305
306,25,44,えっと～……その、ぎゅって、して～？,sound/data/pcm/c25/h/01.unity3d,h_so_25_02_306
307,25,44,今度は、私がキミを気持ちよくしてあげるからね～,sound/data/pcm/c25/h/01.unity3d,h_so_25_02_307
308,25,44,おしりの奥にネバネバしたの、はりついてるよ～,sound/data/pcm/c25/h/01.unity3d,h_so_25_02_308
309,25,44,どろどろして、おしり熱いよぉ～……,sound/data/pcm/c25/h/01.unity3d,h_so_25_02_309
310,25,44,おちんちん、ぴくぴくしながら、びゅってしてる……,sound/data/pcm/c25/h/01.unity3d,h_so_25_02_310
311,25,44,あっ、いっぱい出たなぁ～……,sound/data/pcm/c25/h/01.unity3d,h_so_25_02_311
312,25,44,何度もイッたおちんちん、まだぴくぴくしてる～……,sound/data/pcm/c25/h/01.unity3d,h_so_25_02_312
313,25,44,おまんこ汁とせーしでベトベトのおちんちん～……すご～……,sound/data/pcm/c25/h/01.unity3d,h_so_25_02_313
314,25,44,私のおまんこ、せーしと、おまんこ汁で、ドロドロだ～……,sound/data/pcm/c25/h/01.unity3d,h_so_25_02_314
315,25,44,もう～、いっぱい出されたから、溢れちゃったよ～……,sound/data/pcm/c25/h/01.unity3d,h_so_25_02_315
316,25,44,（開始時台詞）んふふ～、プールの中でしたがるなんて、物好きっすね～……,sound/data/pcm/c25/h/01.unity3d,h_so_25_02_316
317,25,44,（開始時台詞）すごい解放感……スースーしてるっす……,sound/data/pcm/c25/h/01.unity3d,h_so_25_02_317
