管理番号,大きい項目,中間項目,表示名,バンドルパス,ファイル名
0,34,53,カチコチの勃起ｐｅｎｉｓ、オマンコに入るトコロ見ててネ♡,sound/data/pcm/c34/h/01.unity3d,h_fe_34_03_005
1,34,53,今日も、イヤラシイｅｃｓｔａｓｙをタクサンｐｒｅｓｅｎｔするネ♡,sound/data/pcm/c34/h/01.unity3d,h_fe_34_03_028
2,34,53,フフ♡　アナタのオチンポ、早くシコシコされたいって、ワタシの中でウズウズしてるヨ♡,sound/data/pcm/c34/h/01.unity3d,h_fe_34_03_029
3,34,53,ユックリ動くト、ｐｅｎｉｓの血管がプリプリシテ気持ちイイノ♡,sound/data/pcm/c34/h/01.unity3d,h_fe_34_03_040
4,34,53,海外で肉厚に育ったオマンコで、ネットリｆｕｃｋしてあげるネ♡,sound/data/pcm/c34/h/01.unity3d,h_fe_34_03_041
5,34,53,モットいじってくれタラ、アナタのギンギンｐｅｎｉｓぎゅ～って締め付けるヨ♡,sound/data/pcm/c34/h/01.unity3d,h_fe_34_03_054
6,34,53,フフ♡　ワタシ、オサワリもｓｅｍｅｎ搾り取るのモ、大好き♡,sound/data/pcm/c34/h/01.unity3d,h_fe_34_03_058
7,34,53,オサワリでキツキツになったハズカシイ穴デ、気持ちよくするネ♡,sound/data/pcm/c34/h/01.unity3d,h_fe_34_03_071
8,34,53,オサワリに反応シテ、腰が止まらなくなっちゃったヨ～♡,sound/data/pcm/c34/h/01.unity3d,h_fe_34_03_073
9,34,53,Ｃｈｕｃｈｕ　ｐｉｓｔｏｎで射精させるネ♡,sound/data/pcm/c34/h/01.unity3d,h_fe_34_03_083
10,34,53,アナタを気持ちよくしたいノニ、ワタシが気持ちイイトコロ、タクサンゴリゴリしちゃう～♡,sound/data/pcm/c34/h/01.unity3d,h_fe_34_03_088
11,34,53,スケベな腰フリｄａｎｃｅしながらイってイイ？　あ、ダメ、もう我慢できないノ♡,sound/data/pcm/c34/h/01.unity3d,h_fe_34_03_089
12,34,53,ＯＫ♡　射精ギリギリマデ、オチンポごりごりスルネ♡,sound/data/pcm/c34/h/01.unity3d,h_fe_34_03_109
13,34,53,フフ♡　アナタのオチンチンでｍａｓｔｕｒｂａｔｉｏｎシタミタイ……♡,sound/data/pcm/c34/h/01.unity3d,h_fe_34_03_138
14,34,53,ホント魔法のｐｅｎｉｓネ。腰が止まらなかったヨー♡,sound/data/pcm/c34/h/01.unity3d,h_fe_34_03_168
15,34,53,ネェネェ♡　ワタシが動いてあげようカナ？,sound/data/pcm/c34/h/01.unity3d,h_fe_34_03_181
16,34,53,アナタに教え込まれたｔｅｃｈｎｉｃで、気持ちイイコト、してあげようカ？　フフ♡,sound/data/pcm/c34/h/01.unity3d,h_fe_34_03_182
17,34,53,アナタのビンビンｐｅｎｉｓ、イタダキマース♡,sound/data/pcm/c34/h/01.unity3d,h_fe_34_03_184
18,34,53,アナタがされたいコト、何でもしてアゲマスヨ♡,sound/data/pcm/c34/h/01.unity3d,h_fe_34_03_202
19,34,53,早くアナタのヌルヌルｓｅｍｅｎ、ピュッピュさせたいナ～♡,sound/data/pcm/c34/h/01.unity3d,h_fe_34_03_203
20,34,53,オマンコでアナタのｂｉｇ　ｐｅｎｉｓシゴくの好き♡　たまらないヨ～♡,sound/data/pcm/c34/h/01.unity3d,h_fe_34_03_213
21,34,53,モット腰ガツガツしてイイ？　アナタの精液、吸い尽くしてイイ？,sound/data/pcm/c34/h/01.unity3d,h_fe_34_03_219
22,34,53,ゴムチンポ締め付けて、チュルチュルしちゃうネ♡,sound/data/pcm/c34/h/01.unity3d,h_fe_34_03_253
