管理番号,大きい項目,中間項目,表示名,バンドルパス,ファイル名
0,18,48,私達のこと、気持ちよくしてくださいね,sound/data/pcm/c18/h/01.unity3d,h_so3p_18_02_000
1,18,48,私が先におちんちんをもらっちゃって、いいんですか？,sound/data/pcm/c18/h/01.unity3d,h_so3p_18_02_001
2,18,48,私は後ですか……待ってますよ？,sound/data/pcm/c18/h/01.unity3d,h_so3p_18_02_002
3,18,48,ちゃんと私の分まで、元気残しておいてくださいね,sound/data/pcm/c18/h/01.unity3d,h_so3p_18_02_003
4,18,48,見られてるって、変な感じです……,sound/data/pcm/c18/h/01.unity3d,h_so3p_18_02_004
5,18,48,おちんちん……いつもより大きいです……,sound/data/pcm/c18/h/01.unity3d,h_so3p_18_02_005
6,18,48,しないんですか……？　待ちくたびれちゃう……,sound/data/pcm/c18/h/01.unity3d,h_so3p_18_02_006
7,18,48,私達、いつまでこうしてなきゃいけないんでしょうか……？,sound/data/pcm/c18/h/01.unity3d,h_so3p_18_02_007
8,18,48,ゆっくり動いてるの、そっちからも見えますか？,sound/data/pcm/c18/h/01.unity3d,h_so3p_18_02_008
9,18,48,すごく気持ちよさそう……私も気持ちよくしてください？,sound/data/pcm/c18/h/01.unity3d,h_so3p_18_02_009
10,18,48,激しく突かれてるの、観察されちゃってるぅ,sound/data/pcm/c18/h/01.unity3d,h_so3p_18_02_010
11,18,48,私達のつながってるところ、エッチにジュプジュプしちゃってるかな？,sound/data/pcm/c18/h/01.unity3d,h_so3p_18_02_011
12,18,48,コレ、入れてもらうよりエッチな気分になっちゃう、かも……,sound/data/pcm/c18/h/01.unity3d,h_so3p_18_02_012
13,18,48,つながってる……幸せそうな顔してるね,sound/data/pcm/c18/h/01.unity3d,h_so3p_18_02_013
14,18,48,あんなに気持ちよさそうにして……羨ましいかも,sound/data/pcm/c18/h/01.unity3d,h_so3p_18_02_014
15,18,48,すごい……そんなにいいの？,sound/data/pcm/c18/h/01.unity3d,h_so3p_18_02_015
16,18,48,気持ちいいですか？　……たまらないって顔、してるよ,sound/data/pcm/c18/h/01.unity3d,h_so3p_18_02_016
17,18,48,来ちゃう……イクときは三人一緒ですよ？,sound/data/pcm/c18/h/01.unity3d,h_so3p_18_02_017
18,18,48,ゆっくりなのに、こんなに感じちゃってるの、二人にバレちゃってる,sound/data/pcm/c18/h/01.unity3d,h_so3p_18_02_018
19,18,48,激しくされちゃ、もうイッちゃうかも……,sound/data/pcm/c18/h/01.unity3d,h_so3p_18_02_019
20,18,48,そんな気持ちよさそうにして……私よりもいいんですか？,sound/data/pcm/c18/h/01.unity3d,h_so3p_18_02_020
21,18,48,必死に動いちゃって……妬いちゃいますね……,sound/data/pcm/c18/h/01.unity3d,h_so3p_18_02_021
22,18,48,私っ、私達っ、イッちゃう、イッちゃうぅぅ！,sound/data/pcm/c18/h/01.unity3d,h_so3p_18_02_022
23,18,48,イク、イクっ……！　二人でイカされちゃうのおおぉぉ！,sound/data/pcm/c18/h/01.unity3d,h_so3p_18_02_023
24,18,48,あぁっ、ビクビクしてるっ……・！　みんなでいこっ、いこっ！ああぁあ！,sound/data/pcm/c18/h/01.unity3d,h_so3p_18_02_024
25,18,48,ああん、いきそっ……みんな、一緒にっ……！,sound/data/pcm/c18/h/01.unity3d,h_so3p_18_02_025
26,18,48,いいよっ、そのおまんこで、気持ちよく出しちゃってくださいっ,sound/data/pcm/c18/h/01.unity3d,h_so3p_18_02_026
27,18,48,もう出ちゃうのねっ……思い切りイッちゃっていいんですよ？,sound/data/pcm/c18/h/01.unity3d,h_so3p_18_02_027
28,18,48,精液吹き出すとこ、私達がしっかり見てあげますねっ,sound/data/pcm/c18/h/01.unity3d,h_so3p_18_02_028
29,18,48,外がいいんですか？　じゃあ、精液ぶちまけちゃってくださいね,sound/data/pcm/c18/h/01.unity3d,h_so3p_18_02_029
30,18,48,みんなでイッちゃって……私達、すっかりエッチになっちゃいましたねっ,sound/data/pcm/c18/h/01.unity3d,h_so3p_18_02_030
31,18,48,三人で一緒に満たされて……幸せっ……,sound/data/pcm/c18/h/01.unity3d,h_so3p_18_02_031
32,18,48,一緒にイカされちゃったぁ……,sound/data/pcm/c18/h/01.unity3d,h_so3p_18_02_032
33,18,48,今度は私が……おちんちん気持よくさせてあげたいです,sound/data/pcm/c18/h/01.unity3d,h_so3p_18_02_033
34,18,48,二人とも気持ちよさそうにして……羨ましいです,sound/data/pcm/c18/h/01.unity3d,h_so3p_18_02_034
35,18,48,気持ちよかったですか？　……聞くまでもなさそうですねっ……,sound/data/pcm/c18/h/01.unity3d,h_so3p_18_02_035
36,18,48,……このあとも、まだやりますか？　それとも代わりますか？,sound/data/pcm/c18/h/01.unity3d,h_so3p_18_02_036
37,18,48,また……私としますか？　私達はどっちでも……,sound/data/pcm/c18/h/01.unity3d,h_so3p_18_02_037
38,18,48,私……おちんちん、欲しくなっちゃっいました……,sound/data/pcm/c18/h/01.unity3d,h_so3p_18_02_038
39,18,48,次は私の番、ですよね？　触られるのもよかったですけど……ね？,sound/data/pcm/c18/h/01.unity3d,h_so3p_18_02_039
40,18,48,あんなに感じさせて……すごいテクニックですね,sound/data/pcm/c18/h/01.unity3d,h_so3p_18_02_040
41,18,48,ちゃんと私の分も、残ってますよね？,sound/data/pcm/c18/h/01.unity3d,h_so3p_18_02_041
42,18,48,中から垂れちゃってる……どれだけ出したんですか、もうっ,sound/data/pcm/c18/h/01.unity3d,h_so3p_18_02_042
43,18,48,こんなに溢れちゃって、いやらしいですね……,sound/data/pcm/c18/h/01.unity3d,h_so3p_18_02_043
44,18,48,イッちゃうぅぅぅぅっ！,sound/data/pcm/c18/h/01.unity3d,h_so3p_18_02_044
45,18,48,無理、イクぅぅぅっ！,sound/data/pcm/c18/h/01.unity3d,h_so3p_18_02_045
46,18,48,イク、イク、イッちゃぁぁぁうっ！,sound/data/pcm/c18/h/01.unity3d,h_so3p_18_02_046
47,18,48,イクッ、はぁぁぁぁぁぁーっ！,sound/data/pcm/c18/h/01.unity3d,h_so3p_18_02_047
