管理番号,大きい項目,中間項目,表示名,バンドルパス,ファイル名
0,22,51,やーん、我慢出来ないよー,sound/data/pcm/c22/h/01.unity3d,h_ai_22_03_000
1,22,51,早くこっちにきて？,sound/data/pcm/c22/h/01.unity3d,h_ai_22_03_001
2,22,51,焦らしちゃやだよー！,sound/data/pcm/c22/h/01.unity3d,h_ai_22_03_002
3,22,51,あ、んんっ、気持ち……いい……,sound/data/pcm/c22/h/01.unity3d,h_ai_22_03_009
4,22,51,ん……舌……いっぱい絡めて……,sound/data/pcm/c22/h/01.unity3d,h_ai_22_03_010
5,22,51,はぁぁ……身体、熱くなっちゃうね……,sound/data/pcm/c22/h/01.unity3d,h_ai_22_03_011
6,22,51,大人のキス……何も考えられなくなっちゃうね……,sound/data/pcm/c22/h/01.unity3d,h_ai_22_03_012
7,22,51,はぅ……今のキスで私……もう……ぬ、濡れちゃった……,sound/data/pcm/c22/h/01.unity3d,h_ai_22_03_013
8,22,51,こんなキスされたら……私……準備万端になっちゃうよー,sound/data/pcm/c22/h/01.unity3d,h_ai_22_03_014
9,22,51,あぁ、ダメっ……私、敏感になってるっ……,sound/data/pcm/c22/h/01.unity3d,h_ai_22_03_018
10,22,51,何されても気持ち良くなっちゃってるよぅ……,sound/data/pcm/c22/h/01.unity3d,h_ai_22_03_019
11,22,51,やだっ、身体がっ、勝手にっ、んんっ……,sound/data/pcm/c22/h/01.unity3d,h_ai_22_03_020
12,22,51,あんっ、ぴ、ぴくぴくしちゃうっ……気持ちいいよぅっ……,sound/data/pcm/c22/h/01.unity3d,h_ai_22_03_021
13,22,51,んっ、もっと……いっぱいして欲しくなっちゃうっ……,sound/data/pcm/c22/h/01.unity3d,h_ai_22_03_022
14,22,51,そこっ、すごく気持ちいいところっ……んっ、いっぱいしてぇっ！,sound/data/pcm/c22/h/01.unity3d,h_ai_22_03_023
15,22,51,ふあぁっ、そこ、いいよぅっ……どんどん濡れちゃうっ……,sound/data/pcm/c22/h/01.unity3d,h_ai_22_03_024
16,22,51,気持ちいいのがっ、我慢出来なくなっちゃう……ふあぁっ！,sound/data/pcm/c22/h/01.unity3d,h_ai_22_03_025
17,22,51,コリコリされるとっ……全身がびくびくっ、しちゃっ……んんっ！,sound/data/pcm/c22/h/01.unity3d,h_ai_22_03_026
18,22,51,あんっ、乳首っ……気持ち良すぎて大きくなっちゃうよぅっ……,sound/data/pcm/c22/h/01.unity3d,h_ai_22_03_027
19,22,51,んんっ……君に触られるとっ……乳首、また大きくなっちゃうっ……,sound/data/pcm/c22/h/01.unity3d,h_ai_22_03_028
20,22,51,あんっ……お、おまんこ……敏感みたい……,sound/data/pcm/c22/h/01.unity3d,h_ai_22_03_029
21,22,51,ダメっ……私、おまんこが一番弱いのっ……,sound/data/pcm/c22/h/01.unity3d,h_ai_22_03_030
22,22,51,そんなにされるとっ……何も考えられなくなっちゃうっ……,sound/data/pcm/c22/h/01.unity3d,h_ai_22_03_031
23,22,51,あ……そこ……違う穴なのに……気持ちいい……,sound/data/pcm/c22/h/01.unity3d,h_ai_22_03_032
24,22,51,お尻ってこんなに気持ちいいんだね……すごく……敏感……,sound/data/pcm/c22/h/01.unity3d,h_ai_22_03_033
25,22,51,恥ずかしいけど……お尻の穴……いっぱい触って欲しい……,sound/data/pcm/c22/h/01.unity3d,h_ai_22_03_034
26,22,51,君に揉まれると、おっぱい喜んじゃうよ……,sound/data/pcm/c22/h/01.unity3d,h_ai_22_03_047
27,22,51,おっぱい……すごく気持ちいい……もっとして？,sound/data/pcm/c22/h/01.unity3d,h_ai_22_03_048
28,22,51,お尻、もっと強く揉まれたら……あんっ！　やっぱり気持ちいいっ……,sound/data/pcm/c22/h/01.unity3d,h_ai_22_03_049
29,22,51,あっ、お尻……びくびくしちゃう……,sound/data/pcm/c22/h/01.unity3d,h_ai_22_03_050
30,22,51,そうやって押し込まれるとっ……んんっ、びくってしちゃうっ……,sound/data/pcm/c22/h/01.unity3d,h_ai_22_03_051
31,22,51,あんっ、気持ちいい……もっと激しくてもいいかも……,sound/data/pcm/c22/h/01.unity3d,h_ai_22_03_052
32,22,51,乳首なんてつついて……ふふっ、やらしい♪,sound/data/pcm/c22/h/01.unity3d,h_ai_22_03_053
33,22,51,ひっぱられるの大好きっ……もっとしてっ……,sound/data/pcm/c22/h/01.unity3d,h_ai_22_03_054
34,22,51,乳首っ、痛いくらいの方がいいのっ……もっとぎゅうってしてっ……,sound/data/pcm/c22/h/01.unity3d,h_ai_22_03_055
35,22,51,痛くされるのが好きっ……引っ張られるの好きぃっ……,sound/data/pcm/c22/h/01.unity3d,h_ai_22_03_056
36,22,51,あぁっ、お尻っ……すごく気持ちいい……いっぱい触って……,sound/data/pcm/c22/h/01.unity3d,h_ai_22_03_057
37,22,51,ひゃぅっ……お尻の穴……気持ちいい……,sound/data/pcm/c22/h/01.unity3d,h_ai_22_03_058
38,22,51,お尻の穴……たくさん触って欲しくなっちゃう……,sound/data/pcm/c22/h/01.unity3d,h_ai_22_03_059
39,22,51,あぁっ、おまんこ……もっともっと擦って……,sound/data/pcm/c22/h/01.unity3d,h_ai_22_03_060
40,22,51,おまんこぐしゅぐしゅだから……んっ、滑っちゃう……,sound/data/pcm/c22/h/01.unity3d,h_ai_22_03_061
41,22,51,もっともっと濡らして欲しいよぅ……,sound/data/pcm/c22/h/01.unity3d,h_ai_22_03_062
42,22,51,あんっ、おまんこの汁……お尻にも広げてぇ……,sound/data/pcm/c22/h/01.unity3d,h_ai_22_03_063
43,22,51,擦られる度に下半身ひくひくするよ……,sound/data/pcm/c22/h/01.unity3d,h_ai_22_03_064
44,22,51,あっ、もっと指先でひっかくみたいにして……んんっ！,sound/data/pcm/c22/h/01.unity3d,h_ai_22_03_065
45,22,51,はぁっ、あっ、中っ、気持ちいいっ……,sound/data/pcm/c22/h/01.unity3d,h_ai_22_03_066
46,22,51,いっぱい動かしてっ……感じさせてっ……,sound/data/pcm/c22/h/01.unity3d,h_ai_22_03_067
47,22,51,もっとぬるぬるにして欲しいのっ……,sound/data/pcm/c22/h/01.unity3d,h_ai_22_03_068
48,22,51,お尻の穴っ、なのにっ……ぬるぬるしてるっ……,sound/data/pcm/c22/h/01.unity3d,h_ai_22_03_069
49,22,51,お尻の穴に指入れるなんてっ……やらしいよぉっ……,sound/data/pcm/c22/h/01.unity3d,h_ai_22_03_070
50,22,51,お尻の穴っ、ひくひくして感じちゃうっ……,sound/data/pcm/c22/h/01.unity3d,h_ai_22_03_071
51,22,51,もっと……もっと溢れさせてっ……どんどん濡れさせてっ……,sound/data/pcm/c22/h/01.unity3d,h_ai_22_03_072
52,22,51,おまんこの中っ、とろとろのぐちゅぐちゅだよっ……,sound/data/pcm/c22/h/01.unity3d,h_ai_22_03_073
53,22,51,すごい気持ちいいっ……もっとしてぇっ……,sound/data/pcm/c22/h/01.unity3d,h_ai_22_03_074
54,22,51,んんっ、お尻の穴っ、広がっちゃうっ……,sound/data/pcm/c22/h/01.unity3d,h_ai_22_03_075
55,22,51,んんっ、お尻の中っ、もっとめちゃくちゃにしてっ……,sound/data/pcm/c22/h/01.unity3d,h_ai_22_03_076
56,22,51,あぁっ、お尻の穴っ……力入っちゃうっ……気持ちいいっ……,sound/data/pcm/c22/h/01.unity3d,h_ai_22_03_077
57,22,51,私……どんな味がするのかな……？,sound/data/pcm/c22/h/01.unity3d,h_ai_22_03_078
58,22,51,いっぱい舐めて……いっぱい味わって？,sound/data/pcm/c22/h/01.unity3d,h_ai_22_03_079
59,22,51,君の舌……蕩けるみたいに気持ちいいよ……,sound/data/pcm/c22/h/01.unity3d,h_ai_22_03_080
60,22,51,たくさん舐めて……ふふっ、君、可愛い♪,sound/data/pcm/c22/h/01.unity3d,h_ai_22_03_081
61,22,51,何だか……母性本能が刺激されちゃう……,sound/data/pcm/c22/h/01.unity3d,h_ai_22_03_082
62,22,51,どんどん溢れて……濡れ過ぎちゃうよぅ……,sound/data/pcm/c22/h/01.unity3d,h_ai_22_03_083
63,22,51,おまんこの味……好き？　ふふっ、嬉しいよー,sound/data/pcm/c22/h/01.unity3d,h_ai_22_03_084
64,22,51,お尻っ、ダメぇ……気持ち良くて……とろとろになっちゃうっ……,sound/data/pcm/c22/h/01.unity3d,h_ai_22_03_085
65,22,51,お尻で感じるなんて……私、もう完全にヘンタイさんだよぅ……,sound/data/pcm/c22/h/01.unity3d,h_ai_22_03_086
66,22,51,お尻の穴の中っ、舌がぬるぬるしてっ……あぁんっ！,sound/data/pcm/c22/h/01.unity3d,h_ai_22_03_087
67,22,51,こ、この感じっ、癖になっちゃうからっ……ダメぇっ……,sound/data/pcm/c22/h/01.unity3d,h_ai_22_03_088
68,22,51,あっ、お、お願いっ、もっといっぱいっ……激しく舐めてぇっ……,sound/data/pcm/c22/h/01.unity3d,h_ai_22_03_089
69,22,51,んっ、お、押しつける力が絶妙だよっ……,sound/data/pcm/c22/h/01.unity3d,h_ai_22_03_090
70,22,51,やだっ、私、どんどんえっちになっちゃうっ……,sound/data/pcm/c22/h/01.unity3d,h_ai_22_03_091
71,22,51,あんっ、もうっ……全部君に教えられちゃった……,sound/data/pcm/c22/h/01.unity3d,h_ai_22_03_092
72,22,51,んんっ、乳首っ、震えてるだけなのにっ、どうしてこんなに気持ちいいのっ……,sound/data/pcm/c22/h/01.unity3d,h_ai_22_03_093
73,22,51,あっ、おっぱいっ……もっと力強く当ててっ……すごくっ、気持ちいいっ……,sound/data/pcm/c22/h/01.unity3d,h_ai_22_03_094
74,22,51,んんんっ！　おまんこっ、こんなに刺激されたらっ……また濡れちゃうっ……,sound/data/pcm/c22/h/01.unity3d,h_ai_22_03_095
75,22,51,おまんこっ、もっと押しつけてぇっ……,sound/data/pcm/c22/h/01.unity3d,h_ai_22_03_096
76,22,51,ふぁぁっ、い、イッちゃうっ……イッちゃうよぉっ！,sound/data/pcm/c22/h/01.unity3d,h_ai_22_03_097
77,22,51,あっ、もっ、だめっ……い、イかせてぇっ！,sound/data/pcm/c22/h/01.unity3d,h_ai_22_03_098
78,22,51,あっ、あぁっ、君のお顔見ながらっ、私っ……いっ、イッちゃいそうっ！,sound/data/pcm/c22/h/01.unity3d,h_ai_22_03_099
79,22,51,んはあぁあんっ！,sound/data/pcm/c22/h/01.unity3d,h_ai_22_03_100
80,22,51,今の……最高に気持ち良かったよ……,sound/data/pcm/c22/h/01.unity3d,h_ai_22_03_101
81,22,51,ちょっと……乱れ過ぎちゃった……えへへ……,sound/data/pcm/c22/h/01.unity3d,h_ai_22_03_102
82,22,51,こんなに可愛がってもらえて……私、幸せだよー,sound/data/pcm/c22/h/01.unity3d,h_ai_22_03_103
83,22,51,うぅ……焦らされてるよぉ……いじわる……,sound/data/pcm/c22/h/01.unity3d,h_ai_22_03_104
84,22,51,そんなに見られると……もじもじしちゃう……,sound/data/pcm/c22/h/01.unity3d,h_ai_22_03_105
85,22,51,んっ、ふぅっ、大人のキス……気持ちいい……,sound/data/pcm/c22/h/01.unity3d,h_ai_22_03_112
86,22,51,一緒に……ぬるぬるしよ……ん、れりゅっ……,sound/data/pcm/c22/h/01.unity3d,h_ai_22_03_113
87,22,51,えへへ……お口の周り、べとべとになっちゃった,sound/data/pcm/c22/h/01.unity3d,h_ai_22_03_114
88,22,51,キス……蕩けちゃいそうだね……,sound/data/pcm/c22/h/01.unity3d,h_ai_22_03_115
89,22,51,君ってば……キス、すごく上手だよ……,sound/data/pcm/c22/h/01.unity3d,h_ai_22_03_116
90,22,51,私、君のキスでもう……蕩けちゃってます……,sound/data/pcm/c22/h/01.unity3d,h_ai_22_03_117
91,22,51,君が好きなように……何度でも……して？,sound/data/pcm/c22/h/01.unity3d,h_ai_22_03_121
92,22,51,あんっ、続けてされるとっ……敏感になっちゃう……,sound/data/pcm/c22/h/01.unity3d,h_ai_22_03_122
93,22,51,あぁっ、またっ、そこっ……性感帯だよっ……ふあぁっ！,sound/data/pcm/c22/h/01.unity3d,h_ai_22_03_123
94,22,51,そこばかりされたらっ……声っ、大きくなっちゃうっ！,sound/data/pcm/c22/h/01.unity3d,h_ai_22_03_124
95,22,51,あぁんっ、乳首続けられるとっ……溶けちゃいそうっ……,sound/data/pcm/c22/h/01.unity3d,h_ai_22_03_125
96,22,51,そんなに乳首っ、ばっかりっ、集中的にっ……あぁんっ！,sound/data/pcm/c22/h/01.unity3d,h_ai_22_03_126
97,22,51,またおまんこっ、わ、私っ、弱いんだよぅっ……,sound/data/pcm/c22/h/01.unity3d,h_ai_22_03_127
98,22,51,あっ、さっきのでもうっ……トロトロだよぅっ……,sound/data/pcm/c22/h/01.unity3d,h_ai_22_03_128
99,22,51,続けてお尻はっ、ダメっ……気持ち良すぎなのっ……,sound/data/pcm/c22/h/01.unity3d,h_ai_22_03_129
100,22,51,あぁんっ、私っ、お尻ばかり触られて感じるヘンタイさんだよぉっ……,sound/data/pcm/c22/h/01.unity3d,h_ai_22_03_130
101,22,51,ふぁっ……ふふっ、君の触り方、だんだんエッチになってる……,sound/data/pcm/c22/h/01.unity3d,h_ai_22_03_137
102,22,51,んんっ、君……本当に触るの上手だよね……,sound/data/pcm/c22/h/01.unity3d,h_ai_22_03_138
103,22,51,またおっぱい触っちゃうの……？　ううん、気持ちいいから……いっぱいして？,sound/data/pcm/c22/h/01.unity3d,h_ai_22_03_139
104,22,51,君の手でっ……おっぱいトロトロにして欲しい……,sound/data/pcm/c22/h/01.unity3d,h_ai_22_03_140
105,22,51,お尻っ……触られる度に敏感になっちゃうっ……ふあぁっ……,sound/data/pcm/c22/h/01.unity3d,h_ai_22_03_141
106,22,51,繰り返し触られるとっ……んんっ、お尻ひくひくしちゃうよぉっ……,sound/data/pcm/c22/h/01.unity3d,h_ai_22_03_142
107,22,51,あぁんっ、またつついてるっ……乳首っ、引っ込んじゃうよっ……,sound/data/pcm/c22/h/01.unity3d,h_ai_22_03_143
108,22,51,も、もう、乳首ばかりつついて……君、今すごぉくエッチなお顔してるよ……はぅぅ……,sound/data/pcm/c22/h/01.unity3d,h_ai_22_03_144
109,22,51,あぁっ、またぁっ……もうっ、どんどん大きくなっちゃうよぅっ……,sound/data/pcm/c22/h/01.unity3d,h_ai_22_03_145
110,22,51,はぅっ、んっ、君の手でっ……私の乳首……大きくして……？,sound/data/pcm/c22/h/01.unity3d,h_ai_22_03_146
111,22,51,あぁんっ、お尻、もっと触って……好きかも……,sound/data/pcm/c22/h/01.unity3d,h_ai_22_03_147
112,22,51,またお尻っ……んんっ、気持ちいい……,sound/data/pcm/c22/h/01.unity3d,h_ai_22_03_148
113,22,51,あ、あ、あ、もっと擦ってっ……ずっと擦って欲しいよぅっ……,sound/data/pcm/c22/h/01.unity3d,h_ai_22_03_149
114,22,51,またおまんこっ、擦られてるっ……あっ、気持ちっ、いいっ……,sound/data/pcm/c22/h/01.unity3d,h_ai_22_03_150
115,22,51,あぁっ、お尻、擦られてるっ……さっきよりも強いよぅっ……,sound/data/pcm/c22/h/01.unity3d,h_ai_22_03_151
116,22,51,手の動き、どんどん激しくなってるっ……お尻、気持ちいいっ……,sound/data/pcm/c22/h/01.unity3d,h_ai_22_03_152
117,22,51,あんっ、君の指っ……気持ちいいよぅっ……またいっぱい触ってぇ,sound/data/pcm/c22/h/01.unity3d,h_ai_22_03_153
118,22,51,君の指でっ……おまんこの中、何回でも触って欲しい……,sound/data/pcm/c22/h/01.unity3d,h_ai_22_03_154
119,22,51,やっ、んっ、お尻の中……また感じちゃう……気持ちいい……,sound/data/pcm/c22/h/01.unity3d,h_ai_22_03_155
120,22,51,お尻の穴……どんどん広げて……広げた方が気持ちいいもんっ……,sound/data/pcm/c22/h/01.unity3d,h_ai_22_03_156
121,22,51,ふぁぁっ、だ、ダメっ……ますますぐちょぐちょになっちゃうよっ……,sound/data/pcm/c22/h/01.unity3d,h_ai_22_03_157
122,22,51,おまんこの中っ、すごい掻き回されてるっ……さっきよりも濡れちゃうよっ……,sound/data/pcm/c22/h/01.unity3d,h_ai_22_03_158
123,22,51,さっきよりもたくさんっ……強くしてっ……お尻の穴っ、広げてぇっ……,sound/data/pcm/c22/h/01.unity3d,h_ai_22_03_159
124,22,51,お尻の中っ、君の指がっ、またっ、動いてっ……あぁっ、押されてるっ……,sound/data/pcm/c22/h/01.unity3d,h_ai_22_03_160
125,22,51,あんっ、気持ちいい……もっともっと舐めて欲しいな……,sound/data/pcm/c22/h/01.unity3d,h_ai_22_03_161
126,22,51,まだ舐めてくれるの……？　ふふっ、嬉しい……もっと感じさせて欲しいな,sound/data/pcm/c22/h/01.unity3d,h_ai_22_03_162
127,22,51,ふぁっ……も、もう、本当に赤ちゃんみたいだよ？　可愛いって思っちゃう……ふふっ……,sound/data/pcm/c22/h/01.unity3d,h_ai_22_03_163
128,22,51,あんっ、乳首ばかり吸い付いてっ……君っ、えっちだよぅっ……,sound/data/pcm/c22/h/01.unity3d,h_ai_22_03_164
129,22,51,ふぁぁっ、そんなにぺろぺろしちゃっ……ふやけちゃうよぅっ……,sound/data/pcm/c22/h/01.unity3d,h_ai_22_03_165
130,22,51,あっ、そんなに攻められるとっ……お、おまっ、んこっ……んんっ、びくびくしちゃうぅっ！,sound/data/pcm/c22/h/01.unity3d,h_ai_22_03_166
131,22,51,ふぇぇっ、お尻の穴っ、またっ、舐めっ……あっ、あぁっ、好きっ、そこ舐められるの好きぃっ……,sound/data/pcm/c22/h/01.unity3d,h_ai_22_03_167
132,22,51,んんっ、気持ちいいよぅっ……お尻の穴っ、いっぱい舐めてっ……何回でも舐めてぇっ……,sound/data/pcm/c22/h/01.unity3d,h_ai_22_03_168
133,22,51,あ、あ、あっ、お尻の穴にっ、またっ、舌っ……んんっ！　ね、ねじ込まれちゃうっ……ふぁぁっ！,sound/data/pcm/c22/h/01.unity3d,h_ai_22_03_169
134,22,51,あっ、やだっ、お尻に舌入れられるのっ、気持ちいいっ……あっ、く、繰り返しされるとっ……目覚めちゃうよぅっ……,sound/data/pcm/c22/h/01.unity3d,h_ai_22_03_170
135,22,51,んっ、んんっ、き、来てるっ……気持ちいいのっ……またっ、来てるっ……ふぁっ、あっ、来るうぅっ！,sound/data/pcm/c22/h/01.unity3d,h_ai_22_03_171
136,22,51,やっ、あっ、またっ、イッちゃうっ……私っ、またっ……あっ、はぁっ、イッちゃううぅっ！,sound/data/pcm/c22/h/01.unity3d,h_ai_22_03_172
137,22,51,はぁ、はぁ……最後、真っ白になっちゃった……,sound/data/pcm/c22/h/01.unity3d,h_ai_22_03_173
138,22,51,も、もう……私、イきすぎかも……えへへ……,sound/data/pcm/c22/h/01.unity3d,h_ai_22_03_174
