管理番号,大きい項目,中間項目,表示名,バンドルパス,ファイル名
0,25,44,どうしたの～……,sound/data/pcm/c25/h/01.unity3d,h_so_25_02_000
1,25,44,やっぱり見つめられると照れちゃうよ～……,sound/data/pcm/c25/h/01.unity3d,h_so_25_02_001
2,25,44,見惚れてるのかな～……,sound/data/pcm/c25/h/01.unity3d,h_so_25_02_002
3,25,44,うん……いいよ～……,sound/data/pcm/c25/h/01.unity3d,h_so_25_02_003
4,25,44,ふふふ……やっぱりドキドキするねー,sound/data/pcm/c25/h/01.unity3d,h_so_25_02_004
5,25,44,［P］の先っぽが当たってるのわかるよ～……,sound/data/pcm/c25/h/01.unity3d,h_so_25_02_005
6,25,44,いつも通りつけてくれるよね～……？　,sound/data/pcm/c25/h/01.unity3d,h_so_25_02_006
7,25,44,そこはちゃんとしないとね～……,sound/data/pcm/c25/h/01.unity3d,h_so_25_02_007
8,25,44,危険な日だからわかってるっすよね？　,sound/data/pcm/c25/h/01.unity3d,h_so_25_02_008
9,25,44,危険な日に生でやっちゃうとお互い面倒だからね～……,sound/data/pcm/c25/h/01.unity3d,h_so_25_02_009
10,25,44,あん！　もうなんでそこに挿れたがるのかな～？　,sound/data/pcm/c25/h/01.unity3d,h_so_25_02_010
11,25,44,ん……そっちはおしりなんだけど～……もうしょうがないな～……,sound/data/pcm/c25/h/01.unity3d,h_so_25_02_011
12,25,44,ん～とね、今日はおしりはキレイにしてないんだ～……,sound/data/pcm/c25/h/01.unity3d,h_so_25_02_012
13,25,44,今日はおしりイヤなの～……おあずけ～！,sound/data/pcm/c25/h/01.unity3d,h_so_25_02_013
14,25,44,あっ……きったぁ～……！,sound/data/pcm/c25/h/01.unity3d,h_so_25_02_014
15,25,44,んぁっ……き、急に入れちゃだめだって～……あんっ……！,sound/data/pcm/c25/h/01.unity3d,h_so_25_02_015
16,25,44,き、キミのせいで慣れてきちゃったじゃか～……！,sound/data/pcm/c25/h/01.unity3d,h_so_25_02_016
17,25,44,んんっ！　す、すごっ、すんなり入っちゃった～……！,sound/data/pcm/c25/h/01.unity3d,h_so_25_02_017
18,25,44,きゃうっ！　熱くて、溶けちゃうよぉ～……！,sound/data/pcm/c25/h/01.unity3d,h_so_25_02_018
19,25,44,んうっ、もっと強くても、大丈夫だよ……,sound/data/pcm/c25/h/01.unity3d,h_so_25_02_019
20,25,44,んっ！　キミのおちんちん、あっついよ～……！,sound/data/pcm/c25/h/01.unity3d,h_so_25_02_020
21,25,44,あんっ、も、もう……容赦ないっ、なぁ～……！,sound/data/pcm/c25/h/01.unity3d,h_so_25_02_021
22,25,44,んんっ、せ、せっかちさんなんだから～……！,sound/data/pcm/c25/h/01.unity3d,h_so_25_02_022
23,25,44,これ、なんかっ、いいかも～……！,sound/data/pcm/c25/h/01.unity3d,h_so_25_02_023
24,25,44,んくうっ！　これ、クセになりそ～……,sound/data/pcm/c25/h/01.unity3d,h_so_25_02_024
25,25,44,あっ、急にくるのダメだってばぁ～……！,sound/data/pcm/c25/h/01.unity3d,h_so_25_02_025
26,25,44,んんっ……す、すんなり入っちゃったぁ～……！,sound/data/pcm/c25/h/01.unity3d,h_so_25_02_026
27,25,44,もうちょっと、このままでもいいかも～……,sound/data/pcm/c25/h/01.unity3d,h_so_25_02_027
28,25,44,んっ、中で大きくなってる……気持ちいいの～？,sound/data/pcm/c25/h/01.unity3d,h_so_25_02_028
29,25,44,うぅ……うずうずするよぉ～……,sound/data/pcm/c25/h/01.unity3d,h_so_25_02_029
30,25,44,う、動かないの～……？,sound/data/pcm/c25/h/01.unity3d,h_so_25_02_030
31,25,44,んっ……そろそろ、慣れてきたかも～……？,sound/data/pcm/c25/h/01.unity3d,h_so_25_02_031
32,25,44,キミのおちんちんで、おしりの穴広がっちゃってるよ～……,sound/data/pcm/c25/h/01.unity3d,h_so_25_02_032
33,25,44,んっ……焦らされるの、嫌いじゃないけど～……,sound/data/pcm/c25/h/01.unity3d,h_so_25_02_033
34,25,44,んっ……びりってきたぁ～……,sound/data/pcm/c25/h/01.unity3d,h_so_25_02_034
35,25,44,んっ……早くぅ……,sound/data/pcm/c25/h/01.unity3d,h_so_25_02_035
36,25,44,んっ、おしり、ひくひくしてるよ～……,sound/data/pcm/c25/h/01.unity3d,h_so_25_02_036
37,25,44,んぉっ！　……ぬっ、抜くなら抜くって言ってよぉ～,sound/data/pcm/c25/h/01.unity3d,h_so_25_02_037
38,25,44,ああんっ、おしり、抜いちゃダメぇっ！,sound/data/pcm/c25/h/01.unity3d,h_so_25_02_038
39,25,44,あっ、んっ、ああんっ、もっと～……！,sound/data/pcm/c25/h/01.unity3d,h_so_25_02_039
40,25,44,んっ、ゆっくり、おまんこっ、広がっちゃうよぉ～……,sound/data/pcm/c25/h/01.unity3d,h_so_25_02_040
41,25,44,あんっ、んぉっ、奥でぇ～、おっきいのがっ、あん！,sound/data/pcm/c25/h/01.unity3d,h_so_25_02_041
42,25,44,あんっ、んっ、はあっ、これっ、これぇ～！,sound/data/pcm/c25/h/01.unity3d,h_so_25_02_042
43,25,44,太いのが奥でっ、あばれて～っ！,sound/data/pcm/c25/h/01.unity3d,h_so_25_02_043
44,25,44,あっ、んうっ、速いの、いいの～！,sound/data/pcm/c25/h/01.unity3d,h_so_25_02_044
45,25,44,はあっ、おしりっ、　もっとしてもいいんだよ～……？,sound/data/pcm/c25/h/01.unity3d,h_so_25_02_045
46,25,44,んっ、いいよっ、好きにしてえ～,sound/data/pcm/c25/h/01.unity3d,h_so_25_02_046
47,25,44,あうっ、凄い、エッチするとこじゃないのに～！,sound/data/pcm/c25/h/01.unity3d,h_so_25_02_047
48,25,44,あんっ、なんかっ、これっ、ひあ～っ,sound/data/pcm/c25/h/01.unity3d,h_so_25_02_048
49,25,44,んぉっ……ふふふ……相性いいよね、私たち～……,sound/data/pcm/c25/h/01.unity3d,h_so_25_02_049
50,25,44,ああんっ、おしりっ、キミの形にほぐれちゃう～っ,sound/data/pcm/c25/h/01.unity3d,h_so_25_02_050
51,25,44,んうっ、そこいいっ、も、もっと触って～……？,sound/data/pcm/c25/h/01.unity3d,h_so_25_02_051
52,25,44,あぁん……もっと触ってよぉ～……,sound/data/pcm/c25/h/01.unity3d,h_so_25_02_052
53,25,44,あんっ、いっ、いっぱい触ってよおぉ～……？,sound/data/pcm/c25/h/01.unity3d,h_so_25_02_053
54,25,44,んっ、ダメだってば～っ、これ以上っ、触られたらぁ～……！,sound/data/pcm/c25/h/01.unity3d,h_so_25_02_054
55,25,44,そこっ、ダメだって～、ああんっ,sound/data/pcm/c25/h/01.unity3d,h_so_25_02_055
56,25,44,あっ、んもうっ、ズルいよっ、そっちばっかり～っ,sound/data/pcm/c25/h/01.unity3d,h_so_25_02_056
57,25,44,そこっ、キミに触られるならっ、好きになっちゃうかも～……,sound/data/pcm/c25/h/01.unity3d,h_so_25_02_057
58,25,44,い、いやって言ってるのに～……もう～っ,sound/data/pcm/c25/h/01.unity3d,h_so_25_02_058
59,25,44,はぁんっ！　もっと、奥まで擦って～……,sound/data/pcm/c25/h/01.unity3d,h_so_25_02_059
60,25,44,んうっ！　奥で、オチンポっ、あんっ、ゴンゴンって～っ！,sound/data/pcm/c25/h/01.unity3d,h_so_25_02_060
61,25,44,あんっ、いやっ、これ以上突かれたら、おかしくなるよ～っ！,sound/data/pcm/c25/h/01.unity3d,h_so_25_02_061
62,25,44,す、すごいっ、ケダモノみたいにっ、んああぁ～っ！,sound/data/pcm/c25/h/01.unity3d,h_so_25_02_062
63,25,44,んううっ！　おっきいの、来てるぅ～っ！,sound/data/pcm/c25/h/01.unity3d,h_so_25_02_063
64,25,44,あっ、んっ！　いいんだよ、もっと強くても～！,sound/data/pcm/c25/h/01.unity3d,h_so_25_02_064
65,25,44,おちんちん、おしりの奥でゴリゴリしてるぅ～……,sound/data/pcm/c25/h/01.unity3d,h_so_25_02_065
66,25,44,あんっ！　もっとゴリゴリ、奥まで突いて～っ！,sound/data/pcm/c25/h/01.unity3d,h_so_25_02_066
67,25,44,んっ、おっ、おしりっ、おまんこにっ、なっちゃったぁ～っ,sound/data/pcm/c25/h/01.unity3d,h_so_25_02_067
68,25,44,あんっ！　キミのっ、好きにっ、うごいていいよぉ～っ,sound/data/pcm/c25/h/01.unity3d,h_so_25_02_068
69,25,44,あっあっ、おしりっ、いいのぉ～っ,sound/data/pcm/c25/h/01.unity3d,h_so_25_02_069
70,25,44,あんっ、もう、おしりなんてっ、ほんとはだめなのに～っ,sound/data/pcm/c25/h/01.unity3d,h_so_25_02_070
71,25,44,んぁっ、キミの手、あっついよぉ～っ,sound/data/pcm/c25/h/01.unity3d,h_so_25_02_071
72,25,44,キミの手がまさぐってるとこっ、やけどしちゃうよぉ～っ,sound/data/pcm/c25/h/01.unity3d,h_so_25_02_072
73,25,44,んんっ、そこっ、触られたらっ、おかしくなるぅ～っ,sound/data/pcm/c25/h/01.unity3d,h_so_25_02_073
74,25,44,あっ、そこっ触られたらっ、ひゃうん～っ！,sound/data/pcm/c25/h/01.unity3d,h_so_25_02_074
75,25,44,さ、触っててもいいからっ、もっとぉ～……,sound/data/pcm/c25/h/01.unity3d,h_so_25_02_075
76,25,44,うぅ～……キミが好きなら、いいけどっ、もっと突いてよぉ～っ,sound/data/pcm/c25/h/01.unity3d,h_so_25_02_076
77,25,44,もっと、突いてっ、エッチなことで頭からっぽにしてぇ～っ,sound/data/pcm/c25/h/01.unity3d,h_so_25_02_077
78,25,44,あんっ、やなのにっ、なんでっ、うぁ～っ,sound/data/pcm/c25/h/01.unity3d,h_so_25_02_078
79,25,44,舌っ、もっとちょうだい……んちゅっ……はぁっ……ぢゅる……,sound/data/pcm/c25/h/01.unity3d,h_so_25_02_079
80,25,44,んうっ、ちゅーしてっ、おちんちん膨らんできたっ、んちゅっぢゅる……,sound/data/pcm/c25/h/01.unity3d,h_so_25_02_080
81,25,44,んっ、舌噛んじゃいそうっ、じゅるっ、ちゅっ、れろ……ぷはぁ～……,sound/data/pcm/c25/h/01.unity3d,h_so_25_02_081
82,25,44,ちゅっ、はぁっ、おちんちん、おっきくなってる～……キミも好きなんだから～っ,sound/data/pcm/c25/h/01.unity3d,h_so_25_02_082
83,25,44,ちゅ～するだけで、おちんちんっ、きゅ～って……ふふふ～,sound/data/pcm/c25/h/01.unity3d,h_so_25_02_083
84,25,44,んちゅっ、よだれっ、おいしっ、ちゅっ、んはあ～っ,sound/data/pcm/c25/h/01.unity3d,h_so_25_02_084
85,25,44,舌っ、もっと、もっとぉ～……んちゅるっ、ぢゅっ、んぐ～っ,sound/data/pcm/c25/h/01.unity3d,h_so_25_02_085
86,25,44,あんっ、もうっ、ちゅー、できないからっ、んうっ、あばれないで～っ,sound/data/pcm/c25/h/01.unity3d,h_so_25_02_086
87,25,44,やんっ、こんなっ、すごいの、来ちゃう～っ,sound/data/pcm/c25/h/01.unity3d,h_so_25_02_087
88,25,44,あんっ、来てるっ、気持ちいいの来てっ、やあん～っ！,sound/data/pcm/c25/h/01.unity3d,h_so_25_02_088
89,25,44,気持ちいいっ、やんっ、んううっ！　すごっ、すごいのぉ～っ！,sound/data/pcm/c25/h/01.unity3d,h_so_25_02_089
90,25,44,あっ　身体っ、溶けちゃいそう～,sound/data/pcm/c25/h/01.unity3d,h_so_25_02_090
91,25,44,んうっ、太くなって、おまんこっ、ひろがってえぇ～……,sound/data/pcm/c25/h/01.unity3d,h_so_25_02_091
92,25,44,やんっ、おちんちん、上のとこ突いてっ、気持ちいんだぁ～？,sound/data/pcm/c25/h/01.unity3d,h_so_25_02_092
93,25,44,気持ちいように、動いていいからなっ、私も、キミに気持ちよくなってほしいからっ,sound/data/pcm/c25/h/01.unity3d,h_so_25_02_093
94,25,44,いいよっ、せーしでパンパンのちんちんでっ、奥突いてぇ～っ！,sound/data/pcm/c25/h/01.unity3d,h_so_25_02_094
95,25,44,お、奥の方っ。もっと、いっぱい～……！,sound/data/pcm/c25/h/01.unity3d,h_so_25_02_095
96,25,44,あ、あ、あ。んおおっ、これっ、好きっ、おしり好きい～っ,sound/data/pcm/c25/h/01.unity3d,h_so_25_02_096
97,25,44,あんっ、もっと突いて、擦って、んううう～っ！,sound/data/pcm/c25/h/01.unity3d,h_so_25_02_097
98,25,44,おちんちん、擦れてえっ、あんっ、ひっ、熱いのっ、燃えちゃいそうでっ、んううう～っ！,sound/data/pcm/c25/h/01.unity3d,h_so_25_02_098
99,25,44,おしりっ、いいのっ、もっと奥、奥に奥に突いてぇ～っ,sound/data/pcm/c25/h/01.unity3d,h_so_25_02_099
100,25,44,んうっ、おしりっ、いいのっ、おひいっ、好きにしてぇ～っ,sound/data/pcm/c25/h/01.unity3d,h_so_25_02_100
101,25,44,あんっ、やっ、もっと、もっと奥におちんちんちょうだぃ～っ……,sound/data/pcm/c25/h/01.unity3d,h_so_25_02_101
102,25,44,おしりっ、いいよっ、ヒリヒリして、ゾクゾクして、おかしくなる～っ,sound/data/pcm/c25/h/01.unity3d,h_so_25_02_102
103,25,44,きっ、キミのエッチが上手いからっ、いっしょにイキたいのに～っ,sound/data/pcm/c25/h/01.unity3d,h_so_25_02_103
104,25,44,きゃうんっ！　あっ、私っ、もう、らめえぇ～っ！,sound/data/pcm/c25/h/01.unity3d,h_so_25_02_104
105,25,44,もっと突いてっ、私といっしょに、イッちゃうう～っ！,sound/data/pcm/c25/h/01.unity3d,h_so_25_02_105
106,25,44,いっしょにっ、気持ちよくなって、イくんだからね～っ……！？,sound/data/pcm/c25/h/01.unity3d,h_so_25_02_106
107,25,44,あんっ、イきそうなのぉっ？　いいよっ、奥に、ちょうだい～っ！,sound/data/pcm/c25/h/01.unity3d,h_so_25_02_107
108,25,44,気持ちいいんだなっ、おまんこっ、キミの形になってっ、もっと締め付けるから～っ！,sound/data/pcm/c25/h/01.unity3d,h_so_25_02_108
109,25,44,やんっ、かけてっ、真っ白に汚してぇ～っ！,sound/data/pcm/c25/h/01.unity3d,h_so_25_02_109
110,25,44,んうううっ、いいよっ、せーしで、いくぅ～っ！,sound/data/pcm/c25/h/01.unity3d,h_so_25_02_110
111,25,44,あんっ、外ぉ？　中ぁ？　どっちでも好きな方でいいからよぉ～っ,sound/data/pcm/c25/h/01.unity3d,h_so_25_02_111
112,25,44,ひゃんっ、イきそうなの～っ？　んうっ、キミのことは分かってるからぁ～っ,sound/data/pcm/c25/h/01.unity3d,h_so_25_02_112
113,25,44,おくっ、奥いいのっ！　おちんちん子宮にぶつけてぇ～っ！,sound/data/pcm/c25/h/01.unity3d,h_so_25_02_113
114,25,44,あっ、いいよっ、その顔っ、好きだなぁ～……,sound/data/pcm/c25/h/01.unity3d,h_so_25_02_114
115,25,44,やああんっ、いいよっ、もっと好きにして、キミも来てぇ～っ！,sound/data/pcm/c25/h/01.unity3d,h_so_25_02_115
116,25,44,あんっ、ゴメンっ、私、もうっ、限界～っ……,sound/data/pcm/c25/h/01.unity3d,h_so_25_02_116
117,25,44,んぉっ、いくよぉっ、おしりでいっちゃうのおぉ～っ！,sound/data/pcm/c25/h/01.unity3d,h_so_25_02_117
118,25,44,おしりっ、やだっ、これっ、あううっ、キミもっ、いっしょだからね～っ,sound/data/pcm/c25/h/01.unity3d,h_so_25_02_118
119,25,44,あんっ、もっと擦ってっ！　私もいっしょにイキたいから～っ,sound/data/pcm/c25/h/01.unity3d,h_so_25_02_119
120,25,44,いいよっ、来てっ、いっぱい、出してぇ～っ！,sound/data/pcm/c25/h/01.unity3d,h_so_25_02_120
121,25,44,やああんっ！　いっぱい、出てるぅ、そんなに気持ちよかったのぉ～……？,sound/data/pcm/c25/h/01.unity3d,h_so_25_02_121
122,25,44,あっ！　もうっ、こんなにいっぱい～……ふふふ,sound/data/pcm/c25/h/01.unity3d,h_so_25_02_122
123,25,44,ゴム、ちゃんとしてるのにっ、熱いよぉ～……,sound/data/pcm/c25/h/01.unity3d,h_so_25_02_123
124,25,44,ゴム越しに、どくどくって、おちんちん動いてるぅ～……,sound/data/pcm/c25/h/01.unity3d,h_so_25_02_124
125,25,44,んっ、おしりっ、熱いのがきてるぅ～……,sound/data/pcm/c25/h/01.unity3d,h_so_25_02_125
126,25,44,ああんっ、もっと、もっと来てぇ～……,sound/data/pcm/c25/h/01.unity3d,h_so_25_02_126
127,25,44,んっ、ひゃううう～～……！,sound/data/pcm/c25/h/01.unity3d,h_so_25_02_127
128,25,44,あんっ、イクっ、んにいぃ～～っ！,sound/data/pcm/c25/h/01.unity3d,h_so_25_02_128
129,25,44,イッ、イッちゃう。ダメっ、らめえぇ～～っ！,sound/data/pcm/c25/h/01.unity3d,h_so_25_02_129
130,25,44,あんっ、やっ、んっ、はあぁ～！,sound/data/pcm/c25/h/01.unity3d,h_so_25_02_130
131,25,44,ここでゴムを外したら……じょ、冗談だよ～……ふふふ～,sound/data/pcm/c25/h/01.unity3d,h_so_25_02_131
132,25,44,……あったかい。キミといっしょにいると、安心するなぁ～……,sound/data/pcm/c25/h/01.unity3d,h_so_25_02_132
133,25,44,いっしょに気持ちよくなれるって、幸せだなぁ～……,sound/data/pcm/c25/h/01.unity3d,h_so_25_02_133
134,25,44,ねえ、ぎゅってしてくれる～……？,sound/data/pcm/c25/h/01.unity3d,h_so_25_02_134
135,25,44,もしも赤ちゃんが出来たら……って、気が早いかな～？　ふふふ～……,sound/data/pcm/c25/h/01.unity3d,h_so_25_02_135
136,25,44,お腹の中で熱いのが動いてね、子宮に行こうとしてるのが分かるんだ～……,sound/data/pcm/c25/h/01.unity3d,h_so_25_02_136
137,25,44,えへ～、先にイッちゃったぁ～……次はいっしょにイこ～……？,sound/data/pcm/c25/h/01.unity3d,h_so_25_02_137
138,25,44,こうやって、ぎゅっとされるの、あったかくて、いいなぁ～……,sound/data/pcm/c25/h/01.unity3d,h_so_25_02_138
139,25,44,いっしょにイくとさ、心まで繋がってるって、そんな感じしない～…・・？　,sound/data/pcm/c25/h/01.unity3d,h_so_25_02_139
140,25,44,おしり、ちょっとヒリヒリするけど、キミだから気持ちいいんだ～……,sound/data/pcm/c25/h/01.unity3d,h_so_25_02_140
141,25,44,ん……この変な感じが、気持ちいいような～……,sound/data/pcm/c25/h/01.unity3d,h_so_25_02_141
142,25,44,んんっ、おしり、こんなに気持ちいいの、キミのせいだからね～？　……ふふふ,sound/data/pcm/c25/h/01.unity3d,h_so_25_02_142
143,25,44,ちょっと、擦れてヒリヒリするけど、これある方がいっぱいエッチできるからねぇ～……,sound/data/pcm/c25/h/01.unity3d,h_so_25_02_143
144,25,44,もどかしいけど～……まだ子供は早いもんねぇ～……辛抱辛抱～,sound/data/pcm/c25/h/01.unity3d,h_so_25_02_144
145,25,44,もうちょっと、くっついててもいい～……？,sound/data/pcm/c25/h/01.unity3d,h_so_25_02_145
146,25,44,中も、外もあったかくて～……ふふふ、さいこ～……,sound/data/pcm/c25/h/01.unity3d,h_so_25_02_146
147,25,44,んんっ……ダメだ、何にも考えられないよ～……,sound/data/pcm/c25/h/01.unity3d,h_so_25_02_147
148,25,44,あんっ、力んだら漏れちゃうからぁ～……まだぎゅっとしててぇ～……,sound/data/pcm/c25/h/01.unity3d,h_so_25_02_148
149,25,44,私だけ先になんて～……そ、そんな顔で見ないでよぉ～……,sound/data/pcm/c25/h/01.unity3d,h_so_25_02_149
150,25,44,頭の奥、ビリビリって～……これしゅきぃ～……,sound/data/pcm/c25/h/01.unity3d,h_so_25_02_150
151,25,44,最近、エッチのこと考えるだけでおしり、ムズムズしてくるんだ～……,sound/data/pcm/c25/h/01.unity3d,h_so_25_02_151
152,25,44,このっ、ふわふわした感じっ、好きだなぁ～……,sound/data/pcm/c25/h/01.unity3d,h_so_25_02_152
153,25,44,あんっ、激しすぎだよ……びっくりしちゃったぁ～……,sound/data/pcm/c25/h/01.unity3d,h_so_25_02_153
154,25,44,んうっ、キミが激しくしたせいでっ、こうなったんだからね～？,sound/data/pcm/c25/h/01.unity3d,h_so_25_02_154
155,25,44,ゴムが違うと、気持ちよさって変わるのかな……どうだろ～？,sound/data/pcm/c25/h/01.unity3d,h_so_25_02_155
156,25,44,んっ、たまにはゴムでするのもいいかもぉ～……,sound/data/pcm/c25/h/01.unity3d,h_so_25_02_156
157,25,44,抜いたら勿体ないからさ～、もうちょっとこのまま～……ふふふ～,sound/data/pcm/c25/h/01.unity3d,h_so_25_02_157
158,25,44,出してる時の顔、子供みたいに必死で可愛いよぉ～……ふふふ,sound/data/pcm/c25/h/01.unity3d,h_so_25_02_158
159,25,44,こんなにたくさん……赤ちゃんできちゃうなぁ～……養ってもらわないと～……,sound/data/pcm/c25/h/01.unity3d,h_so_25_02_159
160,25,44,子供が出来ても、たくさんエッチしようねぇ～……？,sound/data/pcm/c25/h/01.unity3d,h_so_25_02_160
161,25,44,ゴム、無かったら……って思うと……子宮がきゅんって～……ね～？,sound/data/pcm/c25/h/01.unity3d,h_so_25_02_161
162,25,44,いっしょにイッた時ってさ、なんか心まで一つになった感じしない～？,sound/data/pcm/c25/h/01.unity3d,h_so_25_02_162
163,25,44,いっしょに気持ちよくなるって、幸せ感あるよねぇ～……キミはどう～？,sound/data/pcm/c25/h/01.unity3d,h_so_25_02_163
164,25,44,エッチの後にこうしてるの、好きだな～……,sound/data/pcm/c25/h/01.unity3d,h_so_25_02_164
165,25,44,えへ～、キミも私も。悪い子なんだから～……ふふふ～,sound/data/pcm/c25/h/01.unity3d,h_so_25_02_165
166,25,44,ちょ、ちょっとくらいなら、危ないエッチをしても、大丈夫だよねぇ～……？,sound/data/pcm/c25/h/01.unity3d,h_so_25_02_166
167,25,44,こうする度に、私とキミがひとつに溶けてくみたいで～……幸せ～……,sound/data/pcm/c25/h/01.unity3d,h_so_25_02_167
168,25,44,この瞬間。私、一番好きかも～……,sound/data/pcm/c25/h/01.unity3d,h_so_25_02_168
169,25,44,おしり、興味はあったけど、こんなにすごいなんて思わなかったな～……,sound/data/pcm/c25/h/01.unity3d,h_so_25_02_169
170,25,44,んっ、こんなのしてるってみんなにバレたら、私恥ずかしくて死んじゃうよぉ～……,sound/data/pcm/c25/h/01.unity3d,h_so_25_02_170
171,25,44,ほんとは、よくないって、わかってるのになぁ～……,sound/data/pcm/c25/h/01.unity3d,h_so_25_02_171
172,25,44,おちんちんの先からびゅって出るの、なんか目が離せないな～……,sound/data/pcm/c25/h/01.unity3d,h_so_25_02_172
173,25,44,んっ、せーしシャワー、すごぉ～……,sound/data/pcm/c25/h/01.unity3d,h_so_25_02_173
174,25,44,せーし、熱くて、やけどしちゃいそうだな～……,sound/data/pcm/c25/h/01.unity3d,h_so_25_02_174
175,25,44,えへ～、よかったみたいだねぇ～……うれしい～,sound/data/pcm/c25/h/01.unity3d,h_so_25_02_175
176,25,44,こんなに出されたら～……外からでも妊娠しちゃったりして～……ふふふ～,sound/data/pcm/c25/h/01.unity3d,h_so_25_02_176
177,25,44,ん～っ、今日もいっぱい出たねぇ～……いいこいいこ～,sound/data/pcm/c25/h/01.unity3d,h_so_25_02_177
178,25,44,あっ……溢れてきちゃったなぁ～……もったいない,sound/data/pcm/c25/h/01.unity3d,h_so_25_02_178
179,25,44,んっ……こんなに出して、おしりからせーし溢れちゃうよ～……,sound/data/pcm/c25/h/01.unity3d,h_so_25_02_179
180,25,44,……なんか、これ。気持ちいいかも～……,sound/data/pcm/c25/h/01.unity3d,h_so_25_02_180
181,25,44,んっ……もうおわり～？,sound/data/pcm/c25/h/01.unity3d,h_so_25_02_181
182,25,44,それで、次は何をするの～……？,sound/data/pcm/c25/h/01.unity3d,h_so_25_02_182
183,25,44,私も、キミのが欲しいなぁ～……,sound/data/pcm/c25/h/01.unity3d,h_so_25_02_183
184,25,44,いっしょに、気持ちよくなろ～？,sound/data/pcm/c25/h/01.unity3d,h_so_25_02_184
185,25,44,私もっ、したいけど、ダメなんだってばぁ～,sound/data/pcm/c25/h/01.unity3d,h_so_25_02_185
186,25,44,今日は、ちゃーんとつけてほしいな～……？,sound/data/pcm/c25/h/01.unity3d,h_so_25_02_186
187,25,44,なんにも考えず、キミと繋がっていたいけど～……,sound/data/pcm/c25/h/01.unity3d,h_so_25_02_187
188,25,44,出されたらっ、赤ちゃん出来ちゃうから～……もう少ししたら、それでもいいけど～……,sound/data/pcm/c25/h/01.unity3d,h_so_25_02_188
189,25,44,うん、いいよ。おしりで気持ちよくなって～……？,sound/data/pcm/c25/h/01.unity3d,h_so_25_02_189
190,25,44,うん、私のおしり、欲しいんだもんね～……？,sound/data/pcm/c25/h/01.unity3d,h_so_25_02_190
191,25,44,い、いくらキミの頼みでも～……,sound/data/pcm/c25/h/01.unity3d,h_so_25_02_191
192,25,44,これ以上おしり使ったら、変になっちゃうからぁ～,sound/data/pcm/c25/h/01.unity3d,h_so_25_02_192
193,25,44,おちんちん、おっきいよぉ～……,sound/data/pcm/c25/h/01.unity3d,h_so_25_02_193
194,25,44,きもちっ、いいよ～っ,sound/data/pcm/c25/h/01.unity3d,h_so_25_02_194
195,25,44,んうっ、急におっきいの来たあ～っ,sound/data/pcm/c25/h/01.unity3d,h_so_25_02_195
196,25,44,これっ、いいよぉ～っ,sound/data/pcm/c25/h/01.unity3d,h_so_25_02_196
197,25,44,あはっ、まだおっきくなってる～,sound/data/pcm/c25/h/01.unity3d,h_so_25_02_197
198,25,44,も、もうっ、好きなんだから～,sound/data/pcm/c25/h/01.unity3d,h_so_25_02_198
199,25,44,おしりっ、戻んなくなっちゃうよ～,sound/data/pcm/c25/h/01.unity3d,h_so_25_02_199
200,25,44,おしりっ、だめだってば～っ,sound/data/pcm/c25/h/01.unity3d,h_so_25_02_200
201,25,44,おっきいの、来てるぅ～,sound/data/pcm/c25/h/01.unity3d,h_so_25_02_201
202,25,44,ずっと、つながっていたいな～……,sound/data/pcm/c25/h/01.unity3d,h_so_25_02_202
