管理番号,大きい項目,中間項目,表示名,バンドルパス,ファイル名
0,22,58,おちんちんの面倒は私に任せてね,sound/data/pcm/c22/h/01.unity3d,h_so3p_22_03_000
1,22,58,いーっぱい気持ちいいことしよ！,sound/data/pcm/c22/h/01.unity3d,h_so3p_22_03_001
2,22,58,どう？　おまんこぱっくり開いてる……かな？,sound/data/pcm/c22/h/01.unity3d,h_so3p_22_03_004
3,22,58,おちんちん、入れてもらえるの……幸せだよぉ,sound/data/pcm/c22/h/01.unity3d,h_so3p_22_03_005
4,22,58,おまんこの中、ぐしょぐしょになってるよぉ,sound/data/pcm/c22/h/01.unity3d,h_so3p_22_03_008
5,22,58,あとで交代してあげるからね。おまんこ、いっぱいしてもらお！,sound/data/pcm/c22/h/01.unity3d,h_so3p_22_03_009
6,22,58,おまんこのエッチな音、たくさん聞いてぇ……,sound/data/pcm/c22/h/01.unity3d,h_so3p_22_03_010
7,22,58,私が一番エッチになる瞬間、いっぱい見てねぇ,sound/data/pcm/c22/h/01.unity3d,h_so3p_22_03_011
8,22,58,おちんちん好き過ぎてっ……私もう限界だよぉっ……,sound/data/pcm/c22/h/01.unity3d,h_so3p_22_03_016
9,22,58,ね、もうイきそうなんだよね？　んっ、二人で一緒にイッちゃお！,sound/data/pcm/c22/h/01.unity3d,h_so3p_22_03_017
10,22,58,二人が同時にイッちゃうとこ、しっかり見てぇ！,sound/data/pcm/c22/h/01.unity3d,h_so3p_22_03_022
11,22,58,ふぁっ、身体っ……揃ってびくびくしちゃうっ！,sound/data/pcm/c22/h/01.unity3d,h_so3p_22_03_023
12,22,58,あぁっ、みんな一緒にイッちゃうのっ……仲良くていいかもぉ！,sound/data/pcm/c22/h/01.unity3d,h_so3p_22_03_024
13,22,58,このまま激しくっ……一斉にイッちゃおっ！,sound/data/pcm/c22/h/01.unity3d,h_so3p_22_03_025
14,22,58,おちんちん……いつもより気持ち良かったかも……,sound/data/pcm/c22/h/01.unity3d,h_so3p_22_03_030
15,22,58,おまんこがおちんちん渡したくないって言っちゃった……,sound/data/pcm/c22/h/01.unity3d,h_so3p_22_03_031
16,22,58,お願い……もう少しだけ……おちんちん入れさせて？,sound/data/pcm/c22/h/01.unity3d,h_so3p_22_03_036
17,22,58,おちんちんの感触、すごく気持ちいいよ。次は代わってみる？,sound/data/pcm/c22/h/01.unity3d,h_so3p_22_03_037
