管理番号,大きい項目,中間項目,表示名,バンドルパス,ファイル名
0,21,32,キミに気持ちよくなってもらいたいから、何でも言って,sound/data/pcm/c21/h/01.unity3d,h_hh_21_01_000
1,21,32,ちょっと恥ずかしいけど、満足してもらえるように努力するね,sound/data/pcm/c21/h/01.unity3d,h_hh_21_01_001
2,21,32,この前より気持ちよくできたらいいな…えへへ,sound/data/pcm/c21/h/01.unity3d,h_hh_21_01_002
3,21,32,こう？　ここも気持ちいい？,sound/data/pcm/c21/h/01.unity3d,h_hh_21_01_003
4,21,32,こんなに遅くても感じるの？,sound/data/pcm/c21/h/01.unity3d,h_hh_21_01_004
5,21,32,もっと激しくしてみるね,sound/data/pcm/c21/h/01.unity3d,h_hh_21_01_006
6,21,32,もっと大きくなってきた…ここも感じちゃう？,sound/data/pcm/c21/h/01.unity3d,h_hh_21_01_007
7,21,32,ん…れろ…ちろっ…気持ちいい？　ぺろっ、ぴちゃっ,sound/data/pcm/c21/h/01.unity3d,h_hh_21_01_009
8,21,32,れちゅっ…レロッレロッ…もっと激しく？　う、うん、ぴちゃっむ、れるれるっ、れるっ,sound/data/pcm/c21/h/01.unity3d,h_hh_21_01_011
9,21,32,ん……んちゅぷっ……きもひぃ？　じゅっ、じゅぷ…ちゅうっ（気持ちぃ？）,sound/data/pcm/c21/h/01.unity3d,h_hh_21_01_013
10,21,32,じゅぽ、じゅぽ…じゅる、前よひ、りょうず？　んじゅ、じゅぷっじゅぷっ（前より上手？）,sound/data/pcm/c21/h/01.unity3d,h_hh_21_01_015
11,21,32,ここ、敏感なんだよね？　痛くない？　大丈夫？,sound/data/pcm/c21/h/01.unity3d,h_hh_21_01_017
12,21,32,もっと激しく、だよね？　キミのお顔、物足りなさそうだったから,sound/data/pcm/c21/h/01.unity3d,h_hh_21_01_019
13,21,32,こうやってるだけで、気持ちいいの？,sound/data/pcm/c21/h/01.unity3d,h_hh_21_01_021
14,21,32,こうすると血管が手のひらにゴリゴリ当たってるけど、大丈夫？,sound/data/pcm/c21/h/01.unity3d,h_hh_21_01_023
15,21,32,れろっ、れろっ………れろ、ぺろっ,sound/data/pcm/c21/h/01.unity3d,h_hh_21_01_025
16,21,32,ぺろっ、ぴちゃっぺちゃっ…タマタマって、私が舐めると呼吸するみたいに膨らんだり縮んだりするね、レロッ、れろれろっ,sound/data/pcm/c21/h/01.unity3d,h_hh_21_01_027
17,21,32,こんな感じ？　デリケートな部分だから、痛かったらすぐやめるからね,sound/data/pcm/c21/h/01.unity3d,h_hh_21_01_029
18,21,32,キミが気持ちいいならしちゃうけど、やりすぎ注意だよ？,sound/data/pcm/c21/h/01.unity3d,h_hh_21_01_031
19,21,32,ちろちろ、りゅろっ…気持ちいい？　ちゅろっ、ちろっ,sound/data/pcm/c21/h/01.unity3d,h_hh_21_01_033
20,21,32,れろっれろれろ、先っぽからエッチなお汁出てる、れろろぉっ、れろ、ちゅぺっ,sound/data/pcm/c21/h/01.unity3d,h_hh_21_01_035
21,21,32,じゅぶ…じゅぶぶ…ンっ！　ごえんね、歯があたっちゃった、じゅぶっ…じゅるる（ごめんね、歯が当たっちゃった）,sound/data/pcm/c21/h/01.unity3d,h_hh_21_01_037
22,21,32,くちゅっ、じゅるる、いっはい、気持ちよくなっれ、ぢゅぶっぢゅぶっ（イッパイ気持ちよくなって）,sound/data/pcm/c21/h/01.unity3d,h_hh_21_01_039
23,21,32,私の胸でも、ちゃんと気持ちいい？,sound/data/pcm/c21/h/01.unity3d,h_hh_21_01_041
24,21,32,はぁ、はぁっ、もっと私の胸で、キミを気持ちよくしたい、頑張るから,sound/data/pcm/c21/h/01.unity3d,h_hh_21_01_043
25,21,32,ちっちゃくても気持ちよくしてあげたいから…がんばるね,sound/data/pcm/c21/h/01.unity3d,h_hh_21_01_045
26,21,32,んんっ、なんかこれ、私も気持ちいいぃっ,sound/data/pcm/c21/h/01.unity3d,h_hh_21_01_046
27,21,32,こんな風にするだけで、本当に気持ちいいの？,sound/data/pcm/c21/h/01.unity3d,h_hh_21_01_047
28,21,32,はぁっはぁ、もっと寄せちゃう？　きゅううってしちゃうね,sound/data/pcm/c21/h/01.unity3d,h_hh_21_01_048
29,21,32,れるっ、れるっ、リズム付けると、やりやすいかも、ちゅるっ、ちゅぴっ,sound/data/pcm/c21/h/01.unity3d,h_hh_21_01_049
30,21,32,れるっれるれるれる、舌と胸で、射精させてあげたい…ちゅれっ、ぴちゃっぺちゃっ,sound/data/pcm/c21/h/01.unity3d,h_hh_21_01_051
31,21,32,れろ…れろるっ、んちゅ…キミがいいならするけど、気持ちいいのかな…,sound/data/pcm/c21/h/01.unity3d,h_hh_21_01_053
32,21,32,はあっ、はあっ、レロッ、んんりゅ、おっぱいも、いいんだ？　れるっ、キミが好きなら…ちゅぷ、れぷっ,sound/data/pcm/c21/h/01.unity3d,h_hh_21_01_054
33,21,32,れる、ちゅぷっ、挟むのはいいけど、りゅぷっ、コツがいるね…れる…頑張って覚えるから,sound/data/pcm/c21/h/01.unity3d,h_hh_21_01_055
34,21,32,んりゅっ、れるっ、ちゅぱっ、そ、そんなに気持ちいいの？　なら、いっぱいしてあげる,sound/data/pcm/c21/h/01.unity3d,h_hh_21_01_056
35,21,32,んじゅぽ、じゅぽぉ…こ、こお？　んじゅぷ、じゅぐぷ、練習ひていい？（こ、こう？　練習していい？）,sound/data/pcm/c21/h/01.unity3d,h_hh_21_01_057
36,21,32,じゅ、じゅるっ、じゅっぷ！　キミのが…じゅるっ、暴れへ、んぷ、上手に咥えらえないぃ…じゅぷっ（キミのが暴れて…上手に咥えられないぃ）,sound/data/pcm/c21/h/01.unity3d,h_hh_21_01_059
37,21,32,んじゅる、じゅぶぶ…こんら胸らから、じゅぽ、へめて、気持ちを込めてするね、じゅるる、じゅぷっ（こんな胸だから、せめて気持ちを込めてするね）,sound/data/pcm/c21/h/01.unity3d,h_hh_21_01_061
38,21,32,じゅるる、じゅっ、じゅぷぷっ、胸も出来るらけ、じゅっじゅ、押し付けうね、んじゅっ（胸も出来るだけ押し付けるね）,sound/data/pcm/c21/h/01.unity3d,h_hh_21_01_062
39,21,32,私の胸っれ、ほんなに気持ひいい？　お口も負へないようにふるね（私の胸って、そんなに気持ちいい？　お口も負けないようにするね）,sound/data/pcm/c21/h/01.unity3d,h_hh_21_01_063
40,21,32,ほう？　挟んれ咥えゆだけじゃ、物足りないおね、頑張ゆから（こう？　挟んで咥えるだけじゃ、物足りないよね、頑張るから）,sound/data/pcm/c21/h/01.unity3d,h_hh_21_01_064
41,21,32,いっぱい出して、キミの熱いの出してぇっ,sound/data/pcm/c21/h/01.unity3d,h_hh_21_01_074
42,21,32,いっぱい舐めるからたくさん出してぇ,sound/data/pcm/c21/h/01.unity3d,h_hh_21_01_077
43,21,32,髪でも、お顔でも、いっぱい出ひて（髪でもお顔でも、いっぱい出して）,sound/data/pcm/c21/h/01.unity3d,h_hh_21_01_080
44,21,32,うゆ、キミが気持ひよくなった証、全部出ひてぇ（うん、キミが気持ちよくなった証、全部出してぇ）,sound/data/pcm/c21/h/01.unity3d,h_hh_21_01_083
45,21,32,何回見ても、すごいね…,sound/data/pcm/c21/h/01.unity3d,h_hh_21_01_089
46,21,32,キミのと同じぐらい熱いね…あの熱さって、精液の熱さなんだ…,sound/data/pcm/c21/h/01.unity3d,h_hh_21_01_091
47,21,32,えへへ、またキミの飲んじゃった。胸のあたりがあったかいよ…,sound/data/pcm/c21/h/01.unity3d,h_hh_21_01_092
48,21,32,はぁ、はぁ…苦いけど、なんだか不思議…それだけじゃないの,sound/data/pcm/c21/h/01.unity3d,h_hh_21_01_093
49,21,32,この前よりいっぱい出てるかな…すごく濃いね、プリプリしてる,sound/data/pcm/c21/h/01.unity3d,h_hh_21_01_095
50,21,32,なんだか、私の唾液と混ざって、すごくエッチだね…,sound/data/pcm/c21/h/01.unity3d,h_hh_21_01_096
