管理番号,大きい項目,中間項目,表示名,バンドルパス,ファイル名
0,21,54,ねぇ、もう我慢できないよぉ……はやくオチンポちょうだぁい……♡,sound/data/pcm/c21/h/01.unity3d,h_so_21_03_000
1,21,54,見てぇ……キミの勃起したオチンチンが欲しすぎて、オマンコのヨダレが大変なことになってるよぉ♡,sound/data/pcm/c21/h/01.unity3d,h_so_21_03_001
2,21,54,キミが私をチンポ狂いにしたんだよ？　だから今日もいっぱいハメハメしてね♡,sound/data/pcm/c21/h/01.unity3d,h_so_21_03_002
3,21,54,うん、来て。今日は朝からキミとエッチすることばっかり考えてたんだよ,sound/data/pcm/c21/h/01.unity3d,h_so_21_03_003
4,21,54,もう、焦らすの禁止ぃ♡　ジュクジュクになったオマンコ穴に入れてほしいよぉ♡,sound/data/pcm/c21/h/01.unity3d,h_so_21_03_004
5,21,54,えへへ、私のエッチな格好を見て勃起したオチンポ入れちゃうんだね。し・あ・わ・せ♡,sound/data/pcm/c21/h/01.unity3d,h_so_21_03_005
6,21,54,あ、ゴムなしはだーめ♡　その代わり、箱で持ってきてるから、何回出してもいいから、ね？,sound/data/pcm/c21/h/01.unity3d,h_so_21_03_006
7,21,54,生でしたいの？　OKしたいけど、今日はダメ♡　ほらほら、私がお口でつけてあげるから拗ねないで♡,sound/data/pcm/c21/h/01.unity3d,h_so_21_03_007
8,21,54,よ～く考えてみて。妊娠したら、しばらく私とエッチできなくなっちゃうんだよ？,sound/data/pcm/c21/h/01.unity3d,h_so_21_03_008
9,21,54,ふぅん。危険日の私に思いきり中だしして孕ませたいんだ～。そういうのは、一通り変態エッチをしてから♪,sound/data/pcm/c21/h/01.unity3d,h_so_21_03_009
10,21,54,えへへ、私たちってやっぱり気が合うね。私もアナルに入れてほしかったんだ,sound/data/pcm/c21/h/01.unity3d,h_so_21_03_010
11,21,54,キミ専用のケツマンコ使っちゃう？　うふふ、さっきちゃんと洗っておいたから、オチンポの根本まで入れても大丈夫だよ♡,sound/data/pcm/c21/h/01.unity3d,h_so_21_03_011
12,21,54,お尻？　今日はダーメ。したくないとかじゃなくて、この前キミにほじられすぎて、ちょっぴりヒリヒリしてるの♡,sound/data/pcm/c21/h/01.unity3d,h_so_21_03_012
13,21,54,ごめんね！　お尻も好きだけど……本当にごめんね、オマンコうずうずしてもうおかしくなりそうなのぉ,sound/data/pcm/c21/h/01.unity3d,h_so_21_03_013
14,21,54,んあぁっん♪　相性ピッタリのデカチンポいいぃ,sound/data/pcm/c21/h/01.unity3d,h_so_21_03_014
15,21,54,あぁぁんっ♪　いきなり入れられても感じちゃうよぉ,sound/data/pcm/c21/h/01.unity3d,h_so_21_03_015
16,21,54,あ～～ぁ、お尻の穴が勝手に吸い付いちゃううぅ♪,sound/data/pcm/c21/h/01.unity3d,h_so_21_03_016
17,21,54,はぁ、はぁ……いきなりアナルに入れられちゃうのって興奮しちゃう。次からも言わなくていいからね,sound/data/pcm/c21/h/01.unity3d,h_so_21_03_017
18,21,54,オマンコに入れただけなのに、キミのオチンポがもう一回り大きくなったよぉ♡,sound/data/pcm/c21/h/01.unity3d,h_so_21_03_018
19,21,54,んん？　今日は調子よさそうだね♡　オチンポの大きさでキミの体調がわかるようになっちゃった♪,sound/data/pcm/c21/h/01.unity3d,h_so_21_03_019
20,21,54,どうしよ、オチンポが奥までグッポリ入ってるだけで、イッちゃいそう♡,sound/data/pcm/c21/h/01.unity3d,h_so_21_03_020
21,21,54,あぁん♡　無理やりごっこ？　んふふ、キミとならそういうのも興奮しちゃいそう♡,sound/data/pcm/c21/h/01.unity3d,h_so_21_03_021
22,21,54,んふふ、待ちきれなかった？　実はね、私もだよ♡,sound/data/pcm/c21/h/01.unity3d,h_so_21_03_022
23,21,54,キミの反りっ反りの極太オチンポも余裕で飲み込めるようになっちゃった♡,sound/data/pcm/c21/h/01.unity3d,h_so_21_03_023
24,21,54,あぁん、キミのフル勃起おちんちん気持ちよすぎて、おマンコに入ってるのかアナルに入ってるのかわからないよぉ♡,sound/data/pcm/c21/h/01.unity3d,h_so_21_03_024
25,21,54,うふふ、好きな子にはイタズラしちゃうってやつかな？　す・け・べ♪,sound/data/pcm/c21/h/01.unity3d,h_so_21_03_025
26,21,54,くすっ、仲の良い女の子の使い込んだアナルの感触はどう？,sound/data/pcm/c21/h/01.unity3d,h_so_21_03_026
27,21,54,私のどんなエッチな姿を想像してる？　キミになら実現しちゃってもいいよ,sound/data/pcm/c21/h/01.unity3d,h_so_21_03_027
28,21,54,今日もぎっこんばったん…激しくしちゃっていいからね♡,sound/data/pcm/c21/h/01.unity3d,h_so_21_03_028
29,21,54,コイカツ部の他の子にはできないスケベすぎることもしていいんだよ♡,sound/data/pcm/c21/h/01.unity3d,h_so_21_03_029
30,21,54,ねえ、早く突いてぇ……キミが私をお尻好きの変態に育ててくれたんだよぉ？,sound/data/pcm/c21/h/01.unity3d,h_so_21_03_030
31,21,54,お尻の中でオチンポがミチミチって音たてて…はぁん♡　いま、血管がプリンッて動いたぁ♡,sound/data/pcm/c21/h/01.unity3d,h_so_21_03_031
32,21,54,早く早くぅ♡　あ、お尻をフリフリして、誘惑したらアナルほじほじしてくれる？,sound/data/pcm/c21/h/01.unity3d,h_so_21_03_032
33,21,54,あんっ、もうっ焦らしプレイなんてイジワルしないでぇ。キミの固いオチンポが欲しいのぉ,sound/data/pcm/c21/h/01.unity3d,h_so_21_03_033
34,21,54,んあぁん♡　おまんこ肉がカリ首に引っかかれて、イっちゃいそうだったよぉ♡,sound/data/pcm/c21/h/01.unity3d,h_so_21_03_034
35,21,54,うああっ！？　ま、待ってぇ♡　い、イッちゃったぁ♡,sound/data/pcm/c21/h/01.unity3d,h_so_21_03_035
36,21,54,あぁあ……抜いたらダメぇ。すごく太いうんちしちゃった時と同じでゾクッとしちゃうからぁ,sound/data/pcm/c21/h/01.unity3d,h_so_21_03_036
37,21,54,チンポが抜ける瞬間、キツキツの入口が亀頭でモコォッて拡がるの好きぃ♡　もう一回やってぇ♡,sound/data/pcm/c21/h/01.unity3d,h_so_21_03_037
38,21,54,あひぃっ♡　ち、ちんぽ抜かれただけで小さなビクビクきちゃったぁ♡,sound/data/pcm/c21/h/01.unity3d,h_so_21_03_038
39,21,54,キミのゆっくりオチンポごりごり好きだよぉ,sound/data/pcm/c21/h/01.unity3d,h_so_21_03_039
40,21,54,自然と身体が反っちゃうの、はぁんっ,sound/data/pcm/c21/h/01.unity3d,h_so_21_03_040
41,21,54,気持ちいいところに当たってるぅ♡　もうおまんこ全部が気持ちいいところだけど♡,sound/data/pcm/c21/h/01.unity3d,h_so_21_03_041
42,21,54,あっあっあぁんっ♪　もっと速くピストンしてぇ、あぁんっ、これ好きぃ,sound/data/pcm/c21/h/01.unity3d,h_so_21_03_042
43,21,54,あぁん♡　激しくされると自然と猫なで声がでちゃうのぉっ♡,sound/data/pcm/c21/h/01.unity3d,h_so_21_03_043
44,21,54,私の甘えん坊おまんこがちんちんに引っ付いて、ゴリゴリ擦れてりゅぅう♡,sound/data/pcm/c21/h/01.unity3d,h_so_21_03_044
45,21,54,んっ、はあぁんっ、お尻、イイぃんっ♪　むっちりしたチンポでなでなでしてぇっ,sound/data/pcm/c21/h/01.unity3d,h_so_21_03_045
46,21,54,ああんっ、そこ、おマンコの裏側に擦れて、じゅるるっ、よだれ出ちゃう♡,sound/data/pcm/c21/h/01.unity3d,h_so_21_03_046
47,21,54,これ、強くしたらやばそう♡　激しくしたら絶対アナルびくびくするから、しないでね♡,sound/data/pcm/c21/h/01.unity3d,h_so_21_03_047
48,21,54,あっおっおぉぉおおっ♪　アナルずぽハメ好っきぃっ、オマンコよりイイよぉっ♡,sound/data/pcm/c21/h/01.unity3d,h_so_21_03_048
49,21,54,激しくされるとすぐイッちゃうからぁ♡　お尻きゅんきゅん喜んじゃうからぁ♡,sound/data/pcm/c21/h/01.unity3d,h_so_21_03_049
50,21,54,ごつごつオチンポで腸壁突きほぐしてぇ♡　キミのチンポサイズのうんちで排泄オナニーしたいぃ♡,sound/data/pcm/c21/h/01.unity3d,h_so_21_03_050
51,21,54,んっはあぁ、あんっ、うふふ、オチンポおっきくなったぁ♡　もっと触ってぇっ,sound/data/pcm/c21/h/01.unity3d,h_so_21_03_051
52,21,54,キミとはいっぱいエッチしたから、気持ちいい所知り尽くされちゃってるね♡　オチンポずぼずぼしながらもっと手のひらで転がしてぇ♡,sound/data/pcm/c21/h/01.unity3d,h_so_21_03_052
53,21,54,はぁんっ、弱いところ知り尽くされてるのって幸せぇっ、お願い、もっと弄ってぇ♪,sound/data/pcm/c21/h/01.unity3d,h_so_21_03_053
54,21,54,だめぇっ、そこ触られながらパンパンされると、すぐにアクメスイッチ入っちゃうのぉ♡,sound/data/pcm/c21/h/01.unity3d,h_so_21_03_054
55,21,54,んもう、そこは嫌だって言ってるのに……でも、そんなイジワルなキミもちょっぴり好き♪,sound/data/pcm/c21/h/01.unity3d,h_so_21_03_055
56,21,54,イヤなところなのに、チンポ突きでごまかされちゃってるぅ♡,sound/data/pcm/c21/h/01.unity3d,h_so_21_03_056
57,21,54,そこ触るならもっと激しくオチンポ動かしてぇ♡,sound/data/pcm/c21/h/01.unity3d,h_so_21_03_057
58,21,54,あくぅん♡　オチンチンに好きな所こすられながらなら、嫌なところ触られても気持ちよくなっちゃうぅ♡,sound/data/pcm/c21/h/01.unity3d,h_so_21_03_058
59,21,54,ひっ、おおぉっ♪　ガツンてされるとクラクラしちゃうぅうんっ♪,sound/data/pcm/c21/h/01.unity3d,h_so_21_03_059
60,21,54,コレコレぇっ♡　キミの本気チンポ好きぃっ♡　もうチンポ以外何も考えられなくなるのぉ♡,sound/data/pcm/c21/h/01.unity3d,h_so_21_03_060
61,21,54,友達もママも知らない私を引きずり出してぇ♡　チンポ一本で本当はスケベな子だって証明してぇ♡,sound/data/pcm/c21/h/01.unity3d,h_so_21_03_061
62,21,54,んあぁああっ♪　これを待ってたのぉおっ♪　デカチンポでごりゅごりゅしてええっ,sound/data/pcm/c21/h/01.unity3d,h_so_21_03_062
63,21,54,ちんぽぉ♡　私だけのちんぽこもっとズッポンコしてぇ♡　　,sound/data/pcm/c21/h/01.unity3d,h_so_21_03_063
64,21,54,好きぃっ♡　フル勃起したゴツゴツ血管ちんぽこ好き好き大好きぃん♡,sound/data/pcm/c21/h/01.unity3d,h_so_21_03_064
65,21,54,あぁんんっ、私に気を遣わなくていいよぉっ、もっとガツガツちょうだぁい♡,sound/data/pcm/c21/h/01.unity3d,h_so_21_03_065
66,21,54,ママぁ♡　私、大好きな人のデカチンポを丸呑みできるぐらい成長したよぉ♡,sound/data/pcm/c21/h/01.unity3d,h_so_21_03_066
67,21,54,開発済みのアナルでゆっくりオチンポコキされちゃうの好っきぃ♡　友達にはナイショだよぉ♡,sound/data/pcm/c21/h/01.unity3d,h_so_21_03_067
68,21,54,んおぉおおっ♪　アナル好き、好きぃいっ♪　キミの極太うんこみたいなチンポで掻き回してぇ♪,sound/data/pcm/c21/h/01.unity3d,h_so_21_03_068
69,21,54,アナル滅茶苦茶にしてぇっ♡　壊してもいいから、ベロがぴょーんって伸びちゃうぐらいガチイキさせてぇ♡,sound/data/pcm/c21/h/01.unity3d,h_so_21_03_069
70,21,54,キミに開発されたお尻をほじられると下品になっちゃうのぉ♡　アナルファック専用のケツ穴ハメハメもっとぉ♡,sound/data/pcm/c21/h/01.unity3d,h_so_21_03_070
71,21,54,あぁんっ、触り方すごくエッチで好きぃっ♪　オチンポもして、して、あぁんっ♪,sound/data/pcm/c21/h/01.unity3d,h_so_21_03_071
72,21,54,キミのスケベ菌を私にベタベタ移してぇ♡　もっとオチンポで感じられるようにぃ♡,sound/data/pcm/c21/h/01.unity3d,h_so_21_03_072
73,21,54,んあぁあっそれ、キミの虜になっちゃうやつぅっ、もうダメ、ああんっ♪,sound/data/pcm/c21/h/01.unity3d,h_so_21_03_073
74,21,54,キミのおさわりでもイッちゃいそう♡　オチンポと一緒にダブルアクメさせてぇっ♡,sound/data/pcm/c21/h/01.unity3d,h_so_21_03_074
75,21,54,あぁっあ、あ、オチンポ気持ちよすぎて、そこ触られるのいやだってこと忘れちゃいそぉだよぉ♡,sound/data/pcm/c21/h/01.unity3d,h_so_21_03_075
76,21,54,そこ触るのヤダって言いたいのに、身体はビクビク感じちゃってるぅっ♡,sound/data/pcm/c21/h/01.unity3d,h_so_21_03_076
77,21,54,そこだめだって、あぁあんっ♪　やっぱり気持ち、いい、かも、はぁんっ、オチンポと一緒いぃい～,sound/data/pcm/c21/h/01.unity3d,h_so_21_03_077
78,21,54,オチンポはめはめ中なら、嫌なところ触られても平気だよぉ♡　嫌いなピーマンも食べられるかもぉ♡,sound/data/pcm/c21/h/01.unity3d,h_so_21_03_078
79,21,54,あっあ、あ、はい、あぁんして♪　んりゅれるっ、んちゅっぐっちゅ、ぢゅ、んんぅうっ♪,sound/data/pcm/c21/h/01.unity3d,h_so_21_03_079
80,21,54,キスハメ好きぃっ♪　チュッチュしながらちんちんズボハメしてぇ♡,sound/data/pcm/c21/h/01.unity3d,h_so_21_03_080
81,21,54,んんっんっんっ、んりゅっ、ぢゅるるっ、キミの唾液おいしぃっ♪　次は精液、ね？　れるっ、りゅっぢゅぷ、んにゅるっ,sound/data/pcm/c21/h/01.unity3d,h_so_21_03_081
82,21,54,下のお口も上のお口も仲良しだね♡,sound/data/pcm/c21/h/01.unity3d,h_so_21_03_082
83,21,54,んりゅれぷっ、んんっ♪　れりゅっぷ、ンッ♪　んあぁあん♪　チュッチュピストン好き、好きぃ♪,sound/data/pcm/c21/h/01.unity3d,h_so_21_03_083
84,21,54,ただでさえチンポハメで頭が飛んじゃってるのに、好きな人とベロチューして、もう何が何だかぁ♡,sound/data/pcm/c21/h/01.unity3d,h_so_21_03_084
85,21,54,んじゅるっ、ンゥッ♪　ンッ、んちゅぅうっっ♪　下のお口も上のお口もキスまみれにしてぇっ,sound/data/pcm/c21/h/01.unity3d,h_so_21_03_085
86,21,54,私がキス魔でチンポ痴女になっちゃってるの、みんなには絶対にナイショだよぉっ♡,sound/data/pcm/c21/h/01.unity3d,h_so_21_03_086
87,21,54,なんか今日、はぁんっ、私の方が先にイッちゃいそ♪　一緒にイキたいから私も動いちゃうね♪,sound/data/pcm/c21/h/01.unity3d,h_so_21_03_087
88,21,54,らめぇっ、頭がチンポ畑になるぅっ♡　チンポ脳になっちゃうぅっ♡,sound/data/pcm/c21/h/01.unity3d,h_so_21_03_088
89,21,54,ああぁんっすけべスイッチ入っちゃうぅっ、私を知り尽くされてる感じ気持ちよすぎるよぉっ♡,sound/data/pcm/c21/h/01.unity3d,h_so_21_03_089
90,21,54,おっ、おおおぉおぉっ♡　わらひのオマンコ馬鹿になるぅっ♡　ちんぽこ狂いのズボハメ馬鹿になるぅっ♡,sound/data/pcm/c21/h/01.unity3d,h_so_21_03_090
91,21,54,はぁあんっ、あ、あ、あ、そろそろイキそうなの？　いいよっ来てぇ、オチンポ汁ぜんぶちょうだぁい♪,sound/data/pcm/c21/h/01.unity3d,h_so_21_03_091
92,21,54,もう射精するよね♡　さっきから我慢汁が漏れてるよぉ♡　今までで一番スケベな射精見せつけてぇ♡,sound/data/pcm/c21/h/01.unity3d,h_so_21_03_092
93,21,54,あっあっあっあっあっあっそのまま突いて、私にキミの熱い気持ち全部かけて、本当に大好きなのぉっ♡,sound/data/pcm/c21/h/01.unity3d,h_so_21_03_093
94,21,54,チンポで愛情示してぇっ♡　精液の濃さと臭さで私の身体の抱き心地のよさを教えてぇっ♡,sound/data/pcm/c21/h/01.unity3d,h_so_21_03_094
95,21,54,そ、それ弱いのぉっ、ゴリゴリのデカペニスでゆっくりアナルいいぃっ、あ、もう、ひぃいんっ,sound/data/pcm/c21/h/01.unity3d,h_so_21_03_095
96,21,54,激しくされてないのに、揺さぶられるだけでアナルアクメきちゃうぅっ♡,sound/data/pcm/c21/h/01.unity3d,h_so_21_03_096
97,21,54,ああぁっらめ、らめええっ♪　おならでちゃうぐらいおっきいアナルビクビクきちゃうううう♪,sound/data/pcm/c21/h/01.unity3d,h_so_21_03_097
98,21,54,過去に戻って、アナルファックするのを嫌がってた私に、ケツ穴最高に気持ちいいんだよぉって実演してあげたいぃっ♡,sound/data/pcm/c21/h/01.unity3d,h_so_21_03_098
99,21,54,あぁあんっ！　チンポが膨らんでアナル拡張されちゃってるぅっ、いっぱい突いていいからね、んんぅっ,sound/data/pcm/c21/h/01.unity3d,h_so_21_03_099
100,21,54,待ってぇっ♡　私も一緒にイキたいぃっ♡　あっダメ♡　もうちょっとなのに、いじわるぅ♡,sound/data/pcm/c21/h/01.unity3d,h_so_21_03_100
101,21,54,んあぁああんっ♪　あ、あ、あ、あ、先走りのぬるぬるチンポ汁漏れてきてるぅっ、そのままがつがつアナルほじってぇっ,sound/data/pcm/c21/h/01.unity3d,h_so_21_03_101
102,21,54,キツキツのアナルでイキそうなんだね♡　いいよぉ、キミの精液うんちブリブリひり出してぇっ♪,sound/data/pcm/c21/h/01.unity3d,h_so_21_03_102
103,21,54,あぁん、イッちゃうぅ♡　SNSのプロフィールに、私の弱点はキミのオチンポです♡　って書きたいぐらい気持ちよすぎるのぉ♡,sound/data/pcm/c21/h/01.unity3d,h_so_21_03_103
104,21,54,あぁんっイック、イッちゃうぅ、ねえ私もうだめ、あイク♡　イクイクイク、イクとこ見ててぇ♡,sound/data/pcm/c21/h/01.unity3d,h_so_21_03_104
105,21,54,はあっはあ、ああんっ♪　二人でイこっ、オチンポとオマンコで仲良ししながらビクビクしよっ、あんっ、あ、はぁんっ,sound/data/pcm/c21/h/01.unity3d,h_so_21_03_105
106,21,54,あぁん、キミのラブリーチンポでイッちゃうよぉっ♡　チンポによがり狂ってイキまくる所見てぇ♪,sound/data/pcm/c21/h/01.unity3d,h_so_21_03_106
107,21,54,キミ専用のオマンコに全部出してぇっ、特濃オチンポザーメンあーんして待ってるからぁっ、あ、あ、ひぁああんっ,sound/data/pcm/c21/h/01.unity3d,h_so_21_03_107
108,21,54,いいよぉタマタマが空っぽになるまでピュッピュしてぇ♡　がんばれチンポ♡　がんばれチンポぉ♡,sound/data/pcm/c21/h/01.unity3d,h_so_21_03_108
109,21,54,はぁんっ、あっ、うんっ♪　抜く時、カリでオマンコいっぱい擦ってね、はぁっ、ああんっ,sound/data/pcm/c21/h/01.unity3d,h_so_21_03_109
110,21,54,あっんあっ、はあっんっ、うふふ、好きな方に、あんっ、タップリ出してね♪　んっ、あんっあんっ,sound/data/pcm/c21/h/01.unity3d,h_so_21_03_111
111,21,54,あぁん、いいよ♡　どこに出すとか言わなくていいから、精液がパンパンに詰まったオチンポを爆発させることだけ考えてぇっ♡,sound/data/pcm/c21/h/01.unity3d,h_so_21_03_112
112,21,54,ゴムしてるから、あんっ、将来赤ちゃんを作るときの練習しちゃお？　思いきり奥でドピュドピュしてぇっ♪,sound/data/pcm/c21/h/01.unity3d,h_so_21_03_113
113,21,54,コンドームつけてるから、思い切り中だししてぇっ♡　今日はゴムの子宮をいっぱい孕ましてあげてぇっ♡,sound/data/pcm/c21/h/01.unity3d,h_so_21_03_114
114,21,54,あ、あ、あ、あ、１回イカせて、お尻来ちゃいそう、あんっ、お尻イク、お尻イク、お尻イクぅうっ♪,sound/data/pcm/c21/h/01.unity3d,h_so_21_03_115
115,21,54,パパぁっ♡　大好きな人に肛門えぐられてアへる娘でごめんなさいぃっ♡　私、ケツハメ大好きっ子なのぉっ♡,sound/data/pcm/c21/h/01.unity3d,h_so_21_03_116
116,21,54,お尻の穴キュッて締めて、キミのイカ臭ザーメン絞り取っちゃう、んっ♡　んんぅっ♡,sound/data/pcm/c21/h/01.unity3d,h_so_21_03_117
117,21,54,アナル好きのチンポとチンポ好きのアナルでダブルアクメしよぉ♡　ラストスパート、いくよぉ♡,sound/data/pcm/c21/h/01.unity3d,h_so_21_03_118
118,21,54,じゃあ、ガチガチに締め付けちゃう♡　んああっ、あっあ、お尻叩いてもいいよぉっ、あんっ、はああんっ♪,sound/data/pcm/c21/h/01.unity3d,h_so_21_03_119
119,21,54,うん♡　使い込んだラブアナルにドロドロヌッチョヌチョの精液を注ぎ込んでぇっ♡,sound/data/pcm/c21/h/01.unity3d,h_so_21_03_120
120,21,54,はぁっあぁあん♪　やっぱり生で出されちゃうのが一番好きぃ♪　キミに孕まされてるって思うと、ゾクゾクするの,sound/data/pcm/c21/h/01.unity3d,h_so_21_03_121
121,21,54,キミの子種汁が子宮を満タンにしてるぅ♡,sound/data/pcm/c21/h/01.unity3d,h_so_21_03_122
122,21,54,あぁあんっ、私の子宮に、はぁ、いっぱい出す練習してるよぉ♡,sound/data/pcm/c21/h/01.unity3d,h_so_21_03_123
123,21,54,はぁんっ、子宮と亀頭の間で世界一エッチな風船がどんどん膨らんでるぅ♡,sound/data/pcm/c21/h/01.unity3d,h_so_21_03_124
124,21,54,んくぅうんんっ♪　はあっ、あっ、出る量増えてるよぉ？　完全にアナルファックの味を占めちゃったね,sound/data/pcm/c21/h/01.unity3d,h_so_21_03_125
125,21,54,出てるっ、キミの精液うんちがブリブリって、ああぁん、私の腸の中、身体の中逆流してるぅ♡,sound/data/pcm/c21/h/01.unity3d,h_so_21_03_126
126,21,54,んイグぅうううううっっっ♪,sound/data/pcm/c21/h/01.unity3d,h_so_21_03_127
127,21,54,大好きな人のデカペニスでガチイキしゅるぅううっ♡,sound/data/pcm/c21/h/01.unity3d,h_so_21_03_128
128,21,54,あイクッイッちゃ、イっくうぅぅううううっっっっ♪,sound/data/pcm/c21/h/01.unity3d,h_so_21_03_129
129,21,54,キミとオチンポがあれば、もう何もいらないぃぃぃいいん♡,sound/data/pcm/c21/h/01.unity3d,h_so_21_03_130
130,21,54,やっぱり二人でイくと、しあわせ～って、ハートマークが出ちゃうよね。でも、次はゴムなしでしようね？,sound/data/pcm/c21/h/01.unity3d,h_so_21_03_131
131,21,54,ゴムってずぅっと邪魔だなーって思ってたけど、テラテラした肌触りがクセになってきちゃった♡,sound/data/pcm/c21/h/01.unity3d,h_so_21_03_132
132,21,54,んはぁ……あぁ……まだビクビクが残ってる……って、キミも？　うふふ、二人でしばらくビクビクしてよっか♪,sound/data/pcm/c21/h/01.unity3d,h_so_21_03_133
133,21,54,えと…はしたないことばっかり言ってごめんね。キミとエッチすると、ワケがわからなくなっちゃうんだぁ,sound/data/pcm/c21/h/01.unity3d,h_so_21_03_134
134,21,54,えへへ、これって、捉えようによってはプロポーズだよね～？　期待しちゃっていいのかなん？,sound/data/pcm/c21/h/01.unity3d,h_so_21_03_135
135,21,54,赤ちゃんができても、出来るだけエッチしようね♡,sound/data/pcm/c21/h/01.unity3d,h_so_21_03_136
136,21,54,私が１人でイカされちゃなんて……ちょっと屈辱かも。次はいっぱい絞り取っちゃうんだから,sound/data/pcm/c21/h/01.unity3d,h_so_21_03_137
137,21,54,完全にキミに主導権を握られちゃったね♡　性奴隷とか、興味ある？,sound/data/pcm/c21/h/01.unity3d,h_so_21_03_138
138,21,54,お尻って、エッチするための場所じゃないのに、どうしてこんなに気持ちいいのかな……不思議だけど、しあわせなことだよね♪,sound/data/pcm/c21/h/01.unity3d,h_so_21_03_139
139,21,54,最初は嫌だったお尻も、もうキミとイケただけで幸せになっちゃうほど好き♡　キミにアナルほじってもらえるなら、私もう変態でいいや♡,sound/data/pcm/c21/h/01.unity3d,h_so_21_03_140
140,21,54,最近、本当にお尻が弱くなっちゃった……キミが丁寧に開発しちゃったからだよ♪,sound/data/pcm/c21/h/01.unity3d,h_so_21_03_141
141,21,54,もうキミにお尻向けたら、いつの間にかイクようになっちゃったよぉ♡,sound/data/pcm/c21/h/01.unity3d,h_so_21_03_142
142,21,54,ゴムで安心なセックスも好きだけど、たまにはキケンなエッチもしていいからね？,sound/data/pcm/c21/h/01.unity3d,h_so_21_03_143
143,21,54,ねえ……次はゴムなしで、もう一回しちゃう？,sound/data/pcm/c21/h/01.unity3d,h_so_21_03_144
144,21,54,いっぱい動いていっぱい出たね……ンッ……今日はこのまま、中にキミの精液を入れたまま帰っちゃおうかなぁ,sound/data/pcm/c21/h/01.unity3d,h_so_21_03_145
145,21,54,今ね、おまんこがキミの精液を味わってるよ……ヒダとヒダがざわざわして、精液があっちいったりこっちいったりしてる……,sound/data/pcm/c21/h/01.unity3d,h_so_21_03_146
146,21,54,今日危険日だから、子宮の中に精液が入ってきたのわかったよ……すごく、ゾクゾクってきた,sound/data/pcm/c21/h/01.unity3d,h_so_21_03_147
