管理番号,大きい項目,中間項目,表示名,バンドルパス,ファイル名
177,43,44,あー、あったかい……このトロトロが気持ちええわぁ,sound/data/pcm/c43/h/71.unity3d,h_so_43_02_179
178,43,44,穴の奥から、どんどん出てくる……どんだけ出したん？,sound/data/pcm/c43/h/71.unity3d,h_so_43_02_180
179,43,44,……さーて、これからどないしよっかなぁ,sound/data/pcm/c43/h/71.unity3d,h_so_43_02_181
180,43,44,まだまだヤル気はあるんやろ？　ほな、楽しもか,sound/data/pcm/c43/h/71.unity3d,h_so_43_02_182
181,43,44,はぁ、楽しみや……知ってると思うけど、グッチャグチャに濡れてんねん,sound/data/pcm/c43/h/71.unity3d,h_so_43_02_183
182,43,44,よっしゃ、どっちかの体力が尽きるまでしよか,sound/data/pcm/c43/h/71.unity3d,h_so_43_02_184
183,43,44,うわっ、なんで生でしようとしてんの？　アカンに決まってるやんか,sound/data/pcm/c43/h/71.unity3d,h_so_43_02_185
184,43,44,ちょ、こういう関係になったから言うて、なあなあなんはイカン。ゴムつけて,sound/data/pcm/c43/h/71.unity3d,h_so_43_02_186
185,43,44,……あのな？　ウチ、危険日やねん。エライことなるで？　せやからゴムしぃ,sound/data/pcm/c43/h/71.unity3d,h_so_43_02_187
186,43,44,ノーゴム、ノーセックス！　ウチのオトンの遺言や。まあ、オトンまだ全然元気やねんけどな,sound/data/pcm/c43/h/71.unity3d,h_so_43_02_188
187,43,44,ええ～お尻ぃ～～？　って、いや、ウソ。全然ええで。むしろ欲しい,sound/data/pcm/c43/h/71.unity3d,h_so_43_02_189
188,43,44,ええでええで。好きなだけお尻で感じだって,sound/data/pcm/c43/h/71.unity3d,h_so_43_02_190
189,43,44,お尻ぃ？　う～～ん……今、ちょっとなぁ……他のとこにせーへん？,sound/data/pcm/c43/h/71.unity3d,h_so_43_02_191
190,43,44,あー、あのさ、お尻はまた今度がええなぁ？　なんか、そんな気ぃになれへんねん,sound/data/pcm/c43/h/71.unity3d,h_so_43_02_192
191,43,44,はぁ……ちんちんの形、はっきりわかる……敏感になっとるみたいや,sound/data/pcm/c43/h/71.unity3d,h_so_43_02_202
192,43,44,繋がってるだけで、身体があつぅなってくるわ,sound/data/pcm/c43/h/71.unity3d,h_so_43_02_203
193,43,44,穴にハマってるだけで、変な声出てしまいそ……,sound/data/pcm/c43/h/71.unity3d,h_so_43_02_204
194,43,44,お尻の穴に、すっかり馴染んでしもうとるなぁ……,sound/data/pcm/c43/h/71.unity3d,h_so_43_02_205
195,43,44,チンチンでイキたかったのにダメなん？,sound/data/pcm/c43/h/71.unity3d,h_so_43_02_206
196,43,44,お？　何が気に入らんかったん？　まさか止めへんやんなぁ？,sound/data/pcm/c43/h/71.unity3d,h_so_43_02_207
197,43,44,どうしたん？　お尻の気分ではなかったとか？,sound/data/pcm/c43/h/71.unity3d,h_so_43_02_208
198,43,44,アソコかお尻か迷ってんの？　ウチやったらどっちでもOKやで,sound/data/pcm/c43/h/71.unity3d,h_so_43_02_209
199,43,44,あー、ゆっくりちんちんもエエわぁ……,sound/data/pcm/c43/h/71.unity3d,h_so_43_02_210
200,43,44,はぁ、このちんちんの硬さ、堪らん……,sound/data/pcm/c43/h/71.unity3d,h_so_43_02_211
201,43,44,やっぱ、こういう感じが一番エエねん……,sound/data/pcm/c43/h/71.unity3d,h_so_43_02_212
202,43,44,めっちゃ濡れて、クチュクチュ音が鳴ってる……あはぁ、ヤバいぃ……,sound/data/pcm/c43/h/71.unity3d,h_so_43_02_213
203,43,44,ええ具合過ぎて、下品な声が漏れてしまいそうやわ……,sound/data/pcm/c43/h/71.unity3d,h_so_43_02_214
204,43,44,もう、ウチのお尻とセット販売してええぐらい、相性バッチリやな……自分のちんちん,sound/data/pcm/c43/h/71.unity3d,h_so_43_02_215
205,43,44,自分のお尻も、ウチのお尻と同じくらいきもちよーなれんのかね？,sound/data/pcm/c43/h/71.unity3d,h_so_43_02_216
206,43,44,穴が伸び切っとる、これ以上もう伸びひんギリギリを攻められとる……,sound/data/pcm/c43/h/71.unity3d,h_so_43_02_217
207,43,44,あぁっ、エッチの基本みたいな、気持ちよさやね,sound/data/pcm/c43/h/71.unity3d,h_so_43_02_218
208,43,44,もうチンチン最高すぎるわ,sound/data/pcm/c43/h/71.unity3d,h_so_43_02_219
209,43,44,奥に、グングンぶつかってくる……これ、一番子宮が欲しがっとるヤツぅ……,sound/data/pcm/c43/h/71.unity3d,h_so_43_02_220
210,43,44,アカァン……こんなん、気持ちええに決まっとるやんっ,sound/data/pcm/c43/h/71.unity3d,h_so_43_02_221
211,43,44,あぁ、チンチンの形が、硬さが、ハッキリわかる……めっちゃ敏感になっとるわ,sound/data/pcm/c43/h/71.unity3d,h_so_43_02_222
212,43,44,お尻の穴が、ちんちん憶えてもうたんかな……太さ、形がピッタリやん,sound/data/pcm/c43/h/71.unity3d,h_so_43_02_223
213,43,44,お尻がこんな気持ちエエこと知ったらウチっ、戻れなくなってまうっ……,sound/data/pcm/c43/h/71.unity3d,h_so_43_02_224
214,43,44,こんなに激しぃして大丈夫なん？　根本でボキッていかへん？,sound/data/pcm/c43/h/71.unity3d,h_so_43_02_225
215,43,44,あ、あかん……めっちゃエエ……良すぎて、こんなん持たへんわ……,sound/data/pcm/c43/h/71.unity3d,h_so_43_02_226
216,43,44,あぁ、ゆっくりな分、気持ちええんが染み込んでくる……,sound/data/pcm/c43/h/71.unity3d,h_so_43_02_227
217,43,44,いやらしいヨダレで、ビッチャビチャやん……たまらんわぁ,sound/data/pcm/c43/h/71.unity3d,h_so_43_02_228
218,43,44,もっと気持ちエエの欲しい……快感は、なんぼあってもエエからね……,sound/data/pcm/c43/h/71.unity3d,h_so_43_02_229
219,43,44,お？　その喘ぎ声……そろそろイキそうになっとんちゃう？,sound/data/pcm/c43/h/71.unity3d,h_so_43_02_230
220,43,44,中で震えとる……ちんちん、爆発しそうになっとるやん,sound/data/pcm/c43/h/71.unity3d,h_so_43_02_231
221,43,44,このペースやと持たへんのちゃうかなぁって思ってたら……案の定やな,sound/data/pcm/c43/h/71.unity3d,h_so_43_02_232
222,43,44,ウチはごまかせへんで……もうイキそうになっとるやろ？,sound/data/pcm/c43/h/71.unity3d,h_so_43_02_233
223,43,44,あぁぁ、お尻の穴が、ちんちんにくっついて動いていく……気持ちよすぎて、ヤバい……,sound/data/pcm/c43/h/71.unity3d,h_so_43_02_234
224,43,44,気持ちええのがゆっくりお尻から入ってくる……もうイキ、そう……,sound/data/pcm/c43/h/71.unity3d,h_so_43_02_235
225,43,44,ちんちんが、スルスル出入りしてる……ああ、お尻が感激しとる……,sound/data/pcm/c43/h/71.unity3d,h_so_43_02_236
226,43,44,すっかりお尻が弱くなってる、こんなん自分の所為やでっ……,sound/data/pcm/c43/h/71.unity3d,h_so_43_02_237
227,43,44,ウチのお尻、魔性やろ？　こないにのんびり抽送やのに、自分もうイキそうやん,sound/data/pcm/c43/h/71.unity3d,h_so_43_02_238
228,43,44,次の精液が、集まってきとる……ああ、早よ出したい！　って感じやね……ふふふ,sound/data/pcm/c43/h/71.unity3d,h_so_43_02_239
229,43,44,ええでぇ、このジュボジュボする勢いで、ビュビュビュッて出したってやぁ,sound/data/pcm/c43/h/71.unity3d,h_so_43_02_240
230,43,44,ウチのお尻、最高やろ……？　せやから我慢せんと、最高の射精、味っときぃ,sound/data/pcm/c43/h/71.unity3d,h_so_43_02_241
231,43,44,あ、あ、アカン、もう……ウチぃ……っ,sound/data/pcm/c43/h/71.unity3d,h_so_43_02_242
232,43,44,ヤバいっ……めっちゃ、デッカいの来よる……,sound/data/pcm/c43/h/71.unity3d,h_so_43_02_243
233,43,44,なあ、一緒にイこ？　カップルは一緒にイクのがスタンダードやでぇ……！,sound/data/pcm/c43/h/71.unity3d,h_so_43_02_244
234,43,44,自分もウチも限界みたいやね、ほな一緒に……イコっ……！,sound/data/pcm/c43/h/71.unity3d,h_so_43_02_245
235,43,44,ほな、どーぞー。出せるもん全部出しぃ,sound/data/pcm/c43/h/71.unity3d,h_so_43_02_246
236,43,44,次の射精は、どんな感じかな～？　楽しみにしてるで,sound/data/pcm/c43/h/71.unity3d,h_so_43_02_247
237,43,44,ええで、好きなところ、いっぱい出しぃ……,sound/data/pcm/c43/h/71.unity3d,h_so_43_02_248
238,43,44,ウチに精液の匂い嗅がせたいんやね、ええで,sound/data/pcm/c43/h/71.unity3d,h_so_43_02_249
239,43,44,エエで、ゴムをパンパンに膨らませたってっ,sound/data/pcm/c43/h/71.unity3d,h_so_43_02_252
240,43,44,好きなだけゴムに出しぃ……,sound/data/pcm/c43/h/71.unity3d,h_so_43_02_253
241,43,44,ウチだけお尻でイクけど、堪忍な～……っ！,sound/data/pcm/c43/h/71.unity3d,h_so_43_02_254
242,43,44,これ、めっちゃイクわ……めっちゃイキ倒すわ……！,sound/data/pcm/c43/h/71.unity3d,h_so_43_02_255
243,43,44,一緒に気持ちよぉなろなっ、お尻とちんちんの友情、炸裂やで……！,sound/data/pcm/c43/h/71.unity3d,h_so_43_02_256
244,43,44,お尻フレンドとして、自分と一緒にイクでぇ……っ！,sound/data/pcm/c43/h/71.unity3d,h_so_43_02_257
245,43,44,ウチのお尻、精液で満たしてかまへんで～,sound/data/pcm/c43/h/71.unity3d,h_so_43_02_258
246,43,44,自分の精液全部、ウチがお尻で受け止めたるっ,sound/data/pcm/c43/h/71.unity3d,h_so_43_02_259
247,43,44,あぁ、たまらん……子宮が痙攣しとる,sound/data/pcm/c43/h/71.unity3d,h_so_43_02_260
248,43,44,ビュルビュルって、ちんちんが音立てとろ……,sound/data/pcm/c43/h/71.unity3d,h_so_43_02_261
249,43,44,ゴムの中にどんどんたまって郎わ……,sound/data/pcm/c43/h/71.unity3d,h_so_43_02_262
250,43,44,おお、ゴムがあるのにあっついわぁ……,sound/data/pcm/c43/h/71.unity3d,h_so_43_02_263
251,43,44,うわっ、お尻に熱いの注がれてる……,sound/data/pcm/c43/h/71.unity3d,h_so_43_02_264
252,43,44,お尻の穴ごと、ビクンビクンって震えてる……,sound/data/pcm/c43/h/71.unity3d,h_so_43_02_265
253,43,44,ひやぁぁぁぁぁ！！,sound/data/pcm/c43/h/71.unity3d,h_so_43_02_266
254,43,44,ひぐぅぅぅぅうっ,sound/data/pcm/c43/h/71.unity3d,h_so_43_02_267
255,43,44,ん゛あ゛ぁぁぁぁ！！,sound/data/pcm/c43/h/71.unity3d,h_so_43_02_268
256,43,44,あはぁぁぁぁぁん……,sound/data/pcm/c43/h/71.unity3d,h_so_43_02_269
257,43,44,ゴムあっても一緒にイケるあたり、ウチらの相性はパッチリやね,sound/data/pcm/c43/h/71.unity3d,h_so_43_02_270
258,43,44,はぁ……なんでエッチって気持ちエエんやろ？　自分、なんか知っとる？,sound/data/pcm/c43/h/71.unity3d,h_so_43_02_271
259,43,44,やっぱ一緒はエエなぁ……具体的に言えへんけど違うわ……,sound/data/pcm/c43/h/71.unity3d,h_so_43_02_272
260,43,44,イクのが重なったからかな……自分のこと、めっちゃ愛おしなってもーたわぁ……,sound/data/pcm/c43/h/71.unity3d,h_so_43_02_273
261,43,44,最高のタイミングで一緒にイケたなぁ……多分これ、妊娠したで……知らんけど,sound/data/pcm/c43/h/71.unity3d,h_so_43_02_274
262,43,44,自分の精液がたらふく入って、お腹が大きくなってしまいそうやわ……,sound/data/pcm/c43/h/71.unity3d,h_so_43_02_275
263,43,44,あーもう……ウチ、弱いわ～～……そのちんちん、反則やで,sound/data/pcm/c43/h/71.unity3d,h_so_43_02_276
264,43,44,はぁ、はぁ……常識的に考えて、チンチンに勝てる訳ないやん……,sound/data/pcm/c43/h/71.unity3d,h_so_43_02_277
265,43,44,お尻の穴で一緒にイクと……なんか、もう離れられへん絆を感じてまうねんなぁ,sound/data/pcm/c43/h/71.unity3d,h_so_43_02_278
266,43,44,お尻で繋がるんと、アソコと繋がるんでは、満足度が全然ちゃうな……,sound/data/pcm/c43/h/71.unity3d,h_so_43_02_279
267,43,44,ああ、もう……お尻、弱すぎぃ……ウチ、なんかチョロない……？,sound/data/pcm/c43/h/71.unity3d,h_so_43_02_280
268,43,44,お尻、気持ちよすぎぃ……力が抜けてしまいそ……,sound/data/pcm/c43/h/71.unity3d,h_so_43_02_281
269,43,44,一緒にイケて嬉しかったわぁ……自分もそう思うやろ？,sound/data/pcm/c43/h/71.unity3d,h_so_43_02_282
270,43,44,はぁ～……あと何回自分とイケるんやろ……？,sound/data/pcm/c43/h/71.unity3d,h_so_43_02_283
271,43,44,生やと、なんかちゃうな……こう……言わんとすること、分かるやろ？,sound/data/pcm/c43/h/71.unity3d,h_so_43_02_284
272,43,44,ウチらほど、相性いい男女はおらんのちゃう？　知らんけど,sound/data/pcm/c43/h/71.unity3d,h_so_43_02_285
273,43,44,はぁ、はぁ……してる時、危険日やっちゅうこと、忘れてまいそうやったわ……,sound/data/pcm/c43/h/71.unity3d,h_so_43_02_286
274,43,44,ほんま、めっちゃ出したな……そない赤ちゃん好きなん？,sound/data/pcm/c43/h/71.unity3d,h_so_43_02_287
275,43,44,イキ過ぎて、なんかもう……頭の中が真っ白になったわ……,sound/data/pcm/c43/h/71.unity3d,h_so_43_02_288
276,43,44,はぁ……ウチが弱すぎるんか、自分のチンチンが強すぎるんか……ま、どうでもええか……,sound/data/pcm/c43/h/71.unity3d,h_so_43_02_289
277,43,44,一緒にイったりしたら、なおさらお尻セックスが好きになってまうわ……,sound/data/pcm/c43/h/71.unity3d,h_so_43_02_290
278,43,44,お尻の穴で一緒にイクとか……もう、なんか……最高過ぎて、言葉出てけーへん,sound/data/pcm/c43/h/71.unity3d,h_so_43_02_291
279,43,44,お尻セックスって、なんかヤバいな……中毒性あるわ……,sound/data/pcm/c43/h/71.unity3d,h_so_43_02_292
280,43,44,トイレ行くたびに、自分のこと思い出して、アソコ濡らしてしまいそうや,sound/data/pcm/c43/h/71.unity3d,h_so_43_02_293
281,43,44,またたっぷり出したやん……さっきの超えたんちゃう？,sound/data/pcm/c43/h/71.unity3d,h_so_43_02_294
282,43,44,なんかゴムを突き破りそうな射精っぽかったわ……ゴムへの恨みみたいなん、あるのん？,sound/data/pcm/c43/h/71.unity3d,h_so_43_02_295
283,43,44,やっぱ生で中出しが最高やー！！　ってちんちんが言うてるみたいに震えとったわ,sound/data/pcm/c43/h/71.unity3d,h_so_43_02_296
284,43,44,よーけ出したなぁ……流石に満足してくれたんちゃう？,sound/data/pcm/c43/h/71.unity3d,h_so_43_02_297
285,43,44,絶対ウチを孕ますっていう強い意志を感じたわ,sound/data/pcm/c43/h/71.unity3d,h_so_43_02_298
286,43,44,子宮の中で、精子が卵子に群がってる……多分今、そんな感じになっとるで,sound/data/pcm/c43/h/71.unity3d,h_so_43_02_299
287,43,44,……ゴムに穴開いてたらどないしよ？　まあ、そんときはそんときかぁ……,sound/data/pcm/c43/h/71.unity3d,h_so_43_02_300
288,43,44,自分の場合、本当にゴムを使いきるまで射精出来そうな気ぃするわ,sound/data/pcm/c43/h/71.unity3d,h_so_43_02_301
289,43,44,……なんかさぁ、この瞬間に気づくねん……自分が恋人でよかったーって……,sound/data/pcm/c43/h/71.unity3d,h_so_43_02_302
290,43,44,なんか、身体を離すんが名残惜しいなぁ……もうちょっとする？,sound/data/pcm/c43/h/71.unity3d,h_so_43_02_303
291,43,44,基礎体温、ちゃんと計って、メモっといた方がええな……,sound/data/pcm/c43/h/71.unity3d,h_so_43_02_304
292,43,44,妊娠してたら、えーっと……どういう手順踏んだらえんやろね？,sound/data/pcm/c43/h/71.unity3d,h_so_43_02_305
293,43,44,もう自分相手やったら、何でもイク自信あるわ～……恋人効果っちゅうヤツやね,sound/data/pcm/c43/h/71.unity3d,h_so_43_02_306
294,43,44,身体が敏感になりすぎたんかも……今後の生活に支障を来さんとええけどな,sound/data/pcm/c43/h/71.unity3d,h_so_43_02_307
295,43,44,ここまでお尻で楽しみ尽くしてる人、どれぐらいおるんやろね,sound/data/pcm/c43/h/71.unity3d,h_so_43_02_308
296,43,44,あー……まだお尻が欲しがっとる……ウチも貪欲になったもんや,sound/data/pcm/c43/h/71.unity3d,h_so_43_02_309
297,43,44,ああ、濃いの、たーっぷり出とるわ……,sound/data/pcm/c43/h/71.unity3d,h_so_43_02_310
298,43,44,多いな～～……これが標準なん？,sound/data/pcm/c43/h/71.unity3d,h_so_43_02_311
299,43,44,お疲れ様～……ほんまよーけ出したね……ウチも見習いたいぐらいやわ,sound/data/pcm/c43/h/71.unity3d,h_so_43_02_312
300,43,44,くんくん……精液の匂い、エゲツナイな……すんすん……はぁ、めちゃヤバい……,sound/data/pcm/c43/h/71.unity3d,h_so_43_02_313
301,43,44,あー……とめどなく出てくるわ……自分がウチに興奮した証拠やね,sound/data/pcm/c43/h/71.unity3d,h_so_43_02_314
302,43,44,めっちゃ出る……お尻の穴、ゆるぅなってないか心配やわ……,sound/data/pcm/c43/h/71.unity3d,h_so_43_02_315
303,43,44,（開始時台詞）プールでエッチなことをするとか……よう思いつくわぁ,sound/data/pcm/c43/h/71.unity3d,h_so_43_02_316
