管理番号,大きい項目,中間項目,表示名,バンドルパス,ファイル名
0,30,50,ねぇねぇ、早くしましょ？　焦らすのなんてナシよ？,sound/data/pcm/c30/h/01.unity3d,h_ka_30_03_000
1,30,50,ほら、どんなことしようかしら？　キミのしたいこと、何でもしちゃうわよ？,sound/data/pcm/c30/h/01.unity3d,h_ka_30_03_001
2,30,50,はぁぁ……オチンポのこと考えるだけで……お姉さん、もうぐしょぐしょになっちゃうの……,sound/data/pcm/c30/h/01.unity3d,h_ka_30_03_002
3,30,50,あはは、言われなくても続けちゃうつもりだったわよ……なんて♪,sound/data/pcm/c30/h/01.unity3d,h_ka_30_03_003
4,30,50,私にしてもらうの、そんなに良かった？　ふふっ、それじゃ……オチンポ、虜にしちゃおうかしら,sound/data/pcm/c30/h/01.unity3d,h_ka_30_03_004
5,30,50,何回でもしよ？　だって……私もまだまだしたいもん,sound/data/pcm/c30/h/01.unity3d,h_ka_30_03_005
6,30,50,エッチって止め時ないわよね。こんなに気持ちいいこと、止められるはずないわ,sound/data/pcm/c30/h/01.unity3d,h_ka_30_03_006
7,30,50,お姉さんのこと、めちゃくちゃにしてね♪,sound/data/pcm/c30/h/01.unity3d,h_ka_30_03_007
8,30,50,ふふっ……期待しているわね♪,sound/data/pcm/c30/h/01.unity3d,h_ka_30_03_008
9,30,50,色んなところ触って、私のこと、どんどん開発してね。キミに開発して欲しいの,sound/data/pcm/c30/h/01.unity3d,h_ka_30_03_009
10,30,50,あー、期待したお顔してるわね。いいわよ。お姉さんの技術を見せつけてあげるんだから,sound/data/pcm/c30/h/01.unity3d,h_ka_30_03_010
11,30,50,満足するまで、何回でもオチンポ喜ばせてあげる,sound/data/pcm/c30/h/01.unity3d,h_ka_30_03_011
12,30,50,キミがひんひん言っちゃう声……想像しただけで濡れちゃいそう,sound/data/pcm/c30/h/01.unity3d,h_ka_30_03_012
13,30,50,ん、今すぐオチンポねじ込んで？,sound/data/pcm/c30/h/01.unity3d,h_ka_30_03_013
14,30,50,おまんこはもう準備万端。ほらほら、はやく欲しいって涎垂らしてるのよ,sound/data/pcm/c30/h/01.unity3d,h_ka_30_03_014
15,30,50,あぁ、嬉しい……オチンポ！　オチンポ早くちょうだぁい！,sound/data/pcm/c30/h/01.unity3d,h_ka_30_03_015
16,30,50,生でハメハメしたいけど……妊娠したらエッチできなくなるから、我慢しようね？,sound/data/pcm/c30/h/01.unity3d,h_ka_30_03_016
17,30,50,危険日に生ハメしたい誘惑が……ダメダメ、それはいけないわ,sound/data/pcm/c30/h/01.unity3d,h_ka_30_03_017
18,30,50,実は……今日は安全日なの！　やった！　生で思いっきりエッチしましょ！,sound/data/pcm/c30/h/01.unity3d,h_ka_30_03_018
19,30,50,ゴム、つけなくていいわ。……キミと生身で繋がりたい。お姉さんね、キミと……キミのオチンポ……それくらい好きなのよ,sound/data/pcm/c30/h/01.unity3d,h_ka_30_03_019
20,30,50,いいわよー♪,sound/data/pcm/c30/h/01.unity3d,h_ka_30_03_020
21,30,50,ふふっ、楽しみ♪,sound/data/pcm/c30/h/01.unity3d,h_ka_30_03_021
22,30,50,ふふふっ、いっぱい喘がせちゃうから、覚悟してね,sound/data/pcm/c30/h/01.unity3d,h_ka_30_03_022
23,30,50,よーし、女の子みたいな声出させちゃうんだから♪,sound/data/pcm/c30/h/01.unity3d,h_ka_30_03_023
24,30,50,さてと……それじゃお姉さんの本気を見せちゃおうかしら♪,sound/data/pcm/c30/h/01.unity3d,h_ka_30_03_024
25,30,50,ふふっ、楽しみ楽しみ,sound/data/pcm/c30/h/01.unity3d,h_ka_30_03_025
26,30,50,どんなことしちゃうのかしら♪,sound/data/pcm/c30/h/01.unity3d,h_ka_30_03_026
27,30,50,ふふっ、お姉さんを辱めてどうするつもり？,sound/data/pcm/c30/h/01.unity3d,h_ka_30_03_027
28,30,50,キミの前なら、どんな恥ずかしいことでも喜んでやっちゃうわよ♪,sound/data/pcm/c30/h/01.unity3d,h_ka_30_03_028
29,30,50,お姉さんが、たくさん感じさせちゃう,sound/data/pcm/c30/h/01.unity3d,h_ka_30_03_029
30,30,50,気持ちよく射精することだけ、考えててね♪,sound/data/pcm/c30/h/01.unity3d,h_ka_30_03_030
31,30,50,お口って……ご奉仕してるって感じがして好きよ♪,sound/data/pcm/c30/h/01.unity3d,h_ka_30_03_031
32,30,50,オチンポの味……想像しただけで涎出ちゃいそう……ふふっ,sound/data/pcm/c30/h/01.unity3d,h_ka_30_03_032
33,30,50,ええ、お姉さんのおっぱいにたくさん甘えてね♪,sound/data/pcm/c30/h/01.unity3d,h_ka_30_03_033
34,30,50,おっぱいまで使わせるなんてケダモノなんだからー。なーんて、お姉さんも大好きよ♪,sound/data/pcm/c30/h/01.unity3d,h_ka_30_03_034
35,30,50,あん……興奮しちゃう……,sound/data/pcm/c30/h/01.unity3d,h_ka_30_03_035
36,30,50,もうエッチのことしか考えられなくなっちゃった……♪,sound/data/pcm/c30/h/01.unity3d,h_ka_30_03_036
37,30,50,ふふっ、オチンポ限界まで苛めちゃうわよ〜♪,sound/data/pcm/c30/h/01.unity3d,h_ka_30_03_037
38,30,50,ふっふっふー、お姉さんの本気、見せてあげる♪,sound/data/pcm/c30/h/01.unity3d,h_ka_30_03_038
39,30,50,ふふっ、どんなことされちゃうのか期待しちゃう……,sound/data/pcm/c30/h/01.unity3d,h_ka_30_03_039
40,30,50,あんっ……早く気持ち良くしてぇ……,sound/data/pcm/c30/h/01.unity3d,h_ka_30_03_040
41,30,50,やだ……私、この格好だけでどんどん濡れちゃう……,sound/data/pcm/c30/h/01.unity3d,h_ka_30_03_041
42,30,50,あぁん、もうおまんこ蕩けちゃいそうよぉ……,sound/data/pcm/c30/h/01.unity3d,h_ka_30_03_042
43,30,50,これでキミの反応も楽しめるわね。ふふっ、いっぱい気持ち良くなりましょ,sound/data/pcm/c30/h/01.unity3d,h_ka_30_03_043
44,30,50,あんっ、見て……オチンポに気持ち良くされちゃう私のお顔……ふふっ,sound/data/pcm/c30/h/01.unity3d,h_ka_30_03_044
45,30,50,後ろから……好きなだけパンパンしてね,sound/data/pcm/c30/h/01.unity3d,h_ka_30_03_045
46,30,50,ケダモノみたいに激しく交尾して……あんっ、興奮しちゃう……,sound/data/pcm/c30/h/01.unity3d,h_ka_30_03_046
47,30,50,この格好……乱れてる感じがして好きよ。いっぱいぐちゅぐちゅしてね,sound/data/pcm/c30/h/01.unity3d,h_ka_30_03_047
48,30,50,あぁん、もう……私までヘンタイさんみたい……興奮しすぎてトロトロよぉ……,sound/data/pcm/c30/h/01.unity3d,h_ka_30_03_048
