管理番号,大きい項目,中間項目,表示名,バンドルパス,ファイル名
183,38,24,ゴムだけは、きちんとしてください,sound/data/pcm/c38/h/01.unity3d,h_so_38_00_185
184,38,24,生は、ご遠慮ください……,sound/data/pcm/c38/h/01.unity3d,h_so_38_00_186
185,38,24,危険日なのです、ご理解ください……,sound/data/pcm/c38/h/01.unity3d,h_so_38_00_187
186,38,24,困ります……危ない日はゴムを……,sound/data/pcm/c38/h/01.unity3d,h_so_38_00_188
187,38,24,は、はい、お尻はゆっくりですよ？,sound/data/pcm/c38/h/01.unity3d,h_so_38_00_189
188,38,24,お尻、本当にお好きなのですね……,sound/data/pcm/c38/h/01.unity3d,h_so_38_00_190
189,38,24,すみません、お尻ではできません,sound/data/pcm/c38/h/01.unity3d,h_so_38_00_191
190,38,24,いくらお願いされても、お尻では無理です,sound/data/pcm/c38/h/01.unity3d,h_so_38_00_192
191,38,24,熱い……貴方と繋がっていることを、すごく実感します,sound/data/pcm/c38/h/01.unity3d,h_so_38_00_202
192,38,24,貴方の、さっきより大きくなっていませんか？,sound/data/pcm/c38/h/01.unity3d,h_so_38_00_203
193,38,24,少し休憩しましょう、それがいいです,sound/data/pcm/c38/h/01.unity3d,h_so_38_00_204
194,38,24,お尻、やっぱりキツイですよね？,sound/data/pcm/c38/h/01.unity3d,h_so_38_00_205
195,38,24,あ……終わり、ですか？,sound/data/pcm/c38/h/01.unity3d,h_so_38_00_206
196,38,24,姿勢を変えますか？,sound/data/pcm/c38/h/01.unity3d,h_so_38_00_207
197,38,24,うぅ、お尻、拡がったまになってしまいますから……,sound/data/pcm/c38/h/01.unity3d,h_so_38_00_208
198,38,24,お尻は……やめておきますか？,sound/data/pcm/c38/h/01.unity3d,h_so_38_00_209
199,38,24,前より、感じられている気がしますっ,sound/data/pcm/c38/h/01.unity3d,h_so_38_00_210
200,38,24,普通は、何回くらいするものなんでしょうか？,sound/data/pcm/c38/h/01.unity3d,h_so_38_00_211
201,38,24,あぁ、感度がどんどん上がってるような……,sound/data/pcm/c38/h/01.unity3d,h_so_38_00_212
202,38,24,貴方に満足して頂けるまで、頑張りますっ,sound/data/pcm/c38/h/01.unity3d,h_so_38_00_213
203,38,24,お尻が気持ちいいなんて……変ですよね？,sound/data/pcm/c38/h/01.unity3d,h_so_38_00_214
204,38,24,先程よりは、ほぐれていますよね？,sound/data/pcm/c38/h/01.unity3d,h_so_38_00_215
205,38,24,自分のお尻じゃ、ないみたいですっ,sound/data/pcm/c38/h/01.unity3d,h_so_38_00_216
206,38,24,いっぱいして、早くお尻にも慣れたいですっ,sound/data/pcm/c38/h/01.unity3d,h_so_38_00_217
207,38,24,気持ちいい、ですかっ？,sound/data/pcm/c38/h/01.unity3d,h_so_38_00_218
208,38,24,身体が、どんどん熱くなっています,sound/data/pcm/c38/h/01.unity3d,h_so_38_00_219
209,38,24,あぁ、私達、何回もこんなに激しくっ,sound/data/pcm/c38/h/01.unity3d,h_so_38_00_220
210,38,24,もっと貴方に、気持ちよくなってほしいです,sound/data/pcm/c38/h/01.unity3d,h_so_38_00_221
211,38,24,うぅ、終わった後が、心配です……,sound/data/pcm/c38/h/01.unity3d,h_so_38_00_222
212,38,24,明日、きちんとトイレに行けるでしょうか……？,sound/data/pcm/c38/h/01.unity3d,h_so_38_00_223
213,38,24,流石に、これで終わりにしましょうね？,sound/data/pcm/c38/h/01.unity3d,h_so_38_00_224
214,38,24,お尻ばっかり、そんなにされてはっ,sound/data/pcm/c38/h/01.unity3d,h_so_38_00_225
215,38,24,来ましたっ、また、来てしまいましたっ,sound/data/pcm/c38/h/01.unity3d,h_so_38_00_226
216,38,24,また奥から、ジワジワと来ていますっ,sound/data/pcm/c38/h/01.unity3d,h_so_38_00_227
217,38,24,私、こんなにイって、大丈夫なのでしょうか？,sound/data/pcm/c38/h/01.unity3d,h_so_38_00_228
218,38,24,頭が、真っ白になっていきますっ,sound/data/pcm/c38/h/01.unity3d,h_so_38_00_229
219,38,24,出そうなんですね？　もうきちんと、わかりますよっ,sound/data/pcm/c38/h/01.unity3d,h_so_38_00_230
220,38,24,何回だって出していいんですよ、遠慮はいりませんっ,sound/data/pcm/c38/h/01.unity3d,h_so_38_00_231
221,38,24,はぁ、またイってくださるんんですね、嬉しいですっ,sound/data/pcm/c38/h/01.unity3d,h_so_38_00_232
222,38,24,恥ずかしがることはありませんよ、射精、たくさんしましょう,sound/data/pcm/c38/h/01.unity3d,h_so_38_00_233
223,38,24,お尻が、変になりそうですっ、むしろ、もうなってますっ,sound/data/pcm/c38/h/01.unity3d,h_so_38_00_234
224,38,24,どうか、そのままゆっくりでお願いしますっ,sound/data/pcm/c38/h/01.unity3d,h_so_38_00_235
225,38,24,やだっ、私、自分からお尻擦り付けてっ,sound/data/pcm/c38/h/01.unity3d,h_so_38_00_236
226,38,24,もっとお尻、気持ちよくしてくださいっ,sound/data/pcm/c38/h/01.unity3d,h_so_38_00_237
227,38,24,私のお尻、そんなに気持ちいいんですか？,sound/data/pcm/c38/h/01.unity3d,h_so_38_00_238
228,38,24,またイキそうなんですよね？　我慢しなくていいですよ,sound/data/pcm/c38/h/01.unity3d,h_so_38_00_239
229,38,24,こ、今度は、どちらに出されるのでしょうか？,sound/data/pcm/c38/h/01.unity3d,h_so_38_00_240
230,38,24,そんなに何度もイって、大丈夫なのですか？,sound/data/pcm/c38/h/01.unity3d,h_so_38_00_241
231,38,24,私っ、ああっ、飛んでしまいそうですっ,sound/data/pcm/c38/h/01.unity3d,h_so_38_00_242
232,38,24,貴方とのセックス、最高ですっ,sound/data/pcm/c38/h/01.unity3d,h_so_38_00_243
233,38,24,(恋人限定)一緒にイってください、私達パートナーですからっ,sound/data/pcm/c38/h/01.unity3d,h_so_38_00_244
234,38,24,我儘かもしれませんが、やっぱり一緒がいいですっ,sound/data/pcm/c38/h/01.unity3d,h_so_38_00_245
235,38,24,息、凄く荒くなっていますよ、私まで、つられてイってしまいそうですっ,sound/data/pcm/c38/h/01.unity3d,h_so_38_00_246
236,38,24,先程より気持ちよくなってくださいね、さぁっ、どうぞっ,sound/data/pcm/c38/h/01.unity3d,h_so_38_00_247
237,38,24,はい、外ですねっ、何度でも、貴方のお好きなようにっ,sound/data/pcm/c38/h/01.unity3d,h_so_38_00_248
238,38,24,射精、見せて頂けるんですねっ、はぁっ、楽しみですっ,sound/data/pcm/c38/h/01.unity3d,h_so_38_00_249
239,38,24,あぁっ、ゴムがはちきれそうにっ,sound/data/pcm/c38/h/01.unity3d,h_so_38_00_252
240,38,24,ゴム、大丈夫ですか？　大丈夫ですよねっ？,sound/data/pcm/c38/h/01.unity3d,h_so_38_00_253
241,38,24,うそですっ、私、お尻でっ、そんなっ,sound/data/pcm/c38/h/01.unity3d,h_so_38_00_254
242,38,24,ああっ、仕方ないんですっ、貴方がたくさん突くからっ,sound/data/pcm/c38/h/01.unity3d,h_so_38_00_255
243,38,24,お尻で一緒に、お願いしますっ、一緒にイってくださいっ,sound/data/pcm/c38/h/01.unity3d,h_so_38_00_256
244,38,24,貴方と一緒にイケるなら、お尻でも構いませんっ,sound/data/pcm/c38/h/01.unity3d,h_so_38_00_257
245,38,24,またイクんですねっ、私のお尻で、イって頂けるんですねっ,sound/data/pcm/c38/h/01.unity3d,h_so_38_00_258
246,38,24,どうぞ、貴方が満足するまで、お尻でイってくださいっ,sound/data/pcm/c38/h/01.unity3d,h_so_38_00_259
247,38,24,んぁぁあ、また出ていますぅっ……,sound/data/pcm/c38/h/01.unity3d,h_so_38_00_260
248,38,24,そんなっ、どれだけ出るのですかっ,sound/data/pcm/c38/h/01.unity3d,h_so_38_00_261
249,38,24,そんなに出したら、ゴムが裂けてしまいますぅっ,sound/data/pcm/c38/h/01.unity3d,h_so_38_00_262
250,38,24,ゴムをしていても、勢いが伝わってきますっ,sound/data/pcm/c38/h/01.unity3d,h_so_38_00_263
251,38,24,えぇっ、またお尻にっ、いっぱいぃっ,sound/data/pcm/c38/h/01.unity3d,h_so_38_00_264
252,38,24,はぁっ、お尻の中、真っ白になってしまいますぅっ,sound/data/pcm/c38/h/01.unity3d,h_so_38_00_265
253,38,24,ふぅああああっ,sound/data/pcm/c38/h/01.unity3d,h_so_38_00_266
254,38,24,んいいぃいんっ,sound/data/pcm/c38/h/01.unity3d,h_so_38_00_267
255,38,24,ひうぅうううんっ,sound/data/pcm/c38/h/01.unity3d,h_so_38_00_268
256,38,24,あぃっ、イグっ、はぁああああっ,sound/data/pcm/c38/h/01.unity3d,h_so_38_00_269
257,38,24,ひっ、ぐっ……息が、あぁ、上手くできません……,sound/data/pcm/c38/h/01.unity3d,h_so_38_00_270
258,38,24,一緒に、イケたんですよね？　はぁぁぁ……良かったぁぁ……,sound/data/pcm/c38/h/01.unity3d,h_so_38_00_271
259,38,24,貴方の温かさ、中できちんと感じていますよ……,sound/data/pcm/c38/h/01.unity3d,h_so_38_00_272
260,38,24,セックスばかりしていると頭が悪くなるという理由……わかった気がします……,sound/data/pcm/c38/h/01.unity3d,h_so_38_00_273
261,38,24,貴方との子供なら……私は、喜んで……,sound/data/pcm/c38/h/01.unity3d,h_so_38_00_274
262,38,24,んっ、旦那様？　なんて……ふふっ,sound/data/pcm/c38/h/01.unity3d,h_so_38_00_275
263,38,24,私、貴方にイカされてばかりではありませんか？,sound/data/pcm/c38/h/01.unity3d,h_so_38_00_276
264,38,24,うぅ、貴方に満足して頂きたいのに……力不足です……,sound/data/pcm/c38/h/01.unity3d,h_so_38_00_277
265,38,24,喜んでいいのですよね？　お尻だとしても、一緒にイケたのですから……,sound/data/pcm/c38/h/01.unity3d,h_so_38_00_278
266,38,24,あの……お尻でイクと、貴方もやはり違う感覚なのですか？,sound/data/pcm/c38/h/01.unity3d,h_so_38_00_279
267,38,24,一人だけでイクのは、恥ずかし過ぎます……お尻ですよ？,sound/data/pcm/c38/h/01.unity3d,h_so_38_00_280
268,38,24,お尻でもイケたということで……その、良かったですよね？,sound/data/pcm/c38/h/01.unity3d,h_so_38_00_281
269,38,24,もうどこも、力が入りません……エッチって、こんなに消耗するものなんですね,sound/data/pcm/c38/h/01.unity3d,h_so_38_00_282
270,38,24,まだしたいのでしたら……ゴムを取り替えてから、お願いしますね……,sound/data/pcm/c38/h/01.unity3d,h_so_38_00_283
271,38,24,貴方のって、もしかして、ずっと大きいままなのですか……？,sound/data/pcm/c38/h/01.unity3d,h_so_38_00_284
272,38,24,私の中、もう貴方に出して頂いたもので……いっぱいです……,sound/data/pcm/c38/h/01.unity3d,h_so_38_00_285
273,38,24,子宮が下りる感覚って、本当にあるんですね……,sound/data/pcm/c38/h/01.unity3d,h_so_38_00_286
274,38,24,お腹の奥が熱いです……これが、受精したということなんでしょうか……,sound/data/pcm/c38/h/01.unity3d,h_so_38_00_287
275,38,24,慣れるまでは……先にイってしまうのも、許してくださいね？,sound/data/pcm/c38/h/01.unity3d,h_so_38_00_288
276,38,24,私、もう何回イったのですか？　頭がボーっとしてしまって……,sound/data/pcm/c38/h/01.unity3d,h_so_38_00_289
277,38,24,さ、流石に……お尻がヒリヒリしてきました……,sound/data/pcm/c38/h/01.unity3d,h_so_38_00_290
278,38,24,お尻でこんなにイクのは……おかしいのではないでしょうか？,sound/data/pcm/c38/h/01.unity3d,h_so_38_00_291
279,38,24,うぅ、トイレに行く度……思い出しそうです……,sound/data/pcm/c38/h/01.unity3d,h_so_38_00_292
280,38,24,す、すぐには動かないでくださいね？　今、敏感なので……,sound/data/pcm/c38/h/01.unity3d,h_so_38_00_293
281,38,24,貴方にイって頂けると、何回でも嬉しくなってしまいます,sound/data/pcm/c38/h/01.unity3d,h_so_38_00_294
282,38,24,大丈夫ですか？　一度ゴムを外して……休憩しては？,sound/data/pcm/c38/h/01.unity3d,h_so_38_00_295
283,38,24,男の方は、皆さんこれくらい出るものなのですか？,sound/data/pcm/c38/h/01.unity3d,h_so_38_00_296
284,38,24,何度出しても元気なのですね……そんなに興奮して頂けて、光栄です,sound/data/pcm/c38/h/01.unity3d,h_so_38_00_297
285,38,24,心なしか、お腹が膨らんでいるような……,sound/data/pcm/c38/h/01.unity3d,h_so_38_00_298
286,38,24,妊娠しても……エッチはできるのでしょうか？,sound/data/pcm/c38/h/01.unity3d,h_so_38_00_299
287,38,24,ゴムって凄いですよね……一度きちんと、見てみたくなりました,sound/data/pcm/c38/h/01.unity3d,h_so_38_00_300
288,38,24,貴方の精液を受け止めて頂いたゴムに、感謝しなくてはいけませんね,sound/data/pcm/c38/h/01.unity3d,h_so_38_00_301
289,38,24,(恋人限定)中に出して頂くと、パートナーと認めて頂けたようで……ふふっ♪,sound/data/pcm/c38/h/01.unity3d,h_so_38_00_302
290,38,24,お互いの弱い部分を擦り合うなんて、改めて考えると、凄いことですよね……,sound/data/pcm/c38/h/01.unity3d,h_so_38_00_303
291,38,24,このことは、二人の秘密ですよ？　誰にも言わないでくださいね？,sound/data/pcm/c38/h/01.unity3d,h_so_38_00_304
292,38,24,あとでいいので、ギュっと抱き締めて頂けますか？,sound/data/pcm/c38/h/01.unity3d,h_so_38_00_305
293,38,24,(恋人限定)すみません……貴方に釣り合うパートナーになるには、もう少し時間がかかりそうです,sound/data/pcm/c38/h/01.unity3d,h_so_38_00_306
294,38,24,私、頑張ってエッチなこと覚えますっ、一人でもたくさんして、予習してきますので,sound/data/pcm/c38/h/01.unity3d,h_so_38_00_307
295,38,24,不躾な質問なのですが……お尻の方が好きなのですか？,sound/data/pcm/c38/h/01.unity3d,h_so_38_00_308
296,38,24,慣れたとまでは言えませんが、お尻も抵抗がなくなってきました……,sound/data/pcm/c38/h/01.unity3d,h_so_38_00_309
297,38,24,まだこんなに出るのですかっ、す、すごいですね……,sound/data/pcm/c38/h/01.unity3d,h_so_38_00_310
298,38,24,なんて濃い匂い……んっ、むせてしまいそうです……,sound/data/pcm/c38/h/01.unity3d,h_so_38_00_311
299,38,24,最後はやはり、中に出したいですか？,sound/data/pcm/c38/h/01.unity3d,h_so_38_00_312
300,38,24,外に出して終わりだと、少し味気ないですよね？,sound/data/pcm/c38/h/01.unity3d,h_so_38_00_313
301,38,24,あぁっ、アソコ、緩んで……,sound/data/pcm/c38/h/01.unity3d,h_so_38_00_314
302,38,24,お尻の奥まで、見られてしまいましたね……,sound/data/pcm/c38/h/01.unity3d,h_so_38_00_315
