管理番号,大きい項目,中間項目,表示名,バンドルパス,ファイル名
159,23,54,キミがイケるように……ワタシもがんばったよ……気持ちよかった……かな……？,sound/data/pcm/c23/h/01.unity3d,h_so_23_03_160
160,23,54,今日が安全日ってわかると、ついキミとのゴムなしエッチを想像しちゃうんだよ……ワタシ、おかしいかな、ふふっ,sound/data/pcm/c23/h/01.unity3d,h_so_23_03_161
161,23,54,せっかくだから……生でしてほしいって気持ちもあるんだ……って、変態みたいかなぁ……？,sound/data/pcm/c23/h/01.unity3d,h_so_23_03_162
162,23,54,ねね、赤ちゃんの名前考える？　あ、でもまだ性別が分からないか,sound/data/pcm/c23/h/01.unity3d,h_so_23_03_163
163,23,54,もし、赤ちゃんができた時のために、名前でも考えちゃう？　気が早いかな？,sound/data/pcm/c23/h/01.unity3d,h_so_23_03_164
164,23,54,もしかしたら、今までで一番気持ちよかったかも……危険日中だしって、色々な意味でキケンだね、ふふっ,sound/data/pcm/c23/h/01.unity3d,h_so_23_03_165
165,23,54,たぶん、今までで一番気持ちよかったかも……色々な意味でキケンなエッチだったからかな……ドキドキしてる……,sound/data/pcm/c23/h/01.unity3d,h_so_23_03_166
166,23,54,ごめんね、ワタシだけ気持ちよくなっちゃった……次はうんとサービスしてあげるから、楽しみにしててね,sound/data/pcm/c23/h/01.unity3d,h_so_23_03_167
167,23,54,ひとりだけ気持ちよくなっちゃった……次は……お詫びも込めて、ご奉仕しないと、だね,sound/data/pcm/c23/h/01.unity3d,h_so_23_03_168
168,23,54,んふふ、アナル中出しは仲良しカップルの証なんだって……こないだ読んだ同人誌に書いてあった……,sound/data/pcm/c23/h/01.unity3d,h_so_23_03_169
169,23,54,これからも……アナル中出し大好きな……エッチなワタシを好きでいてくれたらうれしいな……,sound/data/pcm/c23/h/01.unity3d,h_so_23_03_170
170,23,54,アナルで中だし……これだけで、すごい、危険な香りのするフレーズだよね……,sound/data/pcm/c23/h/01.unity3d,h_so_23_03_171
171,23,54,ああっ、すごい、すごいよぉ……おちんちんって、何でこんなに、興奮させてくれるんだろう……,sound/data/pcm/c23/h/01.unity3d,h_so_23_03_172
172,23,54,おちんちんが、ビックマグナムって、言われる理由、なんとなくわかった気がする,sound/data/pcm/c23/h/01.unity3d,h_so_23_03_173
173,23,54,ふふふ……たまには外だしもいいね……これが普段ワタシの中に発射されてると思うと、ブルブルきちゃう,sound/data/pcm/c23/h/01.unity3d,h_so_23_03_174
174,23,54,外に出されると……どれくらい出たのかわかって……いい感じ……,sound/data/pcm/c23/h/01.unity3d,h_so_23_03_175
175,23,54,ふふふ……たまには外だしもいいね……これ、普段私の中に発射されてるんだよね……なんだか、ゾクゾクする,sound/data/pcm/c23/h/01.unity3d,h_so_23_03_176
176,23,54,出しすぎだよぉ……こんなに垂れちゃってる……もう、しかたないなぁ……,sound/data/pcm/c23/h/01.unity3d,h_so_23_03_177
177,23,54,んっ、垂れて来ちゃった……よく見たいなら、みてもいいよ？,sound/data/pcm/c23/h/01.unity3d,h_so_23_03_178
178,23,54,えへへ……わざとじゃないよ？　油断しちゃったら、たらって出てきちゃった,sound/data/pcm/c23/h/01.unity3d,h_so_23_03_179
179,23,54,わざとじゃないよ？　油断しちゃったら、垂れて出てきちゃった……ちょっとだけ……恥ずかしいな………,sound/data/pcm/c23/h/01.unity3d,h_so_23_03_180
180,23,54,んっ、まだ疼いちゃってる…きて…,sound/data/pcm/c23/h/01.unity3d,h_so_23_03_181
181,23,54,な、なんか……まだ体がびっくりしてるみたい……きて……,sound/data/pcm/c23/h/01.unity3d,h_so_23_03_182
182,23,54,こんなに固いんだし……まだ全然できるよね……,sound/data/pcm/c23/h/01.unity3d,h_so_23_03_183
183,23,54,うんっ……キミのおちんちん……ほしくてたまらないよぉ,sound/data/pcm/c23/h/01.unity3d,h_so_23_03_184
184,23,54,ワタシも……したいけど、ダメなのぉ……,sound/data/pcm/c23/h/01.unity3d,h_so_23_03_185
185,23,54,ゴムなしが気持ちいいのはわかるけど……我慢しようよ……,sound/data/pcm/c23/h/01.unity3d,h_so_23_03_186
186,23,54,キミとは、安心してエッチしたいのぉ,sound/data/pcm/c23/h/01.unity3d,h_so_23_03_187
187,23,54,心おきなくエッチしたいから……お願い……,sound/data/pcm/c23/h/01.unity3d,h_so_23_03_188
188,23,54,アナル、クセになっちゃったの？　えへへ,sound/data/pcm/c23/h/01.unity3d,h_so_23_03_189
189,23,54,もしかして、ワタシのアナル、クセになっちゃったの？　えへへ,sound/data/pcm/c23/h/01.unity3d,h_so_23_03_190
190,23,54,ワタシが……道を踏み外しちゃいそうだから……いやだなぁ……,sound/data/pcm/c23/h/01.unity3d,h_so_23_03_191
191,23,54,お尻でイっちゃうワタシを見て……嫌いになったりしない……？,sound/data/pcm/c23/h/01.unity3d,h_so_23_03_192
192,23,54,イキすぎて……おまんこキツキツになってる,sound/data/pcm/c23/h/01.unity3d,h_so_23_03_193
193,23,54,イッちゃった……おまんこキュンキュンンしてる,sound/data/pcm/c23/h/01.unity3d,h_so_23_03_194
194,23,54,思いっきり突っ込んで……奥までとどけてぇ……！,sound/data/pcm/c23/h/01.unity3d,h_so_23_03_195
195,23,54,もっと動いてぇ、奥を突いてぇ……,sound/data/pcm/c23/h/01.unity3d,h_so_23_03_196
196,23,54,イッたばっかりなのに、カチカチぃ,sound/data/pcm/c23/h/01.unity3d,h_so_23_03_197
197,23,54,お尻の穴いっぱいほじっていいからね……,sound/data/pcm/c23/h/01.unity3d,h_so_23_03_198
198,23,54,アナルぅ……いっぱいほじってぇ……,sound/data/pcm/c23/h/01.unity3d,h_so_23_03_199
199,23,54,お尻弱いからっ……手加減してぇ……,sound/data/pcm/c23/h/01.unity3d,h_so_23_03_200
200,23,54,あぁんっ、やっぱり、アナルぅ……弱いぃっ……,sound/data/pcm/c23/h/01.unity3d,h_so_23_03_201
201,23,54,このままでもイッちゃいそう,sound/data/pcm/c23/h/01.unity3d,h_so_23_03_202
202,23,54,この調子だと……なにもされなくても……イッちゃいそう,sound/data/pcm/c23/h/01.unity3d,h_so_23_03_203
203,23,54,気持ちいいだけじゃなくて……ちょっとつらいのが……すごくいいっ……,sound/data/pcm/c23/h/01.unity3d,h_so_23_03_204
204,23,54,この、ちょっとだけ苦しいのが、たまらないのぉ,sound/data/pcm/c23/h/01.unity3d,h_so_23_03_205
205,23,54,いいよ、なんでも好きにして,sound/data/pcm/c23/h/01.unity3d,h_so_23_03_206
206,23,54,好きにしてくれて……かまわないんだよ……？,sound/data/pcm/c23/h/01.unity3d,h_so_23_03_207
207,23,54,ひゃ……も、もうちょっとゆっくり抜いてぇ……,sound/data/pcm/c23/h/01.unity3d,h_so_23_03_208
208,23,54,引き抜くときに、ちょうど、カリが当たるのしゅきぃ,sound/data/pcm/c23/h/01.unity3d,h_so_23_03_209
209,23,54,ネットリ責めてぇっ,sound/data/pcm/c23/h/01.unity3d,h_so_23_03_210
210,23,54,焦らしてるのかな……？　でもゆっくりも好きだよ……？,sound/data/pcm/c23/h/01.unity3d,h_so_23_03_211
211,23,54,それ好きぃ、ゴリゴリ擦ってぇえ,sound/data/pcm/c23/h/01.unity3d,h_so_23_03_212
212,23,54,ズンズンついて……はやいの好きなのぉっ……！,sound/data/pcm/c23/h/01.unity3d,h_so_23_03_213
213,23,54,お尻が締まっちゃうのわかるよぉ,sound/data/pcm/c23/h/01.unity3d,h_so_23_03_214
214,23,54,アナルでも……締めつけ……きつくしちゃうう,sound/data/pcm/c23/h/01.unity3d,h_so_23_03_215
215,23,54,速いのすきぃ、もっとずぼずぼしてぇっ,sound/data/pcm/c23/h/01.unity3d,h_so_23_03_216
216,23,54,はやくぅっ……思いっきりはやくしてぇ……,sound/data/pcm/c23/h/01.unity3d,h_so_23_03_217
217,23,54,キミのおちんちんに……ワタシの中……ダメにされちゃうぅ,sound/data/pcm/c23/h/01.unity3d,h_so_23_03_218
218,23,54,あぁっもうダメになっちゃうぅ、おちんちん、気持ちいい,sound/data/pcm/c23/h/01.unity3d,h_so_23_03_219
219,23,54,ものすごく……おちんちん突いてきてるぅ……,sound/data/pcm/c23/h/01.unity3d,h_so_23_03_220
220,23,54,キミのオチンポ好きぃっ、だいしゅきぃっ,sound/data/pcm/c23/h/01.unity3d,h_so_23_03_221
221,23,54,おちんぽ入れやすい形に……アナルの形……変わっちゃったよぉ……,sound/data/pcm/c23/h/01.unity3d,h_so_23_03_222
222,23,54,私のアナル、すっかりおちんちんが入る穴になっちゃった……,sound/data/pcm/c23/h/01.unity3d,h_so_23_03_223
223,23,54,好きなだけ……お尻にガンガン突きいれてぇぇぇええっ……！,sound/data/pcm/c23/h/01.unity3d,h_so_23_03_224
224,23,54,ガツガツほじられるのだいしゅき、もっとホジホジしてぇっ,sound/data/pcm/c23/h/01.unity3d,h_so_23_03_225
225,23,54,キミのおちんぽにかきまわされたらって思うと……もうダメぇ……,sound/data/pcm/c23/h/01.unity3d,h_so_23_03_226
226,23,54,あぁっだめえ、ワタシのおまんこの中もうトロトロォ,sound/data/pcm/c23/h/01.unity3d,h_so_23_03_227
227,23,54,ワタシの頭の中……キミのおちんぽでいっぱいだよぉ……,sound/data/pcm/c23/h/01.unity3d,h_so_23_03_228
228,23,54,おちんちんのことしか考えられないぃっ,sound/data/pcm/c23/h/01.unity3d,h_so_23_03_229
229,23,54,もう１回出してぇっ、出したいって顔に書いてあるよぉっ,sound/data/pcm/c23/h/01.unity3d,h_so_23_03_230
230,23,54,何回でも出していいからぁっ……いっぱい……いってぇっ……！,sound/data/pcm/c23/h/01.unity3d,h_so_23_03_231
231,23,54,感じてくれてるの……うれしいっ……ワタシのことも感じさせてぇっ……！,sound/data/pcm/c23/h/01.unity3d,h_so_23_03_232
232,23,54,キミのえっちな表情で、ワタシもゾクゾクしちゃうぅっ、もっと激しくしてぇっ,sound/data/pcm/c23/h/01.unity3d,h_so_23_03_233
233,23,54,ゆっくりホジるのだめぇんっ、おかしくなっちゃううっ,sound/data/pcm/c23/h/01.unity3d,h_so_23_03_234
234,23,54,そ、そんなにじっくり動かしたら……我慢できなくなるぅぅっ……,sound/data/pcm/c23/h/01.unity3d,h_so_23_03_235
235,23,54,アナルファックすごいぃっ、もうメロメロぉっ,sound/data/pcm/c23/h/01.unity3d,h_so_23_03_236
236,23,54,もう、アナルファックすごいぃっ、癖になっちゃうぅ,sound/data/pcm/c23/h/01.unity3d,h_so_23_03_237
237,23,54,何回イッても萎えない無敵おちんぽでお尻いっぱい犯してぇっ,sound/data/pcm/c23/h/01.unity3d,h_so_23_03_238
238,23,54,も、もう……なんでそんなに固いままなのっ……もうワタシの体……もたないよぉっ……！,sound/data/pcm/c23/h/01.unity3d,h_so_23_03_239
239,23,54,お尻壊してぇっ、何度使っても気持ちいいキミ専用のアナルにしてぇっ,sound/data/pcm/c23/h/01.unity3d,h_so_23_03_240
240,23,54,壊れるくらい……勢いよく出していいからぁぁぁああっ……！,sound/data/pcm/c23/h/01.unity3d,h_so_23_03_241
241,23,54,そこいっぱい擦ってぇっ、もうイク、イクっっ,sound/data/pcm/c23/h/01.unity3d,h_so_23_03_242
242,23,54,そこ、気持ちいから、もっと擦ってぇっ……思いっきりお願い……,sound/data/pcm/c23/h/01.unity3d,h_so_23_03_243
243,23,54,カップルイキしよぉっ、二人でガクガクってぇっ,sound/data/pcm/c23/h/01.unity3d,h_so_23_03_244
244,23,54,もっと気持ちよくなって……お願い……同時にイっちゃおうよぉっ……,sound/data/pcm/c23/h/01.unity3d,h_so_23_03_245
245,23,54,きてぇっ、キミが開発したエッチな身体で思いっきり射精してぇっ,sound/data/pcm/c23/h/01.unity3d,h_so_23_03_246
246,23,54,お願い……キミの固いおちんぽで……ワタシの身体いじめてぇっ……！,sound/data/pcm/c23/h/01.unity3d,h_so_23_03_247
247,23,54,いいよ、ワタシにぶっかけしてぇっ、さっきよりもたくさんかけてぇぇぇ,sound/data/pcm/c23/h/01.unity3d,h_so_23_03_249
248,23,54,ピストンに必死になってるキミ、エロすぎるよぉっ,sound/data/pcm/c23/h/01.unity3d,h_so_23_03_250
249,23,54,思いっきり……腰ふって……ワタシの身体……突いてぇぇぇっ……！,sound/data/pcm/c23/h/01.unity3d,h_so_23_03_251
250,23,54,ゴムつけてても……キミのおちんぽ大好きだよぉっ……！,sound/data/pcm/c23/h/01.unity3d,h_so_23_03_252
251,23,54,愛液まみれのぬるぬるゴムチンポ、気持ちよくて、好きぃっ,sound/data/pcm/c23/h/01.unity3d,h_so_23_03_253
252,23,54,キミがお尻好きなのは……わかったからぁっ……！　も、もうっ……！,sound/data/pcm/c23/h/01.unity3d,h_so_23_03_254
253,23,54,一番好きな人にアナル責められて、イカされちゃううっ,sound/data/pcm/c23/h/01.unity3d,h_so_23_03_255
254,23,54,ワタシのアナル、キミと一緒にイキたいってヒクついてるぅっ,sound/data/pcm/c23/h/01.unity3d,h_so_23_03_256
255,23,54,う、うれしいよぉ……お尻にキミのおちんぽ……たくさん感じられてるぅぅぅっ……！,sound/data/pcm/c23/h/01.unity3d,h_so_23_03_257
256,23,54,ワタシのエッチなアナルでよかったら何回でも出してぇっ,sound/data/pcm/c23/h/01.unity3d,h_so_23_03_258
257,23,54,アナルで何回も、ドッピュンしてぇ！,sound/data/pcm/c23/h/01.unity3d,h_so_23_03_259
258,23,54,今日はキミのおちんぽミルクのにおいが取れなさそう、くすっ,sound/data/pcm/c23/h/01.unity3d,h_so_23_03_260
259,23,54,おちんぽミルクの濃ゆいにおい、忘れられないよぉ,sound/data/pcm/c23/h/01.unity3d,h_so_23_03_261
260,23,54,すごい量……ゴムが破裂しないか心配、ふふっ,sound/data/pcm/c23/h/01.unity3d,h_so_23_03_262
261,23,54,こんなにも出されたら……ゴムが破裂しそうだよぉ、うふふ,sound/data/pcm/c23/h/01.unity3d,h_so_23_03_263
262,23,54,アナルお注射いいのぉっ、さっき出したのに量もすごいぃ,sound/data/pcm/c23/h/01.unity3d,h_so_23_03_264
263,23,54,お尻に注ぎ込まれるの……すごい好きぃっ……！,sound/data/pcm/c23/h/01.unity3d,h_so_23_03_265
264,23,54,だめだよぉっ……！　ワタシもう……頭おかしくなるぅぅぅううっ……！,sound/data/pcm/c23/h/01.unity3d,h_so_23_03_266
265,23,54,だ、だめぇ、落ちちゃうぅううっっ,sound/data/pcm/c23/h/01.unity3d,h_so_23_03_267
266,23,54,もう……もとのワタシに……戻れなくなっちゃうよぉぉぉおっ……！,sound/data/pcm/c23/h/01.unity3d,h_so_23_03_268
267,23,54,帰ってこれなくなっちゃうぅうよぉ,sound/data/pcm/c23/h/01.unity3d,h_so_23_03_269
268,23,54,最初はゴムって嫌いだったけど、キミと一緒ならゴムイキするのもいいなって,sound/data/pcm/c23/h/01.unity3d,h_so_23_03_270
269,23,54,ゴムがあると……安心していっぱい出せて……いいかも……,sound/data/pcm/c23/h/01.unity3d,h_so_23_03_271
270,23,54,キミと一緒にイケた日はエッチな夢を見ちゃうんだよ。たぶん今日も……,sound/data/pcm/c23/h/01.unity3d,h_so_23_03_272
271,23,54,一緒にイっちゃた日って……そのあともすごく……幸せな気持ちが続くよ……,sound/data/pcm/c23/h/01.unity3d,h_so_23_03_273
272,23,54,ふうっ……キミも……もうさすがにぐったりしてる……？　あれ、そんなことないかな……？,sound/data/pcm/c23/h/01.unity3d,h_so_23_03_274
273,23,54,えへへ、今のキミの顔、すっごくエッチな表情浮かべてるよ,sound/data/pcm/c23/h/01.unity3d,h_so_23_03_275
274,23,54,これからも……ずーっと仲良しで……エッチしようね……,sound/data/pcm/c23/h/01.unity3d,h_so_23_03_276
275,23,54,やっぱりアナタとの相性は抜群だって、再確認したよ,sound/data/pcm/c23/h/01.unity3d,h_so_23_03_277
276,23,54,アナルでもビクンッて痙攣しちゃうんだよね……変態街道まっしぐらだよ,sound/data/pcm/c23/h/01.unity3d,h_so_23_03_278
277,23,54,もう……アナルでいくの……けっこう普通になっちゃったかも……,sound/data/pcm/c23/h/01.unity3d,h_so_23_03_279
278,23,54,せっかく慣れてきたんだし……何度もお尻でイかせてくれるといいな……,sound/data/pcm/c23/h/01.unity3d,h_so_23_03_280
279,23,54,も、もっとアナルでイカせてほしいな,sound/data/pcm/c23/h/01.unity3d,h_so_23_03_281
280,23,54,射精の勢いが……ゴムを通して伝わってくるよぉ……,sound/data/pcm/c23/h/01.unity3d,h_so_23_03_282
281,23,54,ゴムのキュッキュって感触、気持ちいいから、それだけでまたイッちゃいそう,sound/data/pcm/c23/h/01.unity3d,h_so_23_03_283
282,23,54,ゴムをつけてすると、生の気持ちよさにびっくりすることあるよね,sound/data/pcm/c23/h/01.unity3d,h_so_23_03_284
283,23,54,生の気持ちよさって、ゴムにはない気持ちよさがあるよね,sound/data/pcm/c23/h/01.unity3d,h_so_23_03_285
284,23,54,もうゴム、いらないかなぁ？,sound/data/pcm/c23/h/01.unity3d,h_so_23_03_286
285,23,54,ここまできたら……ゴムなんてつける必要なんて……ないよね……,sound/data/pcm/c23/h/01.unity3d,h_so_23_03_287
286,23,54,なんか、キミとの思い出が頭の中で弾けちゃった……悪い意味じゃないよ？,sound/data/pcm/c23/h/01.unity3d,h_so_23_03_288
287,23,54,とても……とてもの気持ちよかった……,sound/data/pcm/c23/h/01.unity3d,h_so_23_03_289
288,23,54,もしかしたらおまんこで一緒にイクより気持ちいいかもぉ,sound/data/pcm/c23/h/01.unity3d,h_so_23_03_290
289,23,54,アナルで一緒にイクの最高に気持ちいい,sound/data/pcm/c23/h/01.unity3d,h_so_23_03_291
290,23,54,今、おっきい方したら、またイッちゃうのかなぁ,sound/data/pcm/c23/h/01.unity3d,h_so_23_03_292
291,23,54,このまま、お尻に刺激が入ったら、またイっちゃいそう,sound/data/pcm/c23/h/01.unity3d,h_so_23_03_293
292,23,54,ワタシがもっとエロくなったら、もっと中だししてくれるのかなぁ？,sound/data/pcm/c23/h/01.unity3d,h_so_23_03_294
293,23,54,中に出されるのが……やっぱり一番好きかも……もっとたくさんぶちこんでくれたらいいのにな……,sound/data/pcm/c23/h/01.unity3d,h_so_23_03_295
294,23,54,またイッちゃったね……生だから？　うふふっ,sound/data/pcm/c23/h/01.unity3d,h_so_23_03_296
295,23,54,生だと……やっぱりイクまでの時間も短いの……？,sound/data/pcm/c23/h/01.unity3d,h_so_23_03_297
296,23,54,さっき出したばっかりなのに、凄い量……ワタシの中で精子がピチピチ跳ねてるのわかるよぉ,sound/data/pcm/c23/h/01.unity3d,h_so_23_03_298
297,23,54,すごく出たね……こんなに出しちゃっても……まだ枯れないんだ……？,sound/data/pcm/c23/h/01.unity3d,h_so_23_03_299
298,23,54,おちんぽミルクが出るたびに、ゴムのさきっぽの袋が子宮にタプタプしてくるぅ,sound/data/pcm/c23/h/01.unity3d,h_so_23_03_300
299,23,54,ゴムのさきっぽの袋が、おまんこの中で震えてるよぉ,sound/data/pcm/c23/h/01.unity3d,h_so_23_03_301
300,23,54,ワタシのおまんこ……キミのザーメンで……いっぱいになってるぅ……,sound/data/pcm/c23/h/01.unity3d,h_so_23_03_302
301,23,54,おまんこ、おちんぽミルクでタプタプになっちゃてるよぉ……えへへ、しあわせ,sound/data/pcm/c23/h/01.unity3d,h_so_23_03_303
302,23,54,射精の勢いすごかった……ちゃんと伝わったよ……,sound/data/pcm/c23/h/01.unity3d,h_so_23_03_304
303,23,54,最後は自分からも腰振っちゃったよぉ……危険日ゴムなしエッチってクセになっちゃうよね,sound/data/pcm/c23/h/01.unity3d,h_so_23_03_305
304,23,54,じゃあ、次はキミがイク番ね。ワタシを気持ちよくしようとしなくていいから、激しくして,sound/data/pcm/c23/h/01.unity3d,h_so_23_03_306
305,23,54,ワタシばっかりイクのはずるいもんね……キミにもいっぱい……いってほしい……,sound/data/pcm/c23/h/01.unity3d,h_so_23_03_307
306,23,54,えへへ、アナルからキミのおちんぽミルクが垂れるところ、見たい？,sound/data/pcm/c23/h/01.unity3d,h_so_23_03_308
307,23,54,出す時って……どんな感じなの……？　ワタシも……ちょっと体験してみたいかも……,sound/data/pcm/c23/h/01.unity3d,h_so_23_03_309
308,23,54,あぁ、キミのおちんぽミルクのにおいが……このにおいだけでイッちゃいそう……興奮する,sound/data/pcm/c23/h/01.unity3d,h_so_23_03_310
309,23,54,精液の……このにおい好きなの……忘れられなくなりそう……,sound/data/pcm/c23/h/01.unity3d,h_so_23_03_311
310,23,54,あ、まだちょっぴり中に残ってそう。吸い出してあげよっか？,sound/data/pcm/c23/h/01.unity3d,h_so_23_03_312
311,23,54,まだ出せる……？　あ、その前に……一回おそうじしないとね……,sound/data/pcm/c23/h/01.unity3d,h_so_23_03_313
312,23,54,ほら、見て……中にいっぱい出したおちんぽミルクが垂れて来ちゃった,sound/data/pcm/c23/h/01.unity3d,h_so_23_03_314
313,23,54,見える？　アナルがぱくぱくしながら、キミのおちんぽミルクの垂らしちゃってる,sound/data/pcm/c23/h/01.unity3d,h_so_23_03_315
