管理番号,大きい項目,中間項目,表示名,バンドルパス,ファイル名
0,43,34,お陰様で、少し慣れてん。せやから心に余裕あるで……いつでもどーぞ,sound/data/pcm/c43/h/71.unity3d,h_so_43_01_000
1,43,34,少しまだ緊張するけど……まあ、いざ始まったら盛り上がるんちゃう？　知らんけど,sound/data/pcm/c43/h/71.unity3d,h_so_43_01_001
2,43,34,ええで……ってか、いちいち断ってくれるん、ちょっと好き,sound/data/pcm/c43/h/71.unity3d,h_so_43_01_003
3,43,34,って、ゴムは付けへんの？　あれ、紳士の嗜みやで？,sound/data/pcm/c43/h/71.unity3d,h_so_43_01_006
4,43,34,ウチ、今日はゴム付きの方が嬉しい気分やなぁ,sound/data/pcm/c43/h/71.unity3d,h_so_43_01_007
5,43,34,なあ、今日は妊娠率激高デーやねん。せやから、ゴム付けてな,sound/data/pcm/c43/h/71.unity3d,h_so_43_01_008
6,43,34,悪いけど、今日はアカン日やねん……でもゴム付きならオッケーやで,sound/data/pcm/c43/h/71.unity3d,h_so_43_01_009
7,43,34,ええ～～そっちぃ？　ま、まあええけどやなぁ……,sound/data/pcm/c43/h/71.unity3d,h_so_43_01_010
8,43,34,うーん……まあ、ちょっとは慣れたし……別にええけど……,sound/data/pcm/c43/h/71.unity3d,h_so_43_01_011
9,43,34,ストップ。気乗りしーひんから、お尻は止めにせぇへん？,sound/data/pcm/c43/h/71.unity3d,h_so_43_01_012
10,43,34,ちょっと怖いなぁ……やっぱお尻はやめとこか,sound/data/pcm/c43/h/71.unity3d,h_so_43_01_013
11,43,34,あ、奥まで来てるわぁ……,sound/data/pcm/c43/h/71.unity3d,h_so_43_01_014
12,43,34,おおっ、急に始めるやん……,sound/data/pcm/c43/h/71.unity3d,h_so_43_01_015
13,43,34,んはぁ、ちょっと、まだキツいなぁ……,sound/data/pcm/c43/h/71.unity3d,h_so_43_01_016
14,43,34,ええ？　ちょ、いきなり過ぎひん？,sound/data/pcm/c43/h/71.unity3d,h_so_43_01_017
15,43,34,はぁ……ちょっとキツいけど、気持ちええわぁ,sound/data/pcm/c43/h/71.unity3d,h_so_43_01_018
16,43,34,ちょっとせっかち過ぎひん？　一声あってもええと思うねんけど……,sound/data/pcm/c43/h/71.unity3d,h_so_43_01_021
17,43,34,んん、ちょっとキツい……かな？　いや、大丈夫……やと思う……,sound/data/pcm/c43/h/71.unity3d,h_so_43_01_023
18,43,34,うわっ、お尻にイキナリは反則ちゃう？　もっと優しゅうしてやぁ……,sound/data/pcm/c43/h/71.unity3d,h_so_43_01_025
19,43,34,いだだだだ……ってほどでもないけど……でもそういうの、アカンで,sound/data/pcm/c43/h/71.unity3d,h_so_43_01_026
20,43,34,……へんな間ぁ作るやん？　この時間、いる？　ウチは要らん思うなぁ……（間＝ま）,sound/data/pcm/c43/h/71.unity3d,h_so_43_01_027
21,43,34,何待ちなん？　これ……ウチの方はもう準備オッケーやで,sound/data/pcm/c43/h/71.unity3d,h_so_43_01_028
22,43,34,こうして、一つになった時間を満喫してんのやろ？　知らんけど,sound/data/pcm/c43/h/71.unity3d,h_so_43_01_029
23,43,34,……ひょっとして、ウチに動け言うてる？　いや、そんなん無理やで,sound/data/pcm/c43/h/71.unity3d,h_so_43_01_030
24,43,34,ずっぽり入ってる……うん、間違いなく、ウチのお尻の穴、挿入されとる……,sound/data/pcm/c43/h/71.unity3d,h_so_43_01_031
25,43,34,……挿れただけでイキそうになってる？　いや、流石にそんなことはあらへんか……,sound/data/pcm/c43/h/71.unity3d,h_so_43_01_032
26,43,34,へ？　なんなん？　したいことでも変わったん？,sound/data/pcm/c43/h/71.unity3d,h_so_43_01_033
27,43,34,ウチ、どないしたらええのん？　このままの体勢でええ？,sound/data/pcm/c43/h/71.unity3d,h_so_43_01_034
28,43,34,なんやねん、それ……どういうボケなんかわからん……,sound/data/pcm/c43/h/71.unity3d,h_so_43_01_036
29,43,34,何？　ちょっとだけ挿れてみたかったとか……そういう感じ？,sound/data/pcm/c43/h/71.unity3d,h_so_43_01_037
30,43,34,あー、その動かし方、めっちゃええ……だんだん興奮してまうわ……,sound/data/pcm/c43/h/71.unity3d,h_so_43_01_039
31,43,34,ちょうど気持ちええところに当たっとる……ああ、めっちゃええやん,sound/data/pcm/c43/h/71.unity3d,h_so_43_01_042
32,43,34,挿れたり出したり、ええ感じで気持ちええのが続いとる……気持ちええわぁ……,sound/data/pcm/c43/h/71.unity3d,h_so_43_01_043
33,43,34,ヤバい、ウチ、興奮して鼻息フンフン言わせてもうたわ……,sound/data/pcm/c43/h/71.unity3d,h_so_43_01_044
34,43,34,お尻の穴が、くちゅくちゅする……少し苦しいけど……続けてくれてええで,sound/data/pcm/c43/h/71.unity3d,h_so_43_01_045
35,43,34,ちょ、なんか焦ってない？　ウチのお尻、もっと優しぃしてーやぁ,sound/data/pcm/c43/h/71.unity3d,h_so_43_01_048
36,43,34,穴が、引っ張られて、裏返ってまいそうや……そないなったら、どないしよ？,sound/data/pcm/c43/h/71.unity3d,h_so_43_01_049
37,43,34,根本まで挿れられ、一気に引き抜かれて……ああ、ヤバい……お尻、気持ちええ……,sound/data/pcm/c43/h/71.unity3d,h_so_43_01_050
38,43,34,気持ちええ箇所が、増えてるやん……,sound/data/pcm/c43/h/71.unity3d,h_so_43_01_051
39,43,34,そんな盛りだくさんにせんでもエエんちゃう？　ウチ、感じすぎてまうで？,sound/data/pcm/c43/h/71.unity3d,h_so_43_01_053
40,43,34,うわっ、ちょ、待って……余計なことはせんでええって。苦手やねん、その弄り方……,sound/data/pcm/c43/h/71.unity3d,h_so_43_01_055
41,43,34,いや、それヤリ過ぎやて……ウチのあんま好きやないとこまで弄らんでエエ,sound/data/pcm/c43/h/71.unity3d,h_so_43_01_057
42,43,34,おおっ、ガッツリ来るやん？　　まだ少し苦しいけど……めっちゃエエ……,sound/data/pcm/c43/h/71.unity3d,h_so_43_01_059
43,43,34,あっ、ヤバっ、気持ちええ所をガンガンに刺激してきよる……うわ、マジヤバい……,sound/data/pcm/c43/h/71.unity3d,h_so_43_01_062
44,43,34,ウチ、お尻の穴で、感じてしまっとる……,sound/data/pcm/c43/h/71.unity3d,h_so_43_01_065
45,43,34,お腹の中が、持っていかれそうや……,sound/data/pcm/c43/h/71.unity3d,h_so_43_01_066
46,43,34,挿れられたまま腰をクネクネされたら……もうヤバいわ……,sound/data/pcm/c43/h/71.unity3d,h_so_43_01_067
47,43,34,おおう、その動き、お腹がヤバい……それやのに、お尻の穴は反応しとる……,sound/data/pcm/c43/h/71.unity3d,h_so_43_01_068
48,43,34,お尻の穴が、持っていかれそうやわ……なんか怖い……,sound/data/pcm/c43/h/71.unity3d,h_so_43_01_069
49,43,34,ずっぽりと根本まで入っとるやん……,sound/data/pcm/c43/h/71.unity3d,h_so_43_01_070
50,43,34,挿れながら出来るとか、自分、なんか器用やなぁ,sound/data/pcm/c43/h/71.unity3d,h_so_43_01_071
51,43,34,アカン、気持ちええところが、多い……！　こんなんガマンでけへんわ,sound/data/pcm/c43/h/71.unity3d,h_so_43_01_073
52,43,34,うっ、あ、あのな、気ぃ悪ぅせんとって……ウチが苦手なトコ、いじっとるで,sound/data/pcm/c43/h/71.unity3d,h_so_43_01_075
53,43,34,うぅん、なんか余計なことしよるなぁ……出し入れだけでええんとちゃう？,sound/data/pcm/c43/h/71.unity3d,h_so_43_01_077
54,43,34,この調子やったら、絶対イカされてまうわ……せやから、これ、続けたってな？,sound/data/pcm/c43/h/71.unity3d,h_so_43_01_087
55,43,34,あ～、ヤバいわぁ……気持ちええ……イクまでもうちょっとやな……,sound/data/pcm/c43/h/71.unity3d,h_so_43_01_088
56,43,34,あぁぁあ、そないに激しいことされたら、ウチもう無理やで……,sound/data/pcm/c43/h/71.unity3d,h_so_43_01_089
57,43,34,ウチ、イキそうや……できたら自分と一緒にイキたいけど……,sound/data/pcm/c43/h/71.unity3d,h_so_43_01_090
58,43,34,イキそうなん？　ほな、このまま好きにしてええで……たっぷり気持ちよぉなって……,sound/data/pcm/c43/h/71.unity3d,h_so_43_01_091
59,43,34,イキそうになっとるんやろ？　わかっとる……ウチでいっぱい気持ちよぉなってな？,sound/data/pcm/c43/h/71.unity3d,h_so_43_01_092
60,43,34,ええで、そのままガンガンに腰つかって、豪快にイッたってや,sound/data/pcm/c43/h/71.unity3d,h_so_43_01_093
61,43,34,中でビクンビクン震えとる……イキそうなら我慢せんでええから,sound/data/pcm/c43/h/71.unity3d,h_so_43_01_094
62,43,34,アカン、お尻でイッてまいそうや……もう、なんでこんないやらしい身体になってしもたん？,sound/data/pcm/c43/h/71.unity3d,h_so_43_01_095
63,43,34,お尻、めっちゃええ……アカンアカン、このままやと、順当に変態の仲間入りしてまうっ,sound/data/pcm/c43/h/71.unity3d,h_so_43_01_096
64,43,34,お尻の穴がスルスル擦り付けられる……ああ、感じてまう……,sound/data/pcm/c43/h/71.unity3d,h_so_43_01_097
65,43,34,自分のモノ、お尻の穴にキッチリとハマっとる……ああ、もうガマンでけへんかも……,sound/data/pcm/c43/h/71.unity3d,h_so_43_01_098
66,43,34,自分がそないに、ウチのお尻の穴で愉しんでくれるとはなぁ……なんか信じられへんわ,sound/data/pcm/c43/h/71.unity3d,h_so_43_01_099
67,43,34,イクん堪えてんちゃう？　そんなんええから、気持ちよくなってな……ウチのお尻で,sound/data/pcm/c43/h/71.unity3d,h_so_43_01_100
68,43,34,ウチのお尻、そないに気に入ってくれてんな？　素直に喜んでええのか微妙やわ,sound/data/pcm/c43/h/71.unity3d,h_so_43_01_101
69,43,34,中でビクビクしよるけど、イクの堪えとるん？　我慢は身体に良くないで,sound/data/pcm/c43/h/71.unity3d,h_so_43_01_102
70,43,34,なんか、イキやすぅなっとるみたいや、ウチ、こののまま気持ちよぉならせてもらうで……！,sound/data/pcm/c43/h/71.unity3d,h_so_43_01_103
71,43,34,ごめんやけど、ウチ、イカせてもうらな？　もうアカンみたいやわ……！,sound/data/pcm/c43/h/71.unity3d,h_so_43_01_104
72,43,34,なあ、二人で一緒にイケそうなんちゃう？　このままタイミング合わせてイこかっ……！,sound/data/pcm/c43/h/71.unity3d,h_so_43_01_105
73,43,34,一人でイクより、二人で一緒がええわっ、なあ、そない思うやろっ……！,sound/data/pcm/c43/h/71.unity3d,h_so_43_01_106
74,43,34,ええで……ウチの中、ぜーんぶ出してぇ,sound/data/pcm/c43/h/71.unity3d,h_so_43_01_107
75,43,34,ええよ……ウチも中で感じるん好きや……,sound/data/pcm/c43/h/71.unity3d,h_so_43_01_108
76,43,34,出したいところに出しい、自分の自由や,sound/data/pcm/c43/h/71.unity3d,h_so_43_01_109
77,43,34,ウチなら全然かまへんで……さ、たっぷりぶちまけーやぁ,sound/data/pcm/c43/h/71.unity3d,h_so_43_01_110
78,43,34,ゴムはちゃんとくっついとる？　ほな、なーんも心配ないな,sound/data/pcm/c43/h/71.unity3d,h_so_43_01_113
79,43,34,ゴム付けてんねんから、遠慮せんでええで？　たっぷり出しぃ,sound/data/pcm/c43/h/71.unity3d,h_so_43_01_114
80,43,34,ごめんやけど、お尻の穴でイカさせてもらうでぇ……！,sound/data/pcm/c43/h/71.unity3d,h_so_43_01_115
81,43,34,ああ、認めなあかんっ、ウチお尻で感じてイッてしまうわ……！,sound/data/pcm/c43/h/71.unity3d,h_so_43_01_116
82,43,34,お尻で一緒にイキそうとか、ウチら本当に変態の仲間入りやんっ……！,sound/data/pcm/c43/h/71.unity3d,h_so_43_01_117
83,43,34,自分がイクなら、ウチもお尻でイクわ……っ！,sound/data/pcm/c43/h/71.unity3d,h_so_43_01_118
84,43,34,ええで……お尻の穴に出しぃ,sound/data/pcm/c43/h/71.unity3d,h_so_43_01_119
85,43,34,妊娠の心配はないし……全然問題ないで,sound/data/pcm/c43/h/71.unity3d,h_so_43_01_120
86,43,34,うわわっ、射精の勢い、エゲツナイ……,sound/data/pcm/c43/h/71.unity3d,h_so_43_01_121
87,43,34,熱い精液で、ウチの中がいっぱいになってまう,sound/data/pcm/c43/h/71.unity3d,h_so_43_01_122
88,43,34,ゴムの中に精液が溜まっていっとる……,sound/data/pcm/c43/h/71.unity3d,h_so_43_01_123
89,43,34,ゴムがどんどん膨らんでるわ……,sound/data/pcm/c43/h/71.unity3d,h_so_43_01_124
90,43,34,お尻だからって、容赦なく出すやん……,sound/data/pcm/c43/h/71.unity3d,h_so_43_01_125
91,43,34,おおお～、お腹の中が、精液だらけにされてるわ,sound/data/pcm/c43/h/71.unity3d,h_so_43_01_126
92,43,34,ゴムつけてても気持ちええもんやな……なんか、めっちゃ満たされた気分や,sound/data/pcm/c43/h/71.unity3d,h_so_43_01_131
93,43,34,ゴムの中がタプタプや……そない興奮してたん？,sound/data/pcm/c43/h/71.unity3d,h_so_43_01_132
94,43,34,はぁ、はぁ……ウチも生でして、感じ過ぎてたみたいやわ……,sound/data/pcm/c43/h/71.unity3d,h_so_43_01_133
95,43,34,中に出されると……なんか幸せになるんわ、ウチが変態やからかなぁ？,sound/data/pcm/c43/h/71.unity3d,h_so_43_01_134
96,43,34,危険日の中出しかぁ……はぁ、どんな未来が待っとるんやろなぁ,sound/data/pcm/c43/h/71.unity3d,h_so_43_01_135
97,43,34,ふぅ……ちょっとヤバいかな？　いや、今更妊娠の心配しても始まらんか……,sound/data/pcm/c43/h/71.unity3d,h_so_43_01_136
98,43,34,ごめん、完全にイカされてもうたわ……いやー、もうちょっとガマンしたかってんけどなぁ,sound/data/pcm/c43/h/71.unity3d,h_so_43_01_137
99,43,34,はぁ～……我慢できひんかったのが情けないわ……ほんま、堪忍やで,sound/data/pcm/c43/h/71.unity3d,h_so_43_01_138
100,43,34,まあ……お互いイケて良かったんちゃう？　お尻やけど,sound/data/pcm/c43/h/71.unity3d,h_so_43_01_139
101,43,34,なんかもう普通にお尻でするんが当たり前になってまいそうやわ,sound/data/pcm/c43/h/71.unity3d,h_so_43_01_140
102,43,34,ウチだけお尻でイクとか……ウチの方がお尻好きみたいやん……,sound/data/pcm/c43/h/71.unity3d,h_so_43_01_141
103,43,34,なんかお尻の穴で、イクん我慢するん苦手かも……しんどいわ,sound/data/pcm/c43/h/71.unity3d,h_so_43_01_142
104,43,34,はぁ、ゴム……もっと欲しいな……あったらあるだけ使ってまうやろけど,sound/data/pcm/c43/h/71.unity3d,h_so_43_01_143
105,43,34,なんかゴム越しに自分の全部が伝わってくるわ……,sound/data/pcm/c43/h/71.unity3d,h_so_43_01_144
106,43,34,うわぁ、自分の体温が、そのままウチのお腹の中に引っ越ししてきよる……,sound/data/pcm/c43/h/71.unity3d,h_so_43_01_145
107,43,34,……一緒にイクんが、一番気持ちええんかもしらんね。次も、一緒がええなぁ……,sound/data/pcm/c43/h/71.unity3d,h_so_43_01_146
108,43,34,はぁ……妊娠の心配よりも先に、満足感が湧いてきよる……,sound/data/pcm/c43/h/71.unity3d,h_so_43_01_147
109,43,34,危険日に、あえて中出しできる自分のこと、ウチ、ほんま尊敬できるわぁ……,sound/data/pcm/c43/h/71.unity3d,h_so_43_01_148
110,43,34,はー……息するだけで、アソコがジンジンしてまうわ……あー、気持ちよかったぁ……,sound/data/pcm/c43/h/71.unity3d,h_so_43_01_149
111,43,34,はぁ、はぁ……ウチ、感じ過ぎとちゃう？　感度良すぎて心配なるわ,sound/data/pcm/c43/h/71.unity3d,h_so_43_01_150
112,43,34,お尻の穴で、一緒にイケるなんて……どんだけ相性ええねん、ウチら……,sound/data/pcm/c43/h/71.unity3d,h_so_43_01_151
113,43,34,お尻でも、一緒にイケたんは……嬉しいもんやね,sound/data/pcm/c43/h/71.unity3d,h_so_43_01_152
114,43,34,はぁ……自分、お尻を攻める天才なん？　悔しいけど気持ち良かったわ……,sound/data/pcm/c43/h/71.unity3d,h_so_43_01_153
115,43,34,なんかお尻の穴、敏感になっとるわ……これが開発されてるってことなんかいな,sound/data/pcm/c43/h/71.unity3d,h_so_43_01_154
116,43,34,抜く時に、ゴムが中に残って、精液がこぼれる……っちゅうこともあるそうやで,sound/data/pcm/c43/h/71.unity3d,h_so_43_01_155
117,43,34,ゴムの中で、精液がぷるぷる震えとる……よーけ出してんなぁ、自分……,sound/data/pcm/c43/h/71.unity3d,h_so_43_01_156
118,43,34,うわっ、お腹、重たい……これ、精液の重さなん？,sound/data/pcm/c43/h/71.unity3d,h_so_43_01_157
119,43,34,はー、たっぷり出したなぁ……なんなん？　ウチを妊娠させる気ぃなん？,sound/data/pcm/c43/h/71.unity3d,h_so_43_01_158
120,43,34,気のせいか、中に出されてから身体がずっと火照ってる気ぃするわ……,sound/data/pcm/c43/h/71.unity3d,h_so_43_01_159
121,43,34,危険日やから興奮して、こないにタップリ出したんちゃうん？,sound/data/pcm/c43/h/71.unity3d,h_so_43_01_160
122,43,34,ゴムの安心感が、ウチを余計に気持ちよぉしてくれたんかもしらんね,sound/data/pcm/c43/h/71.unity3d,h_so_43_01_161
123,43,34,ゴム、外さんでええ？　ほんならこのままもうちょっとジーっとしとこーかぁ……,sound/data/pcm/c43/h/71.unity3d,h_so_43_01_162
124,43,34,で……このまま続きするん？　それとも体位とか変えたりするん？,sound/data/pcm/c43/h/71.unity3d,h_so_43_01_163
125,43,34,自分の肌の触れ心地、めっちゃええ……,sound/data/pcm/c43/h/71.unity3d,h_so_43_01_164
126,43,34,……あのな？　もし妊娠したら、自分、ウチと一緒におってくれる？,sound/data/pcm/c43/h/71.unity3d,h_so_43_01_165
127,43,34,まあ、とりあえず妊娠のことは考えんようにしよ……ちょっと疲れたわ……,sound/data/pcm/c43/h/71.unity3d,h_so_43_01_166
128,43,34,なんか、身体中が自分のこと、求めてんねんなぁ……そらぁイカされるっちゅうねん,sound/data/pcm/c43/h/71.unity3d,h_so_43_01_167
129,43,34,まだまだエッチに慣れてないのに、ここまで気持ちよぉてええんかなぁ,sound/data/pcm/c43/h/71.unity3d,h_so_43_01_168
130,43,34,はぁ……まだお尻がじんじんしとる……余韻がすごいわ,sound/data/pcm/c43/h/71.unity3d,h_so_43_01_169
131,43,34,ウチがお尻エッチにはまってしもうたら、責任とってな？,sound/data/pcm/c43/h/71.unity3d,h_so_43_01_170
132,43,34,なんかお腹がジンワリ熱い……お尻セックスって内臓に負担がかかってるんかもしらんね,sound/data/pcm/c43/h/71.unity3d,h_so_43_01_171
133,43,34,どんんだけ貯めとったん？　量がすごいわ,sound/data/pcm/c43/h/71.unity3d,h_so_43_01_172
134,43,34,うわぁ、出てる出てる……豪快やなぁ,sound/data/pcm/c43/h/71.unity3d,h_so_43_01_173
135,43,34,ま、ウチでよぉなってくれたみたいで良かったわ,sound/data/pcm/c43/h/71.unity3d,h_so_43_01_174
136,43,34,自分の精液のにおい、ほんと濃いわぁ……,sound/data/pcm/c43/h/71.unity3d,h_so_43_01_175
137,43,34,もしかして、まだまだ出せんの？　どこにそない溜まっとるん……？,sound/data/pcm/c43/h/71.unity3d,h_so_43_01_176
138,43,34,うわぁ……抜いただけで、めっさ垂れてくるやん……,sound/data/pcm/c43/h/71.unity3d,h_so_43_01_177
139,43,34,こんなに出すとか……自分、もうちょっとウチをいたわらんといかんで……,sound/data/pcm/c43/h/71.unity3d,h_so_43_01_178
140,43,34,お尻の穴が熱い……なんか溶け出してきたみたいやわ……,sound/data/pcm/c43/h/71.unity3d,h_so_43_01_179
141,43,34,お尻の穴が開きっぱなしや……さすがにこれは恥ずかしいわ……,sound/data/pcm/c43/h/71.unity3d,h_so_43_01_180
142,43,34,ゴムはまだまだあるから、好きなだけ出しぃ,sound/data/pcm/c43/h/71.unity3d,h_so_43_01_252
143,43,34,ええで、このままゴムに出したってぇ,sound/data/pcm/c43/h/71.unity3d,h_so_43_01_253
