管理番号,大きい項目,中間項目,表示名,バンドルパス,ファイル名
0,31,32,おまえが大きくしているのを見ると、なんだか嬉しくなるな……,sound/data/pcm/c31/h/01.unity3d,h_hh_31_01_000
1,31,32,ぴくぴく震えて……フフッ、今日も元気そうだな,sound/data/pcm/c31/h/01.unity3d,h_hh_31_01_001
2,31,32,前より、また少し大きくなっているような……ここも、揉まれると大きくなるとか、あるのか？,sound/data/pcm/c31/h/01.unity3d,h_hh_31_01_002
3,31,32,少し焦らし過ぎ、だろうか？,sound/data/pcm/c31/h/01.unity3d,h_hh_31_01_003
4,31,32,プルプル震えて……ふふ、何だか可愛いな,sound/data/pcm/c31/h/01.unity3d,h_hh_31_01_004
5,31,32,おまえの、熱いな……きつくないか？,sound/data/pcm/c31/h/01.unity3d,h_hh_31_01_006
6,31,32,感じているんだろう？　素直に言ったら、もっとしてやるぞ,sound/data/pcm/c31/h/01.unity3d,h_hh_31_01_007
7,31,32,れるっ、舌で舐めると、熱いのがよくわかるな……れぉっ,sound/data/pcm/c31/h/01.unity3d,h_hh_31_01_009
8,31,32,うぁっ、もう唾液で、べとべとだ……舐めてないところなんて、ないんじゃないかっ,sound/data/pcm/c31/h/01.unity3d,h_hh_31_01_011
9,31,32,んぶっ、口の中で、おまえのが、大きくなってる……,sound/data/pcm/c31/h/01.unity3d,h_hh_31_01_013
10,31,32,んぐっ、顎、外れそうだ……あまり大きく、し過ぎるなっ……,sound/data/pcm/c31/h/01.unity3d,h_hh_31_01_015
11,31,32,案外、ここは柔らかいままなのだな……うぁっ、そ、そうでもないか……,sound/data/pcm/c31/h/01.unity3d,h_hh_31_01_017
12,31,32,ビクビク、凄くなってきたぞ,sound/data/pcm/c31/h/01.unity3d,h_hh_31_01_019
13,31,32,手でした後は、おまえの感触がしばらく残って……その、落ち着かなくなる……,sound/data/pcm/c31/h/01.unity3d,h_hh_31_01_021
14,31,32,あぁっ、血管が、浮き出てっ……皆こうなるものなのか？,sound/data/pcm/c31/h/01.unity3d,h_hh_31_01_023
15,31,32,うぅん……いまいち、気持ちよくできているか、わかりにくいな……,sound/data/pcm/c31/h/01.unity3d,h_hh_31_01_025
16,31,32,ここも、動くものなんだな……私が舐めて、動かしているだけか？,sound/data/pcm/c31/h/01.unity3d,h_hh_31_01_027
17,31,32,本当に感じるところなのか？　私をからかったり、していないだろうな？,sound/data/pcm/c31/h/01.unity3d,h_hh_31_01_029
18,31,32,加減はわかってきたが、どうしても不安は残るな……,sound/data/pcm/c31/h/01.unity3d,h_hh_31_01_031
19,31,32,こら、きちんと洗ってこなかったのか？　少し、おしっこの味がしたぞ？,sound/data/pcm/c31/h/01.unity3d,h_hh_31_01_033
20,31,32,真っ赤になっているのは、充血しているのだよな？　乳首みたいな、ものか？,sound/data/pcm/c31/h/01.unity3d,h_hh_31_01_035
21,31,32,もっと口、すぼめた方が、気持ちいいか？,sound/data/pcm/c31/h/01.unity3d,h_hh_31_01_037
22,31,32,ぐぶっ、太くなったら、長くもなるのだよなっ、けほっ、忘れていた,sound/data/pcm/c31/h/01.unity3d,h_hh_31_01_039
23,31,32,おまえの熱が移ったかな……私まで、胸が熱くなってきた……,sound/data/pcm/c31/h/01.unity3d,h_hh_31_01_041
24,31,32,ほら、先っぽからあのお汁出して、滑りをよくした方が、気持ちよくなるぞ,sound/data/pcm/c31/h/01.unity3d,h_hh_31_01_043
25,31,32,小さい分、感度はいいからな、私もおまえのが擦れて、気持ちよくなれてるぞ,sound/data/pcm/c31/h/01.unity3d,h_hh_31_01_045
26,31,32,こんな小さい胸でも、求めてくれて、嬉しくなるな……,sound/data/pcm/c31/h/01.unity3d,h_hh_31_01_046
27,31,32,良い感じの、重量感だろ？　たぽたぽって、いやらしい音、聞かせてやるっ,sound/data/pcm/c31/h/01.unity3d,h_hh_31_01_047
28,31,32,こう、激しく動かすと、垂れないように気をつけるの、大変なんだぞっ,sound/data/pcm/c31/h/01.unity3d,h_hh_31_01_048
29,31,32,少しずつ、わかってきたぞ、要はリズムの問題だなっ,sound/data/pcm/c31/h/01.unity3d,h_hh_31_01_049
30,31,32,これでおまえを、イカせられたら、少し自信がつきそうだな,sound/data/pcm/c31/h/01.unity3d,h_hh_31_01_051
31,31,32,なぁこれ、やはり舐めるだけで……いいだろ……私だって、傷つくぞ……,sound/data/pcm/c31/h/01.unity3d,h_hh_31_01_053
32,31,32,これでも一生懸命やっているんだ、笑ったら、絶対に許さないからなっ,sound/data/pcm/c31/h/01.unity3d,h_hh_31_01_054
33,31,32,たぷたぷぺろぺろと……これは、見た目だけでも、かなり卑猥だな,sound/data/pcm/c31/h/01.unity3d,h_hh_31_01_055
34,31,32,激しくしても、胸でしっかり挟んでいられるから、舐めやすくて助かるな,sound/data/pcm/c31/h/01.unity3d,h_hh_31_01_056
35,31,32,コツは掴んできたと思うが……気持ちいいか？,sound/data/pcm/c31/h/01.unity3d,h_hh_31_01_057
36,31,32,激しくするのは、まだ、難しいなっ,sound/data/pcm/c31/h/01.unity3d,h_hh_31_01_059
37,31,32,やっぱり咥えるだけにしないか？　自分が情けなくなってきた……,sound/data/pcm/c31/h/01.unity3d,h_hh_31_01_061
38,31,32,もの足りなくならないように、お口だけでも、頑張るからな,sound/data/pcm/c31/h/01.unity3d,h_hh_31_01_062
39,31,32,ほら、大きい事は良い事だろ、口も大きく開けて、咥えてやる,sound/data/pcm/c31/h/01.unity3d,h_hh_31_01_063
40,31,32,口でも、胸でも、しっかり気持ちよくしてやるからな,sound/data/pcm/c31/h/01.unity3d,h_hh_31_01_064
41,31,32,あぁ出せっ、精液の匂い、嗅がせてくれっ,sound/data/pcm/c31/h/01.unity3d,h_hh_31_01_074
42,31,32,舌を離したら、射精していい合図だぞっ、それまで頑張れっ,sound/data/pcm/c31/h/01.unity3d,h_hh_31_01_077
43,31,32,射精する瞬間は、だいたいわかったから、おまえは気持ちよくなる事だけ、考えていていいぞ,sound/data/pcm/c31/h/01.unity3d,h_hh_31_01_080
44,31,32,うん、どれだけ出しても、全部飲んでやるから、変な気を使うなよ,sound/data/pcm/c31/h/01.unity3d,h_hh_31_01_083
45,31,32,人をイカせるのって、何だか楽しいんだよな,sound/data/pcm/c31/h/01.unity3d,h_hh_31_01_089
46,31,32,あはっ、マーキングされてしまったな……これで私は、おまえのメスか？,sound/data/pcm/c31/h/01.unity3d,h_hh_31_01_091
47,31,32,たまにこう、無性にこれが飲みたくなる時があったりしてな……お、おかしいよな？,sound/data/pcm/c31/h/01.unity3d,h_hh_31_01_092
48,31,32,おまえが出したものなら、いつでも飲み込んでやるよ、フフッ、最初からこんな事を言う女は、なかなかいないぞ？,sound/data/pcm/c31/h/01.unity3d,h_hh_31_01_093
49,31,32,おまえが感じてくれた証……大量だな,sound/data/pcm/c31/h/01.unity3d,h_hh_31_01_095
50,31,32,見ているだけで、むずむずしてくるな……,sound/data/pcm/c31/h/01.unity3d,h_hh_31_01_096
