管理番号,大きい項目,中間項目,表示名,バンドルパス,ファイル名
0,42,50,ねぇねぇ、早くしよー？　エッチしたくて待ちきれないよぉ,sound/data/pcm/c42/h/71.unity3d,h_ka_42_03_000
1,42,50,はぅ……お腹の奥が熱くなって我慢できなくなりそうかもー,sound/data/pcm/c42/h/71.unity3d,h_ka_42_03_001
2,42,50,えへへ、いっぱいキミの大っきいので気持ち良くしてねー？,sound/data/pcm/c42/h/71.unity3d,h_ka_42_03_002
3,42,50,うん、いいよぉたっぷりと、おちんちんを搾り取っちゃうねー,sound/data/pcm/c42/h/71.unity3d,h_ka_42_03_003
4,42,50,わかったぁ。もっとドピュってさせれば良いんだね？　えへへ,sound/data/pcm/c42/h/71.unity3d,h_ka_42_03_004
5,42,50,うん、もっとしよぉ？　私のおまんこも、もっと欲しいっていってるよぉ,sound/data/pcm/c42/h/71.unity3d,h_ka_42_03_005
6,42,50,うんうん、もっとズボズボしよ？　途中でやめるのはダメだからねー？,sound/data/pcm/c42/h/71.unity3d,h_ka_42_03_006
7,42,50,もちろん良いよ！　いっぱい気持ちよくしてねー？,sound/data/pcm/c42/h/71.unity3d,h_ka_42_03_007
8,42,50,えへへ、キミに体を攻められるの、大好きー,sound/data/pcm/c42/h/71.unity3d,h_ka_42_03_008
9,42,50,気持ち良すぎて変になっちゃうくらい、してほしいなー……？,sound/data/pcm/c42/h/71.unity3d,h_ka_42_03_009
10,42,50,ご奉仕させてくれるのー？　えへへ、何度でもイかせてあげるー,sound/data/pcm/c42/h/71.unity3d,h_ka_42_03_010
11,42,50,いいよー。私のご奉仕で、いっぱい出してねぇ,sound/data/pcm/c42/h/71.unity3d,h_ka_42_03_011
12,42,50,うんっ。ご期待通り、キミをいっぱい感じさせてあげるねー？,sound/data/pcm/c42/h/71.unity3d,h_ka_42_03_012
13,42,50,えへへ、もちろん良いよー。早くぅ、早くぅ……一つになろっ？,sound/data/pcm/c42/h/71.unity3d,h_ka_42_03_013
14,42,50,いいよ、いいよっ、いっぱいエッチしようねっ,sound/data/pcm/c42/h/71.unity3d,h_ka_42_03_014
15,42,50,えへへ、どーぞ。一緒にたくさん気持ち良くなろうね？,sound/data/pcm/c42/h/71.unity3d,h_ka_42_03_015
16,42,50,生のおちんちんでしたいけど、ゴムは付けないとダメだよー？,sound/data/pcm/c42/h/71.unity3d,h_ka_42_03_016
17,42,50,ごめんねー？　赤ちゃん出来ちゃうかもしれない日だし、ゴムしようねっ,sound/data/pcm/c42/h/71.unity3d,h_ka_42_03_017
18,42,50,今日は安全だから、ゴムしないでいっぱいしよー？,sound/data/pcm/c42/h/71.unity3d,h_ka_42_03_018
19,42,50,恋人なんだしゴムなんて必要ないよぉ。だから、生おちんちんでしよ……？,sound/data/pcm/c42/h/71.unity3d,h_ka_42_03_019
20,42,50,違うことするの？　じゃあどうぞー,sound/data/pcm/c42/h/71.unity3d,h_ka_42_03_020
21,42,50,いいよ。キミのしたいことをしよー？,sound/data/pcm/c42/h/71.unity3d,h_ka_42_03_021
22,42,50,私がたっぷりとキミから搾り取ってあげるっ,sound/data/pcm/c42/h/71.unity3d,h_ka_42_03_022
23,42,50,気持ちいいこと、私からいーっぱいするねぇ？,sound/data/pcm/c42/h/71.unity3d,h_ka_42_03_023
24,42,50,いいよぉ、私がいないとダメな身体にしてあげるね……？,sound/data/pcm/c42/h/71.unity3d,h_ka_42_03_024
25,42,50,わかったぁ。えへへ、キミの好きなポーズを取ってあげるー,sound/data/pcm/c42/h/71.unity3d,h_ka_42_03_025
26,42,50,そういうのがいいのぉ？　少しわくわくするかもぉ,sound/data/pcm/c42/h/71.unity3d,h_ka_42_03_026
27,42,50,恥ずかしいポーズになったら、もっとエッチな気分になっちゃうよぉ,sound/data/pcm/c42/h/71.unity3d,h_ka_42_03_027
28,42,50,キミが興奮してくれるなら、恥ずかしい恰好もへっちゃらだよ,sound/data/pcm/c42/h/71.unity3d,h_ka_42_03_028
29,42,50,うん、おちんちんをいっぱいコシコシすれば良いんだねー,sound/data/pcm/c42/h/71.unity3d,h_ka_42_03_029
30,42,50,いっぱい弄り回してぇ、すぐにドピュってさせてあげるー,sound/data/pcm/c42/h/71.unity3d,h_ka_42_03_030
31,42,50,やったぁ、お口でおちんちんを気持ち良くすれば良いんだねっ,sound/data/pcm/c42/h/71.unity3d,h_ka_42_03_031
32,42,50,私のお口でドピュって出したいの？　えへへ、いいよー,sound/data/pcm/c42/h/71.unity3d,h_ka_42_03_032
33,42,50,おっぱいが良いんだぁ？　いいよぉ、いっぱい気持ち良くしてあげるー,sound/data/pcm/c42/h/71.unity3d,h_ka_42_03_033
34,42,50,うんっ。それじゃあ、おっぱいでドピュってするまでご奉仕するねー,sound/data/pcm/c42/h/71.unity3d,h_ka_42_03_034
35,42,50,はぅ……興奮しちゃって、ドキドキがおさまらないよぉ,sound/data/pcm/c42/h/71.unity3d,h_ka_42_03_035
36,42,50,もっとたくさん、エッチなことしよーねぇ,sound/data/pcm/c42/h/71.unity3d,h_ka_42_03_036
37,42,50,キミが嫌って言っても、もうやめてあげないからねー？,sound/data/pcm/c42/h/71.unity3d,h_ka_42_03_037
38,42,50,私がキミのおちんちんを、たっぷりと気持ち良くしてあげるねー,sound/data/pcm/c42/h/71.unity3d,h_ka_42_03_038
39,42,50,あぅ……ねぇ、早くぅ切ないよぉ……,sound/data/pcm/c42/h/71.unity3d,h_ka_42_03_039
40,42,50,なぁに？　そんなに見られると我慢できなくなっちゃうよぉ,sound/data/pcm/c42/h/71.unity3d,h_ka_42_03_040
41,42,50,こんな恥ずかしいポーズしてたら、お腹の奥がきゅんきゅんしちゃうよぉ,sound/data/pcm/c42/h/71.unity3d,h_ka_42_03_041
42,42,50,ねぇ、早くして……？　焦らされると、エッチな気持ちになっちゃうからぁ,sound/data/pcm/c42/h/71.unity3d,h_ka_42_03_042
43,42,50,キミのおちんちん、早く入れてぇねぇ、早く、早くぅ,sound/data/pcm/c42/h/71.unity3d,h_ka_42_03_043
44,42,50,これだと、おちんちんが入るところがハッキリ見えるし、すごいエッチだよぉ……,sound/data/pcm/c42/h/71.unity3d,h_ka_42_03_044
45,42,50,後ろからだと、おちんちんを深いところまで感じられるんだぁ。今からドキドキしちゃう……,sound/data/pcm/c42/h/71.unity3d,h_ka_42_03_045
46,42,50,後ろから激しくされちゃうのかなぁ？　想像したら、お腹が疼いちゃってるぅ,sound/data/pcm/c42/h/71.unity3d,h_ka_42_03_046
47,42,50,恥ずかしいのが気持ちいいんだー。だから、これも好きぃ,sound/data/pcm/c42/h/71.unity3d,h_ka_42_03_047
48,42,50,こんなポーズだと、私……もっとエッチになっちゃうかもぉ……,sound/data/pcm/c42/h/71.unity3d,h_ka_42_03_048
