管理番号,大きい項目,中間項目,表示名,バンドルパス,ファイル名
188,18,44,危ない日にナマは……まだ、ダメです,sound/data/pcm/c18/h/01.unity3d,h_so_18_02_188
189,18,44,私も、あなたを気持ちよくしてあげたいから,sound/data/pcm/c18/h/01.unity3d,h_so_18_02_189
190,18,44,また、お尻で気持ちよくなってください,sound/data/pcm/c18/h/01.unity3d,h_so_18_02_190
191,18,44,これ以上は、壊れちゃいます,sound/data/pcm/c18/h/01.unity3d,h_so_18_02_191
192,18,44,ちょっと、お尻は、休ませてください……,sound/data/pcm/c18/h/01.unity3d,h_so_18_02_192
193,18,44,んっ、いいですっ,sound/data/pcm/c18/h/01.unity3d,h_so_18_02_193
194,18,44,おまんこ、あなたの形になっちゃってますっ……,sound/data/pcm/c18/h/01.unity3d,h_so_18_02_194
195,18,44,突き入れられるのっ、すきぃっ,sound/data/pcm/c18/h/01.unity3d,h_so_18_02_195
196,18,44,またっ、おちんちん、来ましたっ,sound/data/pcm/c18/h/01.unity3d,h_so_18_02_196
197,18,44,イッたばっかりなのに、おちんちん、頑張ってくれてますっ,sound/data/pcm/c18/h/01.unity3d,h_so_18_02_197
198,18,44,んっ、また、ずん、ってされてますっ,sound/data/pcm/c18/h/01.unity3d,h_so_18_02_198
199,18,44,そんなにされると、お尻大好きになっちゃいますっ,sound/data/pcm/c18/h/01.unity3d,h_so_18_02_199
200,18,44,んっ、また、お尻ぃっ,sound/data/pcm/c18/h/01.unity3d,h_so_18_02_200
201,18,44,後ろの穴で、気持ち良くなってくださいっ,sound/data/pcm/c18/h/01.unity3d,h_so_18_02_201
202,18,44,入ってるだけなのに、感じちゃいます,sound/data/pcm/c18/h/01.unity3d,h_so_18_02_202
203,18,44,ずっと、このままでもいいかも,sound/data/pcm/c18/h/01.unity3d,h_so_18_02_203
204,18,44,お尻、締まっちゃいます,sound/data/pcm/c18/h/01.unity3d,h_so_18_02_204
205,18,44,わたしのお尻、どうですか？,sound/data/pcm/c18/h/01.unity3d,h_so_18_02_205
206,18,44,お好きなように、どうぞ,sound/data/pcm/c18/h/01.unity3d,h_so_18_02_206
207,18,44,あなたの望むままに、したいです,sound/data/pcm/c18/h/01.unity3d,h_so_18_02_207
208,18,44,お尻……あんまり見ないで,sound/data/pcm/c18/h/01.unity3d,h_so_18_02_208
209,18,44,抜かれる感覚、好きかも,sound/data/pcm/c18/h/01.unity3d,h_so_18_02_209
210,18,44,優しくされるの、好き……,sound/data/pcm/c18/h/01.unity3d,h_so_18_02_210
211,18,44,ゆっくりでも気持ちいい,sound/data/pcm/c18/h/01.unity3d,h_so_18_02_211
212,18,44,速くされるの好きですぅ,sound/data/pcm/c18/h/01.unity3d,h_so_18_02_212
213,18,44,たくさんピストンしてください,sound/data/pcm/c18/h/01.unity3d,h_so_18_02_213
214,18,44,後ろの穴優しくされちゃってまさ,sound/data/pcm/c18/h/01.unity3d,h_so_18_02_214
215,18,44,ゆっくりだと、お尻の穴きゅんきゅんしちゃう,sound/data/pcm/c18/h/01.unity3d,h_so_18_02_215
216,18,44,ピストン、速すぎます,sound/data/pcm/c18/h/01.unity3d,h_so_18_02_216
217,18,44,たくさん、お尻激しくしてください,sound/data/pcm/c18/h/01.unity3d,h_so_18_02_217
218,18,44,強くされてるのに、優しい,sound/data/pcm/c18/h/01.unity3d,h_so_18_02_218
219,18,44,おちんちん、すごく熱い……,sound/data/pcm/c18/h/01.unity3d,h_so_18_02_219
220,18,44,中があなたので広げられてます,sound/data/pcm/c18/h/01.unity3d,h_so_18_02_220
221,18,44,必死に腰振ってくれてます、嬉しいっ,sound/data/pcm/c18/h/01.unity3d,h_so_18_02_221
222,18,44,お尻の中、おちんちんの形になっちゃう,sound/data/pcm/c18/h/01.unity3d,h_so_18_02_222
223,18,44,お尻、堪能してくださいねっ,sound/data/pcm/c18/h/01.unity3d,h_so_18_02_223
224,18,44,お尻に乱暴されて、いいのっ,sound/data/pcm/c18/h/01.unity3d,h_so_18_02_224
225,18,44,激しくて、お尻ゆるゆるになっちゃいます,sound/data/pcm/c18/h/01.unity3d,h_so_18_02_225
226,18,44,またエッチになっちゃってますっ,sound/data/pcm/c18/h/01.unity3d,h_so_18_02_226
227,18,44,また絶頂、しちゃいますっ,sound/data/pcm/c18/h/01.unity3d,h_so_18_02_227
228,18,44,すごいの、上ってきてますっ,sound/data/pcm/c18/h/01.unity3d,h_so_18_02_228
229,18,44,イッちゃう、きちゃいますっ,sound/data/pcm/c18/h/01.unity3d,h_so_18_02_229
230,18,44,気持ちいいんですね、目がとろんってしてます,sound/data/pcm/c18/h/01.unity3d,h_so_18_02_230
231,18,44,またきもちよくなってくれてますっ,sound/data/pcm/c18/h/01.unity3d,h_so_18_02_231
232,18,44,もっと、もーっと激しくしてくださいっ,sound/data/pcm/c18/h/01.unity3d,h_so_18_02_232
233,18,44,おちんちんで、私のおまんこ壊してぇっ,sound/data/pcm/c18/h/01.unity3d,h_so_18_02_233
234,18,44,お尻いじめられて、感じちゃってますっ,sound/data/pcm/c18/h/01.unity3d,h_so_18_02_234
235,18,44,いいですっ、お尻穿られるのいいっ,sound/data/pcm/c18/h/01.unity3d,h_so_18_02_235
236,18,44,お尻の穴めくれちゃってますっ,sound/data/pcm/c18/h/01.unity3d,h_so_18_02_236
237,18,44,私、いま絶対えっちな顔になっちゃってますっ,sound/data/pcm/c18/h/01.unity3d,h_so_18_02_237
238,18,44,敏感になってるおちんちん、お尻で締め付けちゃいますっ,sound/data/pcm/c18/h/01.unity3d,h_so_18_02_238
239,18,44,お尻なら何度でも射精できますよっ,sound/data/pcm/c18/h/01.unity3d,h_so_18_02_239
240,18,44,お尻なら妊娠しないから、我慢しないでっ,sound/data/pcm/c18/h/01.unity3d,h_so_18_02_240
241,18,44,あなたのおちんちんで、またお尻を満たしてっ,sound/data/pcm/c18/h/01.unity3d,h_so_18_02_241
242,18,44,もう、ダメえぇぇぇ,sound/data/pcm/c18/h/01.unity3d,h_so_18_02_242
243,18,44,もう私、我慢できないっ,sound/data/pcm/c18/h/01.unity3d,h_so_18_02_243
244,18,44,あなたと一緒に、イキたいですっ,sound/data/pcm/c18/h/01.unity3d,h_so_18_02_244
245,18,44,あなたとなら、何度でもイキたいのっ,sound/data/pcm/c18/h/01.unity3d,h_so_18_02_245
246,18,44,いっぱい、いっぱい気持ちよくなってくれたんですね、精子、ください,sound/data/pcm/c18/h/01.unity3d,h_so_18_02_246
247,18,44,あなたの精子、何度でも受け止めてあげたいのっ,sound/data/pcm/c18/h/01.unity3d,h_so_18_02_247
248,18,44,私がどろどろになるまで、身体にかけてくださいっ,sound/data/pcm/c18/h/01.unity3d,h_so_18_02_248
249,18,44,何度でも私にマーキングしてくださいっ,sound/data/pcm/c18/h/01.unity3d,h_so_18_02_249
250,18,44,おちんちん、中で震えてますっ,sound/data/pcm/c18/h/01.unity3d,h_so_18_02_250
251,18,44,また、中でイキたいんですねっ？,sound/data/pcm/c18/h/01.unity3d,h_so_18_02_251
252,18,44,ゴムおちんちんも、気持ちいいかもっ,sound/data/pcm/c18/h/01.unity3d,h_so_18_02_252
253,18,44,ゴムの中で、おちんちんいっぱい暴れてますっ,sound/data/pcm/c18/h/01.unity3d,h_so_18_02_253
254,18,44,お尻で、イキますぅぅぅ～！,sound/data/pcm/c18/h/01.unity3d,h_so_18_02_254
255,18,44,またお尻で、幸せになっちゃうぅ～！,sound/data/pcm/c18/h/01.unity3d,h_so_18_02_255
256,18,44,あなたがイクのに合わせて、お尻の穴締めちゃいますっ,sound/data/pcm/c18/h/01.unity3d,h_so_18_02_256
257,18,44,一緒にお尻大好きな、変態になりましょうっ,sound/data/pcm/c18/h/01.unity3d,h_so_18_02_257
258,18,44,お尻なら妊娠しないから、出し放題ですよ,sound/data/pcm/c18/h/01.unity3d,h_so_18_02_258
259,18,44,どれだけ出しても、受け止めてあげます,sound/data/pcm/c18/h/01.unity3d,h_so_18_02_259
260,18,44,さっきよりも、量多いです,sound/data/pcm/c18/h/01.unity3d,h_so_18_02_260
261,18,44,今日は精液いっぱい、くれましたね,sound/data/pcm/c18/h/01.unity3d,h_so_18_02_261
262,18,44,ゴム、こんなにエッチに膨らんでます,sound/data/pcm/c18/h/01.unity3d,h_so_18_02_262
263,18,44,ゴムだと。いっぱい出たのがわかっちゃいますね……,sound/data/pcm/c18/h/01.unity3d,h_so_18_02_263
264,18,44,一回目じゃないのに、お尻から溢れちゃいます,sound/data/pcm/c18/h/01.unity3d,h_so_18_02_264
265,18,44,お尻に精液来る感覚、気持ちいい……,sound/data/pcm/c18/h/01.unity3d,h_so_18_02_265
266,18,44,らめえぇぇ……,sound/data/pcm/c18/h/01.unity3d,h_so_18_02_266
267,18,44,大好きぃいい……,sound/data/pcm/c18/h/01.unity3d,h_so_18_02_267
268,18,44,飛んでっちゃいますううぅ……,sound/data/pcm/c18/h/01.unity3d,h_so_18_02_268
269,18,44,わからなくなっちゃううぅ……,sound/data/pcm/c18/h/01.unity3d,h_so_18_02_269
270,18,44,あなたとすると、ゴムがすぐなくなっちゃいますね,sound/data/pcm/c18/h/01.unity3d,h_so_18_02_270
271,18,44,すごく良かったです、ゴムは……少し邪魔ですけど,sound/data/pcm/c18/h/01.unity3d,h_so_18_02_271
272,18,44,すっかり、セックス好きになっちゃいました。こうしたのはあなたですよ,sound/data/pcm/c18/h/01.unity3d,h_so_18_02_272
273,18,44,触れ合って、傷つけあって、セックスって、いいですよね,sound/data/pcm/c18/h/01.unity3d,h_so_18_02_273
274,18,44,危険日でも求めてくれるの、実はかなり、嬉しいんです,sound/data/pcm/c18/h/01.unity3d,h_so_18_02_274
275,18,44,こんなに幸せで、いいんでしょうか,sound/data/pcm/c18/h/01.unity3d,h_so_18_02_275
276,18,44,やっぱり身体の相性、いいんですね。うれし,sound/data/pcm/c18/h/01.unity3d,h_so_18_02_276
277,18,44,あなたはいつも私のことを気持ちよくしてくれますね……,sound/data/pcm/c18/h/01.unity3d,h_so_18_02_277
278,18,44,もう、完全にお尻に目覚めちゃいました,sound/data/pcm/c18/h/01.unity3d,h_so_18_02_278
279,18,44,お尻、どんどん開発されてきちゃってます,sound/data/pcm/c18/h/01.unity3d,h_so_18_02_279
280,18,44,私だけイっちゃうなんて……これ、完全に開発されてるってことですよね……？,sound/data/pcm/c18/h/01.unity3d,h_so_18_02_280
281,18,44,次はあなたも、気持ちよくしてあげたいです……,sound/data/pcm/c18/h/01.unity3d,h_so_18_02_281
282,18,44,射精激しすぎて……あなたに屈服させられちゃいました,sound/data/pcm/c18/h/01.unity3d,h_so_18_02_282
283,18,44,ゴムしててもこれだけ気持ちいいなんて……もし、生でしたら……,sound/data/pcm/c18/h/01.unity3d,h_so_18_02_283
284,18,44,生だからか、いつもより求めてくれてましたね……,sound/data/pcm/c18/h/01.unity3d,h_so_18_02_284
285,18,44,あなたに生で愛されると、すごく嬉しくて、幸せです,sound/data/pcm/c18/h/01.unity3d,h_so_18_02_285
286,18,44,危険日だと、おまんこも敏感になってるきがします,sound/data/pcm/c18/h/01.unity3d,h_so_18_02_286
287,18,44,危険日おまんこ、どうでした？,sound/data/pcm/c18/h/01.unity3d,h_so_18_02_287
288,18,44,気持ちよすぎて幸せでいっぱいになっちゃいました,sound/data/pcm/c18/h/01.unity3d,h_so_18_02_288
289,18,44,今度はあなたも一緒に……イキましょうね？,sound/data/pcm/c18/h/01.unity3d,h_so_18_02_289
290,18,44,私のお尻、壊れるまで使ってくださいぃ……,sound/data/pcm/c18/h/01.unity3d,h_so_18_02_290
291,18,44,お尻で一緒に、気持ちよくなっちゃいましたぁ……,sound/data/pcm/c18/h/01.unity3d,h_so_18_02_291
292,18,44,お尻良すぎてぇ、おまんこも疼いちゃいますぅ,sound/data/pcm/c18/h/01.unity3d,h_so_18_02_292
293,18,44,ちょっと疲れたけど……それ以上に、気持ちよかったですぅ,sound/data/pcm/c18/h/01.unity3d,h_so_18_02_293
294,18,44,おちんちん、あんなに出したのに……まだ元気,sound/data/pcm/c18/h/01.unity3d,h_so_18_02_294
295,18,44,私の中ですごく暴れて……気持ちよかったんですね……,sound/data/pcm/c18/h/01.unity3d,h_so_18_02_295
296,18,44,おまんこの中、もう溢れちゃいそう……見ますか？,sound/data/pcm/c18/h/01.unity3d,h_so_18_02_296
297,18,44,生だとやっぱり……量、増えるんですね……,sound/data/pcm/c18/h/01.unity3d,h_so_18_02_297
298,18,44,こんなに出されたら、受精、しちゃうかも……,sound/data/pcm/c18/h/01.unity3d,h_so_18_02_298
299,18,44,あなたの精液が、私の子宮で跳ね回ってます,sound/data/pcm/c18/h/01.unity3d,h_so_18_02_299
300,18,44,コンドームに精液……いっぱいですね,sound/data/pcm/c18/h/01.unity3d,h_so_18_02_300
301,18,44,精液が、ゴムに阻まれちゃってるの、わかります,sound/data/pcm/c18/h/01.unity3d,h_so_18_02_301
302,18,44,おまんことおちんちんが溶け合ってるみたいでした…………,sound/data/pcm/c18/h/01.unity3d,h_so_18_02_302
303,18,44,もうおちんちんもおまんこもヌルヌルですね…………,sound/data/pcm/c18/h/01.unity3d,h_so_18_02_303
304,18,44,二人で一緒にイッて……これで受精してたら、素敵だなって思っちゃいます,sound/data/pcm/c18/h/01.unity3d,h_so_18_02_304
305,18,44,気持ちよすぎて、子宮降りてるのわかっちゃいました,sound/data/pcm/c18/h/01.unity3d,h_so_18_02_305
306,18,44,気持ちよすぎて……あなたのこと気持ちよくする余裕、ありませんでした,sound/data/pcm/c18/h/01.unity3d,h_so_18_02_306
307,18,44,次は……私の中で射精させてみせます,sound/data/pcm/c18/h/01.unity3d,h_so_18_02_307
308,18,44,お尻、いつでも使えるように準備しててよかったです……,sound/data/pcm/c18/h/01.unity3d,h_so_18_02_308
309,18,44,精液、私のお尻の中に満たされてるのわかります……垂れちゃいそう,sound/data/pcm/c18/h/01.unity3d,h_so_18_02_309
310,18,44,ビクンビクンってして……なんだか、愛らしいです,sound/data/pcm/c18/h/01.unity3d,h_so_18_02_310
311,18,44,おちんちんって、すごくエッチな形ですよね……見とれちゃいます,sound/data/pcm/c18/h/01.unity3d,h_so_18_02_311
312,18,44,やっぱり全部、おまんこに出してほしかったな、って思っちゃいます,sound/data/pcm/c18/h/01.unity3d,h_so_18_02_312
313,18,44,あなたの精液……舐めとっても、いいですか？,sound/data/pcm/c18/h/01.unity3d,h_so_18_02_313
314,18,44,精液垂れちゃってる……もったいないな,sound/data/pcm/c18/h/01.unity3d,h_so_18_02_314
315,18,44,やだ、お尻から垂れちゃってる……,sound/data/pcm/c18/h/01.unity3d,h_so_18_02_315
316,18,44,（開始時台詞）滑ったり、足がつったりしないように気をつけないとですね……,sound/data/pcm/c18/h/01.unity3d,h_so_18_02_316
317,18,44,（開始時台詞）不幸が起きて、誰かに見られちゃいそうな……でも、あなたとなら……,sound/data/pcm/c18/h/01.unity3d,h_so_18_02_317
