管理番号,大きい項目,中間項目,表示名,バンドルパス,ファイル名
0,06,33,私が自ら繋がる瞬間、見ないでくださいましぃ……,sound/data/pcm/c06/h/01.unity3d,h_fe_06_01_014
1,06,33,導き入れるのも、腰を動かして抜くのも、貴方に見られていると思うと恥ずかしいです,sound/data/pcm/c06/h/01.unity3d,h_fe_06_01_033
2,06,33,腰を揺らすと貴方の反り返ったモノが更に大きくなります,sound/data/pcm/c06/h/01.unity3d,h_fe_06_01_039
3,06,33,こんないやらしい動き方は祖母には教わっておりませんっ,sound/data/pcm/c06/h/01.unity3d,h_fe_06_01_042
4,06,33,貴方の気持ちよいお射精の為に淫らな女になります,sound/data/pcm/c06/h/01.unity3d,h_fe_06_01_043
5,06,33,私の動きに合わせて、そんなところを……こ、心地よいです,sound/data/pcm/c06/h/01.unity3d,h_fe_06_01_051
6,06,33,貴方のせり出たエラを使って、私、気持ちよくなっておりますぅ,sound/data/pcm/c06/h/01.unity3d,h_fe_06_01_059
7,06,33,そんなところ、集中して動けなく……いえ、何でもございません,sound/data/pcm/c06/h/01.unity3d,h_fe_06_01_077
8,06,33,申し訳ございません、私、果ててしまいそうです……,sound/data/pcm/c06/h/01.unity3d,h_fe_06_01_090
9,06,33,ねっとり舐めるような動きで、お射精されるのですね,sound/data/pcm/c06/h/01.unity3d,h_fe_06_01_092
10,06,33,雄々しくぶらさがった玉袋に詰まった精液を、吸い出してご覧にいれますぅ,sound/data/pcm/c06/h/01.unity3d,h_fe_06_01_094
11,06,33,はい、貴方は私の中へ注ぎ込むことだけを強く思っていてくださいぃ,sound/data/pcm/c06/h/01.unity3d,h_fe_06_01_107
12,06,33,破廉恥に踊る私の身体に、お熱い精液を注ぎ込んでくださいましぃっ,sound/data/pcm/c06/h/01.unity3d,h_fe_06_01_108
13,06,33,避妊具がクチュクチュと……私ったら、そんなに激しく動いているのですね,sound/data/pcm/c06/h/01.unity3d,h_fe_06_01_114
