管理番号,大きい項目,中間項目,表示名,バンドルパス,ファイル名
0,40,41,どこを攻めるか悩む必要はないぞ……我はどこでも感じてしまうからな,sound/data/pcm/c40/h/71.unity3d,h_ai_40_02_000
1,40,41,我は貴殿に何回イカされてしまうのだろうな……ふふ、楽しみだ……,sound/data/pcm/c40/h/71.unity3d,h_ai_40_02_001
2,40,41,気持ちよくなれることなら何でも歓迎だ……貴殿の思うままにするがいい,sound/data/pcm/c40/h/71.unity3d,h_ai_40_02_002
3,40,41,(貴殿の唾液は美味だな……もっと我の唾液と交換しよう……),sound/data/pcm/c40/h/71.unity3d,h_ai_40_02_003
4,40,41,(身体が熱くなっていくのがわかる……キスで興奮している証拠だ……),sound/data/pcm/c40/h/71.unity3d,h_ai_40_02_004
5,40,41,キスの次はどうするのだ？　我はもう、どこも準備万端だぞ……,sound/data/pcm/c40/h/71.unity3d,h_ai_40_02_005
6,40,41,この火照りはキスだけでは収まらない……もっと身体中で感じさせてくれ……,sound/data/pcm/c40/h/71.unity3d,h_ai_40_02_006
7,40,41,キスはもう終わりか？　唇が少々寂しいな……もう一度、キスをしないか？,sound/data/pcm/c40/h/71.unity3d,h_ai_40_02_007
8,40,41,むぅ、貴殿の唇が恋しい……もっとキスをしたい……なぁ、ダメかぁ？,sound/data/pcm/c40/h/71.unity3d,h_ai_40_02_008
9,40,41,あぁ……この快感を我慢することは……我には不可能だ……,sound/data/pcm/c40/h/71.unity3d,h_ai_40_02_018
10,40,41,遠慮せず、何でもしてくれ……それが我の望みでもある……,sound/data/pcm/c40/h/71.unity3d,h_ai_40_02_019
11,40,41,すぐにイってしまわないようにしなとな……この心地よさを、ずっと感じていたい……,sound/data/pcm/c40/h/71.unity3d,h_ai_40_02_020
12,40,41,感度が増していくのが分かる……凄い勢いでな……,sound/data/pcm/c40/h/71.unity3d,h_ai_40_02_021
13,40,41,声は我慢しないことにした……貴殿にきちんと感じていると伝えたいからな……,sound/data/pcm/c40/h/71.unity3d,h_ai_40_02_022
14,40,41,貴殿は我の弱点を見つけるのが得意だな……少々適格過ぎるほどだ……,sound/data/pcm/c40/h/71.unity3d,h_ai_40_02_023
15,40,41,そう弱いところばかり攻められては……我もたまらなくなってしまうっ,sound/data/pcm/c40/h/71.unity3d,h_ai_40_02_024
16,40,41,我をすぐにイカせる気か？　貴殿は容赦がないなっ……,sound/data/pcm/c40/h/71.unity3d,h_ai_40_02_025
17,40,41,やはり乳首が弱いのはバレているか……どうしても目立ってしまうからな,sound/data/pcm/c40/h/71.unity3d,h_ai_40_02_026
18,40,41,うぅ、乳首が張って……まだ母乳が出た方が楽かもしれないっ,sound/data/pcm/c40/h/71.unity3d,h_ai_40_02_027
19,40,41,我だけでなく、女子は乳首が弱いものだ……だから感じてしまうのはっ、仕方ないっ,sound/data/pcm/c40/h/71.unity3d,h_ai_40_02_028
20,40,41,あぁっ、我のおまんこが喜んでしまっているっ……貴殿に攻められると弱いのだっ,sound/data/pcm/c40/h/71.unity3d,h_ai_40_02_029
21,40,41,我は大分濡れやすいからな……すぐにぐしょぐしょになってしまうんだ……,sound/data/pcm/c40/h/71.unity3d,h_ai_40_02_030
22,40,41,おまんこが感じやすいのは仕方ないだろう……我だって女子なのだからなっ,sound/data/pcm/c40/h/71.unity3d,h_ai_40_02_031
23,40,41,貴殿だってお尻をいじられればわかる……この気持ちよさは絶対癖になると,sound/data/pcm/c40/h/71.unity3d,h_ai_40_02_032
24,40,41,いいぞ、我はお尻を攻められるのが好きなのだ……貴殿はよくわかっている,sound/data/pcm/c40/h/71.unity3d,h_ai_40_02_033
25,40,41,お尻で感じるのは悪いことではない……むしろたくさん感じさせて欲しいっ,sound/data/pcm/c40/h/71.unity3d,h_ai_40_02_034
26,40,41,満足するまで揉むがいい……我は嫌がったりしないからな,sound/data/pcm/c40/h/71.unity3d,h_ai_40_02_044
27,40,41,必死にもむ貴殿は可愛いな……なんだか母性が刺激されてしまう……,sound/data/pcm/c40/h/71.unity3d,h_ai_40_02_045
28,40,41,そうだ、我をもんでほぐしてくれ……もっともっと感じられるようにな……,sound/data/pcm/c40/h/71.unity3d,h_ai_40_02_046
29,40,41,はは、なんだ？　もっとエッチな気分になれるよう、スイッチを押してくれたのか？,sound/data/pcm/c40/h/71.unity3d,h_ai_40_02_051
30,40,41,んっ、乳首をつつかれると声が漏れてしまう……少し恥ずかしいな……,sound/data/pcm/c40/h/71.unity3d,h_ai_40_02_052
31,40,41,乳首は目立つからな、つつきたくなる気持ちは分かる。できれば、我も貴殿のを……,sound/data/pcm/c40/h/71.unity3d,h_ai_40_02_053
32,40,41,引っ張られるとゾクゾクする……乳首が性感帯だと分からされるな……,sound/data/pcm/c40/h/71.unity3d,h_ai_40_02_054
33,40,41,我の乳首を伸ばすつもりか？　今でも十分、つまみやすいだろう？,sound/data/pcm/c40/h/71.unity3d,h_ai_40_02_055
34,40,41,そのくらいの刺激が丁度いい……乳首だけでもイケてしまいそうだ……,sound/data/pcm/c40/h/71.unity3d,h_ai_40_02_056
35,40,41,お尻をいじってくれるのか……ありがたいな……,sound/data/pcm/c40/h/71.unity3d,h_ai_40_02_057
36,40,41,貴殿のおかげで、お尻をいじられる抵抗がなくなった……,sound/data/pcm/c40/h/71.unity3d,h_ai_40_02_058
37,40,41,たくさんお尻いじってくれ……お尻だけでイカされても構わないぞ……,sound/data/pcm/c40/h/71.unity3d,h_ai_40_02_059
38,40,41,おまんこぬるぬるだろう？　少しこすられただけで、そうなってしまうんだ……,sound/data/pcm/c40/h/71.unity3d,h_ai_40_02_060
39,40,41,愛液を伸ばすようにこすってくれ……よくすべって気持ちいいんだ……,sound/data/pcm/c40/h/71.unity3d,h_ai_40_02_061
40,40,41,自分でこするより、やはり何倍も感じるな……不思議なものだ……,sound/data/pcm/c40/h/71.unity3d,h_ai_40_02_062
41,40,41,お尻は濡れないのが残念だな……こんなに感じているというのに……,sound/data/pcm/c40/h/71.unity3d,h_ai_40_02_063
42,40,41,あぁっ、貴殿にこすられる度、お尻の熱さが増していく……,sound/data/pcm/c40/h/71.unity3d,h_ai_40_02_064
43,40,41,もっとこすってくれ……お尻のしわを伸ばすように、じっくりと……,sound/data/pcm/c40/h/71.unity3d,h_ai_40_02_065
44,40,41,あぁ……我のおまんこが、貴殿の指を待ちわびていたのが分かるか……？,sound/data/pcm/c40/h/71.unity3d,h_ai_40_02_066
45,40,41,んんっ、おまんこの中、凄く熱いだろう？　ずっと貴殿の指を待っていたからな……,sound/data/pcm/c40/h/71.unity3d,h_ai_40_02_067
46,40,41,あぁあっ、……貴殿の指で、おまんこしっかりほぐしてくれ……,sound/data/pcm/c40/h/71.unity3d,h_ai_40_02_068
47,40,41,んはっ、この異物感、たまらないな……お尻が喜んでしまっている……,sound/data/pcm/c40/h/71.unity3d,h_ai_40_02_069
48,40,41,んんぅっ、思い切り奥まで挿れてくれ……お尻なら、行き止まりはないからな……,sound/data/pcm/c40/h/71.unity3d,h_ai_40_02_070
49,40,41,あぉっ、お尻に指を入れられると、変な声が出てしまうぅ……,sound/data/pcm/c40/h/71.unity3d,h_ai_40_02_071
50,40,41,最高だ……自分の指でおまんこかきまぜるのとは、わけが違う……,sound/data/pcm/c40/h/71.unity3d,h_ai_40_02_072
51,40,41,貴殿の指でたくさん感じさせてくれ……おまんこ、もっとぐしょ濡れになるくらい……,sound/data/pcm/c40/h/71.unity3d,h_ai_40_02_073
52,40,41,やはり上手だな……おまんこの弱いところを、適格に攻めてくるっ……,sound/data/pcm/c40/h/71.unity3d,h_ai_40_02_074
53,40,41,いい感じだ……貴殿の指にお尻の匂いがしみ込むまで、よーくかきまぜてくれ……,sound/data/pcm/c40/h/71.unity3d,h_ai_40_02_075
54,40,41,凄いだろう？　お尻でもこんなに感じられるようになったのだぞ……,sound/data/pcm/c40/h/71.unity3d,h_ai_40_02_076
55,40,41,手加減は無用だぞ……お尻の中、もっとぐちゅぐちゅにぃっ……,sound/data/pcm/c40/h/71.unity3d,h_ai_40_02_077
56,40,41,どれだけ舐めても構わないぞ……貴殿の心ゆくまで、我の味を堪能してくれ……,sound/data/pcm/c40/h/71.unity3d,h_ai_40_02_078
57,40,41,貴殿は汗でも何でも舐めてしまうのだな……流石だ……,sound/data/pcm/c40/h/71.unity3d,h_ai_40_02_079
58,40,41,舌の熱さが気持ちいい……どこを舐められても蕩けてしまうな……,sound/data/pcm/c40/h/71.unity3d,h_ai_40_02_080
59,40,41,貴殿が熱心に舐めてくれるから……乳首が嬉しがっているぞ……,sound/data/pcm/c40/h/71.unity3d,h_ai_40_02_081
60,40,41,もう乳首がべとべとだ……貴殿の唾液の匂いが残ってしまいそうだな……,sound/data/pcm/c40/h/71.unity3d,h_ai_40_02_082
61,40,41,おまんこそんなに舐めてはっ……最早愛液より、貴殿の唾液の方が多いのではないか？,sound/data/pcm/c40/h/71.unity3d,h_ai_40_02_083
62,40,41,舌の感触が凄くいい……優しくおまんこ蕩けさせられる……,sound/data/pcm/c40/h/71.unity3d,h_ai_40_02_084
63,40,41,貴殿はお尻舐めが大好きなのだな……舌使いから熱意を感じる……,sound/data/pcm/c40/h/71.unity3d,h_ai_40_02_085
64,40,41,我をお尻でイカせるつもりか？　そのまま続けてくれれば、あるいは……,sound/data/pcm/c40/h/71.unity3d,h_ai_40_02_086
65,40,41,凄いっ、貴殿の舌がっ、お尻の中を這いまわって……こんなの長くはもたないっ……,sound/data/pcm/c40/h/71.unity3d,h_ai_40_02_087
66,40,41,舌でお尻、ずぽずぽされてしまっているっ……まるでお尻でしているようだっ……,sound/data/pcm/c40/h/71.unity3d,h_ai_40_02_088
67,40,41,あぁっ、なんて気持ちよさだっ……お尻の穴がっ、貴殿の舌に支配されていくっ,sound/data/pcm/c40/h/71.unity3d,h_ai_40_02_089
68,40,41,その機械には慈悲がないっ……我を容赦なく、イカせようとしてくるっ……,sound/data/pcm/c40/h/71.unity3d,h_ai_40_02_090
69,40,41,油断すると、下品な声が漏れてしまいそうだっ……その機械は強すぎるっ……,sound/data/pcm/c40/h/71.unity3d,h_ai_40_02_091
70,40,41,んぁあっ、頭まで痺れたようになって……もう身体中が震えているようだっ……,sound/data/pcm/c40/h/71.unity3d,h_ai_40_02_092
71,40,41,いかん、乳首をそんなに震わせてはっ……簡単にイカされてしまうぅっ……,sound/data/pcm/c40/h/71.unity3d,h_ai_40_02_093
72,40,41,乳首には少々刺激が強いがっ……それがまた、なんとも心地いいっ……,sound/data/pcm/c40/h/71.unity3d,h_ai_40_02_094
73,40,41,あぁっ、おまんこぶるぶるされると、頭が真っ白にぃっ……,sound/data/pcm/c40/h/71.unity3d,h_ai_40_02_095
74,40,41,くぅっ、何度も小さくイっているような……それはおまんこっ、おかしくなるぅっ……,sound/data/pcm/c40/h/71.unity3d,h_ai_40_02_096
75,40,41,そろそろだっ、もうイっていいだろう？　イキたいんだっ、頼むぅっ……！,sound/data/pcm/c40/h/71.unity3d,h_ai_40_02_097
76,40,41,んうぅっ、もうイクことし考えられないっ、これ以上はっ、頭が変になるぅっ……！,sound/data/pcm/c40/h/71.unity3d,h_ai_40_02_098
77,40,41,イキたい、イキたぃぃっ！　お願いだっ、もう我をっ、楽にしてくれぇっ……！,sound/data/pcm/c40/h/71.unity3d,h_ai_40_02_099
78,40,41,んはぁぁぁぁ……！,sound/data/pcm/c40/h/71.unity3d,h_ai_40_02_100
79,40,41,まだまだ我は大丈夫だ……もっとたくさん感じさせてくれ……,sound/data/pcm/c40/h/71.unity3d,h_ai_40_02_104
80,40,41,貴殿がよければ、もう少ししてくれないか……身体の火照りが収まらないんだ……,sound/data/pcm/c40/h/71.unity3d,h_ai_40_02_105
81,40,41,(貴殿はキスが上手だな……ずっとしていたくなってしまう……),sound/data/pcm/c40/h/71.unity3d,h_ai_40_02_106
82,40,41,(このままキスだけでまたイカせる気か？　我は別に……構わないが……),sound/data/pcm/c40/h/71.unity3d,h_ai_40_02_107
83,40,41,ふむ……もっとキスしていてもよかったのだが……まぁ、貴殿に任せよう……,sound/data/pcm/c40/h/71.unity3d,h_ai_40_02_108
84,40,41,キスは飽きてしまったか？　それなら、他のところを楽しんでくれ……,sound/data/pcm/c40/h/71.unity3d,h_ai_40_02_109
85,40,41,ふぅ……一気に力が抜けてしまった……貴殿とのキスは、強力過ぎるな……,sound/data/pcm/c40/h/71.unity3d,h_ai_40_02_110
86,40,41,もう、ずっとキスだけでもいいくらいだ……我はそれくらいキスが好きなのだ……,sound/data/pcm/c40/h/71.unity3d,h_ai_40_02_111
87,40,41,すっかり身体ができあがってしまった……もう何をされても気持ちいい……,sound/data/pcm/c40/h/71.unity3d,h_ai_40_02_120
88,40,41,またすぐにイカないようにしないとな……貴殿にじっくり楽しんでもらいたいんだ……,sound/data/pcm/c40/h/71.unity3d,h_ai_40_02_121
89,40,41,貴殿も興奮してくれているようだな……大分、息が荒くなっているぞ……,sound/data/pcm/c40/h/71.unity3d,h_ai_40_02_122
90,40,41,もうすっかり、我の弱いところがバレてしまっているな……,sound/data/pcm/c40/h/71.unity3d,h_ai_40_02_123
91,40,41,どうせなら一番感じるところでイキたいからな……弱点を攻めてもらえるのはありがたい,sound/data/pcm/c40/h/71.unity3d,h_ai_40_02_124
92,40,41,んんっ、我は乳首が弱いのだ……もう言わなくても分かっていると思うが……,sound/data/pcm/c40/h/71.unity3d,h_ai_40_02_125
93,40,41,貴殿がそうして、たくさん感じさせるから……どんどん乳首が弱くなってしまう……,sound/data/pcm/c40/h/71.unity3d,h_ai_40_02_126
94,40,41,んぁんっ、誰だっておまんこは弱いと思うが……我は特に敏感なのだっ……,sound/data/pcm/c40/h/71.unity3d,h_ai_40_02_127
95,40,41,おまんこ、最早おもらしではすまないくらい濡れているな……大洪水だ……,sound/data/pcm/c40/h/71.unity3d,h_ai_40_02_128
96,40,41,我のだらしない姿が見たいか？　ならば、お尻をもっといじめてくれっ……,sound/data/pcm/c40/h/71.unity3d,h_ai_40_02_129
97,40,41,お尻をいじられると力が入らなくなる……本当に弱いんだっ……,sound/data/pcm/c40/h/71.unity3d,h_ai_40_02_130
98,40,41,揉んでくれるのは気持ちよくて嬉しいが……貴殿の手は疲れないのか？,sound/data/pcm/c40/h/71.unity3d,h_ai_40_02_137
99,40,41,貴殿に揉まれていると幸せを感じる……ずっと揉まれていてもいいくらいだ……,sound/data/pcm/c40/h/71.unity3d,h_ai_40_02_138
100,40,41,やはり男子は、胸を揉むのが好きなのだな……はは、可愛いものだ……,sound/data/pcm/c40/h/71.unity3d,h_ai_40_02_139
101,40,41,胸を揉んでいる時の貴殿は本当に楽しそうだな……見ているこちらも嬉しくなる……,sound/data/pcm/c40/h/71.unity3d,h_ai_40_02_140
102,40,41,お尻の肉をもみほぐされるというのも……なかなかいいな……,sound/data/pcm/c40/h/71.unity3d,h_ai_40_02_141
103,40,41,揉まれる度にお尻の感度が増していく気がする……これは後が大変そうだな……,sound/data/pcm/c40/h/71.unity3d,h_ai_40_02_142
104,40,41,あぅっ、乳首を押し込まれると、身体中がゾクゾクと震えてしまうっ……,sound/data/pcm/c40/h/71.unity3d,h_ai_40_02_143
105,40,41,んぁっ、そんなに乳首をつつかなくとも……もう我のスイッチは入っているぞ……,sound/data/pcm/c40/h/71.unity3d,h_ai_40_02_144
106,40,41,敏感乳首を、そう引っ張られてはまたすぐにぃっ……,sound/data/pcm/c40/h/71.unity3d,h_ai_40_02_145
107,40,41,我の乳首が本当に伸びてしまったら……確実に貴殿のせいだぞっ……,sound/data/pcm/c40/h/71.unity3d,h_ai_40_02_146
108,40,41,あまりいじられ過ぎると……お尻がずっとイキ続けているような感覚にっ……,sound/data/pcm/c40/h/71.unity3d,h_ai_40_02_147
109,40,41,貴殿はお尻をいじるのが大好きのようだな……我と趣味が一緒で嬉しい……,sound/data/pcm/c40/h/71.unity3d,h_ai_40_02_148
110,40,41,おまんこはもう蕩け切っている……少しこすられただけでっ、痺れるような快感がっ,sound/data/pcm/c40/h/71.unity3d,h_ai_40_02_149
111,40,41,我のおまんこはどれくらい熱くなっているんだ？　もう自分でも分からないんだっ……,sound/data/pcm/c40/h/71.unity3d,h_ai_40_02_150
112,40,41,お尻がもうっ、こすられる度に震えてっ、明らかに感じすぎてしまっているっ……,sound/data/pcm/c40/h/71.unity3d,h_ai_40_02_151
113,40,41,こんなにお尻で感じてしまうものなのだなっ……自分でも驚きだっ,sound/data/pcm/c40/h/71.unity3d,h_ai_40_02_152
114,40,41,んぃいっ、もう貴殿の指がふやけるまでっ、おまんこに挿れていてくれっ……,sound/data/pcm/c40/h/71.unity3d,h_ai_40_02_153
115,40,41,はぉっ、すまない、下品な声が出てしまった……貴殿の指が気持ち良すぎて……,sound/data/pcm/c40/h/71.unity3d,h_ai_40_02_154
116,40,41,あぁぁっ、最高だ……もうお尻に貴殿の指が入っていないと、落ち着かないっ……,sound/data/pcm/c40/h/71.unity3d,h_ai_40_02_155
117,40,41,んんぅっ、いいっ、お尻に指が入ってくると……どうしようもなく嬉しくなってしまう……,sound/data/pcm/c40/h/71.unity3d,h_ai_40_02_156
118,40,41,びちゃびちゃといやらしい音がっ、我のおまんこはどこまではしたなくなってしまうんだっ,sound/data/pcm/c40/h/71.unity3d,h_ai_40_02_157
119,40,41,もう奥までぐっしょりだ……おまんこ濡れていないところなど、どこにもないぃっ……,sound/data/pcm/c40/h/71.unity3d,h_ai_40_02_158
120,40,41,んああっ、指がお尻の中で蠢いてっ、我の理性が溶けていくぅっ……,sound/data/pcm/c40/h/71.unity3d,h_ai_40_02_159
121,40,41,どうしようもなくお尻が気持ちいいっ、貴殿の指でっ、開発され切ってしまったぁっ,sound/data/pcm/c40/h/71.unity3d,h_ai_40_02_160
122,40,41,どれだけ舐めても構わないっ……むしろ、もっともっと舐めてくれぇっ……,sound/data/pcm/c40/h/71.unity3d,h_ai_40_02_161
123,40,41,お願いだっ、我の身体に唾液がしみ込むくらい、貴殿の舌で舐めつくして欲しいっ,sound/data/pcm/c40/h/71.unity3d,h_ai_40_02_162
124,40,41,ぺろぺろいいっ、もうすっかり我の乳首は、貴殿の舌の虜になってしまったぁっ……,sound/data/pcm/c40/h/71.unity3d,h_ai_40_02_163
125,40,41,いいぞっ、貴殿の唾液がしたたるくらい、我の乳首を舐め続けるんだっ……,sound/data/pcm/c40/h/71.unity3d,h_ai_40_02_164
126,40,41,我の愛液、全部飲んでくれ……いやらしい音を立てて、すすってもいいからっ……,sound/data/pcm/c40/h/71.unity3d,h_ai_40_02_165
127,40,41,おまんこが貴殿の舌でイキたがっているっ、ほらっ、また愛液が溢れてきたっ……,sound/data/pcm/c40/h/71.unity3d,h_ai_40_02_166
128,40,41,我のお尻は貴殿に服従しているっ……好きなだけ舐めて、イカせていいのだぞっ,sound/data/pcm/c40/h/71.unity3d,h_ai_40_02_167
129,40,41,ずっともう、お尻がヒクヒクしっぱなしだっ、貴殿には全て見られてしまうなっ……,sound/data/pcm/c40/h/71.unity3d,h_ai_40_02_168
130,40,41,んはんっ、舌でお尻ずぽずぽされてはっ、我とてそう長くはっ……,sound/data/pcm/c40/h/71.unity3d,h_ai_40_02_169
131,40,41,あひっ、貴殿の舌が、我のお尻の穴を蹂躙してっ……こんなの勝てるわけがないっ,sound/data/pcm/c40/h/71.unity3d,h_ai_40_02_170
132,40,41,さぁっ、もう我をイカせるのは簡単だろう？　どうか貴殿の慈悲をっ……！,sound/data/pcm/c40/h/71.unity3d,h_ai_40_02_171
133,40,41,またっ、大きな波がっ、もう我慢できる自信がないっ……イクっ、絶対いイってしまうぅっ……！,sound/data/pcm/c40/h/71.unity3d,h_ai_40_02_172
134,40,41,（開始時台詞）人の気配は我が注意しておく……だが、あまりあてにするなよ……,sound/data/pcm/c40/h/71.unity3d,h_ai_40_02_175
135,40,41,キスは卑怯だ……何も拒めなくなる……,sound/data/pcm/c40/h/71.unity3d,h_ai_40_02_176
136,40,41,待て……キスはダメだ……そう簡単には流されないぞ……,sound/data/pcm/c40/h/71.unity3d,h_ai_40_02_177
137,40,41,まいったな……こんなに感じてしまうものか……,sound/data/pcm/c40/h/71.unity3d,h_ai_40_02_178
138,40,41,声を我慢するのも……限界がっ……,sound/data/pcm/c40/h/71.unity3d,h_ai_40_02_179
139,40,41,誰かに見られている気がする……気のせいだといいのだが……,sound/data/pcm/c40/h/71.unity3d,h_ai_40_02_180
140,40,41,我が変な趣味に目覚めたら……貴殿のせいだぞ……,sound/data/pcm/c40/h/71.unity3d,h_ai_40_02_181
141,40,41,うぅ、もう何も気にせず……声を出してしまいたい……,sound/data/pcm/c40/h/71.unity3d,h_ai_40_02_182
142,40,41,イク時の声は我慢できないかもしれないっ、最悪、貴殿だけでも逃げろっ,sound/data/pcm/c40/h/71.unity3d,h_ai_40_02_183
143,40,41,頑張ったが、これ以上は……すまないっ、もう無理だっ,sound/data/pcm/c40/h/71.unity3d,h_ai_40_02_184
144,40,41,（声を押し殺しながら絶頂）んぃいぃいいぅっ……,sound/data/pcm/c40/h/71.unity3d,h_ai_40_02_185
145,40,41,声を出せないのは辛いな……イってもまだ、何か燻っているようだ……,sound/data/pcm/c40/h/71.unity3d,h_ai_40_02_186
146,40,41,見つかっては……いないよな？　まぁ、お互い合意の上だ……問題はあるまい,sound/data/pcm/c40/h/71.unity3d,h_ai_40_02_187
147,40,41,（Ｈシーン中初めて触った時限定）むぅ、見境なしだな……手短に頼むぞ？,sound/data/pcm/c40/h/71.unity3d,h_ai_40_02_189
148,40,41,そこは声が出るっ……あまり激しくはっ……,sound/data/pcm/c40/h/71.unity3d,h_ai_40_02_190
149,40,41,我は大変なのだぞ……色々我慢しなければいけなくてっ,sound/data/pcm/c40/h/71.unity3d,h_ai_40_02_191
150,40,41,見つかったら貴殿のせいだっ……我は悪くない……,sound/data/pcm/c40/h/71.unity3d,h_ai_40_02_192
151,40,41,濡れてしまう……まずいと分かっていても、身体が……,sound/data/pcm/c40/h/71.unity3d,h_ai_40_02_193
152,40,41,エッチな音をさせるなぁっ……我の我慢が無駄になるっ,sound/data/pcm/c40/h/71.unity3d,h_ai_40_02_194
153,40,41,もうイクからなっ、貴殿が全部、悪いのだからなっ,sound/data/pcm/c40/h/71.unity3d,h_ai_40_02_197
154,40,41,これは仕方ないんだっ、今イカないとっ、もう声がっ,sound/data/pcm/c40/h/71.unity3d,h_ai_40_02_198
155,40,41,保健の勉強はもう十分だ……貴殿も女の身体の仕組みが分かってよかったな,sound/data/pcm/c40/h/71.unity3d,h_ai_40_02_199
156,40,41,強引にも程があるぞ……どうするのだ、我をこんなエッチな気分にさせて……,sound/data/pcm/c40/h/71.unity3d,h_ai_40_02_200
