管理番号,大きい項目,中間項目,表示名,バンドルパス,ファイル名
147,12,54,あぁ孕んだぁっ♪　絶対孕んだぁっ♪　子種子宮に注がれて、卵子包囲されてるぅっ……,sound/data/pcm/c12/h/01.unity3d,h_so_12_03_147
148,12,54,んぅぁぁっ♪　アブナイセックス癖になるぅ……絶対だめなのに……アブナイ方が気持ちよくなっちゃってるぅっ……,sound/data/pcm/c12/h/01.unity3d,h_so_12_03_148
149,12,54,あぁ、ごめっ、あたしだけイッちゃって……まだできるから、全然できるからな。もっとしよ？　な？,sound/data/pcm/c12/h/01.unity3d,h_so_12_03_149
150,12,54,うぅ～ん、一緒にイク方がいいけど。こうイカされるっていうのも、おまえの女になったって感じで……いいなぁっ♪,sound/data/pcm/c12/h/01.unity3d,h_so_12_03_150
151,12,54,はぁぅぅ～、すっかりアナル調教されて……このままだと……うんちする度にイクようになったり……んくっ,sound/data/pcm/c12/h/01.unity3d,h_so_12_03_151
152,12,54,んあぁぁん♪　このぉ、いっぱい出したなぁっ♪　俺のアナルだぞって、たっぷりマーキングしたなぁっ♪,sound/data/pcm/c12/h/01.unity3d,h_so_12_03_152
153,12,54,はぁもぅ♪　アナル大好きっ！　マンコとアナルどっちも好きっ！　どっちかなんて選べないっ♪,sound/data/pcm/c12/h/01.unity3d,h_so_12_03_153
154,12,54,あーあ、こんなにアナルがばがばにされちゃって……何か入ってないと、最近落ち着かないんだぞっ♪,sound/data/pcm/c12/h/01.unity3d,h_so_12_03_154
155,12,54,ゴムすぐに捨てちゃだめだぞ、中でたぽたぽしてるおまえのザーメン、見るの好きなんだっ♪,sound/data/pcm/c12/h/01.unity3d,h_so_12_03_155
156,12,54,この前友達にゴム貸してって言われてさ、思わずビクッってしちゃったよ……あはは……髪留めの方だったんだけどさ……,sound/data/pcm/c12/h/01.unity3d,h_so_12_03_156
157,12,54,毎回あんな気持ちよさそうな顔見せられると、射精ってどんな感じなのかなって、気になるんだよな……,sound/data/pcm/c12/h/01.unity3d,h_so_12_03_157
158,12,54,ふぅ、今日はちょっと早かったか？　あはっ、気にするなって。まだまだいっぱいできる……だろ？,sound/data/pcm/c12/h/01.unity3d,h_so_12_03_158
159,12,54,うぅぅぅー……なんか冷静になるとあたし発情しすぎっていうか……危険日って色々やばいな……,sound/data/pcm/c12/h/01.unity3d,h_so_12_03_159
160,12,54,危険日知りたいっていうから教えたのに……我慢するどころか逆にしちゃうなんて……この鬼畜ぅっ,sound/data/pcm/c12/h/01.unity3d,h_so_12_03_160
161,12,54,間違いなく、今あたしの事一番知ってるのはおまえだよ……だってこんなにされちゃ……な？,sound/data/pcm/c12/h/01.unity3d,h_so_12_03_161
162,12,54,なぁなぁ、ゴムに出すってどんな感じなんだ？　あたしの中に出す方が……気持ちいい……よな？,sound/data/pcm/c12/h/01.unity3d,h_so_12_03_162
163,12,54,今日は安全日だから、もっといっぱい、溢れちゃうくらい何回も出していいんだからな？　はぁっ♪,sound/data/pcm/c12/h/01.unity3d,h_so_12_03_163
164,12,54,はぁ、お腹たぷたぷっ……今ここにおまえの精液、たーっぷり入ってるんだぞ？　んっふふ♪,sound/data/pcm/c12/h/01.unity3d,h_so_12_03_164
165,12,54,二人で暮らしたら……その、毎日できちゃうな……あははっ、だ、大家族になりそ……,sound/data/pcm/c12/h/01.unity3d,h_so_12_03_165
166,12,54,あっ、母乳出てきた……ぷっ、嘘だよっ！　なに期待してたんだ？　うーん？,sound/data/pcm/c12/h/01.unity3d,h_so_12_03_166
167,12,54,ちょ、ちょっと休憩……今ちょっとやばいから……すぐに回復するから……そしたらもう一回な♪,sound/data/pcm/c12/h/01.unity3d,h_so_12_03_167
168,12,54,えっと……あたし相当えぐい声出してたよな……うぅ、おまえのせいでもあるんだぞっ……,sound/data/pcm/c12/h/01.unity3d,h_so_12_03_168
169,12,54,むぅ、おまえばっかずるいぞっ、おまえにもお尻はあるんだ、出せっ！　お尻出せっ！,sound/data/pcm/c12/h/01.unity3d,h_so_12_03_169
170,12,54,んー、アナルの方がいっぱい出てる気がする……なんか複雑な気分……,sound/data/pcm/c12/h/01.unity3d,h_so_12_03_170
171,12,54,はぁ♪　チンポ入ってる方がアナル落ち着く……って、あー、えと、流石に引いた？,sound/data/pcm/c12/h/01.unity3d,h_so_12_03_171
172,12,54,んはっ♪　出てる出てる！　精液どぴゅどぴゅーっ、あはっ、オチンポかわいっ♪,sound/data/pcm/c12/h/01.unity3d,h_so_12_03_172
173,12,54,んぁっ……おまえが出してるの見てたら……なんかあたしまでぇ……んぅぅんっ♪,sound/data/pcm/c12/h/01.unity3d,h_so_12_03_173
174,12,54,もう、こんな濃いのをいつもあたしの中に出してるのか？　うぅ、絶対やばいだろこれ……,sound/data/pcm/c12/h/01.unity3d,h_so_12_03_174
175,12,54,あはぁ♪　ぶっかけマーキングされちゃったな……うんうん、あたしはおまえのものだぞー♪,sound/data/pcm/c12/h/01.unity3d,h_so_12_03_175
176,12,54,なぁなぁ、もっと射精するとこ見たいぃ！　イったばかりの敏感チンポ……手コキしていい？,sound/data/pcm/c12/h/01.unity3d,h_so_12_03_176
177,12,54,はぁ、垂れてるとこ……もっと近くで見てくれよ。二人のが混ざって、凄い事になってるから……,sound/data/pcm/c12/h/01.unity3d,h_so_12_03_177
178,12,54,べとべと精液、オマンコからとろとろ垂れてるぅ……はぁ♪　最後までエッチ過ぎるぅっ……,sound/data/pcm/c12/h/01.unity3d,h_so_12_03_178
179,12,54,いっぱい出された後にぃ……こうやって力入れると、ンッ……ほら、ぶぴって下品な音♪　ぁはっ♪,sound/data/pcm/c12/h/01.unity3d,h_so_12_03_179
180,12,54,んふっ♪　ケツ穴から精液垂れるの見てる時ホント嬉しそうだな……それ、おまえがした結果だぞ？　まったくぅ,sound/data/pcm/c12/h/01.unity3d,h_so_12_03_180
181,12,54,だめ、あたし我慢できない、もっとしてくれ,sound/data/pcm/c12/h/01.unity3d,h_so_12_03_181
182,12,54,まさかもう終わりじゃ……ないよな？,sound/data/pcm/c12/h/01.unity3d,h_so_12_03_182
183,12,54,また溢れて来た、早くオマンコ塞いでくれ,sound/data/pcm/c12/h/01.unity3d,h_so_12_03_183
184,12,54,律儀に言ってくれるとこ、好きだよ,sound/data/pcm/c12/h/01.unity3d,h_so_12_03_184
185,12,54,ほら、ゴム付けてやるから、こっちにチンポ出せ,sound/data/pcm/c12/h/01.unity3d,h_so_12_03_185
186,12,54,あたしだって我慢してるの、だからおまえもゴム付けろ,sound/data/pcm/c12/h/01.unity3d,h_so_12_03_186
187,12,54,安心エッチの方が絶対気持ちいいって、だから、な？,sound/data/pcm/c12/h/01.unity3d,h_so_12_03_187
188,12,54,ふーん、我儘チンポにはおしおきが必要かな？,sound/data/pcm/c12/h/01.unity3d,h_so_12_03_188
189,12,54,またお尻……今度からアナルスキーと呼んでやる,sound/data/pcm/c12/h/01.unity3d,h_so_12_03_189
190,12,54,うん、アナルヒクヒクしてるから、早くっ,sound/data/pcm/c12/h/01.unity3d,h_so_12_03_190
191,12,54,ちょっと拡がり過ぎちゃって、今日はもう怖いかな,sound/data/pcm/c12/h/01.unity3d,h_so_12_03_191
192,12,54,もうやめとこ？　太いうんちしかできない女とかやだろ？,sound/data/pcm/c12/h/01.unity3d,h_so_12_03_192
193,12,54,んふっ、オマンコ頬張り過ぎてキツくないか？,sound/data/pcm/c12/h/01.unity3d,h_so_12_03_193
194,12,54,あぁやばっ、オマンコ喜んじゃってる,sound/data/pcm/c12/h/01.unity3d,h_so_12_03_194
195,12,54,ばかっ、オマンコ驚いちゃうだろ,sound/data/pcm/c12/h/01.unity3d,h_so_12_03_195
196,12,54,はぁ、いきなりチンポぉ……いぃっ,sound/data/pcm/c12/h/01.unity3d,h_so_12_03_196
197,12,54,絶倫タフチンポいいっ、もっと気持ちよくしてくれぇっ,sound/data/pcm/c12/h/01.unity3d,h_so_12_03_197
198,12,54,んぅ、来た！　ケツ穴ごりごり、いぃっ！,sound/data/pcm/c12/h/01.unity3d,h_so_12_03_198
199,12,54,お尻に入ると、支配されてるって感じがして、なんかゾクゾクする,sound/data/pcm/c12/h/01.unity3d,h_so_12_03_199
200,12,54,はぁっ、ズンって来た……お尻でチンポ感じるぅっ,sound/data/pcm/c12/h/01.unity3d,h_so_12_03_200
201,12,54,ひゃぅっ、いきなりは反則ぅ……でも気持ぢい゛ぃっ！,sound/data/pcm/c12/h/01.unity3d,h_so_12_03_201
202,12,54,どうした？　ゆっくり締め付けて欲しいのか？　ん？,sound/data/pcm/c12/h/01.unity3d,h_so_12_03_202
203,12,54,もう出ちゃいそうなのか？　笑わないから、動いちゃえよ,sound/data/pcm/c12/h/01.unity3d,h_so_12_03_203
204,12,54,やっ、お尻期待してるのわかっちゃうから、早く動いてくれよぉっ,sound/data/pcm/c12/h/01.unity3d,h_so_12_03_204
205,12,54,はぁ、お尻の中で脈打ってるのわかるぅ……これ好きぃっ,sound/data/pcm/c12/h/01.unity3d,h_so_12_03_205
206,12,54,入れる時と抜く時って一番ドキドキするから、もっとしていいぞ,sound/data/pcm/c12/h/01.unity3d,h_so_12_03_206
207,12,54,んっふ、好きにしていいんだからな,sound/data/pcm/c12/h/01.unity3d,h_so_12_03_207
208,12,54,ちゃんと準備した筈だけど……に、匂った？,sound/data/pcm/c12/h/01.unity3d,h_so_12_03_208
209,12,54,アナルお預けぇ……うぅ、ヒクヒクしちゃうぅ……,sound/data/pcm/c12/h/01.unity3d,h_so_12_03_209
210,12,54,そんなネットリ責められたら、たまらなくなるぅっ,sound/data/pcm/c12/h/01.unity3d,h_so_12_03_210
211,12,54,ゆっくりオチンポで、弱いとこ探られちゃってるぅ,sound/data/pcm/c12/h/01.unity3d,h_so_12_03_211
212,12,54,ほらほら、もっといけるだろ、ふぁいとふぁいと,sound/data/pcm/c12/h/01.unity3d,h_so_12_03_212
213,12,54,そんなに突かれてたら、勝手に腰動くぅっ,sound/data/pcm/c12/h/01.unity3d,h_so_12_03_213
214,12,54,お尻きゅんきゅんしてるぅ……もう締まりっぱなしぃっ,sound/data/pcm/c12/h/01.unity3d,h_so_12_03_214
215,12,54,はぁ、知ってるか？　お尻も筋肉痛になるんだぞ,sound/data/pcm/c12/h/01.unity3d,h_so_12_03_215
216,12,54,お尻ずぽずぽ、お尻すぽずぽおぉん,sound/data/pcm/c12/h/01.unity3d,h_so_12_03_216
217,12,54,お尻ぐりぐりされて、余裕なくなるぅっ,sound/data/pcm/c12/h/01.unity3d,h_so_12_03_217
218,12,54,あぁ、オチンポで狂わされるぅ、オチンポに服従しちゃぅぅっ,sound/data/pcm/c12/h/01.unity3d,h_so_12_03_218
219,12,54,だめっ、気持ちいいのだめっ、これ以上はぁっ,sound/data/pcm/c12/h/01.unity3d,h_so_12_03_219
220,12,54,奥ぅ、もっと奥トントンぅ、子宮のお口にオチンポキスぅっ,sound/data/pcm/c12/h/01.unity3d,h_so_12_03_220
221,12,54,はぁ、オチンポ、オチンポ、オチンポぉっ,sound/data/pcm/c12/h/01.unity3d,h_so_12_03_221
222,12,54,すっかり開拓されちゃったから、あたしのお尻はもうおまえ専用,sound/data/pcm/c12/h/01.unity3d,h_so_12_03_222
223,12,54,いいぞいいぞ、もっとお尻ほじってくれっ,sound/data/pcm/c12/h/01.unity3d,h_so_12_03_223
224,12,54,溶けるぅ、お尻溶けるぅ、熱くて溶けちゃうぅっ,sound/data/pcm/c12/h/01.unity3d,h_so_12_03_224
225,12,54,がっつかれてるぅ、あたしのお尻、貪られてるぅっ,sound/data/pcm/c12/h/01.unity3d,h_so_12_03_225
226,12,54,ゆっくりピストンで、ねっとりトロトロにされてるぅ,sound/data/pcm/c12/h/01.unity3d,h_so_12_03_226
227,12,54,んはぁっ、オマンコかき混ぜられて、ねちゃねちゃいってるぅっ,sound/data/pcm/c12/h/01.unity3d,h_so_12_03_227
228,12,54,オチンポ出たり入ったり、しゅごいぃっ,sound/data/pcm/c12/h/01.unity3d,h_so_12_03_228
229,12,54,激しいのいいっ、もっとぉ、もっとオマンコしてぇー,sound/data/pcm/c12/h/01.unity3d,h_so_12_03_229
230,12,54,イったばかりの敏感チンポ、また出したいーって震えてるぞ,sound/data/pcm/c12/h/01.unity3d,h_so_12_03_230
231,12,54,ほら、どんどんイけ、あたしの中、おまえの精子でいっぱいにしろ,sound/data/pcm/c12/h/01.unity3d,h_so_12_03_231
232,12,54,敏感ビクビクチンポ、もう無理ぃって泣いてるぞ？　今キュッてしたらぁ……んふふっ,sound/data/pcm/c12/h/01.unity3d,h_so_12_03_232
233,12,54,あはっ、アヘってるアヘってる、そんな顔されたら、虐めたくなっちゃうなぁ,sound/data/pcm/c12/h/01.unity3d,h_so_12_03_233
234,12,54,きでるぅっ、アナルゆっくり掻き回されておかじぐなるぅっ,sound/data/pcm/c12/h/01.unity3d,h_so_12_03_234
235,12,54,お尻焦らすなぁっ、もうほんと無理だからぁっ,sound/data/pcm/c12/h/01.unity3d,h_so_12_03_235
236,12,54,アナルじゅぽじゅぽぉ……あぁ、ケツアクメ来るぅっ！,sound/data/pcm/c12/h/01.unity3d,h_so_12_03_236
237,12,54,んおぉっ、ケツ穴めくれるぅっ、気持よすぎるうっ、イキ狂うぅっ,sound/data/pcm/c12/h/01.unity3d,h_so_12_03_237
238,12,54,オチンポさっきより膨らんでるぞ、どこまで大きくなるのかなっ,sound/data/pcm/c12/h/01.unity3d,h_so_12_03_238
239,12,54,もう痛いくらいなんじゃないか？　ほら、早く楽になっちゃえよ,sound/data/pcm/c12/h/01.unity3d,h_so_12_03_239
240,12,54,まだ出せるのか？　うぁ、す、凄いオチンポなんだなっ,sound/data/pcm/c12/h/01.unity3d,h_so_12_03_240
241,12,54,ちんちんビクビクしてきた、お次の射精はアナルにどーぞっ,sound/data/pcm/c12/h/01.unity3d,h_so_12_03_241
242,12,54,呼吸できなっ、気持ち良すぎて、呼吸がっ,sound/data/pcm/c12/h/01.unity3d,h_so_12_03_242
243,12,54,死んじゃう、こんなの死んじゃう、気持ちいいのもうだめぇっ,sound/data/pcm/c12/h/01.unity3d,h_so_12_03_243
244,12,54,もうどっちも余裕ないけど、イク時は一緒、一緒だからっ,sound/data/pcm/c12/h/01.unity3d,h_so_12_03_244
245,12,54,やっぱり一緒にイキたいから、頑張ろ、ほらもうちょっと,sound/data/pcm/c12/h/01.unity3d,h_so_12_03_245
246,12,54,うん、出せっ、思いっきり射精しちゃえ！　何度でも受け止めてやるからっ,sound/data/pcm/c12/h/01.unity3d,h_so_12_03_246
247,12,54,イケイケ、イッちゃえ、玉からっぽになるまでいっぱい出しちゃえ,sound/data/pcm/c12/h/01.unity3d,h_so_12_03_247
248,12,54,チンポ汁連射しちゃうんだなっ、あぁ、もっとべとべとにしてくれっ,sound/data/pcm/c12/h/01.unity3d,h_so_12_03_248
249,12,54,連続射精で頭真っ白になっちゃえ、二人で真っ白になろ、なっ,sound/data/pcm/c12/h/01.unity3d,h_so_12_03_249
250,12,54,本気ピストンきたぁっ、わかってるからな、いっぱい出しちゃえ,sound/data/pcm/c12/h/01.unity3d,h_so_12_03_250
251,12,54,必死な顔しちゃって、もう、嬉し過ぎるだろ,sound/data/pcm/c12/h/01.unity3d,h_so_12_03_251
252,12,54,ゴム越しチンポ、もう限界なのわかるぅっ,sound/data/pcm/c12/h/01.unity3d,h_so_12_03_252
253,12,54,来てぇっ、いっぱいゴム膨らませてえぇっ,sound/data/pcm/c12/h/01.unity3d,h_so_12_03_253
254,12,54,アナル震えてるぅ、アナル痙攣させながらアクメしちゃうぅっ,sound/data/pcm/c12/h/01.unity3d,h_so_12_03_254
255,12,54,アナル凄い、アナル凄い、アナル凄いぃぃんっ,sound/data/pcm/c12/h/01.unity3d,h_so_12_03_255
256,12,54,わかる、わかるよ、アナルびりびりきてるよ、一緒に、一緒にぃっ,sound/data/pcm/c12/h/01.unity3d,h_so_12_03_256
257,12,54,ほらあたしのリズムに合わせて、いっち、にっ、さん、しっ！,sound/data/pcm/c12/h/01.unity3d,h_so_12_03_257
258,12,54,んはぁ、敏感チンポでぇ、ぐじゅぐじゅアナルに連射してぇっ,sound/data/pcm/c12/h/01.unity3d,h_so_12_03_258
259,12,54,うんうん、アナル真っ白になるまで、いくらでも出していいからなっ,sound/data/pcm/c12/h/01.unity3d,h_so_12_03_259
260,12,54,まだ濃いの出てるぅ、ぷりぷり精子、どくどく子宮に入ってくるぅっ,sound/data/pcm/c12/h/01.unity3d,h_so_12_03_260
261,12,54,あぁ、中出しぃっ、熱々精液、流れ込んできてるぅっ,sound/data/pcm/c12/h/01.unity3d,h_so_12_03_261
262,12,54,またいっぱい出してぇ、ふふっ、ゴムが泣いてるぞ？,sound/data/pcm/c12/h/01.unity3d,h_so_12_03_262
263,12,54,うっ、まさかだけど……あたしゴムに嫉妬してるかも,sound/data/pcm/c12/h/01.unity3d,h_so_12_03_263
264,12,54,うぁぁ、そんなに出されたら、お尻壊れちゃうぅっ,sound/data/pcm/c12/h/01.unity3d,h_so_12_03_264
265,12,54,あぁもっと出してぇ、絶倫チンポ汁でお腹膨らませてぇっ,sound/data/pcm/c12/h/01.unity3d,h_so_12_03_265
266,12,54,んぉおおっ、また下品な声出ちゃうぅっ,sound/data/pcm/c12/h/01.unity3d,h_so_12_03_266
267,12,54,頭おがじぐなるぅぅぅぅっ,sound/data/pcm/c12/h/01.unity3d,h_so_12_03_267
268,12,54,狂うぅ、イキ狂っちゃぅぅっ,sound/data/pcm/c12/h/01.unity3d,h_so_12_03_268
269,12,54,オマンコ溶けるぅぅぅっ,sound/data/pcm/c12/h/01.unity3d,h_so_12_03_269
270,12,54,あはっ、またこんなに出して、ゴムが妊娠しちゃうぞ？,sound/data/pcm/c12/h/01.unity3d,h_so_12_03_270
271,12,54,ゴムって聞くだけで、最近体が疼いちゃうんだ,sound/data/pcm/c12/h/01.unity3d,h_so_12_03_271
272,12,54,はぁ、しあわせぇ……ほんとにしあわせだよぉ……,sound/data/pcm/c12/h/01.unity3d,h_so_12_03_272
273,12,54,えへっ、女の幸せ、教え込まれちゃいましたっ！　なんてなっ,sound/data/pcm/c12/h/01.unity3d,h_so_12_03_273
274,12,54,あたし……良いお母さんになれるかな？,sound/data/pcm/c12/h/01.unity3d,h_so_12_03_274
275,12,54,危ないセックス、病み付きになりそ,sound/data/pcm/c12/h/01.unity3d,h_so_12_03_275
276,12,54,はぁ、相性良すぎるっていうのも困りものだな……,sound/data/pcm/c12/h/01.unity3d,h_so_12_03_276
277,12,54,次はちゃんと頑張るから、あたしだけイッてごめんね,sound/data/pcm/c12/h/01.unity3d,h_so_12_03_277
278,12,54,お尻って……なんなんだろうな……あぁ、これが賢者タイムってやつ？,sound/data/pcm/c12/h/01.unity3d,h_so_12_03_278
279,12,54,アナルでした次の日って、座ってるだけで落ち着かなくなるんだよな,sound/data/pcm/c12/h/01.unity3d,h_so_12_03_279
280,12,54,お尻大好き女にした責任、今日はあと何回で許してやろうかなー,sound/data/pcm/c12/h/01.unity3d,h_so_12_03_280
281,12,54,えっと……お尻でもう一回……いい？,sound/data/pcm/c12/h/01.unity3d,h_so_12_03_281
282,12,54,最近ゴムの匂い嗅ぐだけで発情するって言ったら……引く？,sound/data/pcm/c12/h/01.unity3d,h_so_12_03_282
283,12,54,えっと、これでゴム何個目だっけ？　まだあるけど、足りるかなぁ,sound/data/pcm/c12/h/01.unity3d,h_so_12_03_283
284,12,54,生がこんなに気持ちいいのはゴムのおかげ、感謝しなくちゃな？,sound/data/pcm/c12/h/01.unity3d,h_so_12_03_284
285,12,54,お互いの一番大事なとこ擦り合わせるって、よく考えたら凄い事してるよな,sound/data/pcm/c12/h/01.unity3d,h_so_12_03_285
286,12,54,これはその……プロポーズって事でいいのかな？,sound/data/pcm/c12/h/01.unity3d,h_so_12_03_286
287,12,54,はぁ、結局のところ、許しちゃうあたしが悪いんだよなぁ……,sound/data/pcm/c12/h/01.unity3d,h_so_12_03_287
288,12,54,この反則チンポめぇ……んふぅ～ん、大好きっ,sound/data/pcm/c12/h/01.unity3d,h_so_12_03_288
289,12,54,うぅ～ん、投了、あたしのオマンコはオチンポに勝てません,sound/data/pcm/c12/h/01.unity3d,h_so_12_03_289
290,12,54,あれだけ擦ってまだ元気なんだから……オチンポって凄いんだなぁ……,sound/data/pcm/c12/h/01.unity3d,h_so_12_03_290
291,12,54,アナル気持ち良すぎるぅ……もう一回！　お尻壊れるまでしてぇっ,sound/data/pcm/c12/h/01.unity3d,h_so_12_03_291
292,12,54,あぁ、これでまた明日トイレで喘いじゃうコースだぁ……,sound/data/pcm/c12/h/01.unity3d,h_so_12_03_292
293,12,54,うぅ、アナルで満足させられなかったぁ……なんか屈辱ぅっ,sound/data/pcm/c12/h/01.unity3d,h_so_12_03_293
294,12,54,いっぱい出し過ぎてオチンポびくびくだな、あとでよしよししてやらなきゃ,sound/data/pcm/c12/h/01.unity3d,h_so_12_03_294
295,12,54,うんっ、ゴムにいっぱい出せたな、お利口チンポっ,sound/data/pcm/c12/h/01.unity3d,h_so_12_03_295
296,12,54,はい、オチンポおつかれ、オマンコの中でちょっと休憩なっ,sound/data/pcm/c12/h/01.unity3d,h_so_12_03_296
297,12,54,あ、またイッたなぁ～。おまえがどれだけイケるか試してみよっか？,sound/data/pcm/c12/h/01.unity3d,h_so_12_03_297
298,12,54,子宮ちゅちゅってチンポに吸い付いてるぅ、妊娠準備完了してるぅっ,sound/data/pcm/c12/h/01.unity3d,h_so_12_03_298
299,12,54,危ない日にこんなに出しちゃうって事はぁ……期待していいんだよなっ？,sound/data/pcm/c12/h/01.unity3d,h_so_12_03_299
300,12,54,この先っぽの膨らんでるとこ……ここを子宮に押し付けたら……んあっ,sound/data/pcm/c12/h/01.unity3d,h_so_12_03_300
301,12,54,うわ、ゴムたぷたぷしてる。こんなに出されたら……絶対妊娠しちゃってたよな,sound/data/pcm/c12/h/01.unity3d,h_so_12_03_301
302,12,54,あたしのオマンコ、もうおまえの匂い染み付いちゃってるな,sound/data/pcm/c12/h/01.unity3d,h_so_12_03_302
303,12,54,専用オマンコはどうだった？　ちゃんとお前好みになってたろ？,sound/data/pcm/c12/h/01.unity3d,h_so_12_03_303
304,12,54,危ない方が感じちゃうなんて、あたし達もう完全に変態だよ,sound/data/pcm/c12/h/01.unity3d,h_so_12_03_304
305,12,54,んふっ、あたしはもう覚悟できてるよ。おまえはどうなんだ？　ん？,sound/data/pcm/c12/h/01.unity3d,h_so_12_03_305
306,12,54,うぁぁ～ん、またあたしだけぇ……もう、おまえが満足するまで好きにしていいからっ,sound/data/pcm/c12/h/01.unity3d,h_so_12_03_306
307,12,54,あっれぇ……おかしいなぁ、もうあたしの事とか考えなくていいから、イッて！　お願い！,sound/data/pcm/c12/h/01.unity3d,h_so_12_03_307
308,12,54,アナルファッカーって、ちょっとカッコよくない？,sound/data/pcm/c12/h/01.unity3d,h_so_12_03_308
309,12,54,変態ケツマンコにオチンポミルクたっぷたぷぅっ、お腹膨らんじゃってるぅっ,sound/data/pcm/c12/h/01.unity3d,h_so_12_03_309
310,12,54,あぁ、精液の匂い濃すぎて、オマンコまた発情しちゃった……,sound/data/pcm/c12/h/01.unity3d,h_so_12_03_310
311,12,54,んっふっ、あたしの体、精液でべっとべと……はぇ、ちゅっ、これ最高……,sound/data/pcm/c12/h/01.unity3d,h_so_12_03_311
312,12,54,まだ残ってそうだな、んふっ、最後の一滴まで搾り取ってやるからな,sound/data/pcm/c12/h/01.unity3d,h_so_12_03_312
313,12,54,あたしさ……男の潮吹き……見てみたい,sound/data/pcm/c12/h/01.unity3d,h_so_12_03_313
314,12,54,ほら、おまえの好きなやつ、中出しの証。もっと近くで見ていいぞ,sound/data/pcm/c12/h/01.unity3d,h_so_12_03_314
315,12,54,んぁぁっん、白うんち漏れちゃってるぅっ……匂い嗅いでぇっ,sound/data/pcm/c12/h/01.unity3d,h_so_12_03_315
