管理番号,大きい項目,中間項目,表示名,バンドルパス,ファイル名
0,33,57,ムラムラしてる女の子たちの目の前で、そんなギンギンなチンポ出して……どうなっても知らないんだから♡,sound/data/pcm/c33/h/01.unity3d,h_hh3p_33_03_000
1,33,57,それじゃ、二人で一本のおちんちんを貪り尽くしちゃいましょうか♡,sound/data/pcm/c33/h/01.unity3d,h_hh3p_33_03_001
2,33,57,あなたのお仕事は、私たちにべろべろ舐められて、射精することよ♡,sound/data/pcm/c33/h/01.unity3d,h_hh3p_33_03_004
3,33,57,カリ首に溜まったチンカスも、鈴口に残ったおしっこも、一日搔いた汗も全部舐め取ってあげる♡,sound/data/pcm/c33/h/01.unity3d,h_hh3p_33_03_005
4,33,57,おちんぽ、見た目もにおいもいつもよりスケベなことになってるわよ……♡,sound/data/pcm/c33/h/01.unity3d,h_hh3p_33_03_006
5,33,57,もうほとんど取り合いね♡,sound/data/pcm/c33/h/01.unity3d,h_hh3p_33_03_007
6,33,57,あなたのお仕事は、私たちにべろべろ舐められて、射精することよ♡,sound/data/pcm/c33/h/01.unity3d,h_hh3p_33_03_012
7,33,57,カリ首に溜まったチンカスも、鈴口に残ったおしっこも、一日搔いた汗も全部舐め取ってあげる♡,sound/data/pcm/c33/h/01.unity3d,h_hh3p_33_03_013
8,33,57,おちんぽ、見た目もにおいもいつもよりスケベなことになってるわよ……♡,sound/data/pcm/c33/h/01.unity3d,h_hh3p_33_03_014
9,33,57,もうほとんど取り合いね♡,sound/data/pcm/c33/h/01.unity3d,h_hh3p_33_03_015
10,33,57,この子も頑張ってるけど、私の方がスケベったらしく射精に導いてあげるんだから♡,sound/data/pcm/c33/h/01.unity3d,h_hh3p_33_03_016
11,33,57,そろそろ射精のお時間よ、部長さん♡,sound/data/pcm/c33/h/01.unity3d,h_hh3p_33_03_017
12,33,57,なら、ギリギリまでお口の中で亀頭をころころしてあげる♡,sound/data/pcm/c33/h/01.unity3d,h_hh3p_33_03_020
13,33,57,最後にいっぱい吸い付いて、精液をぜぇんぶ搾り出してあげる♡,sound/data/pcm/c33/h/01.unity3d,h_hh3p_33_03_021
14,33,57,ふふっ、誘惑しすぎちゃったかしら？　私のお口に出して、キンタマが空っぽになるぐらいね♡,sound/data/pcm/c33/h/01.unity3d,h_hh3p_33_03_022
15,33,57,言ったわね？　その通り、あなたのイキそうなチンポ、独り占めしちゃうから♡,sound/data/pcm/c33/h/01.unity3d,h_hh3p_33_03_023
16,33,57,こんな不平等射精する男の子に、一夫多妻制は無理そうね……♡,sound/data/pcm/c33/h/01.unity3d,h_hh3p_33_03_032
