管理番号,大きい項目,中間項目,表示名,バンドルパス,ファイル名
0,42,31,心の準備はできてるから、いつ始めてもいいよー,sound/data/pcm/c42/h/71.unity3d,h_ai_42_01_000
1,42,31,見てるだけじゃなくて、触ってほしいなぁ……,sound/data/pcm/c42/h/71.unity3d,h_ai_42_01_001
2,42,31,どこからやっちゃうか、迷ってるのかなぁ？,sound/data/pcm/c42/h/71.unity3d,h_ai_42_01_002
3,42,31,チュウで……とろとろになっちゃう、よぉ……,sound/data/pcm/c42/h/71.unity3d,h_ai_42_01_003
4,42,31,キス、気持ち良くて……身体が熱い、のぉ,sound/data/pcm/c42/h/71.unity3d,h_ai_42_01_004
5,42,31,あぅ……もぉ、キス……終わりなのかなー……？,sound/data/pcm/c42/h/71.unity3d,h_ai_42_01_005
6,42,31,チュウしただけで、エッチな気分になって来ちゃったぁ……,sound/data/pcm/c42/h/71.unity3d,h_ai_42_01_006
7,42,31,ねぇ、もっとキスしてぇこれ、大好きぃ……,sound/data/pcm/c42/h/71.unity3d,h_ai_42_01_007
8,42,31,チュウで、頭の中が真っ白になっちゃったぁ……えへへ,sound/data/pcm/c42/h/71.unity3d,h_ai_42_01_008
9,42,31,だめぇ、そんなに強くしたら痛くなっちゃうよぉ,sound/data/pcm/c42/h/71.unity3d,h_ai_42_01_035
10,42,31,それ、少し嫌かもぉ。もっと優しくして欲しいなー,sound/data/pcm/c42/h/71.unity3d,h_ai_42_01_036
11,42,31,そういうの好きじゃないから……優しくしてねー？,sound/data/pcm/c42/h/71.unity3d,h_ai_42_01_037
12,42,31,どうして、そんなにお尻が好きなのかなぁ……？,sound/data/pcm/c42/h/71.unity3d,h_ai_42_01_038
13,42,31,そんなにお尻が良いのぉ？　私は変な感じするのに……,sound/data/pcm/c42/h/71.unity3d,h_ai_42_01_039
14,42,31,んぅ、キミはお尻に興味あるんだね……？,sound/data/pcm/c42/h/71.unity3d,h_ai_42_01_040
15,42,31,それ、刺激が強すぎるからぁ……あんまりしちゃヤダよぉ,sound/data/pcm/c42/h/71.unity3d,h_ai_42_01_041
16,42,31,それを使わなくても、気持ち良くなれるよ……？,sound/data/pcm/c42/h/71.unity3d,h_ai_42_01_042
17,42,31,どうしておもちゃを使いたがるのぉ……？,sound/data/pcm/c42/h/71.unity3d,h_ai_42_01_043
18,42,31,キミは揉み揉みが好きなのかなー？　私も、これは好きかもぉ,sound/data/pcm/c42/h/71.unity3d,h_ai_42_01_044
19,42,31,先っぽを何度もツンツンされると、身体がビクンってしちゃうよぉ,sound/data/pcm/c42/h/71.unity3d,h_ai_42_01_051
20,42,31,ああ、グイグイされて、ちょっと気持ちいい……,sound/data/pcm/c42/h/71.unity3d,h_ai_42_01_054
21,42,31,あぅ……お尻で、気持ち良くなっちゃうぅ……,sound/data/pcm/c42/h/71.unity3d,h_ai_42_01_057
22,42,31,キミにこすられるだけで、いっぱいエッチなおつゆが出ちゃうよぉ……,sound/data/pcm/c42/h/71.unity3d,h_ai_42_01_060
23,42,31,お尻いっぱいこすられたら、身体が震えちゃうよぉ……,sound/data/pcm/c42/h/71.unity3d,h_ai_42_01_063
24,42,31,トロトロの私の中に、キミの指……入っちゃってるぅ……,sound/data/pcm/c42/h/71.unity3d,h_ai_42_01_066
25,42,31,キミの指で、お尻が拡がっちゃう……,sound/data/pcm/c42/h/71.unity3d,h_ai_42_01_069
26,42,31,あそこを掻き回しちゃ、だめぇ……感じちゃうのぉ,sound/data/pcm/c42/h/71.unity3d,h_ai_42_01_072
27,42,31,いけないことなのに、お尻が気持ちいいのぉ……,sound/data/pcm/c42/h/71.unity3d,h_ai_42_01_075
28,42,31,もしかして、女の子を舐めるのが好きなの……？,sound/data/pcm/c42/h/71.unity3d,h_ai_42_01_078
29,42,31,乳首を舐めて、なんだか赤ちゃんみたいだねー,sound/data/pcm/c42/h/71.unity3d,h_ai_42_01_081
30,42,31,あそこ、舐められちゃうなんて……気持ちいいけど恥ずかしいよぉ,sound/data/pcm/c42/h/71.unity3d,h_ai_42_01_083
31,42,31,お尻、ぺろぺろするなんて嫌じゃないのぉ……？,sound/data/pcm/c42/h/71.unity3d,h_ai_42_01_085
32,42,31,ひゃぅっ、お、お尻の中まで舐め回されちゃってるぅ……,sound/data/pcm/c42/h/71.unity3d,h_ai_42_01_087
33,42,31,すごい振動で、私……感じちゃってるぅ……,sound/data/pcm/c42/h/71.unity3d,h_ai_42_01_090
34,42,31,先っぽ、そんなにぶるぶるされたら痺れちゃうよぉ……,sound/data/pcm/c42/h/71.unity3d,h_ai_42_01_093
35,42,31,そんなに、オモチャであそこを弄っちゃ……えっちなお汁あふれちゃうぅ,sound/data/pcm/c42/h/71.unity3d,h_ai_42_01_095
36,42,31,イッても良いかなー……？　私、もぉ限界が近いのぉ……っ,sound/data/pcm/c42/h/71.unity3d,h_ai_42_01_097
37,42,31,イカされちゃったぁ……キミにされると、すぐ気持ち良くなっちゃうよぉ,sound/data/pcm/c42/h/71.unity3d,h_ai_42_01_101
38,42,31,キミにいろいろされるの、クセになっちゃいそうかもぉ……えへへ,sound/data/pcm/c42/h/71.unity3d,h_ai_42_01_102
39,42,31,私ばっかり、気持ち良くなっちゃったぁ……ごめんねー？,sound/data/pcm/c42/h/71.unity3d,h_ai_42_01_103
40,42,31,キス、何度しても気持ちいいよぉ……,sound/data/pcm/c42/h/71.unity3d,h_ai_42_01_106
41,42,31,気持ち良くて、チューは何度でもしたくなっちゃう……,sound/data/pcm/c42/h/71.unity3d,h_ai_42_01_107
42,42,31,キスは終わりー？　えへへ、もっとしても良いんだよぉ……？,sound/data/pcm/c42/h/71.unity3d,h_ai_42_01_108
43,42,31,はぅ……チューだけで、気持ち良くなっちゃう……,sound/data/pcm/c42/h/71.unity3d,h_ai_42_01_109
44,42,31,もっと、もっと、いっぱいキスしてぇ……キミとのキス、好きぃ,sound/data/pcm/c42/h/71.unity3d,h_ai_42_01_110
45,42,31,いつまでも、キミとチューしていたいよぉ……,sound/data/pcm/c42/h/71.unity3d,h_ai_42_01_111
46,42,31,乱暴にしちゃうくらい、私の身体を触りたかったのー……？,sound/data/pcm/c42/h/71.unity3d,h_ai_42_01_131
47,42,31,男の子は強引なんだねー。もう少し優しくして欲しいな,sound/data/pcm/c42/h/71.unity3d,h_ai_42_01_132
48,42,31,お尻は複雑な気持ちだけど……キミは本当に好きだねー？,sound/data/pcm/c42/h/71.unity3d,h_ai_42_01_133
49,42,31,あんまり、お尻ばっかり弄っちゃダメだよぉ……？,sound/data/pcm/c42/h/71.unity3d,h_ai_42_01_134
50,42,31,オモチャは複雑な気分だし、キミに直接してほしいよぉ……,sound/data/pcm/c42/h/71.unity3d,h_ai_42_01_135
51,42,31,それ、刺激がすごすぎるから……ちょっと不安かも……,sound/data/pcm/c42/h/71.unity3d,h_ai_42_01_136
52,42,31,気持ちいいのでいっぱいになって、頭の中が真っ白だよぉ……,sound/data/pcm/c42/h/71.unity3d,h_ai_42_01_173
53,42,31,キミにいっぱいイカされちゃったぁもぉ、力が入らなくなっちゃう……,sound/data/pcm/c42/h/71.unity3d,h_ai_42_01_174
54,42,31,"（開始,勉強中）さあて、しっかりやるぞー",sound/data/pcm/c42/h/71.unity3d,h_ai_42_01_188
55,42,31,（Ｈシーン中初めて触った時限定）な、なに？　どうしたのー？,sound/data/pcm/c42/h/71.unity3d,h_ai_42_01_189
56,42,31,ま、待ってぇー……,sound/data/pcm/c42/h/71.unity3d,h_ai_42_01_190
57,42,31,変な気分になっちゃうよぉ……,sound/data/pcm/c42/h/71.unity3d,h_ai_42_01_191
58,42,31,も、もぉ、集中できなくなっちゃう……,sound/data/pcm/c42/h/71.unity3d,h_ai_42_01_192
59,42,31,声、出ちゃいそう……だよぉ……,sound/data/pcm/c42/h/71.unity3d,h_ai_42_01_193
60,42,31,気持ち良く、なっちゃう……よぉ,sound/data/pcm/c42/h/71.unity3d,h_ai_42_01_194
61,42,31,（拒否して外される）もぉ、イタズラしちゃだめー……,sound/data/pcm/c42/h/71.unity3d,h_ai_42_01_195
62,42,31,そ、それ以上されたら、困っちゃうよぉ……？,sound/data/pcm/c42/h/71.unity3d,h_ai_42_01_196
63,42,31,ど、どうしよう、私……イッちゃいそぉ……,sound/data/pcm/c42/h/71.unity3d,h_ai_42_01_197
64,42,31,どんどん、イキたくなってきちゃってる、我慢できない……,sound/data/pcm/c42/h/71.unity3d,h_ai_42_01_198
65,42,31,はぅ……もぉ、これはやりすぎだよぉ……,sound/data/pcm/c42/h/71.unity3d,h_ai_42_01_199
66,42,31,あうぅ……やっぱり我慢できなかったぁ……,sound/data/pcm/c42/h/71.unity3d,h_ai_42_01_200
