管理番号,大きい項目,中間項目,表示名,バンドルパス,ファイル名
0,23,54,ねぇ、もう我慢できないよぉ……はやくおちんぽちょうだぁい……,sound/data/pcm/c23/h/01.unity3d,h_so_23_03_000
1,23,54,ねぇ……見て？　キミのおちんちん見てたら……ワタシのおまんこ……もうぐちょぐちょにになってるの……,sound/data/pcm/c23/h/01.unity3d,h_so_23_03_001
2,23,54,キミが……ワタシを……こんな変態さんにしたんだからね？　だから……今日も気持ちよくしてね？　,sound/data/pcm/c23/h/01.unity3d,h_so_23_03_002
3,23,54,うん、来て……今日は……キミとエッチすることばっかり考えてたんだ……,sound/data/pcm/c23/h/01.unity3d,h_so_23_03_003
4,23,54,焦らしちゃ嫌ぁ……ここのジュクジュクになった……おまんこに入れてぇ……,sound/data/pcm/c23/h/01.unity3d,h_so_23_03_004
5,23,54,えへへ……私のエッチな格好を見て……勃起したオチンポ入れちゃうんだ……いいよぉ……,sound/data/pcm/c23/h/01.unity3d,h_so_23_03_005
6,23,54,ゴム、ワタシがよういしてるよ。箱で……持ってきてるから、何回もできるよ……,sound/data/pcm/c23/h/01.unity3d,h_so_23_03_006
7,23,54,ゴム忘れてるよ？　付けるのが面倒なら……ワタシがつけてあげるよ？　,sound/data/pcm/c23/h/01.unity3d,h_so_23_03_007
8,23,54,ゴムつけてくれなきゃ……だめ。だって……妊娠したら、エッチできなくなっちゃうし……,sound/data/pcm/c23/h/01.unity3d,h_so_23_03_008
9,23,54,もしかして……危険日の私に……思いきり中だししたいの……？　,sound/data/pcm/c23/h/01.unity3d,h_so_23_03_009
10,23,54,えへへ……私たちってやっぱり気が合うね。ワタシもアナルに入れてほしかったんだ……,sound/data/pcm/c23/h/01.unity3d,h_so_23_03_010
11,23,54,キミ専用のアナル……いや、ケツマンコって言ったほうがいいかな？　使っちゃう？　,sound/data/pcm/c23/h/01.unity3d,h_so_23_03_011
12,23,54,ダメ。あ、勘違いしないでね、したくないとかじゃなくて……その、この前……キミにほじられすぎて……ちょっぴり痛いの,sound/data/pcm/c23/h/01.unity3d,h_so_23_03_012
13,23,54,ごめんね……お尻も好きだけど……本当にごめんね、オマンコうずうずしてもうおかしくなりそうなのぉ……,sound/data/pcm/c23/h/01.unity3d,h_so_23_03_013
14,23,54,んあぁっん……相性ピッタリぃ……おちんぽいいぃ……,sound/data/pcm/c23/h/01.unity3d,h_so_23_03_014
15,23,54,あぁぁんっ！　いきなりっ入れられたのにっ……感じちゃうよぉ……！　,sound/data/pcm/c23/h/01.unity3d,h_so_23_03_015
16,23,54,あ、アナルぅ……気持ちいぃよぉ……,sound/data/pcm/c23/h/01.unity3d,h_so_23_03_016
17,23,54,はぁ、はぁ……いきなりアナルに……入れられちゃうのって興奮しちゃう……,sound/data/pcm/c23/h/01.unity3d,h_so_23_03_017
18,23,54,キミのおちんちん、ワタシのおまんこの中で……ピクピクしてる……,sound/data/pcm/c23/h/01.unity3d,h_so_23_03_018
19,23,54,ワタシのオマンコで……キミが喜んでくれるのがわかる……嬉しいよぉ……,sound/data/pcm/c23/h/01.unity3d,h_so_23_03_019
20,23,54,キミのおちんぽ……ワタシの中で反り返ってる……き、気持ちいいよぉ……,sound/data/pcm/c23/h/01.unity3d,h_so_23_03_020
21,23,54,キミの……おちんぽが入ってくるだけで、今までのエッチを思い出してイッちゃいそう……,sound/data/pcm/c23/h/01.unity3d,h_so_23_03_021
22,23,54,おちんぽが……入ってくるだけなのに……もうイっちゃいそうだよぉ……,sound/data/pcm/c23/h/01.unity3d,h_so_23_03_022
23,23,54,えへへ、ワタシのアナル……どう？　気持ちいい？　,sound/data/pcm/c23/h/01.unity3d,h_so_23_03_023
24,23,54,アナル……いいよぉ……キュンキュンしちゃう……,sound/data/pcm/c23/h/01.unity3d,h_so_23_03_024
25,23,54,えへへ……好きな子にはイタズラしちゃうってやつかな？　,sound/data/pcm/c23/h/01.unity3d,h_so_23_03_025
26,23,54,もう……アナルにいきなりなんて……スケベなんだから……,sound/data/pcm/c23/h/01.unity3d,h_so_23_03_026
27,23,54,ワタシのどんなエッチな姿を想像してるの？　,sound/data/pcm/c23/h/01.unity3d,h_so_23_03_027
28,23,54,んんっ……本当に……スケベなんだからぁ……,sound/data/pcm/c23/h/01.unity3d,h_so_23_03_028
29,23,54,あぁ……どんどん……エッチな気分になっていくよぉ……,sound/data/pcm/c23/h/01.unity3d,h_so_23_03_029
30,23,54,ねえ、早く突いてぇ……もう我慢できないのぉ……,sound/data/pcm/c23/h/01.unity3d,h_so_23_03_030
31,23,54,早く動いてぇ……焦らさないでぇ……,sound/data/pcm/c23/h/01.unity3d,h_so_23_03_031
32,23,54,もう……動かないなんて……意地悪なんだからぁ……,sound/data/pcm/c23/h/01.unity3d,h_so_23_03_032
33,23,54,あんっ、もうっ焦らしプレイなんてイジワルしないでぇ……,sound/data/pcm/c23/h/01.unity3d,h_so_23_03_033
34,23,54,ほしいの……おちんぽがほしいのぉ……,sound/data/pcm/c23/h/01.unity3d,h_so_23_03_034
35,23,54,キミの……固いおちんぽが欲しいのぉ……頂戴……,sound/data/pcm/c23/h/01.unity3d,h_so_23_03_035
36,23,54,あぁあ……抜いたらダメぇ……抜ける時にすごい快感がくるからぁ……,sound/data/pcm/c23/h/01.unity3d,h_so_23_03_036
37,23,54,まるで……すごく太いうんちしちゃった時と……同じ、ゾクッとしちゃう……,sound/data/pcm/c23/h/01.unity3d,h_so_23_03_037
38,23,54,アナルに入ってるのに……子宮が反応しちゃってるよぉ……,sound/data/pcm/c23/h/01.unity3d,h_so_23_03_038
39,23,54,キミの……ゆっくりおちんぽごりごり……好きだよぉ……,sound/data/pcm/c23/h/01.unity3d,h_so_23_03_039
40,23,54,自然と……身体が反っちゃうの……はぁんっ,sound/data/pcm/c23/h/01.unity3d,h_so_23_03_040
41,23,54,んんっ……じわじわきてるぅ……たまらないよぉ……,sound/data/pcm/c23/h/01.unity3d,h_so_23_03_041
42,23,54,あっあっあぁんっ……もっと速くピストンしてぇ……あぁんっ、これ好きぃ,sound/data/pcm/c23/h/01.unity3d,h_so_23_03_042
43,23,54,んんっ……あんっ……おちんぽが……出たり入ったり……気持ちいいよぉ……,sound/data/pcm/c23/h/01.unity3d,h_so_23_03_043
44,23,54,もっと……突いてぇ……そう、そうだよ……しゅきぃ……,sound/data/pcm/c23/h/01.unity3d,h_so_23_03_044
45,23,54,んっ、はあぁんっ、お尻、イイぃんっ……,sound/data/pcm/c23/h/01.unity3d,h_so_23_03_045
46,23,54,アナル……むっちりしたおちんぽで……なでなでしてぇっ……,sound/data/pcm/c23/h/01.unity3d,h_so_23_03_046
47,23,54,おちんちんで……アナル弄られるの好きになっちゃうよぉ……,sound/data/pcm/c23/h/01.unity3d,h_so_23_03_047
48,23,54,アナル、ずぽハメ好っきぃっ……おまんこよりイイかもぉっ……,sound/data/pcm/c23/h/01.unity3d,h_so_23_03_048
49,23,54,アナル好きぃ……おまんこよりもしゅきぃ……,sound/data/pcm/c23/h/01.unity3d,h_so_23_03_049
50,23,54,お尻……気持ちいいよぉ……気持ちのいいところに……ガンガン当たるよぉ……,sound/data/pcm/c23/h/01.unity3d,h_so_23_03_050
51,23,54,んっはあぁ、あんっ、えへへ……おちんぽおっきくなった……,sound/data/pcm/c23/h/01.unity3d,h_so_23_03_051
52,23,54,あんっ……んやぁぁっ……いいよ……もっと触ってぇっ……,sound/data/pcm/c23/h/01.unity3d,h_so_23_03_052
53,23,54,はぁんっ、弱点知り尽くされてるのって……宿命のライバルみたい……あんんっ……,sound/data/pcm/c23/h/01.unity3d,h_so_23_03_053
54,23,54,はぁんっ、弱いところ……全部ばれちゃってるぅぅううっ……！,sound/data/pcm/c23/h/01.unity3d,h_so_23_03_054
55,23,54,そこは嫌だって……どうしてそんな……意地悪なのぉ……,sound/data/pcm/c23/h/01.unity3d,h_so_23_03_055
56,23,54,んもう、そこは嫌だって言ってるのに……イジワルぅ……,sound/data/pcm/c23/h/01.unity3d,h_so_23_03_056
57,23,54,さ、触るのもいいけど……でも……おちんぽもしっかり動かしてね？　,sound/data/pcm/c23/h/01.unity3d,h_so_23_03_057
58,23,54,そこ、触られてると気持ちよくなるの……。おちんぽも気持ちいい……,sound/data/pcm/c23/h/01.unity3d,h_so_23_03_058
59,23,54,ガツンてされるとクラクラしちゃうぅうんっ……,sound/data/pcm/c23/h/01.unity3d,h_so_23_03_059
60,23,54,ズンって……奥に当たってるよぉ……,sound/data/pcm/c23/h/01.unity3d,h_so_23_03_060
61,23,54,ひっ、おおぉっ……頭の奥に……響いてくるよぉ……,sound/data/pcm/c23/h/01.unity3d,h_so_23_03_061
62,23,54,んあぁああっ……これを待ってたのぉおっ……ごりゅごりゅしてええっ,sound/data/pcm/c23/h/01.unity3d,h_so_23_03_062
63,23,54,おまんこの中……キミのでいっぱいだよぉ……っはぁっ……！,sound/data/pcm/c23/h/01.unity3d,h_so_23_03_063
64,23,54,おちんちん……ワタシの中でごりゅごりゅされてるよぉ……,sound/data/pcm/c23/h/01.unity3d,h_so_23_03_064
65,23,54,あぁんんっ、ワタシに気を遣わなくていいよぉっ、もっとガツガツちょうだぁい,sound/data/pcm/c23/h/01.unity3d,h_so_23_03_065
66,23,54,お、お尻にキミのおちんぽ……もっとちょうだぁい……,sound/data/pcm/c23/h/01.unity3d,h_so_23_03_066
67,23,54,ワタシに、気を遣わなくていいよぉっ……もっと激しくぅ……,sound/data/pcm/c23/h/01.unity3d,h_so_23_03_067
68,23,54,んおぉおおっ……アナル好き、好きぃいっ……,sound/data/pcm/c23/h/01.unity3d,h_so_23_03_068
69,23,54,アナルだいしゅき……アナルの極太うんちみたいなおちんちん……さいっこうだよぉ……,sound/data/pcm/c23/h/01.unity3d,h_so_23_03_069
70,23,54,アナルぅ、アナル好き、好きぃいっ、だいしゅきぃ！　,sound/data/pcm/c23/h/01.unity3d,h_so_23_03_070
71,23,54,あぁんっ、触り方すごくエッチで好きぃっ！　おちんぽも、ほしい、あぁんっ,sound/data/pcm/c23/h/01.unity3d,h_so_23_03_071
72,23,54,触り方、すごくエッチ……しゅきぃ……もっと触ってぇ……,sound/data/pcm/c23/h/01.unity3d,h_so_23_03_072
73,23,54,んあぁあっ……それ、キミの虜になっちゃうやつぅっ、もうダメ、ああんっ……,sound/data/pcm/c23/h/01.unity3d,h_so_23_03_073
74,23,54,も、もう……ワタシ、キミの虜だよぉ……メインヒロインだよぉ……,sound/data/pcm/c23/h/01.unity3d,h_so_23_03_074
75,23,54,そこ苦手なのに……あぁっあ、あ、おちんぽ気持ちよすぎてわすれちゃううぅぅ……,sound/data/pcm/c23/h/01.unity3d,h_so_23_03_075
76,23,54,おちんぽがぁ……気持ちよすぎて、そこ触られるのも気にならないよぉぉっ……！,sound/data/pcm/c23/h/01.unity3d,h_so_23_03_076
77,23,54,あぁあんっ　やっぱり気持ち、いい、かも、はぁんっ、おちんぽと一緒いぃい～,sound/data/pcm/c23/h/01.unity3d,h_so_23_03_077
78,23,54,そこだめだってっ……だめなのにぃ……気持ち、いいぃ……,sound/data/pcm/c23/h/01.unity3d,h_so_23_03_078
79,23,54,あっあ、あ、はい、あぁんして……んりゅれるっ、んちゅっぐっちゅ、ぢゅ、んんぅうっ,sound/data/pcm/c23/h/01.unity3d,h_so_23_03_079
80,23,54,んりゅれるっ、んちゅっぐっちゅ、ぢゅ、んんぅうっ……キス、しゅきぃ,sound/data/pcm/c23/h/01.unity3d,h_so_23_03_080
81,23,54,んんっんっんっ、んりゅっ、ぢゅるるっ、キミの唾液おいしぃっ　次は精液、ね？　れるっ、りゅっぢゅぷ、んにゅるっ,sound/data/pcm/c23/h/01.unity3d,h_so_23_03_081
82,23,54,唾液だけじゃなくて、おちんぽミルクも頂戴っ……,sound/data/pcm/c23/h/01.unity3d,h_so_23_03_082
83,23,54,んりゅれぷっ、んんっ……れりゅっぷ……んあぁあんチュッチュピストン好き、好きぃ……,sound/data/pcm/c23/h/01.unity3d,h_so_23_03_083
84,23,54,チュッチュピストン好き、好きぃ、だいしゅきぃ……れりゅっぷ、んあぁあん……　,sound/data/pcm/c23/h/01.unity3d,h_so_23_03_084
85,23,54,ンゥッ……んっ……んちゅぅうっっ……好きなだけキスまみれにしてぇっ,sound/data/pcm/c23/h/01.unity3d,h_so_23_03_085
86,23,54,んじゅるっ、ンゥッ……下のお口も上のお口もチュッチュしてぇ……,sound/data/pcm/c23/h/01.unity3d,h_so_23_03_086
87,23,54,なんか今日、はぁんっ、ワタシの方が先にイッちゃいそぅ……一緒にイキたいからワタシも動いちゃうね,sound/data/pcm/c23/h/01.unity3d,h_so_23_03_087
88,23,54,ワタシの方が先にイッちゃいそう……一緒にイキたいから……我慢する、んんんっ……,sound/data/pcm/c23/h/01.unity3d,h_so_23_03_088
89,23,54,ああぁんっすけべスイッチ入っちゃうぅっ、ワタシを知り尽くされてる感じ気持ちよすぎるのぉっ,sound/data/pcm/c23/h/01.unity3d,h_so_23_03_089
90,23,54,気持ちよすぎるのぉっ……ああぁんっすけべスイッチ入っちゃうぅ……,sound/data/pcm/c23/h/01.unity3d,h_so_23_03_090
91,23,54,はぁあんっ、あ、あ、あ、そろそろイキそうなの？　いいよっ来てぇ、おちんぽミルクぜんぶちょうだぁい,sound/data/pcm/c23/h/01.unity3d,h_so_23_03_091
92,23,54,そろそろイキそうなの？　いいよっ、おちんぽミルクぜんぶちょうだぁい、どぴゅってちょうだぁい,sound/data/pcm/c23/h/01.unity3d,h_so_23_03_092
93,23,54,ひぁぁあっ……！　あん……そのまま突いて……ワタシにキミの熱い気持ち全部かけてぇっ……愛してるのぉっ！　,sound/data/pcm/c23/h/01.unity3d,h_so_23_03_093
94,23,54,ふぁぁぁっ……やぁぁ……そのまま続けて、おちんぽミルク、かけてほしいぃの……,sound/data/pcm/c23/h/01.unity3d,h_so_23_03_094
95,23,54,そ、それ弱いのぉっ、ゴリゴリのおっきいおちんちんでの、ゆっくりアナルいいぃっ、あ、もう、ひぃいんっ,sound/data/pcm/c23/h/01.unity3d,h_so_23_03_095
96,23,54,ゆっくりアナルいいぃっ、あ、もう、ひぃいんっ……よ、ひょわいのぉ……,sound/data/pcm/c23/h/01.unity3d,h_so_23_03_096
97,23,54,ああぁっらめ、らめええっ、おならでちゃうぐらいおっきいアナルイキきちゃうううう！,sound/data/pcm/c23/h/01.unity3d,h_so_23_03_097
98,23,54,アナルで……イっちゃうよぉ……あひぃ……あんんんっ……,sound/data/pcm/c23/h/01.unity3d,h_so_23_03_098
99,23,54,あぁあんっ！　おちんぽが膨らんでアナル拡張されちゃってるぅっ、いっぱい突いていいからね、んんぅっ,sound/data/pcm/c23/h/01.unity3d,h_so_23_03_099
100,23,54,おちんぽがおっきくてアナルひろげられてるぅ……あんんっ……,sound/data/pcm/c23/h/01.unity3d,h_so_23_03_100
101,23,54,んあぁああんっ、そのままがつがつアナルほじってぇっ……気持ちいいからぁ……,sound/data/pcm/c23/h/01.unity3d,h_so_23_03_101
102,23,54,あ、あ、あ、あ、おちんぽミルク漏れてきてるぅっ、そのまま、がつがつアナルほじってぇっ,sound/data/pcm/c23/h/01.unity3d,h_so_23_03_102
103,23,54,あんっあ、あ、あ、あぁぁっイく、イッちゃう、キミにイカされちゃううう！　,sound/data/pcm/c23/h/01.unity3d,h_so_23_03_103
104,23,54,あぁぁっイく、イッちゃう、イカされちゃううう……あああああぁぁぁぁっ……！　,sound/data/pcm/c23/h/01.unity3d,h_so_23_03_104
105,23,54,ふ、ふたりでイこっ……おちんちんとおまんこで仲良ししながらビクビクしよっ、あんっ、あ、はぁんっ,sound/data/pcm/c23/h/01.unity3d,h_so_23_03_105
106,23,54,はあっはあ、ああんっ……二人で一緒にイこう？　一緒に……ビクビクしよ？　あんっ、あ、はぁんっ……,sound/data/pcm/c23/h/01.unity3d,h_so_23_03_106
107,23,54,キミ専用のおまんこに全部出してぇっ、特濃おちんぽミルクあーんして待ってるからぁっ、あ、あ、ひぁああんっ,sound/data/pcm/c23/h/01.unity3d,h_so_23_03_107
108,23,54,おちんぽミルク全部出してぇっ、待ってるからぁっ、あ、あ、ひぁああんっ,sound/data/pcm/c23/h/01.unity3d,h_so_23_03_108
109,23,54,あっ、うんっ……抜く時、カリでおまんこいっぱい擦ってね、はぁっ、ああんっ,sound/data/pcm/c23/h/01.unity3d,h_so_23_03_109
110,23,54,はぁんっ、あっ、うんっ……おちんぽミルク、いっぱいかけてぇ！　,sound/data/pcm/c23/h/01.unity3d,h_so_23_03_110
111,23,54,好きな方に、あんっ、タップリ出してね……んっ、あんっあんっ,sound/data/pcm/c23/h/01.unity3d,h_so_23_03_111
112,23,54,あっんあっ、はあっんっ、うふふ、外でも、中でも好きな方に、あんっ、タップリおちんぽミルク、出してね,sound/data/pcm/c23/h/01.unity3d,h_so_23_03_112
113,23,54,ゴムしてるから、あんっ、将来赤ちゃんを作るときの練習しちゃお？　思いきり奥でドピュドピュしてぇっ♪,sound/data/pcm/c23/h/01.unity3d,h_so_23_03_113
114,23,54,キミの精液……思いっきり奥にぶちまけてぇっ……！　んぁぁ……もう……だめぇぇぇぇえっ……！,sound/data/pcm/c23/h/01.unity3d,h_so_23_03_114
115,23,54,あ、あ、あ、あ、１回イカせて、お尻来ちゃいそう、あんっ、お尻イク、お尻イク、お尻イクぅうっ,sound/data/pcm/c23/h/01.unity3d,h_so_23_03_115
116,23,54,い、イかせて、お尻で思いっきり……イかせてええぇぇっ……あんっ、お尻、お尻、お尻っお尻ぃ……！　,sound/data/pcm/c23/h/01.unity3d,h_so_23_03_116
117,23,54,んああっ、はあっんっアナルイっちゃいそう、あ、あんっ、キュッて締めて絞り取っちゃう、はあっはあっはあっ,sound/data/pcm/c23/h/01.unity3d,h_so_23_03_117
118,23,54,アナルイっちゃいそう、あ、あんっ、キュッて締めておちんぽミルク、絞り取っちゃうからね？　,sound/data/pcm/c23/h/01.unity3d,h_so_23_03_118
119,23,54,じゃあ、ガチガチに締め付けちゃう！　んああっ、あっあ、お尻叩いてもいいよぉっ、あんっ、はああんっ,sound/data/pcm/c23/h/01.unity3d,h_so_23_03_119
120,23,54,お、お尻叩いてもいいよぉっ、あんっ、はああんっ……アナル、締め付けちゃうっ……あんんんんっ！　,sound/data/pcm/c23/h/01.unity3d,h_so_23_03_120
121,23,54,や、やっぱり生で出されちゃうのが一番好きぃ！　キミに孕まされてるって思うと、ゾクゾクするの,sound/data/pcm/c23/h/01.unity3d,h_so_23_03_121
122,23,54,はぁっあぁあん……やっぱり生で出されちゃうのが一番しゅきぃ！　だいしゅきぃ！　,sound/data/pcm/c23/h/01.unity3d,h_so_23_03_122
123,23,54,ゴムに邪魔されるの……くやしいよぉっ……中にほしいいぃぃぃっ……！,sound/data/pcm/c23/h/01.unity3d,h_so_23_03_123
124,23,54,あぁあんっ、私の子宮に、はぁ、いっぱい……いっぱい出す練習してるうっ……あん……,sound/data/pcm/c23/h/01.unity3d,h_so_23_03_124
125,23,54,な、なんか……ん……さっきより出る量……ふえてる……？　ふえてるよね……？,sound/data/pcm/c23/h/01.unity3d,h_so_23_03_125
126,23,54,んくぅうんんっ……はあっ、あっ、出る量増えてる……ワタシのアナル……好きになっちゃたのかな？　,sound/data/pcm/c23/h/01.unity3d,h_so_23_03_126
127,23,54,んイグぅうううううっっっ！,sound/data/pcm/c23/h/01.unity3d,h_so_23_03_127
128,23,54,んイグぅうううううっっっああんんっ！,sound/data/pcm/c23/h/01.unity3d,h_so_23_03_128
129,23,54,あイクッイッちゃ、イっくうぅぅううううっっっっ！　,sound/data/pcm/c23/h/01.unity3d,h_so_23_03_129
130,23,54,あんっ！　イクッイッちゃ、イっくうぅぅううううっっっっ！　,sound/data/pcm/c23/h/01.unity3d,h_so_23_03_130
131,23,54,やっぱり二人でイケると、しあわせ～って、ハートマークが出ちゃうよ……。次はゴムなしでしようね？,sound/data/pcm/c23/h/01.unity3d,h_so_23_03_131
132,23,54,いっしょにイッた後って……すごくうれしい……なんていうか、ハートマークが出ちゃうっていうか……,sound/data/pcm/c23/h/01.unity3d,h_so_23_03_132
133,23,54,んはぁ……あぁ……まだビクビクが残ってる……って、キミも？　うふふ、二人でしばらくビクビクしてよっか……,sound/data/pcm/c23/h/01.unity3d,h_so_23_03_133
134,23,54,しばらく……いっしょに余韻を味わおうね……はぁっ……ほんとによかった……,sound/data/pcm/c23/h/01.unity3d,h_so_23_03_134
135,23,54,これって、捉えようによってはプロポーズ？　期待しちゃっていいのかな？,sound/data/pcm/c23/h/01.unity3d,h_so_23_03_135
136,23,54,んんぃ……こんなにも、たくさん出されたら……絶対赤ちゃんできちゃうよ……,sound/data/pcm/c23/h/01.unity3d,h_so_23_03_136
137,23,54,ワタシだけ先にイって……ごめんね……次はいっしょに……ね,sound/data/pcm/c23/h/01.unity3d,h_so_23_03_137
138,23,54,１人でイカされちゃなんて……ちょっと悔しいな。次は負けないんだから……そもそも勝負じゃないか、えへへ,sound/data/pcm/c23/h/01.unity3d,h_so_23_03_138
139,23,54,お尻って、エッチするための場所じゃないのに、どうしてこんなに気持ちいいのかな……不思議だけど、しあわせなことだよね,sound/data/pcm/c23/h/01.unity3d,h_so_23_03_139
140,23,54,お尻の気持ちよさ……キミに教えてもらえて……よかった……,sound/data/pcm/c23/h/01.unity3d,h_so_23_03_140
141,23,54,最近、本当にお尻が弱くなっちゃった……キミが丁寧に開発しちゃったからだよ？,sound/data/pcm/c23/h/01.unity3d,h_so_23_03_141
142,23,54,キミがアナルを開発しちゃったから……あなる、弱くなっちゃたよ……もう、変態なんだから……,sound/data/pcm/c23/h/01.unity3d,h_so_23_03_142
143,23,54,ゴムで安心なセックスも好きだけど、たまにはキケンなエッチもしていいからね？,sound/data/pcm/c23/h/01.unity3d,h_so_23_03_143
144,23,54,安心安全なエッチもだけど、たまにはキケンなエッチもしてみたいかも……,sound/data/pcm/c23/h/01.unity3d,h_so_23_03_144
145,23,54,いっぱい動いていっぱい出たね……ンッ……今日はこのまま、中にキミのおちんぽミルクを入れたまま帰っちゃおうかなぁ,sound/data/pcm/c23/h/01.unity3d,h_so_23_03_145
146,23,54,いっぱい出たね、中にキミのおちんぽミルクの感覚……ずっと残ってる……幸せ……,sound/data/pcm/c23/h/01.unity3d,h_so_23_03_146
147,23,54,今日危険日だから、子宮の中におちんぽミルクが入ってきたのわかったよ……すごく、ゾクゾクってきた,sound/data/pcm/c23/h/01.unity3d,h_so_23_03_147
148,23,54,危険日だからかな、おちんぽミルクがひってきたとき、いつもと違う感じがしたよ……,sound/data/pcm/c23/h/01.unity3d,h_so_23_03_148
149,23,54,はぁ、はぁ……ごめんね、ワタシだけ先にイッちゃった。２回目する？　それとも、しゃぶっちゃう？,sound/data/pcm/c23/h/01.unity3d,h_so_23_03_149
150,23,54,ワタシだけ先にイッちゃったから……ま、まだ満足できてないよね？　続き、する？,sound/data/pcm/c23/h/01.unity3d,h_so_23_03_150
151,23,54,お、お尻でいけるキミも……けっこう……変態なのかな……？,sound/data/pcm/c23/h/01.unity3d,h_so_23_03_151
152,23,54,お尻でイキまくっちゃうなんて、ワタシたち変態コンビだね……えへへ……,sound/data/pcm/c23/h/01.unity3d,h_so_23_03_152
153,23,54,キミのお陰でアナルが弱点になっちゃった……付き合いたてのワタシが見たらびっくりしちゃうよね？,sound/data/pcm/c23/h/01.unity3d,h_so_23_03_153
154,23,54,こんなにアナルが弱点になるなんて……初めての時は思いもしなかったな……,sound/data/pcm/c23/h/01.unity3d,h_so_23_03_154
155,23,54,えへへ、私の中、気持ちよかった？　ゴムは誰もいなさそーな教室のゴミ箱にポイしようね,sound/data/pcm/c23/h/01.unity3d,h_so_23_03_155
156,23,54,わぁ……ゴムの中……たぷたぷにたまってる……すごい……,sound/data/pcm/c23/h/01.unity3d,h_so_23_03_156
157,23,54,中にだしてもらったのにイケないなんて……もったいないなぁ……。ねぇ、もう１回、いい？,sound/data/pcm/c23/h/01.unity3d,h_so_23_03_158
158,23,54,危ない日にゴムなしでやるキミって野性味がすごいんだよね……あれ、褒めてるんだよ？　,sound/data/pcm/c23/h/01.unity3d,h_so_23_03_159
