管理番号,大きい項目,中間項目,表示名,バンドルパス,ファイル名
0,38,24,(初挿入)初めて、ですが……どうか、遠慮なさらずに……,sound/data/pcm/c38/h/01.unity3d,h_so_38_00_000
1,38,24,うぅ、これは、緊張するなという方が、無理というものです,sound/data/pcm/c38/h/01.unity3d,h_so_38_00_001
2,38,24,も、もしかして、貴方もドキドキしているのですか？,sound/data/pcm/c38/h/01.unity3d,h_so_38_00_002
3,38,24,はいっ、お好きなように……,sound/data/pcm/c38/h/01.unity3d,h_so_38_00_003
4,38,24,繋がる直前は、どうしても緊張してしまいます,sound/data/pcm/c38/h/01.unity3d,h_so_38_00_004
5,38,24,とうとう、貴方が入ってくるのですね……,sound/data/pcm/c38/h/01.unity3d,h_so_38_00_005
6,38,24,あの、ゴムは付けて頂けますか？　お願いします,sound/data/pcm/c38/h/01.unity3d,h_so_38_00_006
7,38,24,すみません、お互いのためにも、ゴムは付けてください,sound/data/pcm/c38/h/01.unity3d,h_so_38_00_007
8,38,24,申し訳ありません。危険日なので、ゴムだけはお願いします,sound/data/pcm/c38/h/01.unity3d,h_so_38_00_008
9,38,24,お待ちくださいっ。あの、今日は……危ない日なのです……,sound/data/pcm/c38/h/01.unity3d,h_so_38_00_009
10,38,24,なっ、お尻ですか？　そんなっ、心の準備がっ……,sound/data/pcm/c38/h/01.unity3d,h_so_38_00_010
11,38,24,ぅぅ、まさか貴方に、そういう趣味があったなんて……,sound/data/pcm/c38/h/01.unity3d,h_so_38_00_011
12,38,24,お尻は、お尻だけはっ、勘弁してください……,sound/data/pcm/c38/h/01.unity3d,h_so_38_00_012
13,38,24,そこは不浄の穴です、貴方のモノを入れる場所ではありませんよ？,sound/data/pcm/c38/h/01.unity3d,h_so_38_00_013
14,38,24,（処女）これで、私も女になったのです……ありがとう、ございます……,sound/data/pcm/c38/h/01.unity3d,h_so_38_00_014
15,38,24,（処女）んぁっ、そんな、初めてだったのですよ？　いきなりは酷いです……,sound/data/pcm/c38/h/01.unity3d,h_so_38_00_015
16,38,24,（アナル処女）んぐっ……お願いです、初めてなので、ゆっくり……,sound/data/pcm/c38/h/01.unity3d,h_so_38_00_016
17,38,24,（アナル処女）ああっ、嘘です……そんなっ、ああ、もう入ってっ……,sound/data/pcm/c38/h/01.unity3d,h_so_38_00_017
18,38,24,（処女）これで、全部ですか？　はぁ、大丈夫です……これならなんとか……,sound/data/pcm/c38/h/01.unity3d,h_so_38_00_018
19,38,24,貴方の、中でピクピクしてます……好きに動いて、いいんですよ？,sound/data/pcm/c38/h/01.unity3d,h_so_38_00_019
20,38,24,あぁ、私のが拡がって……貴方にぴったり吸い付いてしまっています……,sound/data/pcm/c38/h/01.unity3d,h_so_38_00_020
21,38,24,（処女）んっ……少し待ってください……はぁ、何もかもが、初めて過ぎて……,sound/data/pcm/c38/h/01.unity3d,h_so_38_00_021
22,38,24,あのっ……焦る気持ちはわかります。ですが……もう少しだけ、優しくして頂けると……,sound/data/pcm/c38/h/01.unity3d,h_so_38_00_022
23,38,24,（アナル処女）お尻が、なんだか変です……私、どうなってしまうのでしょう？,sound/data/pcm/c38/h/01.unity3d,h_so_38_00_023
24,38,24,お尻、戻りますよね？　広がったままなんてことは、ありませんよね？,sound/data/pcm/c38/h/01.unity3d,h_so_38_00_024
25,38,24,（アナル処女）少し、痛かったです……お尻が、裂けるかと思いました……,sound/data/pcm/c38/h/01.unity3d,h_so_38_00_025
26,38,24,うぅ、本来なら、するところではないので……優しく慣らしてください……,sound/data/pcm/c38/h/01.unity3d,h_so_38_00_026
27,38,24,えぇと、動かないのですか？　私のことは、お気遣いなく……,sound/data/pcm/c38/h/01.unity3d,h_so_38_00_027
28,38,24,はぁ、なんだか、満ち足りた気分です……,sound/data/pcm/c38/h/01.unity3d,h_so_38_00_028
29,38,24,繋がって、いますね……私達、繋がっています……,sound/data/pcm/c38/h/01.unity3d,h_so_38_00_029
30,38,24,お尻の中、窮屈ではありませんか？,sound/data/pcm/c38/h/01.unity3d,h_so_38_00_030
31,38,24,お尻は、加減がわかりませんね……他が分かるわけでもありませんが……,sound/data/pcm/c38/h/01.unity3d,h_so_38_00_031
32,38,24,繋がっていることは嬉しいのですが、それがお尻というのは……少し複雑です,sound/data/pcm/c38/h/01.unity3d,h_so_38_00_032
33,38,24,す、すみませんっ、何か私、間違えてしまったでしょうか？,sound/data/pcm/c38/h/01.unity3d,h_so_38_00_033
34,38,24,やはり私では……役不足ですか？,sound/data/pcm/c38/h/01.unity3d,h_so_38_00_034
35,38,24,どうかされました？　一度休憩ですか？,sound/data/pcm/c38/h/01.unity3d,h_so_38_00_035
36,38,24,お尻……拡がったままですよね？　うぅ……,sound/data/pcm/c38/h/01.unity3d,h_so_38_00_036
37,38,24,お尻で遊ばないでくださいっ……こちらは色々、大変なんですよ……,sound/data/pcm/c38/h/01.unity3d,h_so_38_00_037
38,38,24,あっ、私のお尻……お気に召しませんでしたか？,sound/data/pcm/c38/h/01.unity3d,h_so_38_00_038
39,38,24,ゆっくりして頂けると、助かりますっ……,sound/data/pcm/c38/h/01.unity3d,h_so_38_00_039
40,38,24,あぁ、私っ……貴方に、セックスして頂いているのですねっ……,sound/data/pcm/c38/h/01.unity3d,h_so_38_00_040
41,38,24,うぅっ、ゆっくりでも……凄く響きますっ……,sound/data/pcm/c38/h/01.unity3d,h_so_38_00_041
42,38,24,あぁっ、貴方に求められている感じがしますっ,sound/data/pcm/c38/h/01.unity3d,h_so_38_00_042
43,38,24,これくらいなら、まだ大丈夫ですっ、なんとか、頑張れますっ……,sound/data/pcm/c38/h/01.unity3d,h_so_38_00_043
44,38,24,んっ、幸せなリズムです……身体が、浮いてしまうようなっ……,sound/data/pcm/c38/h/01.unity3d,h_so_38_00_044
45,38,24,うくっ、お尻の中で、動いてますっ……,sound/data/pcm/c38/h/01.unity3d,h_so_38_00_045
46,38,24,すごいっ、これが、お尻でするってことなんですね……,sound/data/pcm/c38/h/01.unity3d,h_so_38_00_046
47,38,24,お尻が、熱いですっ……本当に、大丈夫なんですよね？,sound/data/pcm/c38/h/01.unity3d,h_so_38_00_047
48,38,24,あっ、はやいのはっ、まだ難しいですっ、頭が、混乱してしまって,sound/data/pcm/c38/h/01.unity3d,h_so_38_00_048
49,38,24,少し、早過ぎませんか？　お尻でするだけで、満足してくださいっ……,sound/data/pcm/c38/h/01.unity3d,h_so_38_00_049
50,38,24,うぅくっ、すみませんっ、もう少しだけ、ゆっくりっ……,sound/data/pcm/c38/h/01.unity3d,h_so_38_00_050
51,38,24,色々されると、よくわからなくなってしまいますからっ……,sound/data/pcm/c38/h/01.unity3d,h_so_38_00_051
52,38,24,私の身体に、そんなに興味があるのですか？,sound/data/pcm/c38/h/01.unity3d,h_so_38_00_052
53,38,24,んぁ、こんなに求められるのも、悪くないかもしれません,sound/data/pcm/c38/h/01.unity3d,h_so_38_00_053
54,38,24,そんなに色々されては、変になってしまいますっ,sound/data/pcm/c38/h/01.unity3d,h_so_38_00_054
55,38,24,そこは、すみません、苦手かもしれません……,sound/data/pcm/c38/h/01.unity3d,h_so_38_00_055
56,38,24,んぁっ、変なところを、弄らないでくださいっ,sound/data/pcm/c38/h/01.unity3d,h_so_38_00_056
57,38,24,あっ、あのっ、そこはっ、困ってしまいますっ,sound/data/pcm/c38/h/01.unity3d,h_so_38_00_057
58,38,24,んんっ、普通にしてくださいっ、お願いですからっ,sound/data/pcm/c38/h/01.unity3d,h_so_38_00_058
59,38,24,あぁっ、ゆっくりなのにっ、力強いですっ,sound/data/pcm/c38/h/01.unity3d,h_so_38_00_059
60,38,24,貴方のが、奥をごりごり、擦っていますっ,sound/data/pcm/c38/h/01.unity3d,h_so_38_00_060
61,38,24,貴方の、どんどん大きくなっていませんか？,sound/data/pcm/c38/h/01.unity3d,h_so_38_00_061
62,38,24,こんなに激しくしてっ、貴方は大丈夫なんですかっ？,sound/data/pcm/c38/h/01.unity3d,h_so_38_00_062
63,38,24,すごいっ、これがセックスなんですねっ、なんて激しいっ	,sound/data/pcm/c38/h/50_00.unity3d,h_so_38_00_063
64,38,24,んぅあっ、私っ、変な声が抑えられなくなってしまいますっ,sound/data/pcm/c38/h/01.unity3d,h_so_38_00_064
65,38,24,うぅ、あまり拡げ過ぎないでください……戻らなくなってしまいますっ……,sound/data/pcm/c38/h/01.unity3d,h_so_38_00_065
66,38,24,んおっ……やっ、忘れてくださいっ、変な声、勝手に出てしまうんですっ,sound/data/pcm/c38/h/01.unity3d,h_so_38_00_066
67,38,24,貴方は気持ちいいのですか？　その、そんなにお尻をグリグリして……,sound/data/pcm/c38/h/01.unity3d,h_so_38_00_067
68,38,24,あぐっ、お尻、壊れてしまいますっ、お願いですっ、許してくださいっ,sound/data/pcm/c38/h/01.unity3d,h_so_38_00_068
69,38,24,あぁっ、強引過ぎますっ、そこっ、お尻なんですよっ,sound/data/pcm/c38/h/01.unity3d,h_so_38_00_069
70,38,24,私のお尻、どうなっているんですかっ？　大丈夫ですよねっ？,sound/data/pcm/c38/h/01.unity3d,h_so_38_00_070
71,38,24,貴方は器用なのですね、んっ、感心します……,sound/data/pcm/c38/h/01.unity3d,h_so_38_00_071
72,38,24,あのっ、出来れば一つずつ、感じ方を覚えさせて頂けると……,sound/data/pcm/c38/h/01.unity3d,h_so_38_00_072
73,38,24,そこも気持ちいいですっ、もっとしてくださいっ,sound/data/pcm/c38/h/01.unity3d,h_so_38_00_073
74,38,24,貴方に弄られると、どこも気持ちよくなってしまいそうです,sound/data/pcm/c38/h/01.unity3d,h_so_38_00_074
75,38,24,うぅっ、そこは遠慮して頂けますか？,sound/data/pcm/c38/h/01.unity3d,h_so_38_00_075
76,38,24,なんでも気持ちよくなるわけではないですから、わかってください……,sound/data/pcm/c38/h/01.unity3d,h_so_38_00_076
77,38,24,あぁっ、激しくして、誤魔化そうとしていませんか？,sound/data/pcm/c38/h/01.unity3d,h_so_38_00_077
78,38,24,一緒にすれば、何でも気持ちよくなるわけではないのですよっ……,sound/data/pcm/c38/h/01.unity3d,h_so_38_00_078
79,38,24,ちゅむ、くちゅ…んっ、これは、すごいですね…身体も心も、溶けてしまいそうですっ,sound/data/pcm/c38/h/01.unity3d,h_so_38_00_079
80,38,24,ちゅっ、キスをしながらだと、ぷちゅぷ、貴方とエッチしているんだと、凄く感じますっ,sound/data/pcm/c38/h/01.unity3d,h_so_38_00_080
81,38,24,んぅむっ、ぷぁっ、息が苦しいですっ、でも、もっとキス、してくださいっ,sound/data/pcm/c38/h/01.unity3d,h_so_38_00_081
82,38,24,ちゅぶ、くちゅぷ……はぁっ、キスしながらするの、好きかもしれませんっ,sound/data/pcm/c38/h/01.unity3d,h_so_38_00_082
83,38,24,ちゅうむっ、ぢゅぶぶっ、あなたの吐息、熱いですっ,sound/data/pcm/c38/h/01.unity3d,h_so_38_00_083
84,38,24,んぅぶっ、はぷっ、んむぅぅっ、ぷぁっ、息をするの、忘れてしまいそうになりますねっ,sound/data/pcm/c38/h/01.unity3d,h_so_38_00_084
85,38,24,んむぅっ、あぷっ、強くしながらキスはっ、んぷっ、少し刺激が強すぎますっ,sound/data/pcm/c38/h/01.unity3d,h_so_38_00_085
86,38,24,はむっ、ちゅぐっ、頭が、ふわふわします、んぅちゅっ、体も、浮いているようですっ,sound/data/pcm/c38/h/01.unity3d,h_so_38_00_086
87,38,24,なんだかっ、凄いのが来ていますっ、このまま続けられたら、私っ,sound/data/pcm/c38/h/01.unity3d,h_so_38_00_087
88,38,24,すみません、私だけ気持ちよくなって、先に、イってしまうかもっ,sound/data/pcm/c38/h/01.unity3d,h_so_38_00_088
89,38,24,んっ、あっ、もう我慢できませんっ、貴方のモノで、イカせてくださいっ,sound/data/pcm/c38/h/01.unity3d,h_so_38_00_089
90,38,24,私だけイってもダメなんですっ、貴方にイッてもらわなければ、ダメなのですっ,sound/data/pcm/c38/h/01.unity3d,h_so_38_00_090
91,38,24,貴方の震えてますっ、いいんですよっ、好きな時にイってくださいっ,sound/data/pcm/c38/h/01.unity3d,h_so_38_00_091
92,38,24,ああっ、先が膨らんでっ……出るんですねっ？　射精、するんですねっ？,sound/data/pcm/c38/h/01.unity3d,h_so_38_00_092
93,38,24,我慢しなくていいんですよ、早く出して、楽になってくださいっ,sound/data/pcm/c38/h/01.unity3d,h_so_38_00_093
94,38,24,すごいですっ、貴方のが中でパンパンに膨らんで、今にもはちきれそうですっ,sound/data/pcm/c38/h/01.unity3d,h_so_38_00_094
95,38,24,あぁっ、これ、なぜっ、んんっ、私、お尻で感じてしまっていますっ,sound/data/pcm/c38/h/01.unity3d,h_so_38_00_095
96,38,24,うそっ、私、お尻でイクんですか？　あぁっ、そんなっ、,sound/data/pcm/c38/h/01.unity3d,h_so_38_00_096
97,38,24,あぁあっ、凄いっ、お尻が焼けるようですっ、このままでは、私っ,sound/data/pcm/c38/h/01.unity3d,h_so_38_00_097
98,38,24,お尻が、変なんですっ、きっとこれっ、私、イって……あぁああっ,sound/data/pcm/c38/h/01.unity3d,h_so_38_00_098
99,38,24,んあっ、貴方の、また大きくなって、お尻でイってしまうのですか？,sound/data/pcm/c38/h/01.unity3d,h_so_38_00_099
100,38,24,なんだか辛そうですね？　いいんですよ、お尻でイっても……,sound/data/pcm/c38/h/01.unity3d,h_so_38_00_100
101,38,24,お尻でイってもらえたら、私も嬉しいです、頑張った甲斐がありますっ,sound/data/pcm/c38/h/01.unity3d,h_so_38_00_101
102,38,24,折角お尻でしたんですっ、このまま気持ちよく、お尻でイってくださいっ,sound/data/pcm/c38/h/01.unity3d,h_so_38_00_102
103,38,24,（初絶頂）私、あっ、イキますっ、んっ、貴方にイカされてしまいますっ,sound/data/pcm/c38/h/01.unity3d,h_so_38_00_103
104,38,24,ああ、もう無理です、なにか大きいのが来て、我慢できませんっ,sound/data/pcm/c38/h/01.unity3d,h_so_38_00_104
105,38,24,（初絶頂）イクなら貴方と一緒がいいですっ、お願いしますぅっ,sound/data/pcm/c38/h/01.unity3d,h_so_38_00_105
106,38,24,一緒にイケそうですね？　あぁっ、私、嬉しいですっ,sound/data/pcm/c38/h/01.unity3d,h_so_38_00_106
107,38,24,（初絶頂）はいっ、これで私も、大人の女になれるのですねっ,sound/data/pcm/c38/h/01.unity3d,h_so_38_00_107
108,38,24,わ、わかりましたっ、全部受け止められるよう、頑張りますっ,sound/data/pcm/c38/h/01.unity3d,h_so_38_00_108
109,38,24,あっ、はいっ、外ですねっ、お気遣い頂き、ありがとうございますっ,sound/data/pcm/c38/h/01.unity3d,h_so_38_00_109
110,38,24,外でいいのですね？　わかりました、貴方の望むままにっ,sound/data/pcm/c38/h/01.unity3d,h_so_38_00_110
111,38,24,ゴム、きちんと付いていますよね？　取れたり、していませんよねっ？,sound/data/pcm/c38/h/01.unity3d,h_so_38_00_113
112,38,24,ゴムをしていますからっ、お好きなだけ、出してくださいっ,sound/data/pcm/c38/h/01.unity3d,h_so_38_00_114
113,38,24,お尻で、イキますっ、すみませんっ、一人だけでっ,sound/data/pcm/c38/h/01.unity3d,h_so_38_00_115
114,38,24,あぁっ、うそですっ、私、お尻でイかされてしまうなんてっ,sound/data/pcm/c38/h/01.unity3d,h_so_38_00_116
115,38,24,お尻ですけど、一緒にイケそうですねっ、よかった、本当によかった,sound/data/pcm/c38/h/01.unity3d,h_so_38_00_117
116,38,24,貴方と一緒に、お尻でイキますっ、一緒なら、恥ずかしくありませんっ,sound/data/pcm/c38/h/01.unity3d,h_so_38_00_118
117,38,24,お尻に出すんですねっ、わかりましたっ、よろしくおねがいしますっ,sound/data/pcm/c38/h/01.unity3d,h_so_38_00_119
118,38,24,よかった、私のお尻で、気持ちよくなって頂けた証拠ですねっ,sound/data/pcm/c38/h/01.unity3d,h_so_38_00_120
119,38,24,ふぁあっ、すごい勢いですっ、貴方の射精、感じますっ,sound/data/pcm/c38/h/01.unity3d,h_so_38_00_121
120,38,24,あああっ、どれだけ出るんですかっ、私の中、溢れてしまいますっ,sound/data/pcm/c38/h/01.unity3d,h_so_38_00_122
121,38,24,んぁあっ、そんなに出しては、ゴムが破れてしまうのではっ,sound/data/pcm/c38/h/01.unity3d,h_so_38_00_123
122,38,24,はぁぁっ、ゴムの先が、凄い勢いで膨らんでいますっ,sound/data/pcm/c38/h/01.unity3d,h_so_38_00_124
123,38,24,ああっ、お尻の奥に、そんなに出しては、私、どうなってしまうのですかっ,sound/data/pcm/c38/h/01.unity3d,h_so_38_00_125
124,38,24,うぅっ、出てますっ、本当にお尻の中で、出てしまっていますっ,sound/data/pcm/c38/h/01.unity3d,h_so_38_00_126
125,38,24,んぅあああっ！,sound/data/pcm/c38/h/01.unity3d,h_so_38_00_127
126,38,24,ひゃううううんっ！,sound/data/pcm/c38/h/01.unity3d,h_so_38_00_128
127,38,24,んぃっ、あひゅうううっ！,sound/data/pcm/c38/h/01.unity3d,h_so_38_00_129
128,38,24,いっあっ、ふぁああああんっ！,sound/data/pcm/c38/h/01.unity3d,h_so_38_00_130
129,38,24,ゴムの中、たぷたぷしていますね……はぁ、たくさん出して頂けて、光栄です……,sound/data/pcm/c38/h/01.unity3d,h_so_38_00_131
130,38,24,勢いが凄くて……ゴムが破けてしまうのではと、心配になってしまいました……,sound/data/pcm/c38/h/01.unity3d,h_so_38_00_132
131,38,24,はぁ、中に出して頂けると、こんなに幸せになれるのですね……,sound/data/pcm/c38/h/01.unity3d,h_so_38_00_133
132,38,24,なんだか、幸せ過ぎて怖いです……このまま、溶けてしまいそうです……,sound/data/pcm/c38/h/01.unity3d,h_so_38_00_134
133,38,24,ぁ、あの……もし、出来てしまったら、私、きちんと育てたいです……,sound/data/pcm/c38/h/01.unity3d,h_so_38_00_135
134,38,24,一緒にイキながらですと、やはりしやすいのでしょうか……妊娠……,sound/data/pcm/c38/h/01.unity3d,h_so_38_00_136
135,38,24,うぅ、イカされてしまいましたね……次はきちんと、いたしますから……,sound/data/pcm/c38/h/01.unity3d,h_so_38_00_137
136,38,24,んっ、イってしまいました……貴方が相手なのですから、仕方ないですよね,sound/data/pcm/c38/h/01.unity3d,h_so_38_00_138
137,38,24,ど、どうしましょう……今どういう顔をしたらよいか、わかりません……,sound/data/pcm/c38/h/01.unity3d,h_so_38_00_139
138,38,24,お、お尻……気持ち良かったですか？　うぅ、私は良かったです……はい……,sound/data/pcm/c38/h/01.unity3d,h_so_38_00_140
139,38,24,ぅぅぅ……お尻で、一人で……イってしまって……私、最低ですね……,sound/data/pcm/c38/h/01.unity3d,h_so_38_00_141
140,38,24,えぇと……まだお尻、できそうですので……名誉挽回のチャンスを……,sound/data/pcm/c38/h/01.unity3d,h_so_38_00_142
141,38,24,腰が、抜けてしまうかと思いました……ゴムが無かったら、どうなっていたか……,sound/data/pcm/c38/h/01.unity3d,h_so_38_00_143
142,38,24,た、たくさん出して頂いので、ゴムが上手く抜けるか、心配ですね……,sound/data/pcm/c38/h/01.unity3d,h_so_38_00_144
143,38,24,こ、これで終わり……ですか？　はぁ、少しだけ、休憩させてください……,sound/data/pcm/c38/h/01.unity3d,h_so_38_00_145
144,38,24,私達、セックスしたんですね……しかも一緒にイケて……何よりです……,sound/data/pcm/c38/h/01.unity3d,h_so_38_00_146
145,38,24,だ、大丈夫ですよね……危険日でも、絶対できるというわけではないですし……,sound/data/pcm/c38/h/01.unity3d,h_so_38_00_147
146,38,24,もし、もしですよ？　できてしまったら……一緒に育てて、くれますか？,sound/data/pcm/c38/h/01.unity3d,h_so_38_00_148
147,38,24,正直、驚いています、貴方にイカセてもらって、あんなに乱れてしまうなんて……,sound/data/pcm/c38/h/01.unity3d,h_so_38_00_149
148,38,24,エッチって、思ったより体力を使いますね,sound/data/pcm/c38/h/01.unity3d,h_so_38_00_150
149,38,24,お尻でも、こんなに激しくイケるんですね……私の知らない世界です……,sound/data/pcm/c38/h/01.unity3d,h_so_38_00_151
150,38,24,すごかったですね、お尻……貴方になら、もっとして頂いても……,sound/data/pcm/c38/h/01.unity3d,h_so_38_00_152
151,38,24,す、少しだけ……そっとしておいて頂けますか？　色々、複雑でして……,sound/data/pcm/c38/h/01.unity3d,h_so_38_00_153
152,38,24,私のお尻、エッチになってしまいました……うぅ、貴方のせいですよっ,sound/data/pcm/c38/h/01.unity3d,h_so_38_00_154
153,38,24,そろそろ、抜いた方が良いのではないですか？　小さくなると、その、ゴムが……,sound/data/pcm/c38/h/01.unity3d,h_so_38_00_155
154,38,24,貴方は不満かもしれませんが……ゴムがあって、私は助かりました……,sound/data/pcm/c38/h/01.unity3d,h_so_38_00_156
155,38,24,その……ずっと入れたままですが……まさか、このまま……,sound/data/pcm/c38/h/01.unity3d,h_so_38_00_157
156,38,24,今抜かれると、きっと垂れてしまうと思うので……少しの間、このままで……,sound/data/pcm/c38/h/01.unity3d,h_so_38_00_158
157,38,24,出してしまったので、今更かとは思いますが……その、抜かないんですか？,sound/data/pcm/c38/h/01.unity3d,h_so_38_00_159
158,38,24,少し、ゆっくりしたい気分ですね……今更慌てても、仕方ありませんし……,sound/data/pcm/c38/h/01.unity3d,h_so_38_00_160
159,38,24,貴方と一緒にイった、この思い出は……一生忘れません,sound/data/pcm/c38/h/01.unity3d,h_so_38_00_161
160,38,24,後でゴム、貰っていいですか？　えぇと、記念にとっておきたいかなと……,sound/data/pcm/c38/h/01.unity3d,h_so_38_00_162
161,38,24,お互い求め合うって、素敵ですね……心まで、繋がったようでした……,sound/data/pcm/c38/h/01.unity3d,h_so_38_00_163
162,38,24,はぁ……皆さんがエッチに夢中になる理由が、分かった気がします……,sound/data/pcm/c38/h/01.unity3d,h_so_38_00_164
163,38,24,うーん、少しハメを外し過ぎたような……でも、貴方となら……,sound/data/pcm/c38/h/01.unity3d,h_so_38_00_165
164,38,24,これで、できてしまっても……エッチの練習には、付き合って頂けますか？,sound/data/pcm/c38/h/01.unity3d,h_so_38_00_166
165,38,24,はぁ、私、いつか貴方と、一緒にイキたいです,sound/data/pcm/c38/h/01.unity3d,h_so_38_00_167
166,38,24,すみません……私だけイッてしまいました,sound/data/pcm/c38/h/01.unity3d,h_so_38_00_168
167,38,24,この後が不安です……私のお尻……たぶん大変なことに……,sound/data/pcm/c38/h/01.unity3d,h_so_38_00_169
168,38,24,お尻でした後は……どうすればいいのでしょうか？　知っていますか？,sound/data/pcm/c38/h/01.unity3d,h_so_38_00_170
169,38,24,す、すぐには抜かないでくださいね？　今、色々大変なので……,sound/data/pcm/c38/h/01.unity3d,h_so_38_00_171
170,38,24,ひゃっ、凄い勢いですっ……そんなに出して、大丈夫なのですか？,sound/data/pcm/c38/h/01.unity3d,h_so_38_00_172
171,38,24,ああっ、射精……気持ちよさそうですね……,sound/data/pcm/c38/h/01.unity3d,h_so_38_00_173
172,38,24,はぁっ、精液の匂い……これは、あまり嗅いではいけないような……,sound/data/pcm/c38/h/01.unity3d,h_so_38_00_174
173,38,24,本当に白いのですね……これが、貴方の精液……,sound/data/pcm/c38/h/01.unity3d,h_so_38_00_175
174,38,24,ぁ、あの……精液、少し触らせて頂いてもよろしいですか？,sound/data/pcm/c38/h/01.unity3d,h_so_38_00_176
175,38,24,んぁっ、アソコから垂れて……ぅぅ、いやらしすぎます……,sound/data/pcm/c38/h/01.unity3d,h_so_38_00_177
176,38,24,んぅっ、あまり見ないでください……恥ずかしいです……,sound/data/pcm/c38/h/01.unity3d,h_so_38_00_178
177,38,24,あっ、やっ、お尻の穴拡がったままで……垂れてしまいますっ,sound/data/pcm/c38/h/01.unity3d,h_so_38_00_179
178,38,24,あぁっ、ダメですっ……今はお尻、見てはダメですっ,sound/data/pcm/c38/h/01.unity3d,h_so_38_00_180
179,38,24,まだ、いたしますか？,sound/data/pcm/c38/h/01.unity3d,h_so_38_00_181
180,38,24,貴方が望むのでしたら、私はいくらでも……,sound/data/pcm/c38/h/01.unity3d,h_so_38_00_182
181,38,24,また、貴方と一つに……,sound/data/pcm/c38/h/01.unity3d,h_so_38_00_183
182,38,24,あぁ、胸がどんどん高鳴ります,sound/data/pcm/c38/h/01.unity3d,h_so_38_00_184
