管理番号,大きい項目,中間項目,表示名,バンドルパス,ファイル名
0,01,33,まだ不慣れですが……あなたに興奮してもらえるように頑張ります,sound/data/pcm/c01/h/01.unity3d,h_fe_01_01_003
1,01,33,お友達に動き方を教わってきたのですが……どうですか？,sound/data/pcm/c01/h/01.unity3d,h_fe_01_01_039
2,01,33,速く……こうですか？　気持ちいいですか？,sound/data/pcm/c01/h/01.unity3d,h_fe_01_01_042
3,01,33,いやらしくなくて、すみません……,sound/data/pcm/c01/h/01.unity3d,h_fe_01_01_043
4,01,33,お、おちんちんを気持ちよくするだけで精一杯なのに……,sound/data/pcm/c01/h/01.unity3d,h_fe_01_01_077
5,01,33,イくんですか？　よかった、練習の成果が出たみたいですね……,sound/data/pcm/c01/h/01.unity3d,h_fe_01_01_093
6,01,33,また……あなたより先にギブアップしてしまいました……,sound/data/pcm/c01/h/01.unity3d,h_fe_01_01_138
7,01,33,気付けばゴムのツルツルした部分で気持ちいいところを擦っていて……そのまま……,sound/data/pcm/c01/h/01.unity3d,h_fe_01_01_143
8,01,33,自分だけ気持ち良くなって満足にご奉仕もできないなんて……申し訳ありません……,sound/data/pcm/c01/h/01.unity3d,h_fe_01_01_150
