管理番号,大きい項目,中間項目,表示名,バンドルパス,ファイル名
0,12,24,優しく……優しくだぞ？　うぅ、そんなの本当に入るのかよぉ,sound/data/pcm/c12/h/01.unity3d,h_so_12_00_000
1,12,24,や、やっぱりちょっとタイム。一回深呼吸する時間が欲しい,sound/data/pcm/c12/h/01.unity3d,h_so_12_00_001
2,12,24,はぁ、ふぅ、恥ずかし過ぎて過呼吸になりそうだぁ……ぁっ、それが……入るんだよな……,sound/data/pcm/c12/h/01.unity3d,h_so_12_00_002
3,12,24,は、はい……ど、どうぞ……って何で敬語なんだよあたしぃ……,sound/data/pcm/c12/h/01.unity3d,h_so_12_00_003
4,12,24,う、うん……あぁ、一気に緊張してきたぁ……そっとだぞ……優しく……だからな？,sound/data/pcm/c12/h/01.unity3d,h_so_12_00_004
5,12,24,うぅ、あたしエッチしちゃうんだな……おまえとエッチしちゃうんだ、あぁぅぅっ、心臓飛び出そう,sound/data/pcm/c12/h/01.unity3d,h_so_12_00_005
6,12,24,あ、えと……初めてなんだし、ゴムとかその……付けた方がいいと思う……ぞ？,sound/data/pcm/c12/h/01.unity3d,h_so_12_00_006
7,12,24,ゴムとか付けると……やっぱり気持ちよくないのか？　でも最初だし……付けて欲しいな,sound/data/pcm/c12/h/01.unity3d,h_so_12_00_007
8,12,24,は、初めてだから生でしたいって気持ちはわかるんだけど……ごめん、今日危険日なんだ,sound/data/pcm/c12/h/01.unity3d,h_so_12_00_008
9,12,24,た、タイム！　ごめん、言ってなかったけど今日危ない日なんだ……だからゴム……な？,sound/data/pcm/c12/h/01.unity3d,h_so_12_00_009
10,12,24,うぅ、なんでこんな事にぃ……絶対そっちは違う。そういうとこじゃないんだよぉ……,sound/data/pcm/c12/h/01.unity3d,h_so_12_00_010
11,12,24,やっ、そんな……最初からハード過ぎるって……うぅ、絶対優しくだからなぁ……,sound/data/pcm/c12/h/01.unity3d,h_so_12_00_011
12,12,24,や、やっぱりおかしいって……お尻は違うよ。普通にしよ？　な？,sound/data/pcm/c12/h/01.unity3d,h_so_12_00_012
13,12,24,い、いきなりそういうアブノーマルなのはダメだって……うぅ、残念そうな顔するなよぉ……,sound/data/pcm/c12/h/01.unity3d,h_so_12_00_013
14,12,24,（処女）あぃっ……んぅぅっ！　はぁっ、ほんとに入ってきてるぅっ……,sound/data/pcm/c12/h/01.unity3d,h_so_12_00_014
15,12,24,（処女）いつっ！　うぅ、もうちょっと優しくぅ……はぁぁっ……,sound/data/pcm/c12/h/01.unity3d,h_so_12_00_015
16,12,24,（アナル処女）いぅっ！　ぐっ……うそ……ほんとに、ぁぁ、おしりぃっ,sound/data/pcm/c12/h/01.unity3d,h_so_12_00_016
17,12,24,（アナル処女）やっ！　まっ！　そこちがっ！　ああぁっ！,sound/data/pcm/c12/h/01.unity3d,h_so_12_00_017
18,12,24,（処女）はっ、あっ、全部……んっ、入ったみたいだな。意識すると、ゾワゾワする,sound/data/pcm/c12/h/01.unity3d,h_so_12_00_018
19,12,24,んぅっ、あっ……おまえのが、あたしのナカにぃ……はぁ、奥、届いてるぅ,sound/data/pcm/c12/h/01.unity3d,h_so_12_00_019
20,12,24,い、一旦休憩な。ちょっと、もう色々やばすぎて……恥ずかしくて死にそうなんだ,sound/data/pcm/c12/h/01.unity3d,h_so_12_00_020
21,12,24,（処女）あぁっ、うぐっ……いきなり奥までなんて……っうぅ、ひどすぎるぅっ,sound/data/pcm/c12/h/01.unity3d,h_so_12_00_021
22,12,24,はぐっ……あっ、あぁっっ……強引過ぎるよぉっ……優しくしろってぇっ,sound/data/pcm/c12/h/01.unity3d,h_so_12_00_022
23,12,24,（アナル処女）はぁっ、ホントに入ってる……あぁっ、根元までぇ……入っちゃってるぅ……,sound/data/pcm/c12/h/01.unity3d,h_so_12_00_023
24,12,24,うぅ、お尻拡がったらどうするんだよぉ……責任取れよなぁ……,sound/data/pcm/c12/h/01.unity3d,h_so_12_00_024
25,12,24,（アナル処女）ひゃぐ！　こ、こらぁっ……こんなの絶対ダメなんだからなぁっ……,sound/data/pcm/c12/h/01.unity3d,h_so_12_00_025
26,12,24,んぅっ、ぐっ……次やったら……はぁっ、ぅっ、怒るかならぁ……,sound/data/pcm/c12/h/01.unity3d,h_so_12_00_026
27,12,24,う、動かない……のか？　遠慮しなくて……いいんだ……ぞ？,sound/data/pcm/c12/h/01.unity3d,h_so_12_00_027
28,12,24,うぅ、じっとされてると逆に恥ずかしいってぇ……,sound/data/pcm/c12/h/01.unity3d,h_so_12_00_028
29,12,24,うぅ、本当に入ってるぅ……おまえのがあたしのナカに入ってるよぉ……,sound/data/pcm/c12/h/01.unity3d,h_so_12_00_029
30,12,24,あぅぅ……どうしたんだよぉ……おまえがお尻に入れたんだぞぉ……,sound/data/pcm/c12/h/01.unity3d,h_so_12_00_030
31,12,24,あぁ、なんかやっぱダメだぁ……もうひと思いにしてくれぇ……,sound/data/pcm/c12/h/01.unity3d,h_so_12_00_031
32,12,24,んぅっ、お尻……やっぱりキツいだろ？　んっ、普通にしよっか？　な？,sound/data/pcm/c12/h/01.unity3d,h_so_12_00_032
33,12,24,んぁっ……あれ……抜けて……どうした？,sound/data/pcm/c12/h/01.unity3d,h_so_12_00_033
34,12,24,ぁ、あれっ……抜け……お、終わり？,sound/data/pcm/c12/h/01.unity3d,h_so_12_00_034
35,12,24,うっ、ごめん。あたしのナカ……なんか変だったか？,sound/data/pcm/c12/h/01.unity3d,h_so_12_00_035
36,12,24,な、なんかお尻……スース―する……あぁっ、見るなぁっ！,sound/data/pcm/c12/h/01.unity3d,h_so_12_00_036
37,12,24,うぅ、ほらぁ……やっぱりキツくて無理だろぉ？,sound/data/pcm/c12/h/01.unity3d,h_so_12_00_037
38,12,24,うぅぅ……お尻が拡がってるぅ……戻らなくなったらどうするんだよぉ……,sound/data/pcm/c12/h/01.unity3d,h_so_12_00_038
39,12,24,うん、最初はゆっくり、ゆっくりだからな,sound/data/pcm/c12/h/01.unity3d,h_so_12_00_039
40,12,24,うぁぁっ、なんだこれぇ、あたしのなかかきまぜられてるぅ……おかしくなるぅっ,sound/data/pcm/c12/h/01.unity3d,h_so_12_00_040
41,12,24,あぁ、動いてるぅ、ほんとにあたしのナカで動いてるぅ……,sound/data/pcm/c12/h/01.unity3d,h_so_12_00_041
42,12,24,うぁっ、強いぃっ……あぁ、ちょっと、速いってぇっ,sound/data/pcm/c12/h/01.unity3d,h_so_12_00_042
43,12,24,優しくって、あぁっ、優しくって言ったのにぃっ,sound/data/pcm/c12/h/01.unity3d,h_so_12_00_043
44,12,24,この乱暴者ぉ、うぅ、もうちょっと優しくしろぉっ、初めてなんだぞっ,sound/data/pcm/c12/h/01.unity3d,h_so_12_00_044
45,12,24,んあぁっ、なんだ……これ、やめっ、ちょっ、待った,sound/data/pcm/c12/h/01.unity3d,h_so_12_00_045
46,12,24,無理、やっぱり無理ぃっ、お尻、ああっ、おしりぃっ,sound/data/pcm/c12/h/01.unity3d,h_so_12_00_046
47,12,24,お尻の中、あぁっ、凄い事になってるぅっ,sound/data/pcm/c12/h/01.unity3d,h_so_12_00_047
48,12,24,んぁぁっ、お尻そんなにされたら、あたし変になるぅ……,sound/data/pcm/c12/h/01.unity3d,h_so_12_00_048
49,12,24,うぁぁっ！　優しくって、お尻は特に優しくしろってぇっ,sound/data/pcm/c12/h/01.unity3d,h_so_12_00_049
50,12,24,うっくっ、あぁっ、うぅっ、このっ、あとで、覚えてろよっ,sound/data/pcm/c12/h/01.unity3d,h_so_12_00_050
51,12,24,あぁっ、どこ触って、最初っからふたつ同時なんてやめろぉっ,sound/data/pcm/c12/h/01.unity3d,h_so_12_00_051
52,12,24,今そんな一緒に触られたら、あぁ、もうよくわかんなくなるぅ,sound/data/pcm/c12/h/01.unity3d,h_so_12_00_052
53,12,24,ひぅっ、あぁそこ、なんだそこ……なんかいいっ、あぁっ,sound/data/pcm/c12/h/01.unity3d,h_so_12_00_053
54,12,24,そこ弱いぃっ、でもいぃっ、触れるのいぃっ,sound/data/pcm/c12/h/01.unity3d,h_so_12_00_054
55,12,24,ひゃふっ！　変なとこ触るなぁっ、最初は普通でいいんだよぉっ,sound/data/pcm/c12/h/01.unity3d,h_so_12_00_055
56,12,24,んやっ、こらぁっ、どこ触ってるんだよぉ、そこは嫌だってばぁっ,sound/data/pcm/c12/h/01.unity3d,h_so_12_00_056
57,12,24,うぅ、折角の初めてなのにぃっ、そんなとこ違うだろぉ,sound/data/pcm/c12/h/01.unity3d,h_so_12_00_057
58,12,24,やめっ、やめろったらぁ、そこ触るのやめろぉっ,sound/data/pcm/c12/h/01.unity3d,h_so_12_00_058
59,12,24,あぁぅっ、なかで動いてるの……こんなに、わかるものなんだなっ,sound/data/pcm/c12/h/01.unity3d,h_so_12_00_059
60,12,24,うぐっ、ナカぐりぐりされると、あぁ、なんかふわふわするぅっ,sound/data/pcm/c12/h/01.unity3d,h_so_12_00_060
61,12,24,ゆっくりなんだけど、んぅっ、力強くて、それいいかもっ,sound/data/pcm/c12/h/01.unity3d,h_so_12_00_061
62,12,24,ぁぐっ、い、いたっ……ごめっ、まだ強いの無理、もう少しゆっくりぃっ,sound/data/pcm/c12/h/01.unity3d,h_so_12_00_062
63,12,24,ああぅっ、ひびくっ、あたしっ、エッチしてる……うぅ、エッチしちゃってるぅっ,sound/data/pcm/c12/h/01.unity3d,h_so_12_00_063
64,12,24,んあっ、はげしっ、んっ、なか、もうぐちゃぐちゃだよぉっ,sound/data/pcm/c12/h/01.unity3d,h_so_12_00_064
65,12,24,ちょっ、強いよぉっ、お尻は特に優しくだぁっ,sound/data/pcm/c12/h/01.unity3d,h_so_12_00_065
66,12,24,やめっ、あぁっ、やめっ、うぅ、やめろぉっ,sound/data/pcm/c12/h/01.unity3d,h_so_12_00_066
67,12,24,んぎっ、激しすぎるぅっ、そんなのだめだぁっ,sound/data/pcm/c12/h/01.unity3d,h_so_12_00_067
68,12,24,んぃっ、はぁばか、なにをっ、そこはお尻なんだ、お尻なんだぞっ,sound/data/pcm/c12/h/01.unity3d,h_so_12_00_068
69,12,24,あぁやめっ、ぶぴぶぴって、恥ずかしい音出ちゃってるからぁっ,sound/data/pcm/c12/h/01.unity3d,h_so_12_00_069
70,12,24,んぐっ、許して、痛いからぁっ、ほんと許してっ,sound/data/pcm/c12/h/01.unity3d,h_so_12_00_070
71,12,24,んっ、まだ痛いけど、そこ触られると少し紛れるかもっ,sound/data/pcm/c12/h/01.unity3d,h_so_12_00_071
72,12,24,うんっ、そこいいっ、ちょっと恥ずかしいけど、そこ触っててくれっ,sound/data/pcm/c12/h/01.unity3d,h_so_12_00_072
73,12,24,強いから、あぁ、そこ触って紛らわせてくれ,sound/data/pcm/c12/h/01.unity3d,h_so_12_00_073
74,12,24,うぅ、ちょっと激しすぎだけど、そこ触っててくれればなんとかなるかも,sound/data/pcm/c12/h/01.unity3d,h_so_12_00_074
75,12,24,あぁもぅっ、いまそれどころじゃないんだよぉ、へんなとこ触るなぁっ,sound/data/pcm/c12/h/01.unity3d,h_so_12_00_075
76,12,24,そこやめっ、だめっ、怒るぞ,sound/data/pcm/c12/h/01.unity3d,h_so_12_00_076
77,12,24,もぉー、そこばっかり触るなら次からしてやらないからなっ,sound/data/pcm/c12/h/01.unity3d,h_so_12_00_077
78,12,24,んぅぅ～、やらしい手つきで触ればなんでも気持ちよくなるってもんじゃないんだよぉっ,sound/data/pcm/c12/h/01.unity3d,h_so_12_00_078
79,12,24,はむっ、んっ、ちゅっ、っぷ、キス……いい、はぁ、エッチなキス……いぃっ,sound/data/pcm/c12/h/01.unity3d,h_so_12_00_079
80,12,24,っ、ちゅぷ、はぷっ、んぅぅっ、んっ、はふっ……息続かなっ、ちゅくっ、はぁっ、んッ,sound/data/pcm/c12/h/01.unity3d,h_so_12_00_080
81,12,24,んっ、んっ、んっ、ぷっ、ちゅぷっ……はぁっ、これ……すっごいエッチ……,sound/data/pcm/c12/h/01.unity3d,h_so_12_00_081
82,12,24,キス……うぅ、もっとキスぅっ……はぁっ、ぷっ、ちゅぷっ……んぅ、いいよぉっ,sound/data/pcm/c12/h/01.unity3d,h_so_12_00_082
83,12,24,ちゅっ、くちゅっ、あぁん、キスもっと、もっとキスぅっ……,sound/data/pcm/c12/h/01.unity3d,h_so_12_00_083
84,12,24,んぅ、ちゅっ、はぁっ、これ……ちゅぷっ、くちゅっ、どんどんあたし……はふっ、エッチになってくぅっ,sound/data/pcm/c12/h/01.unity3d,h_so_12_00_084
85,12,24,はぁぁっっ、んっ、ちゅぷっ、はぷっ……キスしながらいぃっ、気持ちいいよぉっ,sound/data/pcm/c12/h/01.unity3d,h_so_12_00_085
86,12,24,っちゅ、ちゅぷっ、はぁ、キスで痛いの消えて……ぁぁ、ぷちゅ、ちゅっ、気持ちいいのくるぅっ、,sound/data/pcm/c12/h/01.unity3d,h_so_12_00_086
87,12,24,うそっ、あぁっ、なんかくるっ、こんなのっ、すぐイっちゃ,sound/data/pcm/c12/h/01.unity3d,h_so_12_00_087
88,12,24,あぁ、やばっ、ひとりでするのと、あぁっ、全然ちがうぅっ,sound/data/pcm/c12/h/01.unity3d,h_so_12_00_088
89,12,24,んっ、んっ、あたし、あぁ、初めてなのに、ぁぁ、感じてっ,sound/data/pcm/c12/h/01.unity3d,h_so_12_00_089
90,12,24,すごい、あぁ、あたし感じてる、おまえに気持ちよくされてるぅっ,sound/data/pcm/c12/h/01.unity3d,h_so_12_00_090
91,12,24,あっ、気持ちよくなってきたな？　あたしでもわかるぞっ,sound/data/pcm/c12/h/01.unity3d,h_so_12_00_091
92,12,24,えへっ、その顔好きかも、んっ、もっと気持ちよくしてやるからな,sound/data/pcm/c12/h/01.unity3d,h_so_12_00_092
93,12,24,あぁっ、どんどんおっきく……これ、どこまで膨らむんだよぉっ,sound/data/pcm/c12/h/01.unity3d,h_so_12_00_093
94,12,24,いいのか？　あたし、気持ちよくできてるか？,sound/data/pcm/c12/h/01.unity3d,h_so_12_00_094
95,12,24,あぁなんで、あたし、はじめてのお尻で感じてるっ,sound/data/pcm/c12/h/01.unity3d,h_so_12_00_095
96,12,24,うそっ、あぁうそっ、こんなの絶対違う、お尻でイくわけないぃっ,sound/data/pcm/c12/h/01.unity3d,h_so_12_00_096
97,12,24,あぁ変だぁっ、お尻変なんだぁっ、これ以上はやめろぉっ,sound/data/pcm/c12/h/01.unity3d,h_so_12_00_097
98,12,24,あぁ、キツイのに、キツイのがいいっ、お尻開発されてるぅっ,sound/data/pcm/c12/h/01.unity3d,h_so_12_00_098
99,12,24,お尻の中でおっきくなってる、ぁぁ、うそ、そんなぁっ,sound/data/pcm/c12/h/01.unity3d,h_so_12_00_099
100,12,24,お尻で気持ちよくなるなんて変態なんだぞ、ううぅっ,sound/data/pcm/c12/h/01.unity3d,h_so_12_00_100
101,12,24,はぐっ、も、もう限界だろ？　早く出しちゃえ、あたしもやばいからぁっ,sound/data/pcm/c12/h/01.unity3d,h_so_12_00_101
102,12,24,あぁっ、どんどん固くっ、い、痛くないのか？,sound/data/pcm/c12/h/01.unity3d,h_so_12_00_102
103,12,24,（初絶頂）やぁ嘘っ、あたしイク、初めてなのに、イカされるぅっ！,sound/data/pcm/c12/h/01.unity3d,h_so_12_00_103
104,12,24,イクッ、そんなっ、ほんとにイッちゃう、んぁぁっ、恥ずかしいぃっ,sound/data/pcm/c12/h/01.unity3d,h_so_12_00_104
105,12,24,（初絶頂）あぁいぃっ、初めてだから、一緒に、一緒にぃっ！,sound/data/pcm/c12/h/01.unity3d,h_so_12_00_105
106,12,24,もうだめっ、せつなくて、あぁっ、一緒にイってくれぇっ,sound/data/pcm/c12/h/01.unity3d,h_so_12_00_106
107,12,24,（初絶頂）うっ、うん、初めてだもんな……中で……いいよっ,sound/data/pcm/c12/h/01.unity3d,h_so_12_00_107
108,12,24,あっ、で、出すんだなっ、う、うん、わかった、優しくなっ,sound/data/pcm/c12/h/01.unity3d,h_so_12_00_108
109,12,24,えぁっ、そ、外か、そ、そうだよな、うん、いっぱい出していいからなっ,sound/data/pcm/c12/h/01.unity3d,h_so_12_00_109
110,12,24,えへっ、気使ってくれたのか、うんっ、嬉しいっ,sound/data/pcm/c12/h/01.unity3d,h_so_12_00_110
111,12,24,うっ、おまえのびくってなった、これ、そろそろ出るんだろ？,sound/data/pcm/c12/h/01.unity3d,h_so_12_00_111
112,12,24,な、なんか怖いよ、必死なのわかるけど、イくなら言ってくれよぉっ,sound/data/pcm/c12/h/01.unity3d,h_so_12_00_112
113,12,24,んっ、ゴム付けてるんだから、遠慮しなくていいんだからなっ,sound/data/pcm/c12/h/01.unity3d,h_so_12_00_113
114,12,24,大丈夫かな？　ゴム付いてるよな？　取れてたりしないよな？,sound/data/pcm/c12/h/01.unity3d,h_so_12_00_114
115,12,24,あぁ、うそだぁ、お尻でイキそうになってるなんて、嘘だよぉ,sound/data/pcm/c12/h/01.unity3d,h_so_12_00_115
116,12,24,おしり、へんなかんじ、あぁ、うそ、おしりでイクッ！,sound/data/pcm/c12/h/01.unity3d,h_so_12_00_116
117,12,24,あぁ、お尻のなかで膨らんでっ、あぁっ、そんなのだめだぁっ！,sound/data/pcm/c12/h/01.unity3d,h_so_12_00_117
118,12,24,このままじゃお尻でイカされるぅっ！　はじめてなのにイカされちゃうぅっ！,sound/data/pcm/c12/h/01.unity3d,h_so_12_00_118
119,12,24,んぅ、ホントに最後までするなんてっ、このぉっ、へんたい,sound/data/pcm/c12/h/01.unity3d,h_so_12_00_119
120,12,24,うぅ、やっぱり出すんだよな……お尻、どうなっちゃうんだろ……,sound/data/pcm/c12/h/01.unity3d,h_so_12_00_120
121,12,24,んぁぁっ、出てるぅっ、ホントに出てるぅっ、中にいっぱい来てるよぉっ,sound/data/pcm/c12/h/01.unity3d,h_so_12_00_121
122,12,24,はぁうそっ、射精されてるぅっ、はじめてで中出しされてるぅっ,sound/data/pcm/c12/h/01.unity3d,h_so_12_00_122
123,12,24,んぅぁぁっ、ゴムの先っぽ膨らんでるぅ……あぁ、なんかすごいぃっ,sound/data/pcm/c12/h/01.unity3d,h_so_12_00_123
124,12,24,あっ、イってるのか？　あぁ、なんか膨らんできた、うぁぁ、なんだこれぇっ,sound/data/pcm/c12/h/01.unity3d,h_so_12_00_124
125,12,24,んあぁっ、なんかお尻に熱いの来てるぅっ！　ホントに出されてるぅっ,sound/data/pcm/c12/h/01.unity3d,h_so_12_00_125
126,12,24,うぅ、初めてだったんだぞぉ……それなのにお尻に出すとかぁ……,sound/data/pcm/c12/h/01.unity3d,h_so_12_00_126
127,12,24,んぁっ、やっ、んぁぁぁぁっ！,sound/data/pcm/c12/h/01.unity3d,h_so_12_00_127
128,12,24,ひゃぅ、んっ、んぅぅぅぅうぅうぅっ！,sound/data/pcm/c12/h/01.unity3d,h_so_12_00_128
129,12,24,あぁぁっ、あっ、はぁあっ、んっ、んぅぁぁぁぁっ！,sound/data/pcm/c12/h/01.unity3d,h_so_12_00_129
130,12,24,いっ、うっ、ひぅっ、はっ、はふっ、んぃぃぃっ！,sound/data/pcm/c12/h/01.unity3d,h_so_12_00_130
131,12,24,あぁ、あたし……イっちゃった……おまえもイケたな……えへへ、良かった,sound/data/pcm/c12/h/01.unity3d,h_so_12_00_131
132,12,24,はぁっ、はぁっ、すごかった……ゴムありでも……んっ、全然気持ち良かったよ,sound/data/pcm/c12/h/01.unity3d,h_so_12_00_132
133,12,24,んぅ、初めての中出し……はぁ、もう、なんだこれ……なんかもう……しあわせだよぅ……,sound/data/pcm/c12/h/01.unity3d,h_so_12_00_133
134,12,24,あぁ、あったかいよ……おまえのが中でまだとくんとくんって……ぇへへ,sound/data/pcm/c12/h/01.unity3d,h_so_12_00_134
135,12,24,うぅっ、初めてが危険日中出しって……どんだけだよぉっ……き、気持よかったけどぉっ,sound/data/pcm/c12/h/01.unity3d,h_so_12_00_135
136,12,24,はぁ、これ、絶対出来ちゃったと思うぞ……よくわかんないけど……たぶん……,sound/data/pcm/c12/h/01.unity3d,h_so_12_00_136
137,12,24,あぁ、んっ、んぅぅっ、イカされたぁっ……もう初めてだらけで……わけわかんないよぉ……,sound/data/pcm/c12/h/01.unity3d,h_so_12_00_137
138,12,24,うぅっ、こんなの恥ずかしすぎるぅっ……忘れろよ？　早く忘れ……うぅ、やっぱ覚えとけぇ,sound/data/pcm/c12/h/01.unity3d,h_so_12_00_138
139,12,24,うーっ、お尻にいっぱい出されたぁ……まぁ、あたしもイッちゃったからおあいこか……,sound/data/pcm/c12/h/01.unity3d,h_so_12_00_139
140,12,24,一緒にイキたいとは思ってたけど、なんでお尻なんだよぉっ……,sound/data/pcm/c12/h/01.unity3d,h_so_12_00_140
141,12,24,うぅやだぁ、お尻初めてでイッちゃうなんて……絶対誰にも言うなよぉっ……,sound/data/pcm/c12/h/01.unity3d,h_so_12_00_141
142,12,24,えぁ、な、なんでぇ……あたし……お尻でイッたのか？　このなの初めてだよぉ……,sound/data/pcm/c12/h/01.unity3d,h_so_12_00_142
143,12,24,ぁぁ、あっ、あぁっ……だめっ、なんかもう頭フラフラする……,sound/data/pcm/c12/h/01.unity3d,h_so_12_00_143
144,12,24,うぃぃっ、腰ぬけそ……ゴムあるからって……激しすぎっ……優しくって言ったのに……,sound/data/pcm/c12/h/01.unity3d,h_so_12_00_144
145,12,24,ふぁ、強すぎ……これが……はぁ……セックスなんだな……,sound/data/pcm/c12/h/01.unity3d,h_so_12_00_145
146,12,24,んぁっ、一人でするのと全然違うんだな……こんなの知ったらダメになるぅっ……,sound/data/pcm/c12/h/01.unity3d,h_so_12_00_146
147,12,24,うぁっ、だめ、色々考えなきゃいけないのに……んぅ、頭まっしろ……,sound/data/pcm/c12/h/01.unity3d,h_so_12_00_147
148,12,24,あぁ……子作りしちゃった……あたし……お、おかあさんになっちゃうのかな？,sound/data/pcm/c12/h/01.unity3d,h_so_12_00_148
149,12,24,うっ、やっ、まだビクビク……こんなに長いの……ぁっ、初めてっ……,sound/data/pcm/c12/h/01.unity3d,h_so_12_00_149
150,12,24,こんなの反則……あたし……おまえに逆らえなくなるっ……んぅぅっ,sound/data/pcm/c12/h/01.unity3d,h_so_12_00_150
151,12,24,あぁ、お尻ぃ、お尻熱いぃっ、初めてなのに、こんなの嘘だぁっ……,sound/data/pcm/c12/h/01.unity3d,h_so_12_00_151
152,12,24,うぅ、お尻に出されたぁ……最初からこんなの、ひどすぎるぅっ……,sound/data/pcm/c12/h/01.unity3d,h_so_12_00_152
153,12,24,うぅぅ、うぅぅぅ、ぅぅぅぅっ……もうだめっ……恥ずかしすぎて死ぬぅっ……,sound/data/pcm/c12/h/01.unity3d,h_so_12_00_153
154,12,24,やっ、あたし……お尻で……うそっ、お尻で感じちゃった……,sound/data/pcm/c12/h/01.unity3d,h_so_12_00_154
155,12,24,ふぅっ……ゴムしてて良かったよ……おまえ、出し過ぎ……,sound/data/pcm/c12/h/01.unity3d,h_so_12_00_155
156,12,24,初めてだからゴムなしでさせてやりたかったんだけど……やっぱちょっとな……,sound/data/pcm/c12/h/01.unity3d,h_so_12_00_156
157,12,24,んっ、ちゃんとイケたみたいだな……安心したよ……あたしちゃんとできたんだって,sound/data/pcm/c12/h/01.unity3d,h_so_12_00_157
158,12,24,中、なんか変な感じ……出されたって……ちゃんとわかるんだな……,sound/data/pcm/c12/h/01.unity3d,h_so_12_00_158
159,12,24,あーあ、ほんとに出しちゃって……まぁ、あたしがいいって言ったんだけどさ……,sound/data/pcm/c12/h/01.unity3d,h_so_12_00_159
160,12,24,うぅ、最初からこんな危ない事しちゃって……ほんとはダメなんだからなぁ……,sound/data/pcm/c12/h/01.unity3d,h_so_12_00_160
161,12,24,なんか……凄かったな……うぅ、思い出したらまた恥ずかしくなってきたぁ……,sound/data/pcm/c12/h/01.unity3d,h_so_12_00_161
162,12,24,初めてで、ゴムして、でも二人ともイケて……あ、相性いいのかな？　あたし達……,sound/data/pcm/c12/h/01.unity3d,h_so_12_00_162
163,12,24,処女捨てると女の顔になるってやつ……なんかわかっちゃったかも……,sound/data/pcm/c12/h/01.unity3d,h_so_12_00_163
164,12,24,えと……二人でイケたな……ちょっと不安だったんだけど……良かったよ,sound/data/pcm/c12/h/01.unity3d,h_so_12_00_164
165,12,24,あーもうめちゃくちゃ……とりあえず、ぎゅってして欲しいんだけど……,sound/data/pcm/c12/h/01.unity3d,h_so_12_00_165
166,12,24,いいって言ったよ……言ったけどさ……もうちょっと考えて欲しかったな……,sound/data/pcm/c12/h/01.unity3d,h_so_12_00_166
167,12,24,あたし……初めてなのにイッちゃって……ひ、引いたか？,sound/data/pcm/c12/h/01.unity3d,h_so_12_00_167
168,12,24,イッた時の顔……見てたよな？　あぁうぅ……恥ずかし過ぎるぅ……,sound/data/pcm/c12/h/01.unity3d,h_so_12_00_168
169,12,24,うぅ、お尻へんな感じぃ……なんかぎゅるぎゅるして……あっ、やばっ……,sound/data/pcm/c12/h/01.unity3d,h_so_12_00_169
170,12,24,初めてなのに後ろだけなんてやだからなっ……ちゃんと前も……うぅ……,sound/data/pcm/c12/h/01.unity3d,h_so_12_00_170
171,12,24,お尻ヒリヒリしてきたぁっ……うぅ、いつまで入れてるんだよぉ……,sound/data/pcm/c12/h/01.unity3d,h_so_12_00_171
172,12,24,ひゃっ、そんなに出っ！？　　あっ、すごっ……わぁ……,sound/data/pcm/c12/h/01.unity3d,h_so_12_00_172
