管理番号,大きい項目,中間項目,表示名,バンドルパス,ファイル名
0,21,58,あはっ、３人で出来るからって、オチンポがいつもよりぴくんぴくんしてるぅ♡,sound/data/pcm/c21/h/01.unity3d,h_so3p_21_03_000
1,21,58,クスッ♡　普段、キミにしか見せてないヤバイ私、友達にも知られちゃうかな？,sound/data/pcm/c21/h/01.unity3d,h_so3p_21_03_001
2,21,58,私のぐちょぬれマンコにオチンポ刺さってるところ見てぇ♡,sound/data/pcm/c21/h/01.unity3d,h_so3p_21_03_004
3,21,58,こんな近くで見られてるのって、おかしくなるぐらい興奮しちゃう♡,sound/data/pcm/c21/h/01.unity3d,h_so3p_21_03_005
4,21,58,私ね、このオチンポに変態にされちゃったんだよぉ♡,sound/data/pcm/c21/h/01.unity3d,h_so3p_21_03_008
5,21,58,チンポ狂いの私を見て幻滅しちゃやだよ？,sound/data/pcm/c21/h/01.unity3d,h_so3p_21_03_009
6,21,58,３Ｐハッスルちんぽこヤッバぁい♡　このチンポ好きぃっ♡,sound/data/pcm/c21/h/01.unity3d,h_so3p_21_03_010
7,21,58,後でちゃんと交代するからね？　カラオケでもマイク握りっぱのことないでしょ、私？,sound/data/pcm/c21/h/01.unity3d,h_so3p_21_03_011
8,21,58,勃起チンポとドスケベ愛撫でダブルアクメしちゃおぉ♡,sound/data/pcm/c21/h/01.unity3d,h_so3p_21_03_016
9,21,58,二人でガクガク痙攣しながら絶頂して、射精誘っちゃお♡,sound/data/pcm/c21/h/01.unity3d,h_so3p_21_03_017
10,21,58,すっごい可愛い顔してるよ♡　私も思いきりアヘアヘしちゃうぅ♡,sound/data/pcm/c21/h/01.unity3d,h_so3p_21_03_022
11,21,58,イク直前の顔見て私ももらいイキするぅぅう♡,sound/data/pcm/c21/h/01.unity3d,h_so3p_21_03_023
12,21,58,あは、みんなイキそうだし、いっせーのでイこ♡　準備いい？　いくよ、いっせーの～♡,sound/data/pcm/c21/h/01.unity3d,h_so3p_21_03_024
13,21,58,みんなでアヘバカになっちゃおー♡　チンポとマンコしあわせー♡,sound/data/pcm/c21/h/01.unity3d,h_so3p_21_03_025
14,21,58,竿姉妹でこれからも仲良くエッチしようね♡,sound/data/pcm/c21/h/01.unity3d,h_so3p_21_03_030
15,21,58,これからも一緒に大人の階段のぼっていこうね♡,sound/data/pcm/c21/h/01.unity3d,h_so3p_21_03_031
16,21,58,どっちの穴に入れたい？　どっちも気持ちいいと思うよ♡,sound/data/pcm/c21/h/01.unity3d,h_so3p_21_03_036
17,21,58,ねね、次はどっちがチンポ穴になる？　ふふふ♡,sound/data/pcm/c21/h/01.unity3d,h_so3p_21_03_037
