管理番号,大きい項目,中間項目,表示名,バンドルパス,ファイル名
0,16,54,んっふふ、私、結構焦らされるの好きかも……でもね、あんまり焦らすと……こっちから食べちゃうわよ？,sound/data/pcm/c16/h/01.unity3d,h_so_16_03_000
1,16,54,はぁ……おちんぽ早くちょうだい……おまんこ待ちきれなくて……涎垂れちゃってるから……,sound/data/pcm/c16/h/01.unity3d,h_so_16_03_001
2,16,54,我慢は体に毒よ……ほら早く……おまんこハメハメして……気持ちよくなりましょ……,sound/data/pcm/c16/h/01.unity3d,h_so_16_03_002
3,16,54,んっ、この瞬間が一番ゾクゾクするのよね……期待でおまんこ、ヒクヒクしちゃってる……,sound/data/pcm/c16/h/01.unity3d,h_so_16_03_003
4,16,54,いいわ……来て……意識が飛んじゃうくらい……何もかも忘れて、気持ちよくなる事だけ考えましょう,sound/data/pcm/c16/h/01.unity3d,h_so_16_03_004
5,16,54,んふっ、我慢汁垂らしちゃって、おちんぽかわいい……さぁ、おまんこでいっぱい可愛がってあげるからね,sound/data/pcm/c16/h/01.unity3d,h_so_16_03_005
6,16,54,逆に考えてみて。ゴムってセックスの時にしか使わないのよ？　なら使わないと勿体ないと思わない？,sound/data/pcm/c16/h/01.unity3d,h_so_16_03_006
7,16,54,んー、子宮に膨らんだゴムでキスされるの好きなんだけどなぁ……ゴムして欲しいなぁ……,sound/data/pcm/c16/h/01.unity3d,h_so_16_03_007
8,16,54,もぅ、アナタだって気にしながらするより思い切り出したいでしょう？　拗ねないでよ、ほら、付けてあげるから,sound/data/pcm/c16/h/01.unity3d,h_so_16_03_008
9,16,54,アブナイセックスに憧れる気持ちは私もあるの。でも、私はアナタを信じてるから。だからね……後は任せる,sound/data/pcm/c16/h/01.unity3d,h_so_16_03_009
10,16,54,うん、ケツ穴寂しいから、オチンポ埋めてぇっ……ごりごりって……いっぱい可愛がってね……,sound/data/pcm/c16/h/01.unity3d,h_so_16_03_010
11,16,54,いいわよ、アナタが開発したケツマンコだもの……好きなだけ使っていいの、めちゃくちゃにしていいんだからね,sound/data/pcm/c16/h/01.unity3d,h_so_16_03_011
12,16,54,えっとね……今日お腹の調子悪いのよ……色々とまずい事になると思うの……だからね、やめときましょ？,sound/data/pcm/c16/h/01.unity3d,h_so_16_03_012
13,16,54,もう、お尻でしたがるなんて人間だけなのよ？　オマンコ頑張るから、ね？　いっぱい愛して♪,sound/data/pcm/c16/h/01.unity3d,h_so_16_03_013
14,16,54,あぁ、来たっ……おちんぽ来たぁ……待ってたのよ、アナタのオマンコに……おかえりなさぁい♪,sound/data/pcm/c16/h/01.unity3d,h_so_16_03_014
15,16,54,はぅっ♪　んぅぅ～ん♪　このぉっ、悪戯好きなんだからぁ。オチンポ、メッってしないとね。んふふっ,sound/data/pcm/c16/h/01.unity3d,h_so_16_03_015
16,16,54,わかるのぉ……お尻の穴で……オチンポの形はっきりわかるぅ……はぁ……最高……,sound/data/pcm/c16/h/01.unity3d,h_so_16_03_016
17,16,54,んぁん♪　もう、悪戯オチンポなんだから。これはお尻でキュッてして、お仕置きね,sound/data/pcm/c16/h/01.unity3d,h_so_16_03_017
18,16,54,んぅぅっ、いいっ、ガン反りオチンポ……一番気持ちいいところに当たってるぅ……,sound/data/pcm/c16/h/01.unity3d,h_so_16_03_018
19,16,54,んっふふ、オチンポびくびくさせちゃって。ねぇ、入れただけで出ちゃいそうなんでしょ？　ダメよ？　我慢なさい,sound/data/pcm/c16/h/01.unity3d,h_so_16_03_019
20,16,54,オマンコの中、落ち着くでしょ？　アナタの形に整ってるんだもの、当然よね？,sound/data/pcm/c16/h/01.unity3d,h_so_16_03_020
21,16,54,あんっ、不意打ちのつもり？　無駄よ、最初からずっとアナタのオチンポ見てたもの,sound/data/pcm/c16/h/01.unity3d,h_so_16_03_021
22,16,54,んふふっ、オマンコどう？　ほかほかにして待ってたんだから。好きにしていいのよ,sound/data/pcm/c16/h/01.unity3d,h_so_16_03_022
23,16,54,んぅぅっ、お尻気持ちいぃっ……ねぇ早く、おっきなおちんぽでいっぱい擦ってぇっ,sound/data/pcm/c16/h/01.unity3d,h_so_16_03_023
24,16,54,不思議なものよね、お尻でこんなに感じるようになっちゃうなんて……んふっ、誰のせいかしら？,sound/data/pcm/c16/h/01.unity3d,h_so_16_03_024
25,16,54,むー、ちょっとは雰囲気も考えなさい？　一人で気持ちよくなるだけがセックスじゃないのよ？,sound/data/pcm/c16/h/01.unity3d,h_so_16_03_025
26,16,54,やんっ、もう、あわてんぼうのオチンポねぇ……悪い子はお尻の穴で虐めちゃうぞ？　んふふっ,sound/data/pcm/c16/h/01.unity3d,h_so_16_03_026
27,16,54,なぁに？　ここまで来てお預けなの？　いいわ、膣圧だけでその気にさせてみせるから,sound/data/pcm/c16/h/01.unity3d,h_so_16_03_027
28,16,54,オチンポは元気だし、調子悪いってわけじゃないのよね？　んぅ？　私から動いて欲しいの？,sound/data/pcm/c16/h/01.unity3d,h_so_16_03_028
29,16,54,ねぇ、わかってるでしょ……オマンコもう限界なのっ、早くめちゃくちゃにしてっ、ぐちゃぐちゃにかき混ぜてっ,sound/data/pcm/c16/h/01.unity3d,h_so_16_03_029
30,16,54,んー、ふと思ったのだけどね。私だけじゃなくて……アナタのお尻もいじってみたいの、ダメ？,sound/data/pcm/c16/h/01.unity3d,h_so_16_03_030
31,16,54,ほーら、お尻にならいくら出しても大丈夫だから、好きに動いて、好きなだけ出しなさい,sound/data/pcm/c16/h/01.unity3d,h_so_16_03_031
32,16,54,やだっ、アナルひくひくしちゃってるから……見ないで。いっぱい見た事あるでしょ？　何も変わらないから,sound/data/pcm/c16/h/01.unity3d,h_so_16_03_032
33,16,54,んっふふ、どうしたの？　ほら、アナタのオマンコはここよ、もう一回……ちゃんと入れて,sound/data/pcm/c16/h/01.unity3d,h_so_16_03_033
34,16,54,んー？　焦らしてるの？　そういう小手先の技より……いっぱい気持ちを込めてくれた方が嬉しいんだけどなぁ,sound/data/pcm/c16/h/01.unity3d,h_so_16_03_034
35,16,54,フフッ、ちょっと抜けちゃっただけよね？　わかってるから、今度は抜けないように、奥までしっかりね,sound/data/pcm/c16/h/01.unity3d,h_so_16_03_035
36,16,54,どう？　アナタのオチンポで拡げたアナルよ？　よーく見てね,sound/data/pcm/c16/h/01.unity3d,h_so_16_03_036
37,16,54,あんっ、お尻抜けちゃった……私、緩すぎたかしら？　頑張るから、もう一回入れてぇ……,sound/data/pcm/c16/h/01.unity3d,h_so_16_03_037
38,16,54,んっ、だめよぉ……オチンポ入れててくれないと……んふっ、うんち出しちゃうぞっ……,sound/data/pcm/c16/h/01.unity3d,h_so_16_03_038
39,16,54,そんなに探らなくても、私の弱い所は知ってるでしょ？　フフッ、探求心旺盛なオチンポねっ,sound/data/pcm/c16/h/01.unity3d,h_so_16_03_039
40,16,54,もどかしいのがいいの、これ好きなの、ゆっくりほぐされて……私トロトロにされちゃう……,sound/data/pcm/c16/h/01.unity3d,h_so_16_03_040
41,16,54,んふふ、早くしたら出ちゃうのかしら？　いいわよ、アナタのペースで気持ちよくなって,sound/data/pcm/c16/h/01.unity3d,h_so_16_03_041
42,16,54,んおっ、あっ、違うの……今のは……違うのよ……いやらしい声……聞かないでぇ……,sound/data/pcm/c16/h/01.unity3d,h_so_16_03_042
43,16,54,いいわよ、もっと必死に突いて、子宮降りてきちゃうくらいまで、ガンガン突いて,sound/data/pcm/c16/h/01.unity3d,h_so_16_03_043
44,16,54,いいっ、いいのっ、アナタの本気ピストン……最高よ、もっと来て、もっといけるはずよ,sound/data/pcm/c16/h/01.unity3d,h_so_16_03_044
45,16,54,お尻ぐにぐに気持ちいいぃ……アナタのお尻だって……わからされてるぅ……,sound/data/pcm/c16/h/01.unity3d,h_so_16_03_045
46,16,54,そんなにゆっくりでいいの？　もっと激しくしても大丈夫よ。ほら、遠慮しないで,sound/data/pcm/c16/h/01.unity3d,h_so_16_03_046
47,16,54,あっ、出ちゃう、そんなゆっくりほぐされたら、出ちゃうから、うんちセックスになっちゃうからぁっ……,sound/data/pcm/c16/h/01.unity3d,h_so_16_03_047
48,16,54,いいのよ、アナタのアナルだからね。好きにしていいの、壊しちゃったっていいんだから,sound/data/pcm/c16/h/01.unity3d,h_so_16_03_048
49,16,54,おっ、おほっ、あっ、だめ……聞かないで、下品な声……聞かないでぇ……,sound/data/pcm/c16/h/01.unity3d,h_so_16_03_049
50,16,54,凄いわ、私、アナルでこんなに感じてる……ねぇわかるでしょ、お尻、ずっと震えちゃってるのよ,sound/data/pcm/c16/h/01.unity3d,h_so_16_03_050
51,16,54,あんっ、お上手ね……こんなんじゃ私……すぐイカされちゃうかもっ,sound/data/pcm/c16/h/01.unity3d,h_so_16_03_051
52,16,54,はぁ、もうどこ触られても気持ちいい……アナタの手、すっごくいやらしいんだものっ,sound/data/pcm/c16/h/01.unity3d,h_so_16_03_052
53,16,54,熱いわ、アナタに触られたところ、熱くなっちゃうの、だからいっぱい触ってぇ……,sound/data/pcm/c16/h/01.unity3d,h_so_16_03_053
54,16,54,はっ、はっ、んっ、息がっ、できないわっ……気持ち良すぎて……死んじゃう,sound/data/pcm/c16/h/01.unity3d,h_so_16_03_054
55,16,54,いじめて楽しむなんて、ほんと男の子って面倒なんだからっ,sound/data/pcm/c16/h/01.unity3d,h_so_16_03_055
56,16,54,んもぅ、甘え過ぎよ、オイタはだーめっ,sound/data/pcm/c16/h/01.unity3d,h_so_16_03_056
57,16,54,んっ、確かに好きに触ってとは言ったけど……わかってくれてると思ってたのに……,sound/data/pcm/c16/h/01.unity3d,h_so_16_03_057
58,16,54,やんっ、そこは違うでしょ、ちゃんと集中しなさいっ,sound/data/pcm/c16/h/01.unity3d,h_so_16_03_058
59,16,54,ゆっくりなのに、力強い、矛盾してるのに、はぁ、なんでこんなに気持ちいいのかしら……,sound/data/pcm/c16/h/01.unity3d,h_so_16_03_059
60,16,54,うん、ゆっくりほぐして、いっぱい感じさせて、最後に最高に気持ちよくなる準備しましょ……,sound/data/pcm/c16/h/01.unity3d,h_so_16_03_060
61,16,54,んっあっ、オチンポ強いぃっ、オマンコ負けちゃう……オチンポに勝てないぃっ,sound/data/pcm/c16/h/01.unity3d,h_so_16_03_061
62,16,54,あっ、もう、わけわかんない、私……気持ちいい事しか考えられない,sound/data/pcm/c16/h/01.unity3d,h_so_16_03_062
63,16,54,オチンポがすごいの……オチンポが、オマンコを出たり入ったり、すごすぎるわっ,sound/data/pcm/c16/h/01.unity3d,h_so_16_03_063
64,16,54,オチンポ突いて、奥よ、もっと奥っ、ガンガン突いて、お腹の中、ぐちゃぐちゃに掻き回して,sound/data/pcm/c16/h/01.unity3d,h_so_16_03_064
65,16,54,アナル、ちゃんと締められてる？　ゆっくりされると、ちょっと緩んじゃう時があるから、頑張るわね,sound/data/pcm/c16/h/01.unity3d,h_so_16_03_065
66,16,54,うん、そこっ、ぐりぐりって奥を掻き混ぜるようにね……はぁ、それ、すごく気持ちいいわ,sound/data/pcm/c16/h/01.unity3d,h_so_16_03_066
67,16,54,こんなにされたら、うんちする度に思い出しちゃうかも……もう普通にできなくなっちゃう,sound/data/pcm/c16/h/01.unity3d,h_so_16_03_067
68,16,54,狂っちゃう、オチンポでアナル狂っちゃう、ケツマンコにされちゃぅぅっ,sound/data/pcm/c16/h/01.unity3d,h_so_16_03_068
69,16,54,あぐっ、カリが、カリがひっかいてくの……お尻の中、全部掻き出されるぅっ、ケツ穴めくれちゃうぅっ,sound/data/pcm/c16/h/01.unity3d,h_so_16_03_069
70,16,54,んぐっ、本気で堕としにきたわね……んっ、いいわ、先にどっちが果てちゃうか……勝負しましょ,sound/data/pcm/c16/h/01.unity3d,h_so_16_03_070
71,16,54,おまんこゆっくり掻き混ぜながら、好き放題されちゃってるのに……私、すっごく気持ちよくなってる……,sound/data/pcm/c16/h/01.unity3d,h_so_16_03_071
72,16,54,オチンポもアナタの手も……どっちも熱くて……私溶けちゃうわ……,sound/data/pcm/c16/h/01.unity3d,h_so_16_03_072
73,16,54,そこ好き、そこ好きなの、本気ピストンされながら触られたら、意識飛んじゃうっ！,sound/data/pcm/c16/h/01.unity3d,h_so_16_03_073
74,16,54,あぁもぅ、体中ビクビクしちゃってる……大きいの来てるのわかるぅっ,sound/data/pcm/c16/h/01.unity3d,h_so_16_03_074
75,16,54,むぅ、いじめてるつもり？　あとでひどいんだからねっ,sound/data/pcm/c16/h/01.unity3d,h_so_16_03_075
76,16,54,あぁもぅ、どうしてそこばっかり触りたがるの……何回言ってもわかってくれないんだから,sound/data/pcm/c16/h/01.unity3d,h_so_16_03_076
77,16,54,んぅ、そこ嫌って……もういい、好きになさい……ばかっ,sound/data/pcm/c16/h/01.unity3d,h_so_16_03_077
78,16,54,ホントに聞き分けがないんだから……ちゃんと締めてあげないわよ？,sound/data/pcm/c16/h/01.unity3d,h_so_16_03_078
79,16,54,んふっ、どっちが長く息止めてられるか勝負よ……んっ、ぷちゅ……ちゅぷ……はぷっ……んぅ、んぅぅっっ,sound/data/pcm/c16/h/01.unity3d,h_so_16_03_079
80,16,54,くちゅっ、ちゅぷ……はぁ、粘膜なら……どこでも感じちゃう……はむっ、んっ、ちゅく……きしゅいいっ（キスいい）,sound/data/pcm/c16/h/01.unity3d,h_so_16_03_080
81,16,54,んぁ、キス、すごいの……オマンコもだけど……すっごく繋がってるって感じで……んぅぁ、ちゅぷ、くちゅぷっ,sound/data/pcm/c16/h/01.unity3d,h_so_16_03_081
82,16,54,ちゅっ、くちゅ……はぁ、オマンコトントンされながらキスぅ……んぁぁっ、ちゅぷ、ちゅっ、こんなの溶けるぅ……,sound/data/pcm/c16/h/01.unity3d,h_so_16_03_082
83,16,54,あはっ、もう唾液でべとべと……ちゅぷ、でも、もっとしましょ……だってキス、気持ちいいんだものっ,sound/data/pcm/c16/h/01.unity3d,h_so_16_03_083
84,16,54,あぁっ、おまんこゆっくり掻き混ぜられて……んぅ、キスいっぱいしてっ、こんなの幸せ過ぎるぅっ,sound/data/pcm/c16/h/01.unity3d,h_so_16_03_084
85,16,54,あむっ、んっふふ、口塞いだまま、いっぱい突いて……んぷっ、じゅずずっ、んぅぅぅっ！,sound/data/pcm/c16/h/01.unity3d,h_so_16_03_085
86,16,54,キスされちゃうと……はぁ、だめね……ふにゃふにゃになっちゃう……甘えたくなっちゃう……,sound/data/pcm/c16/h/01.unity3d,h_so_16_03_086
87,16,54,ねぇ、私もうイキそうなの……そんなに焦らされたら……おかしくなっちゃうからぁっ,sound/data/pcm/c16/h/01.unity3d,h_so_16_03_087
88,16,54,んぁっ、もっと強くして、もう少しなの、大きいの来てるのよっ,sound/data/pcm/c16/h/01.unity3d,h_so_16_03_088
89,16,54,んぁっ、奥で感じてるの、子宮疼いちゃってるの……出して……いっぱい出してぇっ,sound/data/pcm/c16/h/01.unity3d,h_so_16_03_089
90,16,54,中、痙攣してるのわかるでしょう、小さくイキっぱなしなの……んぁ、大きいの来るぅっ！,sound/data/pcm/c16/h/01.unity3d,h_so_16_03_090
91,16,54,ほら、射精なさい、気持ちいいのいっぱいぶちまけちゃいなさい、イクとこ見せてっ！,sound/data/pcm/c16/h/01.unity3d,h_so_16_03_091
92,16,54,オチンポ我慢できないんでしょ？　腰ゆっくりになっちゃって……んふっ、可愛いんだから,sound/data/pcm/c16/h/01.unity3d,h_so_16_03_092
93,16,54,いいわ、射精して、思いっきり出しなさい、玉の中空っぽになるくらい出しちゃいなさいっ！,sound/data/pcm/c16/h/01.unity3d,h_so_16_03_093
94,16,54,もう限界でしょ？　わかってるから、全部わかってるからね、好きな時に射精していいからねっ,sound/data/pcm/c16/h/01.unity3d,h_so_16_03_094
95,16,54,オチンポが、アナルほじって……私の事イカせようとしてる……あぁっ、無理……イカされちゃうっ！,sound/data/pcm/c16/h/01.unity3d,h_so_16_03_095
96,16,54,もっと強く……ゆっくりじゃおかしくなっちゃうから……焦らさないで、一思いにイカせてぇっ！,sound/data/pcm/c16/h/01.unity3d,h_so_16_03_096
97,16,54,んおぁ、んぇ……いや、こんな声聞かないでぇっ……全然可愛くない声……出ちゃってるからぁっ！,sound/data/pcm/c16/h/01.unity3d,h_so_16_03_097
98,16,54,んぅぉぉ……おじりぃ……おじりすごいのぉ……あぁやだ……私、乱れすぎて……おかしくなっちゃってる……,sound/data/pcm/c16/h/01.unity3d,h_so_16_03_098
99,16,54,んあぁっっ、ガン反りオチンポでお尻の中掻き混ぜられてるぅっ……早く出してっ、いっぱい射精してぇっ,sound/data/pcm/c16/h/01.unity3d,h_so_16_03_099
100,16,54,いいわ、凄くいい、アナタのオチンポ最高よ……私のアナルと相性良すぎるのっ！,sound/data/pcm/c16/h/01.unity3d,h_so_16_03_100
101,16,54,アナルセックスいいっ！　もっとオチンポ膨らませて……ゴリゴリ奥までかき混ぜてっ！,sound/data/pcm/c16/h/01.unity3d,h_so_16_03_101
102,16,54,んぁっ、お腹の中、もう大変な事に……うぅ、いいわよ、出しちゃいなさいっ！,sound/data/pcm/c16/h/01.unity3d,h_so_16_03_102
103,16,54,あぁ嘘……私だけイッちゃう……先にイっちゃうの……ごめんねっ、ごめんねっ！,sound/data/pcm/c16/h/01.unity3d,h_so_16_03_103
104,16,54,凄い……パンパン凄いのっ、アクメ来てる……でっかいアクメ決めちゃうぅっ！,sound/data/pcm/c16/h/01.unity3d,h_so_16_03_104
105,16,54,んぅぅっ、オチンポがっ、あぁっ、オチンポがぁっ、アクメ来る！　一緒にイってぇ！,sound/data/pcm/c16/h/01.unity3d,h_so_16_03_105
106,16,54,出して、出して、今すぐ射精してぇっ！　私もう、イッちゃうからぁっ！,sound/data/pcm/c16/h/01.unity3d,h_so_16_03_106
107,16,54,あぁ、たっぷり出して、濃くてねばねばの孕ませ汁……私の中に注ぎ込んでっ！,sound/data/pcm/c16/h/01.unity3d,h_so_16_03_107
108,16,54,んぅ、いいわ、特濃ザーメンいっぱい搾ってあげる、意識飛んじゃうくらい、いっぱい出しなさい,sound/data/pcm/c16/h/01.unity3d,h_so_16_03_108
109,16,54,うんっ、かけて、アナタのむせ返りそうなザーメン、私にいっぱい嗅がせてっ,sound/data/pcm/c16/h/01.unity3d,h_so_16_03_109
110,16,54,いいわよ、私の体、アナタの精液でべとべとにして……アナタのものだって、匂い付けて,sound/data/pcm/c16/h/01.unity3d,h_so_16_03_110
111,16,54,ほーら、アナタのだーいすきなセックスで……だーいすきな射精……したいんでしょ？　わかってるんだからね,sound/data/pcm/c16/h/01.unity3d,h_so_16_03_111
112,16,54,オチンポが辛いよーって泣いてるわよ？　アナタの相棒でしょ？　もう楽にしてあげなさい,sound/data/pcm/c16/h/01.unity3d,h_so_16_03_112
113,16,54,あはっ、オチンポ、ゴムの中でイっちゃいなさい、びゅるびゅる射精して、ゴムぱんぱんにしちゃいなさいっ,sound/data/pcm/c16/h/01.unity3d,h_so_16_03_113
114,16,54,激しくしても無駄よ、ゴムは強いんだから、アナタのオチンポじゃ勝てないの、んっふふ,sound/data/pcm/c16/h/01.unity3d,h_so_16_03_114
115,16,54,んぅ、お尻オマンコにされちゃってるぅ……ケツマンコでぇ、ケツアクメ決めちゃうのぉっ！,sound/data/pcm/c16/h/01.unity3d,h_so_16_03_115
116,16,54,やっ、お尻パンパン凄いのっ……オチンポ出たり入ったり、もうイッちゃうからあぁっ！,sound/data/pcm/c16/h/01.unity3d,h_so_16_03_116
117,16,54,凄いわ、弱いとこ擦り合わせて、ケモノでもしないようなアナルセックスで、一緒にイッちゃいましょ！,sound/data/pcm/c16/h/01.unity3d,h_so_16_03_117
118,16,54,一緒よ……お尻だって……イク時は一緒、だってセックスは、一緒に気持ちよくならなきゃでしょ！,sound/data/pcm/c16/h/01.unity3d,h_so_16_03_118
119,16,54,出して、出してっ、お尻に出してぇっ……アナタの精液欲しいって、アナル疼いちゃってるからぁっ,sound/data/pcm/c16/h/01.unity3d,h_so_16_03_119
120,16,54,んっふふ、それ、締めるわよ～。キツキツアナル、勢いよく出してね、奥まで届かせてねっ,sound/data/pcm/c16/h/01.unity3d,h_so_16_03_120
121,16,54,んぁっ、来たぁっ♪　お精子来たぁっ、子宮でお迎えするからぁ、たっくさん注いでぇっ……,sound/data/pcm/c16/h/01.unity3d,h_so_16_03_121
122,16,54,あはっ、凄い量……それに絶対濃いわコレ……私を孕ませようって、精液から感じちゃう……,sound/data/pcm/c16/h/01.unity3d,h_so_16_03_122
123,16,54,すっごい出てる……ゴムだからって遠慮なさすぎよ、こんなに出されたら……私絶対孕んじゃう……,sound/data/pcm/c16/h/01.unity3d,h_so_16_03_123
124,16,54,あんっ、そんなに奥で膨らませたら、取るの大変になっちゃうから……んぅ、もう……フフッ,sound/data/pcm/c16/h/01.unity3d,h_so_16_03_124
125,16,54,あぁいいっ、アナルにねばねばザーメン出てる……お尻の中、凄い事になってるぅ……,sound/data/pcm/c16/h/01.unity3d,h_so_16_03_125
126,16,54,フフッ、お尻でアナタの精液感じるのも……すっかり慣れちゃった……ほら、最後まで搾り取ってあげるからねっ,sound/data/pcm/c16/h/01.unity3d,h_so_16_03_126
127,16,54,あっ、はふっ、イグッ、んああああああっ！,sound/data/pcm/c16/h/01.unity3d,h_so_16_03_127
128,16,54,んぅいいぃっ！　イッぐぅぅぅぅぅぅぅぅぅんっ！,sound/data/pcm/c16/h/01.unity3d,h_so_16_03_128
129,16,54,ふぅぅぅっ、んっ、あっ……はぁ……んっ……ごめっ、いま……イって……んぅっ,sound/data/pcm/c16/h/01.unity3d,h_so_16_03_129
130,16,54,あぁっ、んぅぅ、あぁぁぁ……しゅごぃ……はぁ……しゅごぃろぉ……（すごい　すごいの）,sound/data/pcm/c16/h/01.unity3d,h_so_16_03_130
131,16,54,んふっ、もうゴムぷくぷくよ……アナタ、ちょっと出し過ぎなんじゃないの？　んぅ？,sound/data/pcm/c16/h/01.unity3d,h_so_16_03_131
132,16,54,これ……ゴム中に残っちゃわないかしら……ちょっと緩めるから、ゆっくり引き抜いてね,sound/data/pcm/c16/h/01.unity3d,h_so_16_03_132
133,16,54,はぁ、いっぱい出したわねぇ……溜め過ぎよ……今日のために……我慢してたの？,sound/data/pcm/c16/h/01.unity3d,h_so_16_03_133
134,16,54,どう？　好きなだけ中出しした感想は？　私は……もちろん気持ち良かったわよ……フフッ,sound/data/pcm/c16/h/01.unity3d,h_so_16_03_134
135,16,54,ふぅ、こうなったらとことんやりましょ……どうせ出来ちゃうんだったら、その前にいっぱいしておかないと,sound/data/pcm/c16/h/01.unity3d,h_so_16_03_135
136,16,54,はぁ、ホントに仕方のない人なんだから……今後はもっとしっかりしてもらいますからね？　,sound/data/pcm/c16/h/01.unity3d,h_so_16_03_136
137,16,54,はーあ、イカされちゃった……別にいいわよ、一回で終わりじゃないでしょ？　アナタはまだなんだし……,sound/data/pcm/c16/h/01.unity3d,h_so_16_03_137
138,16,54,あら、今日は私の負けみたい……フフッ、勝率……今どうなってるんだっけ？,sound/data/pcm/c16/h/01.unity3d,h_so_16_03_138
139,16,54,んふふっ、出した後って一番敏感なのよね？　ちょっと意地悪しちゃおうかしら……,sound/data/pcm/c16/h/01.unity3d,h_so_16_03_139
140,16,54,私達、すっかりお尻にハマッちゃって……あ、ハメてるから？　もう……くだらない事言わないのっ,sound/data/pcm/c16/h/01.unity3d,h_so_16_03_140
141,16,54,あっ、うそ……私だけ？　うぅぅ、ごめんね、一緒に気持ちよくならなきゃなのに……私……うぅ……,sound/data/pcm/c16/h/01.unity3d,h_so_16_03_141
142,16,54,うぅ、アナタのせいで、おっきい方するだけで変な気分になっちゃうのよ？　それなのにまたこんな……,sound/data/pcm/c16/h/01.unity3d,h_so_16_03_142
143,16,54,ゴム付けててもこんなにイッちゃうなんて。やっぱり私達……相性抜群ねっ♪,sound/data/pcm/c16/h/01.unity3d,h_so_16_03_143
