管理番号,大きい項目,中間項目,表示名,バンドルパス,ファイル名
0,21,51,今日はどんな風にビクビクさせてやろうか～…なーんて考えてたり？,sound/data/pcm/c21/h/01.unity3d,h_ai_21_03_000
1,21,51,私、またイカされまくっちゃうのかな…頭が真っ白になっちゃうぐらい,sound/data/pcm/c21/h/01.unity3d,h_ai_21_03_001
2,21,51,キミの愛情たっぷりの愛撫でたくさん乱れちゃうからね♡,sound/data/pcm/c21/h/01.unity3d,h_ai_21_03_002
3,21,51,えへへ、ベロチュー気持ちいいね♪,sound/data/pcm/c21/h/01.unity3d,h_ai_21_03_009
4,21,51,舌がぬるぬる熱くて、このまま溶けちゃいそう…,sound/data/pcm/c21/h/01.unity3d,h_ai_21_03_010
5,21,51,んふふ、運命の赤い糸じゃなくて、エロエロの透明な糸引いちゃった♡　,sound/data/pcm/c21/h/01.unity3d,h_ai_21_03_011
6,21,51,エッチなキス、上手になったでしょ♡　スケベで変態なキミのせいだからね♡,sound/data/pcm/c21/h/01.unity3d,h_ai_21_03_012
7,21,51,ごめん、キスだけで軽くイッちゃったぁ…,sound/data/pcm/c21/h/01.unity3d,h_ai_21_03_013
8,21,51,キミとチュパチュパぺろぺろしてるだけで、エッチと同じぐらい気持ちいいよぉ♡,sound/data/pcm/c21/h/01.unity3d,h_ai_21_03_014
9,21,51,そんなにねちっこくされたら、すぐにイッちゃうかもぉ♡,sound/data/pcm/c21/h/01.unity3d,h_ai_21_03_018
10,21,51,それぇ、もうクセになっちゃってるよぉ、もっとぉ♡,sound/data/pcm/c21/h/01.unity3d,h_ai_21_03_019
11,21,51,エッチな声止まらなくなっちゃう♡,sound/data/pcm/c21/h/01.unity3d,h_ai_21_03_020
12,21,51,私がこんな顔してるの、友達にはナイショだからね♡,sound/data/pcm/c21/h/01.unity3d,h_ai_21_03_021
13,21,51,そこ、すごく感じちゃう♡　キミに開発され尽くしちゃってるぅ♡,sound/data/pcm/c21/h/01.unity3d,h_ai_21_03_022
14,21,51,んふふ、私の弱点知られ尽くされちゃってるぅ♡,sound/data/pcm/c21/h/01.unity3d,h_ai_21_03_023
15,21,51,ママぁ、ごめんなさい。私、エッチな子にされちゃったぁ♡,sound/data/pcm/c21/h/01.unity3d,h_ai_21_03_025
16,21,51,いいよぉ、コリコリ乳首もっといじってぇ♡,sound/data/pcm/c21/h/01.unity3d,h_ai_21_03_026
17,21,51,キミのせいで大きくなった勃起乳首感じちゃうのぉ♡,sound/data/pcm/c21/h/01.unity3d,h_ai_21_03_027
18,21,51,毎晩乳首オナニーしてる所もっと気持ちよくしてぇ♡,sound/data/pcm/c21/h/01.unity3d,h_ai_21_03_028
19,21,51,私のアソコ、キミ好みのグチュグチュおまんこにしてぇ♡,sound/data/pcm/c21/h/01.unity3d,h_ai_21_03_029
20,21,51,キミにいじられると、すぐにエッチなおつゆが垂れてきちゃうのぉ♡,sound/data/pcm/c21/h/01.unity3d,h_ai_21_03_030
21,21,51,もっとおマンコしてぇ♡　キミ専用のスケベ穴なんだから♡,sound/data/pcm/c21/h/01.unity3d,h_ai_21_03_031
22,21,51,どうしよ、おまんこよりアナルの方が気持ちいいかもぉっ,sound/data/pcm/c21/h/01.unity3d,h_ai_21_03_032
23,21,51,ああぁっそれだめぇ、うんちする時よりビクビクしちゃうぅ,sound/data/pcm/c21/h/01.unity3d,h_ai_21_03_033
24,21,51,らめっ、お尻ばっかりされたら、イキすぎて失神しちゃうぅっ♡,sound/data/pcm/c21/h/01.unity3d,h_ai_21_03_034
25,21,51,キミ専用のおっぱいだから、真っ赤になるまで揉んでいいからね♡,sound/data/pcm/c21/h/01.unity3d,h_ai_21_03_047
26,21,51,キミのために毎晩ケアしてるおっぱいの揉み心地はどう？　んふふ♡,sound/data/pcm/c21/h/01.unity3d,h_ai_21_03_048
27,21,51,揉み方エロいよぉ♡　手のひらの熱だけでイッちゃいそう♡,sound/data/pcm/c21/h/01.unity3d,h_ai_21_03_049
28,21,51,キミ専用のチンポアナル拡げてぇ♡　すぐ下にムレムレのおマンコもあるよぉ♡,sound/data/pcm/c21/h/01.unity3d,h_ai_21_03_050
29,21,51,たまに乳首以外の所をつついて、焦らしてほしいなぁ♡,sound/data/pcm/c21/h/01.unity3d,h_ai_21_03_051
30,21,51,んふふ♡　後でキミのおちんぽもツンツンしちゃうからね♡,sound/data/pcm/c21/h/01.unity3d,h_ai_21_03_052
31,21,51,あぁん♡　キミがつっつきやすいように、乳首勃起させて待ってたんだよぉ♡,sound/data/pcm/c21/h/01.unity3d,h_ai_21_03_053
32,21,51,えへへぇ♡　キミのオチンポみたいに勃起してる乳首、つまみやすいでしょ？,sound/data/pcm/c21/h/01.unity3d,h_ai_21_03_054
33,21,51,そのままクニクニしたら、母乳でちゃうかも？　なーんて、近い将来ね♡,sound/data/pcm/c21/h/01.unity3d,h_ai_21_03_055
34,21,51,あーん、焦らさないでぇ♡　そのまま転がしてぇ♡　キミなら痛されてもいいよぉ♡,sound/data/pcm/c21/h/01.unity3d,h_ai_21_03_056
35,21,51,浣腸で綺麗にしたツルツルアナルいっぱいいじってぇ♡,sound/data/pcm/c21/h/01.unity3d,h_ai_21_03_057
36,21,51,やっといじってくれたぁ♡　いつまで焦らされちゃうのかと思ったよぉ♡,sound/data/pcm/c21/h/01.unity3d,h_ai_21_03_058
37,21,51,今日もケツアクメでビクビクさせてくれるんだよね？　いっぱい弄ってほぐしてぇ♡,sound/data/pcm/c21/h/01.unity3d,h_ai_21_03_059
38,21,51,おまんこ穴とクリトリス交互にいじられるの好きぃ♡,sound/data/pcm/c21/h/01.unity3d,h_ai_21_03_060
39,21,51,もっと滅茶苦茶にしちゃってもいいんだよ？　それはオチンポまでお預け？　んふふ♡,sound/data/pcm/c21/h/01.unity3d,h_ai_21_03_061
40,21,51,もうスイッチ入っちゃったぁ♡　お願い、そのままグチュグチュしてぇ♡,sound/data/pcm/c21/h/01.unity3d,h_ai_21_03_062
41,21,51,キミに弄られすぎて、ぷっくりしちゃったアナルもっとなでなでしてぇ♡,sound/data/pcm/c21/h/01.unity3d,h_ai_21_03_063
42,21,51,待ってぇ…それだけで軽くイッちゃいそう、あ、あ…指、ほしいぃ♡,sound/data/pcm/c21/h/01.unity3d,h_ai_21_03_064
43,21,51,おまんこはいいから、もっとお尻の穴いじってぇ♡,sound/data/pcm/c21/h/01.unity3d,h_ai_21_03_065
44,21,51,っっっ……ご、ごめんね、入れられただけで、おマンコアクメしちゃったぁ♡,sound/data/pcm/c21/h/01.unity3d,h_ai_21_03_066
45,21,51,全身、鳥肌立っちゃった♡　今日もGスポットいっぱい弄ってね♡,sound/data/pcm/c21/h/01.unity3d,h_ai_21_03_067
46,21,51,そのままグリってされたら絶対イク♡　指動かしたら、一瞬で…♡,sound/data/pcm/c21/h/01.unity3d,h_ai_21_03_068
47,21,51,実は、さっきまでタンポン入れてたのぉ♡　でもやっぱりキミの指が一番気持ちいいぃ♡,sound/data/pcm/c21/h/01.unity3d,h_ai_21_03_069
48,21,51,もうキミの指が入ってないと切なくて仕方ないのぉ♡,sound/data/pcm/c21/h/01.unity3d,h_ai_21_03_070
49,21,51,もっとズッポリハメてぇ♡　根本までどっぷりぃ♡,sound/data/pcm/c21/h/01.unity3d,h_ai_21_03_071
50,21,51,んおぉ♡　オチンポじゃ突けない所グリグリ最高ぉっ♡,sound/data/pcm/c21/h/01.unity3d,h_ai_21_03_072
51,21,51,んはぁっ♡　あダメ、潮きちゃう、ブシューって噴いちゃう、潮、潮ぉ、お潮ぉんっ♡,sound/data/pcm/c21/h/01.unity3d,h_ai_21_03_073
52,21,51,もっとグチュグチュしてぇっ♡　グチュグチュ♡　グチュグチュ♡　グチュグチュぅう♡,sound/data/pcm/c21/h/01.unity3d,h_ai_21_03_074
53,21,51,おマンコより気持ちいいからもうケツマンコって呼べなくなっちゃうぅ♡,sound/data/pcm/c21/h/01.unity3d,h_ai_21_03_075
54,21,51,腸液まみれのほかほかアナル、もっとかっぽじってぇ～♡,sound/data/pcm/c21/h/01.unity3d,h_ai_21_03_076
55,21,51,指の次はおちんぽちょうだぁい♡　ケツハメフルコースご馳走してぇっ♡,sound/data/pcm/c21/h/01.unity3d,h_ai_21_03_077
56,21,51,キミの美味しい唾液まみれになるまで舐め舐めしてぇ♡,sound/data/pcm/c21/h/01.unity3d,h_ai_21_03_078
57,21,51,私もキミのことペロペロしたいよぉ♡　後で沢山お返ししちゃうからね♡,sound/data/pcm/c21/h/01.unity3d,h_ai_21_03_079
58,21,51,その舐め方男の子らしくて好きぃっ♡　もっと滅茶苦茶にしてぇ♡,sound/data/pcm/c21/h/01.unity3d,h_ai_21_03_080
59,21,51,キミのオチンポにも負けない勃起乳首しこしこしてぇ♡,sound/data/pcm/c21/h/01.unity3d,h_ai_21_03_081
60,21,51,キミ専用のおっぱいオシャブリ舐めて奇麗にしてほしいのぉ♡,sound/data/pcm/c21/h/01.unity3d,h_ai_21_03_082
61,21,51,そ、れ、すごいぃ♡　もっとキミの顔にスケベマンコ押し付けていぃい？,sound/data/pcm/c21/h/01.unity3d,h_ai_21_03_083
62,21,51,好きな子のラブラブクンニで、オマンコとクリちゃんふやけちゃうぅ♡,sound/data/pcm/c21/h/01.unity3d,h_ai_21_03_084
63,21,51,ケツまんこクンニ気持ちいいよぉっ♡　力んで拡げるから中も舐めてぇ♡,sound/data/pcm/c21/h/01.unity3d,h_ai_21_03_085
64,21,51,ベロのブツブツでアナルのシワぜぇんぶ引っかいてぇ♡,sound/data/pcm/c21/h/01.unity3d,h_ai_21_03_086
65,21,51,今朝、キミにベロ浣腸される夢見て、ずっと待ってたのぉ♡　ケツ穴以心伝心サイコ～♡,sound/data/pcm/c21/h/01.unity3d,h_ai_21_03_087
66,21,51,アナルにベロチューすごいぃん♡　もっとホジリンコして♡　ンッほぉお♡,sound/data/pcm/c21/h/01.unity3d,h_ai_21_03_088
67,21,51,うんちの穴をドスケベケツマンコにした舌でもっと開発してぇ♡　,sound/data/pcm/c21/h/01.unity3d,h_ai_21_03_089
68,21,51,ねね、私が買ってきた電マどう？　前のやつより振動強いでしょお♡,sound/data/pcm/c21/h/01.unity3d,h_ai_21_03_090
69,21,51,もうらめぇっ♡　ブルブルで思いっきりビクンチョしちゃうぅ♡,sound/data/pcm/c21/h/01.unity3d,h_ai_21_03_091
70,21,51,私のビクビクスイッチもオンにしてぇ♡　キミにスイッチ押し込んでほしいのぉ♡,sound/data/pcm/c21/h/01.unity3d,h_ai_21_03_092
71,21,51,どすけべ勃起んきん乳首もっとイジメてぇ♡,sound/data/pcm/c21/h/01.unity3d,h_ai_21_03_093
72,21,51,乳首が潰れちゃうぐらい押し付けてぇ♡　どうせビンビンに勃って感じちゃうからぁ♡,sound/data/pcm/c21/h/01.unity3d,h_ai_21_03_094
73,21,51,もう何回もイッてるぅっ♡　イキながらイッてるぅ♡　もっと大きいのきちゃうぅぅ♡,sound/data/pcm/c21/h/01.unity3d,h_ai_21_03_095
74,21,51,腰が勝手に動いちゃうぅっ♡　エッチな神様に操られちゃってるよぉ♡,sound/data/pcm/c21/h/01.unity3d,h_ai_21_03_096
75,21,51,お願いぃラストスパートかけてぇ♡　ビクンっビクンってなるぐらい責めまくってぇ♡,sound/data/pcm/c21/h/01.unity3d,h_ai_21_03_097
76,21,51,ねえっイクよ、イッていい？　あイク、ねね、イッたらすぐオチンポはめはめしてぇ♡,sound/data/pcm/c21/h/01.unity3d,h_ai_21_03_098
77,21,51,あ～イクぅっ、イクイクイクイク、イクッ、もうだめ、イクイクイクイクぅぅぅううう,sound/data/pcm/c21/h/01.unity3d,h_ai_21_03_099
78,21,51,ん”イ”ぐうぅううううぅうっ♡♡,sound/data/pcm/c21/h/01.unity3d,h_ai_21_03_100
79,21,51,ねね、次は私が思い切りキミをイカせてあげたいな♡　スケベな女の子の恩返し♡,sound/data/pcm/c21/h/01.unity3d,h_ai_21_03_101
80,21,51,私のカラダ、もう準備OKだよ♡　キミのオチンポの準備もOK？　んふふ♡,sound/data/pcm/c21/h/01.unity3d,h_ai_21_03_102
81,21,51,もう我慢汁たらたらなんじゃない？　我慢はオチンポに毒だよぉ♡,sound/data/pcm/c21/h/01.unity3d,h_ai_21_03_103
82,21,51,いいの？　キミのおちんぽギンッギンで苦しそうだけど♡,sound/data/pcm/c21/h/01.unity3d,h_ai_21_03_104
83,21,51,んふふ、一回ぐらいじゃ物足りないもんね♡　キミ好みのガンギマリ状態にして♡,sound/data/pcm/c21/h/01.unity3d,h_ai_21_03_105
84,21,51,キミとベロを絡ませると子宮がキュンキュンしちゃう♡,sound/data/pcm/c21/h/01.unity3d,h_ai_21_03_112
85,21,51,さっきよりも情熱的？　発情しちゃってるからかなぁ♡,sound/data/pcm/c21/h/01.unity3d,h_ai_21_03_113
86,21,51,んふふ♡　またエッチな糸引いちゃったね♡,sound/data/pcm/c21/h/01.unity3d,h_ai_21_03_114
87,21,51,もう我慢できないよぉ♡　セックスしよ♡　セックスぅ♡,sound/data/pcm/c21/h/01.unity3d,h_ai_21_03_115
88,21,51,身体の力は抜けちゃうのに、おマンコだけはギュギュゥって締まっちゃってるのぉ♡,sound/data/pcm/c21/h/01.unity3d,h_ai_21_03_116
89,21,51,やばぁい…キスしてる間、ずっとイキっぱなしだったよぉ♡　早く私のこと襲ってぇ♡,sound/data/pcm/c21/h/01.unity3d,h_ai_21_03_117
90,21,51,待って、そんなにしたらスイッチ入っちゃうから♡　もう、いじわるぅ♡,sound/data/pcm/c21/h/01.unity3d,h_ai_21_03_120
91,21,51,真っ赤になるまでしていいよ♡,sound/data/pcm/c21/h/01.unity3d,h_ai_21_03_121
92,21,51,鳥肌が止まらなくなっちゃうぅ♡,sound/data/pcm/c21/h/01.unity3d,h_ai_21_03_122
93,21,51,そうやって何度もするから、友達に触られただけでイクようになっちゃったんだよぉ♡,sound/data/pcm/c21/h/01.unity3d,h_ai_21_03_123
94,21,51,もうおまんこもお口も、じゅるるっ、大洪水だよぉっ♡,sound/data/pcm/c21/h/01.unity3d,h_ai_21_03_124
95,21,51,さっきのでフル勃起したスケベ乳首いじめまくってぇ♡,sound/data/pcm/c21/h/01.unity3d,h_ai_21_03_125
96,21,51,乳腺が刺激されて母乳出ちゃうかもぉっ♡　先っぽむずむずするぅ♡,sound/data/pcm/c21/h/01.unity3d,h_ai_21_03_126
97,21,51,おまんこ敏感になりすぎて怖いよぉ♡　限界までイカせてぇ♡,sound/data/pcm/c21/h/01.unity3d,h_ai_21_03_127
98,21,51,いつもセックス自慢してくる友達が引いちゃうぐらいすんごいマンコイキさせてぇ♡,sound/data/pcm/c21/h/01.unity3d,h_ai_21_03_128
99,21,51,そんなにされたら、アナル好きの変態に磨きがかかっちゃうぅ♡,sound/data/pcm/c21/h/01.unity3d,h_ai_21_03_129
100,21,51,もお許してぇっ♡　これ以上されたらオマンコでイケなくなっちゃうぅ♡,sound/data/pcm/c21/h/01.unity3d,h_ai_21_03_130
101,21,51,キミがいっぱい揉むから、汗ばんできちゃった♡　それだけで興奮しちゃう体なんだよ♡,sound/data/pcm/c21/h/01.unity3d,h_ai_21_03_137
102,21,51,体の芯がぼぉっとしてきちゃうよぉ♡　もっと揉み揉みしてぇ♡,sound/data/pcm/c21/h/01.unity3d,h_ai_21_03_138
103,21,51,またおっぱい？　んふふ、本当におっぱい星人なんだからぁ♡,sound/data/pcm/c21/h/01.unity3d,h_ai_21_03_139
104,21,51,また揉むぅ♡　この前更衣室で、おっぱいの形エロくなったって言われちゃったんだからね♡　責任とって気持ちよくしてぇ♡,sound/data/pcm/c21/h/01.unity3d,h_ai_21_03_140
105,21,51,んふふ、安産型のお尻揉んで、子供をたくさん作れるかチェックしてるの？,sound/data/pcm/c21/h/01.unity3d,h_ai_21_03_141
106,21,51,気持ちいいよぉ♡　キミの手垢まみれになるぐらいイッパイ揉んでぇっ♡,sound/data/pcm/c21/h/01.unity3d,h_ai_21_03_142
107,21,51,ペンとか自分の指じゃもうダメなのぉ、キミの指気持ちいいよぉ♡,sound/data/pcm/c21/h/01.unity3d,h_ai_21_03_143
108,21,51,私のスケベスイッチもっと押し込んでぇ♡　さっきより強くぅ♡,sound/data/pcm/c21/h/01.unity3d,h_ai_21_03_144
109,21,51,そのままクリクリしてぇっ♡　そうソレぇっ♡　よがっちゃうの止められないよぉ♡,sound/data/pcm/c21/h/01.unity3d,h_ai_21_03_145
110,21,51,もっと強く引っ張ってぇ♡　痛気持ちいいのがゾクゾクするのぉ♡,sound/data/pcm/c21/h/01.unity3d,h_ai_21_03_146
111,21,51,さっきよりも敏感になってるシワの真ん中つんつんしてぇ♡,sound/data/pcm/c21/h/01.unity3d,h_ai_21_03_147
112,21,51,やっぱりアナルって不思議ぃ♡　いじられると、自然とンオォ♡　って声が出ちゃうのぉ♡,sound/data/pcm/c21/h/01.unity3d,h_ai_21_03_148
113,21,51,おまんこナデナデおかわりきたぁ♡　キミの指、ぜぇんぶご馳走してぇ♡,sound/data/pcm/c21/h/01.unity3d,h_ai_21_03_149
114,21,51,クリトリスもビラビラもおまんこ穴も、ぜんぶ気持ちいいのぉ♡,sound/data/pcm/c21/h/01.unity3d,h_ai_21_03_150
115,21,51,アナルこすこす好っきぃ♡　でも、こすこすの後のズボズボはもっと好きだよぉ？,sound/data/pcm/c21/h/01.unity3d,h_ai_21_03_151
116,21,51,またアナル嬉しいぃ♡　もっとこすこすしてぇ♡　こすこす♡　こすこすコスコスこすこすぅ♡,sound/data/pcm/c21/h/01.unity3d,h_ai_21_03_152
117,21,51,おまんこキュンッて締めて、キミの指動けなくしちゃう♡　ほら、振りほどいてみてぇ♡,sound/data/pcm/c21/h/01.unity3d,h_ai_21_03_153
118,21,51,さっきズボズボされた感触が残ってて、キミの指が何倍も太く感じちゃうぅ♡,sound/data/pcm/c21/h/01.unity3d,h_ai_21_03_154
119,21,51,指アナルぅう♡　それからどうしちゃうの？　スケベな女の子のケツ穴にもっかい指をつっこんだらぁ？,sound/data/pcm/c21/h/01.unity3d,h_ai_21_03_155
120,21,51,えへへ、お尻待ってたのバレちゃったぁ？　さっきより激しくしてぇ♡,sound/data/pcm/c21/h/01.unity3d,h_ai_21_03_156
121,21,51,さっきより速いぃん♡　Gスポえぐってぇ♡　ゴリゴリ連打してぇ♡,sound/data/pcm/c21/h/01.unity3d,h_ai_21_03_157
122,21,51,本気汁たっぷりのドスケベマンコ行かせてぇ♡　指でおもいっきり気絶させてぇっ♡,sound/data/pcm/c21/h/01.unity3d,h_ai_21_03_158
123,21,51,ケツ穴ぐりんぐりん来たぁ♡　最近はキミの指を見るだけでお尻がキュッて反応しちゃうのぉ♡,sound/data/pcm/c21/h/01.unity3d,h_ai_21_03_159
124,21,51,お尻の穴の中気持ちよすぎて、指先が痺れてきちゃってるぅ♡,sound/data/pcm/c21/h/01.unity3d,h_ai_21_03_160
125,21,51,ベロチューの時より唾液たっぷりぃ♡　もっと塗りたくってぇ♡,sound/data/pcm/c21/h/01.unity3d,h_ai_21_03_161
126,21,51,キミの舌、さっきよりエッチな動きで狂っちゃう♡　舌でイカされちゃうぅ♡,sound/data/pcm/c21/h/01.unity3d,h_ai_21_03_162
127,21,51,キミのスケベ菌が移って乳首がビンビンに勃起しちゃってるぅ♡,sound/data/pcm/c21/h/01.unity3d,h_ai_21_03_163
128,21,51,さっきより大きくなった乳首、舐めやすい？　ベロの色んな所でピチャピチャしてぇ♡,sound/data/pcm/c21/h/01.unity3d,h_ai_21_03_164
129,21,51,見てぇ♡　キミがたっくさん舐めてくれたから、おマンコがずっと痙攣してるのぉ♡,sound/data/pcm/c21/h/01.unity3d,h_ai_21_03_165
130,21,51,オマンコの気持ちいいところ、下から上までベロォォオって舐めてぇ♡,sound/data/pcm/c21/h/01.unity3d,h_ai_21_03_166
131,21,51,いっぱい舐められてツヤツヤになったアナル肉もっと舐めてぇっ♡,sound/data/pcm/c21/h/01.unity3d,h_ai_21_03_167
132,21,51,そのまま舐め続けてぇ♡　軽くイッちゃってるの、ずっと、ビクビクってぇ♡,sound/data/pcm/c21/h/01.unity3d,h_ai_21_03_168
133,21,51,このツブツブ感好きだよぉっ♡　オチンポも指もツルツルだから、特別なのぉっ♡,sound/data/pcm/c21/h/01.unity3d,h_ai_21_03_169
134,21,51,さっきより深いところ彫ってぇ♡　やらしー舌でアナルほじくりまくってぇ♡,sound/data/pcm/c21/h/01.unity3d,h_ai_21_03_170
135,21,51,イッちゃうぅ♡　さっきもすごかったけど、ビクビク度更新しちゃうぅうっ♡,sound/data/pcm/c21/h/01.unity3d,h_ai_21_03_171
136,21,51,もっとすごいの来ちゃうぅっ♡　イクイクイク♡　イグゥゥウウンンンッ♡,sound/data/pcm/c21/h/01.unity3d,h_ai_21_03_172
137,21,51,えへへ、もう準備OKだよ♡　きっと何されても大声でイッちゃうから試してみて♡,sound/data/pcm/c21/h/01.unity3d,h_ai_21_03_173
138,21,51,もう色んな所が『汗だく』になってるよ♡　でも、これからもっと汗だくにされちゃうんだよね？　んふふふ♡,sound/data/pcm/c21/h/01.unity3d,h_ai_21_03_174
