管理番号,大きい項目,中間項目,表示名,バンドルパス,ファイル名
0,43,44,……焦らすやん？　もう、イケズぅ……ウチ、早ぉ欲しいねんけど……,sound/data/pcm/c43/h/71.unity3d,h_so_43_02_000
1,43,44,アカンわぁ……身体が気持ちええの欲しがっとる……,sound/data/pcm/c43/h/71.unity3d,h_so_43_02_001
2,43,44,さーて、どんなワクワク大冒険がウチらを待っとるんやろーなぁ……,sound/data/pcm/c43/h/71.unity3d,h_so_43_02_002
3,43,44,うん、めっちゃ挿れてぇ……んで、めっちゃ気持ちよぉしてぇ……,sound/data/pcm/c43/h/71.unity3d,h_so_43_02_003
4,43,44,なんかな？　アソコがもうジンジンしてヤバい感じやねん,sound/data/pcm/c43/h/71.unity3d,h_so_43_02_004
5,43,44,今、濡れ具合とか、ほてり具合とか……ええ感じに仕上がっとるで,sound/data/pcm/c43/h/71.unity3d,h_so_43_02_005
6,43,44,あー、いや、まずゴム付けようや……ほら、その方が何かとええねんで。知らんけど,sound/data/pcm/c43/h/71.unity3d,h_so_43_02_006
7,43,44,ウチ、ゴムは付けて欲しいなぁ？　今日のラッキーアイテムは『ゴム』やってん,sound/data/pcm/c43/h/71.unity3d,h_so_43_02_007
8,43,44,ウチなぁ、危険日的なアレやねんなぁ……ゴム、付けた方がええんちゃうかなぁ？,sound/data/pcm/c43/h/71.unity3d,h_so_43_02_008
9,43,44,ゴム……苦手なん？　ウチはゴム付きでもぜーんぜんエエねんけどなぁ,sound/data/pcm/c43/h/71.unity3d,h_so_43_02_009
10,43,44,んん？　お尻でしたいん？　ふふ、もう、しゃーないなぁ……,sound/data/pcm/c43/h/71.unity3d,h_so_43_02_010
11,43,44,断る理由、一個もないわ～。たっぷり愉しもうやぁ,sound/data/pcm/c43/h/71.unity3d,h_so_43_02_011
12,43,44,お尻なぁ……出来たら、今日は遠慮したいねんけど……,sound/data/pcm/c43/h/71.unity3d,h_so_43_02_012
13,43,44,んー、お尻よりも、もっと違う部分で楽しまへん？　多分楽しいで～……知らんけど,sound/data/pcm/c43/h/71.unity3d,h_so_43_02_013
14,43,44,おお……一番太いところが、ずっぽり入ってくる……,sound/data/pcm/c43/h/71.unity3d,h_so_43_02_014
15,43,44,いなり来ても、受け入れてしまってるわ……,sound/data/pcm/c43/h/71.unity3d,h_so_43_02_015
16,43,44,ああ、お尻に大きいのが来てるわ……,sound/data/pcm/c43/h/71.unity3d,h_so_43_02_016
17,43,44,ちょぉ、ビックリさせるやん……,sound/data/pcm/c43/h/71.unity3d,h_so_43_02_017
18,43,44,ふぅ……一番深いところにガッチリとハマっとる。このまま動いてくれてええんやで,sound/data/pcm/c43/h/71.unity3d,h_so_43_02_018
19,43,44,なんか、そわそわしてへん？　もしかして、もうイキそうなん？,sound/data/pcm/c43/h/71.unity3d,h_so_43_02_019
20,43,44,さーて、どんな風に楽しもか？,sound/data/pcm/c43/h/71.unity3d,h_so_43_02_020
21,43,44,随分なんかせっかちやん。そないにウチとのエッチ、楽しみやったん？,sound/data/pcm/c43/h/71.unity3d,h_so_43_02_021
22,43,44,ウチが濡れてなかったら大変なことになっとったで？,sound/data/pcm/c43/h/71.unity3d,h_so_43_02_022
23,43,44,おちんちん、ずっぽり入っとる……ああ、これだけでもう気持ちええ……,sound/data/pcm/c43/h/71.unity3d,h_so_43_02_023
24,43,44,お尻の穴が、自分のソレの形になってもうとる……ああ、なんかこの圧迫感が愛おしい……,sound/data/pcm/c43/h/71.unity3d,h_so_43_02_024
25,43,44,ウチのお尻大事にしたって～。ま、突然されるのも、悪くないねんけど,sound/data/pcm/c43/h/71.unity3d,h_so_43_02_025
26,43,44,ウチのお尻やなかったら、大変なことになっとったで。知らんけど,sound/data/pcm/c43/h/71.unity3d,h_so_43_02_026
27,43,44,……って動かへんのかーい。まあ、それやったらそれでええけどさぁ,sound/data/pcm/c43/h/71.unity3d,h_so_43_02_027
28,43,44,この時間、大事やね……入ったモノの形、穴に馴染ませてる感じ……,sound/data/pcm/c43/h/71.unity3d,h_so_43_02_028
29,43,44,なあ、わかる？　アソコが、ちんちんをキッチキチに締め付けとるで,sound/data/pcm/c43/h/71.unity3d,h_so_43_02_029
30,43,44,お尻の穴の締め付け具合、そうやってしっかり味わっといてな,sound/data/pcm/c43/h/71.unity3d,h_so_43_02_030
31,43,44,このままじーっとしてても、なーんも起こらへんのと違う？,sound/data/pcm/c43/h/71.unity3d,h_so_43_02_031
32,43,44,こうやって、お互い馴染むのを待つんも悪ぅないんちゃうかなぁ？,sound/data/pcm/c43/h/71.unity3d,h_so_43_02_032
33,43,44,……へ？　なんで抜くん？　ウチ、いけずされてる？,sound/data/pcm/c43/h/71.unity3d,h_so_43_02_033
34,43,44,ほえ？　違うことしたくなったん？,sound/data/pcm/c43/h/71.unity3d,h_so_43_02_034
35,43,44,……もっと濡れてから、ハメるんでもええかもしらんねぇ,sound/data/pcm/c43/h/71.unity3d,h_so_43_02_035
36,43,44,なんやのん……？　ウチのお尻、気に入らんかったん？,sound/data/pcm/c43/h/71.unity3d,h_so_43_02_036
37,43,44,なんなん？　お尻出し入れし過ぎたら、穴が塞がらんくなってしまうわ,sound/data/pcm/c43/h/71.unity3d,h_so_43_02_037
38,43,44,あれ？　どーしたん？　お尻やない方がよかった？,sound/data/pcm/c43/h/71.unity3d,h_so_43_02_038
39,43,44,ああ、中で、ずるずる動いとる……快感拡がってくわ……,sound/data/pcm/c43/h/71.unity3d,h_so_43_02_039
40,43,44,なんかジックリした腰使いやん？　それもええけど、もっと激しいのも好きやなぁ,sound/data/pcm/c43/h/71.unity3d,h_so_43_02_040
41,43,44,今、エエ感じで中が擦れとる……あー、これ、めっちゃええ……,sound/data/pcm/c43/h/71.unity3d,h_so_43_02_041
42,43,44,そう、それエエわ……自分にしてもらうん、好きやねん……ああ、たまらんわぁ……,sound/data/pcm/c43/h/71.unity3d,h_so_43_02_042
43,43,44,奥まで届いてる……そんなに動かされたら、中でゴツゴツ音が聞こえてきよる……,sound/data/pcm/c43/h/71.unity3d,h_so_43_02_043
44,43,44,うわぁ、ウチん中、エッチなヨダレでびっちゃびちゃやわぁ……,sound/data/pcm/c43/h/71.unity3d,h_so_43_02_044
45,43,44,んん、じっくりと動いとる……穴が、ちんちんの形に馴染んでいく感じ、めっちゃエエ……,sound/data/pcm/c43/h/71.unity3d,h_so_43_02_045
46,43,44,出たり入ったり……尻穴がめくれ上がってまいそうやぁ……,sound/data/pcm/c43/h/71.unity3d,h_so_43_02_046
47,43,44,このお尻、もうすっかり気持ちええこと、憶えてもうた……ほんま悪い穴やで,sound/data/pcm/c43/h/71.unity3d,h_so_43_02_047
48,43,44,んん、するすると穴の縁が擦られて……あはぁ、めっちゃ気持ちええわぁ,sound/data/pcm/c43/h/71.unity3d,h_so_43_02_048
49,43,44,お尻の穴からジュポジュポ音が聞こえてきよる……ああ、腹の中で響くぅ……,sound/data/pcm/c43/h/71.unity3d,h_so_43_02_049
50,43,44,はぁ、深いところ、えぐってきよる……あ～～、力、入らんくなりそうやわぁ,sound/data/pcm/c43/h/71.unity3d,h_so_43_02_050
51,43,44,なんか、もう……なんでもありっちゅう感じやわぁ……はぁ、楽しい～～,sound/data/pcm/c43/h/71.unity3d,h_so_43_02_051
52,43,44,いろんなところで楽しまんと、もったいないわなぁ,sound/data/pcm/c43/h/71.unity3d,h_so_43_02_052
53,43,44,はぁ……なんか慌ただしいけど、だんだんええ感じになってきたわ,sound/data/pcm/c43/h/71.unity3d,h_so_43_02_053
54,43,44,こんだけアレコレしてたら、あっと言う間にイッてしまいそうやわ,sound/data/pcm/c43/h/71.unity3d,h_so_43_02_054
55,43,44,んー……なあ、ちょっとアレでアレやねんけど……ほら、わかるやろ？　そこアカンんねん,sound/data/pcm/c43/h/71.unity3d,h_so_43_02_055
56,43,44,ちょ、もう……ソコはアカンねん。いちいち言わんでもわかってるんちゃうのぉ……？,sound/data/pcm/c43/h/71.unity3d,h_so_43_02_056
57,43,44,う～～、ソコ、苦手やねんってぇ……ウチのこと分かってぇ,sound/data/pcm/c43/h/71.unity3d,h_so_43_02_057
58,43,44,アカンアカンッ、そこアカンねんって……それぐらい、わかってーや,sound/data/pcm/c43/h/71.unity3d,h_so_43_02_058
59,43,44,ちんちんで、めっちゃこね回されてる……そんなん気持ちええに決まっとるやん,sound/data/pcm/c43/h/71.unity3d,h_so_43_02_059
60,43,44,あー、その腰使い、アカンわぁ……なんか、気持ちよくなる未来しかないわぁ,sound/data/pcm/c43/h/71.unity3d,h_so_43_02_060
61,43,44,ウチ、どんだけ濡れてんねん……感じすぎて、エライことになってもうてるわ,sound/data/pcm/c43/h/71.unity3d,h_so_43_02_061
62,43,44,あはぁっ、めっちゃ動くやん……そないに興奮してぇ……可愛いなぁ,sound/data/pcm/c43/h/71.unity3d,h_so_43_02_062
63,43,44,ああ、それヤバい……ちんちん、中で暴れとる……こんなん、気持ちよすぎやわぁ,sound/data/pcm/c43/h/71.unity3d,h_so_43_02_063
64,43,44,激しかったら、激しいだけ、感じてまうねん……あかん、もっと欲しぃなる……,sound/data/pcm/c43/h/71.unity3d,h_so_43_02_064
65,43,44,お尻の穴が押し込まれて、引っ張られて……はぁ、たまらんわぁ……,sound/data/pcm/c43/h/71.unity3d,h_so_43_02_065
66,43,44,なんか、お尻の穴がちんちんに抱きついて行きよる……ウチもう完全にハマッとるわ,sound/data/pcm/c43/h/71.unity3d,h_so_43_02_066
67,43,44,ああ、ゆっくり動くと、形とか硬さとか、めっちゃわかる……,sound/data/pcm/c43/h/71.unity3d,h_so_43_02_067
68,43,44,はぁぁぁあ、たまらん……お尻の穴が、喜んどる……,sound/data/pcm/c43/h/71.unity3d,h_so_43_02_068
69,43,44,このままガンガンしてほしいわ、お尻の穴でするん、自分も好っきやろ？,sound/data/pcm/c43/h/71.unity3d,h_so_43_02_069
70,43,44,お尻でするん、すっかりクセになってもうたわ……ほんま最高やぁ,sound/data/pcm/c43/h/71.unity3d,h_so_43_02_070
71,43,44,いろんなところで気持ちよくなるん、ウチ、好きやわぁ,sound/data/pcm/c43/h/71.unity3d,h_so_43_02_071
72,43,44,ああ、身体のあちこちが気持ちええ……めっちゃ濡れる……,sound/data/pcm/c43/h/71.unity3d,h_so_43_02_072
73,43,44,ヤバい……気持ちええのが、全身に染み込んでいく……,sound/data/pcm/c43/h/71.unity3d,h_so_43_02_073
74,43,44,ちょ、もう……感じ過ぎて、全身から力が抜けてしまいよる……,sound/data/pcm/c43/h/71.unity3d,h_so_43_02_074
75,43,44,ん～～～……あのな、刺激したらあかんところ、いじっとるで？,sound/data/pcm/c43/h/71.unity3d,h_so_43_02_075
76,43,44,なんやそれ……そんなんされたら、気持ちよぉなれへんわ……,sound/data/pcm/c43/h/71.unity3d,h_so_43_02_076
77,43,44,ちょ、いらんことしたらあかん……ウチ、そこあんまりやねん,sound/data/pcm/c43/h/71.unity3d,h_so_43_02_077
78,43,44,なあ、集中させてぇや……そこ刺激されたら、ン゛ンンッってなるねん,sound/data/pcm/c43/h/71.unity3d,h_so_43_02_078
79,43,44,ヤバい……キス、好き……めっちゃスキ……あかん、スキすぎる……,sound/data/pcm/c43/h/71.unity3d,h_so_43_02_079
80,43,44,ちんちん感じながら、キスて……こんなん、禁じ手わやぁ,sound/data/pcm/c43/h/71.unity3d,h_so_43_02_080
81,43,44,もっと舌絡めたい……もっとちんちん感じたい……アカン、めっちゃエロい,sound/data/pcm/c43/h/71.unity3d,h_so_43_02_081
82,43,44,なんか、もう……どこもかしこも絡まって……ああ、頭が働かへん……,sound/data/pcm/c43/h/71.unity3d,h_so_43_02_082
83,43,44,ちょ、そないに舌グルグルされたら感じ過ぎてまう点,sound/data/pcm/c43/h/71.unity3d,h_so_43_02_083
84,43,44,アカン……キス魔になってまいそうや……もっと、もっとしてぇ……,sound/data/pcm/c43/h/71.unity3d,h_so_43_02_084
85,43,44,舌で握手してるみたうやわやぁ……ああ、もっと舌、絡ませたい……,sound/data/pcm/c43/h/71.unity3d,h_so_43_02_085
86,43,44,どんどんキスしてまうわぁ……ちんちんも気持ちエエし……ほんま最高やわぁ,sound/data/pcm/c43/h/71.unity3d,h_so_43_02_086
87,43,44,うっわっ、何それ……めっちゃネチッこい腰使いやん……アカン、そろそろイキそうやわ,sound/data/pcm/c43/h/71.unity3d,h_so_43_02_087
88,43,44,ちんちんの刺激強すぎるわ……そろそろイッてしまいそ……,sound/data/pcm/c43/h/71.unity3d,h_so_43_02_088
89,43,44,ガンガンに来よるやんっ、あ、ああ、ヤバッ、このままされたらイッてまう……,sound/data/pcm/c43/h/71.unity3d,h_so_43_02_089
90,43,44,一緒にイクために我慢しとったけど……そろそろアカンかもぉ……,sound/data/pcm/c43/h/71.unity3d,h_so_43_02_090
91,43,44,お？　中でちんちんヒクヒクしよぉやん……イキそうなん？,sound/data/pcm/c43/h/71.unity3d,h_so_43_02_091
92,43,44,身体に力がバッキバキに入っとるで？　イクん我慢してんの？　我慢せんでエエのに……,sound/data/pcm/c43/h/71.unity3d,h_so_43_02_092
93,43,44,あはぁ、その腰使い、ヤバ……イク気まんまんやん,sound/data/pcm/c43/h/71.unity3d,h_so_43_02_093
94,43,44,ちんちんがイキたがっとる……こりゃ、そろそろ射精タイムやなぁ,sound/data/pcm/c43/h/71.unity3d,h_so_43_02_094
95,43,44,あぁ、ゆっくりした出し入れで、ウチのお尻イッてしまいそ……,sound/data/pcm/c43/h/71.unity3d,h_so_43_02_095
96,43,44,こういう、のんびりしたちんちんの方が、逆に感じる……ああ、そろそろイキそ……,sound/data/pcm/c43/h/71.unity3d,h_so_43_02_096
97,43,44,お尻、ヤバい……気持ちよくて、どないかなりそう……もう我慢でけへん……,sound/data/pcm/c43/h/71.unity3d,h_so_43_02_097
98,43,44,あ、来よる……エグいの近づいとる……ウチ、お尻でイッてしまうかも……,sound/data/pcm/c43/h/71.unity3d,h_so_43_02_098
99,43,44,お尻、気持ちええやろぉ？　イキたいなら我慢せんでエエんやで,sound/data/pcm/c43/h/71.unity3d,h_so_43_02_099
100,43,44,ウチのお尻、魔性の穴やろ？　ふふ、そらイキたなるわなぁ……,sound/data/pcm/c43/h/71.unity3d,h_so_43_02_100
101,43,44,なんか焦ってへん？　ははーん……さてはイキそうになっとるな？　ウチのお尻で……,sound/data/pcm/c43/h/71.unity3d,h_so_43_02_101
102,43,44,自分、我慢しとるやろ？　ふふ、なんとなくわかるねん。隠さんでええんやで～,sound/data/pcm/c43/h/71.unity3d,h_so_43_02_102
103,43,44,あぁん、めっちゃチンチン気持ちええっ、ウチだけイッてしまうっ……！,sound/data/pcm/c43/h/71.unity3d,h_so_43_02_103
104,43,44,ごめんやけど、ウチ、もうイキそう……あ、ああ、イク、もうイクぅ……！,sound/data/pcm/c43/h/71.unity3d,h_so_43_02_104
105,43,44,一緒にイケそうやね、心と身体が繋がってるんかな……嬉しいわ……！,sound/data/pcm/c43/h/71.unity3d,h_so_43_02_105
106,43,44,ウチがタイミング合わせるから、一緒にイコかっ……！,sound/data/pcm/c43/h/71.unity3d,h_so_43_02_106
107,43,44,中に出したがるんは男の性なん？　ま、ええで,sound/data/pcm/c43/h/71.unity3d,h_so_43_02_107
108,43,44,かまへん、出しぃ……ウチが、全部受け止めたるっ,sound/data/pcm/c43/h/71.unity3d,h_so_43_02_108
109,43,44,お？　外に出すん……？　ええでぇ……いっぱい出しやぁ,sound/data/pcm/c43/h/71.unity3d,h_so_43_02_109
110,43,44,外かぁ……ほな、出したい場所に狙いを定めときぃ,sound/data/pcm/c43/h/71.unity3d,h_so_43_02_110
111,43,44,ええでええで、ゴム越しに熱いの感じさせてな,sound/data/pcm/c43/h/71.unity3d,h_so_43_02_113
112,43,44,ゴムの中やったら、もう遠慮なしやで……たっぷり出しぃ,sound/data/pcm/c43/h/71.unity3d,h_so_43_02_114
113,43,44,アカン、お尻の穴、めっちゃええ！　イク、めっちゃイってまうぅ！,sound/data/pcm/c43/h/71.unity3d,h_so_43_02_115
114,43,44,あああ、ヤバい……ウチ、一人で気持ちよぉなっとる……お尻の穴で、イクぅ……！,sound/data/pcm/c43/h/71.unity3d,h_so_43_02_116
115,43,44,お尻で一緒にイケるん、なんか嬉しい……なんでか全然わからんけど……！,sound/data/pcm/c43/h/71.unity3d,h_so_43_02_117
116,43,44,同時にイケるかな？　ああ、ドキドキする……めっちゃ楽しみぃ……！,sound/data/pcm/c43/h/71.unity3d,h_so_43_02_118
117,43,44,もちろんやでぇ……お尻の穴やったらナンボでも出しぃ,sound/data/pcm/c43/h/71.unity3d,h_so_43_02_119
118,43,44,お尻の穴で、精液感じるん、想像しただけでめっちゃ興奮するぅ……,sound/data/pcm/c43/h/71.unity3d,h_so_43_02_120
119,43,44,あぁ、精液、めっちゃ出てるぅ……,sound/data/pcm/c43/h/71.unity3d,h_so_43_02_121
120,43,44,奥に、精液、めっちゃぶつかってくる,sound/data/pcm/c43/h/71.unity3d,h_so_43_02_122
121,43,44,ゴムの中がいっぱいになってくぅ……,sound/data/pcm/c43/h/71.unity3d,h_so_43_02_123
122,43,44,ドクドク出て、ゴムが膨らんでいくんが判る……,sound/data/pcm/c43/h/71.unity3d,h_so_43_02_124
123,43,44,ああ、お尻の中、熱いわぁ……,sound/data/pcm/c43/h/71.unity3d,h_so_43_02_125
124,43,44,お尻で精液が爆発しとるは……,sound/data/pcm/c43/h/71.unity3d,h_so_43_02_126
125,43,44,ひゃぁぁぁぁぁあん！！,sound/data/pcm/c43/h/71.unity3d,h_so_43_02_127
126,43,44,んくぅぅぅぅ……っ！！,sound/data/pcm/c43/h/71.unity3d,h_so_43_02_128
127,43,44,きゃひぃぃぃぃぃ……っ！！,sound/data/pcm/c43/h/71.unity3d,h_so_43_02_129
128,43,44,はへぇぇぇぇぇぇ……っ,sound/data/pcm/c43/h/71.unity3d,h_so_43_02_130
129,43,44,はぁ、はぁ……自分もちゃんとイケたみたいで良かったわ,sound/data/pcm/c43/h/71.unity3d,h_so_43_02_131
130,43,44,めっちゃ出したっぽいなぁ……ゴムのバリア、鉄壁やわ,sound/data/pcm/c43/h/71.unity3d,h_so_43_02_132
131,43,44,あぁ、なんやろ？　一緒にイクと、余計気持ちええなぁ,sound/data/pcm/c43/h/71.unity3d,h_so_43_02_133
132,43,44,自分の体温が、流れ込んでくる……身体が一つになってくみたいや,sound/data/pcm/c43/h/71.unity3d,h_so_43_02_134
133,43,44,精液、気持ちええけど……危険日やしなぁ……まあ、細かいことはええかぁ,sound/data/pcm/c43/h/71.unity3d,h_so_43_02_135
134,43,44,なんやろ？　本能かなぁ……中に出されて嬉しい……子供、出来てもエエんかも,sound/data/pcm/c43/h/71.unity3d,h_so_43_02_136
135,43,44,ガチンコでイカされたやん……ちんちん、気持ちよすぎやっちゅーねん,sound/data/pcm/c43/h/71.unity3d,h_so_43_02_137
136,43,44,ウチだけイッてもうたん、なんか悔しいわぁ……ウチ、もうちょっと我慢せなあかんなぁ,sound/data/pcm/c43/h/71.unity3d,h_so_43_02_138
137,43,44,お尻で一緒にイクと、変態感爆上がりにならへん？　ウチ、考え過ぎ……？,sound/data/pcm/c43/h/71.unity3d,h_so_43_02_139
138,43,44,なんかもう、お尻でイカんと気ぃ済まんようになったなぁ……お互いに……,sound/data/pcm/c43/h/71.unity3d,h_so_43_02_140
139,43,44,ああ……お尻やと全然アカン……イキ具合、ヤバいねん,sound/data/pcm/c43/h/71.unity3d,h_so_43_02_141
140,43,44,うわ、震えとる……呼吸するだけで、穴がビクンビクンしよる……,sound/data/pcm/c43/h/71.unity3d,h_so_43_02_142
141,43,44,はぁ、はぁ……なかよぉーイケたなぁ……ウチらの相性バッチやん,sound/data/pcm/c43/h/71.unity3d,h_so_43_02_143
142,43,44,ウチはゴム付きでもあんま変わらへんねんけど……自分的にはどないなんやろ,sound/data/pcm/c43/h/71.unity3d,h_so_43_02_144
143,43,44,はぁ、なんか生ですると、悪いことしてる気ぃする……それが余計にエエねん,sound/data/pcm/c43/h/71.unity3d,h_so_43_02_145
144,43,44,ふぅ、コンマ単位で同時にイッたな……もう寸分の狂いもなかったわ……ウソやけど,sound/data/pcm/c43/h/71.unity3d,h_so_43_02_146
145,43,44,なあ、もし赤ちゃん出来とったら……どうする？　名前、どっちが決める？,sound/data/pcm/c43/h/71.unity3d,h_so_43_02_147
146,43,44,危険日ってよぉ言うけどさぁ……どうせなら大当たり日に変えたらええのに,sound/data/pcm/c43/h/71.unity3d,h_so_43_02_148
147,43,44,あはあ、気持ちよかった～～……自分のちんちん、ずーっとはめっぱなしにしときたいわ,sound/data/pcm/c43/h/71.unity3d,h_so_43_02_149
148,43,44,こんな気持ちええこと、他にあるんかなぁ……あー、たまらん……,sound/data/pcm/c43/h/71.unity3d,h_so_43_02_150
149,43,44,自分の所為で、すっかり尻穴で感じる様になってしもうたなぁ……,sound/data/pcm/c43/h/71.unity3d,h_so_43_02_151
150,43,44,お尻の穴で同時にイクと、なんか行き着く所まで行き着いた感、ある気せぇへん？,sound/data/pcm/c43/h/71.unity3d,h_so_43_02_152
151,43,44,アカン、息上がっとる……お尻、気持ちええから、イキすぎんねん……,sound/data/pcm/c43/h/71.unity3d,h_so_43_02_153
152,43,44,ちんちんが、お尻、ぴったりなんかなぁ？　アソコでするより、ええ気ぃすんねん,sound/data/pcm/c43/h/71.unity3d,h_so_43_02_154
153,43,44,ゴムって、中で存在感発揮しよるよな……なんかくっついてくる感じがする,sound/data/pcm/c43/h/71.unity3d,h_so_43_02_155
154,43,44,なあ、ゴムがプックーってなっとるで……ほんま、出しすぎちゃう？,sound/data/pcm/c43/h/71.unity3d,h_so_43_02_156
155,43,44,あー……隙間の隅々にまで精液が染み込んどる……めっちゃ出したなぁ,sound/data/pcm/c43/h/71.unity3d,h_so_43_02_157
156,43,44,生でするん、好きなんやね……まだカチカチのままやで？,sound/data/pcm/c43/h/71.unity3d,h_so_43_02_158
157,43,44,あー……子宮が重い……。今頃着床が始まっとるかもしらんね,sound/data/pcm/c43/h/71.unity3d,h_so_43_02_159
158,43,44,危険を省みず、こないに出すねんもんなぁ……自分ほんまヤバいヤツや思うわ～,sound/data/pcm/c43/h/71.unity3d,h_so_43_02_160
159,43,44,よっしゃ、この調子でゴム使い切ってしまうか。……って、流石に体力がもたんな,sound/data/pcm/c43/h/71.unity3d,h_so_43_02_161
160,43,44,うわぁ、まだカチカチやな……一緒にイクと、気持ちいいの、ずーっと続くんかなぁ？,sound/data/pcm/c43/h/71.unity3d,h_so_43_02_162
161,43,44,アカンわぁ……なんか、こう、もっと気持ちええの欲しい……一緒にイッたせいかも……,sound/data/pcm/c43/h/71.unity3d,h_so_43_02_163
162,43,44,ふぅ……このまま終わる？　いやー、でもそれはもったいないわぁ……,sound/data/pcm/c43/h/71.unity3d,h_so_43_02_164
163,43,44,……なんか今、ウチがオカンになったような気持ちになってんけど、気の所為かなぁ,sound/data/pcm/c43/h/71.unity3d,h_so_43_02_165
164,43,44,パパ、おとん、ダディ……うーん、自分のこと、どない呼ぼかなぁ,sound/data/pcm/c43/h/71.unity3d,h_so_43_02_166
165,43,44,次は簡単にイカされんよう気張るでぇ,sound/data/pcm/c43/h/71.unity3d,h_so_43_02_167
166,43,44,ふぅ……次は一緒にイキたいな……リベンジさせてくれへん？,sound/data/pcm/c43/h/71.unity3d,h_so_43_02_168
167,43,44,あー、お尻の穴、ヒクヒクしとるわぁ。用途が違うて、抗議してんのちゃうか？,sound/data/pcm/c43/h/71.unity3d,h_so_43_02_169
168,43,44,なんか、お尻がまだ熱～いねんけど……よかったら、この火照り、抑えてくれへん？,sound/data/pcm/c43/h/71.unity3d,h_so_43_02_170
169,43,44,続きする？　お尻で……いや、まあ、ウチはどっちでもええねんけどね,sound/data/pcm/c43/h/71.unity3d,h_so_43_02_171
170,43,44,うわぁ、めっちゃ飛び散ってる……,sound/data/pcm/c43/h/71.unity3d,h_so_43_02_172
171,43,44,こんなにたっぷり……溜めすぎちゃう？,sound/data/pcm/c43/h/71.unity3d,h_so_43_02_173
172,43,44,えらい有様になっとるわぁ……自分、頑張ったもんなぁ,sound/data/pcm/c43/h/71.unity3d,h_so_43_02_174
173,43,44,はぁ、どこもかしこもドロドロやわぁ……匂いもエグい……,sound/data/pcm/c43/h/71.unity3d,h_so_43_02_175
174,43,44,くんくん、この匂い……ああ、なんかムラムラしてきてまうわ,sound/data/pcm/c43/h/71.unity3d,h_so_43_02_176
175,43,44,うわぁ……中からドロッと溢れてくるわ……,sound/data/pcm/c43/h/71.unity3d,h_so_43_02_177
176,43,44,ちょぉ、零れるほど出してたん？　自分、流石やわ～……,sound/data/pcm/c43/h/71.unity3d,h_so_43_02_178
