管理番号,大きい項目,中間項目,表示名,バンドルパス,ファイル名
0,18,44,おちんちんが、私を求めてくれてます……,sound/data/pcm/c18/h/01.unity3d,h_so_18_02_000
1,18,44,今日もあなたのしたいように、してください,sound/data/pcm/c18/h/01.unity3d,h_so_18_02_001
2,18,44,あなたがしてくれることなら、なんでも幸せです,sound/data/pcm/c18/h/01.unity3d,h_so_18_02_002
3,18,44,気持ちよく、してあげたいです,sound/data/pcm/c18/h/01.unity3d,h_so_18_02_003
4,18,44,一緒に、幸せになりましょう？,sound/data/pcm/c18/h/01.unity3d,h_so_18_02_004
5,18,44,今日も、愛してくださいね？,sound/data/pcm/c18/h/01.unity3d,h_so_18_02_005
6,18,44,ゴムはちゃんとつけましょう。エッチできなくなるの、嫌ですし……,sound/data/pcm/c18/h/01.unity3d,h_so_18_02_006
7,18,44,愛してるからこそ、ちゃんとゴムはつけましょう……ね？,sound/data/pcm/c18/h/01.unity3d,h_so_18_02_007
8,18,44,そうですよね……私だって本当は生でしたいですけど、今日はダメな日なんです……,sound/data/pcm/c18/h/01.unity3d,h_so_18_02_008
9,18,44,生では……また改めて、安全な日に……思いっきりさせてあげますからね,sound/data/pcm/c18/h/01.unity3d,h_so_18_02_009
10,18,44,は、はい……どうぞ！　あなただけのための、お尻ですよ……,sound/data/pcm/c18/h/01.unity3d,h_so_18_02_010
11,18,44,私も、やってるうちにだんだんお尻……好きになってきちゃいました,sound/data/pcm/c18/h/01.unity3d,h_so_18_02_011
12,18,44,今日は……普通にいれてもらうんじゃ、ダメ……ですかね……？,sound/data/pcm/c18/h/01.unity3d,h_so_18_02_012
13,18,44,今日は、その……なんというか……と、とにかく無理です！,sound/data/pcm/c18/h/01.unity3d,h_so_18_02_013
14,18,44,ふぁあっ……お、おちんちんが、中にぃっ……！,sound/data/pcm/c18/h/01.unity3d,h_so_18_02_014
15,18,44,あんっ……おちんちん……あ、あっついぃっ……！,sound/data/pcm/c18/h/01.unity3d,h_so_18_02_015
16,18,44,私……おしりにいれられて喜んじゃって……すごいヘンタイさんになっちゃったみたいです……,sound/data/pcm/c18/h/01.unity3d,h_so_18_02_016
17,18,44,お尻っ……！　あ、熱くて気持ち……いいですっ……！　んんんぅうっ……！,sound/data/pcm/c18/h/01.unity3d,h_so_18_02_017
18,18,44,あ……ああぁぁっ……わ、私の中……おちんちんで、いっぱいですぅっ……,sound/data/pcm/c18/h/01.unity3d,h_so_18_02_018
19,18,44,ふあぁっ……！　ぜ、全部入ってきてるのが……つ、伝わってきてますぅ……！,sound/data/pcm/c18/h/01.unity3d,h_so_18_02_019
20,18,44,ふ、ふふ……お、おちんちん……私のおまんこで包み込んじゃいました……,sound/data/pcm/c18/h/01.unity3d,h_so_18_02_020
21,18,44,思いっきり……いれられちゃいました……これから、どうされちゃうんでしょう……,sound/data/pcm/c18/h/01.unity3d,h_so_18_02_021
22,18,44,入っちゃいましたね……ゆ、ゆっくりなら動いても……いいですよ……？,sound/data/pcm/c18/h/01.unity3d,h_so_18_02_022
23,18,44,ふぐぁ……お、お尻っ……好きですぅ……,sound/data/pcm/c18/h/01.unity3d,h_so_18_02_023
24,18,44,んっ、お尻……どうですか？,sound/data/pcm/c18/h/01.unity3d,h_so_18_02_024
25,18,44,おしり……いくら慣れてたって、ちょっとはこわいんですよ……？,sound/data/pcm/c18/h/01.unity3d,h_so_18_02_025
26,18,44,ちょっとびっくりしましたけど……おしり……ちょっと気持ちよかった……,sound/data/pcm/c18/h/01.unity3d,h_so_18_02_026
27,18,44,あの……もっと……私を求めてくれると……うれしいんですけど……,sound/data/pcm/c18/h/01.unity3d,h_so_18_02_027
28,18,44,おちんちん……す、すっごく……あついです……ん、んうっ……！,sound/data/pcm/c18/h/01.unity3d,h_so_18_02_028
29,18,44,つながってるだけで……私の穴……ひ、ひろがっちゃってます……！,sound/data/pcm/c18/h/01.unity3d,h_so_18_02_029
30,18,44,最初は違和感だけだったのに。今は……気持ちいいです,sound/data/pcm/c18/h/01.unity3d,h_so_18_02_030
31,18,44,あなたのおちんちん締め付けちゃってるの……わかりますか？,sound/data/pcm/c18/h/01.unity3d,h_so_18_02_031
32,18,44,んっ……すごく敏感になっちゃってますっ……,sound/data/pcm/c18/h/01.unity3d,h_so_18_02_032
33,18,44,んっ……抜ける感覚、好きなんです,sound/data/pcm/c18/h/01.unity3d,h_so_18_02_033
34,18,44,次は、どんなことしてくれるんですか？,sound/data/pcm/c18/h/01.unity3d,h_so_18_02_034
35,18,44,焦らされると……おまんこ疼いちゃいます……,sound/data/pcm/c18/h/01.unity3d,h_so_18_02_035
36,18,44,お尻がヒクヒクしちゃってます,sound/data/pcm/c18/h/01.unity3d,h_so_18_02_036
37,18,44,これ……排泄みたいで……ちょっと気持ちいい……,sound/data/pcm/c18/h/01.unity3d,h_so_18_02_037
38,18,44,抜かれる瞬間……ちょっとドキドキします,sound/data/pcm/c18/h/01.unity3d,h_so_18_02_038
39,18,44,んああっ……　ゆっくりされるの……愛されてる感じがしてっ……,sound/data/pcm/c18/h/01.unity3d,h_so_18_02_039
40,18,44,ああっ……優しく突かれてっ……おまんこいいですっ……,sound/data/pcm/c18/h/01.unity3d,h_so_18_02_040
41,18,44,ゆっくりだと……おちんちんの形わかっちゃうっ……,sound/data/pcm/c18/h/01.unity3d,h_so_18_02_041
42,18,44,あっ……　速いの、いいっ…気持ちいいですっ……,sound/data/pcm/c18/h/01.unity3d,h_so_18_02_042
43,18,44,あんっ、激しいのっ……　愛されてるの、感じますっ,sound/data/pcm/c18/h/01.unity3d,h_so_18_02_043
44,18,44,んっ……あんっ……思うままに、ついてくださいね……,sound/data/pcm/c18/h/01.unity3d,h_so_18_02_044
45,18,44,んあっ……お尻、あなたの形になっちゃうぅ,sound/data/pcm/c18/h/01.unity3d,h_so_18_02_045
46,18,44,お尻優しくされるのっいいですっ……,sound/data/pcm/c18/h/01.unity3d,h_so_18_02_046
47,18,44,お尻っ好きになっちゃいそうです……あんっ……,sound/data/pcm/c18/h/01.unity3d,h_so_18_02_047
48,18,44,おぉぉっ……　お尻っ……　犯されちゃってますっ……,sound/data/pcm/c18/h/01.unity3d,h_so_18_02_048
49,18,44,激しいのっ……んぉおおっ……動物みたいっ……良いっ……,sound/data/pcm/c18/h/01.unity3d,h_so_18_02_049
50,18,44,んああぁあっ　お尻っ……すっごく突かれてるっ……,sound/data/pcm/c18/h/01.unity3d,h_so_18_02_050
51,18,44,一緒に触られると……んいっ……エッチな気分になっちゃいますっ……,sound/data/pcm/c18/h/01.unity3d,h_so_18_02_051
52,18,44,いっぱい触って……んっ……愛してくださいっ……,sound/data/pcm/c18/h/01.unity3d,h_so_18_02_052
53,18,44,一緒ダメえぇっ……頭変になっちゃいますっ……,sound/data/pcm/c18/h/01.unity3d,h_so_18_02_053
54,18,44,突かれながら触られるのっ……全身気持ちいいですっ,sound/data/pcm/c18/h/01.unity3d,h_so_18_02_054
55,18,44,そこはあんまりっ……ダメですっ……,sound/data/pcm/c18/h/01.unity3d,h_so_18_02_055
56,18,44,そこ触られるのはっ……苦手なのにっ……,sound/data/pcm/c18/h/01.unity3d,h_so_18_02_056
57,18,44,ひゃっ……そこさわっちゃっ……あんっ,sound/data/pcm/c18/h/01.unity3d,h_so_18_02_057
58,18,44,んっ……そこより、もっと……別の所をんぅっ,sound/data/pcm/c18/h/01.unity3d,h_so_18_02_058
59,18,44,ずんっ、ずん、って……ゆっくりなのに、良いっ,sound/data/pcm/c18/h/01.unity3d,h_so_18_02_059
60,18,44,ピストン、ゆっくりでっ……形変えられちゃいますっ……,sound/data/pcm/c18/h/01.unity3d,h_so_18_02_060
61,18,44,あぁぁぁっ……　突かれるの、すきぃっ……　おちんちんっ……,sound/data/pcm/c18/h/01.unity3d,h_so_18_02_061
62,18,44,あなたの思うようにっ……おちんちん動かしてっ……,sound/data/pcm/c18/h/01.unity3d,h_so_18_02_062
63,18,44,深くつながって……んっ、もっと、幸せになりましょうっ……,sound/data/pcm/c18/h/01.unity3d,h_so_18_02_063
64,18,44,ああぁぁっ……　深いところっ、突かれてますぅっ……,sound/data/pcm/c18/h/01.unity3d,h_so_18_02_064
65,18,44,おちんちんが、ずん、ってお尻に入って……あぁんっ,sound/data/pcm/c18/h/01.unity3d,h_so_18_02_065
66,18,44,お、お尻っ、ヒクヒクしちゃってっ……　変になっちゃますっ……,sound/data/pcm/c18/h/01.unity3d,h_so_18_02_066
67,18,44,ん、あっ、お尻なのに、ここまでよくなっちゃうなんて……,sound/data/pcm/c18/h/01.unity3d,h_so_18_02_067
68,18,44,あっあっああぅっ、お尻なのに、すごくよくなっちゃってますっ,sound/data/pcm/c18/h/01.unity3d,h_so_18_02_068
69,18,44,お尻で感じちゃうはしたない女でもっ……いいですかっ？,sound/data/pcm/c18/h/01.unity3d,h_so_18_02_069
70,18,44,んぉっ……お尻っ馴染んできてっ、癖になっちゃいそうですっ……,sound/data/pcm/c18/h/01.unity3d,h_so_18_02_070
71,18,44,触られながらだとっ、余計に、んっ興奮しますっ……,sound/data/pcm/c18/h/01.unity3d,h_so_18_02_071
72,18,44,ああんっ、そこ触られるのっ、好きなんですっ……,sound/data/pcm/c18/h/01.unity3d,h_so_18_02_072
73,18,44,んぁあっっ……　おちんちんはげしいのにっ……　触られるのもよくてっ……,sound/data/pcm/c18/h/01.unity3d,h_so_18_02_073
74,18,44,ああぁあっ……　私、全身変になっちゃいましゅうっ……,sound/data/pcm/c18/h/01.unity3d,h_so_18_02_074
75,18,44,んぁぁっ、そこよりっ、おちんちんがいいですっ,sound/data/pcm/c18/h/01.unity3d,h_so_18_02_075
76,18,44,そこっ、やっぱり、ダメですっ……,sound/data/pcm/c18/h/01.unity3d,h_so_18_02_076
77,18,44,あんまり好きじゃないですけどっ、あなたのためならっ……,sound/data/pcm/c18/h/01.unity3d,h_so_18_02_077
78,18,44,触ってもいいですけどっ、そのかわり、おちんちんっ、弱めないでくださいねっ……あんっ,sound/data/pcm/c18/h/01.unity3d,h_so_18_02_078
79,18,44,んっ、ちゅるっ、ちゅぅ……キスもえっちも、幸せです……,sound/data/pcm/c18/h/01.unity3d,h_so_18_02_079
80,18,44,ちゅるっ、ちゅうっ……んっ、おちんちんでしてもらってるので、私からはキス、あげます,sound/data/pcm/c18/h/01.unity3d,h_so_18_02_080
81,18,44,んちゅるっ、ちゅうっ、キスもっ、おちんちんもっ激しいっ……,sound/data/pcm/c18/h/01.unity3d,h_so_18_02_081
82,18,44,んちゅうっ、れるれるっ、口も、下も、繋がってますっ,sound/data/pcm/c18/h/01.unity3d,h_so_18_02_082
83,18,44,んっ、ちゅるるる、んっ、キス、あなたも好きなんですね……だっておちんちん、中で大きくなってます……,sound/data/pcm/c18/h/01.unity3d,h_so_18_02_083
84,18,44,ちゅるるる、んっ、んっ、キスされて、突かれて、ふわふわしちゃいますぅ……,sound/data/pcm/c18/h/01.unity3d,h_so_18_02_084
85,18,44,キスも、おちんちんも、激しすぎますっ……　じゅるるっじゅぅつちゅっ……,sound/data/pcm/c18/h/01.unity3d,h_so_18_02_085
86,18,44,激しいピストンされながらっ、優しくキスされるとっ……良すぎますっ,sound/data/pcm/c18/h/01.unity3d,h_so_18_02_086
87,18,44,んっ、あっ、身体が、熱くなっちゃいましたっ……,sound/data/pcm/c18/h/01.unity3d,h_so_18_02_087
88,18,44,あなたに抱かれると、気持ちよくて、頭ふわふわしちゃいますっ……,sound/data/pcm/c18/h/01.unity3d,h_so_18_02_088
89,18,44,あっ、んっ、あっ……一緒に、いっしょにイキましょう？,sound/data/pcm/c18/h/01.unity3d,h_so_18_02_089
90,18,44,んっ、ひうっ、頭、とろけて、もう、ダメ……,sound/data/pcm/c18/h/01.unity3d,h_so_18_02_090
91,18,44,あんっ、あなたの顔、気持ちよさそう……嬉しいな……,sound/data/pcm/c18/h/01.unity3d,h_so_18_02_091
92,18,44,もうイキそうですか……？　私も、気持ちいいですっ,sound/data/pcm/c18/h/01.unity3d,h_so_18_02_092
93,18,44,あっ、どんどん……んっ、早くなって、私もっ……,sound/data/pcm/c18/h/01.unity3d,h_so_18_02_093
94,18,44,必死に腰ふって、んっ、私、愛されてますっ……私も、愛してますっ,sound/data/pcm/c18/h/01.unity3d,h_so_18_02_094
95,18,44,お尻いいですっ、いっぱい気持ちよく、なっちゃうっ……,sound/data/pcm/c18/h/01.unity3d,h_so_18_02_095
96,18,44,お尻におちんちん擦れてっ、エッチになっちゃいますっ……,sound/data/pcm/c18/h/01.unity3d,h_so_18_02_096
97,18,44,んぁぁああっ、激しくてっ、お尻広がっちゃってますぅぅっ、いいのぉっ,sound/data/pcm/c18/h/01.unity3d,h_so_18_02_097
98,18,44,んっ、んっ、あっ、きちゃいますぅぅ、お尻できちゃいそうですぅぅ,sound/data/pcm/c18/h/01.unity3d,h_so_18_02_098
99,18,44,おしりで、イキそうなんですね……いっぱい出してくださいねっ,sound/data/pcm/c18/h/01.unity3d,h_so_18_02_099
100,18,44,んっ……　出ちゃいそうなんですねっ、お尻で、搾り取っちゃいますっ,sound/data/pcm/c18/h/01.unity3d,h_so_18_02_100
101,18,44,お尻っ、慣れましたからっ好きなだけ動いて……いっぱい出してくださいねっ,sound/data/pcm/c18/h/01.unity3d,h_so_18_02_101
102,18,44,ああんっ　そうですっ……お尻の穴っいっぱい擦って……気持ちよくなってくださいっ,sound/data/pcm/c18/h/01.unity3d,h_so_18_02_102
103,18,44,い、いっちゃいますっ、気持ちよく、されちゃってますっ,sound/data/pcm/c18/h/01.unity3d,h_so_18_02_103
104,18,44,あ、あ、あっ、突かれて、私、もう、さきに、んんんぅっ,sound/data/pcm/c18/h/01.unity3d,h_so_18_02_104
105,18,44,きちゃいますっ、あなたとっ、おちんちんとおまんこ両方いっちゃいますっ,sound/data/pcm/c18/h/01.unity3d,h_so_18_02_105
106,18,44,あアアッ、気持ちいいですっ、いっしょに、いっしょにきもちよくなりましょうっ,sound/data/pcm/c18/h/01.unity3d,h_so_18_02_106
107,18,44,わたしのなかにっ、熱い欲望っ全部くださいっ……,sound/data/pcm/c18/h/01.unity3d,h_so_18_02_107
108,18,44,いいですよっ……　私、あなたの全部っ受け止めますからっ……,sound/data/pcm/c18/h/01.unity3d,h_so_18_02_108
109,18,44,は、はいっ、じゃあ、わたしに、いっぱいかけてくださいっ,sound/data/pcm/c18/h/01.unity3d,h_so_18_02_109
110,18,44,抜かれちゃうのっ、ちょっと寂しいのでっ、私にかけてくださいっ,sound/data/pcm/c18/h/01.unity3d,h_so_18_02_110
111,18,44,んぁんぁあっ、おちんちん、はげしくなってっ、射精の準備、してるんですねっ,sound/data/pcm/c18/h/01.unity3d,h_so_18_02_111
112,18,44,ぁぁああぁっ、必死に腰振っちゃってますっ、外でも中でもっ、お好きな方にっ……,sound/data/pcm/c18/h/01.unity3d,h_so_18_02_112
113,18,44,ゴム越しでもっ、中出しには代わりありませんからねっ？　いっぱい出してっ,sound/data/pcm/c18/h/01.unity3d,h_so_18_02_113
114,18,44,つけてるから、どれだけ出しても、良いんですよ？　……いっぱいくださいね,sound/data/pcm/c18/h/01.unity3d,h_so_18_02_114
115,18,44,んはぁっ、もうっ、お尻でイクの、癖になっちゃってますぅっ,sound/data/pcm/c18/h/01.unity3d,h_so_18_02_115
116,18,44,んごぉ……　ごめんなさいっお尻でっ、イッちゃうように開発されちゃいましたっ……,sound/data/pcm/c18/h/01.unity3d,h_so_18_02_116
117,18,44,んあぁあっ……　一緒に、お尻でセックスしてイッちゃうような、変態になりましょうっ,sound/data/pcm/c18/h/01.unity3d,h_so_18_02_117
118,18,44,あなたといっしょにっ、変態でも、一緒なら、いいですっ,sound/data/pcm/c18/h/01.unity3d,h_so_18_02_118
119,18,44,出してくださいっ　お尻なら、妊娠しませんからっ,sound/data/pcm/c18/h/01.unity3d,h_so_18_02_119
120,18,44,あなたの思うままにっ、んっ……お尻にくださいっ,sound/data/pcm/c18/h/01.unity3d,h_so_18_02_120
121,18,44,あぁっ……精液、たくさん、もらっちゃいました……,sound/data/pcm/c18/h/01.unity3d,h_so_18_02_121
122,18,44,んんっ……精液、いっぱぁい……だんだん相性、よくなってきたんでしょうか,sound/data/pcm/c18/h/01.unity3d,h_so_18_02_122
123,18,44,あっ、コンドームの中で、ぱしゃぱしゃって、精液弾んでます……,sound/data/pcm/c18/h/01.unity3d,h_so_18_02_123
124,18,44,ゴム越しでも、精液熱くて、んっ……心地いい……,sound/data/pcm/c18/h/01.unity3d,h_so_18_02_124
125,18,44,あぁっ、出てるっ、大好きな精液、お尻にでちゃってますっ……,sound/data/pcm/c18/h/01.unity3d,h_so_18_02_125
126,18,44,ああぁっ……　いっぱい出てます……私のお尻、いっぱい愛されちゃいました,sound/data/pcm/c18/h/01.unity3d,h_so_18_02_126
127,18,44,イッっちゃいますぅぅう！,sound/data/pcm/c18/h/01.unity3d,h_so_18_02_127
128,18,44,きちゃ、きちゃいますぅぅう！,sound/data/pcm/c18/h/01.unity3d,h_so_18_02_128
129,18,44,来ちゃう来ちゃう来ちゃうううううう！,sound/data/pcm/c18/h/01.unity3d,h_so_18_02_129
130,18,44,ダメッイクッ！　イッちゃううううう！,sound/data/pcm/c18/h/01.unity3d,h_so_18_02_130
131,18,44,一緒に、イッちゃいましたね。愛のなせる技……なんて,sound/data/pcm/c18/h/01.unity3d,h_so_18_02_131
132,18,44,一緒にイクの、やっぱり幸せ……でも、今度は、ゴムなしで、ね？,sound/data/pcm/c18/h/01.unity3d,h_so_18_02_132
133,18,44,今日は、とっても幸せでした……愛してます,sound/data/pcm/c18/h/01.unity3d,h_so_18_02_133
134,18,44,一緒にイクと、安心するんです。愛されてるんだって,sound/data/pcm/c18/h/01.unity3d,h_so_18_02_134
135,18,44,んっ……精液……たれてきてます……,sound/data/pcm/c18/h/01.unity3d,h_so_18_02_135
136,18,44,危険日えっち、どきどきして、好きなんです……,sound/data/pcm/c18/h/01.unity3d,h_so_18_02_136
137,18,44,もっと愛してあげたいのに、愛されてばっかりです……,sound/data/pcm/c18/h/01.unity3d,h_so_18_02_137
138,18,44,次は、もっといっぱい、気持ちよくしてあげますね？,sound/data/pcm/c18/h/01.unity3d,h_so_18_02_138
139,18,44,あなたといっしょにイケて……嬉しかったです……私、変態なのかも,sound/data/pcm/c18/h/01.unity3d,h_so_18_02_139
140,18,44,お尻……なれちゃって、今はもう、恥ずかしさより幸せになっちゃってます……,sound/data/pcm/c18/h/01.unity3d,h_so_18_02_140
141,18,44,また、私だけイかされちゃいました……私のお尻、気持ちよくないですか？,sound/data/pcm/c18/h/01.unity3d,h_so_18_02_141
142,18,44,次は、絶対あなたもお尻で気持ちよくしてみせますっ……,sound/data/pcm/c18/h/01.unity3d,h_so_18_02_142
143,18,44,ゴムがあるのにこんなに気持ちいいなら……ゴムなしだと、どうなっちゃうんでしょう,sound/data/pcm/c18/h/01.unity3d,h_so_18_02_143
144,18,44,激しすぎてっ、ゴム越しなのに、沢山擦れて……いっぱい感じちゃいました,sound/data/pcm/c18/h/01.unity3d,h_so_18_02_144
145,18,44,動物みたいに激しいセックス……しちゃいました,sound/data/pcm/c18/h/01.unity3d,h_so_18_02_145
146,18,44,身体も、心も、深く繋がった感じ……しました,sound/data/pcm/c18/h/01.unity3d,h_so_18_02_146
147,18,44,こんなに出されて……妊娠、しちゃってるかも,sound/data/pcm/c18/h/01.unity3d,h_so_18_02_147
148,18,44,危険なセックス……やっぱりゾクゾクしちゃいます,sound/data/pcm/c18/h/01.unity3d,h_so_18_02_148
149,18,44,私ばっかりイカされちゃったから……次は、私も……,sound/data/pcm/c18/h/01.unity3d,h_so_18_02_149
150,18,44,あなたにイかされて……愛してもらって……嬉しい……,sound/data/pcm/c18/h/01.unity3d,h_so_18_02_150
151,18,44,お尻、気持ちよすぎて……もう、昔に戻れません,sound/data/pcm/c18/h/01.unity3d,h_so_18_02_151
152,18,44,お尻、大好きになっちゃって……もう、あなたのところにしかお嫁にいけません,sound/data/pcm/c18/h/01.unity3d,h_so_18_02_152
153,18,44,あなたのせいで、完全に変態になっちゃいましたよぅ……,sound/data/pcm/c18/h/01.unity3d,h_so_18_02_153
154,18,44,また私だけ……つ、次は絶対……お尻で気持ちよくしてあげますから……,sound/data/pcm/c18/h/01.unity3d,h_so_18_02_154
155,18,44,ゴムに精液溜まってるの、なぜか愛しいんですよね……私だけ、でしょうか,sound/data/pcm/c18/h/01.unity3d,h_so_18_02_155
156,18,44,私の中、良かったですか？　こんなことが出来るのもゴムのおかげ……なんですよね,sound/data/pcm/c18/h/01.unity3d,h_so_18_02_156
157,18,44,今日は大丈夫な日ですから……いくらでもして、いいんですよ,sound/data/pcm/c18/h/01.unity3d,h_so_18_02_157
158,18,44,いっぱい精液もらっちゃった……ありがとうございます,sound/data/pcm/c18/h/01.unity3d,h_so_18_02_158
159,18,44,もし、できちゃっても、私は大丈夫です……,sound/data/pcm/c18/h/01.unity3d,h_so_18_02_159
160,18,44,いけない日なのに、しちゃうの……ゾクゾクしちゃいます,sound/data/pcm/c18/h/01.unity3d,h_so_18_02_160
161,18,44,気持ちいいけど……ゴムしないほうが……やっぱり……,sound/data/pcm/c18/h/01.unity3d,h_so_18_02_161
162,18,44,ゴム越しでも、いっぱいイケちゃいました,sound/data/pcm/c18/h/01.unity3d,h_so_18_02_162
163,18,44,今日は大丈夫な日だから……もっとしますか？,sound/data/pcm/c18/h/01.unity3d,h_so_18_02_163
164,18,44,生セックスのほうが、やっぱり盛り上がりますね……,sound/data/pcm/c18/h/01.unity3d,h_so_18_02_164
165,18,44,おなか、いっぱいですっ……ちょっとしたら、もっとお腹大きくなっちゃってるかもですけど,sound/data/pcm/c18/h/01.unity3d,h_so_18_02_165
166,18,44,生でするだけでも危ないのに……危険日セックスが癖になっちゃったら、子供なんてすぐできちゃいますね,sound/data/pcm/c18/h/01.unity3d,h_so_18_02_166
167,18,44,私、どんどんイキやすくなっちゃってる気がします,sound/data/pcm/c18/h/01.unity3d,h_so_18_02_167
168,18,44,イカされてばかりで、少し申し訳ないです……でも、次は頑張ります,sound/data/pcm/c18/h/01.unity3d,h_so_18_02_168
169,18,44,お尻でされるの、誰かに知られたらどうしましょう,sound/data/pcm/c18/h/01.unity3d,h_so_18_02_169
170,18,44,私のお尻、好きにできるのはあなただけ、なんですよ,sound/data/pcm/c18/h/01.unity3d,h_so_18_02_170
171,18,44,お尻でするのも、もう慣れてしまいました,sound/data/pcm/c18/h/01.unity3d,h_so_18_02_171
172,18,44,射精おちんちんのかっこいいところ見られるから、外出しも、意外と好きです,sound/data/pcm/c18/h/01.unity3d,h_so_18_02_172
173,18,44,おちんちん、ビクンビクンって……いつも私の中でこんな風に暴れてるんですね,sound/data/pcm/c18/h/01.unity3d,h_so_18_02_173
174,18,44,こんな勢いで、いつも私の中に入ってるんですね……,sound/data/pcm/c18/h/01.unity3d,h_so_18_02_174
175,18,44,びゅーっておちんちんから精液飛び出すの、なんかかわいいです,sound/data/pcm/c18/h/01.unity3d,h_so_18_02_175
176,18,44,おちんちんからびゅーってするのが、気持ちいいんですよね？　男の人の身体って不思議……,sound/data/pcm/c18/h/01.unity3d,h_so_18_02_176
177,18,44,んっ……おまんこから、とろとろって……,sound/data/pcm/c18/h/01.unity3d,h_so_18_02_177
178,18,44,精液……溢れるくらい注いでくれたんですね。嬉しい……,sound/data/pcm/c18/h/01.unity3d,h_so_18_02_178
179,18,44,お尻、こんなに垂れちゃうくらい広がっちゃいました……あなたのせいですよ？,sound/data/pcm/c18/h/01.unity3d,h_so_18_02_179
180,18,44,あっ……精液漏れて……ち、ちょっときもちいい……,sound/data/pcm/c18/h/01.unity3d,h_so_18_02_180
181,18,44,好きなだけ、していいですよ,sound/data/pcm/c18/h/01.unity3d,h_so_18_02_181
182,18,44,まだ、できますよね……？,sound/data/pcm/c18/h/01.unity3d,h_so_18_02_182
183,18,44,私で、好きなだけ、よくなって……,sound/data/pcm/c18/h/01.unity3d,h_so_18_02_183
184,18,44,なんどでも、受け止めますっ,sound/data/pcm/c18/h/01.unity3d,h_so_18_02_184
185,18,44,今日だけっ、今日はつけてくださぃぃ,sound/data/pcm/c18/h/01.unity3d,h_so_18_02_185
186,18,44,生はまた、今度ね,sound/data/pcm/c18/h/01.unity3d,h_so_18_02_186
187,18,44,あなたとは、安心して、繋がりたいから,sound/data/pcm/c18/h/01.unity3d,h_so_18_02_187
