管理番号,大きい項目,中間項目,表示名,バンドルパス,ファイル名
173,12,24,あっ、えっ、えっ……あっ……あ、あぁー、い、いっぱい出る……んだな……はは……,sound/data/pcm/c12/h/01.unity3d,h_so_12_00_173
174,12,24,うわぁ……これが精液……え、エッチだな……あ、当たり前か……あはは,sound/data/pcm/c12/h/01.unity3d,h_so_12_00_174
175,12,24,い、いっぱい出たな……おまえのずっとビクビクしてるけど……だ、大丈夫なのか？,sound/data/pcm/c12/h/01.unity3d,h_so_12_00_175
176,12,24,あぁ垂れてっ……うわぁこれ……やっ、見るなぁっ！,sound/data/pcm/c12/h/01.unity3d,h_so_12_00_177
177,12,24,あっ、やだっ、アソコ拡がったままになって……うぁ、出てきた……,sound/data/pcm/c12/h/01.unity3d,h_so_12_00_178
178,12,24,あっ、やばっ、た、垂れっ……やっ、だめっ、あっち向いてろぉ……,sound/data/pcm/c12/h/01.unity3d,h_so_12_00_179
179,12,24,うぁっ、お尻から出ちゃ……あっ、垂れて……うぅ、最悪だぁ……,sound/data/pcm/c12/h/01.unity3d,h_so_12_00_180
180,12,24,ん？　まだしたいのか？　いいぞ,sound/data/pcm/c12/h/01.unity3d,h_so_12_00_181
181,12,24,もっとしたいんだろ？　いいよ,sound/data/pcm/c12/h/01.unity3d,h_so_12_00_182
182,12,24,ん、来い,sound/data/pcm/c12/h/01.unity3d,h_so_12_00_183
183,12,24,それ言われると、ドキッとする,sound/data/pcm/c12/h/01.unity3d,h_so_12_00_184
184,12,24,やめっ、ゴムなしはだめだって,sound/data/pcm/c12/h/01.unity3d,h_so_12_00_185
185,12,24,こらっ、ゴム忘れてる,sound/data/pcm/c12/h/01.unity3d,h_so_12_00_186
186,12,24,だめだって、今日はやばい日なの,sound/data/pcm/c12/h/01.unity3d,h_so_12_00_187
187,12,24,危険日だから、そこだけはきちんとしよ、な？,sound/data/pcm/c12/h/01.unity3d,h_so_12_00_188
188,12,24,もう勝手にしろぉ……,sound/data/pcm/c12/h/01.unity3d,h_so_12_00_189
189,12,24,はぁ、お尻好き過ぎ……,sound/data/pcm/c12/h/01.unity3d,h_so_12_00_190
190,12,24,やだっ、まだお尻は痛いの,sound/data/pcm/c12/h/01.unity3d,h_so_12_00_191
191,12,24,うーん、お尻はもうちょっと慣れてからな,sound/data/pcm/c12/h/01.unity3d,h_so_12_00_192
192,12,24,はぁ、来てる……ちゃんと感じるよ,sound/data/pcm/c12/h/01.unity3d,h_so_12_00_193
193,12,24,入ってるのわかるよ、これ幸せかも……,sound/data/pcm/c12/h/01.unity3d,h_so_12_00_194
194,12,24,い、いきなりはやめろよぉっ,sound/data/pcm/c12/h/01.unity3d,h_so_12_00_195
195,12,24,心の準備ってものがあるって言っただろぉ……ばかっ,sound/data/pcm/c12/h/01.unity3d,h_so_12_00_196
196,12,24,あれだけ出したのに……まだ全然元気なんだな……,sound/data/pcm/c12/h/01.unity3d,h_so_12_00_197
197,12,24,うぅ、やっぱり慣れないな、異物感凄すぎ……,sound/data/pcm/c12/h/01.unity3d,h_so_12_00_198
198,12,24,嬉しそうな顔してぇ……そんなにお尻いいのか？,sound/data/pcm/c12/h/01.unity3d,h_so_12_00_199
199,12,24,うぁっ、ちょ、お尻やめっ……あぁっ,sound/data/pcm/c12/h/01.unity3d,h_so_12_00_200
200,12,24,だからいきなりお尻はやめろってぇ,sound/data/pcm/c12/h/01.unity3d,h_so_12_00_201
201,12,24,こ、この状態が一番恥ずかしんだよな……ぁはは,sound/data/pcm/c12/h/01.unity3d,h_so_12_00_202
202,12,24,気使ってくれてるのか？　ありがとな,sound/data/pcm/c12/h/01.unity3d,h_so_12_00_203
203,12,24,うぅ、焦らす位なら入れるなぁっ……,sound/data/pcm/c12/h/01.unity3d,h_so_12_00_204
204,12,24,き、キツイか？　ごめんな、慣れてなくて……,sound/data/pcm/c12/h/01.unity3d,h_so_12_00_205
205,12,24,うぅ、やっぱりお尻とか言うんだろ……,sound/data/pcm/c12/h/01.unity3d,h_so_12_00_206
206,12,24,あっ、ちょっと緩くなっちゃってたかな……,sound/data/pcm/c12/h/01.unity3d,h_so_12_00_207
207,12,24,んぁ、すぐ抜かれるとお尻キュッってなるぅ……,sound/data/pcm/c12/h/01.unity3d,h_so_12_00_208
208,12,24,あっ、うぅ、拡げるの大変だったのにぃ……,sound/data/pcm/c12/h/01.unity3d,h_so_12_00_209
209,12,24,ちょっとは、慣れてきたかな,sound/data/pcm/c12/h/01.unity3d,h_so_12_00_210
210,12,24,あっ、気持ちいい、かも,sound/data/pcm/c12/h/01.unity3d,h_so_12_00_211
211,12,24,いいよ、それくらい、丁度いい,sound/data/pcm/c12/h/01.unity3d,h_so_12_00_212
212,12,24,気持ちいい、気持ちいいよぉっ,sound/data/pcm/c12/h/01.unity3d,h_so_12_00_213
213,12,24,あっ、れ……ちょっと、気持ちいい？,sound/data/pcm/c12/h/01.unity3d,h_so_12_00_214
214,12,24,あ、なんかやばい、じわじわ来てるぅ,sound/data/pcm/c12/h/01.unity3d,h_so_12_00_215
215,12,24,あぁうそ、そんなに動かせるのかっ,sound/data/pcm/c12/h/01.unity3d,h_so_12_00_216
216,12,24,お尻熱い、お尻熱いぃっ,sound/data/pcm/c12/h/01.unity3d,h_so_12_00_217
217,12,24,も、わけわかんなくなってきた,sound/data/pcm/c12/h/01.unity3d,h_so_12_00_218
218,12,24,奥ごりってされると、意識飛びそうになるっ,sound/data/pcm/c12/h/01.unity3d,h_so_12_00_219
219,12,24,あぐっ、激し、奥そんなに押されたらぁ,sound/data/pcm/c12/h/01.unity3d,h_so_12_00_220
220,12,24,ちょっと、暴れ過ぎっ、こんなの続けられたら、あたし,sound/data/pcm/c12/h/01.unity3d,h_so_12_00_221
221,12,24,あぁなんで、お尻なのに、お尻なのにぃ,sound/data/pcm/c12/h/01.unity3d,h_so_12_00_222
222,12,24,どうしよ、これ癖になる、絶対癖になる,sound/data/pcm/c12/h/01.unity3d,h_so_12_00_223
223,12,24,お尻熱いってぇ、火傷しちゃうからぁっ,sound/data/pcm/c12/h/01.unity3d,h_so_12_00_224
224,12,24,やめっ、お尻でめちゃくちゃするなぁっ,sound/data/pcm/c12/h/01.unity3d,h_so_12_00_225
225,12,24,あぁ、あたし感じてる、ほんとに感じちゃってる,sound/data/pcm/c12/h/01.unity3d,h_so_12_00_226
226,12,24,はぁん、気持ちいいぃっ……って、あたしなんて声出して……,sound/data/pcm/c12/h/01.unity3d,h_so_12_00_227
227,12,24,これ以上気持ちよくなったらあたしぃっ,sound/data/pcm/c12/h/01.unity3d,h_so_12_00_228
228,12,24,おかしくなるぅ、あたしおかしくなるぅっ,sound/data/pcm/c12/h/01.unity3d,h_so_12_00_229
229,12,24,あっ、またイクんだな、ふふ、わかっちゃったぞ,sound/data/pcm/c12/h/01.unity3d,h_so_12_00_230
230,12,24,イッていいぞ、また射精したいんだろ？,sound/data/pcm/c12/h/01.unity3d,h_so_12_00_231
231,12,24,ちょっと苦しそうだけど、気持ちいいんだよな？,sound/data/pcm/c12/h/01.unity3d,h_so_12_00_232
232,12,24,あはっ、変な顔、必死過ぎてかわいっ,sound/data/pcm/c12/h/01.unity3d,h_so_12_00_233
233,12,24,おしりが……やばい……,sound/data/pcm/c12/h/01.unity3d,h_so_12_00_234
234,12,24,あ、あたし……お尻動かしちゃってる……,sound/data/pcm/c12/h/01.unity3d,h_so_12_00_235
235,12,24,あぁ、あたしのお尻がぁっ,sound/data/pcm/c12/h/01.unity3d,h_so_12_00_236
236,12,24,おしりいいっ、ぁ、ちがっ、んぃぃっ,sound/data/pcm/c12/h/01.unity3d,h_so_12_00_237
237,12,24,またお尻なのか、またお尻に出す気だなぁ,sound/data/pcm/c12/h/01.unity3d,h_so_12_00_238
238,12,24,あぁわかるぅ、出そうなのわかるようになってきたぁっ,sound/data/pcm/c12/h/01.unity3d,h_so_12_00_239
239,12,24,イ、イクのか？　頷くだけでもいいから、ちゃんと教えてくれよ？,sound/data/pcm/c12/h/01.unity3d,h_so_12_00_240
240,12,24,いいよ、イけ、お尻に出したいんだろ？　イッちゃえ,sound/data/pcm/c12/h/01.unity3d,h_so_12_00_241
241,12,24,もうなんも考えられなっ,sound/data/pcm/c12/h/01.unity3d,h_so_12_00_242
242,12,24,恥ずかしい声止まらないぃっ,sound/data/pcm/c12/h/01.unity3d,h_so_12_00_243
243,12,24,来てるから、あたしも来てるからぁっ,sound/data/pcm/c12/h/01.unity3d,h_so_12_00_244
244,12,24,イこ、一緒にイこ、一緒がいいぃ,sound/data/pcm/c12/h/01.unity3d,h_so_12_00_245
245,12,24,いいよ、いっぱい出せ、何回でも出せ,sound/data/pcm/c12/h/01.unity3d,h_so_12_00_246
246,12,24,うん、さっきより気持ちよくイケるように、あたし頑張るから,sound/data/pcm/c12/h/01.unity3d,h_so_12_00_247
247,12,24,外だな、わかった、いっぱいかけてくれっ,sound/data/pcm/c12/h/01.unity3d,h_so_12_00_248
248,12,24,また出ちゃうのか？　そんなに出して大丈夫なのか？,sound/data/pcm/c12/h/01.unity3d,h_so_12_00_249
249,12,24,出そうなんだよな？　無言は怖いからぁ,sound/data/pcm/c12/h/01.unity3d,h_so_12_00_250
250,12,24,うぁっ、激しっ、そんなっ、無理,sound/data/pcm/c12/h/01.unity3d,h_so_12_00_251
251,12,24,激しすぎっ、ゴムとれちゃうよっ,sound/data/pcm/c12/h/01.unity3d,h_so_12_00_252
252,12,24,あぁだめっ、ゴム千切れそう,sound/data/pcm/c12/h/01.unity3d,h_so_12_00_253
253,12,24,またお尻ビクビクしてきた、うそ、こんなの絶対うそぉっ,sound/data/pcm/c12/h/01.unity3d,h_so_12_00_254
254,12,24,あぁ、見るなぁ、お尻でイクとこなんて見るなぁっ,sound/data/pcm/c12/h/01.unity3d,h_so_12_00_255
255,12,24,うぅ、一緒だぞ、絶対一緒だぞっ,sound/data/pcm/c12/h/01.unity3d,h_so_12_00_256
256,12,24,お願いだからぁ、一緒にイってぇっ,sound/data/pcm/c12/h/01.unity3d,h_so_12_00_257
257,12,24,うぇ、そんな早く出せるのか？　しかもお尻でなんてぇ……,sound/data/pcm/c12/h/01.unity3d,h_so_12_00_258
258,12,24,ちょっ、待って、また？　うぅ、いいけどぉっ,sound/data/pcm/c12/h/01.unity3d,h_so_12_00_259
259,12,24,あぁ、また出てるぅ……ちょっと出し過ぎだぁっ,sound/data/pcm/c12/h/01.unity3d,h_so_12_00_260
260,12,24,うそ、さっきよりいっぱい、出てる気がするぅっ,sound/data/pcm/c12/h/01.unity3d,h_so_12_00_261
261,12,24,どんどんゴム膨らんでく、うぅ、大丈夫かなぁ？,sound/data/pcm/c12/h/01.unity3d,h_so_12_00_262
262,12,24,ゴムだからって、どんだけ出すんだよぉ,sound/data/pcm/c12/h/01.unity3d,h_so_12_00_263
263,12,24,お尻で出てるぅっ、なんでそんなに出るんだよぉ,sound/data/pcm/c12/h/01.unity3d,h_so_12_00_264
264,12,24,お尻の中熱いぃっ、おまえので火傷するぅっ,sound/data/pcm/c12/h/01.unity3d,h_so_12_00_265
265,12,24,んぃっ、あっ、はぁぁぁっ,sound/data/pcm/c12/h/01.unity3d,h_so_12_00_266
266,12,24,んぅぅあぁぁぁっ,sound/data/pcm/c12/h/01.unity3d,h_so_12_00_267
267,12,24,やぁぁっ、見るなぁぁっ,sound/data/pcm/c12/h/01.unity3d,h_so_12_00_268
268,12,24,いぃっ、んいぃぃぃぃっ,sound/data/pcm/c12/h/01.unity3d,h_so_12_00_269
269,12,24,あたしの体……良かったか？　今後のために感想聞きたいな,sound/data/pcm/c12/h/01.unity3d,h_so_12_00_271
270,12,24,何も言えないって……こんな感じなんだな……,sound/data/pcm/c12/h/01.unity3d,h_so_12_00_272
271,12,24,ちょっと前まではおまえとここまでしちゃうなんて想像してなかったよ,sound/data/pcm/c12/h/01.unity3d,h_so_12_00_273
272,12,24,どうしよ、どうしよ……あーもう考えるのやめたっ,sound/data/pcm/c12/h/01.unity3d,h_so_12_00_274
273,12,24,ぁはは、後悔はしてないけど……ちょっと不安はあるかな,sound/data/pcm/c12/h/01.unity3d,h_so_12_00_275
274,12,24,あたしだけイッちゃたのか？　うぅ、ごめん,sound/data/pcm/c12/h/01.unity3d,h_so_12_00_276
275,12,24,もう色々恥ずかし過ぎて……頭の中ぐちゃぐちゃ,sound/data/pcm/c12/h/01.unity3d,h_so_12_00_277
276,12,24,お尻で感じ合うって……うん、やっぱ変態だよ,sound/data/pcm/c12/h/01.unity3d,h_so_12_00_278
277,12,24,二人してお尻お尻って、こんなの誰にも言えないな……,sound/data/pcm/c12/h/01.unity3d,h_so_12_00_279
278,12,24,うぅ、お尻でイカされたぁ……屈辱だぁ……,sound/data/pcm/c12/h/01.unity3d,h_so_12_00_280
279,12,24,お尻でされて一人でイクって……もう最悪……,sound/data/pcm/c12/h/01.unity3d,h_so_12_00_281
280,12,24,ゴム付きでこんなに気持ちいいなんて……これを生でしたら……,sound/data/pcm/c12/h/01.unity3d,h_so_12_00_282
281,12,24,もう無理、もうあたしは動けないぞー,sound/data/pcm/c12/h/01.unity3d,h_so_12_00_283
282,12,24,やっぱり生のが……あたしも嬉しいかな,sound/data/pcm/c12/h/01.unity3d,h_so_12_00_284
283,12,24,はぁ、ほんとに溶けて混ざっちゃうんじゃないかと思った,sound/data/pcm/c12/h/01.unity3d,h_so_12_00_285
284,12,24,あ、あのさ……これからその……よろしくお願いします,sound/data/pcm/c12/h/01.unity3d,h_so_12_00_286
285,12,24,もうちょっと順番ってものが……むっ、ちゃんとこっち向け！,sound/data/pcm/c12/h/01.unity3d,h_so_12_00_287
286,12,24,んぅ、まだ体ビクビクしてる……ちょっとしばらく動けなそう,sound/data/pcm/c12/h/01.unity3d,h_so_12_00_288
287,12,24,セックスって、こんなになっちゃうんだな……,sound/data/pcm/c12/h/01.unity3d,h_so_12_00_289
288,12,24,な、なぁ……あたしのお尻、変になってない？,sound/data/pcm/c12/h/01.unity3d,h_so_12_00_290
289,12,24,あー、お尻バカになるぅ……,sound/data/pcm/c12/h/01.unity3d,h_so_12_00_291
290,12,24,あたしのお尻どうなっちゃうんだろ……うぅ、後が怖いぃぃ……,sound/data/pcm/c12/h/01.unity3d,h_so_12_00_292
291,12,24,あぁもぅ知らない、お尻気持ち良かったから、もっとして！,sound/data/pcm/c12/h/01.unity3d,h_so_12_00_293
292,12,24,ふふっ、またイったな？　そんなにあたしの中気持ちいのか？,sound/data/pcm/c12/h/01.unity3d,h_so_12_00_294
293,12,24,まだまだしたりないって顔……だよな？　ゴム交換してやるよ,sound/data/pcm/c12/h/01.unity3d,h_so_12_00_295
294,12,24,うわぁ……またすごい出したな……い、いいけどさ,sound/data/pcm/c12/h/01.unity3d,h_so_12_00_296
295,12,24,これだけいっぱい出してくれると、ちょっと自信付いてくるな,sound/data/pcm/c12/h/01.unity3d,h_so_12_00_297
296,12,24,まぁ、出しちゃったものはしょうがないか……,sound/data/pcm/c12/h/01.unity3d,h_so_12_00_298
297,12,24,危ない日だって言ってるのに、おまえは何回出すんだよ……もぅ,sound/data/pcm/c12/h/01.unity3d,h_so_12_00_299
298,12,24,これで次からもゴムありで大丈夫だな。なんだよ、不満そうな顔するなって,sound/data/pcm/c12/h/01.unity3d,h_so_12_00_300
299,12,24,なぁなぁ、ゴムに出した後ってどんな感じ？,sound/data/pcm/c12/h/01.unity3d,h_so_12_00_301
300,12,24,この時感じ好きかも……なんかゆっくり溶け合ってくみたいで,sound/data/pcm/c12/h/01.unity3d,h_so_12_00_302
301,12,24,あたしの中はどうだった？　感想くらいくれてもいいだろ？,sound/data/pcm/c12/h/01.unity3d,h_so_12_00_303
302,12,24,なんだかんだ言ったけど、気持ち良かったよ……ありがと,sound/data/pcm/c12/h/01.unity3d,h_so_12_00_304
303,12,24,色々不安にさせちゃってごめんな、慣れてないから、あたしも混乱しちゃって……,sound/data/pcm/c12/h/01.unity3d,h_so_12_00_305
304,12,24,あたしだけごめんな……も、もう一回しよ？　次は頑張るから,sound/data/pcm/c12/h/01.unity3d,h_so_12_00_306
305,12,24,うぅ、またあたしだけぇ……才能ないのかなぁ……,sound/data/pcm/c12/h/01.unity3d,h_so_12_00_307
306,12,24,このお尻野郎……お尻中だし野郎！,sound/data/pcm/c12/h/01.unity3d,h_so_12_00_308
307,12,24,もうっ、お尻ドロドロでなんかやだぁ……,sound/data/pcm/c12/h/01.unity3d,h_so_12_00_309
308,12,24,ひゃっ！　い、一回出したよな？　まだそんなに飛ぶのか？,sound/data/pcm/c12/h/01.unity3d,h_so_12_00_310
309,12,24,あんまりいっぱいかけられると……ドキドキしちゃうな……,sound/data/pcm/c12/h/01.unity3d,h_so_12_00_311
310,12,24,射精ってそんなに何回もできるものなんだな……,sound/data/pcm/c12/h/01.unity3d,h_so_12_00_312
311,12,24,このとろとろ垂れてるのも、まだ射精してるって事？,sound/data/pcm/c12/h/01.unity3d,h_so_12_00_313
312,12,24,あっ、やっ、アソコから垂れて……,sound/data/pcm/c12/h/01.unity3d,h_so_12_00_314
313,12,24,あぁ……お尻から精液漏らすとか……もぅ……,sound/data/pcm/c12/h/01.unity3d,h_so_12_00_315
