管理番号,大きい項目,中間項目,表示名,バンドルパス,ファイル名
0,29,43,私がたくさん気持ちよくして差し上げます,sound/data/pcm/c29/h/01.unity3d,h_fe_29_02_003
1,29,43,やめてしまって、本当によいのですか？,sound/data/pcm/c29/h/01.unity3d,h_fe_29_02_034
2,29,43,もう一度入れていいでしょうか,sound/data/pcm/c29/h/01.unity3d,h_fe_29_02_035
3,29,43,おまんこから、エッチな音が響いてますよ,sound/data/pcm/c29/h/01.unity3d,h_fe_29_02_039
4,29,43,ぐちゅぐちゅって、すごくエッチです,sound/data/pcm/c29/h/01.unity3d,h_fe_29_02_042
5,29,43,おちんちん、おまんこで何度も味わってしまってます,sound/data/pcm/c29/h/01.unity3d,h_fe_29_02_060
6,29,43,もっと強くすることも……できますよ？,sound/data/pcm/c29/h/01.unity3d,h_fe_29_02_061
7,29,43,ああぁ……おちんちん、感じてるのが伝わってきます,sound/data/pcm/c29/h/01.unity3d,h_fe_29_02_062
8,29,43,どうですか？　激しくされる感覚は,sound/data/pcm/c29/h/01.unity3d,h_fe_29_02_063
9,29,43,お口の方でも……ちゅ、ちゅぷっ……気持ちよくしますね……,sound/data/pcm/c29/h/01.unity3d,h_fe_29_02_085
10,29,43,ダメ、です……私だけ、イッちゃいます……っ,sound/data/pcm/c29/h/01.unity3d,h_fe_29_02_090
11,29,43,イきそうですか？　もう、イッちゃいそうなんですか？,sound/data/pcm/c29/h/01.unity3d,h_fe_29_02_094
12,29,43,ふふふっ。あなたの濃い精液、搾り取ってしまいました,sound/data/pcm/c29/h/01.unity3d,h_fe_29_02_147
13,29,43,あなたには敵いませんね。私だけイッてしまいました,sound/data/pcm/c29/h/01.unity3d,h_fe_29_02_150
14,29,43,ゴムを忘れてはいけませんよ,sound/data/pcm/c29/h/01.unity3d,h_fe_29_02_185
15,29,43,危険日ですから、ゴムをちゃんと付けましょう,sound/data/pcm/c29/h/01.unity3d,h_fe_29_02_187
16,29,43,あなたはそのまま、じっとしていてくださいね,sound/data/pcm/c29/h/01.unity3d,h_fe_29_02_210
17,29,43,まだ我慢ですよ。私がするのですから,sound/data/pcm/c29/h/01.unity3d,h_fe_29_02_212
18,29,43,おちんちんの鼓動、何度も何度も伝わってきます……っ,sound/data/pcm/c29/h/01.unity3d,h_fe_29_02_218
