管理番号,大きい項目,中間項目,表示名,バンドルパス,ファイル名
144,16,54,はぁっ、凄かった……オチンポ、まだ全然萎えないのね……んっ、ゴム取り替えて……もう一回する？,sound/data/pcm/c16/h/01.unity3d,h_so_16_03_144
145,16,54,んふっ、お腹たぽたぽよ……アナタの精子……ちゃんと全部入ってるわ……ふふっ,sound/data/pcm/c16/h/01.unity3d,h_so_16_03_145
146,16,54,はぁ、やり切ったって感じね……ん？　あら……アナタのオチンポは、まだしたいって言ってるみたいね,sound/data/pcm/c16/h/01.unity3d,h_so_16_03_146
147,16,54,お母さんになるっていうのも……悪くないかもね……色々大変そうだけど……今、凄く落ち着いてるの……,sound/data/pcm/c16/h/01.unity3d,h_so_16_03_147
148,16,54,あーあ、結局中出ししちゃって……アブナイセックスは堪能できた？　こうなったら、もう何回でもしていいわよ,sound/data/pcm/c16/h/01.unity3d,h_so_16_03_148
149,16,54,はい、一回戦終了ね……次はどうする？　このまま続けてもいいし……そうだ、ご奉仕してあげましょうか？,sound/data/pcm/c16/h/01.unity3d,h_so_16_03_149
150,16,54,こうやって強くイカされちゃうと……アナタの女なんだって覚えさせられてるみたいで……フフッ、いいかもっ♪,sound/data/pcm/c16/h/01.unity3d,h_so_16_03_150
151,16,54,はぁ、アナル良かったぁ……もうね、オマンコとどっちがいいって聞かれたら……迷っちゃうくらいかも……,sound/data/pcm/c16/h/01.unity3d,h_so_16_03_151
152,16,54,んふっ、どう？　開発の成果は確認できた？　もうすっかり、アナタ専用アナルよ,sound/data/pcm/c16/h/01.unity3d,h_so_16_03_152
153,16,54,お尻の穴……んぅ、もうがばがばよっ……これ、なかなか直らないんだからねっ……,sound/data/pcm/c16/h/01.unity3d,h_so_16_03_153
154,16,54,アナルだけもう私じゃないみたい……今だって、ずっとヒクヒクしちゃてるの……わかるでしょ？,sound/data/pcm/c16/h/01.unity3d,h_so_16_03_154
155,16,54,ゴムってよく考えたらエッチよね……オチンポ専用の形って……それだけで卑猥だと思わない？,sound/data/pcm/c16/h/01.unity3d,h_so_16_03_155
156,16,54,ゴムに搾りたてザーメン、いっぱい溜まってるわね……今激しく動いちゃだめよ？　破けたら大変なんだから,sound/data/pcm/c16/h/01.unity3d,h_so_16_03_156
157,16,54,ねぇ、射精ってどんな感じなの？　潮吹きと似てるのかしら？　アナタ気持ちよさそうだったから……気になって　,sound/data/pcm/c16/h/01.unity3d,h_so_16_03_157
158,16,54,射精直後の敏感おちんぽ……ちょっと締めただけで……んふふっ、たまらなくなっちゃうでしょ？,sound/data/pcm/c16/h/01.unity3d,h_so_16_03_158
159,16,54,受精しやすい日って事は私は発情してるって事なんだけど……でも……今更ね……,sound/data/pcm/c16/h/01.unity3d,h_so_16_03_159
160,16,54,知ってる？　年中発情してるのって、人間とウサギくらいなものなの、まぁ、こんなに気持ちいいとね……,sound/data/pcm/c16/h/01.unity3d,h_so_16_03_160
161,16,54,ねぇ、やっぱりゴムより生の方が気持ちいいのよね？　ごめんね、我慢させちゃって……,sound/data/pcm/c16/h/01.unity3d,h_so_16_03_161
162,16,54,こーら、もう終わりよ……ゴムつけたまま奥ぐりぐりしたら……破けちゃうでしょ,sound/data/pcm/c16/h/01.unity3d,h_so_16_03_162
163,16,54,んっ、いっぱい出たわね……濃いおちんちん汁で……私の中、満たされちゃってる……,sound/data/pcm/c16/h/01.unity3d,h_so_16_03_163
164,16,54,お射精よくできましたっ！　おちんぽくん偉いぞっ！　なーんてね……ふふふっ♪,sound/data/pcm/c16/h/01.unity3d,h_so_16_03_164
165,16,54,そろそろ色々決めておかないとかしら……アナタも私の親に挨拶くらいはしてちょうだいね？,sound/data/pcm/c16/h/01.unity3d,h_so_16_03_165
166,16,54,ねぇ、おっぱい吸ってみる？　なんだか母性が溢れちゃって……優しくしてあげたい気分なの,sound/data/pcm/c16/h/01.unity3d,h_so_16_03_166
167,16,54,少しだけ休憩ね……おまんこ入れてていいから、ちょっとだけ休憩させて……,sound/data/pcm/c16/h/01.unity3d,h_so_16_03_167
168,16,54,うぅ、私、腰浮いちゃってたわよね……仕方ないのよ……あんなにされたら、誰だってそうなるわ……,sound/data/pcm/c16/h/01.unity3d,h_so_16_03_168
169,16,54,あぁ、アナル吸い付いちゃってる……抜かないでってお願いしてるのっ,sound/data/pcm/c16/h/01.unity3d,h_so_16_03_169
170,16,54,あー、えっと、もしかしてアナルの方が気持ちよかったり……する？,sound/data/pcm/c16/h/01.unity3d,h_so_16_03_170
171,16,54,んぅ、もうアナルゆるゆるだから……オチンポ優しくしかできないから……一回抜いてぇ……,sound/data/pcm/c16/h/01.unity3d,h_so_16_03_171
172,16,54,お射精ぴゅっぴゅっ、うん、たくさん気持ちいいの出すのよ、ほら、まだ出るでしょ、頑張って,sound/data/pcm/c16/h/01.unity3d,h_so_16_03_172
173,16,54,あぁっ、凄い量……精液もったいない……フフッ、無駄打ちしちゃったわね……,sound/data/pcm/c16/h/01.unity3d,h_so_16_03_173
174,16,54,はぁ、搾りたてザーメンの生臭い匂い……これ、好きなの……ずっと嗅いでたい,sound/data/pcm/c16/h/01.unity3d,h_so_16_03_174
175,16,54,私ね、男の潮吹きにも興味あるの……イッた直後に手コキすると出るらしいんだけど……いいわよね？,sound/data/pcm/c16/h/01.unity3d,h_so_16_03_175
176,16,54,ふふっ、アナタ今、すっごくだらしない顔になってるわよ……オチンポの周りもべとべとで……すっごくだらしない,sound/data/pcm/c16/h/01.unity3d,h_so_16_03_176
177,16,54,あぁ、子種汁と愛液が混ざって……すっごくエッチな匂い……ねぇ、アナタも嗅いでみて,sound/data/pcm/c16/h/01.unity3d,h_so_16_03_177
178,16,54,んっ、溢れちゃう、とろとろオマンコからほんとにトロトロ漏れちゃってる……,sound/data/pcm/c16/h/01.unity3d,h_so_16_03_178
179,16,54,んぅ、今お尻の匂い嗅がないでっ……ぱっくり開いちゃってるから……ダメなのぉ……,sound/data/pcm/c16/h/01.unity3d,h_so_16_03_179
180,16,54,お尻の穴、すっごい拡がっちゃってるでしょ？　そこ、ほんとはうんちする穴なんだからね……,sound/data/pcm/c16/h/01.unity3d,h_so_16_03_180
181,16,54,えっ、もしかして……終わり？　オチンポまだ元気みたいだけど……,sound/data/pcm/c16/h/01.unity3d,h_so_16_03_181
182,16,54,ほーら、焦らすのとかいいから、早く来て,sound/data/pcm/c16/h/01.unity3d,h_so_16_03_182
183,16,54,んふっ、そんな風に言われるとゾクってしちゃう,sound/data/pcm/c16/h/01.unity3d,h_so_16_03_183
184,16,54,いいわ、とろとろオマンコで優しくしてあげる,sound/data/pcm/c16/h/01.unity3d,h_so_16_03_184
185,16,54,仕方ないわね。付けて欲しいんでしょ？　こっち来て,sound/data/pcm/c16/h/01.unity3d,h_so_16_03_185
186,16,54,ねぇ、アナタだけが我慢してると思ってる？,sound/data/pcm/c16/h/01.unity3d,h_so_16_03_186
187,16,54,セックスってヒーリング効果もあると思うの、だから安心が大前提よ,sound/data/pcm/c16/h/01.unity3d,h_so_16_03_187
188,16,54,だーめっ、オチンポいい子にして,sound/data/pcm/c16/h/01.unity3d,h_so_16_03_188
189,16,54,うん、もう期待で拡がっちゃってるから、早く入れて,sound/data/pcm/c16/h/01.unity3d,h_so_16_03_189
190,16,54,えぇ、アナルめちゃくちゃにして……,sound/data/pcm/c16/h/01.unity3d,h_so_16_03_190
191,16,54,アナルがばがばだから……もう緩くて気持ちよくないと思うわよ,sound/data/pcm/c16/h/01.unity3d,h_so_16_03_191
192,16,54,んー、やめときましょ。お、大きな方が太いと、結構ショックなのよ……,sound/data/pcm/c16/h/01.unity3d,h_so_16_03_192
193,16,54,んぁぁ、オチンポ奥まで飲み込んじゃった,sound/data/pcm/c16/h/01.unity3d,h_so_16_03_193
194,16,54,んっふ、根元までぴったりよ,sound/data/pcm/c16/h/01.unity3d,h_so_16_03_194
195,16,54,んぃっ、がっつきオチンポ来たぁ,sound/data/pcm/c16/h/01.unity3d,h_so_16_03_195
196,16,54,こらぁ、悪戯オチンポには容赦しないわよ？,sound/data/pcm/c16/h/01.unity3d,h_so_16_03_196
197,16,54,はぁ、全然萎えない絶倫オチンポ……私、絶対おかしくされちゃうわ,sound/data/pcm/c16/h/01.unity3d,h_so_16_03_197
198,16,54,もっと締める？　リクエストがあったら言ってね？,sound/data/pcm/c16/h/01.unity3d,h_so_16_03_198
199,16,54,んぁ、お尻服従してるぅ、オチンポにおかえりなさいしてるわ,sound/data/pcm/c16/h/01.unity3d,h_so_16_03_199
200,16,54,はぁ、奥まで一気に来たぁ……お尻喜んじゃってるぅ,sound/data/pcm/c16/h/01.unity3d,h_so_16_03_200
201,16,54,ふぁっ、うそ……私……軽くイっちゃったかも……,sound/data/pcm/c16/h/01.unity3d,h_so_16_03_201
202,16,54,んぅ？　動かないならぁ、オマンコ絡みついちゃおうかなぁ……,sound/data/pcm/c16/h/01.unity3d,h_so_16_03_202
203,16,54,んふっ、流石に連続はキツかったかしら？　いいわよ、オマンコで休憩して,sound/data/pcm/c16/h/01.unity3d,h_so_16_03_203
204,16,54,お尻焦らさないでぇ、早く奥までガン突きしてぇっ,sound/data/pcm/c16/h/01.unity3d,h_so_16_03_204
205,16,54,ねぇ、オチンポくんは早く動きたいーって言ってるみたいよ？,sound/data/pcm/c16/h/01.unity3d,h_so_16_03_205
206,16,54,あっ、抜いちゃ……んぅー、オマンコ寂しぃ……,sound/data/pcm/c16/h/01.unity3d,h_so_16_03_206
207,16,54,なぁに？　私のオマンコで遊んでるの？,sound/data/pcm/c16/h/01.unity3d,h_so_16_03_207
208,16,54,なんで抜いちゃうのぉ……ねぇ、アナルしてよぉ……,sound/data/pcm/c16/h/01.unity3d,h_so_16_03_208
209,16,54,あんっ、お尻期待してたのに……酷い人ね,sound/data/pcm/c16/h/01.unity3d,h_so_16_03_209
210,16,54,んぅ、ゆっくりオチンポ好きぃ……繋がってるってよくわかるの,sound/data/pcm/c16/h/01.unity3d,h_so_16_03_210
211,16,54,うん、焦らず、ゆっくりね、まだまだいっぱいするんだから,sound/data/pcm/c16/h/01.unity3d,h_so_16_03_211
212,16,54,そうよ、一生懸命ぱこぱこして……気持ちいいから,sound/data/pcm/c16/h/01.unity3d,h_so_16_03_212
213,16,54,はぁ、素敵よ……ずっとこうしてたい……,sound/data/pcm/c16/h/01.unity3d,h_so_16_03_213
214,16,54,お尻いっぱい愛してね……アナタのお尻よ,sound/data/pcm/c16/h/01.unity3d,h_so_16_03_214
215,16,54,オチンポ辛そうね……でも、やめちゃだめよ？,sound/data/pcm/c16/h/01.unity3d,h_so_16_03_215
216,16,54,必死に腰振っちゃって、お尻大好きなのね,sound/data/pcm/c16/h/01.unity3d,h_so_16_03_216
217,16,54,ほら、アナタの好きなお尻よ、もっと頑張りなさい,sound/data/pcm/c16/h/01.unity3d,h_so_16_03_217
218,16,54,んぅ、気持よすぎて、頭が沸騰しそう,sound/data/pcm/c16/h/01.unity3d,h_so_16_03_218
219,16,54,はぁ、ぐしょぐしょオマンコ、もう溶けちゃう……,sound/data/pcm/c16/h/01.unity3d,h_so_16_03_219
220,16,54,オチンポ来てる！　子宮ガンガン突かれてるぅっ,sound/data/pcm/c16/h/01.unity3d,h_so_16_03_220
221,16,54,オチンポやばぃぃっ、腰勝手に動いちゃうぅぅっ,sound/data/pcm/c16/h/01.unity3d,h_so_16_03_221
222,16,54,あぁ、ねちっこく攻められてるぅ、お尻堕とされちゃうぅ,sound/data/pcm/c16/h/01.unity3d,h_so_16_03_222
223,16,54,んぅ、一生懸命締めてるのに、すぐに拡げちゃうんだから,sound/data/pcm/c16/h/01.unity3d,h_so_16_03_223
224,16,54,おじりっ、おっじり……んぁ、おっじりぃ……（おしりおしりおしり）,sound/data/pcm/c16/h/01.unity3d,h_so_16_03_224
225,16,54,んぁぁ、ガン突きピストンで、お尻めちゃくちゃにされてるぅっ,sound/data/pcm/c16/h/01.unity3d,h_so_16_03_225
226,16,54,んぐぅ、オマンコおがじぐなるぅ……またイっぢゃうぅぅっ,sound/data/pcm/c16/h/01.unity3d,h_so_16_03_226
227,16,54,んぅう、ゆっくり掻き混ぜられてぇ、凄いおっきいの来てるぅっ,sound/data/pcm/c16/h/01.unity3d,h_so_16_03_227
228,16,54,激しいの好きっ、もっとぐちゃぐちゃにしてぇっ,sound/data/pcm/c16/h/01.unity3d,h_so_16_03_228
229,16,54,オマンコ壊れちゃう、オマンコイキっぱなしになっちゃうぅ,sound/data/pcm/c16/h/01.unity3d,h_so_16_03_229
230,16,54,敏感オチンポ、壊れちゃうくらいしてあげる、ほら、また射精なさい！,sound/data/pcm/c16/h/01.unity3d,h_so_16_03_230
231,16,54,ふふっ、イクのね？　いいのよ、何回でもイっていいの、イキ狂っちゃいなさい,sound/data/pcm/c16/h/01.unity3d,h_so_16_03_231
232,16,54,んふっ、もう気持ちいいの辛い？　そんな事ないわよね？,sound/data/pcm/c16/h/01.unity3d,h_so_16_03_232
233,16,54,いいわ、イキなさい、敏感チンポでオマンコ掻き回しながらイっちゃいなさい,sound/data/pcm/c16/h/01.unity3d,h_so_16_03_233
234,16,54,んおぉっ、あぁやだ、また変な声でちゃう、お尻弱いのぉっ,sound/data/pcm/c16/h/01.unity3d,h_so_16_03_234
235,16,54,お尻が、んぁぁ、グリグリ、んぅ、お尻ぐりぐりぃん,sound/data/pcm/c16/h/01.unity3d,h_so_16_03_235
236,16,54,ガチガチおちんぽ、お尻むしゃぶりついちゃってるぅっ,sound/data/pcm/c16/h/01.unity3d,h_so_16_03_236
237,16,54,ケツ穴めくれちゃう……うんちの穴拡がっちゃうのぉぉ……,sound/data/pcm/c16/h/01.unity3d,h_so_16_03_237
238,16,54,びくびくオチンポ、もう限界でしょ？　でもね、まだダメよ……我慢なさい,sound/data/pcm/c16/h/01.unity3d,h_so_16_03_238
239,16,54,んっふ、亀頭ぷるぷるさせちゃって、敏感オチンポ、お尻でもっといじめてあげる,sound/data/pcm/c16/h/01.unity3d,h_so_16_03_239
240,16,54,んふっ、どれだけ出せるの？　試したくなってきたわね,sound/data/pcm/c16/h/01.unity3d,h_so_16_03_240
241,16,54,いいわよ、そんなに必死になられたら、お尻で出すの許してあげる,sound/data/pcm/c16/h/01.unity3d,h_so_16_03_241
242,16,54,はっ、はっ、全身ぶるぶる震えちゃってる……もう小刻みにイッてるのよぉっ,sound/data/pcm/c16/h/01.unity3d,h_so_16_03_242
243,16,54,あぁ、またイッちゃう、イッたばかりなのに、イキ狂っちゃうぅっ！,sound/data/pcm/c16/h/01.unity3d,h_so_16_03_243
244,16,54,アナタもイキそうなんでしょ？　いいわ、いいわ、一緒にイキましょう！,sound/data/pcm/c16/h/01.unity3d,h_so_16_03_244
245,16,54,一緒よ、気持ちよくなるのも、イクのも、全部一緒がいいのっ,sound/data/pcm/c16/h/01.unity3d,h_so_16_03_245
246,16,54,えぇ、いいわよ。オチンポ汁、空っぽになるまで出しなさいっ,sound/data/pcm/c16/h/01.unity3d,h_so_16_03_246
247,16,54,んふっ、じゃあいくわよっ、ギュッって締め付けて、一番気持ちよくしてあげる,sound/data/pcm/c16/h/01.unity3d,h_so_16_03_247
248,16,54,いいわよ、オチンポ連射しちゃうのね、連続射精キメちゃいなさいっ,sound/data/pcm/c16/h/01.unity3d,h_so_16_03_248
249,16,54,あぁ、出して、イキ顔で子種汁噴き出すとこ、私に見せて！,sound/data/pcm/c16/h/01.unity3d,h_so_16_03_249
250,16,54,はぁ、本気オチンポで奥までガン突き……これ、アナタ、そろそろイクのねっ,sound/data/pcm/c16/h/01.unity3d,h_so_16_03_250
251,16,54,んふっ、今アナタ、オマンコの事しか考えてないわね？,sound/data/pcm/c16/h/01.unity3d,h_so_16_03_251
252,16,54,ゴムが擦れて……あぁ、強いっ、イって、いっぱい気持ちよくなって！,sound/data/pcm/c16/h/01.unity3d,h_so_16_03_252
253,16,54,あぁ出して、ゴムたぷたぷになるくらい、凄い量の射精してぇ,sound/data/pcm/c16/h/01.unity3d,h_so_16_03_253
254,16,54,イク！　アナルでイクのっ、私のケツアクメ、ちゃんと見ててねっ！,sound/data/pcm/c16/h/01.unity3d,h_so_16_03_254
255,16,54,お尻の穴、震えてるのわかるでしょ、これ、もう限界って事だからっ,sound/data/pcm/c16/h/01.unity3d,h_so_16_03_255
256,16,54,あぁ、オチンポ熱い！　イキましょ、一緒にイキましょ！,sound/data/pcm/c16/h/01.unity3d,h_so_16_03_256
257,16,54,あはっ、私達、余裕なさすぎね、変態同士、仲良くイキましょ！,sound/data/pcm/c16/h/01.unity3d,h_so_16_03_257
258,16,54,もう、どれだけ出すのよ、フフッ、うーそ、好きなだけ出しなさい,sound/data/pcm/c16/h/01.unity3d,h_so_16_03_258
259,16,54,堪え性のないオチンポねぇ、いいわ、なら連射力を見せてちょうだい,sound/data/pcm/c16/h/01.unity3d,h_so_16_03_259
260,16,54,ふふっ、まだまだ精子元気ねっ、勢い良すぎよ,sound/data/pcm/c16/h/01.unity3d,h_so_16_03_260
261,16,54,はぁ、また特濃ザーメン流れ込んできてる……んぅ、気持ちいいっ,sound/data/pcm/c16/h/01.unity3d,h_so_16_03_261
262,16,54,ゴム付け直しておいてよかったわね……この量だと溢れちゃってたかも……,sound/data/pcm/c16/h/01.unity3d,h_so_16_03_262
263,16,54,んぁっ、凄い……ゴム越しでも妊娠しちゃいそうなくらい出てるじゃない……,sound/data/pcm/c16/h/01.unity3d,h_so_16_03_263
264,16,54,もっと出せるでしょ、もっとよ、私のお尻は欲張りなのっ,sound/data/pcm/c16/h/01.unity3d,h_so_16_03_264
265,16,54,はぁすごい……絶倫オチンポ大好き……ねぇ、もっとお尻してぇっ,sound/data/pcm/c16/h/01.unity3d,h_so_16_03_265
266,16,54,んはぁっっ、あぁぁっ、やっ、んぅぅぅぅ,sound/data/pcm/c16/h/01.unity3d,h_so_16_03_266
267,16,54,あ゛ぁぁぁぁっ、あ゛ぁぁぁぁっ,sound/data/pcm/c16/h/01.unity3d,h_so_16_03_267
268,16,54,んぅぅ、ひぐっ、ひっひゃうぅ（いく、いっちゃう）ふぁ、んはぁぁぁぁっ,sound/data/pcm/c16/h/01.unity3d,h_so_16_03_268
269,16,54,んぇぇっ、ろけるぅっ、とけひゃぅぅっ（溶ける、溶けちゃう）,sound/data/pcm/c16/h/01.unity3d,h_so_16_03_269
270,16,54,んふっ、最近ね、アナタのせいで、ゴムたくさん持ってないと不安になる時あるんだから,sound/data/pcm/c16/h/01.unity3d,h_so_16_03_270
271,16,54,ゴムもいいものでしょ？　私、わりと気にいってるのよ,sound/data/pcm/c16/h/01.unity3d,h_so_16_03_271
272,16,54,ふふっ、しあわせ……アナタも幸せ？　ねぇ、幸せって言って,sound/data/pcm/c16/h/01.unity3d,h_so_16_03_272
273,16,54,女の幸せって下品な言葉かと思ってたけど……そうでもないわよね……,sound/data/pcm/c16/h/01.unity3d,h_so_16_03_273
274,16,54,ふふっ、これからは旦那様って呼べばいいかしら？　それとも……ご主人様？,sound/data/pcm/c16/h/01.unity3d,h_so_16_03_274
275,16,54,あんっ、こら、中で遊ばないの、今、すっごく大事な時間なのよっ,sound/data/pcm/c16/h/01.unity3d,h_so_16_03_275
276,16,54,お、怒ってる？　うぅ、一人でイッて……ごめんなさい,sound/data/pcm/c16/h/01.unity3d,h_so_16_03_276
277,16,54,うぅ、やぁ、次は頑張るからぁ、もう一回しましょ、ねーぇー,sound/data/pcm/c16/h/01.unity3d,h_so_16_03_277
278,16,54,はぁ、アナル気持ち良かったぁ……どう？　大好きなお尻でイッた気分は,sound/data/pcm/c16/h/01.unity3d,h_so_16_03_278
279,16,54,アナルセックスにはね……一つ欠点があるのよ……お、お手洗いに行ってくるわね,sound/data/pcm/c16/h/01.unity3d,h_so_16_03_279
280,16,54,ね、ねぇ……たまにお尻でもオナニーしてるって言ったら……引くわよね？,sound/data/pcm/c16/h/01.unity3d,h_so_16_03_280
281,16,54,知ってる？　男の人だってお尻で感じる事ができるのよ？　んっふふふ,sound/data/pcm/c16/h/01.unity3d,h_so_16_03_281
282,16,54,ねぇ、ゴムをした方が気持ちいいセックス……って本を書いたら売れるかしら？,sound/data/pcm/c16/h/01.unity3d,h_so_16_03_282
283,16,54,はぁ、私達、ゴムメーカーの人に相当貢献してるわよね……,sound/data/pcm/c16/h/01.unity3d,h_so_16_03_283
284,16,54,んっふ、アナタのぷりぷりザーメン、中でたぷたぷいってるわ,sound/data/pcm/c16/h/01.unity3d,h_so_16_03_284
285,16,54,これでまたオチンポ敏感になっちゃったわね……さぁ、次はどうなっちゃうのかしら,sound/data/pcm/c16/h/01.unity3d,h_so_16_03_285
286,16,54,子宮も降りちゃってたし……これは妊娠確実よね,sound/data/pcm/c16/h/01.unity3d,h_so_16_03_286
287,16,54,あんなにグリグリ押し付けたら、子宮壊れちゃうから、一番大事なところなのよ？,sound/data/pcm/c16/h/01.unity3d,h_so_16_03_287
288,16,54,アナタだってイった後なのに……なんで私だけぇ……,sound/data/pcm/c16/h/01.unity3d,h_so_16_03_288
289,16,54,むぅー、敏感オチンポじゃなかったの？　私……頑張ったのに……,sound/data/pcm/c16/h/01.unity3d,h_so_16_03_289
290,16,54,ここまでくると、アナタのお尻へのこだわりを一度ゆっくり聞いてみたいわね,sound/data/pcm/c16/h/01.unity3d,h_so_16_03_290
291,16,54,一緒にお尻でいけたから……今日はお尻記念日……ごめんなさい、忘れて,sound/data/pcm/c16/h/01.unity3d,h_so_16_03_291
292,16,54,わ、私は悪くないわ、アナルが気持ち良すぎるのよっ,sound/data/pcm/c16/h/01.unity3d,h_so_16_03_292
293,16,54,うぅ、イカされちゃった……アナル自信あったのに……,sound/data/pcm/c16/h/01.unity3d,h_so_16_03_293
294,16,54,あらあら、もうオチンポ限界なんじゃないの？　んぅ？,sound/data/pcm/c16/h/01.unity3d,h_so_16_03_294
295,16,54,ゴムにきちんと出せた良い子のオチンポには、ご褒美をあげないとね,sound/data/pcm/c16/h/01.unity3d,h_so_16_03_295
296,16,54,あはっ、敏感オチンポイカせちゃった……なんだか凄い満足感よ,sound/data/pcm/c16/h/01.unity3d,h_so_16_03_296
297,16,54,ほら、凄い汗よ、ちょっと休憩しなさい、オマンコ逃げたりしないから,sound/data/pcm/c16/h/01.unity3d,h_so_16_03_297
298,16,54,はい、子種汁ごちそうさま……妊娠準備完了よ,sound/data/pcm/c16/h/01.unity3d,h_so_16_03_298
299,16,54,これだけ何回も濃いの出されたら、きっと元気な子が生まれるわね,sound/data/pcm/c16/h/01.unity3d,h_so_16_03_299
300,16,54,ゴムって響きだけで卑猥よね。そうでもないかしら？,sound/data/pcm/c16/h/01.unity3d,h_so_16_03_300
301,16,54,気持ち良かったわ……今すぐゴムを外して、アナタの精子飲んじゃいたいくらいよ,sound/data/pcm/c16/h/01.unity3d,h_so_16_03_301
302,16,54,オマンコ居心地いいでしょ、もうすっかりアナタ専用だもの,sound/data/pcm/c16/h/01.unity3d,h_so_16_03_302
303,16,54,もうね、私の指より、アナタのオチンポの方が長くオマンコに入ってると思うの,sound/data/pcm/c16/h/01.unity3d,h_so_16_03_303
304,16,54,そうね、子作りは別にいけない事じゃないもの、あとは私達の問題よね,sound/data/pcm/c16/h/01.unity3d,h_so_16_03_304
305,16,54,ねぇ、お腹撫でて……そうしてくれたら……きっとね……,sound/data/pcm/c16/h/01.unity3d,h_so_16_03_305
306,16,54,うぅ、ごめんなさい。もう何回でもしていいから、アナタがイクまで付き合うから、ね？,sound/data/pcm/c16/h/01.unity3d,h_so_16_03_306
307,16,54,もう、どうしてぇ……次は私がイッても止めなくていいから、好きなだけしてみて,sound/data/pcm/c16/h/01.unity3d,h_so_16_03_307
308,16,54,アナタのお尻好きって筋金入りよね……どうしてそうなっちゃったの？,sound/data/pcm/c16/h/01.unity3d,h_so_16_03_308
309,16,54,この前ね……オナラが精液の匂いするって言われたの……あ、あはは……,sound/data/pcm/c16/h/01.unity3d,h_so_16_03_309
310,16,54,んぅぅっ、この生臭い匂い大好きなのぉ……んあぁ、また発情しちゃうぅ……,sound/data/pcm/c16/h/01.unity3d,h_so_16_03_310
311,16,54,はぁっ、出てる、射精見てると私まで気持ちよくなってきちゃう,sound/data/pcm/c16/h/01.unity3d,h_so_16_03_311
312,16,54,ほんとにいっぱい出したわねぇ……え、ちょっとフラついてない？　だ、大丈夫？,sound/data/pcm/c16/h/01.unity3d,h_so_16_03_312
313,16,54,ふふっ、いくわよ？　男の潮吹き……見せてちょうだい,sound/data/pcm/c16/h/01.unity3d,h_so_16_03_313
314,16,54,んふっ、オマンコひくひくしてるでしょ？　もっと近くで見て……垂れてるの見て……,sound/data/pcm/c16/h/01.unity3d,h_so_16_03_314
