管理番号,大きい項目,中間項目,表示名,バンドルパス,ファイル名
0,33,34,せっかくあなたがくれた時間だもの。一緒に楽しみましょ,sound/data/pcm/c33/h/01.unity3d,h_so_33_01_000
1,33,34,存分に楽しんでいってね,sound/data/pcm/c33/h/01.unity3d,h_so_33_01_001
2,33,34,もう濡れてるから、おチンチンが入る感触を楽しんで,sound/data/pcm/c33/h/01.unity3d,h_so_33_01_003
3,33,34,一応、つけましょ,sound/data/pcm/c33/h/01.unity3d,h_so_33_01_006
4,33,34,ふふふ、ナマ中だしはもう少しお互いを知ってからね？,sound/data/pcm/c33/h/01.unity3d,h_so_33_01_007
5,33,34,危険日はゴム、よね？,sound/data/pcm/c33/h/01.unity3d,h_so_33_01_008
6,33,34,今は赤ちゃんより二人の快感でしょ？　ゴムは必須よ,sound/data/pcm/c33/h/01.unity3d,h_so_33_01_009
7,33,34,乱暴にしたっていいのよ,sound/data/pcm/c33/h/01.unity3d,h_so_33_01_010
8,33,34,ええ、入れて,sound/data/pcm/c33/h/01.unity3d,h_so_33_01_011
9,33,34,トイレにまつわる都合の悪さがあるの、ごめんなさいね,sound/data/pcm/c33/h/01.unity3d,h_so_33_01_012
10,33,34,お尻の穴はダメだけど、それ以外なら何でもしてあげたいわ,sound/data/pcm/c33/h/01.unity3d,h_so_33_01_013
11,33,34,入って、きてるわ,sound/data/pcm/c33/h/01.unity3d,h_so_33_01_014
12,33,34,んんっ！,sound/data/pcm/c33/h/01.unity3d,h_so_33_01_015
13,33,34,ちゃんとお尻に入ってるわよ,sound/data/pcm/c33/h/01.unity3d,h_so_33_01_016
14,33,34,んくっ……ふふふ、素直になってきたわね,sound/data/pcm/c33/h/01.unity3d,h_so_33_01_017
15,33,34,中のお肉がおチンチンに掻き分けられちゃってるわ……,sound/data/pcm/c33/h/01.unity3d,h_so_33_01_018
16,33,34,無理やりプレイがしたかったの？　ふふふ,sound/data/pcm/c33/h/01.unity3d,h_so_33_01_021
17,33,34,お尻の中、いっぱいかき乱して,sound/data/pcm/c33/h/01.unity3d,h_so_33_01_023
18,33,34,ふふふ、もっとお尻をただの肉穴だと思っていいのよ,sound/data/pcm/c33/h/01.unity3d,h_so_33_01_025
19,33,34,無理やりされるのも悪くないわね,sound/data/pcm/c33/h/01.unity3d,h_so_33_01_026
20,33,34,自分がおチンチンを入れた女の子を改めて見てるの？,sound/data/pcm/c33/h/01.unity3d,h_so_33_01_027
21,33,34,ふふふ、おっきい,sound/data/pcm/c33/h/01.unity3d,h_so_33_01_028
22,33,34,このままでいるのも、それはそれで興奮するわね,sound/data/pcm/c33/h/01.unity3d,h_so_33_01_029
23,33,34,腸壁がおチンチンにぴったり張り付いちゃってるわね,sound/data/pcm/c33/h/01.unity3d,h_so_33_01_030
24,33,34,くすっ……ケツアクメっていうの、させてくれるのかしら？,sound/data/pcm/c33/h/01.unity3d,h_so_33_01_031
25,33,34,ふふふ、お尻の穴がぐにょぐにょ動いてるの、わかる？,sound/data/pcm/c33/h/01.unity3d,h_so_33_01_032
26,33,34,抜けちゃったかしら？,sound/data/pcm/c33/h/01.unity3d,h_so_33_01_033
27,33,34,抜いたり差したりしちゃう？,sound/data/pcm/c33/h/01.unity3d,h_so_33_01_034
28,33,34,肛門を刺激したいのかしら？,sound/data/pcm/c33/h/01.unity3d,h_so_33_01_036
29,33,34,抜ける感覚も嫌いじゃないの,sound/data/pcm/c33/h/01.unity3d,h_so_33_01_037
30,33,34,せっかくのエッチなんだから、素のままのあなたを見せて,sound/data/pcm/c33/h/01.unity3d,h_so_33_01_039
31,33,34,速く動いていいのよ,sound/data/pcm/c33/h/01.unity3d,h_so_33_01_042
32,33,34,あなたになら乱暴にされてもいいから,sound/data/pcm/c33/h/01.unity3d,h_so_33_01_043
33,33,34,あなたにはただ気持ちよくなってもらいたいの,sound/data/pcm/c33/h/01.unity3d,h_so_33_01_044
34,33,34,私より先に気持ちよくなって,sound/data/pcm/c33/h/01.unity3d,h_so_33_01_045
35,33,34,お尻だからって遠慮しないで,sound/data/pcm/c33/h/01.unity3d,h_so_33_01_048
36,33,34,お尻のヒダが引っかき回されてるわ,sound/data/pcm/c33/h/01.unity3d,h_so_33_01_049
37,33,34,アナルをもっと拡げてっ,sound/data/pcm/c33/h/01.unity3d,h_so_33_01_050
38,33,34,あなたの気持ちが伝わってくるわ,sound/data/pcm/c33/h/01.unity3d,h_so_33_01_051
39,33,34,両方されるのって、こんなにいいのね,sound/data/pcm/c33/h/01.unity3d,h_so_33_01_053
40,33,34,ふふ、いたずらっ子ね,sound/data/pcm/c33/h/01.unity3d,h_so_33_01_055
41,33,34,私はいやがらないから、いっぱい触って,sound/data/pcm/c33/h/01.unity3d,h_so_33_01_057
42,33,34,ゆっくりするの、好きよ,sound/data/pcm/c33/h/01.unity3d,h_so_33_01_059
43,33,34,ふふふ、ちゃんと気持ちいい？,sound/data/pcm/c33/h/01.unity3d,h_so_33_01_062
44,33,34,もっとお尻のお肉を締め付けた方がいいかしら,sound/data/pcm/c33/h/01.unity3d,h_so_33_01_065
45,33,34,お尻で気持ちよがってるあなたの声を聞かせて,sound/data/pcm/c33/h/01.unity3d,h_so_33_01_066
46,33,34,もっとアナルにがっついて,sound/data/pcm/c33/h/01.unity3d,h_so_33_01_067
47,33,34,あなたのおチンチン、盛り上がってるわね,sound/data/pcm/c33/h/01.unity3d,h_so_33_01_068
48,33,34,あなたがしたいようにして、おチンチンでほじくって,sound/data/pcm/c33/h/01.unity3d,h_so_33_01_069
49,33,34,ぎゅ～って締め付けてあげる,sound/data/pcm/c33/h/01.unity3d,h_so_33_01_070
50,33,34,私がリードするはずだったのに、うふふ,sound/data/pcm/c33/h/01.unity3d,h_so_33_01_071
51,33,34,際限なく、気持ちよくなっちゃうの,sound/data/pcm/c33/h/01.unity3d,h_so_33_01_073
52,33,34,あなたになら私が消費されてもいいって思ってるのよ,sound/data/pcm/c33/h/01.unity3d,h_so_33_01_075
53,33,34,私の反応、楽しんで,sound/data/pcm/c33/h/01.unity3d,h_so_33_01_077
54,33,34,なんだか、スイッチが入っちゃいそう,sound/data/pcm/c33/h/01.unity3d,h_so_33_01_087
55,33,34,急にムラムラしてきちゃった、もっとしてほしいの,sound/data/pcm/c33/h/01.unity3d,h_so_33_01_088
56,33,34,私も、激しいのがいいみたい,sound/data/pcm/c33/h/01.unity3d,h_so_33_01_089
57,33,34,快感が甘くなってきたわ……イキそうなの,sound/data/pcm/c33/h/01.unity3d,h_so_33_01_090
58,33,34,あなたがラストスパートをかけてるのが気持ちいいの,sound/data/pcm/c33/h/01.unity3d,h_so_33_01_091
59,33,34,もっと私を貪って,sound/data/pcm/c33/h/01.unity3d,h_so_33_01_092
60,33,34,あなたの気持ちいいように動いて,sound/data/pcm/c33/h/01.unity3d,h_so_33_01_093
61,33,34,我慢汁のにおいが強くなってきたわ……射精したいのね,sound/data/pcm/c33/h/01.unity3d,h_so_33_01_094
62,33,34,お尻なのに……感じてきちゃったの,sound/data/pcm/c33/h/01.unity3d,h_so_33_01_095
63,33,34,おチンチンの熱にあてられて、気持ちよくなってきちゃったわ,sound/data/pcm/c33/h/01.unity3d,h_so_33_01_096
64,33,34,もうだめ、お尻で達しちゃう,sound/data/pcm/c33/h/01.unity3d,h_so_33_01_097
65,33,34,このままされたら果てちゃうわ、お尻でイッちゃうなんて……,sound/data/pcm/c33/h/01.unity3d,h_so_33_01_098
66,33,34,私のまんまるなお尻が好みだったのね。いっぱい射精して,sound/data/pcm/c33/h/01.unity3d,h_so_33_01_099
67,33,34,お尻の中で膨らんできたわ……,sound/data/pcm/c33/h/01.unity3d,h_so_33_01_100
68,33,34,めちゃくちゃに引っかきまわして,sound/data/pcm/c33/h/01.unity3d,h_so_33_01_101
69,33,34,一体になっちゃうぐらいおチンチン押し込んで,sound/data/pcm/c33/h/01.unity3d,h_so_33_01_102
70,33,34,やだ、私だけ来ちゃいそう,sound/data/pcm/c33/h/01.unity3d,h_so_33_01_103
71,33,34,あなたはまだよね……ごめんね、私、イッちゃいそうなの,sound/data/pcm/c33/h/01.unity3d,h_so_33_01_104
72,33,34,一緒にイって、あなたとイキたいの,sound/data/pcm/c33/h/01.unity3d,h_so_33_01_105
73,33,34,あなたのイキそうな声を聴いてイキたいの,sound/data/pcm/c33/h/01.unity3d,h_so_33_01_106
74,33,34,私でイってくれて、本当に嬉しいわ,sound/data/pcm/c33/h/01.unity3d,h_so_33_01_107
75,33,34,あなたが満足するまでドピュドピュしてほしいの,sound/data/pcm/c33/h/01.unity3d,h_so_33_01_108
76,33,34,ふふふ、外にいっぱい射精して,sound/data/pcm/c33/h/01.unity3d,h_so_33_01_109
77,33,34,出して、中じゃなくていいから、気持ちよく射精してもらいたいの,sound/data/pcm/c33/h/01.unity3d,h_so_33_01_110
78,33,34,何も言わなくていいから、いっぱい出して,sound/data/pcm/c33/h/01.unity3d,h_so_33_01_111
79,33,34,あなたのがゴリゴリ擦れてるわ,sound/data/pcm/c33/h/01.unity3d,h_so_33_01_112
80,33,34,急にボコって膨らんだわね。変なところが擦れちゃう,sound/data/pcm/c33/h/01.unity3d,h_so_33_01_113
81,33,34,二人の体液でゴムがチュッチュッて鳴いてるわ,sound/data/pcm/c33/h/01.unity3d,h_so_33_01_114
82,33,34,あなたの方が上手ね、私が先にイッちゃってもいい？,sound/data/pcm/c33/h/01.unity3d,h_so_33_01_115
83,33,34,一緒にイキたかったけど、ごめんなさい、もう我慢できないわ,sound/data/pcm/c33/h/01.unity3d,h_so_33_01_116
84,33,34,うふふ、仲良くお尻でイキたかったの,sound/data/pcm/c33/h/01.unity3d,h_so_33_01_117
85,33,34,あなたの射精でイけそうなの、いっぱい出して、一緒に……,sound/data/pcm/c33/h/01.unity3d,h_so_33_01_118
86,33,34,私のお尻の中でいいなら、溢れるぐらい出して,sound/data/pcm/c33/h/01.unity3d,h_so_33_01_119
87,33,34,あなた専用のお尻にマーキング射精して,sound/data/pcm/c33/h/01.unity3d,h_so_33_01_120
88,33,34,ドピュ、ドピュ、って注ぎ込まれてるわ,sound/data/pcm/c33/h/01.unity3d,h_so_33_01_121
89,33,34,危険日じゃなくても、妊娠しちゃいそうね、ふふふ,sound/data/pcm/c33/h/01.unity3d,h_so_33_01_122
90,33,34,精液溜まりがあなたの精液でたぷんたぷん言ってるわ……,sound/data/pcm/c33/h/01.unity3d,h_so_33_01_123
91,33,34,コンドーム越しでも、精液の熱さが伝わってくるわ,sound/data/pcm/c33/h/01.unity3d,h_so_33_01_124
92,33,34,肛門がギチギチに広がっちゃってるの……,sound/data/pcm/c33/h/01.unity3d,h_so_33_01_125
93,33,34,あなたの精液が逆流してるわ……,sound/data/pcm/c33/h/01.unity3d,h_so_33_01_126
94,33,34,こんなに気持ちよくしてくれるなんて……,sound/data/pcm/c33/h/01.unity3d,h_so_33_01_131
95,33,34,もう、泣かせ上手なんだから……うふふ,sound/data/pcm/c33/h/01.unity3d,h_so_33_01_132
96,33,34,まだ、視界が白黒してるわ……,sound/data/pcm/c33/h/01.unity3d,h_so_33_01_133
97,33,34,ゴムがないと、あなたのプリプリの血管が擦れるのよ,sound/data/pcm/c33/h/01.unity3d,h_so_33_01_134
98,33,34,あなたの精液が、私の中でずっと温かいの,sound/data/pcm/c33/h/01.unity3d,h_so_33_01_135
99,33,34,あなたの分身が、卵子に押し寄せてるわ,sound/data/pcm/c33/h/01.unity3d,h_so_33_01_136
100,33,34,もう、私ばっかり気持ちよくちゃ、だめなのよ,sound/data/pcm/c33/h/01.unity3d,h_so_33_01_137
101,33,34,気持ち良かったけど、なんだか負けた気がするのよね,sound/data/pcm/c33/h/01.unity3d,h_so_33_01_138
102,33,34,あなたの射精が気持ち良くてイっちゃったのよ……,sound/data/pcm/c33/h/01.unity3d,h_so_33_01_139
103,33,34,もう、お尻が気持ちよくなかった頃には戻れないわね,sound/data/pcm/c33/h/01.unity3d,h_so_33_01_140
104,33,34,女の子一人をお尻イキさせるなんて、意地悪な男の子ね,sound/data/pcm/c33/h/01.unity3d,h_so_33_01_141
105,33,34,お尻が、だんだん性器として開花してる気がするの……,sound/data/pcm/c33/h/01.unity3d,h_so_33_01_142
106,33,34,ゴムの中にたっぷり出せた？　私は、ゴムの外にいっぱいかけちゃったわ,sound/data/pcm/c33/h/01.unity3d,h_so_33_01_143
107,33,34,私たち、ゴムがあってもなくても、気持ちよくイケちゃうのね,sound/data/pcm/c33/h/01.unity3d,h_so_33_01_144
108,33,34,ゴムがないと、私たちの相性の良さが浮き彫りになるわね……ふふふ,sound/data/pcm/c33/h/01.unity3d,h_so_33_01_145
109,33,34,こんな気持ちいいセックス、ハマらない方が嘘よね,sound/data/pcm/c33/h/01.unity3d,h_so_33_01_146
110,33,34,これからは、危険日をゴムなしエッチの日にしちゃう？　ふふふ,sound/data/pcm/c33/h/01.unity3d,h_so_33_01_147
111,33,34,今ごろ受精中かしら？,sound/data/pcm/c33/h/01.unity3d,h_so_33_01_148
112,33,34,これだけガクガクされちゃったら、イカないほうが失礼よね,sound/data/pcm/c33/h/01.unity3d,h_so_33_01_149
113,33,34,もう、何も考えられないわ……あなたのおチンチン以外は……,sound/data/pcm/c33/h/01.unity3d,h_so_33_01_150
114,33,34,お尻の穴ってどうしてこんなに気持ちいいのかしら。あなたも不思議でしょ？,sound/data/pcm/c33/h/01.unity3d,h_so_33_01_151
115,33,34,あなたがお尻の穴で喜んでると、どうしてもムラムラしてイッちゃうの,sound/data/pcm/c33/h/01.unity3d,h_so_33_01_152
116,33,34,どうしたらあなたと一緒にイケるのかしら……,sound/data/pcm/c33/h/01.unity3d,h_so_33_01_153
117,33,34,私だけお尻でイク変態扱いしようとしてない？　気のせいよね？,sound/data/pcm/c33/h/01.unity3d,h_so_33_01_154
118,33,34,ふふふ、今日はどこにゴムを捨てていこうかしらね？,sound/data/pcm/c33/h/01.unity3d,h_so_33_01_155
119,33,34,そろそろコンドームが切れそうね。今度、買ってきてあげるわ,sound/data/pcm/c33/h/01.unity3d,h_so_33_01_156
120,33,34,もう少しで私もイケそうだったけど、あなたがイクのが最優先だからいいの,sound/data/pcm/c33/h/01.unity3d,h_so_33_01_157
121,33,34,あなたの満足そうな顔が見られて幸せよ,sound/data/pcm/c33/h/01.unity3d,h_so_33_01_158
122,33,34,危険日は射精する側の方が興奮しやすいのかしら？　ふふふ,sound/data/pcm/c33/h/01.unity3d,h_so_33_01_159
123,33,34,お腹があったかいわ……赤ちゃんがいたら、もっとあったかいでしょうね,sound/data/pcm/c33/h/01.unity3d,h_so_33_01_160
124,33,34,ゴムさえあれば、何回でも二人でビクビクできるわね,sound/data/pcm/c33/h/01.unity3d,h_so_33_01_161
125,33,34,ゴムエッチって、純粋にあなたと気持ちよくなるためって感じで、好きなの,sound/data/pcm/c33/h/01.unity3d,h_so_33_01_162
126,33,34,ゴムって本当に薄いけど、触れ合うのが粘膜同士か否かで、全然変わってしまうものよね,sound/data/pcm/c33/h/01.unity3d,h_so_33_01_163
127,33,34,これからもゴムがいらない日は粘膜を擦り合いましょ,sound/data/pcm/c33/h/01.unity3d,h_so_33_01_164
128,33,34,ちゃんとお薬を飲むから安心して。あなたの幸せなコイカツ生活は守ってあげたいもの,sound/data/pcm/c33/h/01.unity3d,h_so_33_01_165
129,33,34,危険日ゴムなしエッチもコイカツの一環よね？　ふふふ,sound/data/pcm/c33/h/01.unity3d,h_so_33_01_166
130,33,34,いつかあなたをヒィヒィ言わせて、射精ばっかりさせたいわ,sound/data/pcm/c33/h/01.unity3d,h_so_33_01_167
131,33,34,射精管理じゃなくて、絶頂管理されちゃってるわね、私……,sound/data/pcm/c33/h/01.unity3d,h_so_33_01_168
132,33,34,おチンチンのぜん動でお尻がイッちゃうこともあるのよ,sound/data/pcm/c33/h/01.unity3d,h_so_33_01_169
133,33,34,本当にアナルが好きなのね……嬉しいわ,sound/data/pcm/c33/h/01.unity3d,h_so_33_01_170
134,33,34,私はいくらでもアナルでしてほしいって思ってるからね？,sound/data/pcm/c33/h/01.unity3d,h_so_33_01_171
135,33,34,はぁ……あなたの射精ってどうしてこんなにドキドキするのかしら,sound/data/pcm/c33/h/01.unity3d,h_so_33_01_172
136,33,34,あん……おマンコとお尻が同時にきゅんってしちゃったわ,sound/data/pcm/c33/h/01.unity3d,h_so_33_01_173
137,33,34,この量なら、まだ出せるんじゃない？　ふふふ,sound/data/pcm/c33/h/01.unity3d,h_so_33_01_174
138,33,34,気持ち良さそうね……ふふふ,sound/data/pcm/c33/h/01.unity3d,h_so_33_01_175
139,33,34,これで満足？　ふふふ,sound/data/pcm/c33/h/01.unity3d,h_so_33_01_176
140,33,34,日に日に垂れてくる精液の量が増してるの……ふふふ,sound/data/pcm/c33/h/01.unity3d,h_so_33_01_177
141,33,34,この量と濃さ……危険日じゃなくても妊娠しちゃいそうね,sound/data/pcm/c33/h/01.unity3d,h_so_33_01_178
142,33,34,精液だけ出すって、大変なのよ……？,sound/data/pcm/c33/h/01.unity3d,h_so_33_01_179
143,33,34,いやらしいでしょ？,sound/data/pcm/c33/h/01.unity3d,h_so_33_01_180
144,33,34,もっと強く打ち付けて,sound/data/pcm/c33/h/01.unity3d,h_so_33_01_250
145,33,34,ふふふ、イキそうなのね,sound/data/pcm/c33/h/01.unity3d,h_so_33_01_251
146,33,34,ゴムが愛液で滑って、いいの,sound/data/pcm/c33/h/01.unity3d,h_so_33_01_252
147,33,34,きゅっきゅって、ゴムが鳴るぐらい締め付けちゃってる,sound/data/pcm/c33/h/01.unity3d,h_so_33_01_253
