管理番号,大きい項目,中間項目,表示名,バンドルパス,ファイル名
0,20,34,あ、あなたの、それ……お、おっきい、ですね……,sound/data/pcm/c20/h/01.unity3d,h_so_20_01_000
1,20,34,ま、まだ、やっぱり、慣れません……,sound/data/pcm/c20/h/01.unity3d,h_so_20_01_001
2,20,34,ど、どうぞ……準備、できてます……,sound/data/pcm/c20/h/01.unity3d,h_so_20_01_003
3,20,34,えっと……いやかもしれませんけど、ゴム、つけてもらっていいですか？,sound/data/pcm/c20/h/01.unity3d,h_so_20_01_006
4,20,34,や、やっぱり、ゴムはちゃんとつけてもらえると……,sound/data/pcm/c20/h/01.unity3d,h_so_20_01_007
5,20,34,あ、危ない日なので、ゴムは忘れずに、してほしいです……これからのためにも……,sound/data/pcm/c20/h/01.unity3d,h_so_20_01_008
6,20,34,わ、私、今日、危ない日なんです……ですから、……,sound/data/pcm/c20/h/01.unity3d,h_so_20_01_009
7,20,34,あなたがしたいなら、その、恥ずかしいですけど……,sound/data/pcm/c20/h/01.unity3d,h_so_20_01_010
8,20,34,は、激しくは、しないでくださいね……？,sound/data/pcm/c20/h/01.unity3d,h_so_20_01_011
9,20,34,お、おしりに入れられるのは、怖いんですよぉ……,sound/data/pcm/c20/h/01.unity3d,h_so_20_01_012
10,20,34,や、やっぱり、おしりは恥ずかしいですからぁ……！,sound/data/pcm/c20/h/01.unity3d,h_so_20_01_013
11,20,34,はあぁ、あなたのが、少しずつ……！,sound/data/pcm/c20/h/01.unity3d,h_so_20_01_014
12,20,34,ひあ！？　そ、そんな、いきなりぃ……！,sound/data/pcm/c20/h/01.unity3d,h_so_20_01_015
13,20,34,んう、ぅ……おしりの、中にぃ……！,sound/data/pcm/c20/h/01.unity3d,h_so_20_01_016
14,20,34,ふぇ、い、いきなりは無理で、んぐうっ！？,sound/data/pcm/c20/h/01.unity3d,h_so_20_01_017
15,20,34,ふぁ……少しずつですけど、あなたに馴染んできた気がします……,sound/data/pcm/c20/h/01.unity3d,h_so_20_01_018
16,20,34,ら、乱暴にしなくても、言ってもらえれば、入れさせてあげますよぉ……？,sound/data/pcm/c20/h/01.unity3d,h_so_20_01_021
17,20,34,はぁう……おしりの穴、裂けちゃいそうです……,sound/data/pcm/c20/h/01.unity3d,h_so_20_01_023
18,20,34,む、無理やりはいやですよぉ……！,sound/data/pcm/c20/h/01.unity3d,h_so_20_01_025
19,20,34,おしりって、本当は入れるところじゃないんですよぉ……！？,sound/data/pcm/c20/h/01.unity3d,h_so_20_01_026
20,20,34,み、見られるのは、やっぱり照れちゃいます……,sound/data/pcm/c20/h/01.unity3d,h_so_20_01_027
21,20,34,はあぁ……中で直接、大きいの、感じちゃいます……,sound/data/pcm/c20/h/01.unity3d,h_so_20_01_028
22,20,34,恥ずかしいのは変わりませんけど、つながってるだけっていうのも、いいかもしれません……,sound/data/pcm/c20/h/01.unity3d,h_so_20_01_029
23,20,34,ううぅ……おしりの感触に慣れることなんて、あるんでしょうか……,sound/data/pcm/c20/h/01.unity3d,h_so_20_01_030
24,20,34,ゆっくり、してくださいね……あんまり、激しいのじゃ、なくて……,sound/data/pcm/c20/h/01.unity3d,h_so_20_01_031
25,20,34,おしりの中、大きいので、埋められちゃってますぅ……,sound/data/pcm/c20/h/01.unity3d,h_so_20_01_032
26,20,34,ぬ、抜けちゃい、ました……,sound/data/pcm/c20/h/01.unity3d,h_so_20_01_033
27,20,34,えっと……私は、大丈夫ですよ……？,sound/data/pcm/c20/h/01.unity3d,h_so_20_01_034
28,20,34,おしりは、いいんですか？,sound/data/pcm/c20/h/01.unity3d,h_so_20_01_036
29,20,34,あ……少し、ほっとしちゃいました……,sound/data/pcm/c20/h/01.unity3d,h_so_20_01_037
30,20,34,し、したければ、強くしてくれても、いいですよ……？　少しは、慣れましたから……,sound/data/pcm/c20/h/01.unity3d,h_so_20_01_039
31,20,34,んっ、あっ、中、早く、動いて……！　これ、私も……！,sound/data/pcm/c20/h/01.unity3d,h_so_20_01_042
32,20,34,はぁ、っ……あなたの、好きなように、動いてください……！,sound/data/pcm/c20/h/01.unity3d,h_so_20_01_043
33,20,34,ど、どうですか……？　気持ちいい、ですか……？,sound/data/pcm/c20/h/01.unity3d,h_so_20_01_044
34,20,34,んうぅ……お、おしりの中ぁ……やっぱり、変な感じです……,sound/data/pcm/c20/h/01.unity3d,h_so_20_01_045
35,20,34,ふっ、あっ、わ、私のおしり、気持ち、いいですかぁ……？,sound/data/pcm/c20/h/01.unity3d,h_so_20_01_048
36,20,34,も、もう少しだけなら、激しくしても、いいですから……,sound/data/pcm/c20/h/01.unity3d,h_so_20_01_049
37,20,34,おしりの中、ずぽずぽ、されちゃってます……んああ……,sound/data/pcm/c20/h/01.unity3d,h_so_20_01_050
38,20,34,な、何だか、気持ちよくて……も、もっと、触ってみてください……,sound/data/pcm/c20/h/01.unity3d,h_so_20_01_051
39,20,34,ふあぁ……そ、そこ、いっぱい触ってください……,sound/data/pcm/c20/h/01.unity3d,h_so_20_01_053
40,20,34,そこは、んぅ、できれば、やめてほしいです……,sound/data/pcm/c20/h/01.unity3d,h_so_20_01_055
41,20,34,そこ、触りたいんですか……？　でも、その……,sound/data/pcm/c20/h/01.unity3d,h_so_20_01_057
42,20,34,ひあぁ、ゆ、ゆっくりされるの、これ、よくなっちゃいますぅ,sound/data/pcm/c20/h/01.unity3d,h_so_20_01_059
43,20,34,な、中、強くて……！　奥まで、来ちゃいますぅ……！,sound/data/pcm/c20/h/01.unity3d,h_so_20_01_062
44,20,34,お、おしり、ゆっくりでも、強いですぅ……！　ふあぁ……！,sound/data/pcm/c20/h/01.unity3d,h_so_20_01_065
45,20,34,き、気持ちいいですか？　私のおしりで、気持ちよくなって、くれてますか……？,sound/data/pcm/c20/h/01.unity3d,h_so_20_01_066
46,20,34,わ、私まで、おしりで変になっちゃいそうです……！,sound/data/pcm/c20/h/01.unity3d,h_so_20_01_067
47,20,34,お、おしりの中、あなたのが、どんどん、突いてきますぅ……ああぁ……！,sound/data/pcm/c20/h/01.unity3d,h_so_20_01_068
48,20,34,あ、あなたがそうしたいなら、もっと、おしり、激しくしてもいいですからぁ……！,sound/data/pcm/c20/h/01.unity3d,h_so_20_01_069
49,20,34,わ、私のおしり、好きになって、もらえてますか……？,sound/data/pcm/c20/h/01.unity3d,h_so_20_01_070
50,20,34,んぅっ、気持ちいいところも、触られちゃってますぅ……,sound/data/pcm/c20/h/01.unity3d,h_so_20_01_071
51,20,34,はあぁ、突かれながら、気持ちよくなっちゃうの、いいですぅ……！,sound/data/pcm/c20/h/01.unity3d,h_so_20_01_073
52,20,34,そ、そこは、その、んぅっ、いやなんですぅ……,sound/data/pcm/c20/h/01.unity3d,h_so_20_01_075
53,20,34,ご、ごめんなさい、そこ、触るのは、だめですからぁ……！,sound/data/pcm/c20/h/01.unity3d,h_so_20_01_077
54,20,34,ゆっくりなのに、どんどん、気持ちよくなっちゃってます……,sound/data/pcm/c20/h/01.unity3d,h_so_20_01_087
55,20,34,はぁっ、感じてるところ、あんまり見ないでください……,sound/data/pcm/c20/h/01.unity3d,h_so_20_01_088
56,20,34,き、気持ちいいです、気持ちよくなっちゃってますぅ……！,sound/data/pcm/c20/h/01.unity3d,h_so_20_01_089
57,20,34,ふぁぁん、あなたとのエッチ、好きになっちゃいますぅ……！,sound/data/pcm/c20/h/01.unity3d,h_so_20_01_090
58,20,34,あなたの表情、気持ちよさそうです……ふふ、うれしい……,sound/data/pcm/c20/h/01.unity3d,h_so_20_01_091
59,20,34,あ、あなたの、もっとおっきくなってます……来ちゃいそうですか……？,sound/data/pcm/c20/h/01.unity3d,h_so_20_01_092
60,20,34,わ、私の身体、好きに使って、気持ちよくなってください……！,sound/data/pcm/c20/h/01.unity3d,h_so_20_01_093
61,20,34,あ、あなたが、気持ちよさそうなだけで、私も、じーんってきちゃいます……！,sound/data/pcm/c20/h/01.unity3d,h_so_20_01_094
62,20,34,ひ、ああ……！？　おしりで、気持ちよくなっちゃいますぅ……,sound/data/pcm/c20/h/01.unity3d,h_so_20_01_095
63,20,34,はあぁ……おしりは、変態だから、だめなんですぅ……！,sound/data/pcm/c20/h/01.unity3d,h_so_20_01_096
64,20,34,おしり、激しく突かれて、頭、おかしくなっちゃいますぅ……！,sound/data/pcm/c20/h/01.unity3d,h_so_20_01_097
65,20,34,す、少しだけ、、おしり、ゆっくり……ふああああ！　強いですうぅぅ！,sound/data/pcm/c20/h/01.unity3d,h_so_20_01_098
66,20,34,わ、私のおしり、気持ちいいなら、もっと使っていいですぅ……！,sound/data/pcm/c20/h/01.unity3d,h_so_20_01_099
67,20,34,んああ……おしりの中、あなたので、焼けるように、熱いですぅ……,sound/data/pcm/c20/h/01.unity3d,h_so_20_01_100
68,20,34,はああぁ、もっと、強くぅ……おしり、めちゃくちゃになっちゃいますぅ……！,sound/data/pcm/c20/h/01.unity3d,h_so_20_01_101
69,20,34,あ、あなたの、まだ、おっきくなって……！　おしり、裂けちゃいますぅ……！,sound/data/pcm/c20/h/01.unity3d,h_so_20_01_102
70,20,34,わ、私だけ気持ちよくなってごめんなさいっ、ふ、あああ……！,sound/data/pcm/c20/h/01.unity3d,h_so_20_01_103
71,20,34,で、できれば顔、見ないでくださいぃ……はあああん……！,sound/data/pcm/c20/h/01.unity3d,h_so_20_01_104
72,20,34,お、お願いです、私と、一緒にぃ……！　ひっ、あああああ！,sound/data/pcm/c20/h/01.unity3d,h_so_20_01_105
73,20,34,あ、あはぁ、あなたと、一緒……！　ああっ、はあああん！,sound/data/pcm/c20/h/01.unity3d,h_so_20_01_106
74,20,34,は、はいっ、私の中に、いっぱい、ください……！,sound/data/pcm/c20/h/01.unity3d,h_so_20_01_107
75,20,34,す、好きなだけ、あなたの精液、私の中、出してください……！,sound/data/pcm/c20/h/01.unity3d,h_so_20_01_108
76,20,34,っ、はぁっ、そ、外の、どこに、出したいですか……？,sound/data/pcm/c20/h/01.unity3d,h_so_20_01_109
77,20,34,ひぁ、はぁっ、はい、たくさん、出してください……！,sound/data/pcm/c20/h/01.unity3d,h_so_20_01_110
78,20,34,あ、あなたの、ぷくって、膨らんで……今にも、出ちゃいそうです……！,sound/data/pcm/c20/h/01.unity3d,h_so_20_01_111
79,20,34,は、ぁ、もっと、強くっ……！　ふふ、もう、出したいんですか……？,sound/data/pcm/c20/h/01.unity3d,h_so_20_01_112
80,20,34,ふぁあああ、つ、強いですぅ、ひああっ……！,sound/data/pcm/c20/h/01.unity3d,h_so_20_01_113
81,20,34,ご、ゴムがあるんですから、最後まで、私で気持ちよくなってください……！,sound/data/pcm/c20/h/01.unity3d,h_so_20_01_114
82,20,34,お、おしりもうっ、こんなの、む、無理ですぅ……！　ひ、ああああ……！,sound/data/pcm/c20/h/01.unity3d,h_so_20_01_115
83,20,34,お、おしり、イっちゃ、恥ずかしいのにぃ……！はあああ……！,sound/data/pcm/c20/h/01.unity3d,h_so_20_01_116
84,20,34,おしり、つ、強いですうぅ……！　あ、あなたも、一緒にぃ……！,sound/data/pcm/c20/h/01.unity3d,h_so_20_01_117
85,20,34,わ、私、あなたに、変態にされちゃいますぅ……！　あああああん！,sound/data/pcm/c20/h/01.unity3d,h_so_20_01_118
86,20,34,は、はい……おしりの中なら、平気ですから……！,sound/data/pcm/c20/h/01.unity3d,h_so_20_01_119
87,20,34,わ、私のおしり、好きに使ってくださいぃ……,sound/data/pcm/c20/h/01.unity3d,h_so_20_01_120
88,20,34,な、中に……き、きてますっ……いっぱいきてますぅぅぅっ……！,sound/data/pcm/c20/h/01.unity3d,h_so_20_01_121
89,20,34,ふあああ……！　な、中にいっぱい、びゅうって、来てますぅ……！,sound/data/pcm/c20/h/01.unity3d,h_so_20_01_122
90,20,34,んんんぅっ……！　わ、私で、ちゃんとイってくれましたか？,sound/data/pcm/c20/h/01.unity3d,h_so_20_01_123
91,20,34,はぁぁん……ゴムの中で、あなたの、暴れてますね……,sound/data/pcm/c20/h/01.unity3d,h_so_20_01_124
92,20,34,お、おしりの奥に、びゅるびゅるぅ……！　ひうぅ……！,sound/data/pcm/c20/h/01.unity3d,h_so_20_01_125
93,20,34,ふうぅ……お、おしりの奥、どろっとしてて、熱いですぅ……,sound/data/pcm/c20/h/01.unity3d,h_so_20_01_126
94,20,34,とっても、よかったです……あなたは、どうでしたか？,sound/data/pcm/c20/h/01.unity3d,h_so_20_01_131
95,20,34,その……ゴム、なしというのも……あ、いえ……！,sound/data/pcm/c20/h/01.unity3d,h_so_20_01_132
96,20,34,あなたに気持ちよくしてもらえるの、幸せです……,sound/data/pcm/c20/h/01.unity3d,h_so_20_01_133
97,20,34,一緒にイくって、いいですね……えへへ……,sound/data/pcm/c20/h/01.unity3d,h_so_20_01_134
98,20,34,あなたの生の感触が、私の中に、焼きついてるみたいです……,sound/data/pcm/c20/h/01.unity3d,h_so_20_01_135
99,20,34,はぁ……お腹の中、あなたが出したのでぽかぽかします……,sound/data/pcm/c20/h/01.unity3d,h_so_20_01_136
100,20,34,私が、あなたを気持ちよくするつもりでしたのに……,sound/data/pcm/c20/h/01.unity3d,h_so_20_01_137
101,20,34,イったところ、見られるの、恥ずかしいですよぅ……,sound/data/pcm/c20/h/01.unity3d,h_so_20_01_138
102,20,34,一緒なのはいいですけど、また、おしりで……,sound/data/pcm/c20/h/01.unity3d,h_so_20_01_139
103,20,34,恥ずかしいですけど、私の身体で気持ちよくなってくれたのは、うれしいです……,sound/data/pcm/c20/h/01.unity3d,h_so_20_01_140
104,20,34,うぅ……また、おしりでイっちゃいました……,sound/data/pcm/c20/h/01.unity3d,h_so_20_01_141
105,20,34,お、おしりでイったところなんて、見られたく、ないんですよ……？,sound/data/pcm/c20/h/01.unity3d,h_so_20_01_142
106,20,34,ご、ゴム、つけてたのに、頭が白くなっちゃいました……,sound/data/pcm/c20/h/01.unity3d,h_so_20_01_143
107,20,34,気持ちよすぎて、全然、ドキドキが収まりません,sound/data/pcm/c20/h/01.unity3d,h_so_20_01_144
108,20,34,ちょっと、エッチが怖くなるくらい、気持ちよくなっちゃいました,sound/data/pcm/c20/h/01.unity3d,h_so_20_01_145
109,20,34,い、一緒にイった後って、照れちゃいますね……,sound/data/pcm/c20/h/01.unity3d,h_so_20_01_146
110,20,34,あれだけ激しくイったら、元気な赤ちゃんのもとが出てそうですね……,sound/data/pcm/c20/h/01.unity3d,h_so_20_01_147
111,20,34,あ、危ない日なのが、スリルになっちゃいそうです……,sound/data/pcm/c20/h/01.unity3d,h_so_20_01_148
112,20,34,あ、あなたの前で、こんな……恥ずかしいです……,sound/data/pcm/c20/h/01.unity3d,h_so_20_01_149
113,20,34,また次も、こんなに気持ちよくされちゃったら、どうしましょう……,sound/data/pcm/c20/h/01.unity3d,h_so_20_01_150
114,20,34,二人でイけるなら、おしりも、悪くないです……,sound/data/pcm/c20/h/01.unity3d,h_so_20_01_151
115,20,34,私たち、おしりで、あんなに乱れて……変態になっちゃってますね……,sound/data/pcm/c20/h/01.unity3d,h_so_20_01_152
116,20,34,ど、どんどん、おしりが、気持ちよくなちゃってます……,sound/data/pcm/c20/h/01.unity3d,h_so_20_01_153
117,20,34,あ、あなたに開発されてるみたいで、怖いですけど、その……,sound/data/pcm/c20/h/01.unity3d,h_so_20_01_154
118,20,34,ゴムの中、どれくらいの量が出たんでしょう,sound/data/pcm/c20/h/01.unity3d,h_so_20_01_155
119,20,34,あなたをイかせられると、何だか、達成感を感じちゃうんです,sound/data/pcm/c20/h/01.unity3d,h_so_20_01_156
120,20,34,ふふ……あなたを気持ちよくできると、私もうれしいです,sound/data/pcm/c20/h/01.unity3d,h_so_20_01_157
121,20,34,私の中、そんなによかったですか？　えへへ,sound/data/pcm/c20/h/01.unity3d,h_so_20_01_158
122,20,34,私のお腹、あなたの赤ちゃんのもとが泳いでるんでしょうか……,sound/data/pcm/c20/h/01.unity3d,h_so_20_01_159
123,20,34,あなたに中で出されると、それだけで、うれしくなっちゃうんです……,sound/data/pcm/c20/h/01.unity3d,h_so_20_01_160
124,20,34,後で、その、使ったゴムを見せてもらっても、いいですか……？,sound/data/pcm/c20/h/01.unity3d,h_so_20_01_161
125,20,34,ゴムつけてても、気持ちいいですか？　私は、もちろん気持ちいいです,sound/data/pcm/c20/h/01.unity3d,h_so_20_01_162
126,20,34,胸の奥がぽわぽわして、幸せな感じがします……,sound/data/pcm/c20/h/01.unity3d,h_so_20_01_163
127,20,34,あなたがイったのを実感できるから、中出しって好きです……,sound/data/pcm/c20/h/01.unity3d,h_so_20_01_164
128,20,34,その……危険日でも生でしちゃうエッチな子って、好き、ですか？,sound/data/pcm/c20/h/01.unity3d,h_so_20_01_165
129,20,34,あなたが出したので、お腹の中、ぽかぽかします……,sound/data/pcm/c20/h/01.unity3d,h_so_20_01_166
130,20,34,次は、あなたを気持ちよくさせられるよう、頑張ります,sound/data/pcm/c20/h/01.unity3d,h_so_20_01_167
131,20,34,その……まだ、あなたが満足できてないなら、言ってくださいね？,sound/data/pcm/c20/h/01.unity3d,h_so_20_01_168
132,20,34,私のおしり、気に入ってもらえてるんでしょうか？,sound/data/pcm/c20/h/01.unity3d,h_so_20_01_169
133,20,34,恥ずかしいのは変わらないんですけど、その、気持ちいいのも……,sound/data/pcm/c20/h/01.unity3d,h_so_20_01_170
134,20,34,あなたに喜んでもらえるなら、おしりでも、また頑張ります,sound/data/pcm/c20/h/01.unity3d,h_so_20_01_171
135,20,34,ふふ、びゅーびゅーって、いっぱい出ましたね……,sound/data/pcm/c20/h/01.unity3d,h_so_20_01_172
136,20,34,量もですけど、すごい勢いで出ちゃってます……,sound/data/pcm/c20/h/01.unity3d,h_so_20_01_173
137,20,34,んっ……えへへ、これがあなたの匂い……,sound/data/pcm/c20/h/01.unity3d,h_so_20_01_174
138,20,34,あなたは、外と中、どっちに出すのが好きですか？,sound/data/pcm/c20/h/01.unity3d,h_so_20_01_175
139,20,34,ふふ……これ、熱くて、どろどろで、ねばねばです……,sound/data/pcm/c20/h/01.unity3d,h_so_20_01_176
140,20,34,ふぁ……やっぱり、こぼれてきちゃいました……,sound/data/pcm/c20/h/01.unity3d,h_so_20_01_177
141,20,34,入りきらなくなるくらい、いっぱい出してくれたんですよね……えへへ,sound/data/pcm/c20/h/01.unity3d,h_so_20_01_178
142,20,34,おしりの穴から、白いの、流れちゃってます……,sound/data/pcm/c20/h/01.unity3d,h_so_20_01_179
143,20,34,お、おしり、見ちゃだめです。恥ずかしいんですから……,sound/data/pcm/c20/h/01.unity3d,h_so_20_01_180
144,20,34,激しくなってきましたぁっ,sound/data/pcm/c20/h/01.unity3d,h_so_20_01_250
145,20,34,もっと、早くなっちゃってますぅ,sound/data/pcm/c20/h/01.unity3d,h_so_20_01_251
146,20,34,私の中を、ゴムがこすってますぅ,sound/data/pcm/c20/h/01.unity3d,h_so_20_01_252
147,20,34,さっきよりゴムの感触強いですぅ,sound/data/pcm/c20/h/01.unity3d,h_so_20_01_253
