管理番号,大きい項目,中間項目,表示名,バンドルパス,ファイル名
147,21,54,やっぱり、危ない日に一番奥で出してもらうのが一番興奮しちゃう♡　キミにゾッコンラブだから♡,sound/data/pcm/c21/h/01.unity3d,h_so_21_03_148
148,21,54,はぁ、はぁ……ごめんね、私だけ先にイッちゃった。２回目する？　それとも、しゃぶっちゃう？,sound/data/pcm/c21/h/01.unity3d,h_so_21_03_149
149,21,54,キミのおちんぽって、本当に私をイカすのが得意だよね♡　特技に書いてもいいぐらい♡,sound/data/pcm/c21/h/01.unity3d,h_so_21_03_150
150,21,54,お尻でイキまくっちゃうカップルなんてエッチすぎだよね,sound/data/pcm/c21/h/01.unity3d,h_so_21_03_151
151,21,54,二人でビクーンってイッちゃったね♡　今度は、おまんこにバイブを入れながらアナルファックしちゃう？　んふふ♡,sound/data/pcm/c21/h/01.unity3d,h_so_21_03_152
152,21,54,キミのお陰でアナルをいじるのがクセになっちゃったんだよぉ♡　付き合いたての私が見たらびっくりしちゃうだろうね,sound/data/pcm/c21/h/01.unity3d,h_so_21_03_153
153,21,54,気持ちよすぎだよぉ♡　もう、一日中ずっとお尻の穴におちんちんをねじ込んでおきたいぐらい♡,sound/data/pcm/c21/h/01.unity3d,h_so_21_03_154
154,21,54,えへへ、私の中、気持ちよかった？　ゴムは誰もいなさそーな教室のゴミ箱にポイしようね,sound/data/pcm/c21/h/01.unity3d,h_so_21_03_155
155,21,54,そういえば、そろそろコンドーム切れるよぉ。今度は一緒に選んじゃう？　んふふ♡,sound/data/pcm/c21/h/01.unity3d,h_so_21_03_156
156,21,54,なんだか、中だししてもらったのにイケないのって損した気分。もう１回、できるよね？,sound/data/pcm/c21/h/01.unity3d,h_so_21_03_157
157,21,54,おちんぽもまんこもドロドロになっちゃったね♡　お掃除フェラしなくて平気？,sound/data/pcm/c21/h/01.unity3d,h_so_21_03_158
158,21,54,危ない日にゴムなしでHするときのキミって野性味がすごいんだよね……え？　褒めてるんだよ♡,sound/data/pcm/c21/h/01.unity3d,h_so_21_03_159
159,21,54,えへへ、迷いなく危険日マンコに射精するキミの顔、男の子の顔だったよ～♡,sound/data/pcm/c21/h/01.unity3d,h_so_21_03_160
160,21,54,はじめのときはゴムがキツくて痛かったけど、今はいっつも大洪水だから、全然そんなことなくなっちゃった♡　エッチだね、私って♡,sound/data/pcm/c21/h/01.unity3d,h_so_21_03_161
161,21,54,キミの射精の勢いが強すぎて、コンドームごと精液が子宮の中に入ってきちゃえばよかったのに♡　なーんて♡,sound/data/pcm/c21/h/01.unity3d,h_so_21_03_162
162,21,54,今日が安全日ってわかると、ついキミとのゴムなしエッチを想像しちゃうんだよ……私、おかしいかな、ふふっ,sound/data/pcm/c21/h/01.unity3d,h_so_21_03_163
163,21,54,もし私たちが夫婦になったら、今日みたいなラブラブ絶頂セックスを毎晩するのかなぁ♡,sound/data/pcm/c21/h/01.unity3d,h_so_21_03_164
164,21,54,ねね、赤ちゃんの名前考える？　あ、でもまだ性別が分からないか,sound/data/pcm/c21/h/01.unity3d,h_so_21_03_165
165,21,54,もしかしたら、今までで一番気持ちよかったかも……危険日中だしって、色々な意味でキケンだね、ふふっ,sound/data/pcm/c21/h/01.unity3d,h_so_21_03_166
166,21,54,ごめんね、私が先に気持ちよくなっちゃった……次はうんとサービスしてあげるから、楽しみにしてて,sound/data/pcm/c21/h/01.unity3d,h_so_21_03_167
167,21,54,二人でイきたいってずっと我慢してたけど、キミのチンポ連打には勝てなかったよぉ♡,sound/data/pcm/c21/h/01.unity3d,h_so_21_03_168
168,21,54,んふふ、アナル中出しは仲良しカップルの証だよ～♪　これからもエッチな私を可愛がってね♪,sound/data/pcm/c21/h/01.unity3d,h_so_21_03_169
169,21,54,不思議だよね……普段は普通のお尻の穴なのに、キミのオチンポを見ると、すぐふやけちゃうの♡,sound/data/pcm/c21/h/01.unity3d,h_so_21_03_170
170,21,54,今日もたっくさんお尻の穴に出したね♡　いつか、精液のうんちが出ちゃいそう♡,sound/data/pcm/c21/h/01.unity3d,h_so_21_03_171
171,21,54,ああっ、すごい、すごいよぉ……オチンチンって、何でこんなスケベな形してるのかなぁ、おマンコに毒だよぉ♡,sound/data/pcm/c21/h/01.unity3d,h_so_21_03_172
172,21,54,私にずっぽりハマってたおチンポ美味しそう♡　ねね、舐めてもいい？,sound/data/pcm/c21/h/01.unity3d,h_so_21_03_173
173,21,54,ふふふ……たまには外だしもいいね……これが普段私の中に発射されてると思うと、ブルブルしちゃう,sound/data/pcm/c21/h/01.unity3d,h_so_21_03_174
174,21,54,精液のにおいを直接嗅いで、またムラムラしてきちゃった♡　ねえ、もう一回だけしよ♡　ね？　ね？,sound/data/pcm/c21/h/01.unity3d,h_so_21_03_175
175,21,54,はぁん、ほかほかのチンポ美味しそう♡　ねね、フェラチオしよっか♡　キミも満足するような、すんごいフェラ♡,sound/data/pcm/c21/h/01.unity3d,h_so_21_03_176
176,21,54,んっ、垂れて来ちゃった……ふふ、もっとよく見たい？,sound/data/pcm/c21/h/01.unity3d,h_so_21_03_177
177,21,54,見てぇ♡　キミの快感汁が垂れてくるよ♡　私の中でこんなに気持ちよくなってくれてありがとう♡,sound/data/pcm/c21/h/01.unity3d,h_so_21_03_178
178,21,54,えへへ……わざとじゃないよ？　油断しちゃったら、たらって出てきちゃった,sound/data/pcm/c21/h/01.unity3d,h_so_21_03_179
179,21,54,アナルから精液が垂れるところ見たかったんでしょ？　ほら、お尻のしわが数えられるぐらい近くでよぉ～く見て♡　,sound/data/pcm/c21/h/01.unity3d,h_so_21_03_180
180,21,54,んっ、まだ疼いちゃってる…きて…,sound/data/pcm/c21/h/01.unity3d,h_so_21_03_181
181,21,54,まだできるの？　んふふ、格好いいんだからぁ♡,sound/data/pcm/c21/h/01.unity3d,h_so_21_03_182
182,21,54,うんっ、キミのオチンポほしくてたまらないよぉ,sound/data/pcm/c21/h/01.unity3d,h_so_21_03_183
183,21,54,イキたてのほかほかオチンポごちそうしてぇ♡,sound/data/pcm/c21/h/01.unity3d,h_so_21_03_184
184,21,54,私もしたいけど、ダメなのぉ,sound/data/pcm/c21/h/01.unity3d,h_so_21_03_185
185,21,54,キミがそこまで言うなら……ううん、ダメ。我慢我慢,sound/data/pcm/c21/h/01.unity3d,h_so_21_03_186
186,21,54,キミとは安心してエッチしたいのぉ,sound/data/pcm/c21/h/01.unity3d,h_so_21_03_187
187,21,54,生の方が気持ちいいのはわかるけど、今日はダメなの,sound/data/pcm/c21/h/01.unity3d,h_so_21_03_188
188,21,54,お尻、クセになっちゃったの？　えへへ,sound/data/pcm/c21/h/01.unity3d,h_so_21_03_189
189,21,54,また？　んふふ、私の好きな人のヒントはアナル好きだね,sound/data/pcm/c21/h/01.unity3d,h_so_21_03_190
190,21,54,私が道を踏み外しちゃいそうだからダーメ,sound/data/pcm/c21/h/01.unity3d,h_so_21_03_191
191,21,54,今日はちょっと敏感すぎるからまた今度ね♡,sound/data/pcm/c21/h/01.unity3d,h_so_21_03_192
192,21,54,さっきイッちゃったから、おまんこキツキツになってるね,sound/data/pcm/c21/h/01.unity3d,h_so_21_03_193
193,21,54,おちんぽ、おかえりぃ♡,sound/data/pcm/c21/h/01.unity3d,h_so_21_03_194
194,21,54,動いてぇ、奥突いてぇ,sound/data/pcm/c21/h/01.unity3d,h_so_21_03_195
195,21,54,もうピッタリフィットしてるね,sound/data/pcm/c21/h/01.unity3d,h_so_21_03_196
196,21,54,イッたばっかりなのに、カチカチぃ,sound/data/pcm/c21/h/01.unity3d,h_so_21_03_197
197,21,54,お尻の穴いっぱいほじってぇ,sound/data/pcm/c21/h/01.unity3d,h_so_21_03_198
198,21,54,イッたばっかりでこんなガチガチなんだ。お尻だから？,sound/data/pcm/c21/h/01.unity3d,h_so_21_03_199
199,21,54,やっぱりアナル弱いぃっ,sound/data/pcm/c21/h/01.unity3d,h_so_21_03_200
200,21,54,いきなりアナルに突っ込まれるの好きぃ♡,sound/data/pcm/c21/h/01.unity3d,h_so_21_03_201
201,21,54,このままでもイッちゃいそう,sound/data/pcm/c21/h/01.unity3d,h_so_21_03_202
202,21,54,ここからどんなスケベなことしてくれるの？　んふふ,sound/data/pcm/c21/h/01.unity3d,h_so_21_03_203
203,21,54,ちょっと苦しいのがたまらないのぉ,sound/data/pcm/c21/h/01.unity3d,h_so_21_03_204
204,21,54,私のお尻の穴、まだまだキツキツだよぉ,sound/data/pcm/c21/h/01.unity3d,h_so_21_03_205
205,21,54,いいよ、なんでも好きにして,sound/data/pcm/c21/h/01.unity3d,h_so_21_03_206
206,21,54,んふふ、それからそれから？,sound/data/pcm/c21/h/01.unity3d,h_so_21_03_207
207,21,54,引き抜くときカリが当たるの好きぃ,sound/data/pcm/c21/h/01.unity3d,h_so_21_03_208
208,21,54,ぽっかり空いたところから腸液垂れちゃうぅ♡,sound/data/pcm/c21/h/01.unity3d,h_so_21_03_209
209,21,54,ネットリ責めてぇっ,sound/data/pcm/c21/h/01.unity3d,h_so_21_03_210
210,21,54,優しいピストン好きぃ,sound/data/pcm/c21/h/01.unity3d,h_so_21_03_211
211,21,54,それ好きぃ、ゴリゴリ擦ってぇえ,sound/data/pcm/c21/h/01.unity3d,h_so_21_03_212
212,21,54,さっきいっぱいしたから気遣ってくれてるの？,sound/data/pcm/c21/h/01.unity3d,h_so_21_03_213
213,21,54,お尻が締まっちゃうのわかるよぉ,sound/data/pcm/c21/h/01.unity3d,h_so_21_03_214
214,21,54,またいっぱいお尻犯してぇ♡,sound/data/pcm/c21/h/01.unity3d,h_so_21_03_215
215,21,54,速いのすきぃ、もっとずぼずぼしてぇっ,sound/data/pcm/c21/h/01.unity3d,h_so_21_03_216
216,21,54,お尻かき混ぜられちゃってるぅ,sound/data/pcm/c21/h/01.unity3d,h_so_21_03_217
217,21,54,あぁっもうダメになっちゃうぅ、オチンポにダメにされちゃうぅ,sound/data/pcm/c21/h/01.unity3d,h_so_21_03_218
218,21,54,おちんぽが私の生き甲斐になっちゃうぅ♡,sound/data/pcm/c21/h/01.unity3d,h_so_21_03_219
219,21,54,キミのデカペニス好きぃっ、大好きぃっ,sound/data/pcm/c21/h/01.unity3d,h_so_21_03_220
220,21,54,ガツガツ突かれるたびに軽くイッてるよぉっ♡,sound/data/pcm/c21/h/01.unity3d,h_so_21_03_221
221,21,54,私のアナル、すっかりエッチな穴にされちゃってるぅ♡,sound/data/pcm/c21/h/01.unity3d,h_so_21_03_222
222,21,54,何度掘られてもキツキツのお尻突きほぐしてぇ♡,sound/data/pcm/c21/h/01.unity3d,h_so_21_03_223
223,21,54,ガツガツほじられるの好きぃ、もっとホジホジしてぇっ,sound/data/pcm/c21/h/01.unity3d,h_so_21_03_224
224,21,54,お尻がヤケドしちゃうぅうう♡,sound/data/pcm/c21/h/01.unity3d,h_so_21_03_225
225,21,54,もうだめえ、さっきよりすごいの来ちゃうぅ♡,sound/data/pcm/c21/h/01.unity3d,h_so_21_03_226
226,21,54,オチンポの熱で溶けちゃうー♡,sound/data/pcm/c21/h/01.unity3d,h_so_21_03_227
227,21,54,もうチンチンのことしか考えられないぃっ,sound/data/pcm/c21/h/01.unity3d,h_so_21_03_228
228,21,54,恥ずかしいぐらいビクビクってイッちゃうぅ♡　,sound/data/pcm/c21/h/01.unity3d,h_so_21_03_229
229,21,54,もう１回出してぇっ、出したいって顔に書いてあるよぉっ,sound/data/pcm/c21/h/01.unity3d,h_so_21_03_230
230,21,54,ダメ押しの濃厚射精してぇっ♡,sound/data/pcm/c21/h/01.unity3d,h_so_21_03_231
231,21,54,キミのイキそうな声で私もゾクゾクしちゃうぅっ♡,sound/data/pcm/c21/h/01.unity3d,h_so_21_03_232
232,21,54,さっきよりピストンすごいぃっ♡,sound/data/pcm/c21/h/01.unity3d,h_so_21_03_233
233,21,54,ゆっくりホジるのだめぇんっ、おかしくなっちゃううっ,sound/data/pcm/c21/h/01.unity3d,h_so_21_03_234
234,21,54,もうみんなにお尻ほじりが好きな子って隠すの難しいよぉ,sound/data/pcm/c21/h/01.unity3d,h_so_21_03_235
235,21,54,アナルほじほじすごいぃっ、もうメロメロぉっ,sound/data/pcm/c21/h/01.unity3d,h_so_21_03_236
236,21,54,さっきよりもすんごいケツアクメ来ちゃうぅ♡,sound/data/pcm/c21/h/01.unity3d,h_so_21_03_237
237,21,54,何回イッても萎えない絶倫チンポでお尻いっぱい犯してぇっ,sound/data/pcm/c21/h/01.unity3d,h_so_21_03_238
238,21,54,もう一回お尻に精液ちょうだぁい♡,sound/data/pcm/c21/h/01.unity3d,h_so_21_03_239
239,21,54,お尻壊してぇっ、何度使っても気持ちいいキミ専用のアナルにしてぇっ,sound/data/pcm/c21/h/01.unity3d,h_so_21_03_240
240,21,54,んふふ、きゅんきゅんアナル気持ちいい？,sound/data/pcm/c21/h/01.unity3d,h_so_21_03_241
241,21,54,そこいっぱい擦ってぇっ、もうイク、イクっっ,sound/data/pcm/c21/h/01.unity3d,h_so_21_03_242
242,21,54,ああああダメっイック、イクイクイクぅっ♡,sound/data/pcm/c21/h/01.unity3d,h_so_21_03_243
243,21,54,二人でガクガクアクメきめたいよぉ♡,sound/data/pcm/c21/h/01.unity3d,h_so_21_03_244
244,21,54,スケベ同士、思いっきりイッちゃおぉ♡,sound/data/pcm/c21/h/01.unity3d,h_so_21_03_245
245,21,54,きてぇっ、キミが開発したエッチな身体で思いっきり射精してぇっ,sound/data/pcm/c21/h/01.unity3d,h_so_21_03_246
246,21,54,うんっ出して♡　キミの精子ずぅっと待ってたんだよぉ♡,sound/data/pcm/c21/h/01.unity3d,h_so_21_03_247
247,21,54,いいよ、私にぶっかけてぇっ、さっきよりもたくさん出してぇ,sound/data/pcm/c21/h/01.unity3d,h_so_21_03_248
248,21,54,ビクビク痙攣するオチンチン見せつけてぇ♡,sound/data/pcm/c21/h/01.unity3d,h_so_21_03_249
249,21,54,ピストンに必死になってるキミえろすぎるよぉっ♡,sound/data/pcm/c21/h/01.unity3d,h_so_21_03_250
250,21,54,何も言わなくてもキミがイキそうなのわかるよぉ♡,sound/data/pcm/c21/h/01.unity3d,h_so_21_03_251
251,21,54,愛液まみれのぬるぬるゴムチンポで突きまくってぇ♡,sound/data/pcm/c21/h/01.unity3d,h_so_21_03_252
252,21,54,精液たぷたぷチンポ大きすぎて、ゴムがパツパツになってるよぉ♡,sound/data/pcm/c21/h/01.unity3d,h_so_21_03_253
253,21,54,大好きな男の子にアナルでイカされちゃううっ♡,sound/data/pcm/c21/h/01.unity3d,h_so_21_03_254
254,21,54,さっきより強くほじほじされてもう限界ぃ♡,sound/data/pcm/c21/h/01.unity3d,h_so_21_03_255
255,21,54,私のアナル、キミと一緒にイキたいってヒクついてるぅっ,sound/data/pcm/c21/h/01.unity3d,h_so_21_03_256
256,21,54,また一緒にケツアクメしよぉ♡,sound/data/pcm/c21/h/01.unity3d,h_so_21_03_257
257,21,54,私のエッチなアナルでよかったら何回でも出してぇっ,sound/data/pcm/c21/h/01.unity3d,h_so_21_03_258
258,21,54,来てぇ♡　一番奥でケツマンコ射精ひてぇっ♡,sound/data/pcm/c21/h/01.unity3d,h_so_21_03_259
259,21,54,あんなに出したのにまだたくさん出てるぅ♡,sound/data/pcm/c21/h/01.unity3d,h_so_21_03_260
260,21,54,タマタマが空っぽになるまで射精してるよぉ♡,sound/data/pcm/c21/h/01.unity3d,h_so_21_03_261
261,21,54,すごい量……ゴムが破裂しないか心配、ふふっ,sound/data/pcm/c21/h/01.unity3d,h_so_21_03_262
262,21,54,プリプリの精液風船、さっきより膨らんでるぅ♡,sound/data/pcm/c21/h/01.unity3d,h_so_21_03_263
263,21,54,アナルお注射いいのぉっ♡,sound/data/pcm/c21/h/01.unity3d,h_so_21_03_264
264,21,54,お尻が幸せぇ♡,sound/data/pcm/c21/h/01.unity3d,h_so_21_03_265
265,21,54,落ちちゃうぅううっっ♪,sound/data/pcm/c21/h/01.unity3d,h_so_21_03_266
266,21,54,おちんぽぉおっ♡,sound/data/pcm/c21/h/01.unity3d,h_so_21_03_267
267,21,54,帰ってこれなくなっちゃうぅう♪,sound/data/pcm/c21/h/01.unity3d,h_so_21_03_268
268,21,54,ちんぽイイィ♡　ちんぽちんぽちんぽぉ♡,sound/data/pcm/c21/h/01.unity3d,h_so_21_03_269
269,21,54,最初はゴムって嫌いだったけど、キミと一緒ならゴムイキするのもいいなって,sound/data/pcm/c21/h/01.unity3d,h_so_21_03_270
270,21,54,ゴムアクメ気持ちいいよぉ♡,sound/data/pcm/c21/h/01.unity3d,h_so_21_03_271
271,21,54,キミと一緒にイケた日はエッチな夢を見ちゃうんだよぉ♡,sound/data/pcm/c21/h/01.unity3d,h_so_21_03_272
272,21,54,二人同時って、何度イッても気持ちいいね,sound/data/pcm/c21/h/01.unity3d,h_so_21_03_273
273,21,54,えへへ、今のキミの顔、すっごくエッチだよ,sound/data/pcm/c21/h/01.unity3d,h_so_21_03_274
274,21,54,キミの赤ちゃんなら、できてもいいよ♡,sound/data/pcm/c21/h/01.unity3d,h_so_21_03_275
275,21,54,やっぱりキミとの相性は抜群だね♡,sound/data/pcm/c21/h/01.unity3d,h_so_21_03_276
276,21,54,うれし涙が出るぐらいイッちゃったぁ♡,sound/data/pcm/c21/h/01.unity3d,h_so_21_03_277
277,21,54,アナルでもビクンッて痙攣しちゃうんだよね、変態街道まっしぐらだ～,sound/data/pcm/c21/h/01.unity3d,h_so_21_03_278
278,21,54,お尻の穴ってなんでこんな気持ちいいんだろぉ♡,sound/data/pcm/c21/h/01.unity3d,h_so_21_03_279
279,21,54,も、もっとお尻でイカせてほしいな,sound/data/pcm/c21/h/01.unity3d,h_so_21_03_280
280,21,54,ねね、もう一回…お尻、だめ？,sound/data/pcm/c21/h/01.unity3d,h_so_21_03_281
281,21,54,ゴムのキュッキュって感覚だけでまたイッちゃいそう,sound/data/pcm/c21/h/01.unity3d,h_so_21_03_282
282,21,54,もうコンドームのにおいだけでイケちゃうよぉ♡,sound/data/pcm/c21/h/01.unity3d,h_so_21_03_283
283,21,54,ゴムをつけてするのって、生の気持ちよさにびっくりするためなところあるよねぇ,sound/data/pcm/c21/h/01.unity3d,h_so_21_03_284
284,21,54,キミの生おちんちん、今日も気持ちよかったよぉ♡,sound/data/pcm/c21/h/01.unity3d,h_so_21_03_285
285,21,54,もうゴム、いらないかなぁ？,sound/data/pcm/c21/h/01.unity3d,h_so_21_03_286
286,21,54,生でイクために学校来てるかもぉ♡,sound/data/pcm/c21/h/01.unity3d,h_so_21_03_287
287,21,54,なんか、キミとの思い出が頭の中で弾けちゃった……,sound/data/pcm/c21/h/01.unity3d,h_so_21_03_288
288,21,54,また一人でイッちゃったよぉ♡,sound/data/pcm/c21/h/01.unity3d,h_so_21_03_289
289,21,54,もしかしたらオマンコで一緒にイクより気持ちいいかもぉ,sound/data/pcm/c21/h/01.unity3d,h_so_21_03_290
290,21,54,きっと今うんちしたらイッちゃうよぉ♡,sound/data/pcm/c21/h/01.unity3d,h_so_21_03_291
291,21,54,もう毎日お尻エッチしたいぐらい♡,sound/data/pcm/c21/h/01.unity3d,h_so_21_03_292
292,21,54,こんなにされたら、家でもお尻オナニーしちゃうかも♡,sound/data/pcm/c21/h/01.unity3d,h_so_21_03_293
293,21,54,私がもっとエロくなったら、もっと中だししてくれるのかなぁ？,sound/data/pcm/c21/h/01.unity3d,h_so_21_03_294
294,21,54,ねね、ゴムもう一箱あるけど、まだしちゃう？,sound/data/pcm/c21/h/01.unity3d,h_so_21_03_295
295,21,54,またイッちゃったね……生だから？　うふふっ,sound/data/pcm/c21/h/01.unity3d,h_so_21_03_296
296,21,54,何度も射精できるのって頼もしいよね♡,sound/data/pcm/c21/h/01.unity3d,h_so_21_03_297
297,21,54,さっき出したばっかりなのに、凄い量……,sound/data/pcm/c21/h/01.unity3d,h_so_21_03_298
298,21,54,私の中で精子がピチピチしてるのわかるよぉ,sound/data/pcm/c21/h/01.unity3d,h_so_21_03_299
299,21,54,ゴムのさきっぽの袋が子宮にタプタプしてくるぅ,sound/data/pcm/c21/h/01.unity3d,h_so_21_03_300
300,21,54,ゴムに溜まった精液、飲んじゃおうかなぁ♡,sound/data/pcm/c21/h/01.unity3d,h_so_21_03_301
301,21,54,オマンコがプリプリの精液でいっぱいになってるぅ,sound/data/pcm/c21/h/01.unity3d,h_so_21_03_302
302,21,54,こんなに幸せでいいのかなぁ♡,sound/data/pcm/c21/h/01.unity3d,h_so_21_03_303
303,21,54,慣れてきたから、最後は私も腰振っちゃったぁ♡,sound/data/pcm/c21/h/01.unity3d,h_so_21_03_304
304,21,54,やっぱり危険日ゴムなしセックスって何度もしちゃうよね♡,sound/data/pcm/c21/h/01.unity3d,h_so_21_03_305
305,21,54,じゃあ、次はキミがイク番ね♡,sound/data/pcm/c21/h/01.unity3d,h_so_21_03_306
306,21,54,次は攻守交替、しちゃう？,sound/data/pcm/c21/h/01.unity3d,h_so_21_03_307
307,21,54,えへへ、アナルからキミの精液が垂れるところ、見たい？,sound/data/pcm/c21/h/01.unity3d,h_so_21_03_308
308,21,54,またこんなお尻に出してぇ♡,sound/data/pcm/c21/h/01.unity3d,h_so_21_03_309
309,21,54,あぁ、キミの精液のにおいが……このにおいだけでイッちゃいそう……,sound/data/pcm/c21/h/01.unity3d,h_so_21_03_310
310,21,54,さっき出したのに精液プリップリ♡,sound/data/pcm/c21/h/01.unity3d,h_so_21_03_311
311,21,54,あ、まだちょっぴり中に残ってそう。吸い出してあげよっか？,sound/data/pcm/c21/h/01.unity3d,h_so_21_03_312
312,21,54,キミの精液あつあつだよぉ♡,sound/data/pcm/c21/h/01.unity3d,h_so_21_03_313
313,21,54,ほら、見て……中にいっぱい出した精液が垂れて来ちゃった,sound/data/pcm/c21/h/01.unity3d,h_so_21_03_314
314,21,54,見える？　アナルがぱくぱくしながら、キミの精液垂らしちゃってる,sound/data/pcm/c21/h/01.unity3d,h_so_21_03_315
